Contenido,IR,Fecha,Dispositivo,Likes,Retweets,Entidad,Hora,Foto
Desglose de corregimientos con más casos en el país para el 18 de marzo de 2021. #UnPanamáMejor #ProtégetePanamá https://t.co/iC4hTt8R26,https://twitter.com/i/web/status/1372715440431104002,18/03/2021 19:03:59,Twitter Web App,19,10,Ministerio de Salud de Panamá,19:03:59,http://pbs.twimg.com/profile_images/1345009760815484928/HZiaFwYR.jpg
#Veraguas | El Ministro @LPacoSucre se reúne con el equipo de salud del COCYTC y autoridades locales con la finalid… https://t.co/wq4uBGagne,https://twitter.com/i/web/status/1372953255198740484,19/03/2021 10:48:58,Twitter Web App,7,5,Ministerio de Salud de Panamá,10:48:58,http://pbs.twimg.com/profile_images/1345009760815484928/HZiaFwYR.jpg
"Recibimos una donación de Equipos de Protección Personal, por parte de @USEmbPAN, los cuales serán distribuidos en… https://t.co/AxDUwn6u77",https://twitter.com/i/web/status/1372956028816531459,19/03/2021 11:00:00,Twitter Web App,12,3,Ministerio de Salud de Panamá,11:00:00,http://pbs.twimg.com/profile_images/1345009760815484928/HZiaFwYR.jpg
"#LosSantos | Los equipo de Respuesta Rápida realizaron jornada de hisopados en la subasta ganadera de Panamá S,A en… https://t.co/mHNCfOVkGt",https://twitter.com/i/web/status/1372983617165615113,19/03/2021 12:49:37,Twitter Web App,3,4,Ministerio de Salud de Panamá,12:49:37,http://pbs.twimg.com/profile_images/1345009760815484928/HZiaFwYR.jpg
"Continuamos aplicando la vacuna contra el #COVID19, desde el Centro de Vacunación Express habilitado en los estacio… https://t.co/og9NQRuXLW",https://twitter.com/i/web/status/1372988593354985481,19/03/2021 13:09:24,Twitter Web App,6,7,Ministerio de Salud de Panamá,13:09:24,http://pbs.twimg.com/profile_images/1345009760815484928/HZiaFwYR.jpg
"El Ministro,@LPacoSucre anunció en el recorrido que realiza en la provincia de Veraguas, que se coordina con las au… https://t.co/pbgRr1hb5k",https://twitter.com/i/web/status/1372992414001020928,19/03/2021 13:24:35,Twitter Web App,11,5,Ministerio de Salud de Panamá,13:24:35,http://pbs.twimg.com/profile_images/1345009760815484928/HZiaFwYR.jpg
RT @Ops_Paraguay: ✈️#AHORA 36.000 dosis de AstraZéneca Bioscience están llegando a Paraguay. El arribo del vuelo está previsto para las 16.…,https://twitter.com/i/web/status/1373028478120030210,19/03/2021 15:47:53,Twitter for iPhone,0,61,OPS/OMS,15:47:53,http://pbs.twimg.com/profile_images/1096094749902028801/ijbQWupW.png
"RT @OPSOMSBolivia: La Organización Panamericana de la Salud/Organización Mundial de la Salud (OPS/OMS), representación en Bolivia, acaba de…",https://twitter.com/i/web/status/1373028505903054854,19/03/2021 15:48:00,Twitter for iPhone,0,10,OPS/OMS,15:48:00,http://pbs.twimg.com/profile_images/1096094749902028801/ijbQWupW.png
RT @opscuba: Fueron entregados a @CubaMined materiales comunicativos para ayudar la prevención de la COVID-19 en el espacio escolar: histor…,https://twitter.com/i/web/status/1373028553143545857,19/03/2021 15:48:11,Twitter for iPhone,0,4,OPS/OMS,15:48:11,http://pbs.twimg.com/profile_images/1096094749902028801/ijbQWupW.png
RT @OPASOMSBrasil: A pandemia de #COVID19 tem provocado atitudes discriminatórios e estigma contra pessoas de algumas origens étnicas e que…,https://twitter.com/i/web/status/1373028619992334338,19/03/2021 15:48:27,Twitter for iPhone,0,6,OPS/OMS,15:48:27,http://pbs.twimg.com/profile_images/1096094749902028801/ijbQWupW.png
"RT @Ops_Paraguay: La vacunación contra el COVID-19 no reducirá ni las enfermedades, ni las muertes por otras causas. Se conoce que  los eve…",https://twitter.com/i/web/status/1373028664120651781,19/03/2021 15:48:37,Twitter for iPhone,0,4,OPS/OMS,15:48:37,http://pbs.twimg.com/profile_images/1096094749902028801/ijbQWupW.png
RT @Ops_Paraguay: La OMS está en contacto regular con la Agencia Europea de Medicamentos y con los reguladores de todo el mundo para obtene…,https://twitter.com/i/web/status/1373028676254769152,19/03/2021 15:48:40,Twitter for iPhone,0,2,OPS/OMS,15:48:40,http://pbs.twimg.com/profile_images/1096094749902028801/ijbQWupW.png
"RT @Ops_Paraguay: En las campañas masivas de vacunación, es de rutina que los países informen posibles eventos adversos después de la inmun…",https://twitter.com/i/web/status/1373028694646738955,19/03/2021 15:48:45,Twitter for iPhone,0,3,OPS/OMS,15:48:45,http://pbs.twimg.com/profile_images/1096094749902028801/ijbQWupW.png
"RT @opsomschile: El edadismo se refiere a cómo pensamos (estereotipos), sentimos (prejuicios) y actuamos (discriminación) hacia otras perso…",https://twitter.com/i/web/status/1373028832236670986,19/03/2021 15:49:17,Twitter for iPhone,0,9,OPS/OMS,15:49:17,http://pbs.twimg.com/profile_images/1096094749902028801/ijbQWupW.png
"RT @OPSOMS_Honduras: Alejandra Reyes, médico en servicio social, asignada al Centro del Migrante Retornado, y quien ha sido beneficiaría de…",https://twitter.com/i/web/status/1373029053914087425,19/03/2021 15:50:10,Twitter for iPhone,0,2,OPS/OMS,15:50:10,http://pbs.twimg.com/profile_images/1096094749902028801/ijbQWupW.png
"Lávate las manitas ✋🏾🤚🏼  con Tiburón Bebé  🦈  y recuerda... ponte tu 😷 y mantén la distancia.

¿Cómo? 👇

➕ INFO sob… https://t.co/bktcHXgvXd",https://twitter.com/i/web/status/1373033036451827713,19/03/2021 16:06:00,Twitter Media Studio,9,4,OPS/OMS,16:06:00,http://pbs.twimg.com/profile_images/1096094749902028801/ijbQWupW.png
Los adultos mayores de 60 años y personas con discapacidad del circuito 8-6 y 8-8 luego de ser contactados por cita… https://t.co/DZHiFnRm0F,https://twitter.com/i/web/status/1373039995833946113,19/03/2021 16:33:39,Twitter Web App,8,6,Ministerio de Salud de Panamá,16:33:39,http://pbs.twimg.com/profile_images/1345009760815484928/HZiaFwYR.jpg
"El Ministro de Salud en compañía del equipo de trabajo recorrió el hospital Luis ""Chicho"" Fábrega, donde verificó j… https://t.co/1BYpxKDUKt",https://twitter.com/i/web/status/1373040603471212544,19/03/2021 16:36:04,Twitter Web App,8,3,Ministerio de Salud de Panamá,16:36:04,http://pbs.twimg.com/profile_images/1345009760815484928/HZiaFwYR.jpg
"El Ministro @LPacoSucre y funcionarios de la @Senniaf visitaron a Edwin, quien fue rescatado de un entorno de maltr… https://t.co/vpDlOzb6ce",https://twitter.com/i/web/status/1373065199096377344,19/03/2021 18:13:48,Twitter for Android,7,0,Ministerio de Salud de Panamá,18:13:48,http://pbs.twimg.com/profile_images/1345009760815484928/HZiaFwYR.jpg
"El #BuenGobierno Comunica en Salud

✅La @asambleapa aprueba traslado de partida.
✅Realizamos junto la Asociación Ch… https://t.co/WdM50u067a",https://twitter.com/i/web/status/1373069321438691330,19/03/2021 18:30:11,Twitter for Android,0,0,Ministerio de Salud de Panamá,18:30:11,http://pbs.twimg.com/profile_images/1345009760815484928/HZiaFwYR.jpg
