Contenido,IR,Fecha,Dispositivo,Likes,Retweets,Entidad,Hora,Foto
"El equipo de salud del Centro de Operaciones para el Control y Trazabilidad Comuniaria del distrito Antón en Coclé,… https://t.co/JAOlqArUsx",https://twitter.com/i/web/status/1292861204780724225,10/08/2020 10:31:46,Twitter for Android,10,7,Ministerio de Salud de Panamá,10:31:46,http://pbs.twimg.com/profile_images/1278201105479012353/8BrlKLHe.jpg
Tu también puedes salvar una vida donando plasma. #GraciasHéroesPMA https://t.co/d3hKIELFEI,https://twitter.com/i/web/status/1292887333205946369,10/08/2020 12:15:35,Twitter for Android,11,12,Ministerio de Salud de Panamá,12:15:35,http://pbs.twimg.com/profile_images/1278201105479012353/8BrlKLHe.jpg
"RT @OPSOMSPeru: #COVID19 y #SaludMental Los niños, niñas y adolescentes  pueden ser vulnerables a sentimientos de ansiedad, estrés y triste…",https://twitter.com/i/web/status/1292898047467360257,10/08/2020 12:58:10,Twitter for iPhone,0,9,OPS/OMS,12:58:10,http://pbs.twimg.com/profile_images/1096094749902028801/ijbQWupW.png
"RT @OPSOMSRD: Mantente san@ en el trabajo:
✅En la medida de lo posible, realiza las reuniones por teléfono o a través del 💻internet. 
✅Mant…",https://twitter.com/i/web/status/1292898083924250626,10/08/2020 12:58:18,Twitter for iPhone,0,11,OPS/OMS,12:58:18,http://pbs.twimg.com/profile_images/1096094749902028801/ijbQWupW.png
"RT @OPSOMS_Honduras: Mantente sano en el trabajo, siga las recomendaciones de prevención contra la #COVID19 https://t.co/ZdnY1SRhLx",https://twitter.com/i/web/status/1292898104287678464,10/08/2020 12:58:23,Twitter for iPhone,0,22,OPS/OMS,12:58:23,http://pbs.twimg.com/profile_images/1096094749902028801/ijbQWupW.png
"RT @OnusidaLatina: Si vives con #VIH, aquí hay algunos pasos que puedes seguir para mantenerte saludable durante la #COVID19.",https://twitter.com/i/web/status/1292898133442211847,10/08/2020 12:58:30,Twitter for iPhone,0,23,OPS/OMS,12:58:30,http://pbs.twimg.com/profile_images/1096094749902028801/ijbQWupW.png
RT @opsargentina: La OPS advierte contra el uso de productos de cloro como tratamientos para #COVID19 👉 https://t.co/7kMVRlCQfO https://t.c…,https://twitter.com/i/web/status/1292898157395943424,10/08/2020 12:58:36,Twitter for iPhone,0,28,OPS/OMS,12:58:36,http://pbs.twimg.com/profile_images/1096094749902028801/ijbQWupW.png
"RT @OPSOMSPeru: #COVID19 Revisa la cartilla digital: ""Orientaciones para Cuidadores de Adultos Mayores en el marco de la Epidemia del Nuevo…",https://twitter.com/i/web/status/1292898187238400001,10/08/2020 12:58:43,Twitter for iPhone,0,11,OPS/OMS,12:58:43,http://pbs.twimg.com/profile_images/1096094749902028801/ijbQWupW.png
"RT @OPSOMSRD: ✅Protégete y protege a los demás de la #COVID19, evitando las 3⃣C: 
👇

¡Conoce y reduce tus riesgos‼️ https://t.co/gdSE9gVHv3",https://twitter.com/i/web/status/1292898222659305478,10/08/2020 12:58:51,Twitter for iPhone,0,20,OPS/OMS,12:58:51,http://pbs.twimg.com/profile_images/1096094749902028801/ijbQWupW.png
"RT @OPSOMSBolivia: Para prevenir la propagación de la COVID-19:
🖐🏾🤚🏼 Lávate las manos con 💦 y 🧼 con frecuencia
👃👄 Al toser o estornudar, cu…",https://twitter.com/i/web/status/1292898247686660096,10/08/2020 12:58:57,Twitter for iPhone,0,23,OPS/OMS,12:58:57,http://pbs.twimg.com/profile_images/1096094749902028801/ijbQWupW.png
El departamento de Control de Vectores en Veraguas se trasladó a la comunidad de Baco en Calobre para realizar oper… https://t.co/PtBZrSY61m,https://twitter.com/i/web/status/1292901889789624320,10/08/2020 13:13:26,Twitter for Android,13,5,Ministerio de Salud de Panamá,13:13:26,http://pbs.twimg.com/profile_images/1278201105479012353/8BrlKLHe.jpg
"Para fortalecer la atención de pacientes con #COVID19, el director de Salud de Veraguas, Dr. Ovidio Herrera B., coo… https://t.co/xN8U07Lq5r",https://twitter.com/i/web/status/1292909360864268289,10/08/2020 13:43:07,Twitter for Android,4,4,Ministerio de Salud de Panamá,13:43:07,http://pbs.twimg.com/profile_images/1278201105479012353/8BrlKLHe.jpg
La @CSSPanama continúa la entrega de insumos médicos para el Hospital Dr. Gustavo Nelson Collado de Chitré. https://t.co/J514kWhFpM,https://twitter.com/i/web/status/1292952107088252929,10/08/2020 16:32:58,Twitter for Android,3,3,Ministerio de Salud de Panamá,16:32:58,http://pbs.twimg.com/profile_images/1278201105479012353/8BrlKLHe.jpg
Comunicado N° 168 #UnPanamáMejor🇵🇦 #ProtégetePanamá https://t.co/GTwv0hgkoj,https://twitter.com/i/web/status/1292955813577994241,10/08/2020 16:47:42,Twitter for Android,32,31,Ministerio de Salud de Panamá,16:47:42,http://pbs.twimg.com/profile_images/1278201105479012353/8BrlKLHe.jpg
"Compartimos la actualización de datos sobre #COVID19 en nuestro país.
Lunes 10 de agosto de 2020. Parte 1.… https://t.co/ViQtrEDGbm",https://twitter.com/i/web/status/1292956661548752896,10/08/2020 16:51:04,Twitter for Android,25,28,Ministerio de Salud de Panamá,16:51:04,http://pbs.twimg.com/profile_images/1278201105479012353/8BrlKLHe.jpg
"Compartimos la actualización de datos sobre #COVID19 en nuestro país.
Lunes 10 de agosto de 2020. Parte 2.… https://t.co/0mbbG7nxfd",https://twitter.com/i/web/status/1292956675914301440,10/08/2020 16:51:08,Twitter for Android,11,15,Ministerio de Salud de Panamá,16:51:08,http://pbs.twimg.com/profile_images/1278201105479012353/8BrlKLHe.jpg
"Distribución de los casos de #COVID19 por provincias y comarcas. Lunes 10 de agosto de 2020.
#ProtégetePanamá… https://t.co/LfpmlHXg4z",https://twitter.com/i/web/status/1292956693542969347,10/08/2020 16:51:12,Twitter for Android,14,15,Ministerio de Salud de Panamá,16:51:12,http://pbs.twimg.com/profile_images/1278201105479012353/8BrlKLHe.jpg
Desglose de corregimientos con más de 10 casos para el 10 de agosto de 2020. #UnPanamáMejor #ProtégetePanamá https://t.co/XPPAIlGJL0,https://twitter.com/i/web/status/1292958053193658368,10/08/2020 16:56:36,Twitter for Android,31,18,Ministerio de Salud de Panamá,16:56:36,http://pbs.twimg.com/profile_images/1278201105479012353/8BrlKLHe.jpg
"Nuestro fondo de respuesta COVID19 apoya los esfuerzos para enviar suministros esenciales, como equipos de protecci… https://t.co/LUYOnxbgKr",https://twitter.com/i/web/status/1292966205494644738,10/08/2020 17:29:00,Twitter Web App,32,15,OPS/OMS,17:29:00,http://pbs.twimg.com/profile_images/1096094749902028801/ijbQWupW.png
".@DirOPSPAHO celebra el trabajo del CLAP que con el esfuerzo de los países 🌎, contribuye a alcanzar las metas de lo… https://t.co/E8wdLA6huO",https://twitter.com/i/web/status/1292974007613100033,10/08/2020 18:00:00,TweetDeck,15,8,OPS/OMS,18:00:00,http://pbs.twimg.com/profile_images/1096094749902028801/ijbQWupW.png
