Contenido,IR,Fecha,Dispositivo,Likes,Retweets,Entidad,Hora,Foto
El embarazo 🤰🏾 puede ser uno de los momentos más importantes y satisfactorios en la vida de una mujer y un período… https://t.co/W6pmQtB6xo,https://twitter.com/i/web/status/1435641551573635082,08/09/2021 10:29:53,Twitter Web App,7,2,OPS/OMS,10:29:53,http://pbs.twimg.com/profile_images/1096094749902028801/ijbQWupW.png
Le debemos a las mujeres de América Latina y el Caribe 🌎 utilizar todas las herramientas a nuestra disposición para… https://t.co/Lq9N6IvoNw,https://twitter.com/i/web/status/1435641553381380097,08/09/2021 10:29:53,Twitter Web App,9,1,OPS/OMS,10:29:53,http://pbs.twimg.com/profile_images/1096094749902028801/ijbQWupW.png
"Nos trasladamos a la provincia de Darién junto a Médicos Sin Fronteras (MSF) para brindar atención médica, de salud… https://t.co/q9toZEEl7d",https://twitter.com/i/web/status/1435698495751663617,08/09/2021 14:16:10,Twitter Web App,8,0,Ministerio de Salud de Panamá,14:16:10,http://pbs.twimg.com/profile_images/1410465327176093700/iboqeGBN.jpg
"""Al menos el 4️⃣0️⃣% de los países de nuestra región 🌎 han informado de interrupciones en la atención materna y neo… https://t.co/miBeDeiv1E",https://twitter.com/i/web/status/1435701979418963973,08/09/2021 14:30:00,Twitter Media Studio,15,10,OPS/OMS,14:30:00,http://pbs.twimg.com/profile_images/1096094749902028801/ijbQWupW.png
"#LosSantos | Con 18 centros de vacunación habilitados, inició este miércoles 8 de septiembre la inoculación con la… https://t.co/eCr9vs9Kxz",https://twitter.com/i/web/status/1435708406376144898,08/09/2021 14:55:32,Twitter Web App,6,0,Ministerio de Salud de Panamá,14:55:32,http://pbs.twimg.com/profile_images/1410465327176093700/iboqeGBN.jpg
Esta es la primera de varias entregas 📦 que se realizarán hasta completar la cantidad de dosis de vacunas 💉 necesar… https://t.co/pxjjHR8GeQ,https://twitter.com/i/web/status/1435714442466107401,08/09/2021 15:19:32,Twitter Web App,15,6,OPS/OMS,15:19:32,http://pbs.twimg.com/profile_images/1096094749902028801/ijbQWupW.png
Más de 270.000 embarazadas 🤰🏿 se han infectado y más de 2.600 han muerto a causa del virus SARS-CoV-2 en las Améric… https://t.co/PL9ZLNPsLb,https://twitter.com/i/web/status/1435721381589753862,08/09/2021 15:47:06,Twitter Web App,28,28,OPS/OMS,15:47:06,http://pbs.twimg.com/profile_images/1096094749902028801/ijbQWupW.png
Comunicado N° 561 #UnPanamáMejor🇵🇦 #ProtégetePanamá https://t.co/XK1SFCePBY,https://twitter.com/i/web/status/1435780641686175749,08/09/2021 19:42:35,Twitter Web App,7,7,Ministerio de Salud de Panamá,19:42:35,http://pbs.twimg.com/profile_images/1410465327176093700/iboqeGBN.jpg
"Compartimos la actualización de datos sobre #COVID19 en nuestro país. 
Miércoles 8 de septiembre de 2021. Parte 1.… https://t.co/8a7N2ZwhuM",https://twitter.com/i/web/status/1435780834418647040,08/09/2021 19:43:21,Twitter Web App,18,6,Ministerio de Salud de Panamá,19:43:21,http://pbs.twimg.com/profile_images/1410465327176093700/iboqeGBN.jpg
"Compartimos la actualización de datos sobre #COVID19 en nuestro país. 
Miércoles 8 de septiembre de 2021. Parte 2.… https://t.co/ZdCbC84AW3",https://twitter.com/i/web/status/1435780841846812678,08/09/2021 19:43:22,Twitter Web App,6,4,Ministerio de Salud de Panamá,19:43:22,http://pbs.twimg.com/profile_images/1410465327176093700/iboqeGBN.jpg
"Distribución de los casos de #COVID19 por provincias y comarcas.
Miércoles 8 de septiembre de 2021.… https://t.co/5Mw3MjHD6q",https://twitter.com/i/web/status/1435780847181959168,08/09/2021 19:43:24,Twitter Web App,6,2,Ministerio de Salud de Panamá,19:43:24,http://pbs.twimg.com/profile_images/1410465327176093700/iboqeGBN.jpg
"Distribución de los casos de #COVID19 por provincias y comarcas.
Miércoles 8 de septiembre de 2021.… https://t.co/QGRRV7yxWt",https://twitter.com/i/web/status/1435781393393594368,08/09/2021 19:45:34,Twitter Web App,11,6,Ministerio de Salud de Panamá,19:45:34,http://pbs.twimg.com/profile_images/1410465327176093700/iboqeGBN.jpg
"🚨 ""Durante las últimas 3️⃣ décadas, América Latina y el Caribe luchó por reducir la mortalidad materna. Ahora, la p… https://t.co/as3xoPJm2S",https://twitter.com/i/web/status/1435943570976952321,09/09/2021 06:30:00,Twitter Media Studio,10,8,OPS/OMS,06:30:00,http://pbs.twimg.com/profile_images/1096094749902028801/ijbQWupW.png
#Chiriquí | El equipo de Salud se mantiene realizando jornadas de promoción y limpieza en el corregimiento de Las L… https://t.co/h8aagaMPuA,https://twitter.com/i/web/status/1435951126113828870,09/09/2021 07:00:01,Twitter Web App,4,0,Ministerio de Salud de Panamá,07:00:01,http://pbs.twimg.com/profile_images/1410465327176093700/iboqeGBN.jpg
"¡Ya viene la #SemanaDelBienestar❗️ 

Únete y compártenos historias de personas 👩🏾👵🏼👦🏽👩🏼👴🏽 e iniciativas solidarias… https://t.co/KfB8miwpmT",https://twitter.com/i/web/status/1435964340750934017,09/09/2021 07:52:32,Twitter Web App,8,3,OPS/OMS,07:52:32,http://pbs.twimg.com/profile_images/1096094749902028801/ijbQWupW.png
"Acompáñanos al foro virtual en conmemoración al Día Mundial para la Prevención del Suicidio.

✅Viernes 9 de septiem… https://t.co/7h29CDducc",https://twitter.com/i/web/status/1435967319398834176,09/09/2021 08:04:22,Twitter for Android,9,4,Ministerio de Salud de Panamá,08:04:22,http://pbs.twimg.com/profile_images/1410465327176093700/iboqeGBN.jpg
"La variante Mu (B.1.621) 🦠 ha sido denominada por la OMS como variante de interés, ya que hay indicios de que podrí… https://t.co/pDjZSjGFly",https://twitter.com/i/web/status/1435989796812464128,09/09/2021 09:33:41,Twitter Web App,31,21,OPS/OMS,09:33:41,http://pbs.twimg.com/profile_images/1096094749902028801/ijbQWupW.png
"Mu no supone una amenaza o riesgo en particular; aunque predomina en Colombia, esta variante ha circulado al menos… https://t.co/MZYauHiJb2",https://twitter.com/i/web/status/1435989799064715267,09/09/2021 09:33:42,Twitter Web App,8,7,OPS/OMS,09:33:42,http://pbs.twimg.com/profile_images/1096094749902028801/ijbQWupW.png
"El lunes 4 de octubre de 10:00 a.m. a 1:00 p.m., participa del seminario virtual en el marco al mes del Bienestar A… https://t.co/G14fABC2gB",https://twitter.com/i/web/status/1435996939607236614,09/09/2021 10:02:04,Twitter for Android,3,1,Ministerio de Salud de Panamá,10:02:04,http://pbs.twimg.com/profile_images/1410465327176093700/iboqeGBN.jpg
"💉➡️🤰🏽 ""Recomendamos que todas las mujeres embarazadas después del primer trimestre, así como las que estén amamanta… https://t.co/aNlNf0bTJ2",https://twitter.com/i/web/status/1436018409779650563,09/09/2021 11:27:23,Twitter Web App,8,7,OPS/OMS,11:27:23,http://pbs.twimg.com/profile_images/1096094749902028801/ijbQWupW.png
