Contenido,IR,Fecha,Dispositivo,Likes,Retweets,Entidad,Hora,Foto
"🌎 Con el aporte de la OPS, la OMS también ha publicado una guía actualizada para que los países puedan implementar… https://t.co/ePZyVuZHOY",https://twitter.com/i/web/status/1326584511950434305,11/11/2020 11:56:09,Twitter Web App,3,3,OPS/OMS,11:56:09,http://pbs.twimg.com/profile_images/1096094749902028801/ijbQWupW.png
🌎 Esta nueva herramienta ofrece una guía práctica para ayudar a países a decidir qué medidas implementar y durante… https://t.co/Yx215Wjmfe,https://twitter.com/i/web/status/1326586244248326144,11/11/2020 12:03:02,Twitter Web App,1,1,OPS/OMS,12:03:02,http://pbs.twimg.com/profile_images/1096094749902028801/ijbQWupW.png
🌎 La clave siempre ha sido garantizar que nuestras respuestas de salud pública se adapten al momento. Solo entonces… https://t.co/LssXBDzwUr,https://twitter.com/i/web/status/1326586584838402053,11/11/2020 12:04:23,Twitter Web App,12,3,OPS/OMS,12:04:23,http://pbs.twimg.com/profile_images/1096094749902028801/ijbQWupW.png
"🌎 Con esta nueva guía y empleando las mejores prácticas que describimos hoy, estamos seguros de que los países pued… https://t.co/6nkEUXTvEh",https://twitter.com/i/web/status/1326587179380977666,11/11/2020 12:06:45,Twitter Web App,10,2,OPS/OMS,12:06:45,http://pbs.twimg.com/profile_images/1096094749902028801/ijbQWupW.png
RT @presidenciapma: https://t.co/UR3dJhOGqM,https://twitter.com/i/web/status/1326665293381373955,11/11/2020 17:17:08,Twitter for Android,0,34,Ministerio de Salud de Panamá,17:17:08,http://pbs.twimg.com/profile_images/1322849848186593280/jzW5ccpC.jpg
"RT @PAHOemergencies: ¿Quieres saber cómo responden los equipos médicos de emergencia 🩺⛺️ a la #COVID19? 

Únete al conversatorio 🗨️ en vivo…",https://twitter.com/i/web/status/1326667334799536128,11/11/2020 17:25:15,Twitter for iPhone,0,9,OPS/OMS,17:25:15,http://pbs.twimg.com/profile_images/1096094749902028801/ijbQWupW.png
Comunicado N° 261 #UnPanamáMejor🇵🇦 #ProtégetePanamá https://t.co/qbgJzCvRKA,https://twitter.com/i/web/status/1326668372839424002,11/11/2020 17:29:23,Twitter for Android,25,17,Ministerio de Salud de Panamá,17:29:23,http://pbs.twimg.com/profile_images/1322849848186593280/jzW5ccpC.jpg
"Compartimos la actualización de datos sobre #COVID19 en nuestro país.
Miércoles 11 de noviembre de 2020. Parte 1.… https://t.co/SuyiBGfn6M",https://twitter.com/i/web/status/1326668728533196802,11/11/2020 17:30:47,Twitter for Android,38,16,Ministerio de Salud de Panamá,17:30:47,http://pbs.twimg.com/profile_images/1322849848186593280/jzW5ccpC.jpg
"Compartimos la actualización de datos sobre #COVID19 en nuestro país.
Miércoles 11 de noviembre de 2020. Parte 2.… https://t.co/2tcc2BCOqu",https://twitter.com/i/web/status/1326668743536242688,11/11/2020 17:30:51,Twitter for Android,15,8,Ministerio de Salud de Panamá,17:30:51,http://pbs.twimg.com/profile_images/1322849848186593280/jzW5ccpC.jpg
"Distribución de los casos de #COVID19 por provincias y comarcas.
Miércoles 11 de noviembre de 2020.… https://t.co/34NZnCEDk9",https://twitter.com/i/web/status/1326668760699314176,11/11/2020 17:30:55,Twitter for Android,13,9,Ministerio de Salud de Panamá,17:30:55,http://pbs.twimg.com/profile_images/1322849848186593280/jzW5ccpC.jpg
Desglose de corregimientos con más de 10 casos para el 11 de noviembre de 2020. #UnPanamáMejor #ProtégetePanamá https://t.co/eUzHvNhwa9,https://twitter.com/i/web/status/1326669973603946497,11/11/2020 17:35:44,Twitter for Android,28,12,Ministerio de Salud de Panamá,17:35:44,http://pbs.twimg.com/profile_images/1322849848186593280/jzW5ccpC.jpg
✅📑 Guía ➡️ de las mejores prácticas para ayudar a los países a decidir qué medidas aplicar para controlar la pandem… https://t.co/KEoW40lUsC,https://twitter.com/i/web/status/1326670471446863877,11/11/2020 17:37:43,"<a href=""https://ads-api.twitter.com"" rel=""nofollow"">Twitter for Advertisers (legacy)",33,24,OPS/OMS,17:37:43,http://pbs.twimg.com/profile_images/1096094749902028801/ijbQWupW.png
"Mañana, jueves, 12 Nov, 10 am EST 

🌎 Participa en el seminario Virtual del #DíaMundialdelaDiabetes y aprende cómo… https://t.co/YTuIZFn1wV",https://twitter.com/i/web/status/1326690023949946880,11/11/2020 18:55:25,Twitter Web App,32,20,OPS/OMS,18:55:25,http://pbs.twimg.com/profile_images/1096094749902028801/ijbQWupW.png
RT @Osmotizando: Los Equipos Médicos de Emergencia ⛺️ y los Sitios Alternativos de Atención Médica🏨🏟️ han tenido un papel clave en la expan…,https://twitter.com/i/web/status/1326691266051125250,11/11/2020 19:00:21,Twitter Web App,0,12,OPS/OMS,19:00:21,http://pbs.twimg.com/profile_images/1096094749902028801/ijbQWupW.png
"✳️ Twitter Live, HOY, Jueves, 12NOV 🕚 11:00 hs (EDT).

Conversación en vivo sobre cómo responden los equipos médico… https://t.co/78PNtkd6fJ",https://twitter.com/i/web/status/1326879924989300736,12/11/2020 07:30:01,TweetDeck,12,12,OPS/OMS,07:30:01,http://pbs.twimg.com/profile_images/1096094749902028801/ijbQWupW.png
Tu burbuja social son las personas que viven contigo. Si vas movilizarte a lugares públicos te recomendamos hacerlo… https://t.co/WvXgUMVybi,https://twitter.com/i/web/status/1326894030693797888,12/11/2020 08:26:04,Twitter for Android,31,26,Ministerio de Salud de Panamá,08:26:04,http://pbs.twimg.com/profile_images/1322849848186593280/jzW5ccpC.jpg
"#NgäbeBuglé | Nuestro equipo de Salud continúa con las atenciones médicas, pruebas de #COVID19, vacunación y verifi… https://t.co/Y6P2biWL4Z",https://twitter.com/i/web/status/1326906877213630470,12/11/2020 09:17:06,Twitter for Android,5,2,Ministerio de Salud de Panamá,09:17:06,http://pbs.twimg.com/profile_images/1322849848186593280/jzW5ccpC.jpg
"EN VIVO: 

Cómo responden los equipos médicos de emergencia al #COVID19 https://t.co/4LBebIpPD5",https://twitter.com/i/web/status/1326918626776125443,12/11/2020 10:03:48,Twitter Media Studio,65,27,OPS/OMS,10:03:48,http://pbs.twimg.com/profile_images/1096094749902028801/ijbQWupW.png
"#Veraguas | Personal de la región realizó una inspección a los acueductos rurales de El Picador en Cañazas, comunid… https://t.co/mUDJzlRDGx",https://twitter.com/i/web/status/1326918886164492289,12/11/2020 10:04:50,Twitter for Android,2,1,Ministerio de Salud de Panamá,10:04:50,http://pbs.twimg.com/profile_images/1322849848186593280/jzW5ccpC.jpg
#Chiriquí | Ya contamos con el Centro de Operaciones de Control y Trazabilidad Comunitaria en el corregimiento de L… https://t.co/RvMW7f1hOB,https://twitter.com/i/web/status/1326935233476911107,12/11/2020 11:09:47,Twitter for Android,3,1,Ministerio de Salud de Panamá,11:09:47,http://pbs.twimg.com/profile_images/1322849848186593280/jzW5ccpC.jpg
