Contenido,IR,Fecha,Dispositivo,Likes,Retweets,Entidad,Hora,Foto
Desglose de corregimientos con más casos en el país para el 25 de julio de 2021. #UnPanamáMejor #ProtégetePanamá https://t.co/LARYaCO6nO,https://twitter.com/i/web/status/1419493915716112384,25/07/2021 21:04:57,Twitter Web App,14,7,Ministerio de Salud de Panamá,21:04:57,http://pbs.twimg.com/profile_images/1410465327176093700/iboqeGBN.jpg
"RT @ACNURamericas: 🥊 El primer latinoamericano en participar en los #JuegosOlimpicos con equipo de refugiados, el venezolano Eldric Sella,…",https://twitter.com/i/web/status/1419638747491090432,26/07/2021 06:40:27,Twitter for iPhone,0,24,OPS/OMS,06:40:27,http://pbs.twimg.com/profile_images/1096094749902028801/ijbQWupW.png
"RT @opscuba: Las niñas y los niños también pueden enfermar y agravar con la #COVID19.

Para protegerles 👉 Garantiza una adecuada higiene en…",https://twitter.com/i/web/status/1419639846369468418,26/07/2021 06:44:49,Twitter for iPhone,0,14,OPS/OMS,06:44:49,http://pbs.twimg.com/profile_images/1096094749902028801/ijbQWupW.png
"RT @OPSOMSRD: 🚭El tabaco daña los pulmones, lo que dificulta la lucha contra el coronavirus. Los fumadores corren un mayor riesgo de desarr…",https://twitter.com/i/web/status/1419639855789785091,26/07/2021 06:44:51,Twitter for iPhone,0,14,OPS/OMS,06:44:51,http://pbs.twimg.com/profile_images/1096094749902028801/ijbQWupW.png
"RT @OPSOMSMexico: #COVID19 🦠 

¿Haces todo 👀 para protegerte ☂️ del calor 🌞?

➡ hazlo todo para mantenerte seguro ⤵️ https://t.co/x8J3Zw8djr",https://twitter.com/i/web/status/1419639867072552964,26/07/2021 06:44:54,Twitter for iPhone,0,16,OPS/OMS,06:44:54,http://pbs.twimg.com/profile_images/1096094749902028801/ijbQWupW.png
"Para detener🛑a la #COVID19 y sus variantes, todos tenemos que colaborar➡️Sigue las medidas de salud que ya conoces:… https://t.co/BzYqNzlOb3",https://twitter.com/i/web/status/1419649268453810179,26/07/2021 07:22:16,Twitter Web App,40,30,OPS/OMS,07:22:16,http://pbs.twimg.com/profile_images/1096094749902028801/ijbQWupW.png
"RT @OPSOMS_Col: Con 'palabras dulces', es decir, con una trabajo de sensibilización con adaptación cultural, avanza la vacunación contra la…",https://twitter.com/i/web/status/1419674115871580162,26/07/2021 09:01:00,Twitter for iPhone,0,4,OPS/OMS,09:01:00,http://pbs.twimg.com/profile_images/1096094749902028801/ijbQWupW.png
"RT @campusvirtualsp: 📌 CURSO: Medición automática precisa de la presión arterial ❤️ 

✅ Aprenderás sobre la toma correcta, el paso a paso,…",https://twitter.com/i/web/status/1419674320390037504,26/07/2021 09:01:48,Twitter for iPhone,0,14,OPS/OMS,09:01:48,http://pbs.twimg.com/profile_images/1096094749902028801/ijbQWupW.png
"RT @campusvirtualsp: COVID-19 👉🏾 Curso sobre Manejo Clínico de las Infecciones Respiratorias Agudas Graves (IRAG)

✅ Destinado a profesiona…",https://twitter.com/i/web/status/1419674335304986631,26/07/2021 09:01:52,Twitter for iPhone,0,11,OPS/OMS,09:01:52,http://pbs.twimg.com/profile_images/1096094749902028801/ijbQWupW.png
RT @campusvirtualsp: 👀❗️¿Estás interesad@ en mejorar la calidad de la investigación para la salud o en facilitar el uso de informes de inve…,https://twitter.com/i/web/status/1419674375004073987,26/07/2021 09:02:01,Twitter for iPhone,0,10,OPS/OMS,09:02:01,http://pbs.twimg.com/profile_images/1096094749902028801/ijbQWupW.png
"#LosSantos | Habilitamos un puesto de hisopado para los que asistan voluntariamente, en la sede de la Cruz Roja Pan… https://t.co/bw9Kbadbrw",https://twitter.com/i/web/status/1419690165166125059,26/07/2021 10:04:46,Twitter Web App,7,2,Ministerio de Salud de Panamá,10:04:46,http://pbs.twimg.com/profile_images/1410465327176093700/iboqeGBN.jpg
"La instalación viene a complementar el ya existente punto de hisopados en la ciudad de Las Tablas, a un costado del… https://t.co/1XSMkP0zSK",https://twitter.com/i/web/status/1419690167787479045,26/07/2021 10:04:47,Twitter Web App,4,0,Ministerio de Salud de Panamá,10:04:47,http://pbs.twimg.com/profile_images/1410465327176093700/iboqeGBN.jpg
"✨Nueva fecha límite✨

Queremos financiar proyectos que implementen medidas preventivas en poblaciones en situación… https://t.co/Arpa0ysqfG",https://twitter.com/i/web/status/1419696516172685319,26/07/2021 10:30:00,Twitter Web App,9,6,OPS/OMS,10:30:00,http://pbs.twimg.com/profile_images/1096094749902028801/ijbQWupW.png
#BocasDelToro | Los Equipos de Respuesta Rápida junto a los Unificados de Trazabilidad se mantienen brindando atenc… https://t.co/oibvLBp7Ta,https://twitter.com/i/web/status/1419718309159780362,26/07/2021 11:56:36,Twitter for Android,1,1,Ministerio de Salud de Panamá,11:56:36,http://pbs.twimg.com/profile_images/1410465327176093700/iboqeGBN.jpg
#Veraguas | Realizamos en conjunto a la Alcaldía de Santiago una intervención en la terminal de transporte donde en… https://t.co/LCKpZFeTHz,https://twitter.com/i/web/status/1419725454613811203,26/07/2021 12:25:00,Twitter Web App,9,3,Ministerio de Salud de Panamá,12:25:00,http://pbs.twimg.com/profile_images/1410465327176093700/iboqeGBN.jpg
#PanamáMetro | Realizamos un operativo de verificación y cumplimiento de la ley de tabaco a establecimientos comerc… https://t.co/wkDNUIrbLL,https://twitter.com/i/web/status/1419736527442087948,26/07/2021 13:09:00,Twitter Web App,2,1,Ministerio de Salud de Panamá,13:09:00,http://pbs.twimg.com/profile_images/1410465327176093700/iboqeGBN.jpg
#BocasDelToro | Este lunes continúan las acciones del personal de Salud en los 9 albergues habilitados temporalment… https://t.co/9AxDWrz3bK,https://twitter.com/i/web/status/1419746903919677440,26/07/2021 13:50:14,Twitter Web App,6,4,Ministerio de Salud de Panamá,13:50:14,http://pbs.twimg.com/profile_images/1410465327176093700/iboqeGBN.jpg
"#Veraguas | Los Equipos Unificados de Trazabilidad se mantienen monitoreando a pacientes positivos por #COVID19, co… https://t.co/sOd6xQhYNd",https://twitter.com/i/web/status/1419751123775225856,26/07/2021 14:07:00,Twitter Web App,4,4,Ministerio de Salud de Panamá,14:07:00,http://pbs.twimg.com/profile_images/1410465327176093700/iboqeGBN.jpg
"#Veraguas | Efectuamos una jornada de docencia en Santiago Mall, para exhortar a la población a seguir manteniendo… https://t.co/mNypEQuwPw",https://twitter.com/i/web/status/1419767229801979905,26/07/2021 15:11:00,Twitter Web App,0,1,Ministerio de Salud de Panamá,15:11:00,http://pbs.twimg.com/profile_images/1410465327176093700/iboqeGBN.jpg
"#Veraguas | Un nuevo lote de 42,498 dosis de Pfizer contra el #COVID19 llegó esta mañana a la región, las cuales se… https://t.co/P9iUcALkkk",https://twitter.com/i/web/status/1419767725036118017,26/07/2021 15:12:58,Twitter Web App,8,2,Ministerio de Salud de Panamá,15:12:58,http://pbs.twimg.com/profile_images/1410465327176093700/iboqeGBN.jpg
