Contenido,IR,Fecha,Dispositivo,Likes,Retweets,Entidad,Hora,Foto
Desglose de corregimientos con más de 10 casos para el 17 de agosto de 2020. #UnPanamáMejor #ProtégetePanamá https://t.co/clIABuEI9M,https://twitter.com/i/web/status/1295494628196614149,17/08/2020 16:56:03,Twitter for Android,12,19,Ministerio de Salud de Panamá,16:56:03,http://pbs.twimg.com/profile_images/1278201105479012353/8BrlKLHe.jpg
"Tú eres parte fundamental de nuestra lucha contra el #COVID19. Comparte información preventiva con tus familiares,… https://t.co/gdnPfztPtP",https://twitter.com/i/web/status/1295728321318326272,18/08/2020 08:24:39,Twitter for Android,4,4,Ministerio de Salud de Panamá,08:24:39,http://pbs.twimg.com/profile_images/1278201105479012353/8BrlKLHe.jpg
"El Director Regional de Veraguas Dr. Ovidio Mendoza, entregó insumos médicos para el personal del Hospital Dr. Luis… https://t.co/q1ERtSsH9R",https://twitter.com/i/web/status/1295735242435829768,18/08/2020 08:52:10,Twitter for Android,4,4,Ministerio de Salud de Panamá,08:52:10,http://pbs.twimg.com/profile_images/1278201105479012353/8BrlKLHe.jpg
La @CSSPanama entrega insumos médicos a la policlínica Dr. Carlos N. Brin. https://t.co/9zU5oGWBAZ,https://twitter.com/i/web/status/1295740216494489602,18/08/2020 09:11:55,Twitter for Android,4,2,Ministerio de Salud de Panamá,09:11:55,http://pbs.twimg.com/profile_images/1278201105479012353/8BrlKLHe.jpg
El Hospital Regional de Chepo recibe insumos médicos por parte de la @CSSPanama. https://t.co/sqgmtae1LI,https://twitter.com/i/web/status/1295740330642493442,18/08/2020 09:12:23,Twitter for Android,8,4,Ministerio de Salud de Panamá,09:12:23,http://pbs.twimg.com/profile_images/1278201105479012353/8BrlKLHe.jpg
La @CSSPanama abastece de insumos de protección para el personal médico del Complejo Hospitalario Dr. Arnulfo Arias… https://t.co/DznEGp60Rt,https://twitter.com/i/web/status/1295740438800998400,18/08/2020 09:12:48,Twitter for Android,5,5,Ministerio de Salud de Panamá,09:12:48,http://pbs.twimg.com/profile_images/1278201105479012353/8BrlKLHe.jpg
"🌎 Es probable que el alcance real de la violencia doméstica durante el COVID-19 esté subestimado, ya que los sobrev… https://t.co/W1eQsOixmg",https://twitter.com/i/web/status/1295744391596974082,18/08/2020 09:28:31,Twitter Web App,5,8,OPS/OMS,09:28:31,http://pbs.twimg.com/profile_images/1096094749902028801/ijbQWupW.png
"🌎 Los costos de la violencia son extraordinariamente altos, por lo que el apoyo a los sobrevivientes no puede suspe… https://t.co/HH3LW8zoP2",https://twitter.com/i/web/status/1295744720665227266,18/08/2020 09:29:49,Twitter Web App,1,1,OPS/OMS,09:29:49,http://pbs.twimg.com/profile_images/1096094749902028801/ijbQWupW.png
"🌎 Los servicios de salud mental y violencia doméstica son servicios esenciales, y debemos poner énfasis en abordar… https://t.co/26iEIHB5O8",https://twitter.com/i/web/status/1295744988396105731,18/08/2020 09:30:53,Twitter Web App,18,16,OPS/OMS,09:30:53,http://pbs.twimg.com/profile_images/1096094749902028801/ijbQWupW.png
"🌎 Hoy, pido a los países que tomen las medidas necesarias para garantizar que todos puedan recibir la atención que… https://t.co/ASfBKLueRO",https://twitter.com/i/web/status/1295745339111219201,18/08/2020 09:32:17,Twitter Web App,8,3,OPS/OMS,09:32:17,http://pbs.twimg.com/profile_images/1096094749902028801/ijbQWupW.png
"✅ Primero, los países deben expandir e invertir en servicios de salud mental
✅ Un segundo paso crítico es actuar de… https://t.co/IvSRZQV6zg",https://twitter.com/i/web/status/1295745761494409217,18/08/2020 09:33:57,Twitter Web App,3,1,OPS/OMS,09:33:57,http://pbs.twimg.com/profile_images/1096094749902028801/ijbQWupW.png
La OPS ha estado ayudando a los países a fortalecer las políticas y los servicios y ampliar el aprendizaje en línea… https://t.co/LLoVR0aSUW,https://twitter.com/i/web/status/1295745951588655104,18/08/2020 09:34:43,Twitter Web App,1,3,OPS/OMS,09:34:43,http://pbs.twimg.com/profile_images/1096094749902028801/ijbQWupW.png
🌎 Es alentador ver que algunos lugares utilizan enfoques novedosos para garantizar que los sobrevivientes de la vio… https://t.co/6xs4KXiPK2,https://twitter.com/i/web/status/1295746152885817358,18/08/2020 09:35:31,Twitter Web App,2,2,OPS/OMS,09:35:31,http://pbs.twimg.com/profile_images/1096094749902028801/ijbQWupW.png
"🌎 Los servicios de #saludmental son fundamentales para nuestra respuesta al COVID-19 y, en última instancia, para n… https://t.co/1KuTKpbvfh",https://twitter.com/i/web/status/1295747010524581890,18/08/2020 09:38:55,Twitter Web App,16,14,OPS/OMS,09:38:55,http://pbs.twimg.com/profile_images/1096094749902028801/ijbQWupW.png
🌎 Debemos dar un paso adelante para que las personas que viven con problemas de salud mental y las sobrevivientes d… https://t.co/x1CH00amTU,https://twitter.com/i/web/status/1295747252087074817,18/08/2020 09:39:53,Twitter Web App,6,5,OPS/OMS,09:39:53,http://pbs.twimg.com/profile_images/1096094749902028801/ijbQWupW.png
"🌎 Esta pandemia nos recuerda, como nunca antes, que una buena salud mental es necesaria para el bienestar de las pe… https://t.co/eKL2QbRqmU",https://twitter.com/i/web/status/1295747412015878144,18/08/2020 09:40:31,Twitter Web App,7,7,OPS/OMS,09:40:31,http://pbs.twimg.com/profile_images/1096094749902028801/ijbQWupW.png
"Con el apoyo de @ProtegerYServir, personal de Salud de Bocas del Toro, inspeccionó locales comerciales para verific… https://t.co/B5wrWV0yxb",https://twitter.com/i/web/status/1295748640473075714,18/08/2020 09:45:24,Twitter for Android,5,5,Ministerio de Salud de Panamá,09:45:24,http://pbs.twimg.com/profile_images/1278201105479012353/8BrlKLHe.jpg
"El Club Rotario de David realizó una donación al equipo de trazabilidad de la provincia de Chiriquí:
✅ 4 cabinas de… https://t.co/xogIML57DH",https://twitter.com/i/web/status/1295761388862877697,18/08/2020 10:36:03,Twitter for Android,5,5,Ministerio de Salud de Panamá,10:36:03,http://pbs.twimg.com/profile_images/1278201105479012353/8BrlKLHe.jpg
"Además, el Club Rotario de David entregó insumos al Hospital Regional Rafael Hernández, Hospital Materno Infantil J… https://t.co/Q1cH8VGpbR",https://twitter.com/i/web/status/1295761402750279683,18/08/2020 10:36:07,Twitter for Android,2,2,Ministerio de Salud de Panamá,10:36:07,http://pbs.twimg.com/profile_images/1278201105479012353/8BrlKLHe.jpg
Orientamos a los negocios de venta al por menor y a trabajadores de almacenes del distrito de Las Tablas sobre las… https://t.co/BanJqbopFC,https://twitter.com/i/web/status/1295769877819658240,18/08/2020 11:09:47,Twitter for Android,6,3,Ministerio de Salud de Panamá,11:09:47,http://pbs.twimg.com/profile_images/1278201105479012353/8BrlKLHe.jpg
