Contenido,IR,Fecha,Dispositivo,Likes,Retweets,Entidad,Hora,Foto
🌎 El #cambioclimático es una amenaza real y a largo plazo que debe abordarse mediante soluciones duraderas -… https://t.co/nF42vJ2rqD,https://twitter.com/i/web/status/1453389395168464914,27/10/2021 09:53:29,Twitter Web App,6,2,OPS/OMS,09:53:29,http://pbs.twimg.com/profile_images/1096094749902028801/ijbQWupW.png
🌎 Los fenómenos meteorológicos extremos que provocan emergencias sanitarias son solo uno de los riesgos a los que n… https://t.co/vqOjU1GNZm,https://twitter.com/i/web/status/1453389595715022854,27/10/2021 09:54:16,Twitter Web App,1,0,OPS/OMS,09:54:16,http://pbs.twimg.com/profile_images/1096094749902028801/ijbQWupW.png
"Los científicos nos han advertido durante mucho ⏲️que si no se aborda, el cambio climático transformaría nuestro me… https://t.co/JfbDMFE60m",https://twitter.com/i/web/status/1453390178891059202,27/10/2021 09:56:35,Twitter Web App,3,2,OPS/OMS,09:56:35,http://pbs.twimg.com/profile_images/1096094749902028801/ijbQWupW.png
🌎 La pandemia de COVID-19 ha ofrecido una instantánea de lo poco preparados que estamos para un evento tan perturba… https://t.co/s8tm01SRhh,https://twitter.com/i/web/status/1453390487147139074,27/10/2021 09:57:49,Twitter Web App,3,2,OPS/OMS,09:57:49,http://pbs.twimg.com/profile_images/1096094749902028801/ijbQWupW.png
"🌎 Pero hoy, tenemos la oportunidad de aprovechar las lecciones de la pandemia de COVID-19 para prevenir crisis futu… https://t.co/1u0VecnZqz",https://twitter.com/i/web/status/1453390688171737089,27/10/2021 09:58:37,Twitter Web App,2,2,OPS/OMS,09:58:37,http://pbs.twimg.com/profile_images/1096094749902028801/ijbQWupW.png
"RT @PNUDLAC: 📢¡HOY!

Únete a las ministras de @govgd, @presidenciapy, @MIDESPma y otros distinguidos invitados en este evento para conversa…",https://twitter.com/i/web/status/1453405588210212866,27/10/2021 10:57:49,Twitter for iPhone,0,14,OPS/OMS,10:57:49,http://pbs.twimg.com/profile_images/1096094749902028801/ijbQWupW.png
"RT @PNUDLAC: Ya no podemos ignorar el #CambioClimático. 

Terminemos con las  excusas o seremos otra especie en peligro de extinción.

Únet…",https://twitter.com/i/web/status/1453422852812718081,27/10/2021 12:06:26,Twitter for iPhone,0,101,OPS/OMS,12:06:26,http://pbs.twimg.com/profile_images/1096094749902028801/ijbQWupW.png
"RT @unep_espanol: El mundo está perdiendo la oportunidad de destinar el gasto fiscal de la COVID-19 a una recuperación #sostenible.

Solo c…",https://twitter.com/i/web/status/1453423025911734273,27/10/2021 12:07:07,Twitter for iPhone,0,13,OPS/OMS,12:07:07,http://pbs.twimg.com/profile_images/1096094749902028801/ijbQWupW.png
"Muchos de los sistemas de salud de la región han sufrido el impacto de #COVID19

Ahora los países 🌎 deben tomar med… https://t.co/JZn56uYtZO",https://twitter.com/i/web/status/1453442931520647177,27/10/2021 13:26:13,Twitter Web App,15,9,OPS/OMS,13:26:13,http://pbs.twimg.com/profile_images/1096094749902028801/ijbQWupW.png
"📢 ""Es fundamental que los países sigan implementando medidas de salud pública como el uso de mascarillas, el distan… https://t.co/1qVfhUH7ZT",https://twitter.com/i/web/status/1453451433488130049,27/10/2021 14:00:00,Twitter Media Studio,24,18,OPS/OMS,14:00:00,http://pbs.twimg.com/profile_images/1096094749902028801/ijbQWupW.png
"Informamos a la población que del 2 al 7 de noviembre, se suspenderá temporalmente el proceso de vacunación contra… https://t.co/W2mi6xrKEg",https://twitter.com/i/web/status/1453461697713393664,27/10/2021 14:40:47,Twitter Web App,14,15,Ministerio de Salud de Panamá,14:40:47,http://pbs.twimg.com/profile_images/1443802878737625116/IWF964ln.jpg
"#PanamáMetro | Varios paquetes con diversos productos cárnicos de dudosa procedencia, productos vencidos y sin el p… https://t.co/gmvuyfZBCL",https://twitter.com/i/web/status/1453464238698246147,27/10/2021 14:50:53,Twitter for Android,2,0,Ministerio de Salud de Panamá,14:50:53,http://pbs.twimg.com/profile_images/1443802878737625116/IWF964ln.jpg
"#BocasDelToro | Los Equipos de Respuesta Rápida, se trasladaron a la comunidad de Charco la Pava distrito de Almira… https://t.co/AhCxjurIXv",https://twitter.com/i/web/status/1453481637770113033,27/10/2021 16:00:01,Twitter Web App,2,1,Ministerio de Salud de Panamá,16:00:01,http://pbs.twimg.com/profile_images/1443802878737625116/IWF964ln.jpg
Panamá reporta nuevamente otro día sin fallecimientos a consecuencia del #COVID19. Nuestro país sigue avanzando pos… https://t.co/PNbJFEhGiK,https://twitter.com/i/web/status/1453496457072418823,27/10/2021 16:58:54,Twitter Web App,80,12,Ministerio de Salud de Panamá,16:58:54,http://pbs.twimg.com/profile_images/1443802878737625116/IWF964ln.jpg
"El Ministro @LPacoSucre hizo un llamado a la población, a no bajar la guardia, cumplir con las medidas de bioseguri… https://t.co/65TDQfcQfd",https://twitter.com/i/web/status/1453496458288803844,27/10/2021 16:58:54,Twitter Web App,12,3,Ministerio de Salud de Panamá,16:58:54,http://pbs.twimg.com/profile_images/1443802878737625116/IWF964ln.jpg
Comunicado N° 610 #UnPanamáMejor🇵🇦 #ProtégetePanamá https://t.co/uarf62AQ2Y,https://twitter.com/i/web/status/1453500506819731459,27/10/2021 17:15:00,Twitter Web App,5,1,Ministerio de Salud de Panamá,17:15:00,http://pbs.twimg.com/profile_images/1443802878737625116/IWF964ln.jpg
"Compartimos la actualización de datos sobre #COVID19 en nuestro país. 
Miércoles 27 de octubre de 2021. Parte 1.… https://t.co/sBNBMdDJhf",https://twitter.com/i/web/status/1453500582531055616,27/10/2021 17:15:18,Twitter Web App,3,3,Ministerio de Salud de Panamá,17:15:18,http://pbs.twimg.com/profile_images/1443802878737625116/IWF964ln.jpg
"Compartimos la actualización de datos sobre #COVID19 en nuestro país. 
Miércoles 27 de octubre de 2021. Parte 2.… https://t.co/XiFusvoPjW",https://twitter.com/i/web/status/1453500589149761542,27/10/2021 17:15:19,Twitter Web App,2,3,Ministerio de Salud de Panamá,17:15:19,http://pbs.twimg.com/profile_images/1443802878737625116/IWF964ln.jpg
"Distribución de los casos de #COVID19 por provincias y comarcas.
Miércoles 27 de octubre de 2021.
#ProtégetePanamá… https://t.co/JyJCas98D4",https://twitter.com/i/web/status/1453500595634163712,27/10/2021 17:15:21,Twitter Web App,1,3,Ministerio de Salud de Panamá,17:15:21,http://pbs.twimg.com/profile_images/1443802878737625116/IWF964ln.jpg
Desglose de corregimientos con más casos en el país para el 27 de octubre de 2021. #UnPanamáMejor #ProtégetePanamá https://t.co/ZfqgdChfcs,https://twitter.com/i/web/status/1453500631184969731,27/10/2021 17:15:29,Twitter Web App,7,0,Ministerio de Salud de Panamá,17:15:29,http://pbs.twimg.com/profile_images/1443802878737625116/IWF964ln.jpg
