Contenido,IR,Fecha,Dispositivo,Likes,Retweets,Entidad,Hora,Foto
Comunicado N° 175 #UnPanamáMejor🇵🇦 #ProtégetePanamá https://t.co/3aalm2O11G,https://twitter.com/i/web/status/1295493380898787329,17/08/2020 16:51:05,Twitter for Android,25,40,Ministerio de Salud de Panamá,16:51:05,http://pbs.twimg.com/profile_images/1278201105479012353/8BrlKLHe.jpg
"Compartimos la actualización de datos sobre #COVID19 en nuestro país.
Lunes 17 de agosto de 2020. Parte 1.… https://t.co/ZJsxn03niS",https://twitter.com/i/web/status/1295494432989630465,17/08/2020 16:55:16,Twitter for Android,25,35,Ministerio de Salud de Panamá,16:55:16,http://pbs.twimg.com/profile_images/1278201105479012353/8BrlKLHe.jpg
"Compartimos la actualización de datos sobre #COVID19 en nuestro país.
Lunes 17 de agosto de 2020. Parte 2.… https://t.co/u38mMbvFUj",https://twitter.com/i/web/status/1295494448122560514,17/08/2020 16:55:20,Twitter for Android,9,15,Ministerio de Salud de Panamá,16:55:20,http://pbs.twimg.com/profile_images/1278201105479012353/8BrlKLHe.jpg
"Distribución de los casos de #COVID19 por provincias y comarcas. Lunes 17 de agosto de 2020.
#ProtégetePanamá… https://t.co/VQv4gydOU4",https://twitter.com/i/web/status/1295494463540912135,17/08/2020 16:55:23,Twitter for Android,10,16,Ministerio de Salud de Panamá,16:55:23,http://pbs.twimg.com/profile_images/1278201105479012353/8BrlKLHe.jpg
Desglose de corregimientos con más de 10 casos para el 17 de agosto de 2020. #UnPanamáMejor #ProtégetePanamá https://t.co/clIABuEI9M,https://twitter.com/i/web/status/1295494628196614149,17/08/2020 16:56:03,Twitter for Android,12,19,Ministerio de Salud de Panamá,16:56:03,http://pbs.twimg.com/profile_images/1278201105479012353/8BrlKLHe.jpg
"Tú eres parte fundamental de nuestra lucha contra el #COVID19. Comparte información preventiva con tus familiares,… https://t.co/gdnPfztPtP",https://twitter.com/i/web/status/1295728321318326272,18/08/2020 08:24:39,Twitter for Android,3,3,Ministerio de Salud de Panamá,08:24:39,http://pbs.twimg.com/profile_images/1278201105479012353/8BrlKLHe.jpg
"El Director Regional de Veraguas Dr. Ovidio Mendoza, entregó insumos médicos para el personal del Hospital Dr. Luis… https://t.co/q1ERtSsH9R",https://twitter.com/i/web/status/1295735242435829768,18/08/2020 08:52:10,Twitter for Android,3,4,Ministerio de Salud de Panamá,08:52:10,http://pbs.twimg.com/profile_images/1278201105479012353/8BrlKLHe.jpg
La @CSSPanama entrega insumos médicos a la policlínica Dr. Carlos N. Brin. https://t.co/9zU5oGWBAZ,https://twitter.com/i/web/status/1295740216494489602,18/08/2020 09:11:55,Twitter for Android,3,2,Ministerio de Salud de Panamá,09:11:55,http://pbs.twimg.com/profile_images/1278201105479012353/8BrlKLHe.jpg
El Hospital Regional de Chepo recibe insumos médicos por parte de la @CSSPanama. https://t.co/sqgmtae1LI,https://twitter.com/i/web/status/1295740330642493442,18/08/2020 09:12:23,Twitter for Android,3,2,Ministerio de Salud de Panamá,09:12:23,http://pbs.twimg.com/profile_images/1278201105479012353/8BrlKLHe.jpg
La @CSSPanama abastece de insumos de protección para el personal médico del Complejo Hospitalario Dr. Arnulfo Arias… https://t.co/DznEGp60Rt,https://twitter.com/i/web/status/1295740438800998400,18/08/2020 09:12:48,Twitter for Android,3,3,Ministerio de Salud de Panamá,09:12:48,http://pbs.twimg.com/profile_images/1278201105479012353/8BrlKLHe.jpg
"🌎 .....Y los primeros datos muestran que muchos lo están haciendo frente al consumo de drogas y alcohol, lo que pue… https://t.co/ALykFkxXhn",https://twitter.com/i/web/status/1295741683624300546,18/08/2020 09:17:45,Twitter Web App,5,6,OPS/OMS,09:17:45,http://pbs.twimg.com/profile_images/1096094749902028801/ijbQWupW.png
"A pesar de las ⬆️ necesidades durante estos tiempos difíciles, el apoyo de salud mental puede estar cada vez más fu… https://t.co/KYKsJl8ZJz",https://twitter.com/i/web/status/1295742012554084353,18/08/2020 09:19:04,Twitter Web App,7,5,OPS/OMS,09:19:04,http://pbs.twimg.com/profile_images/1096094749902028801/ijbQWupW.png
Los👩🏾‍⚕️👩‍⚕️👨🏿‍⚕️👨‍⚕️trabajadores de la salud trabajan + horas que nunca. Muchos de ellos pueden estar arriesgando… https://t.co/mcEDp7cn8A,https://twitter.com/i/web/status/1295743131061714945,18/08/2020 09:23:30,Twitter Web App,3,3,OPS/OMS,09:23:30,http://pbs.twimg.com/profile_images/1096094749902028801/ijbQWupW.png
"🌎 En toda nuestra región, casi un tercio de las mujeres han experimentado violencia de pareja íntima en sus vidas;… https://t.co/CaS90T24RA",https://twitter.com/i/web/status/1295743463879835648,18/08/2020 09:24:50,Twitter Web App,2,2,OPS/OMS,09:24:50,http://pbs.twimg.com/profile_images/1096094749902028801/ijbQWupW.png
"🌎 Los grupos marginados como las poblaciones indígenas y afrodescendientes, las mujeres y los niños migrantes y ref… https://t.co/sp4rfJFRiz",https://twitter.com/i/web/status/1295743681308368901,18/08/2020 09:25:42,Twitter Web App,0,1,OPS/OMS,09:25:42,http://pbs.twimg.com/profile_images/1096094749902028801/ijbQWupW.png
"🌎 Las medidas en curso para quedarse en casa, junto con los impactos sociales y económicos de este virus, están aum… https://t.co/wPHhI644GF",https://twitter.com/i/web/status/1295743826166976512,18/08/2020 09:26:16,Twitter Web App,1,2,OPS/OMS,09:26:16,http://pbs.twimg.com/profile_images/1096094749902028801/ijbQWupW.png
"Por ejemplo, en Argentina, las llamadas a una línea de ayuda para casos de violencia contra las mujeres aumentaron… https://t.co/XSbNbiewIH",https://twitter.com/i/web/status/1295744112864436224,18/08/2020 09:27:24,Twitter Web App,0,0,OPS/OMS,09:27:24,http://pbs.twimg.com/profile_images/1096094749902028801/ijbQWupW.png
"En México, las llamadas de emergencia por incidentes de violencia contra las mujeres aumentaron en más del 50% en e… https://t.co/X7PSzejsfP",https://twitter.com/i/web/status/1295744256313831425,18/08/2020 09:27:59,Twitter Web App,1,0,OPS/OMS,09:27:59,http://pbs.twimg.com/profile_images/1096094749902028801/ijbQWupW.png
"🌎 Es probable que el alcance real de la violencia doméstica durante el COVID-19 esté subestimado, ya que los sobrev… https://t.co/W1eQsOixmg",https://twitter.com/i/web/status/1295744391596974082,18/08/2020 09:28:31,Twitter Web App,0,1,OPS/OMS,09:28:31,http://pbs.twimg.com/profile_images/1096094749902028801/ijbQWupW.png
"🌎 Los costos de la violencia son extraordinariamente altos, por lo que el apoyo a los sobrevivientes no puede suspe… https://t.co/HH3LW8zoP2",https://twitter.com/i/web/status/1295744720665227266,18/08/2020 09:29:49,Twitter Web App,0,0,OPS/OMS,09:29:49,http://pbs.twimg.com/profile_images/1096094749902028801/ijbQWupW.png
