Contenido,IR,Fecha,Dispositivo,Likes,Retweets,Entidad,Hora,Foto
Informamos a la ciudadanía que la actualización del informe epidemiológico de hoy 13 de julio se hará esta tarde en… https://t.co/EhVHje1tX7,https://twitter.com/i/web/status/1282798047177723908,13/07/2020 16:04:22,Twitter for Android,212,116,Ministerio de Salud de Panamá,16:04:22,http://pbs.twimg.com/profile_images/1278201105479012353/8BrlKLHe.jpg
Por motivos de cambios en la agenda ministerial el informe epidemiológico para hoy 13 de julio se hará a través de… https://t.co/pLrMAMdoi2,https://twitter.com/i/web/status/1282823030197096449,13/07/2020 17:43:38,Twitter for Android,229,93,Ministerio de Salud de Panamá,17:43:38,http://pbs.twimg.com/profile_images/1278201105479012353/8BrlKLHe.jpg
Comunicado N° 140 #UnPanamáMejor🇵🇦 #ProtégetePanamá https://t.co/c75clg7b7E,https://twitter.com/i/web/status/1282825561170206723,13/07/2020 17:53:42,Twitter for Android,124,100,Ministerio de Salud de Panamá,17:53:42,http://pbs.twimg.com/profile_images/1278201105479012353/8BrlKLHe.jpg
"Compartimos la actualización de datos sobre el #COVID19 en nuestro país.
Lunes 13 de julio de 2020. Parte 1.… https://t.co/7sHWIlbD7K",https://twitter.com/i/web/status/1282827249440432129,13/07/2020 18:00:24,Twitter for Android,56,73,Ministerio de Salud de Panamá,18:00:24,http://pbs.twimg.com/profile_images/1278201105479012353/8BrlKLHe.jpg
"Compartimos la actualización de datos sobre el #COVID19 en nuestro país.
Lunes 13 de julio de 2020. Parte 2.… https://t.co/Db7MsN5RnR",https://twitter.com/i/web/status/1282827269384425472,13/07/2020 18:00:29,Twitter for Android,21,31,Ministerio de Salud de Panamá,18:00:29,http://pbs.twimg.com/profile_images/1278201105479012353/8BrlKLHe.jpg
"Distribución de los casos de #COVID19 por provincias y comarcas. Lunes 13 de julio de 2020.
#ProtégetePanamá… https://t.co/Eho3reiZNV",https://twitter.com/i/web/status/1282827285784145926,13/07/2020 18:00:33,Twitter for Android,25,30,Ministerio de Salud de Panamá,18:00:33,http://pbs.twimg.com/profile_images/1278201105479012353/8BrlKLHe.jpg
Desglose de corregimientos con más de 10 casos para el 13 de julio de 2020. #UnPanamáMejor #ProtégetePanamá https://t.co/Qjz4jOTzTc,https://twitter.com/i/web/status/1282828198582063104,13/07/2020 18:04:10,Twitter for Android,49,42,Ministerio de Salud de Panamá,18:04:10,http://pbs.twimg.com/profile_images/1278201105479012353/8BrlKLHe.jpg
"En estos momentos parte del Gabinete Ministerial y el Consejo Consultivo de Salud, se mantienen trabajando en las r… https://t.co/dSfzk2mzpP",https://twitter.com/i/web/status/1282845349313421312,13/07/2020 19:12:20,Twitter for Android,189,78,Ministerio de Salud de Panamá,19:12:20,http://pbs.twimg.com/profile_images/1278201105479012353/8BrlKLHe.jpg
Continúan trabajando en estos momentos parte del Gabinete Ministerial y el Consejo Consultivo de Salud en las recom… https://t.co/UDeijLYOhB,https://twitter.com/i/web/status/1282874926685454336,13/07/2020 21:09:51,Twitter for Android,98,36,Ministerio de Salud de Panamá,21:09:51,http://pbs.twimg.com/profile_images/1278201105479012353/8BrlKLHe.jpg
Hacer una lista previa nos ayuda a disminuir el tiempo en los lugares de compras y evitar tocar productos que no va… https://t.co/UcPAPeb3is,https://twitter.com/i/web/status/1283040780760866819,14/07/2020 08:08:54,Twitter for Android,28,11,Ministerio de Salud de Panamá,08:08:54,http://pbs.twimg.com/profile_images/1278201105479012353/8BrlKLHe.jpg
"“Juntos nos enfocaremos en proteger a los que están en mayor riesgo: trabajadores de la salud, ancianos y personas… https://t.co/m9s0Agmrcc",https://twitter.com/i/web/status/1283064690348875776,14/07/2020 09:43:55,Twitter for iPhone,4,1,OPS/OMS,09:43:55,http://pbs.twimg.com/profile_images/1096094749902028801/ijbQWupW.png
"“Ya tenemos 3️⃣0️⃣ países y territorios que se unen a través del Fondo Rotatorio de la OPS, y estamos entusiasmados… https://t.co/iNNtBvsPAD",https://twitter.com/i/web/status/1283065275907284992,14/07/2020 09:46:14,Twitter for iPhone,10,4,OPS/OMS,09:46:14,http://pbs.twimg.com/profile_images/1096094749902028801/ijbQWupW.png
"“Debemos mirar hacia el futuro para planificar cómo seleccionaremos, fabricaremos, pagaremos y distribuiremos una v… https://t.co/ZsshizLvBb",https://twitter.com/i/web/status/1283065595592937472,14/07/2020 09:47:30,Twitter for iPhone,9,0,OPS/OMS,09:47:30,http://pbs.twimg.com/profile_images/1096094749902028801/ijbQWupW.png
"“Necesitamos mejorar nuestras capacidades reguladoras sobre la inmunización, desarrollar la vigilancia posterior a… https://t.co/kOD2ywfRHh",https://twitter.com/i/web/status/1283065964645494784,14/07/2020 09:48:58,Twitter for iPhone,13,6,OPS/OMS,09:48:58,http://pbs.twimg.com/profile_images/1096094749902028801/ijbQWupW.png
“Y debemos trabajar ahora para fortalecer nuestra capacidad que nos permitirá llegar a nuestras comunidades vulnera… https://t.co/SfGS084z0n,https://twitter.com/i/web/status/1283066221966045184,14/07/2020 09:50:00,Twitter for iPhone,5,3,OPS/OMS,09:50:00,http://pbs.twimg.com/profile_images/1096094749902028801/ijbQWupW.png
"✅🌎 “Debemos aprovechar este momento y trabajar juntos
👩🏽‍⚕️👨🏻‍⚕️👩🏼‍⚕️👨🏿‍⚕️ hacia un futuro en el que todos, indepen… https://t.co/s8Qu2cPlRX",https://twitter.com/i/web/status/1283066827116027907,14/07/2020 09:52:24,Twitter for iPhone,14,4,OPS/OMS,09:52:24,http://pbs.twimg.com/profile_images/1096094749902028801/ijbQWupW.png
"RT @OPSOMS_Col: 📌 En nuestro reporte de situación #101 le contamos con cifras y análisis cómo está el panorama de #COVID19 en el país.  

👉…",https://twitter.com/i/web/status/1283069347108356097,14/07/2020 10:02:25,Twitter Web App,0,8,OPS/OMS,10:02:25,http://pbs.twimg.com/profile_images/1096094749902028801/ijbQWupW.png
"📌 Te invitamos a participar 👉🏽  Webinar “Salud de las personas cuidadoras no remunerada durante COVID-19”.

🗒  HOY,… https://t.co/AxPX34OuCL",https://twitter.com/i/web/status/1283076290606579718,14/07/2020 10:30:00,TweetDeck,8,8,OPS/OMS,10:30:00,http://pbs.twimg.com/profile_images/1096094749902028801/ijbQWupW.png
"RT @OPSGuate: #NuevaNormalidad 
La limpieza y desinfección de superficies y objetos será importante como medida de prevención de la #COVID1…",https://twitter.com/i/web/status/1283077585044480000,14/07/2020 10:35:09,Twitter Web App,0,8,OPS/OMS,10:35:09,http://pbs.twimg.com/profile_images/1096094749902028801/ijbQWupW.png
"RT @OPSGuate: #COVID19 #PorSiTeLoPerdiste @OPSGuate participó en apertura de Centro de Bienestar Respiratorio.

Entérate de más en: https:/…",https://twitter.com/i/web/status/1283077677973483528,14/07/2020 10:35:31,Twitter Web App,0,3,OPS/OMS,10:35:31,http://pbs.twimg.com/profile_images/1096094749902028801/ijbQWupW.png
