Contenido,IR,Fecha,Dispositivo,Likes,Retweets,Entidad,Hora,Foto
"RT @opsomsnic: Hemos apoyado la llegada hoy a #Nicaragua de 36,480 dosis de vacunas AstraZeneca de Oxford donadas por Noruega a través de #…",https://twitter.com/i/web/status/1421215432057532426,30/07/2021 15:05:38,Twitter for iPhone,0,7,OPS/OMS,15:05:38,http://pbs.twimg.com/profile_images/1096094749902028801/ijbQWupW.png
"""Dado que los países 🌎 han dedicado recursos, personal y atención a sus respuestas al COVID-19, muchos han tenido d… https://t.co/I9Rp6DA950",https://twitter.com/i/web/status/1421221879008751618,30/07/2021 15:31:15,Twitter Media Studio,11,7,OPS/OMS,15:31:15,http://pbs.twimg.com/profile_images/1096094749902028801/ijbQWupW.png
"Todos los virus 🦠, como el que causa la COVID-19, son propensos a generar mutaciones y cambiar genéticamente, crean… https://t.co/625GfwAMWr",https://twitter.com/i/web/status/1421483835909296143,31/07/2021 08:52:11,Twitter for iPhone,81,62,OPS/OMS,08:52:11,http://pbs.twimg.com/profile_images/1096094749902028801/ijbQWupW.png
"Nicaragua recibió un donativo de 36,480 dosis de 💉 de AstraZeneca de Oxford de parte de Noruega por medio del Mecan… https://t.co/Hpc3Yf5B8s",https://twitter.com/i/web/status/1421524457575780353,31/07/2021 11:33:35,Twitter for iPhone,19,3,OPS/OMS,11:33:35,http://pbs.twimg.com/profile_images/1096094749902028801/ijbQWupW.png
"""Si no revertimos estas tendencias, corremos el riesgo de una avalancha de empeoramiento de los problemas de salud… https://t.co/3HEZNzLJxN",https://twitter.com/i/web/status/1421561304654000133,31/07/2021 14:00:01,Twitter Media Studio,39,27,OPS/OMS,14:00:01,http://pbs.twimg.com/profile_images/1096094749902028801/ijbQWupW.png
"#BocasDelToro | Continua la búsqueda activa de casos en la provincia, donde los Equipos de Respuesta Rápida (ERR),… https://t.co/45HTlGWUA2",https://twitter.com/i/web/status/1421833097792917507,01/08/2021 08:00:01,Twitter Web App,7,2,Ministerio de Salud de Panamá,08:00:01,http://pbs.twimg.com/profile_images/1410465327176093700/iboqeGBN.jpg
"El equipo de enfermería se mantiene dando la milla extra en los centros de vacunación del circuito 8-6, con el fin… https://t.co/hagMz76MAp",https://twitter.com/i/web/status/1421852369038594049,01/08/2021 09:16:36,Twitter Web App,15,8,Ministerio de Salud de Panamá,09:16:36,http://pbs.twimg.com/profile_images/1410465327176093700/iboqeGBN.jpg
La vacunación y la seguridad de la sangre hicieron posible la eliminación de la transmisión de la hepatitis B en la… https://t.co/VFlEs1pREP,https://twitter.com/i/web/status/1421883973949542400,01/08/2021 11:22:11,Twitter Web App,20,11,OPS/OMS,11:22:11,http://pbs.twimg.com/profile_images/1096094749902028801/ijbQWupW.png
Exhortamos a las personas a seguir acudiendo a los centros de vacunación contra el #COVID19. Recordamos que no se h… https://t.co/5ATk7Dl2FR,https://twitter.com/i/web/status/1421886188315680782,01/08/2021 11:30:59,Twitter for Android,228,138,Ministerio de Salud de Panamá,11:30:59,http://pbs.twimg.com/profile_images/1410465327176093700/iboqeGBN.jpg
"""La gobernadora de Panamá, Carla García y la ministra @EyraRuiz, realizaron recorridos en los centros de vacunación… https://t.co/5QrVplUWIa",https://twitter.com/i/web/status/1421957028189294594,01/08/2021 16:12:28,Twitter for Android,1,0,Ministerio de Salud de Panamá,16:12:28,http://pbs.twimg.com/profile_images/1410465327176093700/iboqeGBN.jpg
"""Sabemos que el retroceso económico de esta pandemia está obligando a los países a tomar decisiones difíciles sobre… https://t.co/6EZ4iwquGD",https://twitter.com/i/web/status/1421967835811614720,01/08/2021 16:55:25,Twitter Media Studio,42,29,OPS/OMS,16:55:25,http://pbs.twimg.com/profile_images/1096094749902028801/ijbQWupW.png
"#BuenGobiernoComunica en Salud

✅Llegan 456,300 dosis de Pfizer en una semana.
✅Continúa la 4ta. semana de vacunaci… https://t.co/u3dSE7aPad",https://twitter.com/i/web/status/1421971004075692034,01/08/2021 17:08:00,Twitter Web App,19,8,Ministerio de Salud de Panamá,17:08:00,http://pbs.twimg.com/profile_images/1410465327176093700/iboqeGBN.jpg
Comunicado N° 523 #UnPanamáMejor🇵🇦 #ProtégetePanamá https://t.co/lrAfBQrDrZ,https://twitter.com/i/web/status/1422001839428472833,01/08/2021 19:10:32,Twitter Web App,11,7,Ministerio de Salud de Panamá,19:10:32,http://pbs.twimg.com/profile_images/1410465327176093700/iboqeGBN.jpg
Compartimos la actualización de datos sobre #COVID19 en nuestro país. Domingo 1 de agosto de 2021. Parte 1.… https://t.co/DX3FvXW6Tc,https://twitter.com/i/web/status/1422001943480840195,01/08/2021 19:10:57,Twitter Web App,11,7,Ministerio de Salud de Panamá,19:10:57,http://pbs.twimg.com/profile_images/1410465327176093700/iboqeGBN.jpg
Compartimos la actualización de datos sobre #COVID19 en nuestro país. Domingo 1 de agosto de 2021. Parte 2.… https://t.co/MEcRyboyOw,https://twitter.com/i/web/status/1422001950753763334,01/08/2021 19:10:59,Twitter Web App,4,3,Ministerio de Salud de Panamá,19:10:59,http://pbs.twimg.com/profile_images/1410465327176093700/iboqeGBN.jpg
"Distribución de los casos de #COVID19 por provincias y comarcas.
Domingo 1 de agosto de 2021.
#ProtégetePanamá… https://t.co/UI2FgQb7TV",https://twitter.com/i/web/status/1422001956458008578,01/08/2021 19:11:00,Twitter Web App,1,2,Ministerio de Salud de Panamá,19:11:00,http://pbs.twimg.com/profile_images/1410465327176093700/iboqeGBN.jpg
Desglose de corregimientos con más casos en el país para el 1 de agosto de 2021. #UnPanamáMejor #ProtégetePanamá https://t.co/DNTxOnsvY4,https://twitter.com/i/web/status/1422002040553750528,01/08/2021 19:11:20,Twitter Web App,12,11,Ministerio de Salud de Panamá,19:11:20,http://pbs.twimg.com/profile_images/1410465327176093700/iboqeGBN.jpg
📌¡Estaremos en VIVO🔴 en 30 minutos! ⏰ https://t.co/lRhtbTdsUo,https://twitter.com/i/web/status/1422189079194525704,02/08/2021 07:34:34,Twitter Web App,12,3,OPS/OMS,07:34:34,http://pbs.twimg.com/profile_images/1096094749902028801/ijbQWupW.png
"🗣 Conversaciones EN VIVO: 

Lactancia materna durante la pandemia de #COVID19  https://t.co/RZvaDIQjup",https://twitter.com/i/web/status/1422195978816327685,02/08/2021 08:01:59,Twitter Media Studio,61,32,OPS/OMS,08:01:59,http://pbs.twimg.com/profile_images/1096094749902028801/ijbQWupW.png
"¡Protege la #lactanciamaterna! ❤️

✅ La lactancia materna da 🤱🏾 vida
✅ Mejora el sistema inmunológico de los 👧🏻🧑🏾‍🦱… https://t.co/Nl1oBWinqu",https://twitter.com/i/web/status/1422218130944786434,02/08/2021 09:30:00,Twitter Media Studio,1,3,OPS/OMS,09:30:00,http://pbs.twimg.com/profile_images/1096094749902028801/ijbQWupW.png
