Contenido,IR,Fecha,Dispositivo,Likes,Retweets,Entidad,Hora,Foto
"La vacuna contra el #COVID19 significa salud y tranquilidad, pero de igual manera es importante continuar aplicando… https://t.co/QmvSv8CpHx",https://twitter.com/i/web/status/1372270705992212480,17/03/2021 13:36:46,Twitter for Android,5,6,Ministerio de Salud de Panamá,13:36:46,http://pbs.twimg.com/profile_images/1345009760815484928/HZiaFwYR.jpg
"#Veraguas | Llegaron 746 viales de la vacuna contra el #COVID19, que representan 4,476 dosis. Estas serán utilizada… https://t.co/QC8QqNokem",https://twitter.com/i/web/status/1372276290846400512,17/03/2021 13:58:58,Twitter Web App,18,35,Ministerio de Salud de Panamá,13:58:58,http://pbs.twimg.com/profile_images/1345009760815484928/HZiaFwYR.jpg
"RT @cepal_onu: Subsecretaria @marthadelgado en #ForoALC2030: Reafirmamos la importancia de la coordinación multilateral entre los Estados,…",https://twitter.com/i/web/status/1372277424730349577,17/03/2021 14:03:28,Twitter for iPhone,0,11,OPS/OMS,14:03:28,http://pbs.twimg.com/profile_images/1096094749902028801/ijbQWupW.png
"RT @cepal_onu: .@daniInnerarity de @globernanceIGD, en el #ForoALC2030: La crisis confirmó que tenemos sistemas políticos con una cortedad…",https://twitter.com/i/web/status/1372277508058591233,17/03/2021 14:03:48,Twitter for iPhone,0,8,OPS/OMS,14:03:48,http://pbs.twimg.com/profile_images/1096094749902028801/ijbQWupW.png
"RT @cepal_onu: Sin salud, no hay economía. Y si la salud se agrava al punto en que hemos visto en algunas olas de esta pandemia del #COVID1…",https://twitter.com/i/web/status/1372277517197971464,17/03/2021 14:03:50,Twitter for iPhone,0,13,OPS/OMS,14:03:50,http://pbs.twimg.com/profile_images/1096094749902028801/ijbQWupW.png
"RT @cepal_onu: Los países ricos acapararon 3/4 partes del total de vacunas producidas hasta ahora, generando mayor desigualdad con los país…",https://twitter.com/i/web/status/1372277544200851456,17/03/2021 14:03:56,Twitter for iPhone,0,16,OPS/OMS,14:03:56,http://pbs.twimg.com/profile_images/1096094749902028801/ijbQWupW.png
RT @cepal_onu: En 2020 apoyamos a más de 20 países de #ALC por un monto de alrededor de 60 mil millones de dólares. En 2021 estamos dispues…,https://twitter.com/i/web/status/1372277645568843777,17/03/2021 14:04:21,Twitter for iPhone,0,3,OPS/OMS,14:04:21,http://pbs.twimg.com/profile_images/1096094749902028801/ijbQWupW.png
"RT @cepal_onu: .@DrJoyStJohn, Directora Ejecutiva del Organismo de Salud Pública del #Caribe, destacó en el #ForoALC2030 la sólida gobernan…",https://twitter.com/i/web/status/1372277670260654090,17/03/2021 14:04:26,Twitter for iPhone,0,4,OPS/OMS,14:04:26,http://pbs.twimg.com/profile_images/1096094749902028801/ijbQWupW.png
RT @cepal_onu: .@DirOPSPAHO en #ForoALC2030: La crisis social y económica actual ha sido generada por una crisis sanitaria. Las estrategias…,https://twitter.com/i/web/status/1372277684894568461,17/03/2021 14:04:30,Twitter for iPhone,0,11,OPS/OMS,14:04:30,http://pbs.twimg.com/profile_images/1096094749902028801/ijbQWupW.png
"RT @cepal_onu: La vida, la salud y el bienestar constituyen pre-requisitos para la recuperación sostenible. Se requieren acciones urgentes…",https://twitter.com/i/web/status/1372277729819832329,17/03/2021 14:04:41,Twitter for iPhone,0,5,OPS/OMS,14:04:41,http://pbs.twimg.com/profile_images/1096094749902028801/ijbQWupW.png
RT @cepal_onu: Sin transformar los sistemas alimentarios de #ALC no tenemos posibilidad de cumplir los ODS 1 y 2: poner fin a la #pobreza y…,https://twitter.com/i/web/status/1372277765018427395,17/03/2021 14:04:49,Twitter for iPhone,0,39,OPS/OMS,14:04:49,http://pbs.twimg.com/profile_images/1096094749902028801/ijbQWupW.png
La sede del Programa Ampliado de Inmunización recibió un aporte de insumos de protección gestionado por… https://t.co/r4C3NvL1Wi,https://twitter.com/i/web/status/1372279788438708230,17/03/2021 14:12:51,Twitter Web App,4,4,Ministerio de Salud de Panamá,14:12:51,http://pbs.twimg.com/profile_images/1345009760815484928/HZiaFwYR.jpg
"Estos insumos consisten de:
✅20,000 mascarillas quirúrgicas.
✅10,000 guantes desechables.
✅1,020 overoles desechabl… https://t.co/FpsQUP13aK",https://twitter.com/i/web/status/1372279796340772869,17/03/2021 14:12:53,Twitter Web App,4,1,Ministerio de Salud de Panamá,14:12:53,http://pbs.twimg.com/profile_images/1345009760815484928/HZiaFwYR.jpg
"#LosSantos | Un total de 2,472 dosis de la vacuna contra el #COVID19 fueron recibidas la mañana del miércoles en la… https://t.co/5sGry59voT",https://twitter.com/i/web/status/1372281584850661377,17/03/2021 14:20:00,Twitter Web App,22,28,Ministerio de Salud de Panamá,14:20:00,http://pbs.twimg.com/profile_images/1345009760815484928/HZiaFwYR.jpg
"#BocasDelToro | La región de salud recibe un total de 1,464 dosis de la vacuna contra el #COVID19, las cuales serán… https://t.co/2DF3KuFVLd",https://twitter.com/i/web/status/1372286618036436995,17/03/2021 14:40:00,Twitter Web App,21,31,Ministerio de Salud de Panamá,14:40:00,http://pbs.twimg.com/profile_images/1345009760815484928/HZiaFwYR.jpg
#NgäbeBuglé | La región de salud de la comarca recibió 390 dosis de vacunas contra el #COVID19 para seguir con lo e… https://t.co/bNXEllk1cO,https://twitter.com/i/web/status/1372291653499768840,17/03/2021 15:00:00,Twitter Web App,21,34,Ministerio de Salud de Panamá,15:00:00,http://pbs.twimg.com/profile_images/1345009760815484928/HZiaFwYR.jpg
➡️ El Fondo Rotatorio de la OPS entregará alrededor de 728 mil vacunas #COVID19 adquiridas mediante COVAX a 5️⃣ paí… https://t.co/5TIzOIMm4B,https://twitter.com/i/web/status/1372292724993445892,17/03/2021 15:04:16,"<a href=""https://ads-api.twitter.com"" rel=""nofollow"">Twitter for Advertisers (legacy)",1,3,OPS/OMS,15:04:16,http://pbs.twimg.com/profile_images/1096094749902028801/ijbQWupW.png
"Las vacunas contra el #COVID19 te brindan protección, sin embargo es importante seguir manteniendo las medidas de b… https://t.co/BzTZIC6tTi",https://twitter.com/i/web/status/1372300552604909569,17/03/2021 15:35:22,Twitter for Android,2,6,Ministerio de Salud de Panamá,15:35:22,http://pbs.twimg.com/profile_images/1345009760815484928/HZiaFwYR.jpg
"#Coclé | Con la llegada de 3,366 dosis de vacunas contra el #COVID19 a la provincia, nuestro equipo de #PanavaC19 e… https://t.co/BtYHxHLXbX",https://twitter.com/i/web/status/1372305313299304448,17/03/2021 15:54:17,Twitter Web App,4,7,Ministerio de Salud de Panamá,15:54:17,http://pbs.twimg.com/profile_images/1345009760815484928/HZiaFwYR.jpg
"Vacúnate contra el #COVID19 para salvaguardar tu salud y la de tus seres queridos.

Antes de acudir a su centro de… https://t.co/UBUw8TZIsw",https://twitter.com/i/web/status/1372313088133890049,17/03/2021 16:25:11,Twitter for Android,1,1,Ministerio de Salud de Panamá,16:25:11,http://pbs.twimg.com/profile_images/1345009760815484928/HZiaFwYR.jpg
