Contenido,IR,Fecha,Dispositivo,Likes,Retweets,Entidad,Hora,Foto
"RT @OPASOMSBrasil: 📢 OMS convida cineastas, empresas de produção, instituições de saúde pública, ONGs, comunidades, estudantes e escolas de…",https://twitter.com/i/web/status/1319035006229020674,21/10/2020 15:57:06,Twitter for iPhone,0,2,OPS/OMS,15:57:06,http://pbs.twimg.com/profile_images/1096094749902028801/ijbQWupW.png
RT @OPSGuate: Los trabajadores de la salud👩🏻‍⚕️🧑🏻‍⚕️🧑🏻‍⚕️👩🏻‍⚕️👩🏾‍⚕️ deben ser protegidos durante la pandemia de la #COVID19.  Estas son las…,https://twitter.com/i/web/status/1319035050495741957,21/10/2020 15:57:17,Twitter for iPhone,0,12,OPS/OMS,15:57:17,http://pbs.twimg.com/profile_images/1096094749902028801/ijbQWupW.png
RT @OPSECU: #Napo| En el marco de la cooperación con @Salud_Ec  se desarrolló la capacitación denominada “Plan de Apoyo al Fortalecimiento…,https://twitter.com/i/web/status/1319035070024437761,21/10/2020 15:57:21,Twitter for iPhone,0,5,OPS/OMS,15:57:21,http://pbs.twimg.com/profile_images/1096094749902028801/ijbQWupW.png
"RT @OPSOMSPeru: ¿Tienes una persona mayor de 60 años en 🏘? Vamos a darte algunos tips sobre cómo ayudarlos a mantenerse saludable:

🍎🍊🥗  Se…",https://twitter.com/i/web/status/1319035099472605187,21/10/2020 15:57:28,Twitter for iPhone,0,17,OPS/OMS,15:57:28,http://pbs.twimg.com/profile_images/1096094749902028801/ijbQWupW.png
RT @OPSOMS_Honduras: El Programa Regional de Bioética de la OPS les invita a participar en el taller virtual de ética de la investigación d…,https://twitter.com/i/web/status/1319035155026235393,21/10/2020 15:57:42,Twitter for iPhone,0,8,OPS/OMS,15:57:42,http://pbs.twimg.com/profile_images/1096094749902028801/ijbQWupW.png
"RT @OPSOMS_Col: 📹 El Gobierno de Canadá, a través de la OPS/OMS, entrega implementos a instituciones de salud en Tumaco y Uribia. 
Ver 👉 ht…",https://twitter.com/i/web/status/1319035175351816198,21/10/2020 15:57:46,Twitter for iPhone,0,5,OPS/OMS,15:57:46,http://pbs.twimg.com/profile_images/1096094749902028801/ijbQWupW.png
"RT @opsomsnic: OPS/OMS dona equipos e insumos a Nicaragua para la prevención, detección y contención de la #COVID19.

Más información: http…",https://twitter.com/i/web/status/1319035219253563394,21/10/2020 15:57:57,Twitter for iPhone,0,4,OPS/OMS,15:57:57,http://pbs.twimg.com/profile_images/1096094749902028801/ijbQWupW.png
"RT @OPSOMSBolivia: Los jóvenes están minimizando los riesgos por #COVID19 La pandemia no ha terminado, los casos de contagio siguen. Cada s…",https://twitter.com/i/web/status/1319035320772513792,21/10/2020 15:58:21,Twitter for iPhone,0,13,OPS/OMS,15:58:21,http://pbs.twimg.com/profile_images/1096094749902028801/ijbQWupW.png
"RT @OPSGuate: Una persona que ha sido expuesta a la #COVID19 ¿puede vacunarse contra otras enfermedades❓
Aquí te respondemos⤵️ https://t.co…",https://twitter.com/i/web/status/1319035331975499778,21/10/2020 15:58:24,Twitter for iPhone,0,10,OPS/OMS,15:58:24,http://pbs.twimg.com/profile_images/1096094749902028801/ijbQWupW.png
"Este jueves 22 de octubre desde las 10:00 a.m., te invitamos a participar de la Charla virtual ""Cáncer de mama, pre… https://t.co/hNGmir6CCv",https://twitter.com/i/web/status/1319040767604723715,21/10/2020 16:20:00,Twitter Web App,8,2,Ministerio de Salud de Panamá,16:20:00,http://pbs.twimg.com/profile_images/1311541115452035073/tnnGPmq5.jpg
Comunicado N° 240 #UnPanamáMejor🇵🇦 #ProtégetePanamá https://t.co/mbTw1cE1Dp,https://twitter.com/i/web/status/1319047437147869189,21/10/2020 16:46:30,Twitter for Android,17,14,Ministerio de Salud de Panamá,16:46:30,http://pbs.twimg.com/profile_images/1311541115452035073/tnnGPmq5.jpg
Compartimos la actualización de datos sobre #COVID19 en nuestro país. Miércoles 20 de octubre de 2020. Parte 1.… https://t.co/tuVOxV6NUZ,https://twitter.com/i/web/status/1319048340856856578,21/10/2020 16:50:05,Twitter for Android,11,15,Ministerio de Salud de Panamá,16:50:05,http://pbs.twimg.com/profile_images/1311541115452035073/tnnGPmq5.jpg
Compartimos la actualización de datos sobre #COVID19 en nuestro país. Miércoles 20 de octubre de 2020. Parte 2.… https://t.co/7TbK6Otqr6,https://twitter.com/i/web/status/1319048355335577600,21/10/2020 16:50:09,Twitter for Android,5,8,Ministerio de Salud de Panamá,16:50:09,http://pbs.twimg.com/profile_images/1311541115452035073/tnnGPmq5.jpg
Distribución de los casos de #COVID19 por provincias y comarcas. Miércoles 20 de octubre de 2020. #ProtégetePanamá… https://t.co/bvceec3MR8,https://twitter.com/i/web/status/1319048370867081228,21/10/2020 16:50:13,Twitter for Android,5,9,Ministerio de Salud de Panamá,16:50:13,http://pbs.twimg.com/profile_images/1311541115452035073/tnnGPmq5.jpg
Desglose de corregimientos con más de 10 casos para el 21 de octubre de 2020. #UnPanamáMejor #ProtégetePanamá https://t.co/ZvFwSDP2gR,https://twitter.com/i/web/status/1319048626589532160,21/10/2020 16:51:13,Twitter for Android,10,11,Ministerio de Salud de Panamá,16:51:13,http://pbs.twimg.com/profile_images/1311541115452035073/tnnGPmq5.jpg
Como parte del compromiso de los Equipos Unificados de Trazabilidad impulsados por el Presidente @NitoCortizo en la… https://t.co/ZP0sz2Wxbe,https://twitter.com/i/web/status/1319052419628662786,21/10/2020 17:06:18,Twitter for Android,25,10,Ministerio de Salud de Panamá,17:06:18,http://pbs.twimg.com/profile_images/1311541115452035073/tnnGPmq5.jpg
"RT @NoticiasONU: La @opsoms recomendó evitar los viajes en avión a menos que sean esenciales, y hacer turismo nacional para reducir el ries…",https://twitter.com/i/web/status/1319061339399225346,21/10/2020 17:41:44,Twitter Web App,0,46,OPS/OMS,17:41:44,http://pbs.twimg.com/profile_images/1096094749902028801/ijbQWupW.png
RT @presidenciapma: “Hace varios días se hizo un consenso con especialistas panameños y de Baylor College para conocer el diagnóstico del p…,https://twitter.com/i/web/status/1319109518744297474,21/10/2020 20:53:11,Twitter for Android,0,9,Ministerio de Salud de Panamá,20:53:11,http://pbs.twimg.com/profile_images/1311541115452035073/tnnGPmq5.jpg
RT @presidenciapma: “El Gobierno Nacional gestionó la mejor atención para el Dr. Mendoza con especialistas panameños y extranjeros. El Pdte…,https://twitter.com/i/web/status/1319109531792789504,21/10/2020 20:53:14,Twitter for Android,0,14,Ministerio de Salud de Panamá,20:53:14,http://pbs.twimg.com/profile_images/1311541115452035073/tnnGPmq5.jpg
"RT @presidenciapma: Lamentamos la desaparición física del Dr. Carlos Mendoza, un héroe de blanco quien en sus últimos días fue atendido con…",https://twitter.com/i/web/status/1319109553288523776,21/10/2020 20:53:20,Twitter for Android,0,15,Ministerio de Salud de Panamá,20:53:20,http://pbs.twimg.com/profile_images/1311541115452035073/tnnGPmq5.jpg
