Contenido,IR,Fecha,Dispositivo,Likes,Retweets,Entidad,Hora,Foto
"RT @ONU_es: 1 de cada 5 personas desarrollará cáncer antes de los 75 años.

El diagnóstico temprano y la reducción de los factores de riesg…",https://twitter.com/i/web/status/1489664725755600900,04/02/2022 12:18:41,Twitter for iPhone,0,96,OPS/OMS,12:18:41,http://pbs.twimg.com/profile_images/1096094749902028801/ijbQWupW.png
"El #cancercervicouterino es prevenible 👩🏿‍🦱👩👧🏽👩🏼‍🦰 

La vacunación contra el VPH, el tamizaje regular y el tratamie… https://t.co/3z6LLYtWBA",https://twitter.com/i/web/status/1489692586067599370,04/02/2022 14:09:24,Twitter Web App,60,30,OPS/OMS,14:09:24,http://pbs.twimg.com/profile_images/1096094749902028801/ijbQWupW.png
"Al menos un tercio de los cánceres comunes se pueden prevenir.

Esto es lo que puedes hacer para reducir tu riesgo… https://t.co/m0JsCEA6kh",https://twitter.com/i/web/status/1489710350505324546,04/02/2022 15:19:59,Twitter for iPhone,43,23,OPS/OMS,15:19:59,http://pbs.twimg.com/profile_images/1096094749902028801/ijbQWupW.png
"""No puedo comenzar a contarles el alivio que sentí cuando yo, mi madre, mi esposo y mis hijos fuimos vacunados porq… https://t.co/KpA9l9QCEa",https://twitter.com/i/web/status/1489765723270524935,04/02/2022 19:00:01,Twitter Media Studio,68,26,OPS/OMS,19:00:01,http://pbs.twimg.com/profile_images/1096094749902028801/ijbQWupW.png
"Las manos y/o pies fríos son comunes en los recién nacidos y no significa que sientan frío 👶🏽🤱

👉🏽… https://t.co/FI4JbIafUw",https://twitter.com/i/web/status/1490050830212472833,05/02/2022 13:52:56,Twitter for iPhone,7,1,OPS/OMS,13:52:56,http://pbs.twimg.com/profile_images/1096094749902028801/ijbQWupW.png
📊📈Para mejorar los resultados en salud y salvar vidas en todos los países hay que ampliar los programas de control… https://t.co/yXgWnQaq3p,https://twitter.com/i/web/status/1490086529632514050,05/02/2022 16:14:47,Twitter for iPhone,24,10,OPS/OMS,16:14:47,http://pbs.twimg.com/profile_images/1096094749902028801/ijbQWupW.png
Desglose de corregimientos con más casos en el país para el 5 de febrero de 2022. #UnPanamáMejor #ProtégetePanamá https://t.co/Xvu1SpMwbx,https://twitter.com/i/web/status/1490166341730508801,05/02/2022 21:31:56,Twitter Web App,12,4,Ministerio de Salud de Panamá,21:31:56,http://pbs.twimg.com/profile_images/1477447837076148227/8U6oii3Y.jpg
"Reforzando la Estrategia Continua de Vacunación, nuestro equipo de enfermería aplicó dosis de esperanza contra el… https://t.co/DiIRKe90KA",https://twitter.com/i/web/status/1490380545515266052,06/02/2022 11:43:06,Twitter for Android,5,4,Ministerio de Salud de Panamá,11:43:06,http://pbs.twimg.com/profile_images/1477447837076148227/8U6oii3Y.jpg
"Danahi 🇻🇪 relata su experiencia
con sus mellizos “Dos bebés 👶🏽👶🏽, doble cuidado”

#Primeros28Días… https://t.co/pFmc6Srqgv",https://twitter.com/i/web/status/1490385421251092487,06/02/2022 12:02:29,Twitter for iPhone,3,3,OPS/OMS,12:02:29,http://pbs.twimg.com/profile_images/1096094749902028801/ijbQWupW.png
"#Coclé | El día de ayer el equipo #PanavaC19 se trasladó a Río Indio, área de difícil acceso, en donde cientos de p… https://t.co/DkTv1Vw7n9",https://twitter.com/i/web/status/1490385695726354435,06/02/2022 12:03:34,Twitter for Android,12,4,Ministerio de Salud de Panamá,12:03:34,http://pbs.twimg.com/profile_images/1477447837076148227/8U6oii3Y.jpg
Es recomendable iniciar la lactancia 🤱 en el transcurso de la primera hora después de nacer y promover el contacto… https://t.co/emrjOMrhsQ,https://twitter.com/i/web/status/1490386194609451008,06/02/2022 12:05:33,Twitter for iPhone,8,2,OPS/OMS,12:05:33,http://pbs.twimg.com/profile_images/1096094749902028801/ijbQWupW.png
"El cordón umbilical debe mantenerse siempre limpio y seco 

➡️ https://t.co/Uyhsk1bpxZ 

#Primeros28Días… https://t.co/mjK1pOViFq",https://twitter.com/i/web/status/1490386626333323271,06/02/2022 12:07:16,Twitter for iPhone,10,0,OPS/OMS,12:07:16,http://pbs.twimg.com/profile_images/1096094749902028801/ijbQWupW.png
"“La pandemia por COVID-19 ha puesto muchos obstáculos en el camino, pero la lucha contra el cáncer no puede retroce… https://t.co/mVFG3YTex4",https://twitter.com/i/web/status/1490439034015035392,06/02/2022 15:35:31,Twitter for iPhone,11,2,OPS/OMS,15:35:31,http://pbs.twimg.com/profile_images/1096094749902028801/ijbQWupW.png
"El día de ayer, culminó el proceso de vacunación pediátrica en La Chorrera, donde desde temprano niños acompañados… https://t.co/WdH3WJAKEi",https://twitter.com/i/web/status/1490460458804985856,06/02/2022 17:00:39,Twitter Web App,9,1,Ministerio de Salud de Panamá,17:00:39,http://pbs.twimg.com/profile_images/1477447837076148227/8U6oii3Y.jpg
Comunicado N° 712 #UnPanamáMejor🇵🇦 #ProtégetePanamá https://t.co/sGGM9WczmE,https://twitter.com/i/web/status/1490478259053678595,06/02/2022 18:11:23,Twitter Web App,2,1,Ministerio de Salud de Panamá,18:11:23,http://pbs.twimg.com/profile_images/1477447837076148227/8U6oii3Y.jpg
"Compartimos la actualización de datos sobre #COVID19 en nuestro país. 
Domingo 6 de febrero de 2022. Parte 1.… https://t.co/eWhYwX3aa9",https://twitter.com/i/web/status/1490479403897434117,06/02/2022 18:15:56,Twitter Web App,4,4,Ministerio de Salud de Panamá,18:15:56,http://pbs.twimg.com/profile_images/1477447837076148227/8U6oii3Y.jpg
"Compartimos la actualización de datos sobre #COVID19 en nuestro país. 
Domingo 6 de febrero de 2022. Parte 2.… https://t.co/uVBCbV6sCx",https://twitter.com/i/web/status/1490479410490712072,06/02/2022 18:15:57,Twitter Web App,1,3,Ministerio de Salud de Panamá,18:15:57,http://pbs.twimg.com/profile_images/1477447837076148227/8U6oii3Y.jpg
"Distribución de los casos de #COVID19 por provincias y comarcas.
Domingo 6 de febrero de 2022.
#ProtégetePanamá… https://t.co/XPLqnmvXXL",https://twitter.com/i/web/status/1490479416597700611,06/02/2022 18:15:59,Twitter Web App,1,3,Ministerio de Salud de Panamá,18:15:59,http://pbs.twimg.com/profile_images/1477447837076148227/8U6oii3Y.jpg
Desglose de corregimientos con más casos en el país para el 6 de febrero de 2022. #UnPanamáMejor #ProtégetePanamá https://t.co/h7GJ00pnpd,https://twitter.com/i/web/status/1490479451234308100,06/02/2022 18:16:07,Twitter Web App,1,0,Ministerio de Salud de Panamá,18:16:07,http://pbs.twimg.com/profile_images/1477447837076148227/8U6oii3Y.jpg
#PanamáSaleAdelante https://t.co/ki70CyJEb7,https://twitter.com/i/web/status/1490480916455727108,06/02/2022 18:21:56,Twitter for Android,1,0,Ministerio de Salud de Panamá,18:21:56,http://pbs.twimg.com/profile_images/1477447837076148227/8U6oii3Y.jpg
