Contenido,IR,Fecha,Dispositivo,Likes,Retweets,Entidad,Hora,Foto
"La fabricación y venta de pintura con #plomo sigue estando permitida en más de 55% del mundo 🌎

Necesitamos acelera… https://t.co/MaTsRw0ZOB",https://twitter.com/i/web/status/1454125822261006338,29/10/2021 10:39:47,Twitter Web App,14,7,OPS/OMS,10:39:47,http://pbs.twimg.com/profile_images/1096094749902028801/ijbQWupW.png
"Las metas establecen reducciones graduales del contenido de sodio en alimentos envasados frecuentemente consumidos,… https://t.co/UwGxaUGC6z",https://twitter.com/i/web/status/1454201501711278080,29/10/2021 15:40:30,Twitter for iPhone,16,9,OPS/OMS,15:40:30,http://pbs.twimg.com/profile_images/1096094749902028801/ijbQWupW.png
"RT @unep_espanol: El clima de nuestro planeta está en estado de emergencia.

En pocos días, el mundo puede tomar medidas decisivas para res…",https://twitter.com/i/web/status/1454204567428771841,29/10/2021 15:52:41,Twitter for iPhone,0,19,OPS/OMS,15:52:41,http://pbs.twimg.com/profile_images/1096094749902028801/ijbQWupW.png
"RT @ONU_es: No podemos seguir ignorando la crisis climática.

¡Basta de excusas, es hora de cambios!

Tomemos #AcciónClimática antes de que…",https://twitter.com/i/web/status/1454204607790469125,29/10/2021 15:52:50,Twitter for iPhone,0,1729,OPS/OMS,15:52:50,http://pbs.twimg.com/profile_images/1096094749902028801/ijbQWupW.png
"RT @CMNUCC: ⏰ Ha llegado la hora de que se escuchen todas las voces ⏰

#COP26 #AcciónClimática #AcuerdoDeParís https://t.co/3OXVr17qRa",https://twitter.com/i/web/status/1454204734542385156,29/10/2021 15:53:21,Twitter for iPhone,0,48,OPS/OMS,15:53:21,http://pbs.twimg.com/profile_images/1096094749902028801/ijbQWupW.png
RT @opsomsuruguay: Representante de OPS/OMS participó de inauguración de nueva sede de Facultad de Enfermería @FenfUdelar  de la @Udelaruy…,https://twitter.com/i/web/status/1454219542977208323,29/10/2021 16:52:11,Twitter for iPhone,0,5,OPS/OMS,16:52:11,http://pbs.twimg.com/profile_images/1096094749902028801/ijbQWupW.png
"RT @PAHOemergencies: Presentamos la nueva edición de ""Desastres: Preparativos y Mitigación en las Américas🌎""
Este número está dedicado a la…",https://twitter.com/i/web/status/1454219680957276160,29/10/2021 16:52:44,Twitter for iPhone,0,7,OPS/OMS,16:52:44,http://pbs.twimg.com/profile_images/1096094749902028801/ijbQWupW.png
RT @OPSOMS_Col: #SaludSinFronteras. Para evitar que las poblaciones más vulnerables adquieran la #COVID19🦠 es necesario incluir a todos los…,https://twitter.com/i/web/status/1454220036353269773,29/10/2021 16:54:09,Twitter for iPhone,0,6,OPS/OMS,16:54:09,http://pbs.twimg.com/profile_images/1096094749902028801/ijbQWupW.png
"La fabricación y venta de pintura con #plomo sigue estando permitida en más de 55% del mundo. 

Necesitamos acelera… https://t.co/6bMreN2P27",https://twitter.com/i/web/status/1454440451742724102,30/10/2021 07:30:00,Twitter Web App,11,9,OPS/OMS,07:30:00,http://pbs.twimg.com/profile_images/1096094749902028801/ijbQWupW.png
Previamente se ha estado capacitando al personal que utilizará esta plataforma que además cuenta con todo el equipo… https://t.co/uS4wMUxp38,https://twitter.com/i/web/status/1454461526996303878,30/10/2021 08:53:45,Twitter Web App,4,0,Ministerio de Salud de Panamá,08:53:45,http://pbs.twimg.com/profile_images/1443802878737625116/IWF964ln.jpg
"Sin importar la edad, 👱🏼‍♀️ 👩🏻‍🦱 👩🏾 conocer 👀  los signos de manifestación del cáncer de mama es imprescindible par… https://t.co/zsH03G78N9",https://twitter.com/i/web/status/1454463101072560129,30/10/2021 09:00:00,Twitter Media Studio,26,16,OPS/OMS,09:00:00,http://pbs.twimg.com/profile_images/1096094749902028801/ijbQWupW.png
"#LosSantos | El Ministro @LPacoSucre, durante una gira de trabajo en el distrito de Pedasí, se trasladó al COCYTC p… https://t.co/DpHk5t0SM0",https://twitter.com/i/web/status/1454569399940231183,30/10/2021 16:02:24,Twitter Web App,6,6,Ministerio de Salud de Panamá,16:02:24,http://pbs.twimg.com/profile_images/1443802878737625116/IWF964ln.jpg
"El director médico de la Región de Los Santos, Ayvar Hernández, manifestó en su gira que la provincia cuenta ya con… https://t.co/gfrxwR6GNb",https://twitter.com/i/web/status/1454569406403682307,30/10/2021 16:02:25,Twitter Web App,10,5,Ministerio de Salud de Panamá,16:02:25,http://pbs.twimg.com/profile_images/1443802878737625116/IWF964ln.jpg
#LosSantos | La expresidenta Mireya Moscoso acompañó al Ministro de Salud @LPacoSucre en la reunión del COCYTC prov… https://t.co/GhIHMZlwu9,https://twitter.com/i/web/status/1454580427352649731,30/10/2021 16:46:13,Twitter for Android,51,20,Ministerio de Salud de Panamá,16:46:13,http://pbs.twimg.com/profile_images/1443802878737625116/IWF964ln.jpg
"¡Por quinto día en este año, no se registran fallecimientos por #COVID19 en el país! Sólo en el mes de octubre se h… https://t.co/w0z5IQh1V3",https://twitter.com/i/web/status/1454593308047679490,30/10/2021 17:37:24,Twitter for Android,84,23,Ministerio de Salud de Panamá,17:37:24,http://pbs.twimg.com/profile_images/1443802878737625116/IWF964ln.jpg
Comunicado N° 613 #UnPanamáMejor🇵🇦 #ProtégetePanamá https://t.co/NBOebPnzvD,https://twitter.com/i/web/status/1454641644578476032,30/10/2021 20:49:28,Twitter Web App,0,0,Ministerio de Salud de Panamá,20:49:28,http://pbs.twimg.com/profile_images/1443802878737625116/IWF964ln.jpg
"Compartimos la actualización de datos sobre #COVID19 en nuestro país. 
Sábado 30 de octubre de 2021. Parte 1.… https://t.co/iduYr6Xb5F",https://twitter.com/i/web/status/1454642431291441152,30/10/2021 20:52:36,Twitter Web App,1,2,Ministerio de Salud de Panamá,20:52:36,http://pbs.twimg.com/profile_images/1443802878737625116/IWF964ln.jpg
"Compartimos la actualización de datos sobre #COVID19 en nuestro país. 
Sábado 30 de octubre de 2021. Parte 2.… https://t.co/58Fmz5EPaU",https://twitter.com/i/web/status/1454642436249165825,30/10/2021 20:52:37,Twitter Web App,0,2,Ministerio de Salud de Panamá,20:52:37,http://pbs.twimg.com/profile_images/1443802878737625116/IWF964ln.jpg
"Distribución de los casos de #COVID19 por provincias y comarcas.
Sábado 30 de octubre de 2021.
#ProtégetePanamá… https://t.co/YttPMVVGkX",https://twitter.com/i/web/status/1454642441206784001,30/10/2021 20:52:38,Twitter Web App,0,2,Ministerio de Salud de Panamá,20:52:38,http://pbs.twimg.com/profile_images/1443802878737625116/IWF964ln.jpg
Desglose de corregimientos con más casos en el país para el 30 de octubre de 2021. #UnPanamáMejor #ProtégetePanamá https://t.co/kyAHcIyUPv,https://twitter.com/i/web/status/1454642591887241218,30/10/2021 20:53:14,Twitter Web App,2,0,Ministerio de Salud de Panamá,20:53:14,http://pbs.twimg.com/profile_images/1443802878737625116/IWF964ln.jpg
