Contenido,IR,Fecha,Dispositivo,Likes,Retweets,Entidad,Hora,Foto
"Distribución de los casos de #COVID19 por provincias y comarcas.
Martes 10 de agosto de 2021.
#ProtégetePanamá… https://t.co/hsHNJygjtX",https://twitter.com/i/web/status/1425275502533750789,10/08/2021 19:58:54,Twitter Web App,5,3,Ministerio de Salud de Panamá,19:58:54,http://pbs.twimg.com/profile_images/1410465327176093700/iboqeGBN.jpg
Desglose de corregimientos con más casos en el país para el 10 de agosto de 2021. #UnPanamáMejor #ProtégetePanamá https://t.co/6aIXyU7RYf,https://twitter.com/i/web/status/1425275549442875401,10/08/2021 19:59:05,Twitter Web App,14,8,Ministerio de Salud de Panamá,19:59:05,http://pbs.twimg.com/profile_images/1410465327176093700/iboqeGBN.jpg
#BocasDelToro | Colaboradores de Promoción de la Salud se desplazan a puntos de vacunación para distribuir afiches… https://t.co/dThoPwEYYY,https://twitter.com/i/web/status/1425441874790207498,11/08/2021 07:00:01,Twitter Web App,9,0,Ministerio de Salud de Panamá,07:00:01,http://pbs.twimg.com/profile_images/1410465327176093700/iboqeGBN.jpg
#LosSantos | El Departamento de Control de Vectores mantiene vigilancia permanente en predios y residencias de los… https://t.co/DphOhQXdmE,https://twitter.com/i/web/status/1425456979837820931,11/08/2021 08:00:02,Twitter Web App,6,1,Ministerio de Salud de Panamá,08:00:02,http://pbs.twimg.com/profile_images/1410465327176093700/iboqeGBN.jpg
"Las vacunas contra el #COVID19 son seguras y eficacez, todas han seguido las fases de estudios clínicos que tienen… https://t.co/skuFILfyY7",https://twitter.com/i/web/status/1425456998204780546,11/08/2021 08:00:06,Twitter for Android,20,11,Ministerio de Salud de Panamá,08:00:06,http://pbs.twimg.com/profile_images/1410465327176093700/iboqeGBN.jpg
El proceso de vacunación en los hospitales privados  para toda la población desde los 16 años avanza satisfactoriam… https://t.co/BpXo1EWHxM,https://twitter.com/i/web/status/1425472079814664198,11/08/2021 09:00:02,Twitter Web App,10,1,Ministerio de Salud de Panamá,09:00:02,http://pbs.twimg.com/profile_images/1410465327176093700/iboqeGBN.jpg
"📍Centros de vacunación habilitados en el circuito 4-4.

Vacunación por barrido contra el #COVID19. (Pfizer💉)
✅Pobla… https://t.co/HVGwP5RXU4",https://twitter.com/i/web/status/1425489121758302208,11/08/2021 10:07:45,Twitter for Android,15,5,Ministerio de Salud de Panamá,10:07:45,http://pbs.twimg.com/profile_images/1410465327176093700/iboqeGBN.jpg
🌎 Me complace anunciar que la OPS está ofreciendo a nuestros Estados Miembros una nueva oportunidad de acceder a la… https://t.co/6Z5oiDLb1q,https://twitter.com/i/web/status/1425489885587202060,11/08/2021 10:10:47,Twitter Web App,24,23,OPS/OMS,10:10:47,http://pbs.twimg.com/profile_images/1096094749902028801/ijbQWupW.png
El Fondo Rotatorio está recibiendo solicitudes de países de la región para 💉COVID-19 para los últimos tres meses de… https://t.co/uFXhEV8EE6,https://twitter.com/i/web/status/1425490176189534210,11/08/2021 10:11:56,Twitter Web App,4,4,OPS/OMS,10:11:56,http://pbs.twimg.com/profile_images/1096094749902028801/ijbQWupW.png
El Fondo Rotatorio es un mecanismo para proporcionar 💉💉 de alta calidad a precios competitivos que los países puede… https://t.co/8826sJx3zV,https://twitter.com/i/web/status/1425490924927344643,11/08/2021 10:14:55,Twitter Web App,3,1,OPS/OMS,10:14:55,http://pbs.twimg.com/profile_images/1096094749902028801/ijbQWupW.png
Esta nueva iniciativa pondrá a disposición decenas de millones de dosis de 💉vacuna COVID-19 más allá del 20 por cie… https://t.co/WcdkPzwlTo,https://twitter.com/i/web/status/1425492261316567042,11/08/2021 10:20:14,Twitter Web App,5,7,OPS/OMS,10:20:14,http://pbs.twimg.com/profile_images/1096094749902028801/ijbQWupW.png
"🌎 Es una iniciativa que beneficiará a todos los países de la región, pero especialmente a aquellos que carecen de l… https://t.co/94rU9buZRh",https://twitter.com/i/web/status/1425492550736044036,11/08/2021 10:21:23,Twitter Web App,7,8,OPS/OMS,10:21:23,http://pbs.twimg.com/profile_images/1096094749902028801/ijbQWupW.png
🌎 Nuestra región debe seguir todas las vías posibles para acelerar el acceso y garantizar que los países alcancen s… https://t.co/xiekjV9KVs,https://twitter.com/i/web/status/1425492991121240071,11/08/2021 10:23:08,Twitter Web App,4,2,OPS/OMS,10:23:08,http://pbs.twimg.com/profile_images/1096094749902028801/ijbQWupW.png
🌎 Todavía necesitamos más 💉donaciones; y todavía necesitamos que COVAX cumpla con su compromiso original - @DirOPSPAHO #COVID19,https://twitter.com/i/web/status/1425493394147655688,11/08/2021 10:24:44,Twitter Web App,0,2,OPS/OMS,10:24:44,http://pbs.twimg.com/profile_images/1096094749902028801/ijbQWupW.png
También necesitamos crear nuevas oportunidades que satisfagan las diversas necesidades de nuestros Estados Miembros… https://t.co/7dlPNfIC55,https://twitter.com/i/web/status/1425493742681837568,11/08/2021 10:26:07,Twitter Web App,1,1,OPS/OMS,10:26:07,http://pbs.twimg.com/profile_images/1096094749902028801/ijbQWupW.png
"🌎 Ésta ha sido durante mucho tiempo la misión de la OPS y su Fondo Rotatorio, y nos comprometemos a trabajar incans… https://t.co/eNOKTM4aKB",https://twitter.com/i/web/status/1425494386813591559,11/08/2021 10:28:40,Twitter Web App,1,2,OPS/OMS,10:28:40,http://pbs.twimg.com/profile_images/1096094749902028801/ijbQWupW.png
📢 Presentación: Informe - Las juventudes latinoamericanas y caribeñas y la Agenda 2030 para el Desarrollo Sostenibl… https://t.co/Bmkz4N3qsc,https://twitter.com/i/web/status/1425494723238666240,11/08/2021 10:30:01,Twitter Web App,4,2,OPS/OMS,10:30:01,http://pbs.twimg.com/profile_images/1096094749902028801/ijbQWupW.png
"Cientos de personas desde los 16 años de edad con previa cita generada, se han acercado al centro de vacunación con… https://t.co/1GFtm2QS2W",https://twitter.com/i/web/status/1425529480936927233,11/08/2021 12:48:07,Twitter for Android,6,3,Ministerio de Salud de Panamá,12:48:07,http://pbs.twimg.com/profile_images/1410465327176093700/iboqeGBN.jpg
"📍Centros de vacunación habilitados en el circuito 4-6.

Vacunación por barrido contra el #COVID19. (Pfizer💉)
✅Pobla… https://t.co/9gBYTvObOh",https://twitter.com/i/web/status/1425537924859416581,11/08/2021 13:21:41,Twitter Web App,6,0,Ministerio de Salud de Panamá,13:21:41,http://pbs.twimg.com/profile_images/1410465327176093700/iboqeGBN.jpg
"Alrededor de 14,000 personas serán inmunizadas contra el #COVID19 en estos 5 días de vacunación en el Colegio Elena… https://t.co/XlxxRwYWxd",https://twitter.com/i/web/status/1425554890345099264,11/08/2021 14:29:06,Twitter Web App,0,0,Ministerio de Salud de Panamá,14:29:06,http://pbs.twimg.com/profile_images/1410465327176093700/iboqeGBN.jpg
