Contenido,IR,Fecha,Dispositivo,Likes,Retweets,Entidad,Hora,Foto
"🌎  Juntos, podemos cambiar la forma en que entendemos, prevenimos y tratamos la obesidad.  

✅  Hoy es el… https://t.co/Wnplh3tMm3",https://twitter.com/i/web/status/1499746487395237892,04/03/2022 08:00:01,Twitter Web App,28,14,OPS/OMS,08:00:01,http://pbs.twimg.com/profile_images/1096094749902028801/ijbQWupW.png
"🌎 En la región de las Américas, las tasas de #obesidad casi se han triplicado desde 1975 y se han ⬆️ casi 5️⃣ veces… https://t.co/uaDy9YcliQ",https://twitter.com/i/web/status/1499748197694062592,04/03/2022 08:06:48,Twitter for iPhone,3,3,OPS/OMS,08:06:48,http://pbs.twimg.com/profile_images/1096094749902028801/ijbQWupW.png
"🌎 Desde hace 20 años, el sobrepeso infantil ha ido en ⬆️ en la región, y en 2020, 3,9 millones de niños y niñas ten… https://t.co/VmUQCM93ew",https://twitter.com/i/web/status/1499748198860079104,04/03/2022 08:06:49,Twitter for iPhone,4,3,OPS/OMS,08:06:49,http://pbs.twimg.com/profile_images/1096094749902028801/ijbQWupW.png
"⏭️ 7,5 por ciento de los niños &lt; de 5️⃣ años de las 🌎 tiene sobrepeso, casi 2️⃣ puntos % por encima del promedio mu… https://t.co/PtwTvgvFVT",https://twitter.com/i/web/status/1499748200013520904,04/03/2022 08:06:49,Twitter for iPhone,5,2,OPS/OMS,08:06:49,http://pbs.twimg.com/profile_images/1096094749902028801/ijbQWupW.png
"➡️ ¿Cómo se desarrolla la inmunidad cuando estamos infectados con #COVID19 ? 
➡️ ¿En qué se diferencia de la inmuni… https://t.co/bXfctIdJAd",https://twitter.com/i/web/status/1499754191098716167,04/03/2022 08:30:37,Twitter Media Studio,29,20,OPS/OMS,08:30:37,http://pbs.twimg.com/profile_images/1096094749902028801/ijbQWupW.png
"🚨""La atención posterior a la violación se ha visto particularmente afectada por la pandemia: es inaceptable que las… https://t.co/rdI9PlMCcQ",https://twitter.com/i/web/status/1499799332899500034,04/03/2022 11:30:00,Twitter Media Studio,9,2,OPS/OMS,11:30:00,http://pbs.twimg.com/profile_images/1096094749902028801/ijbQWupW.png
"RT @panaftosa_inf: El uso de medicamentos antimicrobianos 💊 en la salud humana👩🏿‍⚕️ , animal 🐷y el medioambiente🌳 acelera la aparición de b…",https://twitter.com/i/web/status/1499822217714184199,04/03/2022 13:00:56,Twitter for iPhone,0,10,OPS/OMS,13:00:56,http://pbs.twimg.com/profile_images/1096094749902028801/ijbQWupW.png
"🛎️ En el primer año de la pandemia por COVID-19, la prevalencia mundial de la ansiedad y la depresión aumentó un 25… https://t.co/VezWjKLqS4",https://twitter.com/i/web/status/1499876771268812804,04/03/2022 16:37:43,TweetDeck,98,60,OPS/OMS,16:37:43,http://pbs.twimg.com/profile_images/1096094749902028801/ijbQWupW.png
"#COVID19 la enfermedad causada por ómicron 🦠 puede ser leve o grave.

Para algunas personas, los síntomas pueden in… https://t.co/ontx5hR9Jn",https://twitter.com/i/web/status/1500181944310583308,05/03/2022 12:50:22,Twitter for iPhone,46,30,OPS/OMS,12:50:22,http://pbs.twimg.com/profile_images/1096094749902028801/ijbQWupW.png
"La Ministra, @ivetteodalys en la gira de trabajo del Pdte. en Coclé, hizo entrega de equipos de desinfección, insum… https://t.co/dhMD15Ckbf",https://twitter.com/i/web/status/1500245815637512196,05/03/2022 17:04:10,Twitter Web App,5,2,Ministerio de Salud de Panamá,17:04:10,http://pbs.twimg.com/profile_images/1477447837076148227/8U6oii3Y.jpg
"La Dra. Berrío además hizo entrega de:
✅5 unidades de clorinadores de línea
✅3,000 pastillas de hipoclorito de calc… https://t.co/rHTrEyd6pa",https://twitter.com/i/web/status/1500245825737400322,05/03/2022 17:04:12,Twitter Web App,1,0,Ministerio de Salud de Panamá,17:04:12,http://pbs.twimg.com/profile_images/1477447837076148227/8U6oii3Y.jpg
#UnidosLoHacemos https://t.co/svuLG2VX6k,https://twitter.com/i/web/status/1500246538337107973,05/03/2022 17:07:02,Twitter Web App,1,0,Ministerio de Salud de Panamá,17:07:02,http://pbs.twimg.com/profile_images/1477447837076148227/8U6oii3Y.jpg
"Durante la gira de #TrabajoComunitario a la provincia de Coclé, la Ministra de Salud encargada, @ivetteodalys, Cocl… https://t.co/S87gkYZwKg",https://twitter.com/i/web/status/1500257704060850176,05/03/2022 17:51:24,Twitter for Android,2,2,Ministerio de Salud de Panamá,17:51:24,http://pbs.twimg.com/profile_images/1477447837076148227/8U6oii3Y.jpg
"Esta obra tiene más del 74% de avance, por un costo de B/. 5,047,254.29 balboas, beneficiando a una población de 11… https://t.co/GmsL1puGCY",https://twitter.com/i/web/status/1500257708527783941,05/03/2022 17:51:25,Twitter for Android,1,0,Ministerio de Salud de Panamá,17:51:25,http://pbs.twimg.com/profile_images/1477447837076148227/8U6oii3Y.jpg
"El virus de la #COVID19 se propaga principalmente entre personas en contacto estrecho entre sí.

Se propaga con may… https://t.co/pHokbTbplY",https://twitter.com/i/web/status/1500264864224325638,05/03/2022 18:19:51,Twitter for iPhone,23,15,OPS/OMS,18:19:51,http://pbs.twimg.com/profile_images/1096094749902028801/ijbQWupW.png
Comunicado N° 739 #UnPanamáMejor🇵🇦 #ProtégetePanamá https://t.co/RVfYvGOyG4,https://twitter.com/i/web/status/1500270935978524678,05/03/2022 18:43:59,Twitter Web App,1,0,Ministerio de Salud de Panamá,18:43:59,http://pbs.twimg.com/profile_images/1477447837076148227/8U6oii3Y.jpg
"Compartimos la actualización de datos sobre #COVID19 en nuestro país. 
Sábado 5 de marzo de 2022. Parte 1.… https://t.co/9wOD3hIBRW",https://twitter.com/i/web/status/1500270983663476740,05/03/2022 18:44:10,Twitter Web App,2,3,Ministerio de Salud de Panamá,18:44:10,http://pbs.twimg.com/profile_images/1477447837076148227/8U6oii3Y.jpg
"Compartimos la actualización de datos sobre #COVID19 en nuestro país. 
Sábado 5 de marzo de 2022. Parte 2.… https://t.co/PBsMFY707B",https://twitter.com/i/web/status/1500270989636251655,05/03/2022 18:44:12,Twitter Web App,1,3,Ministerio de Salud de Panamá,18:44:12,http://pbs.twimg.com/profile_images/1477447837076148227/8U6oii3Y.jpg
"Distribución de los casos de #COVID19 por provincias y comarcas.
Sábado 5 de marzo de 2022.
#ProtégetePanamá… https://t.co/8zpDLTAE2l",https://twitter.com/i/web/status/1500270995373969413,05/03/2022 18:44:13,Twitter Web App,1,3,Ministerio de Salud de Panamá,18:44:13,http://pbs.twimg.com/profile_images/1477447837076148227/8U6oii3Y.jpg
Desglose de corregimientos con más casos en el país para el 5 de marzo de 2022. #UnPanamáMejor #ProtégetePanamá https://t.co/o9xHwRIzSe,https://twitter.com/i/web/status/1500271049656709121,05/03/2022 18:44:26,Twitter Web App,6,0,Ministerio de Salud de Panamá,18:44:26,http://pbs.twimg.com/profile_images/1477447837076148227/8U6oii3Y.jpg
