Contenido,IR,Fecha,Dispositivo,Likes,Retweets,Entidad,Hora,Foto
"RT @opsomsnic: #Nicaragua 🇳🇮recibe 333,700 #vacunasCOVID 💉 segunda donación de España 🇪🇸, a través de #COVAX.  Un compromiso con la #equida…",https://twitter.com/i/web/status/1433889884037595138,03/09/2021 14:29:23,Twitter for iPhone,0,5,OPS/OMS,14:29:23,http://pbs.twimg.com/profile_images/1096094749902028801/ijbQWupW.png
"RT @opsomsnic: El Fondo Rotatorio de la OPS, coordinó el envío de las 333,700 dosis de vacunas AstraZeneca donadas por el Gobierno de Españ…",https://twitter.com/i/web/status/1433907423987871744,03/09/2021 15:39:05,Twitter for iPhone,0,9,OPS/OMS,15:39:05,http://pbs.twimg.com/profile_images/1096094749902028801/ijbQWupW.png
"La lutte contre la #COVID19 est plus que jamais une priorité.

Nous continuons à étendre nos activités de dépistage… https://t.co/ENicyT6HfS",https://twitter.com/i/web/status/1434180738904174592,04/09/2021 09:45:08,Twitter Web App,2,1,OPS/OMS,09:45:08,http://pbs.twimg.com/profile_images/1096094749902028801/ijbQWupW.png
"RT @opsomsnic: #LlegaronMásVacunas 💉 
#Nicaragua 🇳🇮 

333,700 dosis de vacunas AZ donadas por España 🇪🇸 
gracias al esfuerzo conjunto de do…",https://twitter.com/i/web/status/1434184259909062661,04/09/2021 09:59:08,Twitter for iPhone,0,6,OPS/OMS,09:59:08,http://pbs.twimg.com/profile_images/1096094749902028801/ijbQWupW.png
Las variantes se identifican con la toma de muestras de personas contagiadas por COVID-19 en diferentes países y re… https://t.co/unyV2r0R5m,https://twitter.com/i/web/status/1434204938243121152,04/09/2021 11:21:18,Twitter for iPhone,91,48,OPS/OMS,11:21:18,http://pbs.twimg.com/profile_images/1096094749902028801/ijbQWupW.png
Seguirle los pasos al virus 🔎 🦠 es clave para detectar cualquier cambio en su comportamiento y tomar las medidas ad… https://t.co/wtQGL04pqZ,https://twitter.com/i/web/status/1434204943846682631,04/09/2021 11:21:19,Twitter for iPhone,12,9,OPS/OMS,11:21:19,http://pbs.twimg.com/profile_images/1096094749902028801/ijbQWupW.png
"Las 🩹 vacunas no pueden ✋🏽 detener la COVID-19 🦠 por sí solas, pero al hacerlo todo, podemos marcar la diferencia.… https://t.co/Eq8cY10gcI",https://twitter.com/i/web/status/1434569759803203592,05/09/2021 11:30:58,Twitter Web App,82,50,OPS/OMS,11:30:58,http://pbs.twimg.com/profile_images/1096094749902028801/ijbQWupW.png
RT @opsomsnic: #Comparte La OPS apoya a la ampliación del acceso a vacunas COVID-19 mediante su Fondo Rotatorio que tiene más de 42 años de…,https://twitter.com/i/web/status/1434621587953696781,05/09/2021 14:56:55,Twitter for iPhone,0,11,OPS/OMS,14:56:55,http://pbs.twimg.com/profile_images/1096094749902028801/ijbQWupW.png
"""Por medio de una novedosa herramienta informática, llevaremos medicamentos e insumos a áreas de difícil acceso."" p… https://t.co/GoInyXtxS5",https://twitter.com/i/web/status/1434671343950352385,05/09/2021 18:14:37,Twitter for Android,4,1,Ministerio de Salud de Panamá,18:14:37,http://pbs.twimg.com/profile_images/1410465327176093700/iboqeGBN.jpg
Comunicado N° 558 #UnPanamáMejor🇵🇦 #ProtégetePanamá https://t.co/jCrAepH1f2,https://twitter.com/i/web/status/1434702168037146627,05/09/2021 20:17:06,Twitter Web App,1,5,Ministerio de Salud de Panamá,20:17:06,http://pbs.twimg.com/profile_images/1410465327176093700/iboqeGBN.jpg
"Compartimos la actualización de datos sobre #COVID19 en nuestro país. 
Domingo 5 de septiembre de 2021. Parte 1.… https://t.co/PNRfmBj1Q6",https://twitter.com/i/web/status/1434702460464111616,05/09/2021 20:18:16,Twitter Web App,8,4,Ministerio de Salud de Panamá,20:18:16,http://pbs.twimg.com/profile_images/1410465327176093700/iboqeGBN.jpg
"Compartimos la actualización de datos sobre #COVID19 en nuestro país. 
Domingo 5 de septiembre de 2021. Parte 2.… https://t.co/NA5xecVok5",https://twitter.com/i/web/status/1434702466550018050,05/09/2021 20:18:18,Twitter Web App,3,1,Ministerio de Salud de Panamá,20:18:18,http://pbs.twimg.com/profile_images/1410465327176093700/iboqeGBN.jpg
"Distribución de los casos de #COVID19 por provincias y comarcas.
Domingo 5 de septiembre de 2021.
#ProtégetePanamá… https://t.co/jx6UgOCuM2",https://twitter.com/i/web/status/1434702472937881602,05/09/2021 20:18:19,Twitter Web App,1,1,Ministerio de Salud de Panamá,20:18:19,http://pbs.twimg.com/profile_images/1410465327176093700/iboqeGBN.jpg
Desglose de corregimientos con más casos en el país para el 5 de septiembre de 2021. #UnPanamáMejor #ProtégetePanamá https://t.co/uNuVyIBawk,https://twitter.com/i/web/status/1434702743420260352,05/09/2021 20:19:24,Twitter Web App,15,8,Ministerio de Salud de Panamá,20:19:24,http://pbs.twimg.com/profile_images/1410465327176093700/iboqeGBN.jpg
"¿Cómo se generan las variantes 🦠 y qué podemos hacer para 🛑 frenarlas y protegernos? 

Mira en este video 👇 cómo pu… https://t.co/beCyzgRpQy",https://twitter.com/i/web/status/1434896917117521928,06/09/2021 09:10:58,Twitter Web App,49,87,OPS/OMS,09:10:58,http://pbs.twimg.com/profile_images/1096094749902028801/ijbQWupW.png
"La enfermedad cardiovascular es la principal causa de muerte a nivel mundial, por lo que realizamos con… https://t.co/Nb22zA2RFf",https://twitter.com/i/web/status/1434946946284851209,06/09/2021 12:29:46,Twitter Web App,9,3,Ministerio de Salud de Panamá,12:29:46,http://pbs.twimg.com/profile_images/1410465327176093700/iboqeGBN.jpg
"Nos unimos contra la Trata de Personas, con el objetivo de concienciar a la población contra este delito, así como… https://t.co/Z9IAqlj3Bo",https://twitter.com/i/web/status/1434948260112838656,06/09/2021 12:34:59,Twitter Web App,6,3,Ministerio de Salud de Panamá,12:34:59,http://pbs.twimg.com/profile_images/1410465327176093700/iboqeGBN.jpg
#UnidosLoHacemos https://t.co/5qJ6PGSuYD,https://twitter.com/i/web/status/1434948265900904448,06/09/2021 12:35:01,Twitter Web App,4,3,Ministerio de Salud de Panamá,12:35:01,http://pbs.twimg.com/profile_images/1410465327176093700/iboqeGBN.jpg
"La iniciativa HEARTS en las Américas está ayudando a países como ￼Cuba y ￼México a salvar vidas.

Conoce más sobre… https://t.co/ydKErWPUlc",https://twitter.com/i/web/status/1434953482327502849,06/09/2021 12:55:44,Twitter for iPhone,5,3,OPS/OMS,12:55:44,http://pbs.twimg.com/profile_images/1096094749902028801/ijbQWupW.png
"⁣En el #MesDelCorazón❤️recordamos la importancia de llevar una vida activa y saludable, realizando actividad física… https://t.co/CKTsOrxHrO",https://twitter.com/i/web/status/1434963570945560583,06/09/2021 13:35:50,Twitter Web App,15,5,Ministerio de Salud de Panamá,13:35:50,http://pbs.twimg.com/profile_images/1410465327176093700/iboqeGBN.jpg
