name,url,description,datePublished,imagen,pais,Fuente
Medidas adoptadas por la banca frente a la crisis mundial por COVID-19,https://elcapitalfinanciero.com/medidas-adoptadas-por-la-banca-frente-a-la-crisis-mundial-por-covid-19/,"La crisis mundial generada por el coronavirus (COVID-19) en Panamá, comenzó en marzo de 2020. La entonces ministra de Salud, doctora Rosario Turner, confirmó el 09 de marzo de 2020 el primer caso de C",04-09-2020 21:38,https://www.bing.com/th?id=ON.6AADA10A22FDF0BA458810E16F5DF25B,Panamá,El Capital Financiero
Se registran 682 casos nuevos de Covid-19 y 17 defunciones,https://www.prensa.com/sociedad/se-registran-682-casos-nuevos-de-covid-19-y-17-defunciones/,"El Ministerio de Salud (Minsa) informó este viernes, 4 de septiembre, que en las últimas horas se registraron en el país 682 casos nuevos de Covid-19 y 17 nuevas defunciones. De acuerdo con el informe",04-09-2020 23:38,https://www.bing.com/th?id=ON.3F1E1D1A46426AD653A865BE105C7E17,Panamá,prensa.com
Verifican protocolos de salud y bioseguridad en Cobre Panamá,https://ensegundos.com.pa/2020/09/04/verifican-protocolos-de-salud-y-bioseguridad-en-cobre-panama/,Dentro de la primera fase de apertura gradual autorizada por el Ministerio de Salud (MINSA) al citado proyecto minero se le autorizó el ingreso tras la reactivación de los contratos laborales de unos,05-09-2020 01:47,https://www.bing.com/th?id=ON.BDDB6EF8972E1A97C332C739D3B449C8,Panamá,En Segundos
"Panamá sumó este viernes 682 nuevos casos de la COVID-19 con un porcentaje de positividad de 13,4%",https://www.panamaamerica.com.pa/sociedad/panama-sumo-este-viernes-682-nuevos-casos-de-la-covid-19-con-un-porcentaje-de-positividad,"Panamá sumó este viernes 682 nuevos casos del coronavirus SARS-CoV-2 y 17 muertes por la enfermedad de la COVID-19, para un acumulado de 95.596 contagios confirmados y 2.063 fallecidos, desde que el p",05-09-2020 02:20,https://www.bing.com/th?id=ON.357B81B0F2D15A5BDBC45C846EFD8BFA,Panamá,panamaamerica.com.pa
"Minsa reporta 2,063 muertos y 95,596 contagios de COVID-19 en Panamá",https://www.critica.com.pa/nacional/minsa-reporta-2063-muertos-y-95596-contagios-de-covid-19-en-panama-587137,"Por su parte, el presidente Laurentino Cortizo; el ministro de Salud, Luis Francisco Sucre y el viceministro de Seguridad, Ivor Pitti, se reunieron con el Equipo Unificado de Trazabalidad (EUT) de Ia",05-09-2020 02:24,https://www.bing.com/th?id=ON.7287FE59836CB7DC13A187501BB00E05,Panamá,Critica
"San Francisco y Tauro, aportan el mayor número de jugadores en la burbuja de Coclé",https://www.tvmax-9.com/somoslasele/San-Francisco-Tauro-jugadores-Cocle_0_5663433699.html,"Día doce y el trabajo no se detiene en el representativo panameño con su rutina enfocada en los entrenamientos, atenciones y descansos. Por lo que, más allá de ello existe un cúmulo de información int",05-09-2020 03:01,https://www.bing.com/th?id=ON.732955019E70BBDB7009CCF883EA7258,Panamá,TVMAX
Panamá reportó un total de 68 muertes por la COVID-19 esta semana,https://www.panamaamerica.com.pa/sociedad/panama-reporto-un-total-de-68-muertes-por-la-covid-19-esta-semana-1171441,"Entre el lunes y viernes de esta semana, Panamá reportó un total de 68 muertes por la COVID-19, para un total de 2,063 defunciones desde que se confirmó el primer caso en el mes de marzo. Versión impr",05-09-2020 05:24,https://www.bing.com/th?id=ON.D07ABB886E17F497BC7311FF2B771E09,Panamá,panamaamerica.com.pa
Trabajo ‘virtual' en el voleibol,http://elsiglo.com.pa/deportes/trabajo-virtual-voleibol/24163561,"Iniciativa. A pesar de las circunstancias difíciles que ha producido el Covid-19, en Panamá, una de las disciplinas que mantiene trabajo virtual e... Iniciativa. A pesar de las circunstancias difícile",05-09-2020 05:30,https://www.bing.com/th?id=ON.1C81CA27C06B7DF86CF1379180BC3677,Panamá,El Siglo
Panamá alcanza 95 mil contagios de covid-19,http://elsiglo.com.pa/panama/panama-alcanza-95-contagios-covid-19/24163559,"El Ministerio de Salud de Panamá  informó que al corte de hoy se registraron 682 nuevos casos de covid-19, con estos el país alcanzó  los 95,596 casos acumulados. En tanto se han reportado 17 nuevas m",05-09-2020 05:30,https://www.bing.com/th?id=ON.C4C2C1942A9BE7DF2A87CF119783452D,Panamá,El Siglo
Presidente Cortizo asegura que se entra en una etapa importante por reaperturas,https://www.diaadia.com.pa/el-pais/presidente-cortizo-asegura-que-se-entra-en-una-etapa-importante-por-reaperturas-370021,"El presidente de la República, Laurentino Cortizo Cohen; el ministro de Salud, Luis Francisco Sucre y el viceministro de Seguridad, Ivor Pittí, se reunieron este viernes con el Equipo Unificado de Tra",05-09-2020 05:52,https://www.bing.com/th?id=ON.3D7AECB5E519AAEDD031CE95F04FA8AB,Panamá,Día a Día
Embajada de Israel dona insumos al Hospital Santo Tomás,https://www.metrolibre.com/nacionales/181077-embajada-de-israel-dona-insumos-al-hospital-santo-tom%C3%A1s.html,"La mañana de este viernes, 4 de septiembre, el embajador de Israel en Panamá Reda Mansour hizo entrega de una donación de implementos de bioseguridad al Hospital Santo Tomás, la cual fue recibida por",05-09-2020 14:14,https://www.bing.com/th?id=ON.FBFDA37421032B429CA4D292C299E5A4,Panamá,Metro Libre
Panamá reporta 682 nuevos casos de COVID-19 y supera los 95 mil contagios,https://www.telemetro.com/nacionales/2020/09/04/panama-reporta-682-nuevos-casos-de-covid-19-y-supera-los-95-mil-contagios/3200993.html,"En las últimas horas se realizaron 5,100 nuevas pruebas para detectar COVID-19 para un 13.4% de positividad. De acuerdo con el informe epidemiológico del Minsa de este viernes 4 de septiembre, hay un",05-09-2020 14:29,https://www.bing.com/th?id=ON.4D070CA1145EDB232CE29B9823FDAE06,Panamá,Telemetro
"Panamá registra 95,596 personas contagiadas de Covid-19 y 68,742 recuperadas",https://www.metrolibre.com/nacionales/181091-panam%C3%A1-registra-95596-personas-contagiadas-de-covid-19-y-68742-recuperadas.html,"Para este viernes, 4 de septiembre, el Ministerio de Salud (Minsa) detalló que se detectaron 682 nuevos casos positivos de Covid-19, para un total acumulado de 95,596. Mientras tanto, se contabilizaro",05-09-2020 15:15,https://www.bing.com/th?id=ON.DE93A0843EC281F84EEF0545413A6F67,Panamá,Metro Libre
"Berlusconi, ""estable"" tras ser hospitalizado por coronavirus",https://ensegundos.com.pa/2020/09/05/berlusconi-estable-tras-ser-hospitalizado-por-coronavirus/,"Berlusconi anunció el miércoles por la noche que había dado positivo por coronavirus, al igual que dos de sus hijos. El estado de salud del exjefe de gobierno italiano Silvio Berlusconi, hospitalizado",05-09-2020 15:41,https://www.bing.com/th?id=ON.E018312EBD05AC0E31E18878E904944E,Panamá,En Segundos
Protestas contra las restricciones contra la COVID-19 en Melbourne,http://www.nexpanama.com/protestas-contra-las-restricciones-contra-la-covid-19-en-melbourne/,La policía arrestó al menos a 17 personas durante enfrentamientos en Melbourne con unos 300 manifestantes que protestaban contra las restricciones impuestas desde julio en el estado de Victoria para c,05-09-2020 15:54,https://www.bing.com/th?id=ON.18A8BCCC0C49E982996DAF49131A8AC0,Panamá,NEX TV
Panamá solo espera por vacuna alemana para iniciar ensayo con 250 voluntarios,https://www.telemetro.com/nacionales/2020/09/05/panama-solo-espera-por-vacuna-alemana-para-iniciar-ensayo-con-250-voluntarios/3201559.html,"Panamá solo espera la llegada de la vacuna del laboratorio alemán CureVac para comenzar, previsiblemente la próxima semana, las inoculaciones de los primeros voluntarios de un estudio de fase 2 para p",05-09-2020 17:43,https://www.bing.com/th?id=ON.9431033936C3552BA51339B2975C3E8C,Panamá,Telemetro
Estados Unidos debe preparar para distribuir una vacuna antes de noviembre,http://www.nexpanama.com/estados-unidos-debe-preparar-para-distribuir-una-vacuna-antes-de-noviembre/,"Los estados de Estados Unidos deben estar preparados para distribuir una vacuna contra el coronavirus antes del primero de noviembre “por si acaso” hay una lista, afirmó el doctor Jerome Adams, ciruja",05-09-2020 17:56,https://www.bing.com/th?id=ON.A2A67E4DABAC5279CF658A0270D226D1,Panamá,NEX TV
Las condiciones con las que se reiniciarán las construcciones en Panamá a partir del lunes,https://www.tvn-2.com/nacionales/condiciones-reiniciaran-construcciones-Panama_0_5664183547.html,"Aunque ya algunas obras de construcción retomaron sus labores en ciertos puntos del país, hay otras que van para los 6 meses de estar paralizadas por efectos de la pandemia de la COVID-19, y este lune",05-09-2020 18:35,https://www.bing.com/th?id=ON.067BD09A306A262E537E244CDE369DBA,Panamá,TVN
"Silvio Berlusconi, ‘estable’ tras ser hospitalizado por el nuevo coronavirus",https://www.prensa.com/mundo/silvio-berlusconi-estable-tras-ser-hospitalizado-por-el-nuevo-coronavirus/,"El estado de salud del exjefe de gobierno italiano Silvio Berlusconi, hospitalizado el jueves por una infección pulmonar causada por la Covid-19, es “estable”, lo que suscita un “optimismo prudente pe",05-09-2020 18:59,https://www.bing.com/th?id=ON.D6EFAEC5310F8E35A4760D786CD69C0C,Panamá,prensa.com
Salud intensifica lucha contra Covid-19 ante nuevas reaperturas el lunes,https://www.critica.com.pa/nacional/salud-intensifica-lucha-contra-covid-19-ante-nuevas-reaperturas-el-lunes-587193,"Funcionarios del Ministerio de Salud continúa la lucha contra el Covid-19, incluyendo los fines de semana. Equipos de Trazabilidad en busca de posibles contagiados y orientación a la población son par",05-09-2020 19:01,https://www.bing.com/th?id=ON.D0E0E2D9AD18C29F5C4B816874C51268,Panamá,Critica
