name,url,description,datePublished,imagen,pais,Fuente
En Costa Rica reconocen mejor estrategia de Panamá para lograr préstamos,https://www.critica.com.pa/nacional/en-costa-rica-reconocen-mejor-estrategia-de-panama-para-lograr-prestamos-589551,"El abogado constitucionalista y exsecretario general del Partido Liberación Nacional (PLN), Fernando Zamora destacó que Panamá -al contrario que su nación Costa Rica- emitió bonos",08-10-2020 12:00,https://www.bing.com/th?id=OVFT.zaEiaI26B2e4Vo0lYaU53C,Panamá,Critica
Panamá cumple siete meses con la pandemia de Covid-19,https://www.metrolibre.com/nacionales/183949-panam%C3%A1-cumple-siete-meses-con-la-pandemia-de-covid-19.html,"En medio de la flexibilización de las restricciones de movilidad, la reapertura de actividades económicas y disminución de los casos de Covid-19, Panamá cumple hoy siete meses desde el reporte oficial",09-10-2020 10:00,https://www.bing.com/th?id=OVFT.-TvIz2-d939NAKZL-RQhcS,Panamá,Metro Libre
El 68 % de los hoteles reabrirá este 2020 en Panamá tras el cierre por COVID-19,https://www.telemetro.com/nacionales/2020/10/09/el-68-de-los-hoteles-reabrira-este-2020-en-panama-tras-el-cierre-por-covid-19/3324706.html,"El 68 % de los hoteles reabrirá en Panamá entre el próximo lunes, cuando se reactivará la aviación internacional tras siete meses de cierre por la pandemia, y diciembre, dijo a EFE el presidente de la",09-10-2020 12:28,https://www.bing.com/th?id=OVFT.snEDK1qb97F4GjSbpF4B_i,Panamá,Telemetro
"Colón convoca al Foro Social Panamá, en el que se identificarán sus retos para el desarrollo integral",https://bayanodigital.com/colon-convoca-al-foro-social-panama-en-el-que-se-identificaran-sus-retos-para-el-desarrollo-integral/,"Uno de los principales retos para el desarrollo integral de Colón es la ejecución del presupuesto de inversión pública. Decenas proyectos habitacionales, acueductos, centros educativos y facilidades d",09-10-2020 12:40,https://www.bing.com/th?id=OVFT.Vl44HPJgrR5wCK5T1XEEMy,Panamá,Bayano Digital
El Gobierno español decreta el estado de alarma en Madrid,http://www.nexpanama.com/el-gobierno-espanol-decreta-el-estado-de-alarma-en-madrid/,"El Gobierno de España decretará el estado de alarma en la región de Madrid para poder restringir el movimiento de los ciudadanos frente al incremento de contagios de COVID-19, dijeron el viernes vario",09-10-2020 12:49,https://www.bing.com/th?id=OVFT.oscED1Fxf0qCVDMB4gYFNC,Panamá,NEX TV
Buena esa. Este año sí habrá graduaciones. Todo será en un lugar amplio y con límite de personas,https://www.midiario.com/nacionales/buena-esa-este-ano-si-habra-graduaciones-todo-sera-en-un-lugar-amplio-y-con-limite-de-personas/,"El ministro de Salud, Luis Francisco Sucre comunicó a la ministra de Educación, Maruja Gorday que acogieron positivamente el proyecto de “Graduación 2020”, s iempre y cuando se cumplan con las medidas",09-10-2020 12:50,https://www.bing.com/th?id=OVFT.dTtgz37CbE_bQZLQQWWVwC,Panamá,Mi Diario
Por un año evaluarán a voluntarios para vacuna contra la COVID-19,https://www.panamaamerica.com.pa/sociedad/por-un-ano-evaluaran-voluntarios-vacuna-contra-covid-19-1173654,"El vicepresidente y director de Investigación de Vacunas para América Latina de GSK, Eduardo Ortega, uno de los candidatos a las pruebas que se están realizando para la primera dosis de la vacuna alem",09-10-2020 12:50,https://www.bing.com/th?id=OVFT.DxJ1gNw0sbyxY01fv0ykti,Panamá,panamaamerica.com.pa
"Hoy inicia el deporte de los panameños, el Campeonato Nacional de Béisbol Mayor 2020",https://www.tvmax-9.com/beisbolnacional/Hoy-Campeonato-Nacional-Beisbol-Mayor_0_5688931152.html,"Bajo un nuevo formato debido a la pandemia COVID-19, para este 2020 se jugará en dos sedes solamente y las novenas están divididas en dos grupos.",09-10-2020 13:08,https://www.bing.com/th?id=OVFT.FfzsI9Q38hck_S93shTPKS,Panamá,TVMAX
Concolón del 9 de octubre de 2020,https://ensegundos.com.pa/2020/10/09/concolon-del-9-de-octubre-de-2020/,"Siete meses Hoy se cumplen siete meses, desde que las autoridades panameñas anunciaron que el covid-19 estaba en el país. En este tiempo hemos pasado estrictas cuarentenas,  anuncios confusos, denunci",09-10-2020 13:40,https://www.bing.com/th?id=OVFT.CF1M6UnQBqCzwPlQZNA6uC,Panamá,En Segundos
Aplican nuevas estrategias en el Metro de Panamá para reducir flujo de usuarios,https://www.tvn-2.com/nacionales/Aplican-estrategias-Metro-Panama-usuarios-COVID-19_0_5689680987.html,"Con el objetivo de garantizar las medidas de bioseguridad en el Metro de Panamá, se aplicarán nuevas estrategias para reducir el flujo de usuarios.",09-10-2020 13:47,https://www.bing.com/th?id=OVFT.ArgdG7bQXvPldiO6pgGD4C,Panamá,TVN
Merkel y alcaldes alemanes a acuerdan medidas más estrictas por COVID-19,http://www.nexpanama.com/merkel-y-alcaldes-alemanes-a-acuerdan-medidas-mas-estrictas-por-covid-19/,"La canciller alemana, Angela Merkel, dijo que junto a los alcaldes de las 11 principales ciudades del país acordó el viernes adoptar medidas más estrictas por el coronavirus si el número de infeccione",09-10-2020 15:41,https://www.bing.com/th?id=OVFT.GQjXDObzr4Qn1eTdSkUrTC,Panamá,NEX TV
Embajada de la República Popular China dona al Parlatino equipos de bioseguridad contra la covid-19,https://www.laestrella.com.pa/nacional/201008/embajada-republica-popular-china-dona-parlatino-equipos-bioseguridad-conta-covid-19,"El embajador Qiang y el Secretario Ejecutivo del Parlatino, resaltaron las sólidas relaciones existentes que datan desde 2004",09-10-2020 15:44,https://www.bing.com/th?id=OVFT.OKO8g6wu66LxWfJYOtpvyS,Panamá,laestrella.com.pa
El dilema de no contar a los desempleados,https://radioreformaseoye.com/nacionales/el-dilema-de-no-contar-a-los-desempleados/,Panamá no sabe cuántos desempleados existen oficialmente en el país. En la actualidad no cuenta con un registro oficial de desempleo. Aunque se han pronosticado más de medio millones de personas sin p,09-10-2020 15:58,https://www.bing.com/th?id=OVFT.VsAlDmW08xzpFaxL2cRrKS,Panamá,Radio Reforma se Oye
Panamá va por cosas positivas ante Costa Rica en San José,http://elsiglo.com.pa/deportes/panama-cosas-positivas-ante-costa-rica-jose/24165622,Las selecciones de Costa Rica y Panamá se enfrentarán este sábado en partido amistoso que significa el regreso a la acción para ambas escuadras luego de 7 meses sin jugar debido a la pandemia de la CO,09-10-2020 16:24,https://www.bing.com/th?id=OVFT.Wac3KuvpROQ-TQ7KAmQely,Panamá,El Siglo
Muestra de Cine Indígena en Panamá llegará de manera virtual,https://www.tvn-2.com/variedad/cine-y-tv/Muestra-Cine-Indigena-Panama-llegara_0_5689681008.html,"Debido a la situación sanitaria generada por la COVID-19, Jumara Festival se llevará a cabo excepcionalmente en modalidad online desde la página web del festival www.festivaljumara.org, informaron los",09-10-2020 16:45,https://www.bing.com/th?id=OVFT.dZWtdDsxkDXg0E8ShlWHVC,Panamá,TVN
En modo burbuja arranca este viernes el Campeonato de Béisbol Mayor Copa Banco Nacional,http://www.rpctv.com/deportes/beisbol/burbuja-arranca-viernes-Beisbol-Nacional_0_1399360051.html,Su majestad el béisbol entra en escena este viernes 9 de octubre con un torneo especial en medio de la pandemia de la covid-19 pero guardando,09-10-2020 16:51,https://www.bing.com/th?id=OVFT.l-TsK-MH0f1dAjrACdniCC,Panamá,RPCTV
"Empleo post covid-19, emprendimiento e informalidad",https://www.laestrella.com.pa/economia/201009/post-covid-19-emprendimiento,"Para los especialistas laborales, el emprendimiento es y seguirá siendo el motor del empleo. Su evolución reciente plantea una nueva cara de la informalidad, cuyo perfil es imperante entender",09-10-2020 17:03,https://www.bing.com/th?id=OVFT.xqa5RpSFjrWOy4eNsiQHdi,Panamá,laestrella.com.pa
Costa Rica y Panamá vuelven a la acción tras siete meses de pandemia,https://www.tvmax-9.com/somoslasele/Costa-Rica-Panama-vuelven-pandemia_0_5689681014.html,Las selecciones de Costa Rica y Panamá se enfrentarán este sábado en partido amistoso que significa el regreso a la acción para ambas escuadras luego de 7 meses sin jugar debido a la pandemia de la CO,09-10-2020 17:06,https://www.bing.com/th?id=OVFT.ENsVaypAWFqkplK5Pvl3Wy,Panamá,TVMAX
"Peloteros podrán estar sin mascarilla dentro del campo de juego; su uso será obligatorio en dugout, buses y hoteles",https://www.prensa.com/deportes/peloteros-podran-estar-sin-mascarilla-dentro-del-campo-de-juego-su-uso-sera-obligatorio-en-dugout-buses-y-hoteles/,"Los peloteros que participen de la versión 77 del campeonato nacional de béisbol mayor de Panamá no tendrán que utilizar las mascarillas en el terreno de juego. Sin embargo, el uso de esta protección",09-10-2020 17:19,https://www.bing.com/th?id=OVFT.7FmiQ9QBYApyAm0T64Sdli,Panamá,prensa.com
"Mueren dos migrantes en Darién, uno por causa de Covid-19",https://www.critica.com.pa/sucesos/mueren-dos-migrantes-en-darien-uno-por-causa-de-covid-19-589682,"El Gobierno Nacional y el Servicio Nacional de Migración han sido consecuentes con su responsabilidad hacia los migrantes que se encuentran en territorio panameño, así como los que llegan a través de",09-10-2020 17:49,https://www.bing.com/th?id=OVFT.4FLnCKBKAe7MYY8YIm-fSy,Panamá,Critica
"Fallecen dos migrantes en Darién, uno de ellos por Covid-19",https://www.metrolibre.com/provincias/184002-fallecen-dos-migrantes-en-dari%C3%A9n-uno-de-ellos-por-covid-19.html,"El Servicio Nacional de Migración (SNM) informó que dos migrantes que ingresaron al país procedentes de Colombia entre el 1 y 2 de octubre, a través de la selva de Darién fallecieron en el área fronte",09-10-2020 17:56,https://www.bing.com/th?id=OVFT.6jjuuOmosx9ueNAi5kvPmC,Panamá,Metro Libre
El 68 % de los hoteles reabrirá este año en Panamá tras el cierre por COVID,https://www.panamaamerica.com.pa/economia/68-hoteles-reabrira-este-ano-en-panama-tras-cierre-por-covid-1173671,"El 68 % de los hoteles reabrirá en Panamá entre el próximo lunes , cuando se reactivará la aviación internacional tras siete meses de cierre por la pandemia, y diciembre, dijo este jueves a EFE el pre",09-10-2020 18:12,https://www.bing.com/th?id=OVFT.GKgNsA1szLU3-6tnKSymly,Panamá,panamaamerica.com.pa
Dos migrantes pierden la vida en el área fronteriza,http://elsiglo.com.pa/panama/migrantes-pierden-vida-area-fronteriza/24165630,"El Servicio Nacional de Migración (SNM) informó que dos migrantes que ingresaron al país procedentes de Colombia entre el 1 y 2 de octubre de 2020, a través de la selva de Darién perdieron la vida en",09-10-2020 18:13,https://www.bing.com/th?id=OVFT.NKUgH18NMoKNgKKgqE8RvC,Panamá,El Siglo
"Actos de graduación 2020 serán ""voluntarios de cada comunidad educativa"", dice Meduca",https://www.telemetro.com/nacionales/2020/10/09/actos-graduacion-seran-voluntarios-comunidad/3327616.html,"La ministra de Educación (Meduca) de Panamá, Maruja Gorday de Villalobos, informó este viernes que será una decisión voluntaria “de cada comunidad educativa”, la realización de actos de graduación 202",09-10-2020 18:37,https://www.bing.com/th?id=OVFT.yXJ1EP0p6n706-C8jYp5US,Panamá,Telemetro
Banco Mundial espera una caída de -8.1% de la economía panameña al cierre de 2020,https://elcapitalfinanciero.com/banco-mundial-espera-una-caida-de-8-1-de-la-economia-panamena-al-cierre-de-2020/,Tanto en el mes de marzo como en el de junio del presente año las proyecciones de crecimiento del Banco Mundial ubicaban a Panamá como una de las economías de América Latina y el Caribe que se verían,09-10-2020 19:56,https://www.bing.com/th?id=OVFT.hSCDZbZW5kxZjyvsHczR2S,Panamá,El Capital Financiero
Segunda ola del coronavirus se expande a gran velocidad por Europa,https://www.radiopanama.com.pa/noticias/internacional/segunda-ola-del-coronavirus-se-expande-a-gran-velocidad-por-europa/20201009/nota/4076580.aspx,"En solo tres semanas, el virus ha causado innumerables casos de rebrotes, que generado una avalancha de contagios en el viejo continente.",09-10-2020 21:03,https://www.bing.com/th?id=OVFT.U5aKDYpkHePXVNpXvKWW7y,Panamá,Radio Panamá
Bloqueos aumentan costos logísticos y alteran recuperación económica,https://ensegundos.com.pa/2020/10/09/bloqueos-aumentan-costos-logisticos-y-alteran-recuperacion-economica/,"Exportaciones e importaciones por carretera están paralizadas debido a que persisten condiciones de bloqueos en suelo tico. La reapertura de las actividades en la Zona Libre de Colón, sembraron una lu",09-10-2020 21:04,https://www.bing.com/th?id=OVFT.SwvcWoO__JVbc19lO6YXhC,Panamá,En Segundos
Banco Mundial estima caída del 8.3% de la economía panameña para 2020,https://www.prensa.com/economia/banco-mundial-estima-caida-del-83-de-la-economia-panamena-para-2020/,El Banco Mundial (BM) reveló sus proyecciones económicas para los países latinoamericanos y Panamá aparece con una contracción de 8.3% debido a la pandemia respiratoria del coronavirus,09-10-2020 21:49,https://www.bing.com/th?id=OVFT.bS0Iisd4os1IGLuolVNCtC,Panamá,prensa.com
"Mueren dos migrantes en la frontera de Panamá con Colombia, uno por COVID-19",https://www.diaadia.com.pa/el-pais/mueren-dos-migrantes-en-la-frontera-de-panama-con-colombia-uno-por-covid-19-371194,"Dos migrantes irregulares, un mauritano y un haitiano, que entraron este mes a Panamá por la selva del Darién, fronteriza con Colombia, fallecieron, uno de ellos por COVID-19, informó este viernes el Servicio Nacional de Migración panameño.",09-10-2020 22:02,https://www.bing.com/th?id=OVFT.fTGWOpMuFRi6k7_IkDNMOS,Panamá,Día a Día
