name,url,description,datePublished,imagen,pais,Fuente
Reapertura de vuelos internacionales,https://www.radiopanama.com.pa/temas/reapertura-de-vuelos-internacionales/temas/21807.aspx,Actualidad Sin Filtro: Empresas sancionadas por el Banco Mundial siguen contratando con el gobierno panameño; Actualidad Sin Filtro: CSS estaría comprando medicamentos con sobre,12-10-2020 22:26,https://www.bing.com/th?id=OVFT.U5aKDYpkHePXVNpXvKWW7y,Panamá,Radio Panamá
Detained Panama seafarers claim rights abuse,https://www.newsroompanama.com/news/detained-panama-seafarers-claim-rights-abuse,"Panama flagged Star Balboa remains in Trinidad and Tobago, where 17 crew members are linked to three alleged crimes: drug trafficking, drug and ammunition traf",12-10-2020 22:35,https://www.bing.com/th?id=OVFT.rZtJ7OMMTlZNvRuG25K9Mi,Panamá,Newsroom Panama
"Prueba de Covid-19 de Trump da resultado negativo, dice el médico de la Casa Blanca",https://www.prensa.com/mundo/prueba-de-covid-19-de-trump-da-resultado-negativo-dice-el-medico-de-la-casa-blanca/,"El presidente estadounidense, Donald Trump, dio negativo para Covid-19 por “varios días consecutivos” a través de una prueba rápida, dijo este lunes 12 de octubre el médico de la Casa",12-10-2020 22:46,https://www.bing.com/th?id=OVFT.5DStekszoYaGxSPlhy73Gy,Panamá,prensa.com
"Panamá mantiene a 20,825 personas en aislamiento domiciliario por Covid-19",https://ensegundos.com.pa/2020/10/12/panama-mantiene-a-20825-personas-en-aislamiento-domiciliario-por-covid-19/,"Los hospitalizados suman 800 y de ellos 679 se encuentran en sala y 121 en UCI. El Ministerio de Salud (Minsa), informó este lunes 12 de octubre, que, en Panamá se contabilizan 489 casos positivos nue",12-10-2020 23:26,https://www.bing.com/th?id=OVFT.NPZbJAS43EPHhn9NeSczjy,Panamá,En Segundos
"Se registran 489 casos positivos nuevos, de covid-19 y un acumulado de 120, 802",http://elsiglo.com.pa/panama/registran489-casos-positivos-nuevos-covid-19-acumulado-120-802/24165835,"Este lunes se contabilizaron 96,675 pacientes recuperados, 489 casos positivos nuevos, para un total acumulado de 120, 802. A la fecha se aplicaron 4,072 pruebas, para un porcentaje de positividad de",12-10-2020 23:34,https://www.bing.com/th?id=OVFT.dA15h1EJGtFh_BubNBCnwi,Panamá,El Siglo
Confirman el primer caso de reinfección por COVID-19 en Estados Unidos,https://lagacetadepanama.com/confirman-el-primer-caso-de-reinfeccion-por-covid-19-en-estados-unidos/,"Un estudio difundido este lunes por The Lancet confirma el primer caso de reinfección por COVID-19 detectado en un paciente de Estados Unidos, lo que sugiere que la exposición al virus no se traduce n",12-10-2020 23:37,https://www.bing.com/th?id=OVFT.Llr0KexH-kYwkXPInVjShC,Panamá,La Gaceta de Panama
"Trump ha dado negativo para COVID-19 y no es contagioso, según su médico",https://lagacetadepanama.com/trump-ha-dado-negativo-para-covid-19-y-no-es-contagioso-segun-su-medico/,"El presidente de Estados Unidos, Donald Trump, ha dado negativo en COVID-19 y no es contagioso, informó este lunes su médico en la Casa Blanca, Sean Conley. En un memorándum difundido por la Casa Blan",12-10-2020 23:40,https://www.bing.com/th?id=OVFT.KBDEUgM1gnxZbKfYypG2eC,Panamá,La Gaceta de Panama
Panamá reporta 11 defunciones y 489 casos positivos nuevos de COVID-19,https://www.critica.com.pa/nacional/panama-reporta-11-defunciones-y-489-casos-positivos-nuevos-de-covid-19-589900,"Para hoy lunes, Panamá contabiliza 489 casos positivos nuevos, para un total acumulado de 120, 802 y se han registrado 11 nuevas defunciones, que totalizan 2,502 acumuladas, lo que representa una leta",12-10-2020 23:44,https://www.bing.com/th?id=OVFT.PLouNN6A2iqbtRvRAY6ObC,Panamá,Critica
Evolución de los casos y defunciones por COVID-19 en Panamá,https://www.telemetro.com/nacionales/2020/10/13/evolucion-de-los-casos-y-defunciones-por-covid-19-en-panama/3338008.html,"Conozca cómo ha sido la evolución de casos de COVID-19 en Panamá, así como la cifra de defunciones a causa del virus desde el martes 6 hasta este lunes 12 de octubre.",13-10-2020 00:55,https://www.bing.com/th?id=OVFT.kKL6eMSltQkSP4b27XTKji,Panamá,Telemetro
Los efectos de la COVID-19 en la dinámica demográfica panameña,https://www.panamaamerica.com.pa/opinion/efectos-covid-19-en-dinamica-demografica-panamena-1173860,"Al hablar de los efectos de la COVID-19 en la dinámica poblacional panameña, debemos recordar el efecto coyuntural del enorme gasto social y de crédito que venía arrastrando las finanzas y el erario p",13-10-2020 01:27,https://www.bing.com/th?id=OVFT.wQIuwh4pVvZGTqCMq2LY-y,Panamá,panamaamerica.com.pa
Peligran insumos contra la COVID-19 para Centroamérica por el bloqueo en Costa Rica,http://elsiglo.com.pa/internacional/peligran-insumos-contra-covid-19-para-centroamerica-bloqueo-costa-rica/24165828,"Casi 40 contenedores con insumos médicos para combatir la COVID-19 en Centroamérica están a punto de colapsar tras permanecer varios días varados en la frontera entre Panamá y Costa Rica, que sigue bl",13-10-2020 01:50,https://www.bing.com/th?id=OVFT.zPIUkOJ7OVZmGPSNEFs_DC,Panamá,El Siglo
Panamá contabiliza 120.802 casos del COVID-19 y 2.502 decesos,https://www.diaadia.com.pa/el-pais/panama-contabiliza-120802-casos-del-covid-19-y-2502-decesos-371302,"Panamá agregó este lunes 489 nuevos casos del  COVID-19 y 11 defunciones, para llegar a un total de 120.802 contagios confirmados y 2.502 fallecimientos por la enfermedad en 219 días de pan",13-10-2020 02:22,https://www.bing.com/th?id=OVFT.L1hk9oXkGRtLBauY4QLozi,Panamá,Día a Día
"Panamá registra 489 nuevos casos de COVID-19 y contabiliza 120,802 contagios en total",https://www.telemetro.com/nacionales/2020/10/12/panama-registra-nuevos-casos-covid/3337668.html,"El Ministerio de Salud (Minsa) informó que el número de casos confirmados del nuevo coronavirus en Panamá se elevó a 120, 802, mientras que las defunciones aumentaron a 2,502 en total.",13-10-2020 02:58,https://www.bing.com/th?id=OVFT.iK6L4ONjxDsLLF6KgyghNy,Panamá,Telemetro
Johnson & Johnson detiene ensayos de vacuna por enfermedad de participante,https://www.diaadia.com.pa/mundo/johnson-johnson-detiene-ensayos-de-vacuna-por-enfermedad-de-participante-371303,"La multinacional Johnson & Johnson anunció este lunes que detuvo los ensayos de una vacuna en investigación contra el COVID-19 debido a una ""enfermedad inexplicable"" en un participante.""Hemo",13-10-2020 03:08,https://www.bing.com/th?id=OVFT.pkQ8PxTMp1c7d12NlZ_5ky,Panamá,Día a Día
El Aeropuerto de Tocumen se reactiva con 80 vuelos diarios,https://www.panamaamerica.com.pa/economia/aeropuerto-tocumen-se-reactiva-con-80-vuelos-diarios-1173883,"El Aeropuerto Internacional de Tocumen retomó ayer sus primeras operaciones con 80 vuelos diarios a 36 destinos en 20 países de Suramérica, Centroamérica, El Caribe, Norteamérica y Europa.",13-10-2020 03:11,https://www.bing.com/th?id=OVFT.UUD3JVXaPnx9o9vMt4Tiqy,Panamá,panamaamerica.com.pa
Once defunciones y 489 casos de Covid-19 en las últimas 24 horas,https://www.prensa.com/sociedad/once-defunciones-y-489-casos-de-covid-19-en-las-ultimas-24-horas/,"El informe epidemiológico del Ministerio de Salud (Minsa), de este lunes 12 de octubre, registra 11 nuevos fallecimientos por la Covid-19, que totalizan 2,502 decesos",13-10-2020 03:16,https://www.bing.com/th?id=OVFT.93YgjByJUWzc7XsqSIivAC,Panamá,prensa.com
"Tasa de positividad anda en 12%, debe bajar a 5% para controlar Covid-19",https://www.critica.com.pa/nacional/tasa-de-positividad-anda-en-12-debe-bajar-5-para-controlar-covid-19-589904,La semana 42 de la pandemia por Covid-19 en Panamá arrancó con 489 nuevos casos y 11 decesos. El Ministerio de Salud (Minsa) informó que el,13-10-2020 05:08,https://www.bing.com/th?id=OVFT.Sjlan-hqWmbOjjkvr55u5S,Panamá,Critica
Panamá realiza estudio para evaluar la detección temprana de anticuerpos por la covid-19,https://www.laestrella.com.pa/cafe-estrella/salud/201013/panama-realiza-estudio-evaluar-deteccion,"Con este ensayo se demostró que con una prueba serológica se pueden detectar anticuerpos específicos tanto de inmunoglobulina M (IgM) como de inmunoglobulina G (IgG). Sin embargo, explicaron que están",13-10-2020 06:20,https://www.bing.com/th?id=OVFT.5uvOiJJmsGb7uAaSdh_LWy,Panamá,laestrella.com.pa
Quieren volver a dar una alegría a Panamá,https://www.metrolibre.com/deportes/184245-quieren-volver-dar-una-alegr%C3%ADa-panam%C3%A1.html,"Panamá quiere volver a asestar un certero golpe a su vecino Costa Rica, cuando se vuelvan a enfrentar hoy (9:00 p.m., hora en Panamá) en el segundo de los duelos amistosos en suelo tico correspondient",13-10-2020 09:31,https://www.bing.com/th?id=OVFT.fOXrq83H-ky5X6GjH-wDyi,Panamá,Metro Libre
Panamá abre puertas a la aviación internacional,https://www.metrolibre.com/econom%C3%ADa/184262-panam%C3%A1-abre-puertas-la-aviaci%C3%B3n-internacional.html,"“Finalmente se da el reinicio de los vuelos internacionales, por ahora con 80 operaciones diarias desde y hacia 36 ciudades de América y Europa. Hoy es un día de esperanza para Panamá y también para l",13-10-2020 10:01,https://www.bing.com/th?id=OVFT.37Dbg_NMCT9lM80Ujqcduy,Panamá,Metro Libre
"Casos diarios por COVID-19 podrían aumentar a 1,000 diarios nuevamente, advierten expertos",https://www.tvn-2.com/contenido_exclusivo/Casos-COVID-19-aumentar-nuevamente-advierten_0_5691930844.html,"Del lunes 5 de octubre al lunes 12 de octubre en Panamá murieron un total de 79 personas y otras 5,516 se contagiaron por la COVID-19.",13-10-2020 11:19,https://www.bing.com/th?id=OVFT.yR1H4koNnK0F-t0dcFdb1S,Panamá,TVN
Trump dice sentirse “poderoso” tras recuperarse del coronavirus,http://www.nexpanama.com/trump-dice-sentirse-poderoso-tras-recuperarse-del-coronavirus/,"El presidente Donald Trump hizo su primera aparición en campaña electoral desde que anunció su diagnóstico de COVID-19, alabando la gestión de la pandemia por parte de su administración, mientras las",13-10-2020 12:08,https://www.bing.com/th?id=OVFT.zmUqcWqA88lmeeQ0YZWSCS,Panamá,NEX TV
Hotel El Panamá vuelve a reabrir tras 7 meses de pausa,https://ensegundos.com.pa/2020/10/13/hotel-el-panama-vuelve-a-reabrir-tras-7-meses-de-pausa/,"“Las reservas están respondiendo favorablemente”, afirmó el gerente general de la instalación hotelera, ubicada en la vía España. El Hotel El Panamá, importante fuente de empleo para decenas de paname",13-10-2020 13:39,https://www.bing.com/th?id=OVFT.uFNBJ3dAk7aK2dXxOV0FPi,Panamá,En Segundos
Cristiano Ronaldo da positivo de COVID-19,http://www.nexpanama.com/cristiano-ronaldo-da-positivo-de-covid-19/,"El delantero Cristiano Ronaldo dio positivo de COVID-19, dijo el martes la Federación de Fútbol de Portugal. El atacante de la Juventus, de 35 años, se perderá el partido del miércoles entre su selecc",13-10-2020 15:10,https://www.bing.com/th?id=OVFT.juFYej8kYilN6AKpOefhwy,Panamá,NEX TV
Panamá detecta pasajero con covid-19 en el aeropuerto Internacional de Tocumen,https://www.laestrella.com.pa/nacional/201013/panama-detecta-pasajero-covid-19-positivo-aeropuerto-inter-tocumen,"El pasajero venía con una prueba negativa, pero presentaba fiebre alta y según informó el ministro de Salud fue sometido a una prueba rápida y el resultado fue positiva",13-10-2020 15:15,https://www.bing.com/th?id=OVFT.utxrSqsAsykZLqjQrAiFPS,Panamá,laestrella.com.pa
Hoteleros generan estrategias y promociones para la dinamización por efectos de la COVID-19,https://www.tvn-2.com/nacionales/Hoteleros-estrategias-promociones-dinamizacion-COVID-19_0_5692680695.html,"Tras la apertura del sector hotelero en Panamá en medio de la pandemia de la COVID-19, la Asociación Panameña de Hoteles (Apatel), la Asociación de Pequeños Hoteles (Hoppan) y la Cámara de Turismo (Camptur) sellaron una alianza con OfertaSimple ...",13-10-2020 15:19,https://www.bing.com/th?id=OVFT.HMMheWQY_amykEJmUGlCzi,Panamá,TVN
