name,url,description,datePublished,imagen,pais,Fuente
Cortizo pide autocuidado para vencer la pandemia que abate economía de Panamá,https://www.diaadia.com.pa/el-pais/cortizo-pide-autocuidado-para-vencer-la-pandemia-que-abate-economia-de-panama-368702,"El presidente panameño, Laurentino Cortizo, avaló el pronóstico del Bank of America de que la economía local se derrumbará hasta un 10 % este 2020 a causa del COVID-19, y resaltó que el autocuidado es",27-07-2020 02:32,https://www.bing.com/th?id=ON.7D32E28BA0D07DE6F38CB3BF3D3FD4DE,Panamá,Día a Día
Panamá figura entre los países de América Latina con mejores perspectivas recuperación económica,https://elcapitalfinanciero.com/panama-figura-entre-los-paises-de-america-latina-con-mejores-perspectivas-recuperacion-economica/,"Panamá se ubica junto a Colombia, Chile, Perú, Paraguay, Uruguay, República Dominicana y Costa Rica como uno de los ochos países de América Latina y el Caribe mejor preparados para recuperar su nivel",27-07-2020 20:40,https://www.bing.com/th?id=ON.5F957761B6DA158E72F5CA8963E57F6F,Panamá,El Capital Financiero
Más de 120 niños en Panamá tienen la COVID-19,https://www.panamaamerica.com.pa/sociedad/mas-de-120-ninos-en-panama-tienen-la-covid-19-1168615,"Unos 122 menores de edad han sido atendidos en el Hospital del Niño por COVID-19 desde el mes de marzo hasta la fecha. De acuerdo con la pediatra infectóloga, Ximena Noreno, de ese total se han hospit",27-07-2020 21:07,https://www.bing.com/th?id=ON.4AADE2E38CDF0AF9DF54B0B8B3CC35A7,Panamá,panamaamerica.com.pa
Cadena de café presenta propuesta contra la Covid-19,https://www.prensa.com/impresa/economia/cadena-de-cafe-presenta-propuesta-contra-la-covid-19/,Los miembros de la Cadena agroalimentaria de café analizarán mañana con las autoridades agrícolas del país un plan para frenar los brotes de la Covid-19 que se han registrado en algunas fincas cafeter,27-07-2020 21:08,https://www.bing.com/th?id=ON.11E3B84A7C38878FA0233D3CBECC15C5,Panamá,prensa.com
Asep asegura que garantizará ancho de banda a usuarios por pandemia de Covid-19,https://www.metrolibre.com/tecnolog%C3%ADa/177723-asep-asegura-que-garantizar%C3%A1-ancho-de-banda-usuarios-por-pandemia-de-covid-19.html,La Autoridad Nacional de los Servicios Públicos (ASEP) extenderá por dos meses más el espectro asignado a los cuatro operadores de Telefonía Móvil Celular (TMC) en Panamá y a los Servicios de Comunica,27-07-2020 21:10,https://www.bing.com/th?id=ON.713F42028495A7AD40087F9CEC7B7071,Panamá,Metro Libre
Bancada panameña en el Parlacen dice que no juramentará a los hermanos Martinelli Linares,https://www.tvn-2.com/nacionales/Bancada-Parlacen-juramentara-Martinelli-Linares_0_5634186588.html,"En una nota firmada por Gilberto Succari y Cirilo Sala, vicepresidente y secretario de la Junta Directiva de Panamá ante el Parlacen respectivamente, explicaron sus razones a la presidente del organis",27-07-2020 21:40,https://www.bing.com/th?id=ON.F431E2AECC651AEC093DEF6A93BAEB7B,Panamá,TVN
"Falta de un Plan de Reactivación Económica hunde a Panamá en la incertidumbre y la crisis social, advierte Blandón",https://elcapitalfinanciero.com/falta-de-un-plan-de-reactivacion-economica-hunde-a-panama-en-la-incertidumbre-y-la-crisis-social-advierte-blandon/,"El presidente del Partido Panameñista, José Isabel Baldón, advirtió que la falta de un Plan de Reactivación Económica que fije el rumbo que seguirá el país para recuperarse de los impactos negativos d",27-07-2020 22:14,https://www.bing.com/th?id=ON.738FBF4B9C7D7A8D97C278BF5FA3B28C,Panamá,El Capital Financiero
"El internet residencial de Panamá, el segundo más rápido de toda Latinoamérica",https://www.laestrella.com.pa/economia/200721/internet-residencial-panama-segundo-rapido-latinoamerica,"Desde el inicio de la crisis generada por la pandemia COVID-19, los cambios han sido drásticos para todos los sectores de la sociedad, desde el individuo hasta las pequeñas empresas y grandes corporac",27-07-2020 22:15,https://www.bing.com/th?id=ON.490B1022541E5409F279F9DEEEB4794E,Panamá,laestrella.com.pa
"Panamá acumula 1,322 decesos por COVID-19, al registrarse 28 nuevas muertes",https://www.telemetro.com/nacionales/2020/07/27/panama-acumula-decesos-covid-19/3080863.html,"El Ministerio de Salud de Panamá (Minsa) informó este lunes 27 de julio que se registraron 28 nuevas muertes por COVID-19 en las últimas 24 horas, lo que eleva el número de fallecimientos a 1,322. Las",27-07-2020 22:51,https://www.bing.com/th?id=ON.30163F313233624E4F7527AE5CE59132,Panamá,Telemetro
"Educación a distancia en Panamá Oeste, se intenta, pero... ¡qué problema!",https://www.critica.com.pa/nacional/educacion-distancia-en-panama-oeste-se-intenta-pero-que-problema-584295,"La dirección regional del Ministerio de Educación (Meduca) en la provincia de Panamá Oeste, ensaya otras estrategias, intentando que los estudiantes puedan seguir sin contratiempo su educación a dista",27-07-2020 23:10,https://www.bing.com/th?id=ON.3E807273F40C0D6858018E0B5FB45D3B,Panamá,Critica
Técnicos del control de vectores anuncian levantamiento de huelga tras lograr acuerdo con el MINSA,https://www.radiopanama.com.pa/noticias/actualidad/tecnicos-del-control-de-vectores-anuncian-levantamiento-de-huelga-tras-lograr-acuerdo-con-el-minsa/20200727/nota/4058228.aspx,"Los Técnicos de Control de Vectores, anunciaron este lunes que levantarán la medida de huelga, tras lograr acuerdos en una reunión sostenida con el Ministro de Salud, Luis Francisco Sucre. Evelio Gaon",27-07-2020 23:11,https://www.bing.com/th?id=ON.7D78B3FEAE78D8AC05601605E2D2BC64,Panamá,Radio Panamá
Minsa: Más de 4 mil pruebas covid-19 en un día,http://elsiglo.com.pa/panama/minsamas-4-pruebas-covid-19/24161265,"Este lunes 27 julio se registran 35,086 pacientes recuperados en Panamá, 1,146 casos positivos nuevos, para un total acumulado de 61,442. Se realizaron 3,465 pruebas, para un porcentaje de positividad",27-07-2020 23:15,https://www.bing.com/th?id=ON.FBF7A44479D10544895C1EEA625932CB,Panamá,El Siglo
"Covid-19: Se registran 1,146 casos nuevos y 28 muertes en últimas 24 horas",https://ensegundos.com.pa/2020/07/27/covid-19-se-registran-1146-casos-nuevos-y-28-muertes-en-ultimas-24-horas/,"La pandemia del Covid-19 no da tregua. La tasa de letalidad en el país aumentó a 2.15%. Para hoy lunes 27 julio en Panamá se contabilizan 35,086 pacientes recuperados, 1,146 casos positivos nuevos, pa",27-07-2020 23:35,https://www.bing.com/th?id=ON.637E93222502F742F3C1AF50F6C2109A,Panamá,En Segundos
Panamá registra 28 nuevas defunciones y más de mil casos de COVID-19 en un día,https://www.panamaamerica.com.pa/sociedad/panama-registra-28-nuevas-defunciones-y-mas-de-mil-casos-de-covid-19-en-un-dia-1168684,"El Ministerio de Salud (Minsa) anunció este lunes el deceso de 28 nuevos pacientes por causa del coronavirus, para un acumulado de 1.322. Versión impresa Los casos nuevos fueron de 1.146, luego de que",27-07-2020 23:36,https://www.bing.com/th?id=ON.75BBA36DBDF31A799EB096FEFC8E801D,Panamá,panamaamerica.com.pa
Panamá registra 28 nuevas defunciones por Covid-19,https://www.metrolibre.com/nacionales/177741-panam%C3%A1-registra-28-nuevas-defunciones-por-covid-19.html,"Para hoy lunes 27 julio en Panamá se contabilizan 1,146 casos positivos nuevos, para un total acumulado de 61,442, según el último informe epidemiología del Ministerio de Salud (Minsa). Según el infor",27-07-2020 23:49,https://www.bing.com/th?id=ON.CCDBB638F6B11A6FF1F06E91C31FABFA,Panamá,Metro Libre
"Minsa reporta 28 nuevas defunciones en las últimas horas y 1,146 casos positivos",https://www.prensa.com/sociedad/minsa-reporta-28-nuevas-defunciones-en-las-ultimas-horas-y-1146-casos-positivos/,"Ministro de Salud, Luis Francisco Sucre. El Ministerio de Salud (Minsa) informó la tarde de este lunes 27 de julio que en las últimas 24 horas se reportaron 28 nuevas defunciones por coronavirus y 1,1",28-07-2020 00:19,https://www.bing.com/th?id=ON.33E7D2275B4E49BE7BFBB31AF9FFAEAF,Panamá,prensa.com
