name,url,description,datePublished,imagen,pais,Fuente
"Panamá registra una leve disminución de casos por COVID-19, ¿Qué dicen los expertos?",https://www.tvn-2.com/contenido_exclusivo/infectados-decesos-COVID-19-registraron-Panama_0_5697180334.html,"Una ligera baja de casos nuevos por la COVID-19, se reflejó en la semana del 12 al 18 de octubre en Panamá, donde se cuantificaron 4,432 nuevos infectados, 595 menos que la semana epidemiológica del l",20-10-2020 11:10,https://www.bing.com/th?id=OVFT.labFWM7zb3JfAz52VB1vyy,Panamá,TVN
Dos protestas en la ciudad. Unos piden empleos y otros aumento a jubilaciones,https://www.critica.com.pa/nacional/dos-protestas-en-la-ciudad-unos-piden-empleos-y-otros-aumento-jubilaciones-590458,"Los manifestantes se concentraron en la avenida Balboa, cerca de la antigua sede de la embajada de EE.UU en Panamá, donde se edificará el nuevo centro pediátrico.",20-10-2020 15:44,https://www.bing.com/th?id=OVFT.sBcHVpZiTWc46J11LwemQC,Panamá,Critica
Más de dos mil privados de libertad recuperados de la covid-19,http://elsiglo.com.pa/panama/privados-libertad-recuperados-covid-19/24166338,"""Este número de recuperados, es gracias al trabajo conjunto con el Minsa; además, podemos señalar que solo se contabilizan 44 casos activos""",20-10-2020 16:03,https://www.bing.com/th?id=OVFT.4OZmqUzU_xGSrnj0VBZ_AS,Panamá,El Siglo
Asociación de Armadores pide acciones al gobierno para detener a los pseudo.-inversionistas,https://www.radiopanama.com.pa/noticias/actualidad/asociacion-de-armadores-pide-acciones-al-gobierno-para-detener-a-los-pseudoinversionistas/20201020/nota/4079150.aspx,"Panamá no mantiene una normativa actualizada de cabotaje, y actualmente contando con mares y costas panameñas extensas, hay inversionistas que aprovechan eso.",20-10-2020 16:31,https://www.bing.com/th?id=OVFT.U5aKDYpkHePXVNpXvKWW7y,Panamá,Radio Panamá
Bomberos de Panamá utilizarán un robot autónomo que desinfecta mediante luz ultravioleta,https://www.midiario.com/nacionales/bomberos-de-panama-utilizaran-un-robot-autonomo-que-desinfecta-mediante-luz-ultravioleta/,"Desinfectar espacios como bodegas, escuelas, centros comerciales, hogares , fábricas y almacenes es una tarea especialmente importante durante la pandemia de la COVID-19 y en la medidas en que se van dando las diferentes aperturas económicas, pero hacer ...",20-10-2020 16:33,https://www.bing.com/th?id=OVFT.cvHp1EGbx_oBBqqCZQ3D0i,Panamá,Mi Diario
Aún hay 44 casos activos de COVID-19 en los centros penitenciarios de Panamá,https://www.panamaamerica.com.pa/sociedad/aun-hay-44-casos-activos-covid-19-en-centros-penitenciarios-panama-1174390,"La lucha contra la COVID-19 en los centros penitenciarios de Panamá no se detiene, luego de que el Ministerio de Gobierno (Mingob) informó este martes que aún hay 44 privados de libertad con esta enfe",20-10-2020 17:13,https://www.bing.com/th?id=OVFT.1swN0f0lGFuDVLh9Fd796y,Panamá,panamaamerica.com.pa
Más de 40 casos activos de COVID en los centros penitenciarios,http://www.nexpanama.com/mas-de-40-casos-activos-de-covid-en-los-centros-penitenciarios/,"La lucha contra la COVID-19 en los centros penitenciarios de Panamá no se detiene, luego de que el Ministerio de Gobierno (Mingob) informó este martes que aún hay 44 privados de libertad con esta enfe",20-10-2020 17:20,https://www.bing.com/th?id=OVFT.bblfS6-Asg1E6pmEZBvb2C,Panamá,NEX TV
Sistema Penitenciario reporta 44 casos activos de privados de libertad con la Covid-19,https://www.prensa.com/judiciales/sistema-penitenciario-reporta-44-casos-activos-de-privados-de-libertad-con-la-covid-19/,La Dirección del Sistema Penitenciario confirmó que a la fecha solo se reportan 44 casos activos de privados de libertad con la Covid-19 y que más de mil se han,20-10-2020 17:42,https://www.bing.com/th?id=OVFT.PFyeT3aebJcJhQvytxsjGC,Panamá,prensa.com
Privados de libertad de Panamá se recuperan satisfactoriamente de la covid-19,https://www.midiario.com/nacionales/privados-de-libertad-de-panama-se-recuperan-satisfactoriamente-de-la-covid-19/,"El Ministerio de Gobierno (MINGO), dio a conocer que un total de dos mil 22 personas privadas de libertad se han recuperado de la Covid-19 de acuerdo con cifras constatadas por el Ministerio de Salud",20-10-2020 18:13,https://www.bing.com/th?id=OVFT.ttjvbhhWYilS6AStd_B4iC,Panamá,Mi Diario
"El portero Calderón ve un ciclo ""bonito"" para Panamá al mando de Christiansen",https://www.tvmax-9.com/somoslasele/portero-Calderon-bonito-Panama-Christiansen_0_5697930212.html,"El portero mundialista panameño José Calderón, titular del Comunicaciones guatemalteco, ve a su selección nacional en un ciclo ""bonito"" bajo el mando del entrenador hispano-danés Thomas Christiansen,",20-10-2020 19:37,https://www.bing.com/th?id=OVFT.LFimg3ueXytynU9baz8vRC,Panamá,TVMAX
CEPAl presentará propuesta de recuperación y desarrollo orientada al Estado inclusivo,https://anpanama.com/10483-CEPAl-presentara-propuesta-de-recuperacion-y-desarrollo-orientada-al-Estado-inclusivo.note.aspx,(Ciudad de Panamá-ANPanamá) La Comisión Económica para América Latina y el Caribe (CEPAL) presentará a los países de la región una propuesta de recuperación y desarrollado económico orientada hacia un,20-10-2020 20:19,https://www.bing.com/th?id=OVFT.vVTM0FABXONTtG9lgOGmgC,Panamá,AN Panama
IMELCF pide terreno para sepultar cadáveres,https://www.critica.com.pa/nacional/imelcf-pide-terreno-para-sepultar-cadaveres-590475,"La falta de espacio en el campo santo municipal de La Chorrera, el más grande del distrito, ha obligado a la institución a recurrir a los cementerios ubicados en los corregimientos rurales.",20-10-2020 21:22,https://www.bing.com/th?id=OVFT.AK_8OlDO8Aigvq8jwxxyVC,Panamá,Critica
Juventus en la Liga de Campeones sin Cristiano Ronaldo,http://www.nexpanama.com/juventus-en-la-liga-de-campeones-sin-cristiano-ronaldo/,"La Juventus inició el martes con un triunfo otra participación en la Liga de Campeones, al derrotar 2-0 como visitante al Dínamo de Kiev por el Grupo G gracias a un doblete de Álvaro Morata. Andrea Pi",20-10-2020 21:33,https://www.bing.com/th?id=OVFT.X0OEXJrgz9OGaEywURQbOi,Panamá,NEX TV
Moody’s mantiene calificación alta en grado de inversión para Panamá,https://www.metrolibre.com/econom%C3%ADa/184863-moody%E2%80%99s-mantiene-calificaci%C3%B3n-alta-en-grado-de-inversi%C3%B3n-para-panam%C3%A1.html,"La agencia internacional de calificación de crédito Moody’s mantuvo la calificación de Grado de Inversión de Panamá en Baa1 para Panamá, una de las calificaciones más altas en la Región, y revisó la p",20-10-2020 21:42,https://www.bing.com/th?id=OVFT.vsWp3M54voBhGRHydrQ92i,Panamá,Metro Libre
"Moody’s mantiene la calificación de riesgo de Panamá en Baa1, pero la perspectiva pasa a negativa",https://www.prensa.com/economia/moodys-mantiene-la-calificacion-de-riesgo-de-panama-en-baa1-pero-la-perspectiva-pasa-a-negativa/,"La agencia Moody’s actualizó este martes 20 de octubre sus proyecciones para Panamá, y mantuvo la calificación de grado de inversión del país en Baa1, y revisó la perspectiva de estable a",20-10-2020 22:01,https://www.bing.com/th?id=OVFT.V0bTTuc8Wfn0lngnot6BCi,Panamá,prensa.com
MEF propone aumentar tope del déficit fiscal de 2020 a 2025,https://ensegundos.com.pa/2020/10/20/mef-propone-aumentar-tope-del-deficit-fiscal-de-2020-a-2025/,"El titular del Ministerio de Economía y Finanzas, Héctor Alexander sustentó en la Asamblea que la prioridad del gasto del Gobierno está enfocado en combatir la pandemia de COVID-19. Por tanto, se requ",20-10-2020 22:28,https://www.bing.com/th?id=OVFT.TNnlie0vh5wjItYzRML5aS,Panamá,En Segundos
"(Video) Hasta un 35% en pérdidas ha sufrido Correos Panamá, tras la pandemia de COVID-19",https://www.panamaamerica.com.pa/economia/video-hasta-un-35-en-perdidas-ha-sufrido-correos-panama-tras-pandemia-covid-19-1174409,"Entre un 35 a un 30% aproximadamente a comparación del año pasado, bajaron los ingresos durante marzo a septiembre en Correos Panamá, así lo dio a conocer el director de esta entidad, Julio Ramírez.",20-10-2020 23:04,https://www.bing.com/th?id=OVFT.gMOHjhOV5ye67KG51suvAC,Panamá,panamaamerica.com.pa
Se suman 558 casos nuevos de Covid-19 y 11 defunciones por el virus,https://ensegundos.com.pa/2020/10/20/se-suman-558-casos-nuevos-de-covid-19-y-11-defunciones-por-el-virus/,Las autoridades de salud develan que existe una tendencia a la estabilización de los casos. Para este 20 de octubre el Ministerio de Salud (Minsa) reporta un total de 558 casos nuevos de Covid-19 para,20-10-2020 23:21,https://www.bing.com/th?id=OVFT.OCccKzLiRU-9_5GAA3A4PC,Panamá,En Segundos
Panamá suma a sus estadísticas 558 nuevos contagios y 11 defunciones por la COVID-19,https://www.tvn-2.com/nacionales/Panama-estadisticas-contagios-defunciones-COVID-19_0_5697930241.html,"En las últimas 24 horas fueron confirmados en Panamá 558 nuevos contagios y 11 defunciones por la COVID-19. Desde el 9 de marzo hasta la fecha han fallecido 2,585 infectados por el virus, lo que marca",20-10-2020 23:23,https://www.bing.com/th?id=OVFT.M8x_dvYPvhkdHz9fDvqIpi,Panamá,TVN
"La visión de José Calderón: Panamá, Christiansen y más",http://elsiglo.com.pa/deportes/vision-jose-calderon-panama-christiansen/24166339,"El arquero panameño mostró su lado más sincero. El portero mundialista panameño José Calderón, titular del Comunicaciones guatemalteco, ve a su selección nacional en un ciclo ""bonito"" bajo el mando de",20-10-2020 23:27,https://www.bing.com/th?id=OVFT.YTKLSYPcMpCFQqCa3fhjZi,Panamá,El Siglo
White chairs mark deaths from Covid-19,https://www.newsroompanama.com/news/white-chairs-mark-deaths-from-covid-19,"Hundreds of empty chairs sit in a field in the City of Knowledge (Clayton) each one marking the death of a person from Covid -19 . Until Tuesday, October 20, th",20-10-2020 23:28,https://www.bing.com/th?id=OVFT.q289uRMG2tEdbAlqTZC6xi,Panamá,Newsroom Panama
"Se levanta la cuarentena total de los domingos, a partir del 25 de octubre",https://www.metrolibre.com/nacionales/184870-se-levanta-la-cuarentena-total-de-los-domingos-partir-del-25-de-octubre.html,"El ministro de Salud Luis Francisco Sucre anunció que, a partir de este domingo, 25 de octubre, se levanta la cuarentena total dominical. ""El gobierno nacional ha tomado la decisión de levantar la cua",20-10-2020 23:37,https://www.bing.com/th?id=OVFT.X89CvGx5n2xdtUo9-AY8hi,Panamá,Metro Libre
Rt del COVID-19 en Panamá sigue en 1.02,https://www.telemetro.com/nacionales/2020/10/20/rt-covid-19-panama-sigue/3368065.html,"El doctor Israel Cedeño, director de la Región Metropolitana de Salud, informó que el Rt o índice reproductivo del COVID-19 en Panamá se ha mantenido en 1.02 en las últimas 2 semanas epidemiológicas.",20-10-2020 23:46,https://www.bing.com/th?id=OVFT.Z6GY4pbVabMT7GW9IG7PhS,Panamá,Telemetro
Panamá abrirá las playas y levantará la cuarentena de los domingos,https://www.laestrella.com.pa/nacional/201020/panama-abrira-playas-levantara-cuarentena-domingos,El Ministerio de Salud (Minsa) detalló que a las playas y ríos se podrán ingresar desde 6:00 am hasta la 4:00 pm,21-10-2020 00:02,https://www.bing.com/th?id=OVFT.p8AiMrVv6d4ula4b5c7QCi,Panamá,laestrella.com.pa
Panamá registró 11 defunciones por covid-19 y 558 casos nuevos este martes,https://www.laestrella.com.pa/nacional/201020/panama-registro-11-defunciones-covid-19-558-casos-nuevos-martes,"El país acumula 2,585 muertes por el virus y 125,739 casos detectados. La letalidad se mantiene en 2.1% Panamá registró 11 defunciones por covid-19 y 558 casos nuevos este martes, informó el director",21-10-2020 00:02,https://www.bing.com/th?id=OVFT.tNpOzHR7MiY6a6wd4O4jUi,Panamá,laestrella.com.pa
Panamá reporta 558 nuevos casos de COVID-19 y 11 defunciones en las últimas horas,https://www.telemetro.com/nacionales/2020/10/21/panama-reporta-558-nuevos-casos-de-covid-19-y-11-defunciones-en-las-ultimas-horas/3368063.html,"La cifra de defunciones a causa del COVID -19 en el país se elevó a 2,585 con un total de 11 nuevos fallecimientos, manteniendo una tasa de letalidad de 2.1%.",21-10-2020 00:11,https://www.bing.com/th?id=OVFT.E6YxaaTNqqk7yRuM99g7Iy,Panamá,Telemetro
