name,url,description,datePublished,imagen,pais,Fuente
Hospital de campaña en La Chorrera estará listo en una semana,https://www.diaadia.com.pa/el-pais/hospital-de-campana-en-la-chorrera-estara-listo-en-una-semana-373393,"El montaje de la estructura del hospital de campaña que se levanta en los predios de la policlínica Dr. Santiago Barraza de la Caja de Seguro Social (CSS) en La Chorrera, provincia de Panamá Oeste, es",13-12-2020 17:24,https://www.bing.com/th?id=OVFT.fG99jHhjd-HfcZYLKCks7S,Panamá,Día a Día
Presidente Cortizo anuncia nueva transferencia del Vale Digital del 13 al 17 de diciembre,https://elcapitalfinanciero.com/presidente-cortizo-anuncia-nueva-transferencia-del-vale-digital-del-13-al-17-de-diciembre/,"Un total de 442,323 beneficiarios del Plan Panamá Solidario recibirán la transferencia del Vale Digital a partir de este domingo 13, y hasta al jueves 17 de diciembre de 2020, según informó el preside",13-12-2020 17:50,https://www.bing.com/th?id=OVFT._6MyVft1OjEDrYg0vxnHkC,Panamá,El Capital Financiero
"Para disminuir la propagación de la COVID-19, el Minsa prohíbe toda actividad que conlleve aglomeración de personas",https://www.panamaamerica.com.pa/sociedad/disminuir-propagacion-covid-19-minsa-prohibe-toda-actividad-que-conlleve-aglomeracion,"Ante el incremento del índice de reproducción efectiva (RT) de COVID-19 por encima de 1 y el aumento diario de la cantidad de contagios que sobrepasa el índice que permite la reapertura, el Ministerio",13-12-2020 18:46,https://www.bing.com/th?id=OVFT.BOun5YqlEeJgCU0TvjMyYS,Panamá,panamaamerica.com.pa
No se la rife. Gobierno establece medidas para evitar las aglomeraciones ante el repunte de casos de la covid-19 en Panamá,https://www.midiario.com/nacionales/no-se-la-rife-gobierno-establece-medidas-para-evitar-las-aglomeraciones-ante-el-repunte-de-casos-de-la-covid-19-en-panama/,"Las autoridades sanitarias del país han pedido a la población tratar de autoconfinarse para no exponerse a la covid-19, que registra un fuerte repunte en Panamá que acumula ya 190 mil 585 casos confir",13-12-2020 19:31,https://www.bing.com/th?id=OVFT.IcokEktNK-LjIcUCzIAc1i,Panamá,Mi Diario
Síntomas que deja la covid-19. Aquí le decimos dónde están las clínicas post covid en Panamá,https://www.midiario.com/nacionales/sintomas-que-deja-la-covid-19-aqui-le-decimos-donde-estan-las-clinicas-post-covid-en-panama/,"Gladys Guerrero, jefa de Epidemiología de la Caja de Seguro Social manifestó que analizan la situación que les está ocurriendo a un porcentajes de pacientes que han enfrentado la covid-19 y los síntom",13-12-2020 20:40,https://www.bing.com/th?id=OVFT.26NWfzsDXJVMqvkPAb3Kbi,Panamá,Mi Diario
Juventud del PRD aclara que el Gobierno no ha quitado el bono solidario a menores de 25 años,https://www.metrolibre.com/nacionales/189076-juventud-del-prd%C2%A0-aclara%C2%A0-que-el-gobierno-no-ha-quitado%C2%A0-el-bono%C2%A0-solidario-menores-de-25-a%C3%B1os.html,que sin ningún motivo y sin pruebas señalan que el Gobierno Nacional acusa a la juventud del rebrote de COVID-19 y que se exceptúan a jóvenes menores de 25 años de recibir el bono Panamá Solidario”. Detallaron que la ...,13-12-2020 22:15,https://www.bing.com/th?id=OVFT.DYluGA9Z4y_LxWZhxLiXDC,Panamá,Metro Libre
"Panamá registra 25 nuevos decesos por COVID-19 y acumula 193,007 contagios",https://www.telemetro.com/nacionales/2020/12/13/panama-decesos-covid-contagios/3552642.html,"Panamá registró 2,422 casos nuevos de COVID-19, lo que eleva el acumulado de contagios a 193,007 en el país, según lo revelado este domingo 13 de diciembre por el Ministerio de Salud (Minsa).",13-12-2020 22:45,https://www.bing.com/th?id=OVFT.PMQmaprp5s6Q7DmpI0Ul8y,Panamá,Telemetro
"‘Juntos podemos vencer el virus’, nueva campaña que espera frenar el COVID-19",https://noticias24pty.com/juntos-podemos-vencer-el-virus-nueva-campana-que-espera-frenar-el-covid-19/,"El ministro de Salud, Luis Francisco Sucre, se reunió este domingo con los principales líderes de las comunidades de fe radicadas en Panamá con quienes coordinó una campaña de concienciación",13-12-2020 22:54,https://www.bing.com/th?id=OVFT.HHBy5wNDhtzccWxxnFDdxy,Panamá,Noticias 24 PTY
"Hay 1,432 pacientes hospitalizados de COVID-19 y 2,422 nuevos casos",https://www.critica.com.pa/nacional/hay-1432-pacientes-hospitalizados-de-covid-19-y-2422-nuevos-casos-594262,"Panamá sumó este domingo 2,422 nuevos casos de la covid-19 y 25 nuevas defunciones por la enfermedad, lo que elevó hasta 193,007 los casos confirmados y a 3,356 las muertes desde marzo pasado, según e",13-12-2020 22:58,https://www.bing.com/th?id=OVFT.K3d_hJBGvg1jDyV9B_M9tS,Panamá,Critica
La medida surge en medio del aumento de casos nuevos detectados por COVID-19,https://www.radiopanama.com.pa/noticias/fecha/20201213.aspx,"Los casos activos suman 26,613, se han registrado 22 nuevas defunciones, que totalizan 3,331 acumuladas y una letalidad del 1.7%.",13-12-2020 23:41,https://www.bing.com/th?id=OVFT.U5aKDYpkHePXVNpXvKWW7y,Panamá,Radio Panamá
"Se incrementa número de pacientes de COVID-19 en unidades de cuidados intensivos; mientras se registran 2,422 nuevos casos y 25 muertes",https://www.panamaamerica.com.pa/sociedad/se-incrementa-numero-pacientes-covid-19-en-unidades-cuidados-intensivos-mientras-se,"El número de pacientes con COVID-19 en unidades de cuidados intensivos aumentó este domingo 13 de diciembre a 188, encomparación al día anterior que habían 183. Seegún el informe del Ministerio de Salud (Minsa) en Panamá se contabilizan 162,105 ...",13-12-2020 23:43,https://www.bing.com/th?id=OVFT.PQhnDasiNJJ8jd0WvrNjIi,Panamá,panamaamerica.com.pa
Productos de la cena navideña suben su costo hasta un 40% en Merca Panamá,https://www.tvn-2.com/nacionales/Productos-cena-navidena-suben-Merca-Panama_0_5738426161.html,"La crisis económica causada por la pandemia de la COVID-19 ha puesto en una posición difícil a muchas familias panameñas que este fin de año buscan resolver la cena navideña con productos nacionales,",13-12-2020 23:54,https://www.bing.com/th?id=OVFT.HWSgvKTUrxVcNx9NRW-KBi,Panamá,TVN
Menores de 25 años económicamente dependientes dejarán de recibir Vale Digital,https://www.laestrella.com.pa/nacional/201213/menores-25-anos-economicamente-dependientes-dejaran-recibir-vale-digital,"La Presidencia de la República aclaró este domingo que los menores de 25 años, cuyos contratos fueron suspendidos o perdieron su empleo producto de la situación económica que vive el país producto de la pandemia de covid-19, seguirán recibiendo el ...",14-12-2020 00:57,https://www.bing.com/th?id=OVFT.Ld4BL1AMi4g7RhyiEFZj8y,Panamá,laestrella.com.pa
Panamá ya tiene el procedimiento para la importación de la vacuna contra la covid-19,https://noticias24pty.com/panama-ya-tiene-el-procedimiento-para-la-importacion-de-la-vacuna-contra-la-covid-19/,"La vacuna contra la covid-19 ya empezó a aplicarse en el Reino Unido y Estados Unidos y Canadá, quienes autorizaron la utilización de la vacuna producida por Pfizer. Panamá ya tiene su procedimiento para la importación de la vacuna contra la covid-19.",14-12-2020 02:07,https://www.bing.com/th?id=OVFT.VvVEOGW1qE02qPxtnWNo5S,Panamá,Noticias 24 PTY
Gorgas: Transmisión de Covid-19 obedece a conducta social,https://www.prensa.com/impresa/panorama/gorgas-transmision-de-covid-19-obedece-a-conducta-social/,Está claro. Análisis genómicos del Instituto Conmemorativo Gorgas de Estudios de la Salud (Icges) lo confirman: la alta transmisión del nuevo coronavirus que se registra en las últimas semanas no se d,14-12-2020 04:00,https://www.bing.com/th?id=OVFT.xRwjKkiUijO8OpaCXoGguS,Panamá,prensa.com
Hospital de Veraguas está sin una pinta de sangre,http://elsiglo.com.pa/panama/hospital-veraguas-esta-pinta-sangre/24169438,"Los hospitales del país no solo atraviesan una difícil situación por la falta de camas en cuidados intensivos, sino también por un desabastecimiento de sangre jamás visto. Los bancos de sangre están d",14-12-2020 05:05,https://www.bing.com/th?id=OVFT.0TUNlqtzPh91ZXb_DVwwCy,Panamá,El Siglo
"15,288 contagios y 163 muertos en la semana 50 del Covid-19",https://www.critica.com.pa/nacional/15288-contagios-y-163-muertos-en-la-semana-50-del-covid-19-594270,"La semana 50 impuso récord de contagio de Covid-19 en Panamá con 15,288 infectados y se dieron 163 decesos. En promedio fueron 2,184 pacientes con",14-12-2020 05:06,https://www.bing.com/th?id=OVFT.uwmwzQ-lEAexYgkzRp-xYi,Panamá,Critica
"En Panamá, mayoría de empresas financieras mantuvieron operaciones durante la pandemia del COVID-19",https://sertv.gob.pa/nacionalfm/en-panama-mayoria-de-empresas-financieras-mantuvieron-operaciones-durante-la-pandemia-del-covid-19/,"En Panamá, existen unas 194 empresas financieras formalmente establecidas, las cuales, en su gran mayoría, mantuvieron operaciones, en medio de la situación económica generada por la pandemia del COVI",14-12-2020 09:18,https://www.bing.com/th?id=OVFT._xOHatS9m6Xm013OytjAwy,Panamá,SERTV
Donar sangre en tiempos de la pandemia de la Covid-19,https://www.prensa.com/sociedad/donar-sangre-en-tiempos-de-la-pandemia-de-la-covid-19/,"Panamá cuenta con cinco centros de donación de sangre −fuera de los bancos de sangre tradicionales− para que los interesados puedan acudir a ellos y no tener que ir a un centro hospitalario, en tiempo",14-12-2020 12:10,https://www.bing.com/th?id=OVFT.Mc-hkiK3HIshF5Sricmsdy,Panamá,prensa.com
Las citas y cirugías electivas están suspendidas en el Hospital del Niño,http://elsiglo.com.pa/panama/citas-cirugias-electivas-estan-suspendidas-hospital-nino/24169457,A partir de este lunes 14 de diciembre se suspenden todas las cirugías electivas y las atenciones en el Servicio de Consulta Externa Especializada del Hospital del Niño - Dr. José Renán Esquivel. La d,14-12-2020 13:00,https://www.bing.com/th?id=OVFT.MidfT1GvGlYaqIDzDV3abC,Panamá,El Siglo
"EE.UU. inicia vacunación contra covid-19, mientras Francia lanza test masivos",https://ensegundos.com.pa/2020/12/14/eeuu-inicia-vacunacion-contra-covid-19-mientras-francia-lanza-test-masivos/,"Este fin de semana, la vacuna de Pfizer/BioNTech comenzó a ser enviada a hospitales y otros lugares, en cajas refrigeradas a -70 ºC, desde la fábrica de Pfizer en Michigan. Estados Unidos inicia este",14-12-2020 13:14,https://www.bing.com/th?id=OVFT.SvxlHquSg-WrxOVfSvF6Ei,Panamá,En Segundos
Vacunas contra la Covid 19 llegarán a Panamá a partir de febrero,https://tucomunidad.com.pa/2020/12/vacunas-contra-la-covid-19-llegaran-a-panama-a-partir-de-febrero/,"Uno de los retos que tiene Panamá para iniciar la aplicación de la vacuna contra la Covid19, es el proceso de almacenamiento y distribución del fármaco, pues requiere ciertos parámetros que deben cumplirse a cabalidad para poder garantizar su óptimo ...",14-12-2020 14:36,https://www.bing.com/th?id=OVFT.grvPVImZLJMBRhCNQD1aCi,Panamá,Tu Comunidad
Comunicado # 293,https://sertv.gob.pa/crisolfm/comunicado-293/,"El ministro de Salud, Luis Francisco Sucre, se reunió este domingo con los principales líderes de las comunidades de fe, radicadas en Panamá, con quienes coordinó una campaña de concienciación naciona",14-12-2020 14:58,https://www.bing.com/th?id=OVFT.k7U-ZggVQk69RWACCR-3vS,Panamá,SERTV
Trabajadora de la salud de Nueva York fue la primera vacunada contra covid-19 en EEUU,https://ensegundos.com.pa/2020/12/14/trabajadora-de-la-salud-de-nueva-york-fue-la-primera-vacunada-contra-covid-19-en-eeuu/,"Una trabajadora de la salud de Nueva York se convirtió este lunes en la primera persona en ser vacunada contra el covid-19 en una ceremonia pública en Estados Unidos, el país del mundo que ha sufrido más muertes por la pandemia. “La primera vacuna ...",14-12-2020 15:00,https://www.bing.com/th?id=OVFT._LmvRJKC-yeuako2K-ju7i,Panamá,En Segundos
Investigan actos vandálicos en red de fibra óptica de Cable Onda,https://www.telemetro.com/entrevistas/2020/12/14/investigan-actos-vandalicos-en-red-de-fibra-optica-de-cable-onda/3554046.html,"Rodrigo Diehl, gerente general de Tigo Millicom Panamá, alertó que los actos vandálicos en la red de fibra óptica de Cable Onda han aumentado en medio de la pandemia del covid-19. La empresa, junto a",14-12-2020 15:14,https://www.bing.com/th?id=OVFT.4lDgcDxSYZnFnvDCYG2SDC,Panamá,Telemetro
