name,url,description,datePublished,imagen,pais,Fuente
Ya están en Panamá las vacunas para ensayo clínico contra la Covid-19,https://www.tvn-2.com/especiales/covid-19/Llegan-Panama-vacunas-ensayo-clinico-contra-Covid-19_0_5670932933.html,Ya llegaron las vacunas para el estudio clínico contra la Covid-19 a Panamá. En tanto se continua con el proceso para identificar a los voluntarios que deben cumplir ciertos requisitos y comprometerse,15-09-2020 00:39,https://www.bing.com/th?id=OVFT.o1CjtsTfLFSEwOKxBjCtTS,Panamá,TVN
ZLC diseña protocolo para un retorno seguro de operaciones,https://ensegundos.com.pa/2020/09/17/zlc-disena-protocolo-para-un-retorno-seguro-de-operaciones/,El informe recoge los lineamientos preventivos de obligatorio cumplimiento para la administración de la Zona Libre de Colón y para el reinicio de operaciones de las compañías. La Zona Libre de Colón (,17-09-2020 15:44,https://www.bing.com/th?id=OVFT.tM-snRjvbqzUsPNAR_X6wi,Panamá,En Segundos
"Empleadores deberán pagar gastos de internet, luz, equipo y mantenimiento del teletrabajador",https://www.laestrella.com.pa/economia/200917/empleador-debera-pagar-gastos-internet-luz-equipo-mantenimiento-teletrabajador,"Tras ocho meses de haber sancionado la Ley 26 que permite el teletrabajo en Panamá, este miércoles 16 de septiembre de 2020, el presidente Laurentino Cortizo firmó la reglamentación que rige esta acti",17-09-2020 15:48,https://www.bing.com/th?id=OVFT.UKXmp6dsY_V_FSP7vmDJGi,Panamá,laestrella.com.pa
Minsa refuerza trazabilidad y pide a la población no olvidar medidas de bioseguridad,https://www.tvn-2.com/nacionales/Minsa-refuerza-trazabilidad-poblacion-bioseguridad_0_5673182634.html,"La directora Nacional de Salud del Ministerio de Salud (Minsa), Nadja Porcell, afirmó que en las últimas semanas se ha intensificado la trazabilidad para ubicar los casos de COVID-19 y se existen alre",17-09-2020 16:02,https://www.bing.com/th?id=OVFT.gww9MFHKGmnkyf-XwvOoRi,Panamá,TVN
CSS inaugura primera clínica Post COVID-19 en el país,https://www.metrolibre.com/nacionales/182178-css-inaugura-primera-cl%C3%ADnica-post-covid-19-en-el-pa%C3%ADs.html,"La Caja de Seguro Social de Panamá (CSS) inauguró la mañana de este jueves 17 de septiembre  la clínica Post COVID-19, instalación en la que se atenderá a los pacientes que presenten secuelas luego de",17-09-2020 16:25,https://www.bing.com/th?id=OVFT.Xbjoqb15oxrn11rxUyjiOS,Panamá,Metro Libre
Convocan vigilia para despedir a víctimas del COVID-19,https://www.radiopanama.com.pa/noticias/actualidad/convocan-vigilia-para-despedir-a-victimas-del-covid19/20200917/nota/4070992.aspx,"El Movimiento Ciudadanos Unidos por una Constituyente (CuCo) realizará una vigilia a partir de las 4:00 PM, cerca de la estación del Metro de la Iglesia del Carmen, en donde se congregarán pacíficamen",17-09-2020 16:33,https://www.bing.com/th?id=OVFT.U5aKDYpkHePXVNpXvKWW7y,Panamá,Radio Panamá
Ortíz recuerda a su amigo Alfonso Brown y dice que Colón viene a dar pelea,http://www.rpctv.com/deportes/beisbol/Ortiz-recuerda-Alfonso-Brown-Colon_0_1392760716.html,"La novena de Colón iniciará los partidos inter-escuadra el lunes 21 en busca de ir definiendo sus jugadores regulares para el próximo Campeonato Nacional de Béisbol Mayor, informó este jueves en rueda",17-09-2020 16:36,https://www.bing.com/th?id=OVFT.oNz2kLi9y2R0i9Qcpzae9y,Panamá,RPCTV
Restaurantes listos para recibir a sus clientes de forma presencial,https://www.metrolibre.com/econom%C3%ADa/182140-restaurantes-listos-para-recibir-sus-clientes-de-forma-presencial.html,"Los restaurantes y las fondas están preparados para  comenzar  a recibir clientes en sus instalaciones, respetando las medidas de seguridad establecidas por las autoridades sanitarias  para minimizar",17-09-2020 17:33,https://www.bing.com/th?id=OVFT.G89SihcmU0g5uv5ClQ8xIy,Panamá,Metro Libre
Fallece privado de libertad positivo de Covid-19,https://ensegundos.com.pa/2020/09/17/fallece-privado-de-libertad-positivo-de-covid-19/,"Con este nuevo fallecimiento, ya son seis los reclusos que no le han ganado la batalla al Covid-19. Un privado de libertad que había dado positivo a Covid-19, falleció en horas de la madrugada de este",17-09-2020 18:17,https://www.bing.com/th?id=OVFT.x_EtV3N-sfiuH8yyKqQC0i,Panamá,En Segundos
Fallece otro privado de libertad en el Santo Tomás,http://elsiglo.com.pa/panama/fallece-otro-privado-libertad-santo-tomas/24164317,"La Dirección General del Sistema Penitenciario (DGSP), informó que un privado de libertad del centro penitenciario El Renacer, falleció en horas de la madrugada de este jueves en el Hospital Santo Tom",17-09-2020 18:28,https://www.bing.com/th?id=OVFT.hjctQk1idqN8BH06kQHxEC,Panamá,El Siglo
Lau Cortés: la CSS no puede ejecutar fianza del proyecto Ciudad de la Salud por 90 días,https://www.prensa.com/sociedad/lau-cortes-la-css-no-puede-ejecutar-fianza-del-proyecto-ciudad-de-la-salud-por-90-dias/,La sentencia del Tribunal se le pide a FCC que cubra los costos de este proceso de arbitraje El Tribunal Internacional de Arbitraje acogió de forma parcial la demanda que presentó el consorcio español,17-09-2020 18:43,https://www.bing.com/th?id=OVFT.rVoIcyLVYyFaTFqFaXCmpi,Panamá,prensa.com
"‘La corrupción, la falta de credibilidad y de ética han sobrevivido a la pandemia’: Conferencia Episcopal",https://www.prensa.com/sociedad/la-corrupcion-la-falta-de-credibilidad-y-de-etica-han-sobrevivido-a-la-pandemia-conferencia-episcopal/,"Los obispos de la Conferencia Episcopal Panameña, que estuvieron reunidos en su asamblea plenaria ordinaria anual del 14 al 17 de septiembre, aseguraron este jueves que han constatado que las problemá",17-09-2020 18:43,https://www.bing.com/th?id=OVFT.FGBvQCnCkuArztp43CIPqC,Panamá,prensa.com
"Moradores de Las Minas en Cerro Silvestre, Arraiján, piden nuevo puente vehicular",https://www.panamaamerica.com.pa/provincias/moradores-de-las-minas-en-cerro-silvestre-arraijan-piden-nuevo-puente-vehicular-1172281,"La intensa lluvia registrada la noche del martes sobre el distrito de Arraiján en Panamá Oeste, causó daños en la base de un puente vehicular, además de 14 casas inundadas. Las viviendas afectadas se",17-09-2020 18:52,https://www.bing.com/th?id=OVFT.t4h6T8g6uJu6OqnGxNIT7i,Panamá,panamaamerica.com.pa
Club de Leones de Panamá en la lucha contra la covid-19,https://www.midiario.com/nacionales/club-de-leones-de-panama-en-la-lucha-contra-la-covid-19/,"Luis Laguerre, presidente del Club de Leones de Panamá, explicó que el proyecto consiste en tener a disposición del personal médico dos vehículo tipo “pick up” para ser utilizados por los equipos de r",17-09-2020 19:00,https://www.bing.com/th?id=OVFT.JCfuZGYgXOgVGL1yd4vR7y,Panamá,Mi Diario
Artesanos recibirán apoyo para Festival Nacional del Sombrero Pinta’o,https://www.diaadia.com.pa/el-pais/artesanos-recibiran-apoyo-para-festival-nacional-del-sombrero-pintao-370453,"El alcalde de La Pintada, Edgar D’Angelo, convocó la mañana de este jueves 17 de septiembre, a una cantidad importante de artesanos, en el marco del Festival Nacional del Sombrero Pinta’o, que este añ",17-09-2020 19:05,https://www.bing.com/th?id=OVFT.mpG-oQSwBHR7J5LglcaWni,Panamá,Día a Día
FEDEBEIS confirma 10 casos positivos de COVID-19 en peloteros de Coclé y Bocas,https://www.telemetro.com/beisbol-mayor-panama/2020/09/17/fedebeis-confirma-10-casos-positivos/3245271.html,"A través de una conferencia virtual este jueves, la Federación Panameña de Béisbol (FEDEBEIS), confirmó 10 casos positivos de coronavirus en peloteros de las provincias de Coclé y Bocas del Toro. En e",17-09-2020 21:05,https://www.bing.com/th?id=OVFT.VvCLo09ZiqNUvg9c4LI8dy,Panamá,Telemetro
Panamá abre una inédita Clínica Post-COVID para pacientes con secuelas,https://noticias24pty.com/panama-abre-una-inedita-clinica-post-covid-para-pacientes-con-secuelas/,"Cansancio y un pequeño temblor en la mano son las aparentes secuelas que ha dejado el COVID-19 a Iris Sánchez, de 68 años, la primera paciente de la Clínica Post-COVID de Panamá, el único centro de es",17-09-2020 21:08,https://www.bing.com/th?id=OVFT.WDV-P8LJTtxOMBh2xSZRDS,Panamá,Noticias 24 PTY
Panamá registra 15 defunciones y 672 casos nuevos de la covid-19,https://www.laestrella.com.pa/nacional/200917/panama-registra-15-defunciones-672-casos,"Panamá registró 15 defunciones y 672 casos nuevos de la covid-19 este jueves, informó el Ministerio de Salud. Con esta actualización el país acumula 2,213 muertes y 104,138 casos detectados. La letali",17-09-2020 22:56,https://www.bing.com/th?id=OVFT.Ogl5ywEttosqD-ITQvqvhi,Panamá,laestrella.com.pa
COVID-19 le arrebata la vida a unidad de la Policía Nacional que tenía 26 años de servicio,https://www.panamaamerica.com.pa/sociedad/covid-19-le-arrebata-la-vida-unidad-de-la-policia-nacional-que-tenia-26-anos-de-servicio,"La Policía Nacional informó este jueves del fallecimiento del capitán post mortem Marvin Flores, por causa de la COVID-19. Mediante un comunicado, el director general de la Policía Nacional, Jorge Mir",17-09-2020 23:02,https://www.bing.com/th?id=OVFT.EbH48FgqWZShLv8xtKUVEC,Panamá,panamaamerica.com.pa
"Panamá alcanza los 104,138 casos de COVID-19 con 672 nuevos contagios",https://www.telemetro.com/nacionales/2020/09/17/panama-alcanza-los-104-138-casos-de-covid-19-con-672-nuevos-contagios/3245621.html,"Panamá suma este jueves 17 de septiembre, 672 nuevos casos de COVID-19, lo que eleva a 104,138 la cifra total de contagios, según indicó el Ministerio de Salud. También se registraron 15 nuevas defunc",17-09-2020 23:10,https://www.bing.com/th?id=OVFT.fRmWn0a960OXA4gzxdbR3y,Panamá,Telemetro
Panamá reporta 15 nuevas defunciones y más de 24 mil casos activos de Covid-19,https://www.critica.com.pa/nacional/panama-reporta-15-nuevas-defunciones-y-mas-de-24-mil-casos-activos-de-covid-19-588105,"Panamá reporta este jueves 17 de septiembre un total de 15 nuevas defunciones a consecuencia del contagio por Covid-19, lo que eleva la cifra de fallecimientos por la enfermedad a 2,213 acumuladas des",17-09-2020 23:37,https://www.bing.com/th?id=OVFT.IGsF3D9BqO2fAnr0AKkG-C,Panamá,Critica
Caja de Seguro Social habilita instalaciones para atender pacientes recuperados de Covid-19,https://www.radiopanama.com.pa/noticias/actualidad/caja-de-seguro-social-habilita-instalaciones-para-atender-pacientes-recuperados-de-covid19/20200917/nota/4071153.aspx,"La nueva Clínica PostCovid ha sido instalada en el tercer piso de la Policlínica Manuel Ferrer Valdés, en Calidonia y busca ofrecer atención oportuna a aquellos pacientes con secuelas a causa del Covi",17-09-2020 23:39,https://www.bing.com/th?id=OVFT.U5aKDYpkHePXVNpXvKWW7y,Panamá,Radio Panamá
US drug company releases protocol for Covid-19 vaccine trial,https://www.newsroompanama.com/news/us-drug-company-releases-protocol-for-covid-19-vaccine-trial,"The American company Moderna, one of two currently conducting a phase 3 clinical trial in the United States for a Covid-19 vaccine, published the full trial pro",18-09-2020 00:16,https://www.bing.com/th?id=OVFT.o-WZjC_9WLwEob0vFbG_uC,Panamá,Newsroom Panama
"Café Geisha rompe su propio récord mundial al colocar la libra a $1,300.50",https://www.critica.com.pa/provincias/cafe-geisha-rompe-su-propio-record-mundial-al-colocar-la-libra-130050-588118,"El café Geisha rompió su propio récord mundial al lograr un precio de $1,300.50 por libra, durante la subasta electrónica ""Best of Panama (BOP) 2020"" realizado el miércoles en horas de la tarde organi",18-09-2020 00:51,https://www.bing.com/th?id=OVFT.cwab-uJAHwImoniCpOJL2S,Panamá,Critica
"Panamá registra un total de 104,138 contagios de covid-19",http://elsiglo.com.pa/panama/panama-registra-total-de104138-contagios-covid-19/24164327,"El Minsa indicó que en las últimas horas se realizaron 5,355 pruebas, para un porcentaje de positividad de 12.5% Las autoridades de Salud señalaron que para este jueves 17 de septiembre se han registr",18-09-2020 01:23,https://www.bing.com/th?id=OVFT.jcDNim5Sup0bVZDTsuSxzi,Panamá,El Siglo
