name,url,description,datePublished,imagen,pais,Fuente
Lotería y carreras de caballos inician actividades desde este 9 de febrero,http://elsiglo.com.pa/panama/loteria-carreras-caballos-inician-actividades-desde-este-9-febrero/24172531,El Minsa informó que pueden retomar sus actividades la Lotería y las carreras de caballos desde hoy martes El Ministerio de Salud de Panamá (Minsa) informó que desde este martes 9 de febrero la Loterí,09-02-2021 15:09,https://www.bing.com/th?id=OVFT.bBhQsPJKjdAsdNE244m6gC,Panamá,El Siglo
Habilitan sala transitoria para pacientes no COVID-19 en La Chorrera,https://www.tvn-2.com/nacionales/Habilitan-transitoria-pacientes-COVID-19-Chorrera_0_5781921780.html,"De manera provisional y por instrucciones del ministro de Salud, Luis Francisco Sucre, se habilitó el Centro de Rehabilitación Integral Reintegra en el distrito de La Chorrera, para atender a paciente",09-02-2021 15:14,https://www.bing.com/th?id=OVFT.-Jx9asvz01wxu6PzTtegUi,Panamá,TVN
OPS exhorta a robustecer la preparación para la vacunación contra el SARS-CoV-2,https://www.prensa.com/sociedad/ops-exhorta-a-robustecer-la-preparacion-para-la-vacunacion-contra-el-sars-cov-2/,La Organización Panamericana de la Salud (OPS) instó a los países de las Américas a asegurarse de que estén preparados para el despliegue de las vacunas contra el nuevo coronavirus SARS-CoV-2 (el viru,09-02-2021 15:50,https://www.bing.com/th?id=OVFT.1suadlG6KxycMd-6AdzIVS,Panamá,prensa.com
"El Hub humanitario en Panamá, distribuye ayuda por 10.44 millones de dólares a 39 países",https://sertv.gob.pa/crisolfm/el-hub-humanitario-en-panama-distribuye-ayuda-por-10-44-millones-de-dolares-a-39-paises/,"En este periodo, desde el llamado Hub Humanitario, las operaciones de respuesta a la COVID-19, se distribuyeron 579 toneladas con un valor de 10.44 millones de dólares a 39 países en la región de las",09-02-2021 17:23,https://www.bing.com/th?id=OVFT.iRSG8mvLcMSZv_uO5OLiTC,Panamá,SERTV
Primer sorteo del año de la Lotería será el 12 de febrero,http://www.nexpanama.com/primer-sorteo-del-ano-de-la-loteria-sera-el-12-de-febrero/,"La Lotería Nacional de Beneficencia (LNB) confirmó que el primer sorteo del año 2021 se realizará este viernes 12 de febrero a la 1:00 p.m. en el auditorio de la entidad, a puertas cerradas. El anunci",09-02-2021 17:37,https://www.bing.com/th?id=OVFT.ykelBQNyswLpRqePUNtg_S,Panamá,NEX TV
Feria de las Flores y el Café en Boquete abre sus puertas al público,https://www.diaadia.com.pa/el-pais/feria-de-las-flores-y-el-cafe-en-boquete-abre-sus-puertas-al-publico-375348,"El Patronato de la feria de Las Flores y el café en el distrito de Boquete, en la provincia de Chiriquí, anunció la apertura al público de sus jardines tomando en cuenta las medidas de bioseguridad po",09-02-2021 18:02,https://www.bing.com/th?id=OVFT.Yo_h8Jmg0HdGw4DIhjCtey,Panamá,Día a Día
CIRSA dona al Minsa $1 millón para comprar vacunas contra la Covid-19,https://www.critica.com.pa/nacional/cirsa-dona-al-minsa-1-millon-para-comprar-vacunas-contra-la-covid-19-597984,"Los recursos entregados se sumarán al presupuesto que ha sido asignado para la compra de las mismas, esto como parte de la estrategia nacional de inmunización.",09-02-2021 18:51,https://www.bing.com/th?id=OVFT.DVat875T4w1RJsocCTAlUi,Panamá,Critica
"Murió África, la perrita que conmovió a todo Panamá por su estado de salud",https://noticias24pty.com/murio-africa-la-perrita-que-conmovio-a-todo-panama-por-su-estado-de-salud/,"Luego de conocer la triste historia de África debido a las múltiples enfermedades que padecía, este martes 9 de febrero, falleció.  También puedes leer: Mujer se pone Gorilla Glue en el pelo y",09-02-2021 19:41,https://www.bing.com/th?id=OVFT.QFGEBIlAXsXsZNLXXZoUCS,Panamá,Noticias 24 PTY
ATP pone en marcha plan para desarrollar potencial turístico de isla Taboga,https://www.radiopanama.com.pa/noticias/actualidad/atp-pone-en-marcha-plan-para-desarrollar-potencial-turistico-de-isla-taboga/20210209/nota/4108386.aspx,"Aseguró que en estos momentos en la isla no hay casos de Covid 19. En el muelle estarán dos inspectores haciendo las verificaciones a medida que lleguen las embarcaciones. “Recibiremos los turistas, quienes deberán cumplir con las medidas de ...",09-02-2021 21:24,https://www.bing.com/th?id=OVFT.U5aKDYpkHePXVNpXvKWW7y,Panamá,Radio Panamá
Reportan 20 decesos en las últimas horas; Rt se mantiene por debajo de 1 por cuarta semana consecutiva,https://www.prensa.com/sociedad/casos-de-covid-19-aumentan-a-328476-se-registran-20-decesos-en-las-ultimas-horas/,"A 328,476 se incrementaron los casos acumulados de la Covid-19 en Panamá, luego de que este martes 9 de febrero se registraran 822 nuevos",09-02-2021 22:39,https://www.bing.com/th?id=OVFT.Xh9klx18M22qB7qtExTkLS,Panamá,prensa.com
"Personal de Salud, realiza hisopado exprés en el distrito de Ocú",https://sertv.gob.pa/nacionalfm/personal-de-salud-realiza-hisopado-expres-en-el-distrito-de-ocu/,"para detectar la COVID-19, cuyos resultados fueron otorgados de forma inmediata. El puesto, contó con la presencia de personal del Ministerio de Salud y Caja de Seguro Social, quienes efectuaron la toma de hisopados, procesamiento de pruebas y entrega de ...",09-02-2021 22:42,https://www.bing.com/th?id=OVFT.WZ3UnsTx1B_YGTmmpbbQqS,Panamá,SERTV
Realizan hisopados exprés en el distrito de Ocú,https://elcapitalfinanciero.com/realizan-hisopados-expres-en-el-distrito-de-ocu/,"Los Equipos de Respuesta Rápida y los Unificados de Trazabilidad del distrito de Ocú, realizaron una jornada de hisopados exprés en el parque de San Sebastián, cerca de un centenar de ocueños asistier",09-02-2021 22:50,https://www.bing.com/th?id=OVFT.ZoCj_TACkCXqTl9P9WN6ji,Panamá,El Capital Financiero
Pleno de la Asamblea ratifica a Eduardo Ortega como Secretario de Senacyt,https://www.midiario.com/nacionales/pleno-de-la-asamblea-ratifica-a-eduardo-ortega-como-secretario-de-senacyt/,"Diputados de distintas bancadas ratificaron a Eduardo Ortega Barría como Secretaría Nacional de Ciencia, Tecnología e Innovación (Senacyt), la tarde este martes 9 de",09-02-2021 22:50,https://www.bing.com/th?id=OVFT.fkG0LvcIL_43dJTFJSZ0Ay,Panamá,Mi Diario
Tyler Christianson lucha por llevar a Panamá a la piscina olímpica de Tokio,https://www.tvmax-9.com/mas_deportes/Tyler-Christianson-Panama-olimpica-Tokio_0_5775922440.html,"Desde pequeño comenzó a practicar deportes, pero la natación fue la que lo cautivó y ahora trabaja por alcanzar la meta de clasificar directamente, por Panamá, a los Juegos Olímpicos de Tokio que se r",09-02-2021 23:13,https://www.bing.com/th?id=OVFT._PQSldqfRMhvJKwNToFrXi,Panamá,TVMAX
Celebración de Jesús Nazareno de Atalaya será a distancia a través de las redes sociales,https://www.midiario.com/nacionales/celebracion-de-jesus-nazareno-de-atalaya-sera-a-distancia-a-traves-de-las-redes-sociales/,"Audilio Aguilar Aguilar, obispo de la Diócesis de Santiago de Veraguas, hace de conocimiento que la festividad de Jesús Nazareno de Atalaya, que implican actos públicos como la romería y otras celebra",09-02-2021 23:24,https://www.bing.com/th?id=OVFT.kiX5U8-snEonF7mr68gmay,Panamá,Mi Diario
COVID-19 en Panamá: 822 casos y 20 defunciones en las últimas 24 horas,https://www.tvn-2.com/nacionales/COVID-19-Panama-casos-defunciones-ultimas_0_5781921846.html,El Sistema de Vigilancia Epidemiológica de Panamá confirmó el deceso de 20 personas y el contagio de otras 822 por la COVID-19.,09-02-2021 23:41,https://www.bing.com/th?id=OVFT.Vn_56K83qI1BUnKcRAjuGi,Panamá,TVN
Minsa reporta 822 nuevos casos de Covid-19 y 20 defunciones más,https://ensegundos.com.pa/2021/02/09/minsa-reporta-822-nuevos-casos-de-covid-19-y-20-defunciones-mas/,"Se da una disminución en el porcentaje de positividad de contagios. En el informe epidemiológico del Ministerio de Salud para este 9 de febrero se reportan 822 nuevos casos de Covid-19 acumulando 328,",09-02-2021 23:50,https://www.bing.com/th?id=OVFT.K1Fo8d6V7SvwLv9bK3cMVS,Panamá,En Segundos
Covid-19 en Panamá: 822 nuevos casos y 20 defunciones en las últimas horas,https://www.metrolibre.com/nacionales/193743-covid-19-en-panam%C3%A1-822-nuevos-casos-y-20-defunciones-en-las-%C3%BAltimas-horas.html,"El Ministerio de Salud (Minsa) confirmó para este martes, 9 de febrero, que detectaron 822 nuevos casos en las últimas 24 horas, para un acumulado de 328,476 contagios de Covid-19. Además, reportaron",10-02-2021 00:00,https://www.bing.com/th?id=OVFT.Y9vwlRh5CthtvSBORjD_4y,Panamá,Metro Libre
Panamá reporta 822 casos nuevos de la covid-19 y 20 defunciones,https://www.laestrella.com.pa/nacional/210209/panama-reporta-822-casos-nuevos-covid-19-20-defunciones,"Panamá reportó 822 casos positivos nuevos, para un total acumulado de 328,476. A la fecha se aplicaron 8,030 pruebas, para un porcentaje de positividad de 10.2%. En las últimas 24 horas se han registr",10-02-2021 00:04,https://www.bing.com/th?id=OVFT.jjKa7INsGcDzEDDO-bpkzi,Panamá,laestrella.com.pa
Reportan 822 casos nuevos y 25 defunciones,https://www.critica.com.pa/nacional/reportan-822-casos-nuevos-y-25-defunciones-598001,"Panamá mantiene su tendencia a la baja en la tasa de positividad diaria del Covid-19, que  fue del 10.2%  tras reportarse 822  nuevos casos en 8,030 pruebas.En las últimas 24 horas se registraron 25 d",10-02-2021 00:11,https://www.bing.com/th?id=OVFT.heWrZeOVJEgSnwWCWZjq9C,Panamá,Critica
"Panamá presenta 328,476 casos acumulados de covid-19 y 5,531 muertes, al cumplirse 11 meses de la pandemia",https://www.panamaamerica.com.pa/sociedad/panama-presenta-328476-casos-acumulados-covid-19-5531-muertes-al-cumplirse-11-meses,"Tras 11 meses de pandemia de covid-19 Panamá presenta 328,476 casos acumulados y 5,531 muertes.De acuerdo con el informe epidemiológico del Ministerio de Salud (Minsa) para este martes nueve de febrer",10-02-2021 00:15,https://www.bing.com/th?id=OVFT.eN2zgKQIV6pE1GxdnyJPNS,Panamá,panamaamerica.com.pa
Chile supera el millón de personas vacunadas contra el covid-19,https://ensegundos.com.pa/2021/02/09/chile-supera-el-millon-de-personas-vacunadas-contra-el-covid-19/,La meta del gobierno es vacunar a cinco millones de personas para fines de marzo y llegar a 15 de los 18 millones de habitantes en julio de 2021. Chile superó este martes el millón de personas vacunad,10-02-2021 00:22,https://www.bing.com/th?id=OVFT.2KYOVoDfM3Svf3AwkFJLmC,Panamá,En Segundos
"Panamá alcanza los 328,476 contagios de COVID-19",https://www.telemetro.com/nacionales/2021/02/10/panama-alcanza-los-328-476-contagios-de-covid-19/3731348.html,"Tras reportar 822 nuevos casos en las últimas 24 horas, Panamá alcanzó los 328,476 contagios de COVID-19, según informa el Ministerio de Salud (Minsa). En tanto, fueron reportados 20 nuevos decesos, e",10-02-2021 00:42,https://www.bing.com/th?id=OVFT.kc_k-Gul-Kv_KDRTaJXJ0S,Panamá,Telemetro
Índice reproductivo del COVID-19 en Panamá está en 0.80,https://www.telemetro.com/nacionales/2021/02/10/indice-reproductivo-del-covid-19-en-panama-esta-en-0-80/3731418.html,"El RT o índice reproductivo efectivo de casos de COVID-19 en Panamá está en 0.80, según indicó el Ministerio de Salud (Minsa). La semana pasada, el Rt estaba en 0.77; y la anterior a esa en 0.78.",10-02-2021 00:54,https://www.bing.com/th?id=OVFT.gnWSPuGuw2sL--DJXDzWcC,Panamá,Telemetro
"Después de vacunadas, 42 personas desarrollaron síntomas de covid-19 en Panamá",https://www.laestrella.com.pa/nacional/210209/vacunadas-42-personas-desarrollaron-sintomas-covid-19-panama,"Las personas que presentaron síntomas se hicieron un PCR positivo, porque estaban incubando el virus en el momento de ser vacunado",10-02-2021 00:58,https://www.bing.com/th?id=OVFT.QHcfmj_GaA6k6B_gh3rk-C,Panamá,laestrella.com.pa
Científicos no logran encontrar procedencia del Covid-19,https://www.radiopanama.com.pa/noticias/internacional/cientificos-no-logran-encontrar-procedencia-del-covid19/20210209/nota/4108467.aspx,"Laorganización advirtió que hay que tener mucha paciencia para encontrar la respuesta,mientras todos los paísesaclaman por la vacuna para inocular a todos los habitantes de cada región",10-02-2021 01:16,https://www.bing.com/th?id=OVFT.U5aKDYpkHePXVNpXvKWW7y,Panamá,Radio Panamá
42 personas vacunadas desarrollaron síntomas de la Covid-19,https://noticias24pty.com/42-personas-vacunadas-desarrollaron-sintomas-de-la-covid-19/,"El asesor del Comité Covid del Ministerio de Salud, Eduardo Ortega, informó que 42 personas, de las 12 mil 806, que recibieron la primera dosis de la vacuna de la Covid-19 han desarrollado",10-02-2021 01:19,https://www.bing.com/th?id=OVFT.RZ7dGk8S60P7cHu0-KY90y,Panamá,Noticias 24 PTY
Se registran 25 fallecidos en el último informe del COVID... No baje la guardia,https://www.diaadia.com.pa/el-pais/se-registran-25-fallecidos-en-el-ultimo-informe-del-covid-no-baje-la-guardia-375388,"“Los resultados que hemos observado en las últimas semanas, tales como la disminución del Índice de Reproducción Efectiva (RT), del virus y el descenso en la ocupación de camas, al igual que de",10-02-2021 03:03,https://www.bing.com/th?id=OVFT.8AYM0ZgW19zW6V7NMr4_Vi,Panamá,Día a Día
