name,url,description,datePublished,imagen,pais,Fuente
Panamá llega a 383.733 casos de la covid-19 y 6.408 defunciones,https://www.msn.com/es-us/noticias/mundo/panam%C3%A1-llega-a-383733-casos-de-la-covid-19-y-6408-defunciones/ar-AAKQAlB,"Panamá reportó este martes 882 nuevos casos de la covid-19 y 4 muertes por la enfermedad, que hacen un total de 383.733 contagios confirmados y 6.408 fallecimientos en más de un año de pandemia, infor",09-06-2021 01:28,https://www.bing.com/th?id=OVFT.gQD8lCThv3WxhxqIhK6_7C,Panamá,MSN
Ver imagen más grande,https://sertv.gob.pa/nacionalfm/comunicado-477/,"En su informe emitido esta tarde, el Programa Ampliado de Inmunización del Ministerio de Salud (MINSA), detalla que, en Panamá, se han aplicado hasta el corte de hoy 1,343,784 dosis de la vacuna contr",17-06-2021 13:00,https://www.bing.com/th?id=OVFT.hLsJxXIA9-TrLEXzsvIe8y,Panamá,SERTV
DATA COVID: Se registra crecimiento de 1.4% en los contagios,https://www.radiopanama.com.pa/noticias/actualidad/data-covid-se-registra-crecimiento-de-14-en-los-contagios/20210617/nota/4143904.aspx,Se mantiene una tendencia semanal al aumento que se reitera en las mismas zonas donde desde hace varias semanas se reporta un número considerable de nuevos contagios.,17-06-2021 13:38,https://www.bing.com/th?id=OVFT.U5aKDYpkHePXVNpXvKWW7y,Panamá,Radio Panamá
"Panamá no reporta muertes de personas por vacunas contra la COVID-19, según el Minsa",https://www.tvn-2.com/nacionales/Panama-personas-Vacunas-COVID-19-Minsa_0_5877912186.html,"El Ministerio de Salud (Minsa) informó este jueves 17 de junio, que la mortalidad a causa de la COVID-19 ha presentado un descenso considerable en los últimos meses e incluso se han reportado días sin",17-06-2021 16:11,https://www.bing.com/th?id=OVFT.Vv5wqV9kHa5j54pZd9T-Ly,Panamá,TVN
No se reportan defunciones relacionadas a vacunas contra la covid-19,https://www.midiario.com/nacionales/no-se-reportan-defunciones-relacionadas-a-vacunas-contra-la-covid-19/,"La mortalidad a causa de la COVID-19 ha presentado en los últimos meses un descenso considerable e incluso se han reportado días sin presentar defunciones en el país, así lo sostuvo la dra. Nadja Porc",17-06-2021 16:40,https://www.bing.com/th?id=OVFT.F-nv_x2tWWt2jWlqcGGqli,Panamá,Mi Diario
Minsa: No se reportan muertes relacionadas a vacunas contra covid-19,https://www.telemetro.com/nacionales/minsa-no-se-reportan-muertes-relacionadas-vacunas-contra-covid-19-n5242961,El Minsa aseguró que la mortalidad a causa de covid-19 en Panamá ha presentado un descenso considerable y la letalidad ha disminuido hasta por debajo de 2.0%.,17-06-2021 16:53,https://www.bing.com/th?id=OVFT.OU8sAjhV4jduwX1kDzvILi,Panamá,Telemetro
Acciones que no se detienen en la región Metropolitana de Salud,https://sertv.gob.pa/nacionalfm/acciones-que-no-se-detienen-en-la-region-metropolitana-de-salud/,"En la región Metropolitana de Salud, se mantienen las acciones enfocadas por la COVID-19 y otras enfermedades propias de la temporada lluviosa en Panamá. Ante las inundaciones ocasionadas por las fuer",17-06-2021 16:58,https://www.bing.com/th?id=OVFT.T7lhtSc9Rxidp-7eB-Xy_i,Panamá,SERTV
MINSA: No se reportan defunciones relacionadas a vacunas contra la COVID-19,https://ensegundos.com.pa/2021/06/17/minsa-no-se-reportan-defunciones-relacionadas-a-vacunas-contra-la-covid-19/,"La doctora Porcell reiteró a la población que al estar vacunado tiene la posibilidad de tener una evolución positiva y desarrollar formas más leves de la enfermedad. La dra. Nadja Porcell, directora g",17-06-2021 17:23,https://www.bing.com/th?id=OVFT.EFsR17H6tEICqLVE8jLNbi,Panamá,En Segundos
Más de mil personas por día se vacunan contra el covid-19 en Westland Mall,http://elsiglo.com.pa/panama/personas-vacunan-contra-covid-19-westland-mall/24179995,"Hasta el miércoles 16 de junio iban contabilizados 3,326 voluntarios vacunados contra el covid-19 en este centro comercial de Panamá Oeste",17-06-2021 17:42,https://www.bing.com/th?id=OVFT.BbpBml_sLbVCMCEfZgOgwi,Panamá,El Siglo
Minsa: No se reportan defunciones relacionadas a vacunas contra COVID-19,https://www.critica.com.pa/nacional/minsa-no-se-reportan-defunciones-relacionadas-vacunas-contra-covid-19-606173,"Panamá en la evolución de la pandemia ha disminuido el porcentaje de la letalidad hasta por debajo de 2.0%, ubicándolo entre los países de la región con las cifras más bajas.",17-06-2021 18:44,https://www.bing.com/th?id=OVFT.qqDP6Dj_8OdXToj0P06bMS,Panamá,Critica
"Panamá registra ""dramática"" disminución de muertes por la covid-19",https://www.laestrella.com.pa/nacional/210617/panama-registra-dramatica-disminucion-muertes-covid-19,"Panamá ha registrado en los últimos meses una disminución ""dramática"" de las muertes por la covid-19, especialmente entre las personas de entre 60 y 80 años, un comportamiento atribuido a la vacunació",17-06-2021 19:46,https://www.bing.com/th?id=OVFT.VrFD9B_3hfAZ1oI3fVerqi,Panamá,laestrella.com.pa
Porcell: No se reportan defunciones relacionadas a vacunas contra el Covid-19,https://www.metrolibre.com/nacionales/205059-porcell-no-se-reportan-defunciones-relacionadas-vacunas-contra-el-covid-19.html,"Porcell dejó claro que no se ha reportado ninguna muerte a causa de las vacunas, “las defunciones que se han registrados han sido pacientes que han fallecido por el Covid-19 pero que no se adjudica a",17-06-2021 20:03,https://www.bing.com/th?id=OVFT.IHW47KsqdqzvB1QjZrKeuC,Panamá,Metro Libre
Panamá registra 'dramática' disminución de muertes por el covid-19,https://www.diaadia.com.pa/el-pais/panama-registra-dramatica-disminucion-de-muertes-por-el-covid-19-735236,"Panamá ha registrado en los últimos meses una disminución ""dramática"" de las muertes por el covid-19, especialmente entre las personas de entre 60 y 80 años, un comportamiento atribuido a la vacunació",17-06-2021 20:13,https://www.bing.com/th?id=OVFT.ZIICacaupyxwZ3-HUIDcdS,Panamá,Día a Día
Cifra de pacientes con covid-19 en unidades de cuidados intensivos va en aumento,https://www.panamaamerica.com.pa/sociedad/cifra-de-pacientes-con-covid-19-en-unidades-de-cuidados-intensivos-va-en-aumento-1189183,El los últimos dos días la cifra de pacientes con covid-19 en unidades de cuidados intensivos (UCI) ha aumentado a más de 70. Versión impresa El pasado martes 16 de junio habían 75 personas contagiadas de covid-19 en unidades de cuidados intensivos.,17-06-2021 20:56,https://www.bing.com/th?id=OVFT.Ainj8INfeHrvtvIqUhBY6i,Panamá,panamaamerica.com.pa
El Minsa reporta 969 nuevos casos de Covid-19 y 536 personas hospitalizadas,https://www.prensa.com/sociedad/el-minsa-reporta-969-nuevos-casos-de-covid-19-y-536-personas-hospitalizadas/,"El Ministerio de Salud (Minsa) registra para este jueves, 17 de junio, 969 nuevos contagios de la Covid-19 para un total de 391,190 casos",17-06-2021 22:18,https://www.bing.com/th?id=OVFT.xmyMbG_tZ_Gizee3SjmDky,Panamá,prensa.com
Más de 26 mil azuerenses optan por la vacuna de AstraZeneca,https://www.critica.com.pa/provincias/mas-de-26-mil-azuerenses-optan-por-la-vacuna-de-astrazeneca-606191,"Se trata de una estrategia de las autoridades de Salud de ambas provincias, para tratar de disminuir los casos activos de la COVID-19, que han tenido un vertiginoso aumento en las últimas semanas.",17-06-2021 22:25,https://www.bing.com/th?id=OVFT.klfxrtYi3A21l27PJwZBNS,Panamá,Critica
Se han aplicado un millón 370 mil 895 dosis de vacunas anticovid en el país,https://www.prensa.com/sociedad/se-han-aplicado-un-millon-370-mil-895-dosis-de-vacunas-anticovid-en-el-pais/,"El informe del Programa Ampliado de Inmunización del Ministerio de Salud (Minsa), de este jueves 17 de junio, revela que en Panamá se han aplicado un millón 370 mil 895 dosis de las vacunas contra la",17-06-2021 22:47,https://www.bing.com/th?id=OVFT.3qlrNN9E59MyXB4liu_T7S,Panamá,prensa.com
"Panamá registra 969 nuevos casos de COVID-19, acumula 391,190 contagios",https://www.telemetro.com/nacionales/panama-registra-969-nuevos-casos-covid-19-acumula-391190-contagios-n5243278,"A la fecha se aplicaron 12,298 pruebas, y se mantiene un porcentaje de positividad de 7.8%, así lo informó el Minsa.",17-06-2021 23:24,https://www.bing.com/th?id=OVFT.K-UQUcBtDWGDQ5MDB9rAQy,Panamá,Telemetro
"Detectan 969 casos de Covid-19 al aplicar 12,298 pruebas",https://www.metrolibre.com/nacionales/205075-detectan-969-casos-de-covid-19-al-aplicar-12298-pruebas.html,"Para este jueves, 17 de junio, el Ministerio de Salud (Minsa) confirma 969 nuevos casos positivos de coronavirus, para un total acumulado de 391,190. A la fecha se aplicaron 12,298 pruebas, y se manti",17-06-2021 23:25,https://www.bing.com/th?id=OVFT.vXORiHHOB07Gbwkh_kdUPi,Panamá,Metro Libre
Panamá reporta 969 casos nuevos y un deceso por la COVID-19 en las últimas 24 horas,https://www.tvn-2.com/nacionales/Panama-reporta-nuevos-COVID-19-ultimas_0_5877912241.html,El Sistema de Vigilancia Epidemiológico de Panamá reportó 1 deceso y 969 infectados por la COVID-19 en las últimas 24 horas.,17-06-2021 23:27,https://www.bing.com/th?id=OVFT.Clz2Gwaxp-LwcR0f3MPOmy,Panamá,TVN
Minsa reporta que en Panamá el porcentaje de letalidad de coronavirus está por debajo del 2.0%,https://www.diaadia.com.pa/el-pais/minsa-reporta-que-en-panama-el-porcentaje-de-letalidad-de-coronavirus-esta-por-debajo-del,"1,370,895 dosis contra la COVID-19 se han aplicado en Panamá, tanto de la casa farmacéutica Pfizer como de AstraZeneca, según destacó el Programa Ampliado de Inmunización del Ministerio de Salud (Mins",17-06-2021 23:40,https://www.bing.com/th?id=OVFT.wlp2IXZKH7Tfb9df_PC5gy,Panamá,Día a Día
"Panamá superó nuevamente los 10,000 mil casos activos de covid-19; OPS reconoce baja letalidad en el país",https://www.laestrella.com.pa/nacional/210617/panama-supero-nuevamente-10-000-mil-casos-activos-covid-19-ops-reconoce-baja-letalidad-pais,"En las últimas 24 horas se registró 1 defunción, con lo que totalizan 6,458 muertes acumuladas, para una letalidad del 1.7 %",17-06-2021 23:51,https://www.bing.com/th?id=OVFT.MwMO_c_OCUw4hxSAb6z6ni,Panamá,laestrella.com.pa
Minsa: 969 casos nuevos y una defunción por covid-19,http://elsiglo.com.pa/panama/minsa969-casos-nuevos-unadefuncion-covid-19/24180008,"Este jueves en Panamá se registraron 969 casos positivos nuevos y una defunción por covid-19. Este jueves en Panamá se registraron 969 casos positivos nuevos de covid-19, para",18-06-2021 00:00,https://www.bing.com/th?id=OVFT.DJi6blIoa6-Ddgegt8Vc1S,Panamá,El Siglo
Reportan 969 nuevos contagios de covid-19 en Panamá este jueves,https://www.midiario.com/salud/reportan-969-nuevos-contagios-de-covid-19-en-panama-este-jueves/,"Para este jueves, 17 de junio de 2021, se reportan 969 nuevos contagios de covid-19 en Panamá, de un total de 12 mil 298 pruebas aplicadas, lo que arroja un porcetaje de positividad de",18-06-2021 00:08,https://www.bing.com/th?id=OVFT.YAC2cZO-yZ7zBJhktWs75i,Panamá,Mi Diario
Peligro del covid-19 sigue latente sobre Panamá:hoy 969 casos positivos nuevos,https://ensegundos.com.pa/2021/06/17/peligro-del-covid-19-sigue-latente-sobre-panamahoy-969-casos-positivos-nuevos/,"El peligro del covid-19 sigue latente sobre Panamá y así lo indican las cifras de hoy: 969 casos positivos nuevos, un acumulado de 391,190; una defunción, para un total de 6,458 acumuladas y una letal",18-06-2021 00:16,https://www.bing.com/th?id=OVFT.OQsBUP9MMqAoc1tOEEn2gS,Panamá,En Segundos
