name,url,description,datePublished,imagen,pais,Fuente
Universitarios se unen a los afectados por la pandemia,https://www.prensa.com/impresa/economia/universitarios-se-unen-a-los-afectados-por-la-pandemia/,"Los universitarios también experimentan las debilidades de una educación a distancia, impuesta por el coronavirus (Covid-19) de un día para otro. Estudiantes de cuatro universidades particulares del p",19-06-2020 07:12,https://www.bing.com/th?id=ON.B58E1F0A14E83F0420B38E07F4CBE59F,Panamá,prensa.com
"Prioridades, señores, prioridades",https://www.prensa.com/impresa/opinion/prioridades-senores-prioridades/,"Un recurso valioso para evitar el caos y alcanzar metas, es determinar prioridades. Cualquier día casero, suena el teléfono, llora un niño, llama un vecino, hierve una olla; en la oficina, brindas ate",20-06-2020 07:44,https://www.bing.com/th?id=ON.9BC26FC26E442192D7684576EACF6388,Panamá,prensa.com
923 coronavirus cases in one day sets new record,https://www.newsroompanama.com/health/923-coronavirus-cases-in-one-day-sets-new-record,"Panama added 923 new cases of COVID- 19 in the last 24 hours, the highest daily total since the pandemic arrived, bringing the total of recorded infections to 2",20-06-2020 13:45,https://www.bing.com/th?id=ON.B8D275E53E180E8A954ACCD86373A91A,Panamá,Newsroom Panama
"Covid-19: Panamá registra cifra récord de 923 nuevos casos para acumular 24,724 contagios",https://ensegundos.com.pa/2020/06/19/panama-registra-cifra-record-de-923-nuevos-casos-para-acumular-24724-contagios/,"En las últimas 24 horas se realizaron 2,833 pruebas nuevas y 10 personas perdieron la batalla contra el virus. El Departamento de epidemiología del Ministerio de Salud, informó que al día de hoy se co",20-06-2020 14:01,https://www.bing.com/th?id=ON.F870F1D74666D06356E3B0CA431EA715,Panamá,En Segundos
Cantantes panameños se unen a la campaña #CabezaEnAlto,https://www.latinol.com/musica/cantantes-panamenos-se-unen-a-la-campana-cabezaenalto/90742.html,"Hace unos días, P&G a través de su marca Head & Shoulders, lanzó en Panamá la campaña #CabezaEnAlto con la cual se comprometió a donar equipos de protección a los profesionales de la salud que se encu",20-06-2020 15:01,https://www.bing.com/th?id=ON.79DC64DE44ED3D5535176D4235410147,Panamá,Latin OL
Sindicatos dicen que la mayoría de los afectados por COVID no recibe ayuda estatal,https://www.tvn-2.com/nacionales/Sindicatos-mayoria-afectados-COVID-estatal_0_5606439322.html,"Sindicatos de Panamá reclamaron este viernes que la mayoría de los trabajadores que están parados por la emergencia de la COVID-19 no reciben una ayuda monetaria aprobada por el Gobierno, por ahora de",20-06-2020 15:31,https://www.bing.com/th?id=ON.2DBE7427A9381BF92CD0C71CF6A5C2C5,Panamá,TVN
MEF: JCJ inspecciona las medidas de bioseguridad en casinos,https://www.panamaamerica.com.pa/economia/mef-jcj-inspecciona-las-medidas-de-bioseguridad-en-casinos-1166074,La Junta de Control de Juegos (JCJ) del Ministerio de Economía y Finanzas (MEF) realizó un recorrido por diversos casinos del área metropolitana con la finalidad de ver si las instalaciones cumplen co,20-06-2020 15:37,https://www.bing.com/th?id=ON.E9AFB28407DEEFC731CB3B48D3E1568E,Panamá,panamaamerica.com.pa
Rescatan en Pacora a un hombre tras ser privado de su libertad en Chilibre,https://www.telemetro.com/nacionales/2020/06/20/rescatan-en-pacora-a-un-hombre-tras-ser-privado-de-su-libertad-en-chilibre/2969921.html,"Docentes del IPHE desarrollan diferentes iniciativas para educar a sus estudiantes Surgen múltiples reacciones por reunión del PRD y multa aplicada La historia de Fidelino, el sociólogo que vive en la",20-06-2020 15:58,https://www.bing.com/th?id=ON.44F94E9D1AA0FA842CF3C96F9A2D929E,Panamá,Telemetro
Equipos de MLB y NHL cierran instalaciones en Florida y ponen en duda su regreso,http://www.nexpanama.com/equipos-de-mlb-y-nhl-cierran-instalaciones-en-florida-y-ponen-en-duda-su-regreso/,"Las esperanza de que regresen los deportes profesionales en Estados Unidos y Canadá se vieron afectadas el viernes, cuando dos equipos de la MLB y uno de la NHL cerraron sus instalaciones en Florida d",20-06-2020 16:41,https://www.bing.com/th?id=ON.5EC387191ED79343F26867C553FA193C,Panamá,NEX TV
Minsa sanciona a Sandra Sandoval con $10 mil por violar cuarentena,https://www.metrolibre.com/nacionales/174462-minsa-sanciona-sandra-sandoval-con-10-mil-por-violar-cuarentena.html,"La ministra de Salud, Rosario Turner, informó que se sancionó con $10 mil a una ciudadana de la provincia de Herrera, que infringió disposiciones de movilidad y salud establecidas por el Minsa ante la",20-06-2020 16:53,https://www.bing.com/th?id=ON.F98E6C88B6FF4D9DDD2EEC5E1D0A84DF,Panamá,Metro Libre
CSS: Cuidados intensivos del Complejo está próximo a alcanzar su máxima capacidad,https://www.metrolibre.com/nacionales/174463-css-cuidados-intensivos-del-complejo-est%C3%A1-pr%C3%B3ximo-alcanzar-su-m%C3%A1xima-capacidad.html,"La Caja de Seguro Social (CSS) informó que la Unidad de Cuidados Intensivos del Complejo Hospitalario Dr. Arnulfo Arias Madrid (CHDr.AAM) está próxima a alcanzar su máxima capacidad.  ""Ante este escen",20-06-2020 17:10,https://www.bing.com/th?id=ON.5FC2E559181AD5A81332BF22F2C083CE,Panamá,Metro Libre
Pekín hace pruebas a repartidores mientras se amplían los controles de COVID-19,http://www.nexpanama.com/pekin-hace-pruebas-a-repartidores-mientras-se-amplian-los-controles-de-covid-19/,Las autoridades de la capital china han estado ampliando las pruebas de ácido nucleico en toda la ciudad de 20 millones de habitantes desde que un grupo de infecciones vinculadas a un mercado mayorist,20-06-2020 17:14,https://www.bing.com/th?id=ON.2F6CA6BD6D103B5E8E011A5B0A2915B5,Panamá,NEX TV
Jugadores de la Liga Panameña de Fútbol participarán en un torneo virtual,https://www.tvmax-9.com/somoslasele/Jugadores-Liga-Panamena-Futbol-participaran_0_5606439340.html,"En un comunicado enviado por la jefatura de prensa de la Federación panameña de Fútbol, se anunció el inicio del torneo virtual con jugadores de la LPF. La Liga Panameña de Fútbol en conjunto con Liga",20-06-2020 17:33,https://www.bing.com/th?id=ON.1481D53D83EAC7D0A9E6A56AEA96F44E,Panamá,TVMAX
Médicos denuncian amenazas de familiares fallecidos por covid-19,http://elsiglo.com.pa/panama/medicos-denuncian-amenazas-familiares-fallecidos-covid-19/24158808,Piden apoyo a la población y a los estamentos de seguridad para garantizar la atención y la integridad del personal de salud La Asociación Panameña de Médicos Intensivistas (ASPAMI) emitió un comunica,20-06-2020 18:15,https://www.bing.com/th?id=ON.281E7C7B13D031879CE514B0B507B122,Panamá,El Siglo
"Panamá contabiliza 923 nuevos contagios de COVID-19, casos cumulados se elevan a 24,274",https://www.telemetro.com/nacionales/2020/06/19/panama-contagios-covid-19-casos/2969656.html,"Reportan que unas 14,359 personas se han recuperado clínicamente, mientras que 8,056 pacientes permanecen en aislamiento domiciliario, y 748 están hoteles. Por otro lado, 503 personas se encuentran ho",20-06-2020 18:20,https://www.bing.com/th?id=ON.D3D3D409BC45EEB7DD077CED6D5EEE2D,Panamá,Telemetro
"El coronavirus favorece la corrupción en Latinoamérica, hay varios casos vinculados a la emergencia sanitaria",https://www.panamaamerica.com.pa/mundo/el-coronavirus-favorece-la-corrupcion-en-latinoamerica-hay-varios-casos-vinculados-la,"El COVID-19 no ha evitado que un virus persistente siga recorriendo Latinoamérica: la corrupción. Repartos irregulares de ayudas, compras sobrevaloradas, falta de transparencia en adjudicaciones, esto",20-06-2020 18:36,https://www.bing.com/th?id=ON.6B2172129C7B8CAACE574D4720E3ADCD,Panamá,panamaamerica.com.pa
Panamá niega permiso para celebrar elecciones dominicanas en su territorio,https://www.diaadia.com.pa/el-pais/panama-niega-permiso-para-celebrar-elecciones-dominicanas-en-su-territorio-367513,"El Gobierno de Panamá negó su permiso para organizar las elecciones presidenciales y legislativas de la República Dominicana en su territorio, previstas para el próximo 5 de julio, anunciaron este sáb",20-06-2020 19:30,https://www.bing.com/th?id=ON.FC60879020EBA3538B7FB639BB8CD748,Panamá,Día a Día
Fiscal de NYC que investigó a aliados de Trump se niega a renunciar,https://ensegundos.com.pa/2020/06/20/fiscal-de-nyc-que-investigo-a-aliados-de-trump-se-niega-a-renunciar/,"El fiscal general William Barr anunció la renuncia de Berman el viernes por la noche y dijo que Trump nominaría al jefe de la Comisión de Valores, Jay Clayton. Un fiscal de Nueva York que investigó a",20-06-2020 19:30,https://www.bing.com/th?id=ON.67460B436DCB37B5503C9DBFCD3E79BE,Panamá,En Segundos
No se permitirá el pago de multa con el fondo del subsidio electoral,http://elsiglo.com.pa/panama/permitira-pago-multa-fondo-subsidio-electoral/24158807,"El TE aclaró la situación debido a la sanción por la suma de B/. 50 mil, impuesta por el Minsa al Partido Revolucionario Democrático (PRD) Este viernes el Tribunal Electoral de Panamá (TE) aclaró en u",20-06-2020 19:32,https://www.bing.com/th?id=ON.9247EC152A3B5100BF5CD8C81668EAEB,Panamá,El Siglo
650.000 trabajadores panameños condenados al hambre,https://bayanodigital.com/650-000-trabajadores-panamenos-condenados-al-hambre/,"Unos 650.000 trabajadores cuyos contratos laborales fueron suspendidos y no clasifican para recibir ayuda gubernamental durante la pandemia de Coronavirus (Covid-19), han sido condenados al hambre y l",20-06-2020 19:39,https://www.bing.com/th?id=ON.5ECF2C1E59878224ADE7670B099D302C,Panamá,Bayano Digital
"""Patrulla Mixta"", nueva estrategia para seguimiento de pacientes Covid-19",https://www.critica.com.pa/nacional/patrulla-mixta-nueva-estrategia-para-seguimiento-de-pacientes-covid-19-581688,"""Patrulla mixta"" es la nueva estrategia que utilizará el Ministerio de Salud y otras instituciones para la trazabilidad y seguimiento de las personas positivas con Covid-19. Luis Francisco Sucre, vice",20-06-2020 19:44,https://www.bing.com/th?id=ON.F9A20532E86A5AC4503E4A682602671B,Panamá,Critica
"Toma de hisopados casa por casa en Loma Cová, corregimiento de Arraiján cabecera",https://noticias24pty.com/toma-de-hisopados-casa-por-casa-en-loma-cova-corregimiento-de-arraijan-cabecera/,"Ocho Equipos de Respuesta Rápida (ERR) de la Caja de Seguro Social (CSS), efectuaron una segunda jornada masiva de captación de casos positivos de coronavirus, en el distrito de Arraiján, una de las z",20-06-2020 20:39,https://www.bing.com/th?id=ON.37AFBFC9E558EA813298941D4335A249,Panamá,Noticias 24 PTY
Investigación por reunión en Parillada Jimmy´s continúa abierta,https://www.radiopanama.com.pa/noticias/actualidad/investigacion-por-reunion-en-parillada-jimmys-continua-abierta/20200620/nota/4048485.aspx,"Tanto los directivos del Partido Revolucionario Democrático como los propietarios del Restaurante y Parrillada Jimmy´s, lugar donde se reunieron los diputados de este colectivo político el pasado juev",20-06-2020 20:51,https://www.bing.com/th?id=ON.7D78B3FEAE78D8AC05601605E2D2BC64,Panamá,Radio Panamá
Proyecto de moratoria es aprobado en tercer debate,https://elcapitalfinanciero.com/proyecto-de-moratoria-es-aprobado-en-tercer-debate/,"El pleno legislativo aprobó en tercer debate el Proyecto de Ley No. 287, que dicta medidas económicas y financieras para contrarrestar los efectos del COVID-19 en la República de Panamá. Esta iniciativa busca beneficiar aquellos panameños que se les ...",20-06-2020 21:32,https://www.bing.com/th?id=ON.FD1EDB747C874E80AB6197EFD996174F,Panamá,El Capital Financiero
Médicos exigen protección en medio de amenazas de pandilleros,https://bayanodigital.com/medicos-exigen-proteccion-en-medio-de-amenazas-de-pandilleros/,Dirigentes de la Asociación de Médicos Intensivistas (ASPAMI) y profesionales de la Salud que luchan contra la pandemia de Coronavirus (Covid-19) solicitaron al gobierno protección ante amenazas de pa,20-06-2020 21:31,https://www.bing.com/th?id=ON.3446ECB25C4FFD8980A92827F48F3FDE,Panamá,Bayano Digital
Importaciones de bienes se desploman,https://www.laestrella.com.pa/economia/200620/importaciones-bienes-panama-desploman-abril,"Como era de esperarse, las cifras de las importaciones de bienes en Panamá se desplomaron de manera general, producto de la compleja situación económica mundial derivada de la crisis del nuevo coronav",20-06-2020 21:40,https://www.bing.com/th?id=ON.F0AE6B51B8716E246553B53F1E9F4D7C,Panamá,laestrella.com.pa
Arquidiócesis advierte que no se pueden visitar criptas en el Día del Padre,https://www.laestrella.com.pa/nacional/200620/arquidiocesis-panama-advierte-visitar-criptas-dia-padre,"Ante los riesgos de contagios de la covid-19 y por la cuarentena absoluta de este domingo, la Arquidiócesis de Panamá informó a la ciudadanía que no se pueden visitar las criptas en el Día del Padre. ""La iglesia católica ha tenido que tomar medidas ...",20-06-2020 21:40,https://www.bing.com/th?id=ON.C1DABC83769681423EED48761F062BA2,Panamá,laestrella.com.pa
Minsa niega permiso para celebrar elecciones dominicanas en Panamá,https://www.critica.com.pa/nacional/minsa-niega-permiso-para-celebrar-elecciones-dominicanas-en-panama-581698,"Panamá negó su permiso para organizar las elecciones presidenciales y legislativas de la República Dominicana en su territorio, previstas para el próximo 5 de julio, anunciaron este sábado las autorid",20-06-2020 21:45,https://www.bing.com/th?id=ON.13F36CCB91126348CFFEE35B686402A5,Panamá,Critica
Comité de pacientes recuperados de COVID-19 oran por las víctimas y hacen un minuto de silencio,https://www.tvn-2.com/nacionales/Comite-pacientes-recuperados-COVID-19-victimas_0_5606439363.html,"Integrantes del Comité de Pacientes Recuperados de COVID-19, realizaron una jornada de oración, este sábado 20 de junio, en los predios del Hospital Integral Panamá Solidario, ubicado en Albrook. Albe",20-06-2020 21:53,https://www.bing.com/th?id=ON.DAFE1A8CC31A7FB8F4D43A86B58840BD,Panamá,TVN
Búsqueda de casos de COVID-19 en Loma Cová,https://noticias24pty.com/busqueda-de-casos-de-covid-19-en-loma-cova/,"Ocho Equipos de Respuesta Rápida (ERR) de la Caja de Seguro Social (CSS), efectuaron una segunda jornada masiva de captación de casos positivos de coronavirus, en el distrito de Arraiján, una de las z",20-06-2020 21:59,https://www.bing.com/th?id=ON.6A597FA87ABA3EDBD40611579DD03FF3,Panamá,Noticias 24 PTY
