name,url,description,datePublished,imagen,pais,Fuente
"Panamá presentó en marzo reducción relativa del 37.8% de la pandemia, según la OPS",https://www.tvn-2.com/nacionales/Panama-presento-reduccion-relativa-OPS_0_5825417518.html,"Mientras otros países del continente registran un alza en el número de casos positivos, la Organización Panamericana de la Salud (OPS) en su último reporte destacó que para el pasado mes de enero Pana",09-04-2021 01:03,https://www.bing.com/th?id=OVFT.dMYnva1ImIx0m_57ak_R2y,Panamá,TVN
Panamá reporta 364 casos positivos y 2 nuevas defunciones por Covid-19,https://www.radiopanama.com.pa/noticias/fecha/20210407.aspx,"El jefe de Epidemiología del Minsa, Leonardo Labrador, indicó que en la última semana se han detectado 17 viajeros que dieron positivo para Covid-19 en pruebas realizadas en el Aeropuerto de Tocumen.",09-04-2021 01:03,https://www.bing.com/th?id=OVFT.U5aKDYpkHePXVNpXvKWW7y,Panamá,Radio Panamá
"Covid-19 Panamá: casos, 357,704; fallecidos, 6,152; recuperados, 347,060; pruebas realizadas, 2,214.840",https://noticias24pty.com/covid-19-panama-casos-357704-fallecidos-6152-recuperados-347060-pruebas-realizadas-2214-840/,El 9 de marzo el Ministerio de Salud reportó el primer caso confirmado de coronavirus Covid-19 en Panamá. A partir de la fecha el ministerio ha reportado diariamente a través de conferencias de,09-04-2021 01:07,https://www.bing.com/th?id=OVFT.aUMWEWJd5zsu_BCqNtgqkS,Panamá,Noticias 24 PTY
Unos 800 niños y niñas están recibiendo estimulación temprana en 60 CAIPI,https://www.diaadia.com.pa/el-pais/unos-800-ninos-y-ninas-estan-recibiendo-estimulacion-temprana-en-60-caipi-732593,"que han permitido que hoy estos centros estén operando libre del COVID-19. Estas aperturas también han contribuido a la reactivación económica, ya que 262 maestras han regresado a sus puestos de trabajo. La titular de la cartera social les ...",09-04-2021 01:16,https://www.bing.com/th?id=OVFT.FLt94zdCFzwK7HkeYe0oYC,Panamá,Día a Día
Presidente Cortizo: la justicia es la columna vertebral de la democracia,https://lagacetadepanama.com/presidente-la-justicia-es-la-columna-vertebral-de-la-democracia/,"Durante un recorrido por dos centros de vacunación contra la COVID-19, en escuelas del circuito 8-10, el gobernante señaló que el «trabajo que hagan el Ministerio Público y el Órgano Judicial es fundamental para la democracia», por lo que se ...",09-04-2021 01:17,https://www.bing.com/th?id=OVFT.y9cDytl40GhIqm4iVOSBJS,Panamá,La Gaceta de Panama
"Gobierno Nacional proyecta inmunizar a 122,416 personas en los circuitos 8-1, 8-6 y 8-10",https://lagacetadepanama.com/gobierno-nacional-proyecta-inmunizar-a-122416-personas-en-los-circuitos-8-1-8-6-y-8-10/,"La Estrategia Continua de Vacunación (PanavaC-19) realiza, de manera simultánea, jornadas de inmunización contra la COVID-19 en los circuitos 8-6, 8-10 y 8-1, donde se pretende alcanzar, desde el lune",09-04-2021 01:21,https://www.bing.com/th?id=OVFT.TNRAVBqxGGT4Rj3OkM4qTC,Panamá,La Gaceta de Panama
4 decesos y tasa de contagio de 4.6%,https://www.critica.com.pa/nacional/4-decesos-y-tasa-de-contagio-de-46-601792,"Panamá reportó ayer 4 decesos por Covid-19 y 427 contagios con una tasa de positividad diaria de 4. 6%. Hay 357,704 casos acumulados y 6,152 fallecimientos a",09-04-2021 02:20,https://www.bing.com/th?id=OVFT.XOIwHtQVEeNaRxIxxaa8pi,Panamá,Critica
Panamá espera vacunar contra la covid-19 unos 350 mil pacientes que padecen de enfermedades crónicas,https://www.panamaamerica.com.pa/sociedad/panama-espera-vacunar-contra-covid-19-unos-350-mil-pacientes-que-padecen-enfermedades,"Esto luego de que los pacientes con enfermedades crónicas han estado insistiendo en la importancia y la necesidad que tienen en ser vacunados, ante el peligro de quedar contagiados con la covid-19. Entre tanto, la Organización Panamericana de la Salud ...",09-04-2021 02:51,https://www.bing.com/th?id=OVFT.r_1lqo12behA9t0YYrprFS,Panamá,panamaamerica.com.pa
Va un aproximado de 18 mil personas vacunadas en Arraiján,https://www.midiario.com/nacionales/va-un-aproximado-de-18-mil-personas-vacunadas-en-arraijan/,"Más de 18 mil personas se han inmunizado en los dos primeros días de vacunación contra la covid-19 en el distrito de Arraiján. Durante la pandemia Arraiján fue uno de los sectores con más casos de contagios, que provocó que en dos ocasiones ...",09-04-2021 04:16,https://www.bing.com/th?id=OVFT.EFUIeOP3rmJpAj3tH3lEVy,Panamá,Mi Diario
"Proceso de vacunación avanza a buen paso en el 8-10, 8-6 y 8-1",http://elsiglo.com.pa/panama/proceso-vacunacion-avanza-buen-paso-8-10-8-6-8-1/24175888,"La ministra Consejera de Salud, Eyra Ruiz, calificó de ‘ordenado y dinámico', el proceso Inmunización. El proceso de vacunación contra el covid-19 en los circuitos 8-10, 8-6 y 8-1 continúa avanzando s",09-04-2021 05:05,https://www.bing.com/th?id=OVFT.UHeOikZcQWGjnWheoaHHlC,Panamá,El Siglo
Minsa se refiere a disminución de casos activos y pasajeros con COVID-19,https://www.telemetro.com/nacionales/entrevistas/minsa-se-refiere-disminucion-casos-activos-y-pasajeros-covid-19-n5001223,"Sobre la disminución de los casos activos de COVID-19 en Panamá, habló Leonardo Labrador, jefe de Epidemiología del Ministerio de Salud (Minsa).",09-04-2021 12:55,https://www.bing.com/th?id=OVFT.eobl4KIQYJ6WBrXHin8-ry,Panamá,Telemetro
"En dos jornadas se han vacunado contra la Covid-19 a 18,820 personas en Arraiján",https://www.prensa.com/sociedad/en-dos-jornadas-se-han-vacunado-contra-la-covid-19-a-18820-personas-en-arraijan/,"Después de dos jornadas de vacunación en el circuito 8-1 (Arraiján), la dirección regional de Salud de Panamá Oeste confirmó que un total de 18,820 personas han recibido la primera dosis contra la Covid-19. La inmunización de mayores de 60 años ...",09-04-2021 14:57,https://www.bing.com/th?id=OVFT.S0k7-S4Eyw_zq2wFCrPuWC,Panamá,prensa.com
Miviot y juntas comunales adecuarán 24 escuelas para vacunación contra Covid-19 en circuito 8-4,https://elcapitalfinanciero.com/miviot-y-juntas-comunales-adecuaran-24-escuelas-para-vacunacion-contra-covid-19-en-circuito-8-4/?doing_wp_cron=1617981882.2249329090118408203125,"donde se desarrollará el plan de vacunación contra la Covid-19, denominado Operación PanaVac-19. Abdías Culiolis, director de la oficina del Miviot en Chepo, indicó que en conjunto con representantes de cinco entidades, el alcalde de Chepo ...",09-04-2021 14:59,https://www.bing.com/th?id=OVFT.dng-P7yBh44WbdFVFR0Oty,Panamá,El Capital Financiero
"En Panamá, casos activos continúan bajando y aumentan los recuperados",https://sertv.gob.pa/nacionalfm/en-panama-casos-activos-continuan-bajando-y-aumentan-los-recuperados/,"En el boletín epidemiológico regional, se reporta en la Semana Epidemiológica N° 13 que, se mantienen 703 casos activos, 590 pacientes en aislamiento domiciliario, 85 en hospitales, 28 pacientes en ho",09-04-2021 15:05,https://www.bing.com/th?id=OVFT._e_3pk4rQJdgnZbm1pyZFC,Panamá,SERTV
"Panamá tiene letalidad por la covid-19 del 1.7%, la segunda más baja de Centroamérica",https://www.panamaamerica.com.pa/sociedad/panama-tiene-letalidad-por-covid-19-del-17-segunda-mas-baja-centroamerica-1184880,"El Ministerio de Salud (Minsa) informó que Panamá que tiene una letalidad por la covid-19 del 1.7%, la segunda más baja de Centroamérica, de acuerdo a un informe de la Organización Panamericana de la",09-04-2021 15:10,https://www.bing.com/th?id=OVFT.T_uVN1bB43M3wN8G2dJSJi,Panamá,panamaamerica.com.pa
"Ministros de Estado realizan balance sobre la COVID-19, en la región",https://sertv.gob.pa/nacionalfm/ministros-de-estado-realizan-balance-sobre-la-covid-19-en-la-region/,"de lo alcanzado luego de iniciar la vacunación en cada país y la situación actual de COVID-19”, manifestó recientemente, la viceministra de Salud, Ivette Berrio. Berrio, destacó, que en los países de la región, están surgiendo terceras olas de ...",09-04-2021 15:12,https://www.bing.com/th?id=OVFT.Rexkbm2qvX7hUQtFt_oC9C,Panamá,SERTV
Ipsos explica contratiempos financieros que han experimentado los panameños por COVID-19,https://www.telemetro.com/nacionales/entrevistas/ipsos-explica-contratiempos-financieros-que-han-experimentado-los-panamenos-covid-19-n5001238,Gerente de la encuestadora Ipsos dice que la recuperación económica en Panamá es menor que en el resto de la región.,09-04-2021 16:37,https://www.bing.com/th?id=OVFT.PCoTjIMtCxiEvEUGgVqcqy,Panamá,Telemetro
Panamá aprueba el uso de emergencia de la vacuna china CoronaVac,https://www.prensa.com/sociedad/panama-aprueba-el-uso-de-emergencia-de-la-vacuna-china-coronavac/,"Panamá aprobó el uso de emergencia de la vacuna china CoronaVac, de la casa farmacéutica SinovaC, contra la Covid-19, confirmó este viernes. 9 de abril, el Ministerio de Salud",09-04-2021 17:04,https://www.bing.com/th?id=OVFT.X0eSO1cTvoKQavfb-LcacS,Panamá,prensa.com
Aprueban uso de emergencia de la vacuna china SinovaC,http://www.nexpanama.com/aprueban-uso-de-emergencia-de-la-vacuna-china-sinovac/,"La dirección nacional de farmacias y drogas del Ministerio de Salud aprobó esta mañana el uso de emergencia al producto “CoronavaC” (vacuna COVID-19 células Vero, inactivo) de la farmacéutica china, SinovaC, manifestó Elvia Lao, directora ...",09-04-2021 18:01,https://www.bing.com/th?id=OVFT.hHsvNbJx7mAtaLSx0okqFC,Panamá,NEX TV
Panamá aprueba el uso de emergencia de la vacuna china,https://www.laestrella.com.pa/nacional/210409/panama-aprueba-emergencia-vacuna-china-farmaceutica-sinovac,"La dirección nacional de farmacias y drogas del Ministerio de Salud aprobó esta mañana el uso de emergencia al producto “CoronavaC” (vacuna COVID-19 células Vero, inactivo) de la farmacéutica china, SinovaC, manifestó Elvia Lao, directora ...",09-04-2021 18:03,https://www.bing.com/th?id=OVFT.yljkjv1WrlRTAGS0cyxyWy,Panamá,laestrella.com.pa
Empresarios exigen apertura de las galleras,https://www.critica.com.pa/nacional/empresarios-exigen-apertura-de-las-galleras-601831,"Pablo Núñez, representtante de los ""galleros"", dijo que en la provincia de Chiriquí está permitida, sin embargo, en otras provincias esta actividad está suspendida desde hace meses por la pandemia de",09-04-2021 18:44,https://www.bing.com/th?id=OVFT.ywzf9B2SxE3bPKmlMOSRxy,Panamá,Critica
Panamá es el tercer país de América con mayor proporción de personas vacunadas contra el coronavirus,https://www.midiario.com/nacionales/panama-es-el-tercer-pais-de-america-con-mayor-proporcion-de-personas-vacunadas-contra-el-coronavirus/,"Panamá, que acumula 357 mil 704 casos de la covid-19 y 6 mil 148 muertes por la enfermedad, es el tercer país de América con mayor proporción de personas vacunadas contra el coronavirus, dijo este mié",09-04-2021 18:56,https://www.bing.com/th?id=OVFT.0PjSFGN0ALpkhs15_fdfCS,Panamá,Mi Diario
El 88% de los citados en Panamá Este ha recibido la vacuna contra la covid-19,https://www.laestrella.com.pa/nacional/210409/88-poblacion-panama-recibido-vacuna-covid-19,"Se espera que unas 35 mil personas entre adultos mayores de 60 años, docentes y embarzadas sean vacunadas en el circuito 8-10",09-04-2021 19:16,https://www.bing.com/th?id=OVFT.xww1QOYuxSW0TBHKSUXMYi,Panamá,laestrella.com.pa
Más de 18 mil personas vacunadas en Arraiján,https://ensegundos.com.pa/2021/04/09/mas-de-18-mil-personas-vacunadas-en-arraijan/,"para un acumulado de 18,820 personas vacunadas contra el Covid-19 en el circuito 8-1. En este proceso de vacunación durante los dos primeros días ya han recibido su primera dosis de vacunas 16,416 adultos mayores de 60 años, 2,276 docentes y 128 ...",09-04-2021 19:27,https://www.bing.com/th?id=OVFT.YxcjfSAbPxfChYYodjs4Wy,Panamá,En Segundos
88% de las personas se han aplicado vacuna en el 8-10,https://ensegundos.com.pa/2021/04/09/88-de-las-personas-se-han-aplicado-vacuna-en-el-8-10/,"Vacunación incluye adultos mayores de 60 años, educadores y embarazadas. De acuerdo con el Ministerio de Salud (MINSA), en el circuito 8-10 la Operación PanavaC-19 en dos días de haberse iniciado ha a",09-04-2021 20:15,https://www.bing.com/th?id=OVFT.M3ji6ixQ6E_orDmrp-6MZi,Panamá,En Segundos
