name,url,description,datePublished,imagen,pais,Fuente
COMUNICADO # 295: Panamá aprueba uso de la vacuna Pfizer,https://sertv.gob.pa/nacionalfm/comunicado-295/,"El Gobierno Nacional, aprobó el uso por emergencia de la vacuna Pfizer contra la COVID-19, en base al marco legal que establece la ley 97 del 4 de octubre de 2019 y del Decreto Ejecutivo 36 del 17 de",16-12-2020 21:27,https://www.bing.com/th?id=OVFT.hLsJxXIA9-TrLEXzsvIe8y,Panamá,SERTV
Instalarán camas para pacientes de COVID-19 en gimnasio de la UP,https://www.critica.com.pa/nacional/instalaran-camas-para-pacientes-de-covid-19-en-gimnasio-de-la-594445,"El Consejo Académico de  la Univesidad de Panamá aprobó por unanimidad en la tarde de hoy, que la Caja del Seguro Social utilice el área del gimnasio para instalación de camas para atender casos de CO",16-12-2020 21:45,https://www.bing.com/th?id=OVFT.osKpArvZXCbWeyYKSvWbDy,Panamá,Critica
Oficina de cedulación de Ancón cierra temporalmente,https://www.metrolibre.com/nacionales/189297-oficina-de-cedulaci%C3%B3n-de-anc%C3%B3n-cierra-temporalmente.html,"La medida responde a “los casos registrados de Covid-19, y para salvaguardar la salud de los funcionarios y de nuestros usuarios”. Se explicó que solo se brindará el servicio de entrega de cédula previamente tramitado por ventanilla, en horario de 7 ...",16-12-2020 22:03,https://www.bing.com/th?id=OVFT.mZk_Zd-8WEu7IPznzN1bly,Panamá,Metro Libre
"Panamá suma hoy 2,960 casos positivos de COVID-19 y 28 defunciones",https://www.critica.com.pa/nacional/panama-suma-hoy-2960-casos-positivos-de-covid-19-y-28-defunciones-594451,"Según los datos estadísticos del Minsa la totalidad de defunciones por esta enfermedad, desde que inició la pandemia, se elevaron a 3,439 acumuladas, para una tasa de letalidad del 1.7 %.",16-12-2020 23:54,https://www.bing.com/th?id=OVFT.aqF6o4RA4tANGMNY7_Hrzi,Panamá,Critica
Cifras covid-19 en Panamá: 2.960 casos nuevos y 28 defunciones,http://elsiglo.com.pa/panama/cifras-covid-19-2960-casos-nuevos-28-defunciones/24169591,"Para hoy miércoles 16 de diciembre el Ministerio de Salud (Minsa) de Panamá contabilizó 166,600 pacientes recuperados, 2,960 casos positivos nuevos, para un total acumulado de 199,947. En las últimas 24 horas se aplicaron 13,981 pruebas, para un ...",17-12-2020 00:06,https://www.bing.com/th?id=OVFT.r59l1DWGXYQLOVj3ZTATaS,Panamá,El Siglo
IATA hace un llamado para que Panamá y Venezuela restablezcan urgentemente los vuelos,https://noticias24pty.com/iata-hace-un-llamado-para-que-panama-y-venezuela-restablezcan-urgentemente-los-vuelos/,"Venezuela tenía una conectividad aérea internacional muy limitada, incluso antes de la pandemia de la COVID-19. Los vuelos recientemente reiniciados desde y hacia Panamá, se convirtieron en un salvavidas, tanto para los pasajeros como para la carga ...",17-12-2020 00:21,https://www.bing.com/th?id=OVFT.cSgwFuxB5yg9oDCWd5wNvy,Panamá,Noticias 24 PTY
Crece la amenaza del aumento del desempleo ante el panorama dibujado por el Covid-19,https://www.tvn-2.com/nacionales/Crece-ameza-aumento-desempleo_0_5740675939.html,"Esperan que con la medida esto se pueda minimizar. Antes de la llegada del COVID-19 a Panamá, según la Contraloría General de la República, el número de desempleados en el país era de 146 mil personas, pero las estimaciones del gobierno y sector ...",17-12-2020 00:43,https://www.bing.com/th?id=OVFT.H7USvMy6Hd8ntXpvtvb2hS,Panamá,TVN
Una persona está muriendo cada hora en Panamá por covid-19. Reportan cuáles son los corregimientos con más contagios,https://www.midiario.com/salud/una-persona-esta-muriendo-cada-hora-en-panama-por-covid-19-reportan-cuales-son-los-corregimientos-con-mas-contagios/,"Para este miércoles, 16 de diciembre, las autoridades de salud reportan 2 mil 960 nuevos casos de covid-19 en Panamá, para un total de 199 mil 947 contagios desde que inició la pandemia en el país. Además, reportan que 28 personas más han muerto en ...",17-12-2020 00:51,https://www.bing.com/th?id=OVFT.hl81iror05RBDH-EUuT5Jy,Panamá,Mi Diario
Productores advierten que usarán armas para defenderse en Panamá Oeste,https://www.diaadia.com.pa/el-pais/productores-advierten-que-usaran-armas-para-defenderse-en-panama-oeste-373495,"Propietarios de fincas ganaderas y porcinas en la provincia de Panamá Oeste, advirtieron a las autoridades que tomaran las armas para defender su patrimonio y familias de los ataques de bandas delincu",17-12-2020 01:35,https://www.bing.com/th?id=OVFT.jrL2uwA0y80LipuIaAH4wi,Panamá,Día a Día
Lotería Nacional de Beneficencia anuncia cambios en sorteos debido a implementación de nuevas restricciones,https://www.panamaamerica.com.pa/sociedad/loteria-nacional-beneficencia-anuncia-cambios-en-sorteos-debido-implementacion-nuevas,"Debido a las nuevas restricciones anunciadas por el Gobierno  para mitigar el contagio de la COVID-19, la Lotería Nacional de Beneficencia (LNB), adelantó que los sorteos retornarán a su horario habit",17-12-2020 02:02,https://www.bing.com/th?id=OVFT.vK9GAuS87MM8qGGQkJuYFy,Panamá,panamaamerica.com.pa
Hospitales aplazan consultas y citas ante repunte de casos,https://www.prensa.com/impresa/panorama/hospitales-aplazan-consultas-y-citas-ante-repunte-de-casos/,"Dos de los principales hospitales del país decidieron suspender la atención en la consulta externa, ante el incremento de casos de la Covid-19 que reporta el país. Ayer, la dirección médica del Hospital Santo Tomás informó que se optó por suspender ...",17-12-2020 05:00,https://www.bing.com/th?id=OVFT.KbVrBIiIB_bHrOVGhLn6fy,Panamá,prensa.com
Exportaciones de bienes crecen 29% impulsadas por el sector minero,https://www.laestrella.com.pa/economia/201217/exportaciones-bienes-crecen-29-impulsadas,"Con estos resultados, y pese a la pandemia de la covid-19, se rompe la barrera de la mala racha que traían las exportaciones nacionales después de 2008 cuando también rebasó los $1,000 millones, según los números oficiales. “Cuando vemos el ...",17-12-2020 05:25,https://www.bing.com/th?id=OVFT.xaNC6kyQisA3vVEjRnY-GS,Panamá,laestrella.com.pa
Universidad de Panamá aprueba uso de gimnasio para pacientes con la Covid-19,https://noticias24pty.com/universidad-de-panama-aprueba-uso-de-gimnasio-para-pacientes-con-la-covid-19/,"Un equipo técnico de la Caja de Seguro Social (CSS) llevará a cabo una inspección hoy al gimnasio de la Universidad de Panamá (UP), en el que se atenderá a pacientes con la Covid-19 en estado",17-12-2020 06:50,https://www.bing.com/th?id=OVFT.f-Q3MZthcW4fkc4Sg52hES,Panamá,Noticias 24 PTY
Salud financiera para terminar el año e iniciar 2021 dando espacio al ahorro,https://www.tvn-2.com/contenido_exclusivo/Salud-financiera-ahorro-economia-Panama_0_5740675962.html,"Pese a que Panamá vive tiempos difíciles en su economía debido a la crisis sanitaria del COVID-19, diciembre trae consigo gastos agregados a las familias, pues algunos salen a comprar regalos, artícul",17-12-2020 11:18,https://www.bing.com/th?id=OVFT.oZsIrIqCEknLga-YDfniKi,Panamá,TVN
Con el covid imparable Panamá registra nuevo récord de casos diarios,https://www.diaadia.com.pa/el-pais/con-el-covid-imparable-panama-registra-nuevo-record-de-casos-diarios-373519,"Panamá registró en las últimas 24 horas 2.960 nuevos casos de covid-19, un récord enmarcado en el fuerte repunte de la enfermedad, y 28 defunciones, que elevaron hasta 199.947 los contagios conf",17-12-2020 11:17,https://www.bing.com/th?id=OVFT.l4gQedx8hnVeuu68JqXb_y,Panamá,Día a Día
"Presidente de Francia, Emmanuel Macron, da positivo por COVID-19",https://www.panamaamerica.com.pa/mundo/presidente-francia-emmanuel-macron-da-positivo-por-covid-19-1177974,"El presidente francés, Emmanuel Macron, ha dado positivo por coronavirus este jueves y permanecerá siete días aislado, aunque mantendrá sus actividades a distancia, indicó el Elíseo. Versión impresa El jefe del Estado se sometió a un test PCR ...",17-12-2020 12:08,https://www.bing.com/th?id=OVFT.vzokNnxcEqwExARXxwPT8C,Panamá,panamaamerica.com.pa
Presidente de Francia da positivo por COVID-19,http://www.nexpanama.com/presidente-de-francia-da-positivo-por-covid-19/,"El presidente francés Emmanuel Macron ha dado positivo en el test de COVID-19, dijo la presidencia francesa el jueves, sin saberse claramente y de forma inmediata dónde habría contraído el nuevo virus",17-12-2020 12:49,https://www.bing.com/th?id=OVFT.UjarvwKMRDS99Tv3XaM7fS,Panamá,NEX TV
América Latina empieza a dar luz verde a la vacuna con la inmunidad aún lejos,https://www.laestrella.com.pa/internacional/america/201217/america-latina-empieza-dar-luz-verde-vacuna-inmunidad-lejos,"América Latina sigue lejos de inyectar las primeras vacunas contra la covid-19 pero esta semana Chile, México, Ecuador, Panamá y Costa Rica despejaron el camino al dar luz verde a la vacuna de Pfizer y BioNTech. Mientras se aceleran las gestiones para ...",17-12-2020 13:15,https://www.bing.com/th?id=OVFT.Dl7z3zDmLO10fti-N3vH3y,Panamá,laestrella.com.pa
Tribunal Electoral informa el cierre temporal del registro civil,https://www.metrolibre.com/nacionales/189361-tribunal-electoral-informa-el-cierre-temporal-del-registro-civil.html,"Debido a que se han registrado varios casos de la Covid-19, el Pleno del Tribunal Electoral (TE) ordenó el cierre desde hasta el 27 de diciembre del despacho principal de la dirección nacional de registro civil y de la dirección regional del registro ...",17-12-2020 13:29,https://www.bing.com/th?id=OVFT.mZk_Zd-8WEu7IPznzN1bly,Panamá,Metro Libre
"Contratos de médicos extranjeros será temporal, aclaró Minsa",https://elcapitalfinanciero.com/contratos-de-medicos-extranjeros-sera-temporal-aclaro-minsa/,"Los contratos de los especialistas extranjeros serían temporales, y durante ese tiempo se mantendrá la contratación del 100% del personal médico panameño que desee trabajar en la lucha contra la COVID-19, reiteró el organismo en un comunicado de prensa.",17-12-2020 14:07,https://www.bing.com/th?id=OVFT.2OeJCb8ZcYbHmmETlx9_Sy,Panamá,El Capital Financiero
Así se curó Bobby de la picada del bicho,http://elsiglo.com.pa/panama/curo-bobby-picada-bicho/24169621,"Esto es lo que hizo el empresario Roberto Eisenmann en su lucha contra la covid-19, una enfermedad que ha cobrado la vida de más de 3 mil 400 personas en Panamá. En su cuenta de Twitter escribió lo siguiente: ""Me preguntan al saber de mi lucha con Covid ...",17-12-2020 14:10,https://www.bing.com/th?id=OVFT.-tM7tOPvfXWHgSQxcGWoAy,Panamá,El Siglo
Alergólogo explica reacciones por aplicación de la vacuna contra covid-19,https://www.telemetro.com/entrevistas/2020/12/17/alergologo-explica-reacciones-por-aplicacion-de-la-vacuna-contra-covid-19/3564513.html,"El alergólogo, Moisés Zebede habló sobre la producción de la vacuna de Pfizer contra el covid-19, cómo ayuda a combatir el virus y las reacciones que podría causar su aplicación. Zebede dijo la vacuna",17-12-2020 14:26,https://www.bing.com/th?id=OVFT.eOwxq_Tb4Vj0D9DueQ3JeC,Panamá,Telemetro
Mike Pompeo en cuarentena tras haber estado en contacto con persona contagiada de Covid-19,https://www.radiopanama.com.pa/noticias/fecha/20201217.aspx,"En los últimos meses se han dado decenas de casos de covid-19 en la Casa Blanca, entre los que figura el presidente, Donald Trump, y la primera dama, Melania Trump",17-12-2020 14:41,https://www.bing.com/th?id=OVFT.U5aKDYpkHePXVNpXvKWW7y,Panamá,Radio Panamá
"Proteger a millones de personas con vacunas contra la Covid-19 será una tarea colosal, afirma la directora de la OPS",https://www.prensa.com/salud-ciencia/proteger-a-millones-de-personas-con-vacunas-contra-la-covid-19-sera-una-tarea-colosal-afirma-la-directora-de-la-ops/,"“Aunque esperamos que 2021 abra un nuevo capítulo en nuestra lucha contra este virus, proteger a millones de personas en nuestra región con vacunas contra la Covid-19 será una tarea",17-12-2020 15:00,https://www.bing.com/th?id=OVFT.Y2ykYZ_4dgytcuJNXDOfHC,Panamá,prensa.com
Comunicado # 296,https://sertv.gob.pa/nacionalfm/comunicado-296/,"Además, señala que ya se han iniciado las conversaciones con la Organización Panamericana de la Salud (OPS) y algunas embajadas, al igual que también se han realizado reuniones con el Consejo Técnico",17-12-2020 15:15,https://www.bing.com/th?id=OVFT.mjziWgtBwMeBdIvEKXOavS,Panamá,SERTV
Macron da positivo por covid-19 y obliga a aislarse a varios líderes europeos,https://ensegundos.com.pa/2020/12/17/macron-da-positivo-por-covid-19-y-obliga-a-aislarse-a-varios-lideres-europeos/,"Tras el diagnóstico establecido con ""pruebas RT-PCR realizadas en cuanto aparecieron los primeros síntomas"", el jefe de Estado francés ""estará aislado durante siete días"" pero ""seguirá trabajando y re",17-12-2020 15:19,https://www.bing.com/th?id=OVFT.UUTnZXEoAP_O91Gt0krbXC,Panamá,En Segundos
Detallan quiénes podrán movilizarse durante toque de queda y cuarentena,https://www.telemetro.com/nacionales/2020/12/17/detallan-podran-movilizarse-durante-toque/3564774.html,"El Gobierno Nacional detalló este jueves qué tipo de personal está autorizado para movilizarse durante las horas del toque de queda y la cuarentena de fin de semana, medidas establecidas en Panamá par",17-12-2020 15:20,https://www.bing.com/th?id=OVFT.D4JDCzhJ5wdC_UjtvVOp4i,Panamá,Telemetro
Sucre: ‘Nosotros no podemos permitir que sigan aumentando las muertes’,https://www.midiario.com/nacionales/sucre-nosotros-no-podemos-permitir-que-sigan-aumentando-las-muertes/,"Tras el nuevo récord de casos diarios de la covid-19 que registró el país el miércoles (2 mil 960), el ministro de Salud, Luis Francisco Sucre, manifestó que las cifras de las últimas semanas han obli",17-12-2020 15:44,https://www.bing.com/th?id=OVFT.J6avYvpJfGneywAvOAsNoC,Panamá,Mi Diario
Barça-Real Sociedad y Real Madrid-Athletic Bilbao disputarán la Supercopa española,http://www.nexpanama.com/barca-real-sociedad-y-real-madrid-athletic-bilbao-disputaran-la-supercopa-espanola/,"El Fútbol Club Barcelona se enfrentará a la Real Sociedad, actual colíder de La Liga, en las semifinales de la Supercopa de España, mientras que el defensor del título, el Real Madrid, se enfrentará a",17-12-2020 16:29,https://www.bing.com/th?id=OVFT.1-vTgfyAoFXaXwOCJKK-Yy,Panamá,NEX TV
Cómo una idea remota llevó hasta las vacunas contra la Covid-19 a través del ARN mensajero,https://ensegundos.com.pa/2020/12/17/como-una-idea-remota-llevo-hasta-las-vacunas-contra-la-covid-19-a-traves-del-arn-mensajero/,"Ahora, su trabajo pionero, que allanó el camino para las vacunas contra el covid-19 de los laboratorios Pfizer/BioNTech y Moderna, podría ser lo que salve al mundo de una pandemia de 100 años. La obse",17-12-2020 17:00,https://www.bing.com/th?id=OVFT.I_1Ma8mwdBu3aPxzgMl9EC,Panamá,En Segundos
