name,url,description,datePublished,imagen,pais,Fuente
"Covid-19 en Panamá: 22 defunciones y 2,806 casos este sábado",https://www.laestrella.com.pa/nacional/201212/covid-19-panama-22-defunciones-2-806-casos-sabado,"Panamá registró 22 defunciones por covid-19 y 2,806 casos durante las últimas 24 horas, informó el Ministerio de Salud. Con esta actualización, el país acumula 3,331 muertes por el virus y 190,585 cas",12-12-2020 22:41,https://www.bing.com/th?id=OVFT.pDmkTKuVBjP42O4u1U4vbC,Panamá,laestrella.com.pa
"Con 2,806 nuevos contagios de COVID-19, Panamá alcanza un total de 190,585 casos",https://www.telemetro.com/nacionales/2020/12/12/minsa-contagios-de-covid-19-panama/3550014.html,"El informe epidemiológico del Ministerio de Salud de Panamá (Minsa) informó este sábado 12 de diciembre que se han registrado 190,585 casos acumulados de COVID-19, luego de se registraran 2,806 nuevos contagios en las últimas 24 horas El reporte ...",12-12-2020 22:45,https://www.bing.com/th?id=OVFT.CsfZzilnbXyj0Kd19eG-RC,Panamá,Telemetro
Comunicado # 291,https://sertv.gob.pa/crisolfm/comunicado-291/,"Posteriormente visitaron diversas instalaciones médicas, las cuales incluyeron el Hospital Nicolás Solano, el principal hospital de Panamá Oeste. El ministro solicitó el apoyo a los representantes y j",12-12-2020 22:46,https://www.bing.com/th?id=OVFT.NgejyZ9m253gdLFc69rKty,Panamá,SERTV
"Panamá reporta 2,806 casos nuevos de Covid-19 en las últimas 24 horas",https://www.tvn-2.com/nacionales/Panama-reporta-positivos-Covid-19-ultimas_0_5737676228.html,"Para hoy sábado 12 de diciembre en Panamá, las autoridades de salud contabilizan 160,641 pacientes recuperados, 2,806 casos positivos nuevos, para un total acumulado de 190,585.",12-12-2020 22:48,https://www.bing.com/th?id=OVFT.V7JNSnaTfxDWwbSVTmP4aC,Panamá,TVN
"Siguen subiendo: ¡2,806 casos nuevos de COVID-19!",https://www.critica.com.pa/nacional/siguen-subiendo-2806-casos-nuevos-de-covid-19-594210,"Panamá contabiliza 2,806 casos positivos nuevos, para un total acumulado de 190,585 y 22 nuevas defunciones que elevan la cifra a 3,331acumuladas y una letalidad del 1.7 %.Los casos activos suman 26,6",12-12-2020 22:55,https://www.bing.com/th?id=OVFT.pQ3sRhrwjOfo1rHgj6SEFC,Panamá,Critica
Más de 500 personas con COVID-19 han sido detectadas en el aeropuerto de Tocumen,https://www.telemetro.com/nacionales/2020/12/12/500-personas-covid-19-positivo/3550056.html,"A la fecha se han realizado 24,601 pruebas de COVID-19, detectandose 549 pasajeros con COVID-19 en el Aeropuerto Internacional de Tocumen, tras la reactivación de los vuelos internacionales, así lo in",12-12-2020 23:01,https://www.bing.com/th?id=OVFT.VRiY1pNMeSbLdcCFNAxVMi,Panamá,Telemetro
Otra cifra récord. Siguen disparados los contagios de covid-19. Reportan 2 mil 806 casos nuevos este sábado,https://www.midiario.com/nacionales/otra-cifra-record-siguen-disparados-los-contagios-de-covid-19-reportan-2-mil-806-casos-nuevos-este-sabado/,"Una nueva cifra récord de contagiados se contabilizan para este sábado 12 de diciembre en Panamá, nada menos que 2 mil 806 casos positivos nuevos, arrojando un total acumulado de 190 mil 585 contagiad",12-12-2020 23:27,https://www.bing.com/th?id=OVFT.okT4M2iuymxUv-R0Aauzwi,Panamá,Mi Diario
"Las defunciones por COVID-19 no bajan, 22 en las últimas horas",https://noticias24pty.com/las-defunciones-por-covid-19-no-bajan-22-en-las-ultimas-horas/,"El ministro de Salud, Luis Francisco Sucre y la ministra consejera Eyra Ruiz se reunión este sábado con Luis Campana director de MiBus; Héctor Ortega director general del Metro de Panamá y Miguel",12-12-2020 23:27,https://www.bing.com/th?id=OVFT.VMzkGD_hlwOD2oPu9bgiOC,Panamá,Noticias 24 PTY
Panamá busca frenar contagio en transporte público en pleno repunte de covid-19,https://www.laestrella.com.pa/nacional/201212/panama-busca-frenar-contagio-transporte-publico-pleno-repunte-covid,Buses y andenes del Metro abarrotados de personas sin posibilidad de mantener el distanciamiento físico son imágenes que se repiten en los medios de comunicación y redes sociales de Panamá,12-12-2020 23:46,https://www.bing.com/th?id=OVFT.rr_ea1XZFWMCUEaID3Uuey,Panamá,laestrella.com.pa
Caja de Seguro Social cierra su Departamento de Planilla ante gran cantidad de casos por COVID-19,https://www.tvn-2.com/nacionales/Caja-Seguro-Social-cierra-planillas-COVID-19-Panama_0_5737676232.html,"El director de la Caja de Seguro Social (CSS), Enrique Lau Cortés, confirmó este sábado 12 de diciembre el cierre temporal del Departamento de Planillas de la entidad, debido a varios casos de COVID-1",13-12-2020 00:03,https://www.bing.com/th?id=OVFT.bUotv93IluZxieGNXngFPC,Panamá,TVN
COVID-19 impacta el consumo interno en Panamá,https://www.panamaamerica.com.pa/economia/covid-19-impacta-consumo-interno-en-panama-1177740,"El fuerte impacto de la crisis de la pandemia a la economía nacional ha incidido en el alza del desempleo, el empleo informal generando que el consumo de los panameños haya disminuido, así lo aseguran",13-12-2020 01:28,https://www.bing.com/th?id=OVFT.zPeZolrnJCPsvqP9q75dHC,Panamá,panamaamerica.com.pa
New dry law - curfew expanded,https://www.newsroompanama.com/news/new-dry-law-curfew-expanded,"The increase in cases of covid-19 has led to the imposition of a new dry law and the expansion of curfew in the province of Panama. Minister of Health, Luis",13-12-2020 04:44,https://www.bing.com/th?id=OVFT.fh22ITiT3DIvki6RxZUhaS,Panamá,Newsroom Panama
El Metro de Panamá: ¿estamos preparados para un desastre?,http://elsiglo.com.pa/panama/metro-panama-estamos-preparados-para-desastre/24169379,El Metro de Panamá se ha convertido en el medio de transporte público más importante en la capital. En la actualidad el Metro de Panamá ha disminuido el número de pasajeros debido a la emergencia sani,13-12-2020 05:08,https://www.bing.com/th?id=OVFT.LZ9C7dQDi-P6gff3a_NgUi,Panamá,El Siglo
Sáenz Llorens vaticina aumento de defunciones y casos en pocos dias,http://elsiglo.com.pa/panama/saenz-llorens-vaticina-aumento-defunciones-casos-pocos-dias/24169383,"El referente en temas de coronavirus, publicó en su cuenta de twitter que las muertes por la Covid 19, aumentarán en el país",13-12-2020 05:17,https://www.bing.com/th?id=OVFT.k7D3PauXkwQM_aNx2N6yBi,Panamá,El Siglo
"Récord de contagio ayer, pero el porcentaje de positividad es menor a julio y agosto",https://www.critica.com.pa/nacional/record-de-contagio-ayer-pero-el-porcentaje-de-positividad-es-menor-julio-y-agosto-594238,"Panamá registró ayer un récord de contagios diarios por Covid-19 con 2,806 casos tras 16,400 pruebas con un porcentaje de positividad del 17. 1%. Hay un total",13-12-2020 05:33,https://www.bing.com/th?id=OVFT.HIzg0nyFKrvQiDbfmQelCi,Panamá,Critica
La COVID-19 ha cobrado la vida de unos 25 abogados a nivel nacional,https://www.panamaamerica.com.pa/judicial/covid-19-ha-cobrado-vida-unos-25-abogados-nivel-nacional-1177756,"Más de 25 abogados litigantes han perdido la vida a causa de la COVID-19, desde marzo a la fecha, según indicó Juan Carlos Araúz, presidente del Colegio Nacional de Abogados (CNA).Igualmente, hay un s",13-12-2020 05:39,https://www.bing.com/th?id=OVFT.7IT2aWFS81lyDJXQIssr0i,Panamá,panamaamerica.com.pa
Panamá hace llamado para combatir el cambio climático,https://ensegundos.com.pa/2020/12/13/panama-hace-llamado-para-combatir-el-cambio-climatico/,"Al 2050, el país proyecta reducir en un 24%, las emisiones de gases de efecto invernadero del Sector Energía. Conscientes del llamado de acción para contrarrestar los efectos del cambio climático y ca",13-12-2020 12:12,https://www.bing.com/th?id=OVFT.FVHxETXUhBxJCFr8-tIL4y,Panamá,En Segundos
No era suficiente y ahora será peor. Juan Diego reacciona a exclusión de menores de 25 años del Vale Digital,https://www.midiario.com/nacionales/no-era-suficiente-y-ahora-sera-peor-juan-diego-reacciona-a-exclusion-de-menores-de-25-anos-del-vale-digital/,TAMBIÉN PUEDES LEER: Otra cifra récord. Siguen disparados los contagios de covid-19. Reportan 2 mil 806 casos nuevos este sábado Este viernes Cortizo firmó el Decreto Ejecutivo No. 830 que realizó modificaciones al Plan Panamá Solidario. El grupo ...,13-12-2020 12:24,https://www.bing.com/th?id=OVFT.3ADrzxWi0hl0VNfzXWX9iS,Panamá,Mi Diario
Exhortan al uso de las pantallas faciales en el transporte público,https://www.prensa.com/sociedad/exhortan-al-uso-de-las-pantallas-faciales-en-el-transporte-publico/,"El ministro de Salud, Luis Francisco Sucre, se reunió, el sábado 12 de diciembre con el director de MiBus, Luis Campana, el director general del Metro de Panamá, Héctor Ortega, y el director general d",13-12-2020 12:50,https://www.bing.com/th?id=OVFT.ps5kTIYglak4zMqgbP2Eui,Panamá,prensa.com
"Estados Unidos prepara la vacunación contra la Covid-19, que roza 1.6 millones de muertos en el mundo",https://www.prensa.com/mundo/estados-unidos-prepara-la-vacunacion-contra-la-covid-19-que-roza-16-millones-de-muertos-en-el-mundo/,"Los lotes de la vacuna de Pfizer/BioNTech contra la Covid-19 estaban listos para abandonar la planta de la empresa en Michigan este domingo, de cara a una campaña de vacunación de millones de estadoun",13-12-2020 13:10,https://www.bing.com/th?id=OVFT.3LbYHbsCEdD39GSPwyq4hi,Panamá,prensa.com
"EE.UU. prepara la vacunación contra el covid-19, que roza 1,6 millones de muertos en el mundo",https://ensegundos.com.pa/2020/12/13/ee-uu-prepara-la-vacunacion-contra-el-covid-19-que-roza-16-millones-de-muertos-en-el-mundo/,"Las dosis serán enviadas en cajas con nieve carbónica, que las mantendrán a -70 ºC, la temperatura necesaria para conservar la vacuna. Los lotes de la vacuna de Pfizer/BioNTech contra el covid-19 esta",13-12-2020 13:24,https://www.bing.com/th?id=OVFT.3U1PdcISL-dtPUVAghOs-i,Panamá,En Segundos
