name,url,description,datePublished,imagen,pais,Fuente
Ya están en Panamá las vacunas para ensayo clínico contra la Covid-19,https://www.tvn-2.com/especiales/covid-19/Llegan-Panama-vacunas-ensayo-clinico-contra-Covid-19_0_5670932933.html,Ya llegaron las vacunas para el estudio clínico contra la Covid-19 a Panamá. En tanto se continua con el proceso para identificar a los voluntarios que deben cumplir ciertos requisitos y comprometerse,15-09-2020 00:39,https://www.bing.com/th?id=OVFT.o1CjtsTfLFSEwOKxBjCtTS,Panamá,TVN
Atentos. Estas son las fechas de entrega del vale digital,https://www.midiario.com/nacionales/atentos-estas-son-las-fechas-de-entrega-del-vale-digital/,"El presidente de la República, Laurentino Cortizo, anunció este lunes que a partir de mañana y hasta el 26 de septiembre, se estará realizando la transferencia de vale digital a 415 mil 143 panameños",22-09-2020 01:33,https://www.bing.com/th?id=OVFT.zrkMMKttM-hXmDrtTVzV9S,Panamá,Mi Diario
Modifican horario del transporte selectivo en Panamá y Panamá Oeste,https://www.midiario.com/nacionales/modifican-horario-del-transporte-selectivo-en-panama-y-panama-oeste/,Mientras que la medida par y non se mantiene. La regulación de los horarios se dio debido a la pandemia de la covid-19 que azotó desde marzo a Panamá donde a la fecha van 106 mil 810 casos acumulados de coronavirus y dos mil 272 defunciones. LEA ...,22-09-2020 01:32,https://www.bing.com/th?id=OVFT.-yi4OWcA98SnyDW2unTLqC,Panamá,Mi Diario
Pompeo llama a Nito,https://www.critica.com.pa/nacional/pompeo-llama-nito-588415,"El pasado mes de agosto, el presidente Cortizo recibió la visita oficial del consejero de Seguridad Nacional estadounidense, Robert O'Brien, en el Palacio de las Garzas, donde conversaron sobre la asistencia de Estados Unidos ante la COVID-19, crecimiento ...",22-09-2020 02:16,https://www.bing.com/th?id=OVFT.kCBODYpCqagzYwSPqaIRRC,Panamá,Critica
OPS: Panamá evidencia una fase de desacelaración y superó el primero pico de la pandemia,https://www.telemetro.com/nacionales/2020/09/21/panama-evidencia-fase-desacelaracion-supero/3260156.html,Un reporte semanal sobre la situación del COVID-19 en Panamá publicado por la Organización Panamericana de la Salud (OPS) indica que el país evidencia una fase de desaceleración y se superó el primer,22-09-2020 02:16,https://www.bing.com/th?id=OVFT.o4A9wiFHPVJfrxpw1_sHzC,Panamá,Telemetro
"Pompeo llama a su aliado ""Nito""...¡Aló, aló!",https://www.critica.com.pa/nacional/pompeo-llama-su-aliado-nitoalo-alo-588415,"El secretario de Estado norteamericano, Mike Pompeo, habló este lunes con el presidente de Panamá, Laurentino ""Nito"" Cortizo, sobre la lucha contra el coronavirus y sobre seguridad antidrogas, informó",22-09-2020 02:21,https://www.bing.com/th?id=OVFT.kCBODYpCqagzYwSPqaIRRC,Panamá,Critica
"Atlapa y el ISTE, en la mira para pacientes con Covid-19",https://www.prensa.com/impresa/panorama/atlapa-y-el-iste-en-la-mira-para-pacientes-con-covid-19/,"Las autoridades de Salud tienen identificadas más instalaciones con el propósito de habilitar provisionalmente camas para pacientes con Covid-19, y un presupuesto de $5.2 millones para su remodelación",22-09-2020 05:06,https://www.bing.com/th?id=OVFT.xy6EYXgEz4YPbfKv2x0YYC,Panamá,prensa.com
Panamá registra 15 nuevas defunciones por coronavirus,https://www.metrolibre.com/nacionales/182489-panam%C3%A1-registra-15-nuevas-defunciones-por-coronaviru.html,"El Ministerio de Salud (Minsa) reveló que para hoy lunes 21 de septiembre Panamá registró 607 nuevos de Covid-19, para un total acumulado de 106,810. De acuerdo al informe epidemiológico, se aplicaron",22-09-2020 07:07,https://www.bing.com/th?id=OVFT.23fro5-enot7mMzRapwQ8i,Panamá,Metro Libre
No habrá que temer al contagio de COVID-19 en hoteles hospitales,https://www.panamaamerica.com.pa/sociedad/no-habra-que-temer-al-contagio-de-covid-19-en-hoteles-hospitales-1172574,"Con la reapertura de la actividad turística y de hotelería, surgen muchas interrogantes sobre los hoteles hospitales que alojan a pacientes positivos por COVID-19 y el tratamiento que se le dará a las",22-09-2020 07:36,https://www.bing.com/th?id=OVFT.iohrOnPY1_oMwISskFPJUy,Panamá,panamaamerica.com.pa
"Mediante Factoring, Caja de Ahorros financia transacciones comerciales",https://noticias24pty.com/mediante-factoring-caja-de-ahorros-financia-transacciones-comerciales/,"La situación económica para los empresarios en Panamá no está nada bien, debido a que por varios meses no pudieron operar de manera regular por motivo de la pandemia por COVID-19, sin embargo, como pa",22-09-2020 08:10,https://www.bing.com/th?id=OVFT.vyp7GjdPo0aqIkAt7IpPRC,Panamá,Noticias 24 PTY
Panamá supera el primer pico de la pandemia… 15 muertes en las última horas,https://noticias24pty.com/panama-supera-el-primer-pico-de-la-pandemia-15-muertes-en-las-ultima-horas/,"En las últimas 24 horas se registraron 15 defunciones por COVID-19 en Panamá, para totalizar 2,272. Mientras que se contabilizaron 82,320 pacientes recuperados, 607 casos positivos nuevos, para un total acumulado de 106,810. A la fecha se aplicaron ...",22-09-2020 08:15,https://www.bing.com/th?id=OVFT.s3U1C6VlCceBsqbZjRigiS,Panamá,Noticias 24 PTY
Apps útiles para el desconfinamiento,https://www.metrolibre.com/tecnolog%C3%ADa/182499-apps-%C3%BAtiles-para-el-desconfinamiento.html,"En Panamá aún no hay apps de rastreo del Covid-19 o herramientas similares, pero otras con algo más de antigüedad pueden ser útiles a la hora de recordarnos cómo prevenir el virus. Si solemos ser desp",22-09-2020 09:35,https://www.bing.com/th?id=OVFT.qi3cApRWYELjVOWRlziC0y,Panamá,Metro Libre
"Anuncian nueva transferencia del vale digital para 415,143 personas",https://www.nexpanama.com/anuncian-nueva-transferencia-del-vale-digital-para-415143-personas/,"El presidente Laurentino Cortizo anunció que esta semana se realizará la transferencia del vale digital a 415,143 panameños afectados por el impacto económico de la COVID-19. “La primera transferencia se realiza el día de mañana ...",22-09-2020 11:57,https://www.bing.com/th?id=OVFT.nYaCCnIa_jLTXlP0HDcgBS,Panamá,NEX TV
El mundo bate un récord y registra casi 2 millones de casos de coronavirus en una semana,https://www.prensa.com/mundo/el-mundo-bate-un-record-y-registra-casi-2-millones-de-casos-de-coronavirus-en-una-semana/,"El mundo registró cerca de 2 millones de casos de la Covid-19 la semana pasada, una cifra récord, mientras que el número de decesos disminuyó con respecto a la semana precedente, según los datos divulgados este martes por la Organización Mundial de ...",22-09-2020 12:13,https://www.bing.com/th?id=OVFT.HMvT8aXcDRYU_BlQXGtGLi,Panamá,prensa.com
Italia aprueba reducir su parlamento en medio de la pandemia,https://www.radiopanama.com.pa/noticias/internacional/italia-aprueba-reducir-su-parlamento-en-medio-de-la-pandemia/20200922/nota/4071992.aspx,"Italia ha registrado 5 mil nuevos casos positivos de COVID-19 en los últimos 3 días, y permanece como el país con menor número de contagios de la región. Aunque si se mira la cantidad de fallecidos, aparece en el primer lugar desde el inicio de la ...",22-09-2020 12:38,https://www.bing.com/th?id=OVFT.U5aKDYpkHePXVNpXvKWW7y,Panamá,Radio Panamá
El Reino Unido vuelve a imponer toque de queda para combatir el COVID.19,https://www.radiopanama.com.pa/noticias/internacional/el-reino-unido-vuelve-a-imponer-toque-de-queda-para-combatir-el-covid19/20200922/nota/4071998.aspx,"En medio de la pandemia del COVID-19, el gobierno del Reino Unido vuelve a imponer medidas de restricción, para combatir los contagios. El toque de queda desde las 10 de la noche para bares y restaura",22-09-2020 12:49,https://www.bing.com/th?id=OVFT.U5aKDYpkHePXVNpXvKWW7y,Panamá,Radio Panamá
Caja de Ahorros impulsa factoring para generar liquidez en las empresas,https://anpanama.com/10399-Caja-de-Ahorros-impulsa-factoring-para-generar-liquidez-en-las-empresas.note.aspx,"(Ciudad de Panamá-ANPanamá) La estatal Caja de Ahorros anunció la implementación de un plan de factoring para que las empresas que tengan cuentas por cobrar con el Gobierno de Panamá, puedan obtener d",22-09-2020 13:54,https://www.bing.com/th?id=OVFT.Lk1ixbTlnHMgr3gtIOfTpS,Panamá,AN Panama
"Proyecto de reserva hídrica, principal objetivo del Canal de Panamá en su presupuesto 2021",https://anpanama.com/10398-Proyecto-de-reserva-hidrica-principal-objetivo-del-Canal-de-Panama-en-su-presupuesto-2021.note.aspx,"(Ciudad de Panamá-ANPanamá) Con el proyecto de proveer recursos hídricos para los ciudadanos y la operación del Canal de Panamá, la administración de la vía presentó su presupuesto a la Asamblea Nacio",22-09-2020 13:54,https://www.bing.com/th?id=OVFT.u3Q-XUgUW9TTY7v3c4i4fy,Panamá,AN Panama
Pompeo elogia a Cortizo en Twitter,https://radioreformaseoye.com/internacionales/pompeo-elogia-a-cortizo-en-twitter/,"Según la vocera Ortagus, Estados Unidos ha proporcionado más de 4 millones para enfrentar la pandemia ocasionada por la Covid-19. El secretario de Estado ... NitoCortizo today about our strong U.S.-Panama partnership. Panama remains a key regional ...",22-09-2020 14:16,https://www.bing.com/th?id=OVFT.Wkx4XbOGa9YbjQX_sa-wCC,Panamá,Radio Reforma se Oye
"Canal de Panamá sustenta presupuesto 2021 por $3,308.9 millones",https://www.laestrella.com.pa/economia/200922/canal-panama-sustenta-presupuesto-2021-base-ingresos-3-308-9-millones,"Pese a que la pandemia de la covid-19 aún sigue impactando las economías del mundo, el administrador del Canal de Panamá, Ricaurte Vásquez Morales, estimó para la vigencia fiscal 2021 ingresos por $3,308.9 millones y aportes al Tesoro Nacional por $ ...",22-09-2020 14:22,https://www.bing.com/th?id=OVFT.C35K3ZaZ9t5AARwbXby21y,Panamá,laestrella.com.pa
Empresarios panameños prevén crecimiento positivo para último trimestre del 2020,https://www.telemetro.com/nacionales/2020/09/22/empresarios-preven-crecimiento-positivo-ultimo/3261684.html,"De acuerdo con Chapman, espera que no haya un aumento de los contagios de COVID-19 y se pueda continuar abriendo todas las actividades económicas de forma oportuna y en las fechas establecidas por el Gobierno Nacional. “Eso nos debe llevar a empezar a ...",22-09-2020 14:27,https://www.bing.com/th?id=OVFT.5ag0EcvpHQhK7XGfhKMlRi,Panamá,Telemetro
Reino Unido impone restricciones de seis meses para frenar nueva ola de COVID-19,http://www.nexpanama.com/reino-unido-impone-restricciones-de-seis-meses-para-frenar-nueva-ola-de-covid-19/,"El primer ministro Boris Johnson pidió el martes a los británicos que trabajen desde casa siempre que sea posible y ordenó el cierre más temprano de restaurantes y bares para frenar la rápida propagación de una segunda ola de coronavirus, con ...",22-09-2020 14:48,https://www.bing.com/th?id=OVFT.dC1KwEAGWa1RjKYP4AykES,Panamá,NEX TV
Universidad de Panamá presenta propuesta para la reactivación económica del país,https://ensegundos.com.pa/2020/09/22/universidad-de-panama-presenta-propuesta-para-la-reactivacion-economica-del-pais/,"La Universidad de Panamá presentó un plan para la reactivación económica del país, en medio de la pandemia por el Covid-19, que ha mantenido al Estado con severas medidas sanitarias y económicas por al menos seis meses. En el documento, que contempla ...",22-09-2020 15:55,https://www.bing.com/th?id=OVFT.JWJTDEEtQPeTNRXadpJsoC,Panamá,En Segundos
Canal de Panamá sustenta presupuesto del AF 2021 en la Asamblea Nacional,https://www.panamaamerica.com.pa/economia/canal-de-panama-sustenta-presupuesto-del-af-2021-en-la-asamblea-nacional-1172584,"por la vía interoceánica transitarán 429.2 millones de toneladas CP/SUAB (Sistema Universal de Arqueo de Buques del Canal de Panamá), con base en el comportamiento de la economía mundial tras el impacto de la pandemia de Covid-19. Para la vigencia ...",22-09-2020 16:05,https://www.bing.com/th?id=OVFT.UKJ5zD3m3J40BXB1Fu5yoy,Panamá,panamaamerica.com.pa
Fue citado el propietario del local donde se grabó el video,https://tucomunidad.com.pa/2020/09/fue-citado-el-propietario-del-local-donde-se-grabo-el-video/,"solicitaran el permiso respectivo ante el Ministerio de Salud (Minsa), en medio de las medidas sanitarias impuestas para evitar la propagación de la Covid-19″, indicó el médico Cedeño, quien aseguró que el dueño del local fue citado para este martes.",22-09-2020 16:07,https://www.bing.com/th?id=OVFT.m-v49DsbMBgp0CuOi7sNQi,Panamá,Tu Comunidad
Pompeo habla con el presidente Cortizo de la pandemia y de seguridad,http://elsiglo.com.pa/internacional/pompeo-habla-presidente-cortizo-pandemia-seguridad/24164601,"La portavoz afirmó que el secretario de Estado ""reiteró su apoyo a Panamá en su lucha contra la pandemia de la COVID-19"", y recordó que Estados Unidos ha proporcionado más de 4,6 millones de dólares en asistencia a las autoridades panameñas para ...",22-09-2020 16:40,https://www.bing.com/th?id=OVFT._RSKHL6FrCrudehPyXym0y,Panamá,El Siglo
Political “hoax” anti masker killed by Covid-19,https://www.newsroompanama.com/health/political-hoax-anti-masker-killed-by-covid-19,"A former Republican councilman who opposed mask-wearing and spread conspiracy theories about COVID-19 on social media has died from the disease one of many deniers who have been infected. Tony Tenpenny, a Nashville, Tennesse Council Member died Sunday died ...",22-09-2020 17:57,https://www.bing.com/th?id=OVFT.Nfo5GtzPA5Myua15dbrtYy,Panamá,Newsroom Panama
Servicio de Migración atendió la salida humanitaria de más de 700 nicaragüenses,https://www.diaadia.com.pa/el-pais/servicio-de-migracion-atendio-la-salida-humanitaria-de-mas-de-700-nicaraguenses-370612,"De manera programada, cumpliendo con los protocolos de bio-seguridad y en coordinación con las autoridades de Costa Rica y Nicaragua, inspectores migratorios del Puesto de Control Fronterizo de Paso C",22-09-2020 18:11,https://www.bing.com/th?id=OVFT.p9yJv9P9V5HtfEDk_F4eoS,Panamá,Día a Día
Más de 700 nicaragüenses se retiraron de Panamá este mes,http://elsiglo.com.pa/panama/700-nicaraguenses-retiraron-panama-este/24164610,"El SNM reitera, que las fronteras continúan cerradas como medida de bio-seguridad para prevenir contagios por covid-19. Cualquier solicitud de salida humanitaria, se debe canalizar por medio de las vías diplomáticas del país de origen.",22-09-2020 18:28,https://www.bing.com/th?id=OVFT.E1r5hf44_1jg-6lU4xwp0i,Panamá,El Siglo
Más de 700 nicaragüenses salieron de Panamá durante septiembre,https://ensegundos.com.pa/2020/09/22/mas-de-700-nicaraguenses-salieron-de-panama-durante-septiembre/,"Las fronteras continúan cerradas como medida de bio-seguridad para prevenir contagios por COVID-19. Cualquier solicitud de salida humanitaria, se debe canalizar por medio de las vías diplomáticas del país de origen. Inspectores migratorios del Puesto ...",22-09-2020 18:38,https://www.bing.com/th?id=OVFT.3OfavWQA3rfztQzoIKeKqC,Panamá,En Segundos
Joven surfista panameño domina las olas de Hawaii,https://www.tvn-2.com/deportes/Joven-surfista-panameno-domina-Hawaii_0_5676932306.html,"Tuve que estar en casa por 14 días, aquí en Hawaii (Maui) es la ley. En Maui es verano y está tranquilo, sólo hay un caso de la Covid 19"", comentó. ""La idea de salir de casa y venir a Maui fue mía. No quería quedarme en Santa Catalina por mucho ...",22-09-2020 18:50,https://www.bing.com/th?id=OVFT.w2H-I-kxWRycPTWcT04zzy,Panamá,TVN
Inician convocatorias en Panamá para Online Cup Centroamérica de Tiro con Arco,https://www.tvmax-9.com/mas_deportes/Inician-Panama-Online-Centroamerica-Tiro_0_5676932307.html,"La Asociación Nacional de Tiro con Arco de Panamá (ANTAP) tiene el placer de convocar al Online Cup Centroamérica, evento que será respaldado por World Archery Americas y que contará con la participac",22-09-2020 18:54,https://www.bing.com/th?id=OVFT.W4fN2Y8W4y397RpHI96VBi,Panamá,TVMAX
"Panamá emitirá 'Bonos Globales' por $2,500 millones para 'apoyar' presupuesto",https://www.laestrella.com.pa/economia/200922/panama-emitira-bonos-globales-2-500-millones-apoyar-presupuesto-actual,"A fin de financiar el incremento del déficit presupuestario del Estado a causa de la caída de ingresos ocasionados por los efectos económicos de la covid-19, el Estado, autorizó este martes al Ministerio de Economía y Finanzas (MEF) la emisión de ...",22-09-2020 20:13,https://www.bing.com/th?id=OVFT.C6jpoHTSrpF-0PuWfJ1xvy,Panamá,laestrella.com.pa
