name,url,description,datePublished,imagen,pais,Fuente
Minsa reporta 808 casos nuevos de covid-19 y anuncia 'reingeniería' en hospitales,https://www.laestrella.com.pa/nacional/200622/minsa-reporta-808-casos-nuevos,"Panamá sumó 808 nuevos casos positivos de la covid-19, para un total de 26,030 casos acumulados y anunció una reingeniería dentro de los hospitales públicos. El Ministerio de Salud (Minsa) detalló que",22-06-2020 21:45,https://www.bing.com/th?id=ON.EB46A048E1B962CD33B93B8BFC16B085,Panamá,laestrella.com.pa
Gobierno de Japón dona a Panamá $5.5 millones para la compra de equipos médicos,https://www.laestrella.com.pa/nacional/200622/gobierno-japon-dona-panama-5-5-millones-compra-equipos-medicos,"a través de la Organización Panamericana de la Salud (OPS), para afrontar la lucha contra la pandemia del COVID-19. A través de esta donación se realizará la compra por medio de OPS de equipo de protección personal de salud, que incluye guantes y ...",22-06-2020 21:45,https://www.bing.com/th?id=ON.96EF0CBA293D5F359EA230248ED217C3,Panamá,laestrella.com.pa
Hub Humanitario ha beneficiado a 26 países durante pandemia,https://elcapitalfinanciero.com/hub-humanitario-ha-beneficiado-a-26-paises-durante-pandemia/,"Janaina Tewaney Mencomo, ministra de Gobierno (Mingob), durante una transmisión en vivo desde la cuenta de Instagram de la institución, tuvo como invitado a Alberto Sierra, director ejecutivo del Cent",22-06-2020 21:50,https://www.bing.com/th?id=ON.0A618A497687C1CBBAC44832289060C4,Panamá,El Capital Financiero
Costa Rica accede a viaje humanitario de nicaragüenses varados en Paso Canoas,https://www.diaadia.com.pa/el-pais/costa-rica-accede-viaje-humanitario-de-nicaraguenses-varados-en-paso-canoas-367568,Las autoridades de Costa Rica autorizaron este lunes el paso por su territorio para los 18 nicaragüenses que permanecían varados desde el pasado viernes en el sector de Paso Canoas en territorio panam,22-06-2020 22:02,https://www.bing.com/th?id=ON.CF66CEE61FDE6667752AF745CB7D7C9B,Panamá,Día a Día
ENSA mantiene en BBB su calificación de Fitch Ratings,https://elcapitalfinanciero.com/ensa-mantiene-en-bbb-su-calificacion-de-fitch-ratings/,"En su más reciente reporte, Fitch Ratings ratificó la calificación BBB de perspectiva “Estable” otorgada a ENSA, siendo una de las pocas empresas panameñas en lograr mantener por la pandemia de corona",22-06-2020 22:06,https://www.bing.com/th?id=ON.528399ED0C9FC68D60DF3E07ED1C8639,Panamá,El Capital Financiero
Covid-19: Panamá recibe donación de $5.5 millones por parte de Japón,https://ensegundos.com.pa/2020/06/22/covid-19-panama-recibe-donacion-de-5-5-millones-por-parte-de-japon/,"La donación fue formalizada por una firma de canje de notas entre el entre el Canciller Alejandro Ferrer y el Embajador de Japón en presencia de la Ministra de Salud, Rosario Turner Montenegro. El Min",22-06-2020 22:13,https://www.bing.com/th?id=ON.43512720EEF9EE012D737CDAD2B50864,Panamá,En Segundos
WHO wants stepped up production of drug to fight virus after UK study,https://www.newsroompanama.com/health/who-wants-stepped-up-production-of-drug-to-fight-virus-after-uk-study-1,"The World Health Organization (WHO) has called for increased production of dexamethasone, identified in an Oxford University study to be effective in tr",22-06-2020 22:34,https://www.bing.com/th?id=ON.82A1A8CBCC6C15F34389FFF5B048D2E1,Panamá,Newsroom Panama
Japón dona $5.5 millones a Panamá para la compra de equipos médicos,https://www.tvn-2.com/nacionales/Japon-millones-Panama-equipos-medicos_0_5607939229.html,"Panamá realizó un canje de notas con el Gobierno de Japón, a través del cual recibió la donación de $5.5 millones de la embajada de esa nación con el fin de que sean utilizados para la adquisición de",22-06-2020 22:34,https://www.bing.com/th?id=ON.68446BC3D6A8533A6EF40B58B5109DED,Panamá,TVN
"Interponen denuncia contra varias Ministras de Estado, miembros de la cúpula del PRD",https://www.radiopanama.com.pa/noticias/actualidad/interponen-denuncia-contra-varias-ministras-de-estado-miembros-de-la-cupula-del-prd/20200622/nota/4048824.aspx,"La denuncia criminal presentada este lunes ante la Procuraduría General de la Nación contra las ministras Rosario Turner (Salud), Doris Zapata (Trabajo) y la consejera para temas de Salud, Eyra Ruíz,",22-06-2020 23:17,https://www.bing.com/th?id=ON.7D78B3FEAE78D8AC05601605E2D2BC64,Panamá,Radio Panamá
Más de 190 detenidos por incumplir con el toque de queda este fin de semana en La Chorrera,https://www.telemetro.com/nacionales/2020/06/22/190-detenidos-incumplir-toque-queda/2975944.html,"Más de 190 personas fueron aprehendidas por incumplir con el toque de queda decretado en Panamá para frenar la propagación del COVID-19, durante este fin de semana en La Chorrera, provincia de Panamá",22-06-2020 23:21,https://www.bing.com/th?id=ON.3AD7259BA561649BF2FF8D481CBCCCF5,Panamá,Telemetro
"Covid-19: Panamá suma 20 nuevos fallecidos y 26,752 casos acumulados",https://ensegundos.com.pa/2020/06/22/covid-19-panama-suma-20-nuevos-fallecidos-y-26752-casos-acumulados/,"El día de hoy, autoridades de salud informaron sobre la mayor cifra de fallecidos desde que inició la pandemia. El Departamento de epidemiología del Ministerio de Salud, informó que al día de hoy se c",22-06-2020 23:54,https://www.bing.com/th?id=ON.07BFE2893917F7A19D7EA3C33166454A,Panamá,En Segundos
Transportistas de Panamá Este protestan para exigir apoyo del gobierno,https://www.tvn-2.com/nacionales/Transportistas-sector-protestan-exigir-gobierno-Panama-Este_0_5607939171.html,"Transportistas de Panamá Este, salieron este lunes 22 de junio, a protestar para exigir de parte de las autoridades apoyo durante la pandemia por la COVID-19. Además, se quejan de las multas que se le",23-06-2020 00:14,https://www.bing.com/th?id=ON.3B61181746DD9C433E0C7A5B8A99308A,Panamá,TVN
La sangre panameña se notó en el Draft 2020 de las Grandes Ligas,https://www.tvmax-9.com/beisbol/sangre-panamena-Draft-Grandes-Ligas_0_5607939232.html,"El Draft 2020 del béisbol de las Grandes Ligas dejó, entre los seleccionados, a dos peloteros con vínculos familiares en Panamá. Los Indios de Cleveland eligieron, en la segunda ronda del draft al lan",23-06-2020 00:36,https://www.bing.com/th?id=ON.4136EEABE81DB0663AC26D5184B1CA2B,Panamá,TVMAX
Panamá alcanza por primera vez las 20 muertes por COVID-19 en un día,https://www.panamaamerica.com.pa/sociedad/panama-alcanza-por-primera-vez-las-20-muertes-por-covid-19-en-un-dia-1166241,"El Ministerio de Salud (Minsa) reportó esta tarde que 20 personas más perdieron la batalla contra el coronavirus, lo que representa el mayor número de decesos en un día por esta enfermedad en Panamá.",23-06-2020 01:03,https://www.bing.com/th?id=ON.5F33514437B7CA515BCD2CEAF53B5B90,Panamá,panamaamerica.com.pa
Estrategia especial de salud para San Miguelito,https://www.panamaamerica.com.pa/sociedad/estrategia-especial-de-salud-para-san-miguelito-1166245,"Próximamente, se inaugurará en San Miguelito el Centro de Operaciones para el Control y Trazabilidad Comunitaria para el COVID-19, donde se centralizará el apoyo a los casos detectados de coronavirus",23-06-2020 01:56,https://www.bing.com/th?id=ON.B30EEF384F0B737F37F6108075E9A6C2,Panamá,panamaamerica.com.pa
Panamá acumula 521 muertes y 26.752 casos confirmados de COVID-19,https://www.diaadia.com.pa/el-pais/panama-acumula-521-muertes-y-26752-casos-confirmados-de-covid-19-367594,"Panamá reportó este lunes 20 muertes y 722 nuevos casos de la COVID-19, que elevaron a 521 las defunciones y a 26.752 los contagios confirmados de la enfermedad en 105 días de pandemia. Quince de los",23-06-2020 02:44,https://www.bing.com/th?id=ON.4F6A8DEB05DBAEEF5D54B08D9FCDC76A,Panamá,Día a Día
Minsa reporta 20 decesos más y van 521 en 105 días,https://www.prensa.com/impresa/panorama/minsa-reporta-20-decesos-mas-y-van-521-en-105-dias/,"El Ministerio de Salud (Minsa) reportó ayer la muerte de 20 personas por Covid-19, enfermedad que transmite el virus SARS-CoV-2, lo que elevó la cifra de fallecidos a 521. Lourdes Moreno, directora na",23-06-2020 03:18,https://www.bing.com/th?id=ON.4E38786673A6F4616B716C6CE4897E29,Panamá,prensa.com
La dexametasona se suma a fármacos para Covid-19,https://www.prensa.com/impresa/panorama/la-dexametasona-se-suma-a-farmacos-para-covid-19/,"L a dexametasona pertenece a la familia de los corticoides (o corticosteroides), que tienen propiedades antiinflamatorias, inmunosupresoras y antialérgicas. AFP Científicos del Reino Unido acaban de p",23-06-2020 03:34,https://www.bing.com/th?id=ON.E007742A6C05B29904E962A7F7C8C577,Panamá,prensa.com
"Un total de 156 lotes de café compiten en el ""The Best of Panama""",https://www.metrolibre.com/nacionales/174659-un-total-de-156-lotes-de-caf%C3%A9-compiten-en-el-best-panama.html,"Un total de 156 lotes (150 libras cada uno), de 49 productores entraron a participar en la XXIV Cata Internacional “The Best of Panama (BOP)”, el evento más importante de la caficultura panameña, que",23-06-2020 04:24,https://www.bing.com/th?id=ON.C617F4DF83AD2F5D8C301BC792FF6839,Panamá,Metro Libre
Codere tiene una cita importante para resolver su presente y su futuro,https://www.tvmax-9.com/mas_deportes/Codere-importante-resolver-presente-futuro_0_5607939197.html,"Codere tiene este lunes una cita importante para resolver su presente y su futuro, impactado por el coronavirus. La compañía de apuestas, de acuerdo a un reportaje publicado en el Portal Digital El Co",23-06-2020 04:34,https://www.bing.com/th?id=ON.62058443C1FCBCE821CF8B18D8FBA4FE,Panamá,TVMAX
"COVID: 521 muertos, 722 nuevos casos y 26,752 contagiados",https://www.critica.com.pa/nacional/covid-521-muertos-722-nuevos-casos-y-26752-contagiados-581812,"Panamá acumuló hasta este lunes o 26.752 casos confirmados, y 521 muertes por la COVID-19, en medio de una escalada de la enfermedad, según el reporte del Ministerio de Salud, en el informe de hoy. En",23-06-2020 04:44,https://www.bing.com/th?id=ON.2E97160872F94827AFBF7CAF6C5A8ED3,Panamá,Critica
Gobierno de Japón donó 5.5 millones a Panamá para compra de equipos médicos,https://www.metrolibre.com/econom%C3%ADa/174671-gobierno-de-jap%C3%B3n-don%C3%B3-55-millones-panam%C3%A1-para-compra-de-equipos-m%C3%A9dicos.html,Panamá recibió por parte del gobierno de Japón unos 5.5 millones de dólares en cooperación financiera no reembolsable para la compra exclusiva de equipos médicos ofrecidos a través de catálogo y selec,23-06-2020 04:56,https://www.bing.com/th?id=ON.6C85A83B0A7A57E6A170B03933733BB4,Panamá,Metro Libre
"Vergüenza, solo tres han donado plasma",http://elsiglo.com.pa/panama/verguenza-solo-tres-donado-plasma/24158982,"Solo tres de los más de 14 mil pacientes que se han curado del coronavirus (covid-19), han donado plasma convaleciente para ayudar a otros que están en cuidados intensivos u hospitalizados. Si, solo t",23-06-2020 05:11,https://www.bing.com/th?id=ON.D03EBA3B0DE4EAAB808CAF48CA16517A,Panamá,El Siglo
"Ya van 521 fallecidos por el virus, hay una avalancha de casos nuevos",http://elsiglo.com.pa/panama/521-fallecidos-virus-avalancha-casos-nuevos/24158984,Informe. La crisis del coronavirus (covid-19) en Panamá cobró la vida de 20 nuevos pacientes para elevar la cifra de decesos por la enfermedad a 521. Informe. La crisis del coronavirus (covid-19) en Panamá cobró la vida de 20 nuevos pacientes para ...,23-06-2020 05:11,https://www.bing.com/th?id=ON.F1190831F941BAF6DFF4C79D7A63FD89,Panamá,El Siglo
Se nos fue el ‘Funket’,https://www.critica.com.pa/nacional/se-nos-fue-el-funket-581828,"Manuel Horacio De León Yanis, el popular ""Funket"", murió cerca de la medianoche del domingo víctima del coronavirus. ""Funket"" era polifacético. Locutor, productor de televisión y diputado suplente. Ha",23-06-2020 05:17,https://www.bing.com/th?id=ON.09AF08F941CAD37AB375BE3ACE1D2CE9,Panamá,Critica
Panamá reporta 722 nuevos casos de COVID-19 y 20 defunciones,https://www.telemetro.com/nacionales/2020/06/22/panama-reporta-722-nuevos-casos-de-covid-19-y-20-defunciones/2977631.html,"De acuerdo con el informe epidemiológico del Minsa, hay 11,567 casos activos y 14,664 pacientes recuperados clínicamente. Se realizaron 2,087 nuevas pruebas para un acumulado de 109,990 pruebas para d",23-06-2020 11:34,https://www.bing.com/th?id=ON.D2141E9EB1AABBD432D7E51810F56552,Panamá,Telemetro
