name,url,description,datePublished,imagen,pais,Fuente
Acodeco recuerda que compras en línea deben cumplir con publicidad,https://www.laestrella.com.pa/economia/200828/acodeco-recuerda-compras-linea-deben-cumplir-publicidad,"La Autoridad de Protección al Consumidor y Defensa de la Competencia (Acodeco) recordó que las normas sobre publicidad contempladas en la Ley 45 de 2007, se mantienen vigentes durante las compras en l",28-08-2020 22:25,https://www.bing.com/th?id=OVFT.2AqQfkIK2oQQgtyFLJUp6y,Panamá,laestrella.com.pa
"Covid-19 cases near 100,000 with 2,217 deaths",https://www.newsroompanama.com/news/covid-19-cases-near-100000-with-2217-deaths,"The 673 new cases of coronavirus were on Thursday, September 10 , raises the total number of people who have been infected since the first cases were reported s",11-09-2020 03:10,https://www.bing.com/th?id=OVFT.oQjqXyOrk6cLLIDuEWu8oi,Panamá,Newsroom Panama
Lo que debes leer antes de dormir,https://www.tvn-2.com/nacionales/debes-leer-dormir_0_5667933244.html,"Este jueves 10 de septiembre de 2020 estuvo cargado de información y aquí te compartimos algunas de las noticias más importantes, y que no debes dejar de leer antes de dormir. 1. Panamá suma 673 casos",11-09-2020 03:23,https://www.bing.com/th?id=OVFT._6LXsq1onrt1k3rkk-40TS,Panamá,TVN
La Covid-19 trastocó plan de los trabajos del Metro,https://www.prensa.com/impresa/economia/la-covid-19-trastoco-plan-de-los-trabajos-del-metro/,"La extensión a Villa Zaita, que tiene una longitud de 2.3 kilómetros, reducirá el congestionamiento vehicular que se produce en las inmediaciones de la estación de San Isidro. Archivo Las 300 mil pers",11-09-2020 04:38,https://www.bing.com/th?id=OVFT._btF9efaFj0a-6yisgl3rS,Panamá,prensa.com
Panamá Metro y Colón abren el torneo,https://www.diaadia.com.pa/deportes/panama-metro-y-colon-abren-el-torneo-370244,"Los equipos de Panamá Metro y Colón serán los encargados de abrir el telón del Campeonato Nacional de Béisbol Mayor 2020 cuando se midan el 9 de octubre, en el estadio José Remón Cantera de Aguadulce.",11-09-2020 05:04,https://www.bing.com/th?id=OVFT.Px_kk-8IxxLy3rfg2CBZgy,Panamá,Día a Día
Panamá es ratificada como sede del Campeonato Mundial de Ajedrez Escolar 2021,https://www.panamaamerica.com.pa/deportes/panama-es-ratificada-como-sede-del-campeonato-mundial-de-ajedrez-escolar-2021-1171844,"La Federación Internacional de Ajedrez (FIDE) corroboró nuevamente a Panamá en la sede del Campeonato Mundial de Ajedrez Escolar 2021, mediante comunicado oficial publicado en sitio web de la organiza",11-09-2020 05:31,https://www.bing.com/th?id=OVFT.6IlNsBWNTjzcumNd3uxGFC,Panamá,panamaamerica.com.pa
Secuencia cronológica de la pandemia,https://www.laestrella.com.pa/opinion/columnistas/200911/secuencia-cronologica-pandemia,"Cuando el virus de la COVID-19 se convirtió en pandemia, el Gobierno del presidente Laurentino Cortizo actuó muy rápido. Nombró una comisión de respetados científicos para que lo asistieran y pidió, a",11-09-2020 05:42,https://www.bing.com/th?id=OVFT.df3Hbt7wA5GR76g61G9QWi,Panamá,laestrella.com.pa
Expertos trabajan en fabricar ventiladores 100% panameños,https://www.critica.com.pa/nacional/expertos-trabajan-en-fabricar-ventiladores-100-panamenos-587593,"Al inicio de la pandemia por la COVID-19, el aumento de la demanda global de ventiladores para atender a pacientes con insuficiencia respiratoria en las Unidades de Cuidados Intensivos (UCI), propició la escasez de estos equipos, así como restricciones ...",11-09-2020 08:03,https://www.bing.com/th?id=OVFT.4G6BTSc7GXaOmk399aYxJi,Panamá,Critica
11 nuevas defunciones por COVID-19 en las últimas horas en Panamá,https://noticias24pty.com/11-nuevas-defunciones-por-covid-19-en-las-ultimas-horas-en-panama/,"Hoy jueves 10 de septiembre en Panamá se contabilizan 72,203 pacientes recuperados, 673 casos positivos nuevos, para un total acumulado de 99,715. A  la fecha se aplicaron 5,075 pruebas, para un porce",11-09-2020 08:12,https://www.bing.com/th?id=OVFT.wMwZWsR07QogUI6EiMilSy,Panamá,Noticias 24 PTY
Entre la vida y la política,https://www.metrolibre.com/opini%C3%B3n/181621-entre-la-vida-y-la-pol%C3%ADtica.html,"¿Puede haber, por estos días, una tarea más importante que salvar la vida ante la pandemia del covid-19? Sorpresa desagradable, la pandemia del Covid-19 se ha convertido en el enemigo inmediato de la",11-09-2020 09:34,https://www.bing.com/th?id=OVFT.rec8Lmu2L2NtsLr0kx3bri,Panamá,Metro Libre
Hoy por hoy,https://www.prensa.com/impresa/hoy-por-hoy/hoy-por-hoy-299/,"El primer caso de la Covid-19 en Panamá fue informado oficialmente el 9 de marzo pasado. Pero no es menos cierto que de la pandemia se tenía conocimiento meses antes y, sin duda, se sabía que tarde qu",11-09-2020 09:38,https://www.bing.com/th?id=OVFT.7FmiQ9QBYApyAm0T64Sdli,Panamá,prensa.com
Panama’s unthinkable ventilator gaffe,https://www.newsroompanama.com/opinion/panamas-unthinkable-ventilator-gaffe,"The first case of Covid-19 in Panama was officially reported on March 9. But it is no less true that the pandemic was known months before and, without a doubt,",11-09-2020 11:15,https://www.bing.com/th?id=OVFT.kjfhBkTxSQW86XZkQqv0BC,Panamá,Newsroom Panama
"Teotihuacán, la ""ciudad de los dioses"", renace en México tras cierre por covid-19",https://ensegundos.com.pa/2020/09/11/teotihuacan-la-ciudad-de-los-dioses-renace-en-mexico-tras-cierre-por-covid-19/,"La “Calzada de los Muertos”, arteria principal de unos 2 km de largo que une a la pirámide del Sol, la mayor, con la de la Luna, era recorrida el jueves por un centenar de turistas. Teotihuacán, la “c",11-09-2020 12:07,https://www.bing.com/th?id=OVFT.dVwhPxVt4yP4w4jq8jWh-y,Panamá,En Segundos
China autoriza las pruebas de la primera vacuna contra el coronavirus por espray nasal,https://www.panamaamerica.com.pa/mundo/china-autoriza-las-pruebas-de-la-primera-vacuna-contra-el-coronavirus-por-espray-nasal-1171858,China autorizó el inicio de pruebas clínicas en humanos de una posible vacuna contra el coronavirus SARS-CoV-2 que sería la única de todas las candidatas a nivel mundial en administrarse mediante espr,11-09-2020 12:58,https://www.bing.com/th?id=OVFT.6yubVOR2vARaxi1Hl-22iy,Panamá,panamaamerica.com.pa
6 de cada 10 panameños se encuentran positivos ante la pandemia,https://www.telemetro.com/entrevistas/2020/09/11/6-de-cada-10-panamenos-se-encuentran-positivos-ante-la-pandemia/3221774.html,"En medio de la pandemia del COVID-19 en Panamá, una encuesta realizada por la encuestadora Ipsos Centroamérica reveló que 2 de cada 10 panameños se encuentran indiferentes ante la crisis, pero 6 de ca",11-09-2020 14:11,https://www.bing.com/th?id=OVFT.93Gj4-HRVxIkewIU37Rpiy,Panamá,Telemetro
Sector hotelero adecua instalaciones para su futura reapertura en el mes de octubre,https://www.tvn-2.com/economia/economia-panamena/Sector-hotelero-instalaciones-reapertura-octubre_0_5668683096.html,"Los hoteles de Panamá se han adaptado a los protocolos de bioseguridad en 12 áreas sensibles dentro sus instalaciones, como parte de las medidas aprobadas por el Ministerio de Salud (Minsa), con lo qu",11-09-2020 14:47,https://www.bing.com/th?id=OVFT.55bgjJvwg9f2oJFwvQWQIS,Panamá,TVN
"Interponen denuncia contra Sicarelle Holdings, abogado dice que Minsa no encontró anomalías",https://www.telemetro.com/nacionales/2020/09/11/interponen-denuncia-sicarelle-holding-abogado/3222224.html,"Una denuncia por supuesto uso ilegal de espacio y propiedades del Ministerio de Salud de Panamá (Minsa) fue interpuesta en contra de la empresa Sicarelle Holdings, contratada de forma directa para el",11-09-2020 15:09,https://www.bing.com/th?id=OVFT.z32sHR4Q5dEEJdCZMzZUCS,Panamá,Telemetro
Venezolanos varados en Panamá quieren irse a su país,https://www.critica.com.pa/nacional/venezolanos-varados-en-panama-quieren-irse-su-pais-587632,"Un grupo de venezolanos varados en Panamá desde marzo por la pandemia de Covid-19 protestaron pacíficamente en la sede de la ONU, ubicado en la Ciudad del Saber, con la finalidad que este organismo se",11-09-2020 16:32,https://www.bing.com/th?id=OVFT._KZm1JEnEPI_k1zalLFmYi,Panamá,Critica
Migración presenta requisitos para extranjeros contratados por multinacionales,https://www.metrolibre.com/nacionales/181675-migraci%C3%B3n-presenta-requisitos-para-extranjeros-contratados-por-multinacionales.html,"Ante la activación de nuevos grupos de actividades, cuya reapertura impactará en la reactivación económica del país, el Servicio Nacional de Migración, (SNM), permitirá el ingreso y la presentación de",11-09-2020 16:46,https://www.bing.com/th?id=OVFT.6AAxh4fvA0DM4EzNNlMBQC,Panamá,Metro Libre
Prueban con cerdos dos prototipos de ventilador,http://elsiglo.com.pa/panama/prueban-cerdos-prototipos-ventilador/24163933,"Dos prototipos de ventiladores para pacientes graves de la COVID-19 desarrollados en Panamá se encuentran en la fase de pruebas en animales, dijeron ayer los responsables del proyecto que busca producir equipos de este tipo 100 % panameños. Los ensayos ...",11-09-2020 16:49,https://www.bing.com/th?id=OVFT.hEK7L8s83SD7csUyGSwxBS,Panamá,El Siglo
"Probablemente el 30% de los hoteles no podrán abrir sus puertas el 12 de octubre, asevera Apatel",https://elcapitalfinanciero.com/probablemente-el-30-de-los-hoteles-no-podran-abrir-sus-puertas-el-12-de-octubre-asevera-apatel/,"Los hoteles de Panamá aplicarán protocolos de bioseguridad en 12 áreas sensibles dentro sus instalaciones, como parte de las medidas aprobadas por el Ministerio de Salud (Minsa) y los estándares de ca",11-09-2020 17:03,https://www.bing.com/th?id=OVFT.lULWYMkd-Yr8dkAUhsoYKi,Panamá,El Capital Financiero
"Béisbol Mayor en 'burbuja', la nueva modalidad de la pelota panameña",https://www.tvmax-9.com/beisbol/Beisbol-Mayor-burbuja-modalidad-panamena_0_5668683114.html,"El 9 de octubre de 2020 se dará el grito de 'playball' para la versión 77 del Campeonato Nacional de Béisbol Mayor. El que se hará con reglas distintas y bajo la modalidad de 'burbuja' sanitaria, segú",11-09-2020 18:15,https://www.bing.com/th?id=OVFT.v5H3kAXNT9cQ3wxXiGPT_C,Panamá,TVMAX
Minsa abre portal de comunicación con la comunidad China residente en Panamá,https://www.diaadia.com.pa/el-pais/minsa-abre-portal-de-comunicacion-con-la-comunidad-china-residente-en-panama-370253,"El Ministerio de Salud (Minsa), y el Centro de Distribuciones Especializadas S.A. (Cendesa), firmaron un memorando de entendimiento, con el fin de crear un marco de laboración entre las partes que per",11-09-2020 18:17,https://www.bing.com/th?id=OVFT.9hXtmuq0eozOcVyWT6uyFS,Panamá,Día a Día
"Aplicaron más de 80 mil vacunas contra la influenza en la ""Vacunación Express""",http://elsiglo.com.pa/panama/aplicaron-80-vacunas-contra-influenza-vacunacion-express/24163983,"Más de 80 mil dosis de vacuna contra la influenza entre otras, han sido aplicadas en la denominada ""Vacunación Express"", en la Región de Salud de San Miguelito. Esto ha sido en tiempo de pandemia por",11-09-2020 18:24,https://www.bing.com/th?id=OVFT.0j_rgvbx8kn2cpwk8uuQwi,Panamá,El Siglo
Cortizo se pronunció sobre el alquiler de vehículos para Presidencia,https://www.nexpanama.com/cortizo-se-pronuncio-sobre-el-alquiler-de-vehiculos-para-presidencia/,"Se trata de un tema que ha generado cuestionamientos y críticas, porque el acto se ha hecho en plena pandemia de la COVID-19. Arrendadora Global S.A. propuso el contrato de arrendamiento por $2,408,116; Panama Renta Car ofertó un contrato de alquiler por ...",11-09-2020 19:43,https://www.bing.com/th?id=OVFT.1siyT_7fcjcSM0-Uz84Lmi,Panamá,NEX TV
