name,url,description,datePublished,imagen,pais,Fuente
Se agotan las camas para pacientes de Covid-19,https://radioreformaseoye.com/nacionales/se-agotan-las-camas-para-pacientes-de-covid-19/,"Menos del 20% de la capacidad de camas en hospitales y en la unidad de cuidados intensivos, tiene el sistema de salud panameño disponible para la atención de pacientes positivos por la Covid-19. Esta urgencia sucede cuando el indicador de velocidad de tr ...",16-12-2020 13:38,https://www.bing.com/th?id=OVFT.no4JmFbX6XTpWeGH9bJely,Panamá,Radio Reforma se Oye
Reino Unido ya ha vacunado a 140.000 personas,https://www.nexpanama.com/reino-unido-ya-ha-vacunado-a-140-000-personas/,"Cerca de 140.000 personas en el Reino Unido han recibido sus primeras inyecciones de COVID-19 en la primera semana de lanzamiento de la vacuna desarrollada por Pfizer y BioNTech, según dijo el miércol",16-12-2020 14:04,https://www.bing.com/th?id=OVFT.OxnIfj2eYjKxON1uHwMJLC,Panamá,NEX TV
Panamá decreta cuarentena para fin de año,https://radioreformaseoye.com/nacionales/panama-decreta-cuarentena-para-fin-de-ano/,"El Gobierno de Panamá decretó una cuarentena total durante las fiestas de Navidad y Año Nuevo, para enfrentar el aumento de contagios positivos por la Covid-19. Además aumentará las horas del toque de queda, establecerá nuevos cercos sanitarios y ...",16-12-2020 14:28,https://www.bing.com/th?id=OVFT.bsUDnGL2B-45AxbZdtgaui,Panamá,Radio Reforma se Oye
"Gorgas recibe donación de 8,500 pruebas serológicas",https://elcapitalfinanciero.com/gorgas-recibe-donacion-de-8500-pruebas-serologicas/,"causante de la enfermedad COVID-19 y, al respecto, Cobre Panamá realizó una donación de 8,500 pruebas serológicas para ampliar el estudio. En este sentido, Manuel Aizpurúa, vocero de Cobre Panamá indicó que “Cobre Panamá apoya al país y a las ...",16-12-2020 15:01,https://www.bing.com/th?id=OVFT.9Mv6FfzYzTnmLZ0lZiALhy,Panamá,El Capital Financiero
"Latinoamérica cerrará 2020 con una contracción del 7,7 % por la pandemia, según la Cepal",https://www.tvn-2.com/economia/Latinoamerica-cerrara-contraccion-pandemia-Cepal_0_5740675908.html,"enfrentó la pandemia en un momento de debilidad de su economía, con un crecimiento que apenas alcanzó una tasa del 0,1 % el año pasado. Antes de la covid-19, la Cepal preveía que Latinoamérica crecería un máximo de 1,3% en 2020.",16-12-2020 15:46,https://www.bing.com/th?id=OVFT.vErjM0QGTlwNkQlCol77ji,Panamá,TVN
Hospital Santo Tomás suspende temporalmente atención médica de la consulta externa especializada,https://www.laestrella.com.pa/nacional/201216/hospital-santo-tomas-suspende-temporalmente-atencion-medica-consulta-externa-especializada,"La dirección médica del Hospital Santo Tomás, debido al aumento de los casos de covid-19, suspendió temporalmente la atención médica de la consulta externa especializada. Elías García Mayorca, quien es el director Médico del Hospital, informó que ...",16-12-2020 16:02,https://www.bing.com/th?id=OVFT.Bop-NYVOVfFlsEfb1nKWzC,Panamá,laestrella.com.pa
"Durán, Christiansen y Mariano se roban los reflectores en 2020",http://elsiglo.com.pa/deportes/duran-christiansen-mariano-roban-reflectores-2020/24169567,"La pandemia del coronavirus paralizó al deporte en el mundo durante varios meses pero en Panamá momentos negativos y positivos contribuyeron a dar visibilidad al boxeo, el fútbol, el béisbol y el atle",16-12-2020 16:47,https://www.bing.com/th?id=OVFT.M-bzYwYA8Nlb7c4JvHT4ii,Panamá,El Siglo
Panamá entre los países que aseguraron a tiempo dosis de vacunas contra COVID-19 para toda su población,https://lagacetadepanama.com/panama-entre-los-paises-que-aseguraron-a-tiempo-dosis-de-vacunas-contra-covid-19-para-toda-su-poblacion/,"Reino Unido y la Unión Europea, en el grupo de naciones que hicieron pedidos anticipados asegurando la compra de vacunas debidamente autorizadas contra el coronavirus de acuerdo ... de la vacuna para combatir el COVID-19. El artículo del periódico ...",16-12-2020 16:49,https://www.bing.com/th?id=OVFT.HZTwfmNHVKrJQRy0LiTonS,Panamá,La Gaceta de Panama
Realizan pago a jugadores de la Liga Panameña de Fútbol,https://www.diaadia.com.pa/deportes/realizan-pago-jugadores-de-la-liga-panamena-de-futbol-373491,"Cumpliendo nuestro compromiso en bienestar de los futbolistas, el Instituto Panameño de Deportes (Pandeportes) hizo entrega del apoyo económico otorgado a la Liga Panameña de Fútbol (LPF). Tambié",16-12-2020 18:48,https://www.bing.com/th?id=OVFT.jPX4e9d6uMY0IctGPc8qVC,Panamá,Día a Día
"Comité de Salud de la ATTT de Panamá, se reúne para evaluación y toma de decisiones",https://sertv.gob.pa/nacionalfm/comite-de-salud-de-la-attt-de-panama-se-reune-para-evaluacion-y-toma-de-decisiones/,"El comité de salud institucional conformado para la prevención de COVID-19 de la Autoridad de Tránsito y Transporte Terrestre de Panamá (ATTT), llevó a cabo una importante reunión en horas de la mañana, de este miércoles, 16 de diciembre de 2020.",16-12-2020 19:21,https://www.bing.com/th?id=OVFT.WN2CINZihlr6PNZYmThm5y,Panamá,SERTV
Universidad de Panamá aprueba ceder el gimnasio a la CSS para atender a pacientes con la Covid-19,https://www.prensa.com/sociedad/universidad-de-panama-aprueba-ceder-el-gimnasio-a-la-css-para-atender-a-pacientes-con-la-covid-19/,"El Consejo Académico de la Universidad de Panamá (UP), aprobó de forma unánime que la Caja de Seguro Social (CSS) utilice el gimnasio de esta casa de estudios para atender a pacientes con la Covid-19.",16-12-2020 20:09,https://www.bing.com/th?id=OVFT.LVh7zqiFuydvvdlUqeWnSy,Panamá,prensa.com
Tom Cruise explotó contra dos miembros del equipo de 'Misión Imposible 7',https://www.panamaamerica.com.pa/variedades/tom-cruise-exploto-contra-dos-miembros-del-equipo-mision-imposible-7-1177930,"El protagonista y director de la cinta “Misión Imposible 7”, Tom Cruise se enfadó en el set de grabaciones porque no se estaba cumpliendo con las medidas de bioseguridad contra la COVID-19. El diario la Marca describió que Tom Cruise se molestó ...",16-12-2020 20:45,https://www.bing.com/th?id=OVFT.jIragjNrdeBlqDg4OM2KOy,Panamá,panamaamerica.com.pa
COMUNICADO # 295: Panamá aprueba uso de la vacuna Pfizer,https://sertv.gob.pa/nacionalfm/comunicado-295/,"El Gobierno Nacional, aprobó el uso por emergencia de la vacuna Pfizer contra la COVID-19, en base al marco legal que establece la ley 97 del 4 de octubre de 2019 y del Decreto Ejecutivo 36 del 17 de",16-12-2020 21:27,https://www.bing.com/th?id=OVFT.hLsJxXIA9-TrLEXzsvIe8y,Panamá,SERTV
Instalarán camas para pacientes de COVID-19 en gimnasio de la UP,https://www.critica.com.pa/nacional/instalaran-camas-para-pacientes-de-covid-19-en-gimnasio-de-la-594445,"El Consejo Académico de  la Univesidad de Panamá aprobó por unanimidad en la tarde de hoy, que la Caja del Seguro Social utilice el área del gimnasio para instalación de camas para atender casos de CO",16-12-2020 21:45,https://www.bing.com/th?id=OVFT.osKpArvZXCbWeyYKSvWbDy,Panamá,Critica
Oficina de cedulación de Ancón cierra temporalmente,https://www.metrolibre.com/nacionales/189297-oficina-de-cedulaci%C3%B3n-de-anc%C3%B3n-cierra-temporalmente.html,"La medida responde a “los casos registrados de Covid-19, y para salvaguardar la salud de los funcionarios y de nuestros usuarios”. Se explicó que solo se brindará el servicio de entrega de cédula previamente tramitado por ventanilla, en horario de 7 ...",16-12-2020 22:03,https://www.bing.com/th?id=OVFT.mZk_Zd-8WEu7IPznzN1bly,Panamá,Metro Libre
Panamá entre los pocos países que asegura la compra de vacuna contra el coronavirus,https://www.midiario.com/nacionales/panama-entre-los-pocos-paises-que-asegura-la-compra-de-vacuna-contra-el-coronavirus/,"Panamá está entre los primeros países del mundo que recibirán la vacuna de la farmacéutica Pfizer contra el SARSCoV-2, según un análisis de datos publicado hoy por el diario The New York Times sobre c",16-12-2020 22:17,https://www.bing.com/th?id=OVFT.TMG9aDCPZScmnCIlf_1BoC,Panamá,Mi Diario
"Panamá reporta 2,960 casos nuevos de infectados con la Covid-19; se aplicaron 13,981 pruebas",https://www.prensa.com/sociedad/panama-reporta-2960-casos-nuevos-de-infectados-con-la-covid-19-se-aplicaron-13981-pruebas/,"En el informe epidemiológico de los casos de Covid-19 se destacó este miércoles 16 de diciembre que fueron detectados 2,960 casos nuevos de",16-12-2020 22:24,https://www.bing.com/th?id=OVFT._R5QErVtf23iXfJ5W6E7bi,Panamá,prensa.com
Universidad de Panamá cede instalaciones para usar contra el covid-19,https://ensegundos.com.pa/2020/12/16/universidad-de-panama-cede-instalaciones-para-usar-contra-el-covid-19/,"El gimnasio fue cedido temporalmente a la Caja de Seguro Social. El rector de la Universidad de Panamá, Eduardo  Flores Castro,  anunció en su cuenta de Twitter, que el Consejo Académico decidió la ta",16-12-2020 22:28,https://www.bing.com/th?id=OVFT.moqg0oyxT-KuJpfi8ZgxTC,Panamá,En Segundos
"Panamá reporta 2,960 nuevos casos de COVID-19 y 28 defunciones en las últimas horas",https://www.telemetro.com/nacionales/2020/12/16/panama-reporta-nuevos-casos-covid-19/3562769.html,"Panamá registró 2,960 casos nuevos de COVID-19, elevando a 199,947 los contagios del virus a nivel Nacional, así dio a conocer Ministerio de Salud (Minsa).",16-12-2020 22:56,https://www.bing.com/th?id=OVFT.eKbmzJ0JbPb82I02p-NLwS,Panamá,Telemetro
Franklyn Robinson tuvo la covid-19 y piensa que como él hay gente que ‘se la rifa’ al salir a trabajar,https://www.midiario.com/farandula/franklyn-robinson-tuvo-la-covid-19-y-piensa-que-como-el-hay-gente-que-se-la-rifa-al-salir-a-trabajar/,"Muchos son los panameños que han padecido de la mortal covid-19 y no todos viven para contarlo. Uno que forma parte de la lista de las personas recuperadas es el expresentador de Tv y empresario, Fran",16-12-2020 23:10,https://www.bing.com/th?id=OVFT.Qqe0M7z3eJqUULi9WuoXuS,Panamá,Mi Diario
Informe del covid-19 : 108 muertos en 96 horas.,https://ensegundos.com.pa/2020/12/16/informe-del-covid-19-108-muertos-en-96-horas/,"Es el tercer día con un reporte de fallecidos superior a 25. Hoy se registran 2,960 casos nuevos. Las cifras del covid son abrumadoras.  La tarde de este miércoles los casos nuevos rozan el umbral de",16-12-2020 23:34,https://www.bing.com/th?id=OVFT.pZ5oAOLbFJiUwIgn3_M7mS,Panamá,En Segundos
"Panamá suma hoy 2,960 casos positivos de COVID-19 y 28 defunciones",https://www.critica.com.pa/nacional/panama-suma-hoy-2960-casos-positivos-de-covid-19-y-28-defunciones-594451,"Según los datos estadísticos del Minsa la totalidad de defunciones por esta enfermedad, desde que inició la pandemia, se elevaron a 3,439 acumuladas, para una tasa de letalidad del 1.7 %.",16-12-2020 23:54,https://www.bing.com/th?id=OVFT.aqF6o4RA4tANGMNY7_Hrzi,Panamá,Critica
Cifras covid-19 en Panamá: 2.960 casos nuevos y 28 defunciones,http://elsiglo.com.pa/panama/cifras-covid-19-2960-casos-nuevos-28-defunciones/24169591,"Para hoy miércoles 16 de diciembre el Ministerio de Salud (Minsa) de Panamá contabilizó 166,600 pacientes recuperados, 2,960 casos positivos nuevos, para un total acumulado de 199,947. En las últimas 24 horas se aplicaron 13,981 pruebas, para un ...",16-12-2020 23:56,https://www.bing.com/th?id=OVFT.r59l1DWGXYQLOVj3ZTATaS,Panamá,El Siglo
Inician trabajos de habilitación de área para pacientes con COVID-19 en la Ciudad de la Salud,https://www.telemetro.com/nacionales/2020/12/17/inician-trabajos-de-habilitacion-de-area-para-pacientes-con-covid-19-en-la-ciudad-de-la-salud/3563093.html,La Caja de Seguro Social de Panamá (CSS) dio a conocer que este miércoles se dio inicio a los trabajos de habilitación de un área en la Ciudad de la Salud que estará destinada a la atención de los pacientes positivos con COVID-19.,17-12-2020 00:18,https://www.bing.com/th?id=OVFT.YkfU5R8pcxV4_C2xAXURli,Panamá,Telemetro
IATA hace un llamado para que Panamá y Venezuela restablezcan urgentemente los vuelos,https://noticias24pty.com/iata-hace-un-llamado-para-que-panama-y-venezuela-restablezcan-urgentemente-los-vuelos/,"Venezuela tenía una conectividad aérea internacional muy limitada, incluso antes de la pandemia de la COVID-19. Los vuelos recientemente reiniciados desde y hacia Panamá, se convirtieron en un salvavidas, tanto para los pasajeros como para la carga ...",17-12-2020 00:21,https://www.bing.com/th?id=OVFT.cSgwFuxB5yg9oDCWd5wNvy,Panamá,Noticias 24 PTY
