name,url,description,datePublished,imagen,pais,Fuente
Cortizo pide autocuidado para vencer la pandemia que abate economía de Panamá,https://www.diaadia.com.pa/el-pais/cortizo-pide-autocuidado-para-vencer-la-pandemia-que-abate-economia-de-panama-368702,"El presidente panameño, Laurentino Cortizo, avaló el pronóstico del Bank of America de que la economía local se derrumbará hasta un 10 % este 2020 a causa del COVID-19, y resaltó que el autocuidado es",27-07-2020 02:32,https://www.bing.com/th?id=ON.7D32E28BA0D07DE6F38CB3BF3D3FD4DE,Panamá,Día a Día
"El Rt baja a 1.13, mientras que los casos de Covid-19 aumentan a 69,424",https://www.prensa.com/sociedad/el-rt-baja-a-113-mientras-que-los-casos-de-covid-19-aumentan-a-69424/,"El último reporte epidemiológico del Ministerio de Salud (Minsa) revela que en las últimas horas han fallecido 25 personas producto de la Covid-19, lo que eleva la cantidad total de muertes a 1,522. I",05-08-2020 21:36,https://www.bing.com/th?id=ON.A74A855D3940DDFCD2D3F25EE02EBB19,Panamá,prensa.com
Siete semanas sucesivas con alta tasa de positividad,https://www.prensa.com/impresa/panorama/la-tasa-de-positividad-una-cifra-dificil-de-bajar/,La pasada semana epidemiológica (26 de julio al 1 de agosto) se realizaron 22 mil 996 pruebas diagnósticas de la enfermedad Covid-19 en todo el país. Gabriel Rodríguez Lograr una tasa de positividad q,05-08-2020 21:36,https://www.bing.com/th?id=ON.6248B0760E75D65442D640168DD3102B,Panamá,prensa.com
Empresarios se unen a los equipos de trazabilidad,https://www.critica.com.pa/nacional/empresarios-se-unen-los-equipos-de-trazabilidad-584927,Dirigentes de dos de los principales gremios empresariales del país manifestaron que se suman al trabajo coordinado y unificado que realiza el Gobierno Nacional para reducir el número de casos positiv,05-08-2020 21:46,https://www.bing.com/th?id=ON.E521D1A63C6DBF4319151314B7703656,Panamá,Critica
Arrested former Colombian president tests positive,https://www.newsroompanama.com/news/arrested-former-colombian-president-tests-positive,Former Colombian President Álvaro Uribe tested positive for COVID-19 just 19 hoursafter the Supreme Court ordered his house arrest for alleged procedur,05-08-2020 21:55,https://www.bing.com/th?id=ON.19DFE6F9AE437A6A3DD467B5EFC7D4D7,Panamá,Newsroom Panama
"Migración de estudiantes del sector particular al público, genera preocupación en gremios magisteriales",https://www.radiopanama.com.pa/noticias/actualidad/migracion-de-estudiantes-del-sector-particular-al-publico-genera-preocupacion-en-gremios-magisteriales/20200805/nota/4060587.aspx,"Unos 2,210 estudiantes han migrado del sector particular al público como consecuencia de los efectos en la economía a raíz de la pandemia del COVID-19. Anaika De la Espada, subdirectora general admini",05-08-2020 22:15,https://www.bing.com/th?id=ON.7D78B3FEAE78D8AC05601605E2D2BC64,Panamá,Radio Panamá
Empresarios chiricanos lanzan la iniciativa #TODOCHIRIQUÍ,https://www.metrolibre.com/provincias/178492-empresarios-chiricanos-lanzan-la-iniciativa-todochiriqu%C3%AD.html,"Todo Chiriquí, es el lema de la iniciativa presentada por el Centro de Competitividad de la Región Occidental (CECOMRO), la Cámara de Comercio de Chiriquí (CAMCHI) y la Asociación Panameña de Ejecutiv",05-08-2020 22:17,https://www.bing.com/th?id=ON.E8E118A2562D3DBF170903591F82A1AE,Panamá,Metro Libre
Se confirma la muerte del folklorista y médico Kendall Royo por la covid-19,https://www.latinol.com/vidasocial/se-confirma-la-muerte-del-folklorista-y-medico-kendall-royo-por-la-covid-19/91053.html,"Esto sin duda nos rompe el alma y menos tratándose de alguien tan querido como el folklorista Kendall Royo, quien ha sido víctima del Covid-19, Royo se encontraba hospitalizado en cuidados intensivos",05-08-2020 23:08,https://www.bing.com/th?id=ON.526E3A017830AABBC7FC007A1AC5E5A4,Panamá,Latin OL
"Panamá mantiene comunicación directa con fábricas de vacunas contra el COVID-19, dice Cortizo",https://www.telemetro.com/nacionales/2020/08/05/panama-mantiene-comunicacion-directa-con-fabricas-de-vacunas-contra-el-covid-19-dice-cortizo/3107311.html,"Reconozco el esfuerzo que el Comité de Vacuna ha realizado para organizar la estrategia que nos permita obtener, a través de las fábricas de vacunas contra #COVID19 de todo el mundo y con las Organiza",05-08-2020 23:11,https://www.bing.com/th?id=ON.5A05B43A4D190DDB99321A8D6001EF94,Panamá,Telemetro
Panama virus positivity rate over 30% for seven weeks,https://www.newsroompanama.com/health/panama-virus-positivity-rate-over-30-for-seven-weeks-1,"The positivity rate in the diagnostic tests of Covid-19 has not dropped below 30% in the last seven weeks and the 4000, daily tests announced by President Corti",05-08-2020 23:16,https://www.bing.com/th?id=ON.6886D177FC1265B92DB6B379E634B68F,Panamá,Newsroom Panama
"Con 807 nuevos contagios de COVID-19, Panamá supera los 70,000 casos acumulados",https://www.telemetro.com/nacionales/2020/08/05/nuevos-contagios-covid-panama/3106902.html,"Agregó que unas 44,792 personas se han recuperado y se registran 23,886 casos activos, 21,784 permanecen en aislamiento domiciliario y 598 se encuentran en hoteles hospitales. Por otro lado, 1,340 per",05-08-2020 23:32,https://www.bing.com/th?id=ON.54EE4052B7145515FF687B8C5009B9E9,Panamá,Telemetro
"Las defunciones por COVID-19 siguen en aumento, 31 en las últimas horas",https://www.diaadia.com.pa/el-pais/las-defunciones-por-covid-19-siguen-en-aumento-31-en-las-ultimas-horas-369036,"Hoy miércoles 5 de agosto en Panamá el Ministerio de Salud contabilizan 44,792 pacientes recuperados de COVID-19, mientras que 807 casos positivos nuevos, para un total acumulado de 70,231. A la fecha",05-08-2020 23:54,https://www.bing.com/th?id=ON.2854D667BC7B540B3A0CF28B7CD0ADD7,Panamá,Día a Día
"Presidente Cortizo, adelantó que a partir de la próxima semana culmina vuelos humanitarios para ciudadanos panameños",https://www.radiopanama.com.pa/noticias/actualidad/presidente-cortizo-adelanto-que-a-partir-de-la-proxima-semana-culmina-vuelos-humanitarios-para-ciudadanos-panamenos/20200805/nota/4060625.aspx,"El presidente de la República, Laurentino Cortizo, adelantó que a partir de la próxima semana se estaría culminando con los vuelos humanitarios para los ciudadanos panameños. El mandatario informó que",05-08-2020 23:56,https://www.bing.com/th?id=ON.7D78B3FEAE78D8AC05601605E2D2BC64,Panamá,Radio Panamá
Panamá anuncia eliminación de vuelos humanitarios para retorno de panameños,https://www.tvn-2.com/nacionales/Panama-anuncia-eliminacion-humanitarios-panamenos_0_5640935936.html,"El presidente de Panamá, Laurentino Cortizo, anunció este miércoles que se ""eliminarán"" los vuelos humanitarios para nacionales a partir de la próxima semana y que sólo se les exigirá una prueba de CO",06-08-2020 00:25,https://www.bing.com/th?id=ON.F28B40248CFF391AA6265D4AC7FC7813,Panamá,TVN
El premundial de futsal de Concacaf se jugará en el mes de mayo del 2021,https://www.tvmax-9.com/somoslasele/premundial-futsal-Concacaf-jugara-mayo_0_5640935937.html,"Concacaf ratificó a Guatemala como sede del Campeonato de Futsal de la Confederación, este evento clasificará a cuatro selecciones para el Mundial de Futsal que se disputará en Lituania en el 2021. Or",06-08-2020 00:57,https://www.bing.com/th?id=ON.38BD5C7B4E1279E388D03465A641B225,Panamá,TVMAX
Minsa: 807 casos positivos y 31 nuevas defunciones por covid-19,http://elsiglo.com.pa/panama/minsa807casos-positivos-nuevos31-nuevas-defunciones-covid-19/24161804,"Este miércoles 5 de agosto el Ministerio de Salud (Minsa) informó que en Panamá se contabilizan 44,792 pacientes recuperados, 807 casos positivos nuevos, para un total acumulado de 70,231. En cuanto a",06-08-2020 01:57,https://www.bing.com/th?id=ON.13AE292F20674C47BE597FB25AF72CAB,Panamá,El Siglo
"COVID-19 en Panamá: 31 defunciones, 807 casos nuevos y 23,886 activos",https://www.tvn-2.com/nacionales/COVID-19-Panama-defunciones-nuevos-activos_0_5640935944.html,"El Sistema de Vigilancia Epidemiológica constató este miércoles, 807 casos positivos nuevos, y 31 nuevas defunciones por la COVID-19. Del total de 70,231 contagiados registrados en el país, 44,792 se",06-08-2020 02:01,https://www.bing.com/th?id=ON.C8059EC07E3D43F346090D163694E6CA,Panamá,TVN
Muertes por COVID-19 en Panamá: 31 en un día,https://www.panamaamerica.com.pa/sociedad/muertes-por-covid-19-en-panama-31-en-un-dia-1169316,Las muertes por coronavirus en Panamá siguen en aumento. Para este miércoles las autoridades del Ministerio de Salud (Minsa) anunciaron del deceso de 31 personas en las últimas 24 horas. Versión impre,06-08-2020 02:38,https://www.bing.com/th?id=ON.AD3FF116B8161630A3940533C866B713,Panamá,panamaamerica.com.pa
Embajada de China dona insumos para lucha contra el Covid-19 en Veraguas,https://ensegundos.com.pa/2020/08/05/embajada-de-china-dona-insumos-para-lucha-contra-el-covid-19-en-veraguas/,"La donación consistió en mascarillas de protección, termómetros infrarrojos, gel bacterial, alcohol y jabón líquido que serán distribuidos en las comunidades más necesitadas y áreas vulnerables de San",06-08-2020 02:40,https://www.bing.com/th?id=ON.8C5CFD90041E06D895D453C7D81DE5F5,Panamá,En Segundos
"Panamá supera los 70 mil casos de Covid-19 y registra 1,553 muertes",https://ensegundos.com.pa/2020/08/05/panama-supera-los-70-mil-casos-de-covid-19-y-registra-1533-muertes/,"En suelo patrio la pandemia no da tregua. En las últimas 24 horas ha arrebatado la vida de 31 personas. Para hoy miércoles 5 de agosto en Panamá se contabilizan 44,792 pacientes recuperados, 807 casos",06-08-2020 02:40,https://www.bing.com/th?id=ON.93EB37405281C380B500F320F7A612F2,Panamá,En Segundos
"Panamá alcanza las 1,553 muertes por Covid-19",https://www.metrolibre.com/nacionales/178500-panam%C3%A1-alcanza-las-1553-muertes-por-covid-19.html,"Para este miércoles, 5 de agosto, el Ministerio de Salud contabilizó 807 nuevos casos positivos de Covid-19, para un total acumulado de 70,231.  A la fecha se aplicaron 2,535 pruebas, para un porcenta",06-08-2020 03:07,https://www.bing.com/th?id=ON.C16DEA376240B22C7FE6D132F1FA3E70,Panamá,Metro Libre
Más de 70 mil casos acumulados de Covid-19,https://www.critica.com.pa/nacional/mas-de-70-mil-casos-acumulados-de-covid-19-584960,"En tres días se han dado 82 muertes por coronavirus y 2,778 contagios para un total acumulado de 70,231 infectados. Ayer se aplicaron 2,535 pruebas y 807 (32%) fueron positivas. Además se reportaron 3",06-08-2020 05:14,https://www.bing.com/th?id=ON.F6906BEFB5F47A6F14B3E8BF357FAEDA,Panamá,Critica
Bajan los casos de contagios de covid-19 en San Miguelito,http://elsiglo.com.pa/panama/bajan-casos-contagios-covid-19-miguelito/24161820,"Se encuentran evaluando la reactivación de algunas actividades económicas del Bloque 3, inclusive el Bloque 4 para otras provincias del país Retención. Debido a que el RT (número reproductivo de casos",06-08-2020 05:14,https://www.bing.com/th?id=ON.85FB7A4A8422BC858CE23A81C051A744,Panamá,El Siglo
Tour Panamá se realizará de manera virtual,https://www.panamaamerica.com.pa/deportes/tour-panama-se-realizara-de-manera-virtual-1169330,"Además de Panamá, ""los invitados serán solamente selecciones de diferentes países, obviamente con el aval de sus federaciones entre ellos: Costa Rica, Guatemala, El Salvador, Honduras, Belice, Guadalu",06-08-2020 05:19,https://www.bing.com/th?id=ON.A04DB6A69E19D6534EB4BAE1ADF1A35D,Panamá,panamaamerica.com.pa
