name,url,description,datePublished,imagen,pais,Fuente
Data Intelligence y el comportamiento de la pandemia en Panamá tras la apertura,https://www.radiopanama.com.pa/noticias/actualidad/data-intelligence-y-el-comportamiento-de-la-pandemia-en-panama-tras-la-apertura/20201001/nota/4074387.aspx,"La empresa Data Intelligence International quién se encarga de analizar los datos del comportamiento del COVID-19 en Panamá con los reportes del Ministerio de Salud, lleva a cabo una estadística que s",01-10-2020 15:58,https://www.bing.com/th?id=OVFT.U5aKDYpkHePXVNpXvKWW7y,Panamá,Radio Panamá
Conozca cómo la IA cambió la forma de viajar,https://elcapitalfinanciero.com/conozca-como-la-ia-cambio-la-forma-de-viajar/,"La IA ha sido de gran impacto en la lucha contra la pandemia de COVID-19, pero más allá de ello, esta tecnología ha llegado para quedarse y ayudar a crear sociedades más seguras e inteligentes.",01-10-2020 16:01,https://www.bing.com/th?id=OVFT.NM4shqbLydUEPhSqNDbcjS,Panamá,El Capital Financiero
La hípica rompe la inactividad deportiva en Panamá,http://elsiglo.com.pa/deportes/hipica-rompe-inactividad-deportiva-panama/24165126,"Causada por la COVID-19 (nuevo coronavirus). ""Los animales se ven felices al subir al trabajo diario, parece que supieran que van a volver a competir"", afirmó a EFE José Armado Góngora, dueño de un ca",01-10-2020 16:10,https://www.bing.com/th?id=OVFT.adn_SryttnmIGSskRQTcoy,Panamá,El Siglo
Trabajadores protestan en el Minsa para poder cobrar sus salarios [Video],https://www.critica.com.pa/nacional/trabajadores-protestan-en-el-minsa-para-poder-cobrar-sus-salarios-video-589073,Los obreros con pancartas esperaban ser recibidos por alguna autoridad del Minsa para dialogar en torno a la reclamación salarial.,01-10-2020 16:48,https://www.bing.com/th?id=OVFT.NxuDRbgYlqCC83qBnH9Key,Panamá,Critica
Indicasat realiza estudio para detectar anticuerpos específicos contra el Covid-19,https://www.metrolibre.com/nacionales/183328-indicasat-realiza-estudio-para-detectar-anticuerpos-espec%C3%ADficos-contra-el-covid-19.html,El Instituto de Investigaciones Científicas y Servicios de Alta Tecnología (INDICASAT AIP) realizó el primer estudio de seroprevalencia en Panamá para evaluar la detección temprana de anticuerpos anti,01-10-2020 17:19,https://www.bing.com/th?id=OVFT.julY2DqRkLaR-lRS0rxD2C,Panamá,Metro Libre
27 casas afectadas por inundaciones en Tonosí,https://www.critica.com.pa/provincias/27-casas-afectadas-por-inundaciones-en-tonosi-589077,"Se informó que rescatistas de los bomberos, en conjunto con personal del Sistema Nacional de Protección Civil se encuentran en el área, realizando el censo de las personas afectadas y así coordinar co",01-10-2020 17:42,https://www.bing.com/th?id=OVFT.4OMUena51XxjFDU5Zq-XcC,Panamá,Critica
Gobernadora de Panamá se colocó vacuna experimental contra la covid-19,http://elsiglo.com.pa/panama/gobernadora-panama-coloco-vacuna-experimental-contra-covid-19/24165138,"La gobernadora de la provincia de Panamá, Judy Meana,  confirmó que se colocó la vacuna experimental contra a covid-19. Esta confirmación la hizo en RPC Radio. Es un estudio que se lleva a cabo la com",01-10-2020 18:14,https://www.bing.com/th?id=OVFT.TFIpONwQsM7o_LQ2OluqVy,Panamá,El Siglo
El Minsa y la CSS se preparan en Panamá Oeste ante posible rebrote,https://www.telemetro.com/nacionales/2020/10/01/el-minsa-y-la-css-se-preparan-en-panama-oeste-ante-posible-rebrote/3298039.html,"El doctor Kevin Cedeño de la Región de Salud de Panamá Oeste y la doctora Herminia Mariscal,  directora de la Caja del Seguro Social de este sector, informaron sobre las estrategias que preparan para",01-10-2020 18:30,https://www.bing.com/th?id=OVFT.50uhDW0RUkIGa43Q4oTYTC,Panamá,Telemetro
"Trump es el principal factor de desinformación sobre la Covid-19, según un estudio",https://www.prensa.com/mundo/trump-es-el-principal-factor-de-desinformacion-sobre-la-covid-19-segun-un-estudio/,"El presidente estadounidense Donald Trump es probablemente el mayor factor de desinformación sobre la Covid-19, según un estudio de la Universidad de Cornell, financiado en parte por la Fundación de B",01-10-2020 19:39,https://www.bing.com/th?id=OVFT.M-GuYZnCGMq0He7STTMASS,Panamá,prensa.com
Inauguran la I Expo Virtual Empresarial Panamá–Latinoamérica,https://elcapitalfinanciero.com/inauguran-la-i-expo-virtual-empresarial-panama-latinoamerica/,"La I Expo Virtual Empresarial Panamá–Latinoamérica, fue inaugurada, a través de una plataforma online, con la participación de 200 empresas expositoras proveedoras de productos y servicios de la nació",01-10-2020 20:07,https://www.bing.com/th?id=OVFT.j9zWovcSBC0WohdbNPnlmS,Panamá,El Capital Financiero
Inauguran Expo Virtual Empresarial Panamá – Latinoamérica,https://www.panamaamerica.com.pa/economia/inauguran-expo-virtual-empresarial-panama-latinoamerica-1173183,"La I Expo Virtual Empresarial Panamá – Latinoamérica, fue inaugurada hoy, a través de la plataforma online, con la participación de 200 empresas expositoras proveedoras de productos y servicios de la",01-10-2020 20:21,https://www.bing.com/th?id=OVFT.kKbJr5hgWLvL_xBFxAwSMC,Panamá,panamaamerica.com.pa
España abandona por la pandemia las reglas de disciplina presupuestaria,https://ensegundos.com.pa/2020/10/01/espana-abandona-por-la-pandemia-las-reglas-de-disciplina-presupuestaria/,"El gobierno de España anunció el miércoles que abandonará las reglas de disciplina presupuestaria para 2020 y 2021 debido al impacto de la pandemia de covid-19 sobre las finanzas públicas. ""El gobiern",01-10-2020 20:45,https://www.bing.com/th?id=OVFT.7Vn7YH9xPaT8Bix8V0Gg7S,Panamá,En Segundos
Donan $50 mil para la adquisición de oxímetros para pacientes con covid-19,https://www.laestrella.com.pa/economia/201001/donan-50-000-adquisicion-6-000-oximetros-pacientes-covid-19,PriceSmart y la Fundación Price Philanthropies donaron los equipos al movimiento #TodoPanamá como parte de los esfuerzos para combatir el contagio y promover la recuperación del país,01-10-2020 20:52,https://www.bing.com/th?id=OVFT.eGbW_2GDr2CeHJobxQhckC,Panamá,laestrella.com.pa
Trump’s infodemic of COVID-19 fake news,https://www.newsroompanama.com/health/trumps-infodemic-of-covid-19-fake-news,"President Trump is the biggest source of misinformation about Covid-19, according to a Cornell University study, A team from the Cornell Allia",01-10-2020 20:54,https://www.bing.com/th?id=OVFT.M-GuYZnCGMq0He7STTMASS,Panamá,Newsroom Panama
Levantan Ley Seca en Arraiján... Cuarentena obligatoria los domingos,https://www.diaadia.com.pa/el-pais/levantan-ley-seca-en-arraijan-cuarentena-obligatoria-los-domingos-370925,"El alcalde del distrito de Arraiján, Rolly Rodríguez, confirmó la suspensión de la Ley Seca, que prohibía la venta, consumo y distribución de bebidas alcohólicas durante los últimos meses de est",01-10-2020 21:03,https://www.bing.com/th?id=OVFT.htqHMcyd_ftI9ijQpEZJTS,Panamá,Día a Día
"Expo virtual reúne a 200 empresas de Panamá y 1,100 compradores de 15 países",https://www.telemetro.com/nacionales/2020/10/01/expo-virtual-reune-200-empresas/3299013.html,"Unas 200 empresas panameñas proveedoras de productos y servicios y cerca de 1,100 compradores de más de 15 países participan desde este jueves en una inédita expo virtual que pretende generar negocios",01-10-2020 21:28,https://www.bing.com/th?id=OVFT.QCmvmMnvVKvW7AFdJ2GO7y,Panamá,Telemetro
"COVID-19, donantes y personal de salud: ¿Qué reveló un estudio hecho en Panamá y Colón?",https://www.panamaamerica.com.pa/sociedad/covid-19-donantes-y-personal-de-salud-que-revelo-un-estudio-hecho-en-panama-y-colon-1173188,"Un 12% , entre   trabajadores de la salud y donantes de sangre de cuatro hospitales de Panamá y Colón, ya había estado en contacto con el coronavirus a inicios de julio, según los resultados de un est",01-10-2020 21:51,https://www.bing.com/th?id=OVFT.0fQqDltcgfWPA1RVmLeuxy,Panamá,panamaamerica.com.pa
Viéndonos como flores,https://ensegundos.com.pa/2020/10/01/viendonos-como-flores/,"Cristina Martínez pinta a las mujeres como si fueran flores. En sus imágenes de colores brillantes, sus cabezas se alzan y caen sobre sus cuerpos, como capullos demasiado pesados para sus tallos. A me",01-10-2020 21:55,https://www.bing.com/th?id=OVFT.dYGDIMB6kwJydG1S3DluoS,Panamá,En Segundos
"Barceló dio positivo en prueba de COVID-19, está en cuarentena",https://www.diaadia.com.pa/fama/barcelo-dio-positivo-en-prueba-de-covid-19-esta-en-cuarentena-370928,"El COVID-19 sigue azotando. Aquí en Panamá, varias son las caras populares que se han contagiado de este virus que ha provocado la muerte de millones de personas en el mundo.  Ahora qu",01-10-2020 22:08,https://www.bing.com/th?id=OVFT.eSOXlHFjgvwoO-27EeEIRC,Panamá,Día a Día
La hípica rompe la inactividad deportiva en Panamá causada por la COVID-19,https://www.tvn-2.com/deportes/otros/inactividad-deportiva-Panama-causada-COVID-19_0_5683681651.html,"La hípica es la primera disciplina deportiva en volver tras la parada obligada por la crisis de la COVID-19, que ha golpeado con dureza a Panamá, un país de 4,2 millones de habitantes que acumula ya m",01-10-2020 22:09,https://www.bing.com/th?id=OVFT.NlPTn9KEyinV0CyqoJ65eC,Panamá,TVN
Jacky Guzmán fue nominada como ‘Influencer Latina’ por llevar soluciones a personas de escasos recursos y afectados con la covid-19,https://www.midiario.com/farandula/jacky-guzman-fue-nominada-como-influencer-latina-por-llevar-soluciones-a-personas-de-escasos-recursos-y-afectados-con-la-covid-19/,La expresentadora y empresaria Jacky Guzmán anunció en su cuenta de Instagram que es la primera panameña en ser nominada en los “E! People’s Choice Awards” o los “PCAS” de,01-10-2020 22:14,https://www.bing.com/th?id=OVFT.BQbsaQFgfsMzCYsdedEnBi,Panamá,Mi Diario
Brasil inicia análisis preliminares de la vacuna de Oxford contra la COVID-19,https://lagacetadepanama.com/brasil-inicia-analisis-preliminares-de-la-vacuna-de-oxford-contra-la-covid-19/,EFE. Las autoridades sanitarias brasileñas iniciaron este jueves los primeros análisis de los resultados que han obtenido hasta ahora la empresa AstraZeneca y la Universidad de Oxford en la búsqueda d,01-10-2020 22:54,https://www.bing.com/th?id=OVFT.tYM-pg_faZBQ1G_ljIgw1C,Panamá,La Gaceta de Panama
COVID-19 en Panamá: 15 muertes y 747 casos confirmados en las últimas horas,https://www.tvn-2.com/nacionales/COVID-19-Panama-muertes-confirmados-ultimas_0_5683681666.html,"Un total de 747 nuevos contagiados y 15 defunciones fueron confirmados por el Sistema de Vigilancia Epidemiológica de Panamá, al cierre de este jueves 1 de octubre.",01-10-2020 23:10,https://www.bing.com/th?id=OVFT.vDKgDg-nSrO7IZDeNJqqFi,Panamá,TVN
Panamá registra 747 nuevos casos de coronavirus,https://www.metrolibre.com/nacionales/183350-panam%C3%A1-registra-747-nuevos-casos-de-coronavirus.html,"El Ministerio de Salud (Minsa) reveló que, para este jueves, 1 de octubre, Panamá registró 747 casos positivos nuevos de coronavirus a nivel nacional, para un total acumulado de 113,342. Se detalló qu",01-10-2020 23:24,https://www.bing.com/th?id=OVFT.-TO-oQnxFyrk5pZonIjFJi,Panamá,Metro Libre
Inauguran la I Expo Virtual Empresarial Panamá Latinoamérica para realizar negocios en toda la región,https://www.radiopanama.com.pa/noticias/actualidad/inauguran-la-i-expo-virtual-empresarial-panama-latinoamerica-para-realizar-negocios-en-toda-la-region/20201001/nota/4074540.aspx,"Jean Pierre Leignadier, presidente de la CCIAP, expresó que a través de la feria multisectorial se promoverá el comercio entre empresarios, y así generar aportes a la economía de cada país, que se han",01-10-2020 23:59,https://www.bing.com/th?id=OVFT.U5aKDYpkHePXVNpXvKWW7y,Panamá,Radio Panamá
Panamá registró 15 defunciones y 747 casos nuevos de la covid-19 en las últimas 24 horas,https://www.laestrella.com.pa/nacional/201001/panama-registro-15-defunciones-747-casos-nuevos-ultimas-24-horas,"El país acumula 2,387 muertes por el virus y 113,342 casos detectados en todo el territorio nacional, según el Minsa",02-10-2020 01:15,https://www.bing.com/th?id=OVFT.f4o0cTd5EYsvSoc0f5NFcy,Panamá,laestrella.com.pa
Presidente de Guatemala ordena capturar a miles de migrantes hondureños,https://www.prensa.com/mundo/presidente-de-guatemala-ordena-capturar-a-miles-de-migrantes-hondurenos/,"El presidente de Guatemala, Alejandro Giammattei, ordenó este jueves la detención de miles de hondureños que en caravana ingresaron al país para llegar a Estados Unidos en medio de la pandemia de Covid-19. “En este momento se ha dado la orden que ...",02-10-2020 01:51,https://www.bing.com/th?id=OVFT.yJjBPyUXSDZQ2vRQo4uGhy,Panamá,prensa.com
