name,url,description,datePublished,imagen,pais,Fuente
Contenedores súper aislantes para transportar la vacuna contra el covid-19,https://ensegundos.com.pa/2020/12/06/contenedores-super-aislantes-para-transportar-la-vacuna-contra-el-covid-19-2/,"A primera vista parecen cajas ordinarias, pero contienen una joya tecnológica: los contenedores de la empresa alemana Va-Q-Tec, campeones del aislamiento térmico, que transportarán las vacunas contra",06-12-2020 22:12,https://www.bing.com/th?id=OVFT.8Y2pby8npi2CJv1Ryi9DOC,Panamá,En Segundos
Comunicado # 285,https://sertv.gob.pa/nacionalfm/comunicado-285/,"La viceministra de Salud, Ivette Berrio, presidió este sábado una reunión con un grupo de funcionarios que organiza y coordina la llegada de las primeras dosis de vacuna contra la COVID-19 en el prime",06-12-2020 22:16,https://www.bing.com/th?id=OVFT.757_294cVa63fVbouGhIXS,Panamá,SERTV
Más casos de coronavirus. Ministro Sucre recomienda que se haga la prueba antes de viajar al interior,https://www.midiario.com/nacionales/mas-casos-de-coronavirus-ministro-sucre-recomienda-que-se-haga-la-prueba-antes-de-viajar-al-interior/,"El Ministerio de Salud de Panamá informó para este domingo 6 de diciembre un total de mil 812 casos positivos nuevos, para un total acumulado de 177 mil",07-12-2020 00:40,https://www.bing.com/th?id=OVFT.0rLbEHlgVJ2fq--tIZRzEi,Panamá,Mi Diario
Magistrado Alfredo Juncá dio positivo para COVID-19,https://www.panamaamerica.com.pa/sociedad/magistrado-alfredo-junca-dio-positivo-covid-19-1177394,"El magistrado del Tribunal Electoral, Alfredo Juncá, confirmó que dio positivo para COVID-19.""He sido diagnosticado, junto con otros funcionarios, con COVID-19"", fue el mensaje que colocó en su cuenta",07-12-2020 04:38,https://www.bing.com/th?id=OVFT.nm3mkh82UWssAem_ozcaTi,Panamá,panamaamerica.com.pa
Encrucijada por inicio de clases semipresenciales,http://elsiglo.com.pa/panama/encrucijada-inicio-clases-semipresenciales/24169045,"El Meduca, estudiantes y once gremios avalan la modalidad híbrida; otros la rechazan. Las medidas adoptadas por las autoridades educativas en plena pandemia nunca tendrán el 100",07-12-2020 05:06,https://www.bing.com/th?id=OVFT.gwwO2fp2r3pJcl1lE1BGjy,Panamá,El Siglo
"El covid hizo desastre, mató a 52 personas en solo tres días",http://elsiglo.com.pa/panama/covid-hizo-desastre-mato-52-personas-solo-tres-dias/24169047,"Pandemia. Este fin de semana el covid-19 nuevamente estuvo candela. Entre el viernes y el domingo, el virus mató a 52 pacientes y contagió a otras 6 mil 500 personas en todo el país. El día en que hub",07-12-2020 05:06,https://www.bing.com/th?id=OVFT.j5kbWPzIRz_aqoPHP7ZYDC,Panamá,El Siglo
Coronavirus puede afectar el manduco,https://www.critica.com.pa/nacional/coronavirus-puede-afectar-el-manduco-593864,"Pacientes recuperados por Covid-19 podrían sufrir de disfunción eréctil, según la dra. Dena Grayson, experta en enfermedades infecciosas de la Universidad de Florida. La doctora dijo",07-12-2020 05:11,https://www.bing.com/th?id=OVFT.p-nCFW9YdPR55ipwSR539S,Panamá,Critica
Se lucieron a pesar de la pandemia,https://www.diaadia.com.pa/el-pais/se-lucieron-pesar-de-la-pandemia-373187,"Para nadie es un secreto que la pandemia de COVID-19 trastocó al mundo y sobre todo golpeó a la educación. A pesar de ello y en apoyo a la tecnología, se logró dar la batalla ante el reto",07-12-2020 06:51,https://www.bing.com/th?id=OVFT.qbMhGIV74JFZpk3i_LQjwi,Panamá,Día a Día
Metro de Panamá presenta aglomeraciones diarias,https://www.telemetro.com/entrevistas/2020/12/07/metro-de-panama-presenta-aglomeraciones-diarias/3530755.html,"Ante las aglomeraciones que se están presentando a diario en el Metro de Panamá los administradores de este medio de transporte recomiendan el uso de la mascarillas y la careta protectora, para minimi",07-12-2020 13:41,https://www.bing.com/th?id=OVFT.a-ZmuwvtdyuWZWjBX-Mv3S,Panamá,Telemetro
Panamá¡Auxilio! Médicos piden a sus colegas especialistas sumarse a la lucha contra la COVID-19,https://www.panamaamerica.com.pa/sociedad/auxilio-medicos-piden-sus-colegas-especialistas-sumarse-lucha-contra-covid-19-1177377,"Ante la nueva ola de casos de la COVID-19 que en los últimos dos días han superado los 2,000 contagios en Panamá, el doctor José Croston, director médico del Complejo Hospitalario Arnulfo Arias Madrid",07-12-2020 13:57,https://www.bing.com/th?id=OVFT.y-8dGEYQxCstuReFG7TzYi,Panamá,panamaamerica.com.pa
Magistrado Alfredo Juncá da positivo a Covid-19,https://ensegundos.com.pa/2020/12/07/magistrado-alfredo-junca-da-positivo-a-covid-19/,"El magistrado del Tribunal Electoral (TE), Alfredo Juncá confirmó la mañana de este lunes 7 de diciembre de 2020, que ha dado positivo a coronavirus Covid-19. “He sido diagnosticado junto con otros fu",07-12-2020 15:13,https://www.bing.com/th?id=OVFT.94RHjGPgC84BH4bl3ROE-i,Panamá,En Segundos
Cuarentena los fines de semana en Santiago de Chile tras aumento de casos de la Covid-19,https://www.prensa.com/mundo/cuarentena-los-fines-de-semana-en-santiago-de-chile-tras-aumento-de-casos-de-la-covid-19/,"La Región Metropolitana de Chile, la más poblada del país, retrocederá desde el jueves a la cuarentena durante los fines de semana debido a un aumento de 18% de nuevos casos de la Covid-19, que ha gol",07-12-2020 15:34,https://www.bing.com/th?id=OVFT.nYGS1mh5FNoBTNjPYT75ii,Panamá,prensa.com
"En Panamá, siguen sensibilizando a padres de familia y encargados de fincas, sobre trabajos prohibidos para menores de edad",https://sertv.gob.pa/nacionalfm/en-panama-siguen-sensibilizando-a-padres-de-familia-y-encargados-de-fincas-sobre-trabajos-prohibidos-para-menores-de-edad/,"Ampliando su recorrido para la prevención del Trabajo Infantil, personal del Ministerio de Trabajo y Desarrollo Laboral de Panamá (MITRADEL) en conjunto con Casa Esperanza y la Defensoría del Pueblo,",07-12-2020 15:46,https://www.bing.com/th?id=OVFT.nm9gIsN8BmThYtkhuprSVS,Panamá,SERTV
Primer lote de vacunas contra la Covid-19 será para personal que está en ‘la primera línea de batalla’ y personas en riesgo,https://www.prensa.com/sociedad/primer-lote-de-vacunas-contra-la-covid-19-sera-para-personal-que-esta-en-la-primera-linea-de-batalla-y-personas-en-riesgo/,"La viceministra de Salud, Ivette Berrío, reiteró este lunes, 7 de diciembre, que Panamá se está preparando para recibir el primer lote de vacunas contra la Covid-19, entre la segunda quincena de enero",07-12-2020 17:03,https://www.bing.com/th?id=OVFT.J-Pg3sTpgZLNXiQZijLT6C,Panamá,prensa.com
Autoridades de La Chorrera piden al Minsa evaluar nuevas medidas de restricción,https://www.tvn-2.com/nacionales/provincias/Decretan-Ley-Seca-Panama-Oeste_0_5733926599.html,"El Consejo Municipal de La Chorrera pidió al Ministerio de Salud (Minsa), que evalúen medidas de restricción por COVID-19, luego del incremento de casos en esa provincia.",07-12-2020 18:04,https://www.bing.com/th?id=OVFT.UuaE8q6UYKr3LLS97tEsci,Panamá,TVN
Aún no se tiene una fecha para inicio del proceso de vacunación contra COVID-19,https://www.critica.com.pa/nacional/aun-no-se-tiene-una-fecha-para-inicio-del-proceso-de-vacunacion-contra-covid-19-593889,"Según la alta funcionaria, esto es un proceso arduo, ""porque todo el mundo en este momento está esperando -que- las fechas de entrega -sean anunciadas-, ya que las casas -farmacéuticas- están esperand",07-12-2020 18:19,https://www.bing.com/th?id=OVFT.HHOg3KggM9RfNlxwb2z0Ty,Panamá,Critica
Viceministra Berrío aclara sobre grupo al que se le aplicará la vacuna y cadena de frío,https://www.telemetro.com/nacionales/2020/12/07/viceministra-berrio-aclara-sobre-grupo-al-que-se-le-aplicara-la-vacuna-y-cadena-de-frio/3531679.html,"La viceministra de Salud Ivette Berrío, aclaró que entre la lista de personas o el grupo prioritario al que se le colocará la vacuna contra el COVID-19 que llegará en el primer trimestre del 2021, no",07-12-2020 18:22,https://www.bing.com/th?id=OVFT.-vPErZBLjBajP5FQJkzPXi,Panamá,Telemetro
Oli Camarena comienza con pie derecho su entrenamiento en El Salvador,https://www.midiario.com/deportivas/oli-camarena-comienza-con-pie-derecho-su-entrenamiento-en-el-salvador/,"El subcampeón mundial panameño, Jean Carlos Gonzalez, mejor conocido como “Oli Camarena”, arrancó con buen pie la segunda etapa de su plan de entrenamiento, ahora en un campamento intensivo en el Puro",07-12-2020 18:54,https://www.bing.com/th?id=OVFT.D3RecpyQ9Z4_yFF7rOnulS,Panamá,Mi Diario
Piden nuevas medidas de restricción de movilidad en Panamá Oeste,https://noticias24pty.com/piden-nuevas-medidas-de-restriccion-de-movilidad-en-panama-oeste/,"El Concejo Municipal de La Chorrera, aprobó una resolución, solicitando a la Gobernadora de la provincia de Panamá Oeste, Sindy Smith y al Ministerio de Salud (Minsa) a aplicación de nuevas",07-12-2020 19:09,https://www.bing.com/th?id=OVFT.Tn8tWDbNoD2xgibZtNwcwy,Panamá,Noticias 24 PTY
Hub Humanitario en Panamá Pacífico transformado en Centro de Atención de Crisis,https://www.diaadia.com.pa/el-pais/hub-humanitario-en-panama-pacifico-transformado-en-centro-de-atencion-de-crisis-373202,El Hub Humanitario es el único centro logístico en la región que trabaja fuertemente en dinamizar los procesos para que la ayuda llegue a los más necesitados.El Centro Logístico Regional de Asistencia,07-12-2020 19:21,https://www.bing.com/th?id=OVFT.05ADyc069u5C20BeSqyRFi,Panamá,Día a Día
