name,url,description,datePublished,imagen,pais,Fuente
Médicos piden al MINSA uso del Dióxido de Cloro,https://www.critica.com.pa/nacional/medicos-piden-al-minsa-uso-del-dioxido-de-cloro-594855,Un grupo de médicos en Panamá pidieron ayer al ministro de Salud Luis Francisco Sucre que autorice el uso del tratamiento terapéutico Dióxido de Cloro,23-12-2020 04:00,https://www.bing.com/th?id=OVFT.f5P4YfHvgG29HSlMQOXlbi,Panamá,Critica
"Viajeros, presos por ‘falsos positivos’ en Tocumen",https://noticias24pty.com/viajeros-presos-por-falsos-positivos-en-tocumen/,Numerosos turistas y viajeros locales que dieron positivo en la prueba rápida de Covid-19 a su llegada a las terminales del Aeropuerto Internacional de Tocumen (Aitsa) –aunque luego han resultado,23-12-2020 04:45,https://www.bing.com/th?id=OVFT.iqdy_NAkye1Ewddt9low6C,Panamá,Noticias 24 PTY
"El Pres. del COP, Camilo Amado V., ‘rehusa’ Convocar la 2ª Vuelta, de las Elecciones 2020-.2024",https://www.laestrella.com.pa/deportes/cocteldeportivo/201222/pres-cop-camilo-amado-v-rehusa-convocar-2-vuelta-elecciones-2020-2024,"La decisión fue tomada el Sáb., 12 de Dic. por la ‘CEI’. S.Saucedo y D.Young, no lograron los 38 Votos +1 Las Notas Sueltas. N°1). Hoy miércoles 23 de Dic. 2020, faltando 2 días para la navidad, (25 d",23-12-2020 05:40,https://www.bing.com/th?id=OVFT.df3Hbt7wA5GR76g61G9QWi,Panamá,laestrella.com.pa
Amplían cobertura de atención domiciliaria,https://noticias24pty.com/amplian-cobertura-de-atencion-domiciliaria/,El programa de atención domiciliaria de pacientes de Covid-19 que llevan adelante el movimiento TodoPanamá y la Fundación Unidos por Panamá ampliará su cobertura y el número de pacientes que,23-12-2020 08:43,https://www.bing.com/th?id=OVFT.8VsHam81FU2t8OIUpDJ-5C,Panamá,Noticias 24 PTY
Un hombre murió tras contagiarse dos veces de coronavirus con cepas distintas,https://www.midiario.com/salud/un-hombre-murio-tras-contagiarse-dos-veces-de-coronavirus-con-cepas-distintas/,"Israel confirmó la muerte de un hombre que había contraído por segunda vez el coronavirus, tras contagiarse tres meses después de pasar el virus de una nueva variante de la",23-12-2020 12:04,https://www.bing.com/th?id=OVFT.Ikmry1lsEvskdPqg0ScsBi,Panamá,Mi Diario
Minsa prohíbe viajes en buses desde y hacia el interior del país como medida para contener el contagio de la COVID-19,https://www.panamaamerica.com.pa/sociedad/minsa-prohibe-viajes-en-buses-desde-hacia-interior-del-pais-como-medida-contener-contagio,"como parte de las medidas ante el acelerado nivel de contagio de la COVID-19. Mediante Decreto Ejecutivo, el Minsa ordenó un cerco sanitario para Panamá y Panamá Oeste, provincias que acumulan la mayor cantidad de casos de coronavirus según los ...",23-12-2020 12:38,https://www.bing.com/th?id=OVFT.ZQyC_0_L-X0jryaRVt2y2i,Panamá,panamaamerica.com.pa
Panamá aplica cerco sanitario para evitar movilización en fiestas de navidad,https://anpanama.com/10641-Panama-aplica-cerco-sanitario-para-evitar-movilizacion-en-fiestas-de-navidad.note.aspx,(Ciudad de Panamá-ANPanamá) Panamá inició su cerco sanitario en distintos puntos para evitar la movilización de ciudadanos hacia el interior del país con miras al encierro de navidad dispuesto como medida para contener la propagación del COVID-19.,23-12-2020 12:41,https://www.bing.com/th?id=OVFT.eUiR4HWr8A2O5tXqqxsfUC,Panamá,AN Panama
"En Panamá se registra un promedio de 25 muertes por COVID-19 al día, solo el mes de diciembre",https://www.panamaamerica.com.pa/sociedad/en-panama-se-registra-un-promedio-25-muertes-por-covid-19-al-dia-solo-mes-diciembre-1178334,"Solo en el mes de diciembre, en Panamá, se registra un promedio de 25 muertes por día debido a  la COVID-19, es decir más de una persona está muriendo diariamente por esta enfermedad.En los últimos 22",23-12-2020 14:01,https://www.bing.com/th?id=OVFT.2AY5RU_zC8gVG2Lw5Sox1S,Panamá,panamaamerica.com.pa
Los Expertos de Vertiv Prevén que los Centros de Datos Serán Tan Críticos como los Servicios Públicos en 2021,https://www.nexpanama.com/los-expertos-de-vertiv-preven-que-los-centros-de-datos-seran-tan-criticos-como-los-servicios-publicos-en-2021/,"A medida que el mundo se trasladaba a la red aparentemente de la noche a la mañana debido a la pandemia de la COVID-19, la criticidad de los centros de datos y la incesante dependencia de estos en todos los ámbitos de la vida se han convertido en una ...",23-12-2020 14:03,https://www.bing.com/th?id=OVFT.nJyiOW8x7_wmqsv-ugXcjC,Panamá,NEX TV
La Gobernación de Panamá actúa como mediadora en entierros de solemnidad,https://www.tvn-2.com/nacionales/Gobernacion-Panama-mediadora-entierros-solemnidad_0_5745925361.html,"Bajo la labor de asistir y supervisar se encuentra la Gobernación de Panamá, con aquellas personas que han perdido a un ser querido producto de la pandemia por la COVID-19 y que desean darle un entierro digno, así lo dio a conocer la gobernadora ...",23-12-2020 14:07,https://www.bing.com/th?id=OVFT.ZPrFwcdBrLvNq1n0_i5O4i,Panamá,TVN
El lugar que merecen los patriotas,https://bayanodigital.com/el-lugar-que-merecen-los-patriotas/,"Ernesto A. Holder Columnista La Estrella de Panamá La discusión sobre qué es ser patriota o no, se puede realizar desde varias perspectivas. Los que invierten dinero y crean oportunidades de negocios",23-12-2020 14:38,https://www.bing.com/th?id=OVFT.3RGjZGfSJUPbAqPJimmUbC,Panamá,Bayano Digital
Panamá cuenta con 4 congeladores para almacenamiento de vacunas contra Covid-19,https://www.critica.com.pa/nacional/panama-cuenta-con-4-congeladores-para-almacenamiento-de-vacunas-contra-covid-19-594880,"El Instituto Conmemorativo Gorgas para Estudios de la Salud (ICGES) está preparado para recibir el primer lote de la vacuna de Pfizer y BioNTech contra la COVID-19, ya que Panamá cuenta con cuatro congeladores para almacenarlas a una temperatura de -80 ...",23-12-2020 14:42,https://www.bing.com/th?id=OVFT.oVrG81M390bHTcQy66kY1C,Panamá,Critica
"""Instituto Gorgas está preparado para recibir el primer lote de vacuna covid""",http://elsiglo.com.pa/panama/instituto-gorgas-esta-preparado-para-recibir-primer-lote-vacuna-covid/24169940,"El director del Instituto Conmemorativo Gorgas de Estudios de la Salud (ICGES) ,Juan Miguel Pascale. informó que está preparado para recibir el primer lote de la vacuna de Pfizer y BioNTech contra la",23-12-2020 14:49,https://www.bing.com/th?id=OVFT.o2lGfoWR0jVGpIqglPFWAy,Panamá,El Siglo
Intuban por Covid-19 al compositor mexicano Armando Manzanero,https://www.prensa.com/entretenimiento/intuban-por-covid-19-al-compositor-mexicano-armando-manzanero/,"El afamado compositor mexicano Armando Manzanero, ícono de la música romántica, fue intubado por Covid-19, informó su familia en un comunicado la noche del",23-12-2020 15:16,https://www.bing.com/th?id=OVFT.g1PeYjvOE6862bqSqK2yHC,Panamá,prensa.com
El Instituto Conmemorativo Gorgas está preparado para recibir vacuna Pfizer,https://ensegundos.com.pa/2020/12/23/el-instituto-conmemorativo-gorgas-esta-preparado-para-recibir-vacuna-pfizer/,"Tres de los cuatro congeladores con los que ya cuenta Panamá están bajo la administración del Gorgas y el otro, en el Instituto de Investigaciones Científicas y Servicios de Alta Tecnología de Panamá",23-12-2020 16:51,https://www.bing.com/th?id=OVFT.ks_EJw3ayb7fyxGtF4Evei,Panamá,En Segundos
México iniciará el jueves vacunación contra COVID-19 a personal médico,http://www.nexpanama.com/mexico-iniciara-el-jueves-vacunacion-contra-covid-19-a-personal-medico/,"México comenzará el jueves la aplicación de la vacuna contra el COVID-19 de la farmacéutica estadounidense Pfizer entre personal médico, de acuerdo a lo planeado, informó el miércoles el presidente, A",23-12-2020 17:20,https://www.bing.com/th?id=OVFT.5tGY_BlomVuTrboQvP_t4i,Panamá,NEX TV
Proyecciones epidemiológicas indican que para enero en Panamá se esperan 100 muertos diarios por COVID-19,https://www.telemetro.com/nacionales/2020/12/23/proyecciones-epidemiologicas-indican-enero-panama/3582158.html,"El epidemiólogo Arturo Rebollón señaló en Radiografía que ante la situación actual que se registra en Panamá, con el drástico aumento de casos de COVID-19, se podrían esperar 100 muertos y más de 4 mi",23-12-2020 18:01,https://www.bing.com/th?id=OVFT.glkAbw52LnGtd42Dhc678S,Panamá,Telemetro
"Proyectan cerca de 4 mil contagios de COVID-19 para enero, según epidemiólogo",https://www.telemetro.com/nacionales/2020/12/23/proyectan-cerca-de-4-mil-contagios-de-covid-19-para-enero-segun-epidemiologo/3582157.html,"El epidemiólogo Arturo Rebollón señaló en Radiografía que ante la situación actual que se registra en Panamá, con el drástico aumento de casos de COVID-19, se podrían esperar 100 muertos y más de 4 mi",23-12-2020 18:15,https://www.bing.com/th?id=OVFT.y7AQmi0WQE-QeMSqNP6tbS,Panamá,Telemetro
Este miércoles llegan las vacunas contra el nuevo coronavirus a Costa Rica,https://www.prensa.com/mundo/este-miercoles-llegan-las-vacunas-contra-el-nuevo-coronavirus-a-costa-rica/,La Caja Costarricense de Seguro Social (CCSS) informó este 23 de diciembre que este miércoles llegarán las primeras vacunas contra el nuevo coronavirus a ese país,23-12-2020 18:20,https://www.bing.com/th?id=OVFT.IHiXk3k0YwQiqs7xqWGXrC,Panamá,prensa.com
Gorgas realizará estudios para determinar si nueva cepa del coronavirus está en Panamá,https://www.tvn-2.com/nacionales/Cientificos-Gorgas-realizaran-SARCOV-2-Panama_0_5745925408.html,"Un estudio de muestreo realizarán científicos del Instituto Conmemorativo Gorgas, para determinar si la nueva cepa de Sarcov-2, detectada desde el mes de septiembre en Reino Unido, ingresó a Panamá.",23-12-2020 18:44,https://www.bing.com/th?id=OVFT.zZS2S38EKioQ_KishRee4S,Panamá,TVN
Médicos piden mayor cuidado contra las quemaduras durante la cuarentena de fin de año,https://www.metrolibre.com/nacionales/189814-m%C3%A9dicos-piden-mayor-cuidado-contra-las-quemaduras-durante-la-cuarentena-de-fin-de-a%C3%B1o.html,"Ante la cuarentena total decretada durante las fiestas navideñas a raíz de la pandemia por el Covid-19, la Dra. Marvis Corro, jefa de la Unidad de Quemados del Hospital del Niño Dr. José Renán Esquivel, dijo que se debe tener mayor cuidado ...",23-12-2020 19:08,https://www.bing.com/th?id=OVFT.RhQYTz-vkyGcYmeDwJNqWS,Panamá,Metro Libre
El hipódromo cierra el año con 4 días de carreras,https://www.midiario.com/deportivas/el-hipodromo-cierra-el-ano-con-4-dias-de-carreras/,"La empresa Hípica de Panamá, informó oficialmente que el horario de carreras locales de fin de año en el Hipódromo Presidente Remón, constará con 4 días eventos del patio, y la actual semana navideña",23-12-2020 19:09,https://www.bing.com/th?id=OVFT.tpkJ6AIPNRPDRix75oko3S,Panamá,Mi Diario
Piden aprobar el uso de dióxido de cloro para la atención de pacientes con Covid-19,https://ensegundos.com.pa/2020/12/23/piden-aprobar-el-uso-de-dioxido-de-cloro-para-la-atencion-de-pacientes-con-covid-19/,"Los médicos de COMUSAV piden al ministro una reunión para ampliar más sobre esta carta y ponerlo al tanto de las bondades del dióxido de cloro. La Coalición Mundial de Salud y Vida (COMUSAV), remitió",23-12-2020 19:30,https://www.bing.com/th?id=OVFT.6oCCx-iDj3csseZ0xQUnQC,Panamá,En Segundos
Comunicado # 301,https://sertv.gob.pa/crisolfm/comunicado-301/,"El ministro de Salud, Luis Francisco Sucre, hizo el anuncio durante la conferencia de prensa realizada este martes, para dar a conocer el informe epidemiológico sobre el comportamiento del COVID-19 en",23-12-2020 19:42,https://www.bing.com/th?id=OVFT.NgejyZ9m253gdLFc69rKty,Panamá,SERTV
Mundial de ciclismo en pista paralímpico,https://www.laestrella.com.pa/tag/mundial-de-ciclismo-en-pista-paralimpico,"La cancelación del campeonato se debe ""a las restricciones impuestas por las autoridades competentes"" debido a la la pandemia de la covid-19",23-12-2020 19:57,https://www.bing.com/th?id=OVFT.df3Hbt7wA5GR76g61G9QWi,Panamá,laestrella.com.pa
Se la rifan. Mujeres abarrotan los almacenes para últimas compras de navidad,http://elsiglo.com.pa/panama/mujeres-abarrotan-almacenes-para-ultimas-compras-navidad/24169952,"Hoy, miércoles es el día que pueden salir las mujeres a hacer sus compras, tomando en cuenta la movilidad establecida por las autoridades para disminuir la propagación de la covid-19. El Siglo pudo constatar que las mujeres han abarrotado La Central ...",23-12-2020 20:08,https://www.bing.com/th?id=OVFT.yIdHrIgs6JKQAEyjZTjImS,Panamá,El Siglo
"ICGES preparado para recibir vacuna Pfizer, en Panamá",https://sertv.gob.pa/nacionalfm/icges-preparado-para-recibir-vacuna-pfizer-en-panama/,"El Instituto Conmemorativo Gorgas para Estudios de la Salud (ICGES) está preparado para recibir el primer lote de la vacuna de Pfizer y BioNTech contra la COVID-19, ya que Panamá, cuenta con cuatro co",23-12-2020 20:20,https://www.bing.com/th?id=OVFT.nrbbEfiAKxhnQk3t-U6AhS,Panamá,SERTV
