name,url,description,datePublished,imagen,pais,Fuente
"Hay 1,432 pacientes hospitalizados de COVID-19 y 2,422 nuevos casos",https://www.critica.com.pa/nacional/hay-1432-pacientes-hospitalizados-de-covid-19-y-2422-nuevos-casos-594262,"Panamá sumó este domingo 2,422 nuevos casos de la covid-19 y 25 nuevas defunciones por la enfermedad, lo que elevó hasta 193,007 los casos confirmados y a 3,356 las muertes desde marzo pasado, según e",13-12-2020 22:58,https://www.bing.com/th?id=OVFT.K3d_hJBGvg1jDyV9B_M9tS,Panamá,Critica
La medida surge en medio del aumento de casos nuevos detectados por COVID-19,https://www.radiopanama.com.pa/noticias/fecha/20201213.aspx,"Los casos activos suman 26,613, se han registrado 22 nuevas defunciones, que totalizan 3,331 acumuladas y una letalidad del 1.7%.",13-12-2020 23:41,https://www.bing.com/th?id=OVFT.U5aKDYpkHePXVNpXvKWW7y,Panamá,Radio Panamá
"Se incrementa número de pacientes de COVID-19 en unidades de cuidados intensivos; mientras se registran 2,422 nuevos casos y 25 muertes",https://www.panamaamerica.com.pa/sociedad/se-incrementa-numero-pacientes-covid-19-en-unidades-cuidados-intensivos-mientras-se,"El número de pacientes con COVID-19 en unidades de cuidados intensivos aumentó este domingo 13 de diciembre a 188, encomparación al día anterior que habían 183. Seegún el informe del Ministerio de Salud (Minsa) en Panamá se contabilizan 162,105 ...",13-12-2020 23:43,https://www.bing.com/th?id=OVFT.PQhnDasiNJJ8jd0WvrNjIi,Panamá,panamaamerica.com.pa
Productos de la cena navideña suben su costo hasta un 40% en Merca Panamá,https://www.tvn-2.com/nacionales/Productos-cena-navidena-suben-Merca-Panama_0_5738426161.html,"La crisis económica causada por la pandemia de la COVID-19 ha puesto en una posición difícil a muchas familias panameñas que este fin de año buscan resolver la cena navideña con productos nacionales,",13-12-2020 23:54,https://www.bing.com/th?id=OVFT.HWSgvKTUrxVcNx9NRW-KBi,Panamá,TVN
Panamá ya tiene el procedimiento para la importación de la vacuna contra la covid-19,https://noticias24pty.com/panama-ya-tiene-el-procedimiento-para-la-importacion-de-la-vacuna-contra-la-covid-19/,"La vacuna contra la covid-19 ya empezó a aplicarse en el Reino Unido y Estados Unidos y Canadá, quienes autorizaron la utilización de la vacuna producida por Pfizer. Panamá ya tiene su procedimiento para la importación de la vacuna contra la covid-19.",14-12-2020 02:07,https://www.bing.com/th?id=OVFT.VvVEOGW1qE02qPxtnWNo5S,Panamá,Noticias 24 PTY
"15,288 contagios y 163 muertos en la semana 50 del Covid-19",https://www.critica.com.pa/nacional/15288-contagios-y-163-muertos-en-la-semana-50-del-covid-19-594270,"La semana 50 impuso récord de contagio de Covid-19 en Panamá con 15,288 infectados y se dieron 163 decesos. En promedio fueron 2,184 pacientes con",14-12-2020 05:06,https://www.bing.com/th?id=OVFT.uwmwzQ-lEAexYgkzRp-xYi,Panamá,Critica
"En Panamá, mayoría de empresas financieras mantuvieron operaciones durante la pandemia del COVID-19",https://sertv.gob.pa/nacionalfm/en-panama-mayoria-de-empresas-financieras-mantuvieron-operaciones-durante-la-pandemia-del-covid-19/,"En Panamá, existen unas 194 empresas financieras formalmente establecidas, las cuales, en su gran mayoría, mantuvieron operaciones, en medio de la situación económica generada por la pandemia del COVI",14-12-2020 09:18,https://www.bing.com/th?id=OVFT._xOHatS9m6Xm013OytjAwy,Panamá,SERTV
Las citas y cirugías electivas están suspendidas en el Hospital del Niño,http://elsiglo.com.pa/panama/citas-cirugias-electivas-estan-suspendidas-hospital-nino/24169457,A partir de este lunes 14 de diciembre se suspenden todas las cirugías electivas y las atenciones en el Servicio de Consulta Externa Especializada del Hospital del Niño - Dr. José Renán Esquivel. La d,14-12-2020 13:00,https://www.bing.com/th?id=OVFT.MidfT1GvGlYaqIDzDV3abC,Panamá,El Siglo
Vacunas contra la Covid 19 llegarán a Panamá a partir de febrero,https://tucomunidad.com.pa/2020/12/vacunas-contra-la-covid-19-llegaran-a-panama-a-partir-de-febrero/,"Uno de los retos que tiene Panamá para iniciar la aplicación de la vacuna contra la Covid19, es el proceso de almacenamiento y distribución del fármaco, pues requiere ciertos parámetros que deben cumplirse a cabalidad para poder garantizar su óptimo ...",14-12-2020 14:36,https://www.bing.com/th?id=OVFT.grvPVImZLJMBRhCNQD1aCi,Panamá,Tu Comunidad
Comunicado # 293,https://sertv.gob.pa/nacionalfm/comunicado-293/,"El ministro de Salud, Luis Francisco Sucre, se reunió este domingo con los principales líderes de las comunidades de fe, radicadas en Panamá, con quienes coordinó una campaña de concienciación naciona",14-12-2020 14:58,https://www.bing.com/th?id=OVFT.757_294cVa63fVbouGhIXS,Panamá,SERTV
Coordinador de Panamá Solidario: Queremos priorizar recursos,https://www.telemetro.com/entrevistas/2020/12/14/coordinador-de-panama-solidario-queremos-priorizar-recursos/3554092.html,"El administrador de la Autoridad de Pasaportes de Panamá, Omar Ahumada, quien es coordinador del Plan Panamá Solidario, dijo que las modificaciones que se efectuaron para ser beneficiario de este plan",14-12-2020 15:42,https://www.bing.com/th?id=OVFT.0wZxUsz9jEfGhVvAE1SSaC,Panamá,Telemetro
Menores de 25 años económicamente dependientes dejarán de recibir Vale Digital,https://www.laestrella.com.pa/nacional/201213/201214-menores-25-anos-economicamente-dependientes-dejaran-recibir-vale-digital,"La Presidencia de la República aclaró este domingo que los menores de 25 años, cuyos contratos fueron suspendidos o perdieron su empleo producto de la situación económica que vive el país producto de la pandemia de covid-19, seguirán recibiendo el ...",14-12-2020 16:14,https://www.bing.com/th?id=OVFT.Ld4BL1AMi4g7RhyiEFZj8y,Panamá,laestrella.com.pa
Empresa panameña exportará 120 contenedores de zapallo,https://www.midiario.com/nacionales/empresa-panamena-exportara-120-contenedores-de-zapallo/,"Pese a la contracción de los principales mercados internacionales por la pandemia de covid-19, Panamá continúa con las exportaciones de diversos productos nacionales como es el zapallo y papaya, entre",14-12-2020 16:20,https://www.bing.com/th?id=OVFT.84ivt1pcLz8UMgcFsxkjby,Panamá,Mi Diario
"Envían zapallo a Estados Unidos, España y el Caribe",http://elsiglo.com.pa/panama/envian-zapallo-aestados-unidos-espana-caribe/24169470,"Pese a la contracción de los principales mercados internacionales por la pandemia de Covid-19, Panamá continúa con las exportaciones de diversos productos nacionales como es el zapallo y papaya, entre otros. Según el director Nacional de Agronegocios ...",14-12-2020 17:31,https://www.bing.com/th?id=OVFT.GYoPZJI9UE4HuNI9389Edi,Panamá,El Siglo
Eyra Ruiz: “El contagio ha aumentado por las fiestas de noviembre”,http://www.nexpanama.com/eyra-ruiz-el-contagio-ha-aumentado-por-las-fiestas-de-noviembre/,"La Dra. Eyra Ruiz, ministra Consejera de Salud, afirmó que los contagios de COVID-19 han aumentado por las fiestas de noviembre. Comentarios",14-12-2020 17:59,https://www.bing.com/th?id=OVFT.1LDmvKK9s68yaufmfkvY7C,Panamá,NEX TV
Abre centro de toma de muestras de la Covid-19 en Costa del Este,https://www.prensa.com/sociedad/abre-centro-de-toma-de-muestras-de-la-covid-19-en-costa-del-este/,Un nuevo centro de toma de muestras para diagnosticar el nuevo coronavirus SARS-CoV-2 (que provoca la Covid-19) abrió en la urbanización Costa del,14-12-2020 18:30,https://www.bing.com/th?id=OVFT.q38TDPfs41U7IMKIUGudqS,Panamá,prensa.com
Sucre: ‘Reforzaremos junto a las iglesias con campaña la estrategia anticovid en Panamá’,https://www.midiario.com/nacionales/sucre-reforzaremos-junto-a-las-iglesias-con-campana-la-estrategia-anticovid-en-panama/,"A pesar de que las autoridades sanitarias del país han pedido a la población en reiteradas ocasiones tratar de autoconfinarse para no exponerse a la covid-19, que registra un fuerte repunte en Panamá,",14-12-2020 18:50,https://www.bing.com/th?id=OVFT.J6avYvpJfGneywAvOAsNoC,Panamá,Mi Diario
"Paciente con covid-19 denuncia falta de atención, CSS se pronuncia",https://www.telemetro.com/nacionales/2020/12/14/paciente-con-covid-19-denuncia-falta-de-atencion-css-se-pronuncia/3555029.html,"Un paciente con covid-19 en Panamá Oeste denunció a través de redes sociales falta de atención por parte de las autoridades de Salud. Herminia Mariscal, directora de la Caja de Seguro Social (CSS) en",14-12-2020 18:59,https://www.bing.com/th?id=OVFT.ZM2R14xHrledT4r3Ju6vmy,Panamá,Telemetro
Canadá comenzó a vacunar en Ontario y Quebec contra la Covid-19,https://www.prensa.com/mundo/canada-comenzo-a-vacunar-en-ontario-y-quebec-contra-la-covid-19/,Una cuidadora de ancianos de Ontario y una octogenaria de Quebec se convirtieron este lunes en las primeras personas en vacunarse contra la Covid-19 en Canadá tras el arribo el domingo de un primer ca,14-12-2020 19:33,https://www.bing.com/th?id=OVFT.BbORpZu-qM_Q_rqk1O0dGi,Panamá,prensa.com
"Panamá exportará 120 contenedores de zapallo a EE.UU., España y el Caribe con valor de $1.1 millones",https://elcapitalfinanciero.com/panama-exportara-120-contenedores-de-zapallo-a-ee-uu-espana-y-el-caribe-con-valor-de-1-1-millones/,"Panamá continúa con las exportaciones de diversos productos nacionales como es el zapallo y papaya, entre otros, a pesar de la contracción de los principales mercados internacionales por la pandemia de coronavirus (COVID-19).",14-12-2020 20:00,https://www.bing.com/th?id=OVFT.sBt-7e0e45RG1vTRy7EbHC,Panamá,El Capital Financiero
"Continúan exportaciones de zapallo hacia EE.UU, Europa y el Caribe",https://www.diaadia.com.pa/el-pais/continuan-exportaciones-de-zapallo-hacia-eeuu-europa-y-el-caribe-373430,"Unos 120 contenedores de zapallo fresco exportará la empresa familiar Panamá Scuash, ubicada en Pesé, provincia de Herrera hacia los mercados de Estados Unidos, España y el Caribe.Pese a la contracció",14-12-2020 20:40,https://www.bing.com/th?id=OVFT.0L3hWd3FMnAtIxDt2Rud1S,Panamá,Día a Día
"Personal de Salud sigue entregando mascarillas en diferentes puntos del país, piden a la población reforzar la autoprotección",https://www.panamaamerica.com.pa/sociedad/personal-salud-sigue-entregando-mascarillas-en-diferentes-puntos-del-pais-piden-poblacion,"Más de 2,000 pantallas faciales fueron entregadas este lunes por parte del Ministerio de Salud (Minsa), en la Plaza 5 de mayo, como parte de la estrategia para reducir el riesgo de contagio de COVID-19 en el transporte público La directora de Promoción ...",14-12-2020 21:12,https://www.bing.com/th?id=OVFT.NbguQT0sE0_A3ZsskarX7i,Panamá,panamaamerica.com.pa
EE.UU. supera los 300.000 muertos por covid-19 (Johns Hopkins),https://ensegundos.com.pa/2020/12/14/ee-uu-supera-los-300-000-muertos-por-covid-19-johns-hopkins/,"Con estos 300.000 fallecimientos, el país perdió el equivalente a la población de la ciudad de Cincinnati, en el estado de Ohio. Más de 300.000 personas fallecieron a causa del covid-19 en Estados Uni",14-12-2020 21:39,https://www.bing.com/th?id=OVFT.-LEgRR-Imxuaw5-caksEUi,Panamá,En Segundos
Medidas aplicadas en Panamá Oeste no han tenido los efectos esperados,https://www.diaadia.com.pa/el-pais/medidas-aplicadas-en-panama-oeste-no-han-tenido-los-efectos-esperados-373435,"Pese al endurecimiento por parte del Gobierno central de las medidas sanitarias impuestas debido a la pandemia del COVID-19, en el distrito de La Chorrera el número de personas retenidas por vio",14-12-2020 22:11,https://www.bing.com/th?id=OVFT.HhcgF5SgXfTAOdHdFWXQuS,Panamá,Día a Día
Gobierno no ha decidido implementar nuevas restricciones,https://ensegundos.com.pa/2020/12/14/gobierno-no-ha-decidido-implementar-nuevas-restricciones/,"Gobierno y sector privado se reunieron hoy ante el repunte de casos de covid-19. Por el momento, el Gobierno nacional que encabeza el presidente de la República, Laurentino Cortizo, aún no ha decidido",14-12-2020 22:11,https://www.bing.com/th?id=OVFT.7bH-dzAzKmMq5z-kW56Lfi,Panamá,En Segundos
