name,url,description,datePublished,imagen,pais,Fuente
Especialistas extranjeros se capacitan en las guías establecidas en Panamá,https://www.prensa.com/sociedad/especialistas-extranjeros-se-capacitan-en-guias-establecidos-en-panama/,"Los 220 médicos cubanos que llegaron a Panamá, el pasado 24 de diciembre, para apoyar en la atención de pacientes con la Covid-19, se encuentran en un proceso de inducción, ambientación y capacitación",26-12-2020 18:25,https://www.bing.com/th?id=OVFT.DqHcWLfulHz-YPHhwBIAAS,Panamá,prensa.com
Redpamif ofrece consejos a la Mipymes para salir adelante tras la pandemia de COVID-19,https://elcapitalfinanciero.com/redpamif-ofrece-consejos-a-la-mipymes-para-salir-adelante-tras-la-pandemia-de-covid-19/,"Poder adaptar el tamaño del negocio a la realidad actual. Esto permitirá pasar el momento de tempestad para seguir desarrollándose pasada la pandemia de COVID-19. Reinventarse: Cambiar la forma de hacer negocios, buscar nuevos clientes, nuevos canales ...",26-12-2020 20:01,https://www.bing.com/th?id=OVFT.dHkKsKfVhhLNQAf11z4e4y,Panamá,El Capital Financiero
Especialistas cubanos son capacitados en guías y protocolos establecidos en Panamá,https://bayanodigital.com/especialistas-cubanos-son-capacitados-en-guias-y-protocolos-establecidos-en-panama/,Redacción de Bayano digital El MINSA recalca que la contratación de médicos panameños continuará y que los profesionales extranjeros serán contratados por un tiempo limitado para atención de pacientes,26-12-2020 20:50,https://www.bing.com/th?id=OVFT.Vq5xZDEEe1Dt-5K8ynXxFC,Panamá,Bayano Digital
"Panamá registra 2,064 nuevos casos de COVID-19 y 43 decesos en las últimas horas",https://www.telemetro.com/nacionales/2020/12/26/panama-registra-nuevos-casos-covid/3588265.html,"El informe empiedemiológico del Ministerio de Salud agrega que en las últimas 24 horas han fallecido 43 personas a causa del COVID-19, y hasta este día el saldo total de decesos por el virus es de 3,799. La letalidad se mantiene en 1.7%.",26-12-2020 22:45,https://www.bing.com/th?id=OVFT.HK3NFyC139_2N9Wp1efIgi,Panamá,Telemetro
"Covid-19: 43 defunciones y 2,064 nuevos contagios",https://ensegundos.com.pa/2020/12/26/covid-19-43-defunciones-y-2064-nuevos-contagios/,"El Ministerio de Salud (Minsa) reportó este 26 de dicimebre que se detectaron 2,064 nuevos casos de Covid-19 para un acumulado de 228,724. En las últimas horas se dieron 43 fallecimientos por el virus",26-12-2020 22:54,https://www.bing.com/th?id=OVFT.d0VVLMjpFKp0yCM8j4_2Ay,Panamá,En Segundos
Fallece séptima enfermera víctima del COVID-19 en Panamá,https://www.telemetro.com/nacionales/2020/12/26/fallece-septima-enfermera-victima-del-covid-19-en-panama/3588360.html,La Asociación Nacional de Enfermeras de Panamá (ANEP) confirmó el deceso de la séptima compañera a causa del coronavirus.,26-12-2020 23:07,https://www.bing.com/th?id=OVFT.kq-3MVFO6Ym9MVx3Rb4w5i,Panamá,Telemetro
Se registran 43 defunciones por COVID-19 en las últimas horas,https://noticias24pty.com/se-registran-43-defunciones-por-covid-19-en-las-ultimas-horas/,"Este sábado 26 de diciembre la viceministra de Salud, Ivette Berrío coordinó una mesa de trabajo en la que se abordó el tema de la logística de la vacunación contra el COVID-19, además de la",26-12-2020 23:40,https://www.bing.com/th?id=OVFT.DwJ2sOWx0w7S3TYeGiQIli,Panamá,Noticias 24 PTY
Cuarenta y tres personas más han muerto en las últimas horas por covid-19. Se reportan 2 mil 64 nuevos contagios,https://www.midiario.com/salud/cuarenta-y-tres-personas-mas-han-muerto-en-las-ultimas-horas-por-covid-19-se-reportan-2-mil-64-nuevos-contagios/,"Para este sábado 26 de diciembre en Panamá se contabilizan 2 mil 64 casos positivos nuevos, para un total acumulado de 228 mil 724 contagios desde que inició la pandemia. Se informó que esta vez se aplicaron 9 mil 781 pruebas, para un porcentaje de ...",26-12-2020 23:41,https://www.bing.com/th?id=OVFT.fW8EdKBSj426GQqzniEAjC,Panamá,Mi Diario
Argentina empieza a vacunar el martes contra la Covid-19,https://www.prensa.com/mundo/argentina-empieza-a-vacunar-el-martes-contra-la-covid-19/,"La campaña de vacunación para combatir la Covid-19 empezará el martes en Argentina, donde hay 42,501 muertos y casi 1.6 millones de contagios, informó el sábado la agencia estatal",27-12-2020 00:19,https://www.bing.com/th?id=OVFT.XUhX0i5FHdmk95YgM1uvjC,Panamá,prensa.com
Médicos cubanos ayudarán a que Panamá supere trance difícil de la pandemia,http://elsiglo.com.pa/panama/medicos-cubanos-ayudaran-panama-supere-trance-dificil-pandemia/24170126,"En esta primera fase de entrenamiento conocerán las instalaciones, así como movilidad y seguridad en el uso adecuado de los equipos",27-12-2020 00:34,https://www.bing.com/th?id=OVFT.PpYYgZfJ5ua0UlG3xT5oIS,Panamá,El Siglo
Recuperación económica tardará dos años en Panamá,http://elsiglo.com.pa/panama/recuperacion-economica-tardara-anos-panama/24170127,"Economía. El econonista Juan Jované aseguró que la recuperación económica tardará dos años, luego de la profunda crisis que enfrenta el país, producto de la Covid 19. Jované dijo que el gobierno no tiene en su agenda ningún plan de reacomodo ...",27-12-2020 05:03,https://www.bing.com/th?id=OVFT.FSY7e4RlIKdXSu9PlF6j4C,Panamá,El Siglo
Pandemia de la covid-19 genera aumentos en la desigualdad de género y la violencia doméstica,https://www.laestrella.com.pa/nacional/201227/pandemia-covid-19-genera-aumentos,"La pandemia de la covid-19 ha golpeado severamente a América Latina y el Caribe, una región asediada por problemas estructurales no resueltos, tales como una alta tasa de delincuencia y violencia, fragmentación y polarización política, pobreza y ...",27-12-2020 05:08,https://www.bing.com/th?id=OVFT.WeIssa3AYfOJiHzO78qvOS,Panamá,laestrella.com.pa
Gwendolyn Stephenson pasó Navidad en su tierrita panameña,https://www.diaadia.com.pa/fama/gwendolyn-stephenson-paso-navidad-en-su-tierrita-panamena-373853,"Gwendolyn Stephenson, Noel Schajris y su familia pasaron la Navidad en la cuarentena total en Panamá.Sí, la empresaria panameña y el cantante llegaron de Colombia para celebrar en Panamá.",27-12-2020 06:12,https://www.bing.com/th?id=OVFT.rZucpuzmcW8tlLSWEITLXS,Panamá,Día a Día
"Panamá alcanza el récord de 2,000 hospitalizados por la covid-19",https://www.laestrella.com.pa/nacional/201226/panama-alcanza-record-2-000-hospitalizados-covid-19,"Panamá, que totaliza 3,756 defunciones por la covid-19 y 226,660 casos positivos, incrementó este viernes la positividad de pruebas para detectar la infección y alcanzó la cifra récord de más de 2,000 hospitalizados, informó el Ministerio de Salud ...",27-12-2020 13:15,https://www.bing.com/th?id=OVFT.DLbshamcnJe5_JMNm_kc1y,Panamá,laestrella.com.pa
Empresarios advierten que en el 2021 aumentará el desempleo y la economía informal por la pandemia,https://www.midiario.com/nacionales/empresarios-advierten-que-en-el-2021-aumentara-el-desempleo-y-la-economia-informal-por-la-pandemia/,"Este año pasará a la historia como aquel en que la pandemia de la covid-19 golpeó al mundo entero en materia sanitaria y socioeconómica; al tiempo que, desnudó y profundizó las fragilidades que como nación arrastramos históricamente. En 2021 las ...",27-12-2020 13:39,https://www.bing.com/th?id=OVFT.wk7iMI5kGfICaxkqj_SlJi,Panamá,Mi Diario
La Cámara de Comercio reflexiona sobre los retos como país que nos deja el 2020,https://www.tvn-2.com/nacionales/Camara-Comercio-reflexiona-retos-pais_0_5748925055.html,"Este año pasará a la historia como aquel en que la pandemia del COVID-19 golpeó al mundo entero en materia sanitaria y socioeconómica; al tiempo que, desnudó y profundizó las fragilidades que como nación arrastramos históricamente. En 2021 las ...",27-12-2020 14:05,https://www.bing.com/th?id=OVFT.JNDoGKlqm_o6iSoLuVCCZi,Panamá,TVN
Europa inicia la vacunación masiva para intentar superar la pandemia,http://www.nexpanama.com/europa-inicia-la-vacunacion-masiva-para-intentar-superar-la-pandemia/,Europa lanza el domingo un programa de vacunación internacional de escala sin precedentes como parte de los esfuerzos para poner fin a una pandemia de COVID-19 que ha paralizado las economías y se ha,27-12-2020 14:14,https://www.bing.com/th?id=OVFT.cQMnlKS8bxqBELu73bnNbi,Panamá,NEX TV
"Panamá supera la cifra de los 2,000 pacientes hopitalizados por COVID-19",https://www.panamaamerica.com.pa/sociedad/panama-supera-cifra-2000-pacientes-hopitalizados-por-covid-19-1178519,"Un total de 2,031 pacientes de COVID-19 se encuentran hospitalizados en el país, una cifra récord desde que se informó del primer caso en marzo pasado. Es el segundo día consecutivo que se sobrepasa la barrera de los 2,000 casos, después que el pasado ...",27-12-2020 14:14,https://www.bing.com/th?id=OVFT.o9ZShgw1wrqlsW4hP2LEsy,Panamá,panamaamerica.com.pa
Dr. Francisco Sánchez Cárdenas denuncia Fake News,https://bayanodigital.com/dr-francisco-sanchez-cardenas-denuncia-fake-news/,"Redacción de Bayano digital A diferencia de otras epidemias, la Covid-19 es utilizado por los distintos actores para imponer sus intereses económicos, políticos e ideológicos.  La asistencia humanitar",27-12-2020 15:45,https://www.bing.com/th?id=OVFT.0JctxjDdKtF3-uxdmoWXuS,Panamá,Bayano Digital
México recibe segundo lote de vacunas de Pfizer,https://www.radiopanama.com.pa/noticias/internacional/mexico-recibe-segundo-lote-de-vacunas-de-pfizer/20201227/nota/4097819.aspx,"el mundo entero se encuentra a la expectativa de la llegada de la vacuna contra el Covid-19. México recibió este fin de semana el segundo lote de vacunas contra la COVID-19 de Pfizer-BioNTech, con 42 mil 900 dosis. Las mismas fueron distribuidas en 44 cajas.",27-12-2020 16:45,https://www.bing.com/th?id=OVFT.U5aKDYpkHePXVNpXvKWW7y,Panamá,Radio Panamá
"Europa supera 25 millones de contagios, mientras Latinoamérica lanza campaña de vacunación",https://www.radiopanama.com.pa/noticias/internacional/europa-supera-25-millones-de-contagios-mientras-latinoamerica-lanza-campana-de-vacunacion/20201227/nota/4097822.aspx,"El Covid-19 ha matado a más de 1.7 millones de personas y contagiado a más de 79 millones en todo el mundo. El director de la Organización Mundial de la Salud, Tedros Adhanom Ghebreyesus señaló que hemos visto los sacrificios que tanta gente ha hecho ...",27-12-2020 17:20,https://www.bing.com/th?id=OVFT.U5aKDYpkHePXVNpXvKWW7y,Panamá,Radio Panamá
"La pandemia podría agravarse en EE.UU. después de las fiestas, según experto",https://ensegundos.com.pa/2020/12/27/la-pandemia-podria-agravarse-en-ee-uu-despues-de-las-fiestas-segun-experto/,"Fauci, que aconsejó a la Casa Blanca durante la crisis y al que Biden ya nombró asesor, dijo este domingo que ese incremento de los casos podría llegar en ""un momento muy crítico"", ejerciendo ""más pre",27-12-2020 17:33,https://www.bing.com/th?id=OVFT.JHL9s73ssl8LbbkIJFkT0C,Panamá,En Segundos
"Oxford group has ""winning vaccine formula""",https://www.newsroompanama.com/health/oxford-group-has-winning-vaccine-formula-1,"The British pharmaceutical group AstraZeneca claimed to have found, after additional research, ""the winning formula"" for its vaccine against covid-19 developed with the University of Oxford, on which the British regulator must comment in the coming days.",27-12-2020 17:35,https://www.bing.com/th?id=OVFT.8-cQ3CLXArkNEzrGOk3Q0i,Panamá,Newsroom Panama
CCIAP pide tomar decisiones que nos permitan avanzar hacia el futuro,https://www.nexpanama.com/cciap-pide-tomar-decisiones-que-nos-permitan-avanzar-hacia-el-futuro/,"Este año pasará a la historia como aquel en que la pandemia del COVID-19 golpeó al mundo entero en materia sanitaria y socioeconómica; al tiempo que, desnudó y profundizó las fragilidades que como nación arrastramos históricamente. En 2021 las ...",27-12-2020 19:34,https://www.bing.com/th?id=OVFT.Xz0GfdAqeWiuebhe3zgcpC,Panamá,NEX TV
"Pfizer, AstraZeneca, Merck, Teva y Amazon crearán un laboratorio en Israel",https://lagacetadepanama.com/pfizer-astrazeneca-merck-teva-y-amazon-crearan-un-laboratorio-en-israel/,«El rápido desarrollo de las vacunas para el virus de la COVID-19 debe su éxito en parte a las capacidades de Inteligencia Artificial de farmacéuticas líder como Pfizer y Moderna. Se espera que estas áreas sean más significativas en los próximos ...,27-12-2020 20:34,https://www.bing.com/th?id=OVFT.qaCkZ_FxoK-SJKE1kqXqfi,Panamá,La Gaceta de Panama
AstraZeneca dice haber encontrado la «fórmula ganadora» para su vacuna,https://lagacetadepanama.com/astrazeneca-dice-haber-encontrado-la-formula-ganadora-para-su-vacuna/,"El director ejecutivo de la farmacéutica AstraZeneca, Pascal Soriot, asegura que el laboratorio ha encontrado la «fórmula ganadora» para hacer que su vacuna contra la COVID-19 tenga una efectividad a la altura de las de Pfizer/BioNTech, del 95% ...",27-12-2020 20:34,https://www.bing.com/th?id=OVFT.U59dKCKP8Vg-g46quRbWyC,Panamá,La Gaceta de Panama
Bandera ondea dañada en la Cinta Costera (Video),https://www.critica.com.pa/nacional/bandera-ondea-danada-en-la-cinta-costera-video-595093,"Sin importar los días de cuarentena total ni que Panamá esté azotada por una pandemia ocasionada por el COVID-19, la bandera ondea dañada.",27-12-2020 20:45,https://www.bing.com/th?id=OVFT.Y-tMJN2E_W6Jm0-mrNuwzC,Panamá,Critica
Algunos comercios en Panamá Oeste no están cumpliendo con normas sanitarias,https://www.critica.com.pa/provincias/algunos-comercios-en-panama-oeste-no-estan-cumpliendo-con-normas-sanitarias-595095,"Algunos de estos comercios, no están dejando salir a sus empleados antes de las 7:00 p.m. para que estén en sus casas antes de la hora del toque de queda.",27-12-2020 21:17,https://www.bing.com/th?id=OVFT.3dnXQ7GHKNZKXe1S39EInC,Panamá,Critica
Community infection out control,https://www.newsroompanama.com/news/community-infection-out-control-1,"In spite of fact that the average percentage of positivity remains at 20%, despite the fact over 15,000 diagnostic tests a day for Covid-19 , with a 20% positivity ... Juan Díaz and San Francisco in Panama, as well as Arraiján and Vista Alegre, in ...",27-12-2020 21:19,https://www.bing.com/th?id=OVFT.svjGT_EnNG8ApifxJAgKbC,Panamá,Newsroom Panama
Médicos cubanos son asignados a la Torre COVID-19 del hospital Rafael Hernández en Chiriquí,https://noticias24pty.com/medicos-cubanos-son-asignados-a-la-torre-covid-19-del-hospital-rafael-hernandez-en-chiriqui/,"Los 23 médicos cubanos asignados al Hospital Rafael Hernández ubicado en la ciudad de David, provincia de Chiriquí, reforzarán la atención en la Torre COVID-19, así lo informó el director médico Rolando Caballero. Versión impresa Destacó que los ...",27-12-2020 21:33,https://www.bing.com/th?id=OVFT.AGZipAVxqWf7wIYoUpamfS,Panamá,Noticias 24 PTY
