name,url,description,datePublished,imagen,pais,Fuente
Venta de autos se desploman drásticamente en abril,https://elcapitalfinanciero.com/venta-de-autos-se-desploman-drasticamente-en-abril/,"luego de la aplicación las medidas de cuarentena destinadas a combatir la pandemia del coronavirus (COVID-19), al punto que ese mes sólo se vendieron 117 vehículos en todo el país, según cifras del Instituto Nacional de Estadística y Censo (Inec ...",26-06-2020 19:05,https://www.bing.com/th?id=ON.038818F358521A300B907F282DB3A36D,Panamá,El Capital Financiero
"Panamá enfrenta crisis sanitaria, económica y social a un año del gobierno de Laurentino Cortizo.",https://anpanama.com/10144-Panama-enfrenta-crisis-sanitaria-economica-y-social-a-un-ano-del-gobierno-de-Laurentino-Cortizo.note.aspx,"(Ciudad de Panamá-ANPanamá) A pocos días de cumplirse un año del gobierno del Presidente Laurentino Cortizo, Panamá enfrenta una crisis sanitaria que registra más de 30 mil personas contagiadas por el",29-06-2020 15:24,https://www.bing.com/th?id=ON.7832A1146BCF4FA003C2293F5E455AE2,Panamá,AN Panama
Principal complejo hospitalario de Panamá será sólo para pacientes con COVID-19,https://anpanama.com/10142-Principal-complejo-hospitalario-de-Panama-sera-solo-para-pacientes-con-COVID-19.note.aspx,"(Ciudad de Panamá-ANPanamá) El Complejo hospitalario de la ciudad de Panamá Dr. Arnulfo Arias Madrid, que es administrado por la Caja de Seguro Social (CSS), será convertido en un centro exclusivo par",29-06-2020 15:24,https://www.bing.com/th?id=ON.3BECB4BA78C748E3E0BE745821B4FC83,Panamá,AN Panama
COVID-19 golpea con fuerza a Panamá en junio: casos superan a los de tres meses previos juntos,https://www.panamaamerica.com.pa/sociedad/covid-19-golpea-con-fuerza-panama-en-junio-casos-superan-los-de-tres-meses-previos-juntos,"La cifra de casos nuevos de coronavirus en Panamá durante junio ha aumentado en un 162.9% con respecto al mes de mayo, según datos recopilados por el químico y docente universitario Jafet Cárdenas. Versión impresa En su informe, con corte al 28 de ...",29-06-2020 15:51,https://www.bing.com/th?id=ON.B45E88F3C2E98A7B766FAB1183F37114,Panamá,panamaamerica.com.pa
Pandemia de Covid-19 está ‘lejos de haber terminado’: OMS,https://www.prensa.com/mundo/pandemia-de-covid-19-esta-lejos-de-haber-terminado-oms/,"La pandemia de Covid-19, que se reportó por primera vez hace seis meses en China, “está lejos de haber terminado”, dijo este lunes 29 de junio el director de la Organización Mundial de la Salud (OMS)",29-06-2020 16:24,https://www.bing.com/th?id=ON.36C6A4A5FAB3A039585990E09344117F,Panamá,prensa.com
Reportan primeros casos de la COVID-19 en Taboga,https://www.panamaamerica.com.pa/sociedad/reportan-primeros-casos-de-la-covid-19-en-taboga-1166677,La dirección regional Metropolitana de Salud confirmó los primeros cinco (5) casos positivos de la COVID-19 en la isla de Taboga. La trazabilidad realizada por las autoridades de Salud indican que los,29-06-2020 17:07,https://www.bing.com/th?id=ON.43066179A8178A406E95971F761C63D7,Panamá,panamaamerica.com.pa
"Con 1,028 nuevos contagios de COVID-19, Panamá alcanza un total de 31,686 casos y 604 defunciones",https://www.telemetro.com/nacionales/2020/06/28/panama-eleva-muertes-covid-19/2996239.html,"El ministro de Salud, Luis Francisco Sucre expresó que han reforzado los esfuerzos para incrementar la capacidad instalada en los diferentes centros hospitalarios, al tiempo que buscan alternativas pa",29-06-2020 17:09,https://www.bing.com/th?id=ON.8BB469A960AF95750576715A186C9F23,Panamá,Telemetro
Panameños que estaban en Brasil retornan al país en vuelo humanitario,https://www.tvn-2.com/nacionales/Panamenos-Brasil-retornan-vuelo-humanitario_0_5613188638.html,"Un grupo de panameños que se encontraban en Brasil, fueron repatriados en vuelo humanitario, así lo informó la Cancillería, a través de su cuenta de Twitter. El pasado 26 de junio, se abrió la oportun",29-06-2020 17:22,https://www.bing.com/th?id=ON.BC34D3177B059F0A8E9B44CE794998AA,Panamá,TVN
El boxeo en Panamá no baja la guardia,http://elsiglo.com.pa/deportes/boxeo-panama-baja-guardia/24159418,"Y busca cómo encarar la nueva realidad. No hay prisa, aunque sí mucho cuidado cuando se piensa en 'la nueva normalidad' que se avista en plena pandemia para la práctica del boxeo en Panamá. El preside",29-06-2020 17:29,https://www.bing.com/th?id=ON.BCE751EA7CC04C64E77B251D11A03D32,Panamá,El Siglo
Europa enfrenta más desafíos comerciales agroalimentarios,https://noticias24pty.com/europa-enfrenta-mas-desafios-comerciales-agroalimentarios/,"Las amenazas de nuevos aranceles de EE.UU. abren un verano repleto de negociaciones y de desafíos comerciales para el sector agroalimentario tras la pandemia, entre ellos el Brexit, Mercosur e incluso",29-06-2020 17:30,https://www.bing.com/th?id=ON.37BAECB3DB6DA7ED446D39FCDD646DE7,Panamá,Noticias 24 PTY
"La pandemia “no está siquiera cerca de terminar”, dice el jefe de la OMS",http://www.nexpanama.com/la-pandemia-no-esta-siquiera-cerca-de-terminar-dice-el-jefe-de-la-oms/,"La pandemia de COVID-19 no está ni siquiera cerca de terminar, dijo el jefe de la Organización Mundial de la Salud, Tedros Adhanom Ghebreyesus, en una reunión informativa el lunes. Tedros señaló que,",29-06-2020 18:10,https://www.bing.com/th?id=ON.74F2DF0A205070DDCDCCE88FE69A4B75,Panamá,NEX TV
Primeros casos por COVID-19 reportados en Taboga,https://ensegundos.com.pa/2020/06/29/primeros-casos-por-covid-19-reportados-en-taboga/,"En las investigaciones de trazabilidad el primer caso fue de un adolescente de 18 años que paso tres días fuera de la Isla, al llegar presenta dificultad al respirar, acude al Centro de Salud dando po",29-06-2020 18:49,https://www.bing.com/th?id=ON.98F231E0A7213D395576228883C3AD33,Panamá,En Segundos
Bajo porcentaje de donantes en banco de sangre del complejo hospitalario,https://ensegundos.com.pa/2020/06/29/bajo-porcentaje-de-donantes-en-banco-de-sangre-del-complejo-hospitalario/,La población que ha superado el virus respiratorio del Covid -19 puede donar su plasma convaleciente para salvar la vida de otro panameño. Un llamado a la población general realizan las autoridades de,29-06-2020 18:53,https://www.bing.com/th?id=ON.18FE42C2BED08F36F2942A7E4956E022,Panamá,En Segundos
Diputado Julio Mendoza da positivo a covid-19,http://elsiglo.com.pa/panama/diputado-julio-mendoza-positivo-covid-19/24159415,"El diputado Julio Mendoza, del circuito 6-2 en la provincia de Herrera, comunicó a la ciudadanía que ha resultado positivo en la prueba de coronavirus (covid-19).  ""A partir de la fecha estaré en aisl",29-06-2020 19:29,https://www.bing.com/th?id=ON.8CD6825DA50B56DD7C769BDA452F6958,Panamá,El Siglo
Reubican a dos familias afectadas por colapso de pared en Panamá Este,https://www.diaadia.com.pa/el-pais/reubican-dos-familias-afectadas-por-colapso-de-pared-en-panama-este-367823,"Dos familias, cuyas viviendas resultaron seriamente afectadas por el colapso de una pared en la madrugada de este lunes, en el sector 13, corregimiento de Las Mañanitas, en el distrito de Panamá, fuer",29-06-2020 19:47,https://www.bing.com/th?id=ON.12093A41F4187FC52C427E6B2789A391,Panamá,Día a Día
Interponen denuncia contra el Hospital Nicolás A. Solano por error,https://www.diaadia.com.pa/el-pais/interponen-denuncia-contra-el-hospital-nicolas-solano-por-error-367831,"Familiares de una adulta mayor, de 70 años, contagiada de coronavirus al ser recluida por error, en una sala de COVID-19 del Hospital Nicolás A. Solano, en la provincia de Panamá Oeste, interpusieron",29-06-2020 21:21,https://www.bing.com/th?id=ON.C36F54DB4C80FFEA55801C631585C381,Panamá,Día a Día
El nuevo coronavirus llega a la isla de Taboga,https://www.prensa.com/sociedad/covid-19-llega-taboga/,"El segundo caso positivo, según la investigación, se registró en un hombre de 53 años. El Ministerio de Salud (Minsa) reportó los primeros cinco casos de Covid-19 en la isla de Taboga, la cual hasta l",29-06-2020 21:34,https://www.bing.com/th?id=ON.0CC070E73E6FE07A3E648F38B20430CE,Panamá,prensa.com
El boxeo en Panamá no baja la guardia y busca cómo encarar la nueva realidad,https://www.tvmax-9.com/boxeo/boxeo-Panama-guardia-encarar-realidad_0_5613188675.html,"No hay prisa, aunque sí mucho cuidado cuando se piensa en 'la nueva normalidad' que se avista en plena pandemia para la práctica del boxeo en Panamá. El presidente de la Federación de Boxeo Olímpico d",29-06-2020 21:39,https://www.bing.com/th?id=ON.2EB94A9E97296622810CC491B68E6D6C,Panamá,TVMAX
Diputado del PRD en Herrera confirma que dio positivo por covid-19,https://www.laestrella.com.pa/nacional/200629/diputado-prd-herrera-confirma-dio-positivo-covid-19,"Julio Mendoza, diputado del circuito 6-2 del Partido Revolucionario Democrático (PRD) informó que dio positivo a la prueba de covid-19, por lo que a partir de la fecha se acoge a un aislamiento domici",29-06-2020 21:56,https://www.bing.com/th?id=ON.6B2E3E6A18967827F4E6A697B63EE56F,Panamá,laestrella.com.pa
Pride Panamá 2020 llegó a 500 mil personas y participó en el Global Pride,https://www.laestrella.com.pa/nacional/200629/pride-panama-2020-llego-500-mil-personas-participo-global-pride,"Este año, el World Pride Panamá fue virtual, debido a la covid-19, logrando varios hitos en la historia de la comunidad LGBTIQ+ del país, con la transmisión en streaming, redes sociales, radio y telev",29-06-2020 21:56,https://www.bing.com/th?id=ON.D0D7D9FEF956874BD356322CEDB1C18F,Panamá,laestrella.com.pa
'Manos de Piedra' Durán evoluciona bien tras ser hospitalizado por COVID-19,https://www.telemetro.com/boxeo/2020/06/29/manos-de-piedra-duran-evoluciona-bien-tras-ser-hospitalizado-por-covid-19/2999023.html,"Desde un principio, la familia del exboxeador dijo que prefería mantener hospitalizado a Durán no solo por su edad, que se considera un factor de riesgo cuando se padece de COVID-19, sino también porq",29-06-2020 22:14,https://www.bing.com/th?id=ON.F8426DEB8E1203D6D8B92E03FA0274BA,Panamá,Telemetro
Cortizo cumple un año de presidente con Panamá hundido en su peor crisis,https://www.critica.com.pa/nacional/cortizo-cumple-un-ano-de-presidente-con-panama-hundido-en-su-peor-crisis-582298,"En el primer año de Gobierno del presidente Laurentino Cortizo, que se cumple el próximo 1 de julio, Panamá se ha hundido en una inédita crisis política, institucional, económica y social de la que no",29-06-2020 22:18,https://www.bing.com/th?id=ON.21868A52F70ED4AA37BBE39AECE67091,Panamá,Critica
Con buen ritmo avanza siembra de arroz a nivel nacional.,https://sertv.gob.pa/con-buen-ritmo-avanza-siembra-de-arroz-a-nivel-nacional/,"A nivel nacional se ha logrado sembrar unas 24 mil 589 hectáreas de arroz, cifra que representa un 34% de lo programado para el período agrícola 2020-2021, de lo estimado para este ciclo de unas 72 mi",29-06-2020 22:35,https://www.bing.com/th?id=ON.8DB5696BC51048CB3733C3F00E5E11FB,Panamá,SERTV
Panamá Oeste activa COE para la trazabilidad de casos positivos de COVID-19,https://www.tvn-2.com/nacionales/provincias/Panama-Oeste-COE-trazabilidad-COVID-19_0_5613188702.html,"La alta incidencia de casos positivos de COVID-19, en Panamá Oeste, llevó a que las autoridades provinciales se organizaran para activar el Centro de Operaciones de Emergencia (COE) para la trazabilid",29-06-2020 22:39,https://www.bing.com/th?id=ON.CE492026BBF9B668C28B6F540D1D6ACF,Panamá,TVN
