name,url,description,datePublished,imagen,pais,Fuente
Joven da a luz en su casa y entierran la placenta. No tenían para ir al hospital. Grupo Asistencia Alimentaria apoya,https://www.midiario.com/curiosidades/joven-da-a-luz-en-su-casa-y-entierran-la-placenta-no-tenian-para-ir-al-hospital-grupo-asistencia-alimentaria-apoya/,"Una joven dio a luz en su propia casa y allí mismo tuvieron que enterrar la placenta, en el sector de Buenos Aires, en Chilibre, un procedimiento más común de lo que se pudiera creer, según pudo conoc",18-11-2020 13:22,https://www.bing.com/th?id=OVFT.x6-rD25qRPFqXtiawYOeQi,Panamá,Mi Diario
Panamá busca vacunas contra la pandemia,https://radioreformaseoye.com/nacionales/panama-busca-vacunas-contra-la-pandemia/,"El Gobierno panameño anunció que destinará 48 millones de dólares para la adquisición de la vacuna contra la Covid-19. Con ello, el Ministerio de Salud (Minsa), tiene previsto lograr una cobertura por",18-11-2020 15:17,https://www.bing.com/th?id=OVFT.HgLK3WH440EJjLvajyo9Si,Panamá,Radio Reforma se Oye
La carera por la vacuna contra la COVID-19 entra en etapa final,https://www.nexpanama.com/la-carera-por-la-vacuna-contra-la-covid-19-entra-en-etapa-final/,"El Dr. Eduardo Ortega Barría, habla sobre la carera por la vacuna contra la COVID-19 que pareciera estar en la recta final. Comentarios",18-11-2020 15:39,https://www.bing.com/th?id=OVFT.qIUsKkAWODwx2tqrZ95iYC,Panamá,NEX TV
Epidemia de Covid-19 frustra la ceremonia de los Nobel,https://ensegundos.com.pa/2020/11/18/epidemia-de-covid-19-frustra-la-ceremonia-de-los-nobel/,"""Estamos considerando la posibilidad de celebrar una ceremonia digital de entrega del premio"", el 10 de diciembre, indicó la Fundación. Las ceremonias del Nobel serán reducidos a su mínima expresión e",18-11-2020 15:41,https://www.bing.com/th?id=OVFT.UIzs7IhSRamL-Rq_yBdYoS,Panamá,En Segundos
Crece lista de corregimientos con más de 10 casos de Covid-19,https://tucomunidad.com.pa/2020/11/crece-lista-de-corregimientos-con-mas-de-10-casos-de-covid-19/,"La lista de corregimientos con más de diez casos de covid-19 confirmados que diariamente publica el Ministerio de Salud de Panamá, se hace cada vez más larga, con números de casos que superan los 50 c",18-11-2020 16:23,https://www.bing.com/th?id=OVFT.N-1xkp8-hS68kLG0bpwl3y,Panamá,Tu Comunidad
ANEP pide a las autoridades de Salud atender estatus de las enfermeras por el covid,http://elsiglo.com.pa/panama/anep-pide-autoridades-salud-atender-estatus-enfermeras-covid/24168007,"Dicen que quienes deben cuidar a los cuidadores no asumen su rol, muy al contrario, explotan las necesidades de trabajo",18-11-2020 16:28,https://www.bing.com/th?id=OVFT.kQNkKtpdxbHpUgczvVAZKS,Panamá,El Siglo
Houseparty y Fortnite se asocian para permitir que usuarios conversen mientras juegan,http://www.nexpanama.com/houseparty-y-fortnite-se-asocian-para-permitir-que-usuarios-conversen-mientras-juegan/,"Houseparty, la aplicación de conversaciones grupales por video, dijo el miércoles que se asoció con el videojuego “Fortnite” para permitir que los amigos realicen videoconferencias mientras juegan, en",18-11-2020 17:18,https://www.bing.com/th?id=OVFT.J56255droXIAYys-JMGCoy,Panamá,NEX TV
Los corregimientos que podrían tener cerco sanitario si la situación de la covid-19 no mejora,https://www.midiario.com/nacionales/los-corregimientos-que-podrian-tenia-cercos-sanitarios-si-la-cosa-sigue-fea/,"El Director metropolitano de Salud, Dr. Israel Cedeño mencionó la mañana de este miércoles los corregimientos del área metropolitana que se encuentran en los primeros lugares con el mayor casos de cor",18-11-2020 18:55,https://www.bing.com/th?id=OVFT.Guodn3daArVOSQ0dmhu6uy,Panamá,Mi Diario
SBP presentó nuevo portal de Educación Financiera: “Tu Balboa con Sentido”,https://elcapitalfinanciero.com/sbp-presento-nuevo-portal-de-educacion-financiera-tu-balboa-con-sentido/,"La Superintendencia de Bancos de Panamá,  en convenio con la Fundación de las Cajas de Ahorro de Alemania (Sparkassenstiftung) para la Cooperación Internacional, y en conjunto con la Superintendencia",18-11-2020 20:24,https://www.bing.com/th?id=OVFT.pCRnXbRyMmOvvKP9GFEkrC,Panamá,El Capital Financiero
Exfiscal Sofanor Espinosa pierde la batalla contra el Covid-19,https://www.critica.com.pa/nacional/exfiscal-sofanor-espinosa-pierde-la-batalla-contra-el-covid-19-592559,Espinosa fue el fiscal en el sonado caso de cinco jóvenes de origen asiático que fueron asesinados en La Chorrera.,18-11-2020 20:31,https://www.bing.com/th?id=OVFT.cuMmPVlVbQWv5wjI-9nkki,Panamá,Critica
Panamá aprueba la compra de vacuna contra el COVID-19 a AstraZeneca,https://www.tvn-2.com/nacionales/Panama-aprueba-compra-millon-AstraZeneca-vacuna-COVID-19_0_5719678056.html,Este miércoles 18 de noviembre el Consejo de Gabinete informó que autorizó al Ministerio de Salud a realizar la compra de un millón 92 mil dosis de la vacuna que prepara la farmacéutica británica Astr,18-11-2020 21:27,https://www.bing.com/th?id=OVFT.MSZUgLRcvuFN18hPsApFiC,Panamá,TVN
Panamá comprará un millón 92 mil dosis de vacuna covid-19 a AstraZeneca,http://elsiglo.com.pa/panama/panama-comprara-millon-92-dosis-vacuna-covid-19-astrazeneca/24168022,"El Consejo de Gabinete en una sesión extraordinaria,  aprobó la compra de un millón 92 mil dosis de la vacuna para prevenir la covid-19, a la farmacéutica británica AstraZeneca UK Limited, en asociaci",18-11-2020 22:27,https://www.bing.com/th?id=OVFT.vebt64X_WbFiYpEBpCRhpi,Panamá,El Siglo
Autoridades de salud piden blindar la ‘burbuja familiar’ para evitar el repunte de casos en Panamá Oeste,https://www.panamaamerica.com.pa/sociedad/autoridades-salud-piden-blindar-burbuja-familiar-evitar-repunte-casos-en-panama-oeste,Las autoridades de salud  en Panamá Oeste concluyeron que ‘las fiestas  entre parientes que abiertamente no son la burbuja familiar son la causa del repunte de casos activos de COVID-19 en la provinci,18-11-2020 22:40,https://www.bing.com/th?id=OVFT.PDvNQeXlIscZl2Kk8KXICi,Panamá,panamaamerica.com.pa
Diputado perredista del circuito 4-4 Gonzalo González confirma que dio positivo en prueba de COVID-19,https://www.panamaamerica.com.pa/politica/diputado-perredista-del-circuito-4-4-gonzalo-gonzalez-confirma-que-dio-positivo-en-prueba,"El diputado chiricano Gonzalo González confirmó que dio positivo en la prueba de COVID-19.Gonzalo González es diputado de la Asamblea Nacional de Panamá, por el circuito 4-4 de provincia de Chiriquí.L",18-11-2020 22:42,https://www.bing.com/th?id=OVFT._VpuRDDO6LxQ3CCSfU1Bzi,Panamá,panamaamerica.com.pa
"Aumentan a 149,833 los casos de COVID-19 en Panamá y alcanza las 2,907 defunciones",https://www.telemetro.com/nacionales/2020/11/18/aumentan-casos-covid-19-panama/3470721.html,"El número de casos confirmados del nuevo coronavirus en Panamá aumentó a 149,833, luego de que para este miércoles 18 de noviembre el país registrara 1,112 nuevos contagios.",18-11-2020 23:00,https://www.bing.com/th?id=OVFT.ls5uC8q8dSsszDlz26ZpDC,Panamá,Telemetro
"Covid-19: Panamá realiza 9,205 y 1,112 resultan positivas",https://ensegundos.com.pa/2020/11/18/covid-19-panama-realiza-9205-y-1112-resultan-positivas/,"En el mundo se registran 35,898,286 personas recuperadas, mientras que se suman un total de 55,784,525 casos positivos por COVID-19 acumulados y 1,341,360 defunciones para un porcentaje de letalidad de 2.4%.",18-11-2020 23:25,https://www.bing.com/th?id=OVFT.wJUI34yUo4XiWUq-xu6R1i,Panamá,En Segundos
"Letalidad de la COVID-19 que estuvo en 2% por semanas bajó hoy a 1.94%, mientras se registran 1,112 casos y 14 muertes",https://noticias24pty.com/letalidad-de-la-covid-19-que-estuvo-en-2-por-semanas-bajo-hoy-a-1-94-mientras-se-registran-1112-casos-y-14-muertes/,El informe del Ministerio de Salud (Minsa) de este miércoles 18 de noviembre revela que este sería el tercer día en el que se logra superar las nueve mil pruebas en 24 horas para la detección del COVID-19 y se está cerca de llegar a la meta de las ...,19-11-2020 00:25,https://www.bing.com/th?id=OVFT.8gusnJTDSW5Sv_XX1jQPlC,Panamá,Noticias 24 PTY
Denuncian aglomeración de personas a fuera de junta comunal,https://www.critica.com.pa/whatsappcri/denuncian-aglomeracion-de-personas-fuera-de-junta-comunal-592592,Pero estas dos situaciones no son excusa para no cumplir ni hacer cumplir las medidas de bioseguridad y distanciamiento social establecidos para frenar la propagación del COVID-19 en Panamá. Publicidad Es por ello que un cibernauta denunció que un grupo ...,19-11-2020 00:41,https://www.bing.com/th?id=OVFT.7dbqfnKZen5452GXNDQRHy,Panamá,Critica
OPS prevé alza de los casos de la Covid-19 en Centroamérica tras el paso de Iota y Eta,https://noticias24pty.com/ops-preve-alza-de-los-casos-de-la-covid-19-en-centroamerica-tras-el-paso-de-iota-y-eta/,"La Organización Panamericana de la Salud (OPS) dijo este miércoles 18 de noviembre que la respuesta a la Covid-19 en Centroamérica está amenazada por la temporada de huracanes, y anticipó un alza de los contagios tras el devastador pasaje de Iota y ...",19-11-2020 01:06,https://www.bing.com/th?id=OVFT.E122m2wj2TLZKqmAP5eiqC,Panamá,Noticias 24 PTY
Así evoluciona el COVID-19 en Panamá,https://www.telemetro.com/nacionales/2020/11/19/asi-evoluciona-el-covid-19-en-panama/3471278.html,"El Ministerio de Salud (Minsa) informó que además, la cifra de fallecidos a causa de la COVID-19 se elevó a 2,907 tras contabilizar 14 nuevas defunciones.",19-11-2020 01:28,https://www.bing.com/th?id=OVFT.nS65hmyo3tyFRO4Vbyu-wS,Panamá,Telemetro
El futuro pos-COVID-19 tiene que ser verde,https://www.laestrella.com.pa/opinion/columnistas/201119/futuro-pos-covid-19-verde,"La buena noticia es que lo podemos hacer y así conseguir un futuro más seguro y resiliente, como una tarea inexpugnable para afrontar el desafío económico pos-COVID-19. La Unión Europea (UE), juntamente con sus Estados Miembros, se apegará a su ...",19-11-2020 02:01,https://www.bing.com/th?id=OVFT.df3Hbt7wA5GR76g61G9QWi,Panamá,laestrella.com.pa
Aumentan hospitalizados en sala y cuidados intensivos,https://www.prensa.com/impresa/panorama/aumentan-hospitalizados-en-sala-y-cuidados-intensivos/,"El último informe de la Organización Panamericana de la Salud (OPS) da cuenta de un aumento en el ingreso de pacientes con la Covid-19 a hospitalización. Si se compara con la semana pasada, el porcentaje de nuevos ingresos en sala se elevó en 14.4% (93 ...",19-11-2020 02:30,https://www.bing.com/th?id=OVFT.QVGdPBHz-mwbZGdB0ohyvy,Panamá,prensa.com
Hidroxicloroquina contra el Covid-19: NO,https://www.prensa.com/impresa/opinion/hidroxicloroquina-contra-el-covid-19-no/,"La ciencia evoluciona con la investigación y la aparición de una nueva enfermedad conlleva iniciar de cero, Covid-19 es un ejemplo. Hemos vivido paso a paso como ha evolucionado la investigación con Covid-19, un día parece adelantamos y otro día ...",19-11-2020 02:57,https://www.bing.com/th?id=OVFT.7FmiQ9QBYApyAm0T64Sdli,Panamá,prensa.com
