name,url,description,datePublished,imagen,pais,Fuente
‘Personas totalmente vacunadas pueden relajar uso de cubrebocas’,https://www.midiario.com/salud/personas-totalmente-vacunadas-pueden-relajar-uso-de-cubrebocas/,"Las personas completamente vacunadas contra covid-19 pueden reunirse en pequeños grupos con otras personas vacunadas sin usar cubrebocas, pero deben seguir usándolos fuera de casa, anunciaron este lun",08-03-2021 20:58,https://www.bing.com/th?id=OVFT.k0svWbWdFHakWVPs8RMxFi,Panamá,Mi Diario
A response to vaccine deniers,https://newsroompanama.com/news/a-response-to-vaccine-deniers-1,"There were many mistakes made during the pandemic, but fortunately, they were corrected as scientific evidence was generated to combat the uncertainties posed b",08-03-2021 22:15,https://www.bing.com/th?id=OVFT.vlzVtl-qq-SaOTsv1L7tui,Panamá,Newsroom Panama
"Panamá detecta 402 nuevas personas con Covid-19 y hay 7,083 casos activos",https://www.metrolibre.com/nacionales/196010-panam%C3%A1-detecta-402-nuevas-personas-con-covid-19-y-hay-7083-casos-activos.html,"Para este lunes, 8 de marzo, el Ministerio de Salud (Minsa) reportó que hay 402 nuevos casos de Covid-19, para un total acumulado de 345,236. De acuerdo con el informe epidemiolg",08-03-2021 23:16,https://www.bing.com/th?id=OVFT.Y9vwlRh5CthtvSBORjD_4y,Panamá,Metro Libre
Prácticos del Canal de Panamá advierten incremento del desempleo en fuerza laboral femenina,https://bayanodigital.com/practicos-del-canal-de-panama-advierten-incremento-del-desempleo-en-fuerza-laboral-femenina/,(Nota de Bayano digital elaborada con datos de la Asociación de Prácticos del Canal de Panamá).  A un año del estallido de la pandemia de Coronavirus (C,08-03-2021 23:21,https://www.bing.com/th?id=OVFT.mJ4YYzKZgMKFgEIxENoi8C,Panamá,Bayano Digital
Panamá registra 11 nuevos decesos por COVID-19 y 402 contagios en las últimas horas,https://noticias24pty.com/panama-registra-11-nuevos-decesos-por-covid-19-y-402-contagios-en-las-ultimas-horas/,"Linda Batista • 8 Mar 2021 – 06:20 PM Tras reportarse un total de 402 nuevos casos de COVID-19 en las últimas 24 horas, Panamá elevó su cifra de contagios a 345,236, según el informe",08-03-2021 23:41,https://www.bing.com/th?id=OVFT.vqMXAtRsFvF-VlRLHKPdfy,Panamá,Noticias 24 PTY
Panamá ocupa la tercera posición en la región con mayor número de vacunados contra Covid,https://ensegundos.com.pa/2021/03/08/panama-ocupa-la-tercera-posicion-en-la-region-con-mayor-numero-de-vacunados-contra-covid/,"El proceso de vacunación avanza a buen ritmo en todo el país y según el Programa Ampliado de Inmunización (PAI). El 9 de marzo, se cumple un año desde que se anunció el primer caso de COVID-19 en Pana",08-03-2021 23:45,https://www.bing.com/th?id=OVFT.AW5_KuqtL1tDX47zgE1ZJy,Panamá,En Segundos
Panamá reporta 402 casos positivos y 11 nuevas defunciones por Covid 19,https://www.radiopanama.com.pa/noticias/actualidad/panama-reporta-402-casos-positivos-y-11-nuevas-defunciones-por-covid-19/20210308/nota/4115449.aspx,"El proceso de vacunación avanza a buen ritmo en todo el país y según el Programa Ampliado de Inmunización (PAI), desde el 20 de enero a la fecha se han aplicado 211,751 dosis de vacunas COVID-19 a niv",08-03-2021 23:58,https://www.bing.com/th?id=OVFT.U5aKDYpkHePXVNpXvKWW7y,Panamá,Radio Panamá
Baja la cantidad de pruebas aplicadas y de casos positivos de COVID-19 en Panamá,https://www.critica.com.pa/nacional/baja-la-cantidad-de-pruebas-aplicadas-y-de-casos-positivos-de-covid-19-en-panama-599823,"Según establece el informe epidemiológico del Ministerio de Salud (Minsa), en las últimas 24 horas se han aplicado 4,225 pruebas, de las cuales reportan que 402 dieron positivos (nuevos), elevándose e",09-03-2021 00:05,https://www.bing.com/th?id=OVFT.BhmM1gMPDOqUEnLaO1aBAS,Panamá,Critica
Se reportan 402 casos positivos y 11 nuevas defunciones por coronavirus en Panamá,https://www.midiario.com/nacionales/se-reportan-402-casos-positivos-y-11-nuevas-defunciones-por-coronavirus-en-panama/,"El Ministerio de Salud reportó para este lunes 8 de marzo un total de 402 casos positivos nuevos, para un total acumulado de 345 mil 236, lamentablemente en las últimas 24 horas se han registrado 11 n",09-03-2021 00:25,https://www.bing.com/th?id=OVFT.RsvAV3kWTPqXxEolrE1E1y,Panamá,Mi Diario
Avanza el estudio de las vacunas contra Covid-19,https://ensegundos.com.pa/2021/03/08/avanza-el-estudio-de-las-vacunas-contra-covid-19/,Los estudios clínicos en Panamá tienen una trayectoria de más de 20 años aportando a la ciencia mundial. El estudio de la fase 3 de la vacuna alemana Curevac contra Covid-19 avanza. Muchas personas qu,09-03-2021 00:57,https://www.bing.com/th?id=OVFT.33lSjmmol8LxAIiu86OWNS,Panamá,En Segundos
Centros escolares de Inglaterra reabren sus puertas,https://www.radiopanama.com.pa/noticias/internacional/centros-escolares-de-inglaterra-reabren-sus-puertas/20210308/nota/4115481.aspx,"El primer ministro británico Boris Johnson, destacó que la reapertura de las escuelas supone el primer paso hacia cierta normalidad, después de las duras medidas restrictivas impuestas para reducir lo",09-03-2021 02:31,https://www.bing.com/th?id=OVFT.U5aKDYpkHePXVNpXvKWW7y,Panamá,Radio Panamá
Un año de pandemia en Panamá; 345 mil 236 casos y 5 mil 934 muertes,https://www.prensa.com/impresa/panorama/un-ano-de-pandemia-en-panama-345-mil-236-casos-y-5-mil-934-muertes/,"Panamá cumple hoy un año desde que se detectó el primer caso del coronavirus SARS-CoV-2, y después de un mes de diciembre difícil, en la actualidad el país experimenta un declive significativo en la c",09-03-2021 05:00,https://www.bing.com/th?id=OVFT.RoLtQPLPe0-ToNaJ1MprMS,Panamá,prensa.com
Covid-19 amplió desigualdad de género,https://www.prensa.com/impresa/economia/covid-19-amplio-desigualdad-de-genero/,"La pandemia del coronavirus y la crisis económica y política han agudizado los desafíos que enfrentan las mujeres en su demanda de igualdad de derechos, advirtieron tres de las líderes más influyentes",09-03-2021 05:00,https://www.bing.com/th?id=OVFT.pGO37M7JuG19-1wVMSDR-i,Panamá,prensa.com
Se cumple un año del primer caso del nuevo coronavirus en Panamá,https://www.laestrella.com.pa/nacional/210309/cumple-ano-primer-caso-nuevo,"Hace un año Panamá confirmaba el primer caso de covid-19. Se trató de una mujer panameña, de 40 años, quien ingresó al país en el vuelo 6339 de Iberia procedente de Barajas, España.",09-03-2021 06:01,https://www.bing.com/th?id=OVFT.QYNtJVv8cMKsAnGZ-XH4yS,Panamá,laestrella.com.pa
Se inicia la jornada de vacunación contra la Covid-19 en el circuito 8-8,https://noticias24pty.com/se-inicia-la-jornada-de-vacunacion-contra-la-covid-19-en-el-circuito-8-8/,"La jornada de vacunación contra el SARS-CoV-2 se inició, la mañana de este martes 9 de marzo, en el circuito 8-8 que comprende los corregimientos de Juan Díaz, Don Bosco, Parque Lefevre, Río Abajo",09-03-2021 13:01,https://www.bing.com/th?id=OVFT.sk01pkr2Tr7l1u3P7Yfo3S,Panamá,Noticias 24 PTY
Ver imagen más grande,https://sertv.gob.pa/nacionalfm/comunicado-377/,"Mañana 9 de marzo, se cumple un año desde que se anunció el primer caso de COVID-19 en Panamá y hoy, la esperanza del país, está puesta en la estrategia continua de vacunación que lleva adelante el Go",09-03-2021 13:49,https://www.bing.com/th?id=OVFT.hLsJxXIA9-TrLEXzsvIe8y,Panamá,SERTV
"El Gorgas llegó a analizar hasta 4,500 muestras en un día de pandemia",https://www.metrolibre.com/nacionales/196060-el-gorgas-lleg%C3%B3-analizar-hasta-4500-muestras-en-un-d%C3%ADa-de-pandemia.html,"“La institución de 500 trabajadores ha sido la responsable de categorizar al menos 400 mil pruebas de PCR en un año desde el inicio de la pandemia el pasado 9 de marzo”, revelan. En 91 años de exigenc",09-03-2021 14:16,https://www.bing.com/th?id=OVFT.BX762nISf6qC3hbqbjZ79S,Panamá,Metro Libre
"El Gorgas, llegó analizar hasta 4,500 muestras en un día de pandemia",https://sertv.gob.pa/nacionalfm/el-gorgas-llego-analizar-hasta-4500-muestras-en-un-dia-de-pandemia/,"Es la primera vez que Instituto Conmemorativo Gorgas de Estudios de la Salud (ICGES), en Panamá, realiza un trabajo tan excesivo sobre una enfermedad, esta institución de 500 trabajadores, ha sido la",09-03-2021 14:23,https://www.bing.com/th?id=OVFT.XFgpyWKA-DPjZHaIyOd4Pi,Panamá,SERTV
Video: Se cumple un año del primer caso del nuevo coronavirus en Panamá,https://www.laestrella.com.pa/nacional/210309/video-cumple-ano-primer-caso-nuevo-coronavirus-panama,"Hace un año Panamá confirmaba el primer caso de covid-19. Se trató de una mujer panameña, de 40 años, quien ingresó al país en el vuelo 6339 de Iberia procedente de Barajas, España.",09-03-2021 14:45,https://www.bing.com/th?id=OVFT.oDKBK2PN2LL9HJkPOPq-by,Panamá,laestrella.com.pa
Porcell brinda balance a un año de la pandemia en Panamá,https://www.telemetro.com/entrevistas/2021/03/09/porcell-brinda-balance-a-un-ano-de-la-pandemia-en-panama/3827360.html,"La directora nacional de Salud del Ministerio de Salud (Minsa) de Panamá, Nadja Porcell, hizo un balance al cumplirse este martes 9 de marzo un año desde que se confirmó el primer caso positivo de la",09-03-2021 14:59,https://www.bing.com/th?id=OVFT.ekShCOHMoigUr5OpvPGhfi,Panamá,Telemetro
