name,url,description,datePublished,imagen,pais,Fuente
Mides entrega donaciones a inmigrantes en albergues de Panamá Centro,https://elcapitalfinanciero.com/mides-entrega-donaciones-a-inmigrantes-en-albergues-de-panama-centro/,"Ante la crisis sanitaria generada por el COVID-19, el Ministerio de Desarrollo Social (Mides), entregó bolsas de comida, kits de higiene e insumos de primera necesidad a más de 70 personas que se encu",27-08-2020 21:58,https://www.bing.com/th?id=ON.28D8AB925C4FE7CB67F8DDC176C51258,Panamá,El Capital Financiero
Trabajadores interponen recurso en la Corte por reducción de jornada laboral,https://www.laestrella.com.pa/nacional/200827/trabajadores-interponen-recurso-corte-reduccion-jornada-laboral,Integrantes de la Confederación Nacional de Unidad Sindical (Conusi) así como otras agrupaciones de trabajadores organizados marcharon la mañana de este jueves desde la avenida de Los Mártires hasta l,27-08-2020 21:59,https://www.bing.com/th?id=ON.12CDDE16F316DE0DE9C2FF92126AD886,Panamá,laestrella.com.pa
El Metro de Panamá se suma a estrategia para contener la Covid-19,https://www.prensa.com/sociedad/el-metro-de-panama-se-suma-a-estrategia-para-contener-la-covid-19/,"La administración del Metro de Panamá se sumó a la estrategia que impulsa la Caja de Seguro Social (CSS) para contener la propagación del nuevo coronavirus. Este jueves, 27 de agosto, ambas entidades",27-08-2020 21:59,https://www.bing.com/th?id=ON.C67B81525728715338F74339982E9325,Panamá,prensa.com
Gobierno solicita cotizaciones para adecuar Centro de Convenciones Amador,https://www.laestrella.com.pa/nacional/200827/gobierno-solicita-cotizaciones-adecuar-centro-convenciones-amador,"La mesa conjunta del Ministerio de Salud (Minsa) y la Caja de Seguro Social (CSS) lanzaron una invitación a todas las empresas interesadas, para presentar cotizaciones para la habilitación provisional",27-08-2020 21:59,https://www.bing.com/th?id=ON.3A60B26889D11A351262C42DAB0F24E4,Panamá,laestrella.com.pa
Ocupación de camas de UCI en Panamá y Panamá Oeste alcanza el 76%,https://www.prensa.com/impresa/panorama/ocupacion-de-camas-de-uci-en-panama-y-panama-oeste-alcanza-el-76/,"El Ministerio de Sallud habilitó 150 camas hospitalarias más en el centro de convenciones Figali, en Ancón. Elysée Fernández El nivel de ocupación de camas hospitalarias en las unidades de cuidados in",27-08-2020 21:59,https://www.bing.com/th?id=ON.E6A1158707EADB593DBBFCFC798A4360,Panamá,prensa.com
"Metro Burbuja, el nuevo programa para el manejo integral del COVID- 19",https://www.diaadia.com.pa/el-pais/metro-burbuja-el-nuevo-programa-para-el-manejo-integral-del-covid-19-369755,"El director general de la Caja de Seguro Social, Dr. Enrique Lau Cortés, junto al Ing. Héctor Ortega, director general del Metro de Panamá, S.A. realizaron el lanzamiento del Programa “Metro Burbuja”,",27-08-2020 22:26,https://www.bing.com/th?id=ON.FA23A44924EA91436B4B206E693BE43C,Panamá,Día a Día
Metro de Panamá y CSS ponen en marcha programa “Metro Burbuja” para el manejo integral del COVID-19,https://www.radiopanama.com.pa/noticias/actualidad/metro-de-panama-y-css-ponen-en-marcha-programa-metro-burbuja-para-el-manejo-integral-del-covid19/20200827/nota/4065879.aspx,"El Metro de Panamá y la Caja de Seguro Social (CSS) ponen en marcha el Programa “Metro Burbuja” manejo integral del COVID-19 laboral y comunitario, se trata de un sistema que busca en las empresas man",27-08-2020 23:30,https://www.bing.com/th?id=ON.7D78B3FEAE78D8AC05601605E2D2BC64,Panamá,Radio Panamá
"Uso de hidroxicloroquina disminuye número de muertes por COVID-19 en Panamá, confirma el Ministerio de Salud",https://www.panamaamerica.com.pa/sociedad/uso-de-hidroxicloroquina-disminuye-numero-de-muertes-por-covid-19-en-panama-confirma-el,"Un descenso significativo en los casos de COVID-19 se ha podido notar desde que el Ministerio de Salud autorizó el uso de la hidroxicloroquina y/o Azitromicina, así lo manifestó el ministro de Salud L",27-08-2020 23:39,https://www.bing.com/th?id=ON.E5030C67F1A10220C1F1C21A4F25DE88,Panamá,panamaamerica.com.pa
"900 nuevos casos y 16 defunciones adiciones por COVID-19, reporta el MINSA",https://www.radiopanama.com.pa/noticias/actualidad/900-nuevos-casos-y-16-defunciones-adiciones-por-covid19-reporta-el-minsa/20200827/nota/4065887.aspx,"EL MInisterio de Salud (MINSA), reporta para este jueves 27 de agosto en Panamá 63,996 pacientes recuperados, 900 casos positivos nuevos, para un total acumulado de 89,982. A la fecha se aplicaron 4,3",27-08-2020 23:51,https://www.bing.com/th?id=ON.7D78B3FEAE78D8AC05601605E2D2BC64,Panamá,Radio Panamá
Minsa nota descenso en cifra de fallecidos por COVID-19 con el uso de hidroxicloroquina,https://www.telemetro.com/nacionales/2020/08/27/minsa-nota-descenso-en-cifra-de-fallecidos-por-covid-19-con-el-uso-de-hidroxicloroquina/3174738.html,"El uso de hidroxicloroquina y azitromicina en Panamá ha reflejado como resultado un descenso en cuanto a la cifra de fallecidos a causa de la COVID-19, informó este jueves el Ministerio de Salud (Mins",28-08-2020 00:01,https://www.bing.com/th?id=ON.98CE2277B33F4CD5A95700787DD78B02,Panamá,Telemetro
Proyecto de investigación de vacuna de COVID-19 en Panamá pide voluntarios mayores de 60 años,https://www.telemetro.com/nacionales/2020/08/27/encargados-estudio-vacuna-panama-piden/3174745.html,El Consorcio de Investigación de Vacunas de COVID-19 (Cevaxin) en Panamá está buscando la participación de voluntarios mayores de 60 años para el estudio que realizan en el país sobre la efectividad d,28-08-2020 00:07,https://www.bing.com/th?id=ON.BC790B38A7D8887ABD1679B7C8810471,Panamá,Telemetro
Hay descenso en los casos de COVID-19 en Panamá gracias a la Hidroxicloroquina,https://www.diaadia.com.pa/el-pais/hay-descenso-en-los-casos-de-covid-19-en-panama-gracias-la-hidroxicloroquina-369774,"En el reporte del COVID-19 de hoy, jueves 27 de agosto en Panamá se contabilizan 63,996 pacientes recuperados, 900 casos positivos nuevos, para un total acumulado de 89,982. A la fecha se aplicaron 4,",28-08-2020 00:23,https://www.bing.com/th?id=ON.0625CA482859BA778AC2C9B4E367FD1E,Panamá,Día a Día
"Hay 24,038 casos activos por COVID-19 en Panamá; hoy se confirmaron 16 nuevas muertes",https://www.tvn-2.com/nacionales/activos-COVID-19-Panama-confirmaron-muertes_0_5657434291.html,"En las últimas 24 horas fueron confirmados 900 casos positivos nuevos y 16 nuevas defunciones por la COVID-19 en Panamá. Hasta este jueves, 27 de agosto, hay 89,982 infectados acumulados, de los cuale",28-08-2020 02:41,https://www.bing.com/th?id=ON.B48072EF3C05A341D4B4EA927162FB72,Panamá,TVN
Uso de hidroxicloroquina genera descenso significativo en casos de covid-19,http://elsiglo.com.pa/panama/hidroxicloroquina-genera-descenso-significativo-casos-covid-19/24163096,"El ministro de Salud, Luis Francisco Sucre, informó que se ha notado un “descenso significativo” en los casos de covid-19 desde que el Ministerio de Salud (Minsa) autorizó el uso de la hidroxicloroqui",28-08-2020 05:05,https://www.bing.com/th?id=ON.EF4C6D1137ADB473B02837BFA379F67C,Panamá,El Siglo
‘Metro Burbuja’ para que no se nos pegue el coronavirus,https://www.critica.com.pa/nacional/metro-burbuja-para-que-no-se-nos-pegue-el-coronavirus-586588,La Caja de Seguro Social (CSS) y el Metro de Panamá implementarán un plan para mitigar el contagio por Covid-19 en las estaciones y trenes. La “Metro burbuja productiva” es un sistema de áreas seguras,28-08-2020 07:30,https://www.bing.com/th?id=ON.BC46EF80027510CAADCAE068A06ECA4D,Panamá,Critica
Aislamiento preventivo para ingresar a la mina,https://www.critica.com.pa/nacional/aislamiento-preventivo-para-ingresar-la-mina-586587,"Cada trabajador de Cobre Panamá y de sus contratistas, sin excepción, deberá pasar un periodo de aislamiento preventivo remunerado de 14 días, en uno de los hoteles asignados para este propósito, ante",28-08-2020 07:30,https://www.bing.com/th?id=ON.6A12897FBBD2BACE87A75E79195CFB2B,Panamá,Critica
"Panamá eleva a 1,948 las muertes por Covid-19",https://www.metrolibre.com/nacionales/180408-panam%C3%A1-eleva-1948-las-muertes-por-covid-19.html,"El Ministerio de Salud reportó para este jueves, 27 de agosto, 900 nuevos casos positivos de coronavirus, para un total acumulado de 89,982. A la fecha se aplicaron 4,326 pruebas, para un porcentaje d",28-08-2020 09:54,https://www.bing.com/th?id=ON.3F9DF67B1280213ED1114FE84D0B51A6,Panamá,Metro Libre
Veraguas pide mayor vigilancia por casos activos de coronavirus,https://www.metrolibre.com/provincias/180438-veraguas-pide-mayor-vigilancia-por-casos-activos-de-coronavirus.html,"Con 3,651 casos acumulados de Covid-19  Veraguas se posiciona como la quinta provincia del país con más contagios.   En las últimas semanas los distritos de Soná y Santiago han registrado  brotes, que",28-08-2020 10:27,https://www.bing.com/th?id=ON.08B7098661CF1CE43D4E69ACCED16DB3,Panamá,Metro Libre
Lo que debes leer antes de dormir,https://www.tvn-2.com/nacionales/debes-leer-dormir_0_5657434311.html,"Este jueves 27 de agosto de 2020 estuvo cargado de información y aquí te compartimos algunas de las noticias más importantes, y que no debes dejar de leer antes de dormir. 1. Hay 24,038 casos activos",28-08-2020 11:52,https://www.bing.com/th?id=ON.B6BAD23999A0C4977E36AD1817084E5F,Panamá,TVN
"900 nuevos casos de Covid-19 y 16 muertes engrosan la cifra a 1,948",https://ensegundos.com.pa/2020/08/27/reportan-900-nuevos-casos-de-covid-19-y-16-nuevas-muertes-aumentan-la-cifra-a-1948/,"Para hoy jueves 27 de agosto en Panamá el Ministerio de Salud reporta 900 casos positivos nuevos, para un total acumulado de 89,982. Se han registrado 16 nuevas defunciones, que totalizan 1,948 acumul",28-08-2020 12:00,https://www.bing.com/th?id=ON.CF60E77D64164A07798CDC073DE4C2FB,Panamá,En Segundos
900 nuevos contagiados de coronavirus en un solo día,http://elsiglo.com.pa/panama/900-nuevos-contagiados-coronavirus-solo/24163105,"Pandemia. En las últimas 24 horas se realizaron 4 mil 326 pruebas de hisopados, de las cuales 900 resultaron positivas en coronavirus, además ocurrieron 16 nuevas defunciones, que totalizan mil 948 ac",28-08-2020 12:08,https://www.bing.com/th?id=ON.0F8B1AAC9D8326AA92867AD79D08E13A,Panamá,El Siglo
"OMS aconseja a quienes hayan tenido contacto con personas con covid-19, testearse incluso sin síntomas",https://ensegundos.com.pa/2020/08/27/oms-aconseja-a-quienes-hayan-tenido-contacto-con-personas-con-covid-19-testearse-incluso-sin-sintomas/,La Organización Mundial de la Salud (OMS) aconsejó este jueves que quienes que hayan estado en contacto con algún caso de covid-19 deben someterse a pruebas aunque no tengan síntomas. En Estados Unido,28-08-2020 12:22,https://www.bing.com/th?id=ON.20B80123C4264C560A8EEC7038A6201C,Panamá,En Segundos
"Aislamiento preventivo, garantía para ingresar sin COVID-19 a la mina",https://www.panamaamerica.com.pa/sociedad/aislamiento-preventivo-garantia-para-ingresar-sin-covid-19-la-mina-1170906,"Cada trabajador de Cobre Panamá y de sus contratistas, sin excepción, deberá pasar un periodo de ""aislamiento preventivo"" remunerado de 14 días, en uno de los hoteles asignados para este propósito, an",28-08-2020 14:58,https://www.bing.com/th?id=ON.5CF502F41199BEBB699D36637482B4C8,Panamá,panamaamerica.com.pa
