name,url,description,datePublished,imagen,pais,Fuente
Pfizer y BioNTech prueban vacuna contra COVID en embarazadas,http://www.nexpanama.com/pfizer-y-biontech-prueban-vacuna-contra-covid-en-embarazadas/,La farmacéutica estadounidense Pfizer y su socio alemán BioNTech empezaron el jueves un estudio que se llevará a cabo en nueve países sobre los efectos de su vacuna contra el coronavirus en embarazada,19-02-2021 13:00,https://www.bing.com/th?id=OVFT.KAMdq22JW6vw7ynLNoGWZC,Panamá,NEX TV
"La reducción de casos de covid-19 da un respiro a Europa, según la OMS",https://ensegundos.com.pa/2021/02/19/la-reduccion-de-casos-de-covid-19-da-un-respiro-a-europa-segun-la-oms/,"Los nuevos casos han declinado por quinta semana consecutiva, aunque sigue siendo ""alto"" su número. La Organización Mundial de la Salud (OMS) indicó este viernes que la caída de casos de covid-19 en E",19-02-2021 13:20,https://www.bing.com/th?id=OVFT.99KQIszaR10b855zJZ2AoS,Panamá,En Segundos
Sistema electrónico busca agilizar certificaciones en la región metropolitana de salud,https://www.prensa.com/sociedad/sistema-electronico-busca-agilizar-certificaciones-en-la-region-metropolitana-de-salud/,La región metropolitana de salud informó que busca agilizar la obtención de las certificaciones de pacientes Covid-19. La iniciativa cuenta con el respaldo de la Autoridad de Innovación Gubernamental,19-02-2021 14:25,https://www.bing.com/th?id=OVFT.EEmpSBCpHTsjNjFIzZxrEC,Panamá,prensa.com
COMUNICADO # 359,https://sertv.gob.pa/crisolfm/comunicado-359/,"Al corte de hoy, remitido a las 4 de la tarde por la Autoridad de Innovación Gubernamental (AIG), se han aplicado 30,766 dosis (3,575 segundas dosis y 27,191 primera dosis). En la región Metropolitana",19-02-2021 14:35,https://www.bing.com/th?id=OVFT.TExIUMQKiIGJqTtEn3bRry,Panamá,SERTV
Adultos mayores de los asilos de David y Chitré reciben la primera dosis de la vacuna contra la covid-19,https://www.panamaamerica.com.pa/provincias/adultos-mayores-asilos-david-chitre-reciben-primera-dosis-vacuna-contra-covid-19-1181795,"Un total de 3,192 dosis de vacunas contra la covid-19 fueron recibidas en la provincia de Herrera, con las cuales se inició la inmunización del personal de salud, así como los adultos mayores albergad",19-02-2021 15:18,https://www.bing.com/th?id=OVFT.lcNsj0ESNVfHYk-5ZHcD-y,Panamá,panamaamerica.com.pa
Panamá entre los países donde Abrahamson Center dará tratamientos contra el tabaco a personal de salud,https://www.tvn-2.com/nacionales/salud/Panama-Abrahamson-Center-destinara-tratamientos-tabaco-salud_0_5789421031.html,"Panamá, Colombia, México y Estados Unidos son algunos de los países donde Abrahamson Center destinará más de 80 mil dólares en tratamientos contra el tabaco para personal de salud que lucha contra la",19-02-2021 15:18,https://www.bing.com/th?id=OVFT.tjZtHG-J-mTPO2rJGjW6Ay,Panamá,TVN
La Región Metropolitana inicia la vacunación en asilos y casas hogares,https://www.laestrella.com.pa/nacional/210219/region-metropolitana-inicia-vacunacion-asilos-culminar-fase-1a,Las autoridades de salud se trasladaron hoy viernes a Parque Lefreve para vacunar a adultos mayores de 60 años y encamados en asilos y hogares,19-02-2021 17:06,https://www.bing.com/th?id=OVFT.j01DE7muMziMnJWu022mqi,Panamá,laestrella.com.pa
375 mil nuevos usuarios beneficiados por innovación en pagos electrónicos en 2020,https://www.radiopanama.com.pa/noticias/actualidad/375-mil-nuevos-usuarios-beneficiados-por-innovacion-en-pagos-electronicos-en-2020/20210219/nota/4111005.aspx,Durante el 2020 la empresa también enfocó sus esfuerzos en modernizar la plataforma de transferencias interbancarias bajo la marca ACH Directo.,19-02-2021 18:48,https://www.bing.com/th?id=OVFT.U5aKDYpkHePXVNpXvKWW7y,Panamá,Radio Panamá
Panamá levantará la cuarentena de fines de semana el 6 de marzo,https://www.laestrella.com.pa/nacional/210219/panama-levantara-cuarentena-fines-semana-6-marzo,"A partir del 6 de marzo se levantará la medida de cuarentena total de los fines de semana a nivel nacional, a las 4:00 a.m. Se mantiene el toque de queda a nivel nacional desde las 10:00 p.m. hasta la",19-02-2021 21:06,https://www.bing.com/th?id=OVFT._JOIfOSVt_6gtssYf4q4mC,Panamá,laestrella.com.pa
Se reactivan las exportaciones en Panamá a pesar de la pandemia,https://www.radiopanama.com.pa/noticias/actualidad/se-reactivan-las-exportaciones-en-panama-a-pesar-de-la-pandemia/20210219/nota/4111070.aspx,"El Ministro de Desarrollo Agropecuario Augusto Valderrama señaló que se han reactivado las exportaciones de carne, piña, sandía entre otros, a diferentes países considerándolo un factor importante",19-02-2021 22:04,https://www.bing.com/th?id=OVFT.U5aKDYpkHePXVNpXvKWW7y,Panamá,Radio Panamá
La aerolínea panameña Copa Airlines amplía los vuelos a Venezuela,https://www.diaadia.com.pa/el-pais/la-aerolinea-panamena-copa-airlines-amplia-los-vuelos-venezuela-375719,"La aerolínea Copa Airlines informó este viernes que reiniciará vuelos entre Panamá y la ciudad venezolana de Maracaibo y añadirá una nueva frecuencia con Valencia, después que en enero ambos paí",19-02-2021 22:15,https://www.bing.com/th?id=OVFT.EwMDjESFXcYB88nDOJzCKC,Panamá,Día a Día
"Panamá supera las 5,700 muertes por Covid-19; se reportan 876 casos en las últimas horas",https://www.prensa.com/sociedad/panama-supera-las-5700-muertes-por-covid-19-se-reportan-876-en-las-ultimas-horas/,"Panamá superó este viernes, 19 de febrero, las 5,700 muertes por coronavirus, de acuerdo al informe epidemiológico del Ministerio de Salud",19-02-2021 22:34,https://www.bing.com/th?id=OVFT.5xzIp-Nntf1J2X3rfGtr4S,Panamá,prensa.com
"Las escuelas públicas de Florida pierden 90,000 alumnos debido a la pandemia",https://www.panamaamerica.com.pa/mundo/escuelas-publicas-florida-pierden-90000-alumnos-debido-pandemia-1181828,"Las autoridades escolares y legisladores de Florida (EE.UU.) han pedido información sobre los casi 90,000 estudiantes de primaria y secundaria que no se han matriculado después de la pandemia en las e",19-02-2021 23:01,https://www.bing.com/th?id=OVFT.sV13PtFVg6FSBZwkHnFTji,Panamá,panamaamerica.com.pa
‘La Pantera’ Edwards ya es toda una figura mediática,https://www.midiario.com/deportivas/la-pantera-edwards-ya-es-toda-una-figura-mediatica/,"‘La Pantera’ ya no suele pasar desapercibida. A donde quiera que va los fanáticos la reconocen, aún teniendo su mascarilla",19-02-2021 23:02,https://www.bing.com/th?id=OVFT.4rblcPQpqt-s1fzN9fbeXS,Panamá,Mi Diario
"Panamá recibirá 77, 200 nuevas dosis de la vacuna de Pfizer",https://www.metrolibre.com/nacionales/194593-panam%C3%A1-recibir%C3%A1-77-200-nuevas-dosis-de-la-vacuna-de-pfizer.html,"La viceministra de Salud de Panamá, Ivette Berrío confirmó hoy, 19 de febrero, que el tercer lote de  77, 200 dosis de la vacuna contra el covid-19 de la farmacéutica Pfizer llegarán la próxima semana",19-02-2021 23:18,https://www.bing.com/th?id=OVFT.q2UGy0CRCYMvzXMdusiz3C,Panamá,Metro Libre
Nevada invierte en ampliar su línea de producción y lanza al mercado su nueva Leche Deslactosada 2%,https://elcapitalfinanciero.com/nevada-invierte-en-ampliar-su-linea-de-produccion-y-lanza-al-mercado-su-nueva-leche-deslactosada-2/,"Productos Nevada, con 28 años de ser parte de la industria láctea en Panamá, anunció de la apertura de su nueva línea de producción de leche Nevada deslactosada 2%, alimento que se producirá en Panamá",19-02-2021 23:20,https://www.bing.com/th?id=OVFT.GRM4Lx9aed5j_xWYSs6yVS,Panamá,El Capital Financiero
"Vacunación se desarrolla a nivel nacional: viceministra de Salud, Ivette Berrio",https://sertv.gob.pa/nacionalfm/vacunacion-se-desarrolla-a-nivel-nacional-viceministra-de-salud-ivette-berrio/,"Durante su intervención, la Dra. Berrio, mencionó, que la política del gobierno panameño, está encaminada a que el plan de vacunación abarque un gran porcentaje de la población. Esta cobertura, inicia",19-02-2021 23:27,https://www.bing.com/th?id=OVFT.FlYghe4BexYbSteqrB1Cqy,Panamá,SERTV
Panamá reporta 876 nuevos casos de covid-19 y 17 decesos en las últimas horas,https://www.telemetro.com/nacionales/2021/02/19/panama-reporta-876-nuevos-casos-de-covid-19-y-17-decesos-en-las-ultimas-horas/3768132.html,"Panamá registró en las últimas 24 horas 876 nuevos casos de covid-19, con lo que se eleva a 335,339 el total de contagios, informó el Ministerio de Salud (Minsa), a través de su informe epidemiológico",19-02-2021 23:31,https://www.bing.com/th?id=OVFT.BXjvrokG0T8Mkji7cOly7y,Panamá,Telemetro
Nevada amplía su línea de producción y lanza al mercado su nueva Leche Deslactosada 2%,https://elcapitalfinanciero.com/nevada-amplia-su-linea-de-produccion-y-lanza-al-mercado-su-nueva-leche-deslactosada-2/,"Productos Nevada, con 28 años de ser parte de la industria láctea en Panamá, anunció de la apertura de su nueva línea de producción de leche Nevada deslactosada 2%, alimento que se producirá en Panamá",19-02-2021 23:40,https://www.bing.com/th?id=OVFT.GRM4Lx9aed5j_xWYSs6yVS,Panamá,El Capital Financiero
En últimas 24 horas Panamá reporta 876 casos positivos y 17 muertes por la COVID-19,https://www.tvn-2.com/nacionales/ultimas-Panama-reporta-positivos-COVID-19_0_5789421077.html,"Al cierre de este viernes 19 de febrero, el Sistema de Vigilancia Epidemiológica de Panamá contabilizó 17 muertos y 876 casos positivos nuevos por la COVID-19.",19-02-2021 23:46,https://www.bing.com/th?id=OVFT.P2pHC8dklOCaWUVZ2jugoi,Panamá,TVN
Panamá registra 876 casos nuevos de coronavirus,https://www.metrolibre.com/nacionales/194595-panam%C3%A1-registra-876-casos-nuevos-de-coronavirus.html,"Para hoy, viernes 19 de febrero 2021, en Panamá se contabilizan 876 casos positivos nuevos, para un total acumulado de 335,339, desde que se detectó el primer infectado en marzo de 2020. De acuerdo al",19-02-2021 23:48,https://www.bing.com/th?id=OVFT.zgdc6ewJkmhPKupuu6Xobi,Panamá,Metro Libre
"Hasta la fecha se han colocado 40,830 dosis de vacunas a nivel nacional",https://noticias24pty.com/hasta-la-fecha-se-han-colocado-40830-dosis-de-vacunas-a-nivel-nacional/,"Hoy en conferencia de prensa, la viceministra de salud Ivette Berrío, dijo durante su intervención que “con respecto a los acuerdos para obtener vacunas contra el COVID-19 el equipo negociador",20-02-2021 00:01,https://www.bing.com/th?id=OVFT.478GAHh0IIpLiA9oNgR-SS,Panamá,Noticias 24 PTY
Hay 876 casos positivos nuevos de Covid-19 y 17 defunciones,https://www.critica.com.pa/nacional/hay-876-casos-positivos-nuevos-de-covid-19-y-17-defunciones-598686,"Los casos activos suman 10,833. En aislamiento domiciliario se reportan 9,476 personas, de los cuales 9,112 se encuentran en casa y 364 en hoteles.",20-02-2021 00:08,https://www.bing.com/th?id=OVFT.XXGf8dxDhfdpa2EJo2Vnei,Panamá,Critica
Defunciones producto de las afectaciones del covid-19 disminuyen y hoy sumaron solamente 17,https://ensegundos.com.pa/2021/02/19/defunciones-producto-de-las-afectaciones-del-covid-19-disminuyen-y-hoy-sumaron-solamente-17/,"En lo referente a las recuperaciones de los pacientes, en esta fecha se contabilizan 318,795, al tiempo que los casos positivos nuevos  son 876, para un total acumulado de 335,339. Las defunciones, pr",20-02-2021 00:25,https://www.bing.com/th?id=OVFT.zCFtiI9FtDbSIoHhPev4aS,Panamá,En Segundos
