name,url,description,datePublished,imagen,pais,Fuente
Cortizo pide autocuidado para vencer la pandemia que abate economía de Panamá,https://www.diaadia.com.pa/el-pais/cortizo-pide-autocuidado-para-vencer-la-pandemia-que-abate-economia-de-panama-368702,"El presidente panameño, Laurentino Cortizo, avaló el pronóstico del Bank of America de que la economía local se derrumbará hasta un 10 % este 2020 a causa del COVID-19, y resaltó que el autocuidado es",27-07-2020 02:32,https://www.bing.com/th?id=ON.7D32E28BA0D07DE6F38CB3BF3D3FD4DE,Panamá,Día a Día
Bolivia le pone fin al año escolar por la pandemia,https://www.radiopanama.com.pa/noticias/internacional/bolivia-le-pone-fin-al-ano-escolar-por-la-pandemia/20200802/nota/4059748.aspx,"El ministro interino de la Presidencia de Bolivia, Yerko Núñez, fue quién dio el anuncio del cierre del año lectivo 2020 en ese país, derivado por la pandemia. “El Gobierno de la presidenta Jeanine Áñ",02-08-2020 21:17,https://www.bing.com/th?id=ON.7D78B3FEAE78D8AC05601605E2D2BC64,Panamá,Radio Panamá
Abogado Rosendo Rivera presentó denuncia penal contra el alcalde José Luis Fábrega,https://ensegundos.com.pa/2020/08/02/abogado-rosendo-rivera-presento-denuncia-penal-contra-el-alcalde-jose-luis-fabrega/,"La máxima autoridad del Municipio de Panamá, luego de pedir a los ciudadanos que acataran las normas impuestas por las autoridades de Salud para frenar los contagios por el Covid-19, decidió infringir",02-08-2020 21:43,https://www.bing.com/th?id=ON.D03D9085F1A0F2BBC9D40B832FABEFF3,Panamá,En Segundos
Preocupa cantidad exagerada de muertes por COVID-19 en Panamá,https://www.critica.com.pa/nacional/preocupa-cantidad-exagerada-de-muertes-por-covid-19-en-panama-584717,"Francisco Sánchez Cárdenas, miembro del consejo consultivo del Ministerio de Salud (Minsa) señaló que ve con gran preocupación la cantidad exagerada de defunciones por COVID-19, que es superior a la d",02-08-2020 22:12,https://www.bing.com/th?id=ON.F7A4133B82E175DCD40CFF2F5E44903B,Panamá,Critica
"Al menos 1,471 personas han muerto por Covid-19 en Panamá",https://ensegundos.com.pa/2020/08/02/al-menos-1471-personas-han-muerto-por-covid-19-en-panama/,"Los casos activos suman 24,944. En aislamiento domiciliario se reportan 23,480 personas de los cuales 22,806 se encuentran en casa y 674 en hoteles. El Ministerio de Salud (Minsa) informó que, para ho",02-08-2020 23:07,https://www.bing.com/th?id=ON.780C4314F80C8B74C80E7539DFD5FCFE,Panamá,En Segundos
Buscan habilitar Ciudad de la Salud para pacientes COVID-19,https://www.radiopanama.com.pa/noticias/actualidad/buscan-habilitar-ciudad-de-la-salud-para-pacientes-covid19/20200802/nota/4059735.aspx,"El proyecto de la Ciudad de la Salud todavía está lejos de culminarse, pero en el camino, las autoridades de la Caja de Seguro Social esperan usar algunas zonas que se encuentran más avanzadas para at",02-08-2020 23:37,https://www.bing.com/th?id=ON.7D78B3FEAE78D8AC05601605E2D2BC64,Panamá,Radio Panamá
"Minsa lanza convocatoria para contratar especialistas para la lucha contra la COVID-19; mientras se registran 1,471 muertes por este virus en Panamá",https://www.panamaamerica.com.pa/sociedad/minsa-lanza-convocatoria-para-contratar-especialistas-para-la-lucha-contra-la-covid-19,"Mientras que el Ministerio de Salud (Minsa) hizo una nueva convocatoria para la contratación de médicos especialistas para formar parte del equipo que batalla contra la COVID-19, los casos en Panamá l",02-08-2020 23:52,https://www.bing.com/th?id=ON.75BBA36DBDF31A799EB096FEFC8E801D,Panamá,panamaamerica.com.pa
Coordinan apoyo para el hospital Nicolás A. Solano de La Chorrera,https://www.panamaamerica.com.pa/provincias/coordinan-apoyo-para-el-hospital-nicolas-solano-de-la-chorrera-1169084,"Médicos agotados debido a las extensas jornadas de trabajo en las salas de COVID-19 y otros en cuarentena, tras resultar contagiados con el virus, es parte del panorama a lo interno del hospital Nicol",02-08-2020 23:52,https://www.bing.com/th?id=ON.75BBA36DBDF31A799EB096FEFC8E801D,Panamá,panamaamerica.com.pa
"A 1,471 ascienden las defunciones en Panamá por el Covid-19",https://www.metrolibre.com/nacionales/178236-1471-ascienden-las-defunciones-en-panam%C3%A1-por-el-covid-19.html,"Panamá reporta 1,070 casos nuevos de COVID-19 para hoy, domingo 2 de agosto de 2020, elevando a 67,453 los casos acumulados en el país. En cuanto a las defunciones se registran 1,471, de las cuales 22",03-08-2020 02:06,https://www.bing.com/th?id=ON.CCDBB638F6B11A6FF1F06E91C31FABFA,Panamá,Metro Libre
