name,url,description,datePublished,imagen,pais,Fuente
Empresarios a la espera de un plan de recuperación ¿Qué ha adelantado el Gobierno?,https://www.tvn-2.com/contenido_exclusivo/Empresarios-espera-recuperacion-adelantado-Gobierno_0_5687431314.html,"La tasa de desempleo en el país podría alcanzar un pico histórico del 25% al cierre de este 2020, debido a los efectos de la pandemia por la COVID-19 en nuestra economía. Así lo aseguró a TVN-2.com el",07-10-2020 11:09,https://www.bing.com/th?id=OVFT.2dyPjo6QMZDd4ty5byPDsC,Panamá,TVN
Consejero de Estados Unidos visitará Panamá,https://www.midiario.com/nacionales/consejero-de-estados-unidos-visitara-panama/,"El consejero del Departamento de Estado de Estados Unidos, T. Ulrich Brechbuhl visitará Panamá y otros países latinoamericanos durante una gira del 6 al 9 de octubre, según informó este martes 6 de oc",07-10-2020 11:37,https://www.bing.com/th?id=OVFT.hk153wUgcWfvKgNjb_yEbC,Panamá,Mi Diario
Casi un tercio de pacientes con COVID-19 presenta alteración mental en un estudio,https://ensegundos.com.pa/2020/10/07/casi-un-tercio-de-pacientes-con-covid-19-presenta-alteracion-mental-en-un-estudio/,Casi una tercera parte de los pacientes hospitalizados con COVID-19 presentó algún tipo de alteración de las funciones mentales (desde confusión hasta delirio y reacciones ausentes) en el estudio más,07-10-2020 14:02,https://www.bing.com/th?id=OVFT.3TvOlf8fVVjY1PmQtFz3SS,Panamá,En Segundos
"Panamá Oeste no baja la guardia en lucha contra la Covid-19, dicen autoridades",https://www.metrolibre.com/nacionales/183809-panam%C3%A1-oeste-no-baja-la-guardia-en-lucha-contra-la-covid-19-dicen-autoridades.html,"Los clubes cívicos, grupos evangélicos, voluntarios del Sinaproc, empresarios y otras organizaciones de la sociedad civil se han unido en Panamá Oeste para la lucha contra la Covid -19, según destacó",07-10-2020 14:11,https://www.bing.com/th?id=OVFT.xrsEwpY0pl2VIUkBrRCX6i,Panamá,Metro Libre
Berlín impone toque de queda nocturno por aumento de casos de coronavirus,http://www.nexpanama.com/berlin-impone-toque-de-queda-nocturno-por-aumento-de-casos-de-coronavirus/,La capital alemana decidió el martes imponer un toque de queda nocturno en restaurantes y bares para contener los crecientes números de casos de coronavirus en Berlín. El alcalde de la ciudad Michael,07-10-2020 15:14,https://www.bing.com/th?id=OVFT.0CcepybDSaMi20SpHg8UQS,Panamá,NEX TV
Asintomáticos de COVID-19 podrían presentar muerte súbita si se descuidan,https://www.panamaamerica.com.pa/sociedad/asintomaticos-covid-19-podrian-presentar-muerte-subita-si-se-descuidan-1173540,"Los asintomáticos de COVID-19 constituyen un dolor de cabeza para los sistemas de salud, destacó la investigadora Sandra López Vergés durante un foro organizado por la Universidad Especializada de las",07-10-2020 15:22,https://www.bing.com/th?id=OVFT.geAlZ8Eh-2SJUH_zGE0i1i,Panamá,panamaamerica.com.pa
AFUTPA destina fondo para asistencia social a futbolistas en tiempos de pandemia,https://www.tvmax-9.com/futbol_nacional/AFUTPA-destina-asistencia-futbolistas-pandemia_0_5688181156.html,Doce mil dólares fue el fondo inicial que destinó la Asociación de Futbolistas Profesionales de Panamá (AFUTPA) al programa de asistencia social a los jugadores que pasan por problemas económicos debi,07-10-2020 15:57,https://www.bing.com/th?id=OVFT.gZubgO4jWHNItaEyywgtwS,Panamá,TVMAX
Habrá una Sala Covid-19 en la Ciudad de la Salud,https://www.midiario.com/nacionales/habra-una-sala-covid-19-en-la-ciudad-de-la-salud/,"Enrique Lau Cortés, director general de la Caja de Seguro Social (CSS) informó que lograron entrar a la Ciudad de la Salud para habilitar la Sala covid-",07-10-2020 16:17,https://www.bing.com/th?id=OVFT.9OTwdSX-xBQWHpKuYwy_MS,Panamá,Mi Diario
Panamá Oeste no baja la guardia frente al COVID-19,https://www.diaadia.com.pa/el-pais/panama-oeste-no-baja-la-guardia-frente-al-covid-19-371116,"Los clubes cívicos, los grupos evangélicos, los voluntarios de Sistema Nacional de Protección Civil - Sinaproc, empresarios, además de otras organizaciones de la sociedad civil se han unido",07-10-2020 17:09,https://www.bing.com/th?id=OVFT.122DWICP0-r9dOBerkk7wy,Panamá,Día a Día
Consejero del Departamento de Estado de EEUU se reúne con ministros panameños,https://www.telemetro.com/nacionales/2020/10/07/consejero-departamento-eeuu-ministros-panamenos/3318687.html,"Thomas Ulrich Brechbuhl, Consejero del Departamento de Estado de Estados Unidos (EEUU), arribó a Panamá esta mañana para abordar temas de seguridad con las autoridades panameñas.",07-10-2020 17:16,https://www.bing.com/th?id=OVFT.VDYd-hF_WYFyTrrSZTtC4S,Panamá,Telemetro
"Diezmada por la Covid-19, Costa Rica enfrentará a Panamá en amistosos",https://www.prensa.com/deportes/diezmada-por-la-covid-19-costa-rica-enfrentara-a-panama-en-amistosos/,"Con un equipo diezmado por la Covid-19, la selección de fútbol de Costa Rica se medirá a Panamá en dos amistosos preparatorios para la clasificatoria al Mundial de Catar-2022 y la Copa Oro de Concacaf",07-10-2020 17:21,https://www.bing.com/th?id=OVFT.FtGDy0MG8Mz_I2C4_Mb7Yy,Panamá,prensa.com
Consejero Ulrich Brechbuhl dona 50 ventiladores para combatir COVID-19,https://www.critica.com.pa/nacional/consejero-ulrich-brechbuhl-dona-50-ventiladores-para-combatir-covid-19-589508,"El Consejero del Departamento de Estado de EE.UU., Thomas Ulrich Brechbuhl, se encuentra de visita en Panamá como parte de una gira por América Latina, donde también visitará México y Uruguay.El Conse",07-10-2020 17:26,https://www.bing.com/th?id=OVFT.kZNTEt8ezu1QZM41NyIPSi,Panamá,Critica
Habilitan cuenta para recaudar fondos para joven médico contagiado de COVID-19,https://www.panamaamerica.com.pa/sociedad/habilitan-cuenta-recaudar-fondos-joven-medico-contagiado-covid-19-1173551,"La familia del médico Carlos Manuel Mendoza Gobea, contagiado de COVID-19, informó este miércoles que ya tiene habilitada una cuenta bancaria para recaudar los fondos necesarios para su tratamiento  e",07-10-2020 17:34,https://www.bing.com/th?id=OVFT.-4IKyGv0syPSbaevdCuvKS,Panamá,panamaamerica.com.pa
Director de la CSS asegura en informe de gestión que cuentan con los estudios actuariales del Fondo IVM,https://www.telemetro.com/nacionales/2020/10/07/director-css-asegura-informe-gestion/3319200.html,"El director de la Caja de Seguro Social de Panamá (CSS), Enrique Lau adelantó en su informe de gestión de su primer año (2019-2020) al frente de la entidad, que ya cuentan con los estudios actuariales",07-10-2020 17:53,https://www.bing.com/th?id=OVFT.PCqZtj-0vhTEgV7BsahoxS,Panamá,Telemetro
"Diezmada por covid-19, Costa Rica enfrentará a Panamá en amistosos",https://www.metrolibre.com/deportes/183823-diezmada-por-covid-19-costa-rica-enfrentar%C3%A1-panam%C3%A1-en-amistosos.html,"Con un equipo diezmado por la covid-19, la selección de fútbol de Costa Rica se medirá a Panamá en dos amistosos preparatorios para la clasificatoria al Mundial de Catar-2022 y la Copa Oro de Concacaf",07-10-2020 18:03,https://www.bing.com/th?id=OVFT.s_96e1pzCGwoTqaMxUUv2C,Panamá,Metro Libre
Consejero del Departamento de Estado de EE.UU. Ulrich Brechbuhl está en Panamá,http://elsiglo.com.pa/panama/consejero-departamento-estado-eeuu-ulrich-brechbuhl-esta-panama/24165508,"El consejero del Departamento de Estado de EE.UU., Thomas Ulrich Brechbuhl, se encuentra de visita en Panamá como parte de una gira por América Latina, donde también visitará México y Uruguay. La Emba",07-10-2020 18:51,https://www.bing.com/th?id=OVFT.yznMcoTL7ok9l8CFATYXai,Panamá,El Siglo
Cepal mantiene sus perspectivas para Panamá en -6.5% y prevé ligera recuperación desde octubre,https://www.laestrella.com.pa/economia/201007/cepal-mantiene-perspectivas-panama-6-5-preve-ligera-recuperacion-octubre,Sostiene que la contracción del PIB es consecuencia de las medidas implementadas para enfrentar la pandemia de la enfermedad por coronavirus en el país y en el mundo,07-10-2020 19:26,https://www.bing.com/th?id=OVFT.2Wf_O-b1SHbG_dWIsA6aqy,Panamá,laestrella.com.pa
Trump sin síntomas de la Covid-19 desde hace 24 horas ni fiebre desde hace 4 días,https://www.prensa.com/mundo/trump-sin-sintomas-de-la-covid-19-desde-hace-24-horas-ni-fiebre-desde-hace-4-dias/,"El presidente de Estados Unidos, Donald Trump, no tiene síntomas de Covid-19 desde hace 24 horas ni fiebre desde hace cuatro días, informó este miércoles su médico en un",07-10-2020 19:35,https://www.bing.com/th?id=OVFT.izjnM4rHp2pXETq_bI9GaC,Panamá,prensa.com
Panamá ha recibido de EEUU $5.5 millones en donaciones para combatir la covid-19,https://www.laestrella.com.pa/nacional/201007/panama-recibe-eeuu-5-5-millones-donaciones-combatir-covid-19,"En los últimos tres meses, el gobierno de Estados Unidos ha donado a Panamá $5.5 millones en insumos para combatir la covid-19. La cifra fue revelada este miércoles en un comunicado de prensa enviado",07-10-2020 19:55,https://www.bing.com/th?id=OVFT.ZuRJx0eYi8B4I-a30uNGay,Panamá,laestrella.com.pa
Centro penitenciario de Las Tablas sin casos de Covid-19,https://ensegundos.com.pa/2020/10/07/centro-penitenciario-de-las-tablas-sin-casos-de-covid-19/,"Hoy, los 66 reclusos, quienes se encontraban en el gimnasio auditorio de Las Tablas fueron trasladados nuevamente al penal tras su recuperación. El Ministerio de Gobierno informó este miércoles 7 de o",07-10-2020 20:34,https://www.bing.com/th?id=OVFT.CNelhIEKSCxdcKqVzZUePy,Panamá,En Segundos
Panamá y EEUU activan fuerza de tarea conjunta para combatir el lavado de dinero,https://www.critica.com.pa/nacional/panama-y-eeuu-activan-fuerza-de-tarea-conjunta-para-combatir-el-lavado-de-dinero-589520,"Thomas Ulrich se reunió con los ministros de Relaciones Exteriores, de Economía y Finanzas y del Canal de Panamá, además del viceministro de Seguridad, ""para conversar sobre cooperación bilateral, ges",07-10-2020 20:52,https://www.bing.com/th?id=OVFT.PgECNFTk03GhP8DdoDtMyC,Panamá,Critica
Ramal de la línea 2 de Metro Panamá avanza un 44%,https://noticias24pty.com/ramal-de-la-linea-2-de-metro-panama-avanza-un-44/,"El ramal de la línea 2 de Metro Panamá, que llega hasta el aeropuerto internacional de Tocumen, el principal del país y centro de conexiones regional, registra un avance global de 44 % y se espera",07-10-2020 21:09,https://www.bing.com/th?id=OVFT.d-8Y_ECVXlRAz5u0ZraXQy,Panamá,Noticias 24 PTY
Ramal del metro que llega al principal aeropuerto de Panamá avanza un 44%,http://elsiglo.com.pa/panama/ramal-metro-llega-principal-aeropuerto-panama-avanza-44/24165506,"Las obras estuvieron congeladas desde que comenzó la pandemia de la COVID-19 en Panamá,  y fueron reactivadas el pasado 29 de junio",07-10-2020 21:44,https://www.bing.com/th?id=OVFT.vu-StWWPXneBYhCmVtwFyC,Panamá,El Siglo
CSS logra acuerdo con FCC para crear instalaciones COVID en el proyecto Ciudad de la Salud,https://www.radiopanama.com.pa/noticias/actualidad/css-logra-acuerdo-con-fcc-para-crear-instalaciones-covid-en-el-proyecto-ciudad-de-la-salud/20201007/nota/4075985.aspx,"Mientras tanto, y luego de varios meses de conversaciones, la institución logró la autorización para habilitar espacios para la atención de pacientes con COVID-19 en uno de los edificios. Las autoridades de la Caja de Seguro Social aspiran a instalar ...",07-10-2020 21:48,https://www.bing.com/th?id=OVFT.U5aKDYpkHePXVNpXvKWW7y,Panamá,Radio Panamá
Panamá se mantiene vigilante de proceso para el desarrollo de vacuna segura contra el COVID-19,https://www.radiopanama.com.pa/noticias/actualidad/panama-se-mantiene-vigilante-de-proceso-para-el-desarrollo-de-vacuna-segura-contra-el-covid19/20201007/nota/4075998.aspx,Panamá se ha sumado al mecanismo COVAX el cual le permitiría estar entre los primeros países en tener acceso a una vacuna licenciada,07-10-2020 22:04,https://www.bing.com/th?id=OVFT.U5aKDYpkHePXVNpXvKWW7y,Panamá,Radio Panamá
Diputado Vásquez cuestiona aumentos que se registran mes tras mes en la planilla estatal,https://www.tvn-2.com/economia/economia-panamena/Vasquez-aumentos-registran-mes-planilla_0_5688181200.html,"El diputado independiente, Juan Diego Vásquez, salió al paso de los considerables aumentos que se realizan en la planilla estatal, pese a golpeada realidad económica que enfrenta el país a causa de la",07-10-2020 22:14,https://www.bing.com/th?id=OVFT.C_e-YoJJkztEUgf0QgK2YC,Panamá,TVN
