name,url,description,datePublished,imagen,pais,Fuente
"Prevención: arma eficaz para evitar ITS, indican autoridades de Salud",https://sertv.gob.pa/nacionalfm/prevencion-arma-eficaz-para-evitar-its-indican-autoridades-de-salud/,"Como parte de las acciones de prevención emprendidas por personal de la Dirección de Promoción de la Salud del Ministerio de Salud (MINSA), este viernes se realizó una jornada de distribución de prese",13-02-2021 00:21,https://www.bing.com/th?id=OVFT.NiAhZDk0riiolyUYtrZu1S,Panamá,SERTV
"Minsa reporta 330,985 casos acumulados de covid-19 y 5,595 decesos en Panamá",https://www.panamaamerica.com.pa/sociedad/minsa-reporta-330985-casos-acumulados-covid-19-5595-decesos-en-panama-1181392,"El Ministerio de Salud (Minsa) anunció que hoy los casos acumulados de coronavirus aumentaron a 330,985 en Panamá, luego que se reportaron 910 casos positivos nuevos en 24 horas.El total de decesos po",13-02-2021 00:38,https://www.bing.com/th?id=OVFT.EsIL44hJ_3lC-eABTepiiy,Panamá,panamaamerica.com.pa
EE.UU. analiza obtener 200 millones de dosis adicionales de vacunas,https://www.radiopanama.com.pa/noticias/internacional/eeuu-analiza-obtener-200-millones-de-dosis-adicionales-de-vacunas/20210212/nota/4109426.aspx,"El gobierno de Estados Unidos analiza obtener 200 millones de dosis adicionales de vacunas, con el propósito de inocular a la mayor parte de las regiones en donde el virus cobrado miles de vidas. El p",13-02-2021 01:02,https://www.bing.com/th?id=OVFT.U5aKDYpkHePXVNpXvKWW7y,Panamá,Radio Panamá
Selección femenina de Panamá en la recta final de su preparación,https://www.tvmax-9.com/somoslasele/Seleccion-femenina-Panama-recta-preparacion_0_5784171628.html,La selección mayor femenina entró en la recta final de su preparación con miras a los partidos amistosos de la próxima semana ante Guatemala.,13-02-2021 03:18,https://www.bing.com/th?id=OVFT.mJn8RGVfFv_R0hi5HQqwby,Panamá,TVMAX
"Coronavirus: 3,967 muertes entre grupos vulnerables",https://www.prensa.com/impresa/panorama/coronavirus-3-967-muertes-entre-grupos-vulnerables/,"A algunos más que otros, la Covid-19 impacta a poblaciones vulnerables como niños, adultos mayores, mujeres embarazadas o",13-02-2021 04:00,https://www.bing.com/th?id=OVFT.LfYa7ASYXfzpRPx-_5F-by,Panamá,prensa.com
Panamá - Costa Rica,http://elsiglo.com.pa/tag/panama-costa-rica/12586,7:53 p.m. El presidente de Chile recibe la primera dosis de la vacuna china Sinovac ; 7:32 p.m. Panamá y Costa Rica realizaron una reunión binacional ; 12/02/2021 - 6:53 p.m. In,13-02-2021 05:02,https://www.bing.com/th?id=OVFT.ZX4nrkPyl4ckT2kGIJ12bC,Panamá,El Siglo
Contagio del Covid-19 registra una de las menores tasa a lo largo de pandemia,https://www.critica.com.pa/nacional/contagio-del-covid-19-registra-una-de-las-menores-tasa-lo-largo-de-pandemia-598263,"Panamá registró ayer uno de los porcentajes más bajos de contagio durante la pandemia del Covid-19 al reportar 7. 8% al aplicar 11,625 pruebas. Ayer se reportaron",13-02-2021 05:15,https://www.bing.com/th?id=OVFT.8tqsSlEJ6Gki3DgBmqJZKC,Panamá,Critica
Panamá llega a 5.595 muertes por la covid-19 y a 330.985 contagios,https://www.midiario.com/nacionales/panama-llega-a-5595-muertes-por-la-covid-19-y-a-330985-contagios/,"Panamá sumó este viernes 23 nuevas muertes por la covid-19 y 910 casos, para llegar a un acumulado de 5.595 fallecimientos y 330.985 contagios confirmados en 11 meses de pandemia, informó el Ministeri",13-02-2021 05:32,https://www.bing.com/th?id=OVFT.DWZDvx2OYfgSDBkc28haEy,Panamá,Mi Diario
OMS advierte que personas vacunadas contra Covid-19 pueden contagiar a otras,https://www.midiario.com/salud/oms-advierte-que-personas-vacunadas-contra-covid-19-pueden-contagiar-a-otras/,"La científica jefe de la Organización Mundial de la Salud (OMS), Soumya Swaminathan, advirtió este viernes en rueda de prensa de que algunas personas vacunadas contra la covid-19 aún pueden contraer e",13-02-2021 12:01,https://www.bing.com/th?id=OVFT.FJJS06lQcJWPSKwrQFP_Di,Panamá,Mi Diario
Covid-19 test positivity rate falls to 7.8%,https://newsroompanama.com/health/covid-19-test-positivity-rate-falls-to-78-1,"The positivity rate of 11,625 covid-19 tests, conducted on Friday February 2 fell to 7.8% reports The Ministry of Health (Minsa), According to the Ministry,",13-02-2021 17:48,https://www.bing.com/th?id=OVFT.QbUmr1Qahc52LuHJtTNQ0C,Panamá,Newsroom Panama
Panamá negocia de forma virtual el suministro de la vacuna rusa Sputnik V,https://www.tvn-2.com/nacionales/Panama-negocia-virtual-suministro-Sputnik_0_5784921491.html,La Embajada de Rusia en Panamá confirmó que el Ministerio de Salud (Minsa) y el Fondo Ruso de Inversión Directa se encuentra haciendo negociaciones en formato virtual sobre el suministro de vacunas co,13-02-2021 19:18,https://www.bing.com/th?id=OVFT.blfVzk3lQT6YomnBTUF7FS,Panamá,TVN
El Gobierno ha invertido más de $190 millones en el programa Panamá Solidario,https://www.laestrella.com.pa/economia/210213/gobierno-invertido-190-millones-programa-panama-solidario,"De esa cifra, $108 millones han sido destinado a la adquisición de producción nacional, $29 millones a la agroindustria y $44 millones a la compra de productos secos de comercio",13-02-2021 19:56,https://www.bing.com/th?id=OVFT.39cJbTu4SC-w7IlTP3fiCy,Panamá,laestrella.com.pa
Covid-19 deja 23 muertes en las últimas 24 horas; casos activos disminuyen,https://www.prensa.com/sociedad/covid-19-deja-23-muertes-en-las-ultimas-24-horas-casos-activos-disminuyen/,"A 331,692 se incrementaron los casos acumulados de la Covid-19 en Panamá, luego de que este sábado 13 de febrero se registraran 707 nuevos",13-02-2021 21:45,https://www.bing.com/th?id=OVFT.NKVq-deCAYrJQGHTapx2Oy,Panamá,prensa.com
Naves del servicio interior podrán operar solo al 60% de su capacidad,https://ensegundos.com.pa/2021/02/13/naves-del-servicio-interior-podran-operar-solo-al-60-de-su-capacidad/,"Autoridades buscan reducir los riesgos de contagios de coronavirus. La Autoridad Marítima de Panamá (AMP), dio a conocer que las naves del servicio interior panameño solo podrán operar al 60% de su ca",13-02-2021 22:22,https://www.bing.com/th?id=OVFT.922QiIozI9A0FEV5-3CqGS,Panamá,En Segundos
"Panamá contabiliza un total de 331,692 casos de COVID-19 y acumula 5,621 fallecimientos",https://www.telemetro.com/nacionales/2021/02/13/panama-casos-covid-19-acumula/3746413.html,"El Ministerio de Salud (Minsa) informó que para este sábado 13 de febrero en Panamá se contabilizan un total de 331,692 casos acumulados de la COVID-19, de los cuales 707 son nuevos contagios registra",13-02-2021 22:35,https://www.bing.com/th?id=OVFT.lBNDtVMmyuSMAZqCdHiuky,Panamá,Telemetro
"Casos de COVID-19 en Panamá aumentan a 331,692 y contabiliza 5,621 fallecimientos",https://www.telemetro.com/nacionales/2021/02/13/casos-covid-19-panama-aumentan/3746413.html,"El Ministerio de Salud (Minsa) informó que para este sábado 13 de febrero en Panamá se contabilizan un total de 331,692 casos acumulados de la COVID-19, de los cuales 707 son nuevos contagios registra",13-02-2021 22:35,https://www.bing.com/th?id=OVFT.lBNDtVMmyuSMAZqCdHiuky,Panamá,Telemetro
Panamá reporta 707 casos nuevos de la covid-19 y 23 nuevas defunciones,https://www.laestrella.com.pa/nacional/210213/panama-reporta-707-casos-nuevos-covid-19-23-nuevas-defunciones,"Para hoy sábado 13 de febrero 2021 en Panamá se contabilizan 309,296 pacientes recuperados. Los casos activos han disminuido y al día de hoy suman 16,775",13-02-2021 22:43,https://www.bing.com/th?id=OVFT.Ld4BL1AMi4g7RhyiEFZj8y,Panamá,laestrella.com.pa
Panamá reporta 23 muertes más por Covid-19 y 707 nuevos casos,https://ensegundos.com.pa/2021/02/13/panama-reporta-23-muertes-mas-por-covid-19-y-707-nuevos-casos/,"Con 2,662 nuevos pacientes recuperados del virus, el total de los que vencieron la enfermedad desde el inicio de la pandemia es de 309,296. El Ministerio de Salud (Minsa) en su informe epidemiológico",13-02-2021 22:58,https://www.bing.com/th?id=OVFT.1BLV_at7Ix_T7O6VPsi_ri,Panamá,En Segundos
Panamá contabiliza 707 casos nuevos de Covid-19,https://www.metrolibre.com/nacionales/194082-panam%C3%A1-contabiliza-707-casos-nuevos-de-covid-19.html,"El Ministerio de Salud (Minsa) informó que en Panamá se contabiliza 707 nuevos contagios de coronavirus, elevando a 331,692 los casos acumulados desde la primera detección de un paciente en marzo de 2",13-02-2021 23:34,https://www.bing.com/th?id=OVFT.9dkrymC7HZxEd2IHqW0tNS,Panamá,Metro Libre
Minsa reporta 26 fallecidos y 707 casos nuevos,https://www.critica.com.pa/nacional/minsa-reporta-26-fallecidos-y-707-casos-nuevos-598303,"Los casos activos suman 16,775. Y, hay 14,905 pacientes en casa y 412 en hoteles. Se reportan 1,262 pacientes en sala y 196 en UCI.",13-02-2021 23:55,https://www.bing.com/th?id=OVFT._9Hpuo3hV_uNXbDbVFHeNS,Panamá,Critica
Disminuye la cantidad de personas que buscan hisoparse,https://www.tvn-2.com/nacionales/Disminuye-cantidad-personas-buscan-hisoparse_0_5784921526.html,"La curva de contagios por COVID-19 ha disminuido en las últimas semanas, tras el confinamiento. Sin embargo, no se puede bajar la guardia porque se podrían dar nuevas reinfecciones.",14-02-2021 00:14,https://www.bing.com/th?id=OVFT.SzDSnCCG6geZ4LvkH3o3hC,Panamá,TVN
