name,url,description,datePublished,imagen,pais,Fuente
"Covid-19: 38 muertos y nuevo récord de 52,114 casos activos",https://www.critica.com.pa/nacional/covid-19-38-muertos-y-nuevo-record-de-52114-casos-activos-595796,"El Covid-19 cobró ayer en Panamá la vida de 38 personas y aumentó a 4,321 el número de fallecidos a lo largo de la pandemia. El",08-01-2021 05:06,https://www.bing.com/th?id=OVFT.vQmtQ8TuEF4dAtVisyrEpy,Panamá,Critica
Juzgados siguen afectados por contagios de la Covid-19,https://noticias24pty.com/juzgados-siguen-afectados-por-contagios-de-la-covid-19/,"Además de la suspensión de los términos judiciales en las provincias de Panamá y Panamá Oeste, a raíz del repunte de los contagios de Covid-19, la Corte Suprema de Justicia aplicó la misma medida",08-01-2021 08:48,https://www.bing.com/th?id=OVFT.yFCtpGc8FL5oIcQdRn-Uzy,Panamá,Noticias 24 PTY
"En Panamá, veintiún bultos de presunta mercancía falsificada son retenidos por personal aduanero, en Aeropuerto Internacional de Tocumen",https://sertv.gob.pa/nacionalfm/en-panama-veintiun-bultos-de-presunta-mercancia-falsificada-son-retenidos-por-personal-aduanero-en-aeropuerto-internacional-de-tocumen/,Veintiún bultos con mercancía de presunta falsificación fueron retenidos por unidades de la Dirección de Prevención y Fiscalización Aduanera (D.P.F.A.) de la Zona Aeroportuaria en una acción coordinad,08-01-2021 12:03,https://www.bing.com/th?id=OVFT.NypFfSRRbRGEadMLPsyZgi,Panamá,SERTV
El 35% del total de casos de covid-19 registrados en Panamá se han presentado en diciembre y lo que va de enero,https://www.panamaamerica.com.pa/sociedad/35-del-total-casos-covid-19-registrados-en-panama-se-han-presentado-en-diciembre-lo-que-va,"Entre diciembre de 2020 y los primeros siete días de enero de 2021 se han contabilizado en Panamá 103,285 casos de covid-19 del total de 269,091 casos acumulados, los que representa el 35% de la total",08-01-2021 13:31,https://www.bing.com/th?id=OVFT.P4tLKO9fXIqPnd7ZX6zutS,Panamá,panamaamerica.com.pa
Minsa valida formulario de vacunación contra el COVID-19 que circula en redes,https://www.diaadia.com.pa/el-pais/minsa-valida-formulario-de-vacunacion-contra-el-covid-19-que-circula-en-redes-374146,"Desde tempranas horas de este martes 5 de enero de 2021, ha circulado un formulario para aplicar a la colocación de vacunas contra el coronavirus. Ante la incertidumbre algunos usuarios lo catalogaron",08-01-2021 13:35,https://www.bing.com/th?id=OVFT.2edQ1hlOpQC00RcVgnh45y,Panamá,Día a Día
Los extranjeros en Panamá podrán vacunarse contra la covid-19,https://www.laestrella.com.pa/nacional/210108/extranjeros-panama-podran-vacunarse-covid-19,"El director de la región metropolitana de Salud, Israel Cedeño, aseguró que Programa Ampliado de Inmunización no discrimina nacionalidades",08-01-2021 14:24,https://www.bing.com/th?id=OVFT.pksvPCYqiYb_FKOHINXwQC,Panamá,laestrella.com.pa
"Panamá ha hecho pagos a Pfizer, Covax y AstraZeneca para vacuna contra COVID-19",https://www.telemetro.com/nacionales/2021/01/08/panama-hecho-pagos-pfizer-covax/3620650.html,"El ministro de Salud de Panamá, Luis Sucre, confirmó que ya han hecho pagos a tres proveedores de vacunas contra COVID-19.",08-01-2021 14:25,https://www.bing.com/th?id=OVFT.yTTNM9-8joR6DeHeeoQFvi,Panamá,Telemetro
Unión Europea duplica demanda de dosis a Pfizer/BioNTech,https://www.prensa.com/mundo/union-europea-duplica-demanda-de-dosis-a-pfizerbiontech/,"La Unión Europea (UE) anunció este viernes que duplicó su demanda de dosis la vacuna de Pfizer/BioNTech contra la Covid-19, y realizará el 21 de enero una cumbre virtual para discutir la coordinación",08-01-2021 14:35,https://www.bing.com/th?id=OVFT.KR3L3puUyk1Wk-YjQTIITy,Panamá,prensa.com
"Tranquilos. Nadie, ni los extranjeros, se quedarán por fuera en la aplicación de la vacuna contra la covid-19, asegura ministro",https://www.midiario.com/salud/tranquilos-nadie-ni-los-extranjeros-se-quedaran-por-fuera-en-la-aplicacion-de-la-vacuna-contra-la-covid-19-asegura-ministro/,"El Ministro de Salud, Lu is Francisco Sucr e, aseguró la mañana de este viernes, 8 de enero, que nadie se quedará por fuera en cuanto a la aplicación de la vacuna contra la covid-19 en",08-01-2021 15:19,https://www.bing.com/th?id=OVFT.Sqmd3kXGXcrTNOhU__3D-C,Panamá,Mi Diario
Ministro Sucre: hospitales en la capital tienen pocas camas para pacientes con Covid-19,https://www.metrolibre.com/nacionales/190998-ministro-sucre-hospitales-en-la-capital-tienen-pocas-camas-para-pacientes-con-covid-19.html,"Los hospitales en la capital están en una situación difícil, en cuanto a la capacidad de camas para pacientes con Covid-19, informó el ministro de Salud Luis Francisco Sucre. “A nivel nacional tenemos",08-01-2021 16:04,https://www.bing.com/th?id=OVFT.X89CvGx5n2xdtUo9-AY8hi,Panamá,Metro Libre
"Extranjeros en Panamá podrán aplicarse la vacuna contra COVID-19, ""el PAI no discrimina""",https://www.telemetro.com/nacionales/2021/01/08/extranjeros-panama-entraran-proceso-vacunacion/3620995.html,"El Dr. Israel Cedeño, director de la región Metropolitana de Salud afirmó este viernes que el Programa Ampliado de Inmunización (PAI), lleva adelante el plan de inoculación de la vacuna contra COVID-1",08-01-2021 16:36,https://www.bing.com/th?id=OVFT.jdqFzeMU9IUuZmlEQrDMxy,Panamá,Telemetro
"Apertura de actividades económicas en Panamá y Panamá Oeste será gradual, y cerco sanitario se mantendrá",https://www.panamaamerica.com.pa/economia/apertura-actividades-economicas-en-panama-panama-oeste-sera-gradual-cerco-sanitario-se,"El ministro de Salud, Luis Francisco Sucre informó que la reactivación de actividades económicas en las provincias de Panamá y Panamá Oeste, una vez culminada la cuarentena, será gradualExplicó que: “",08-01-2021 17:20,https://www.bing.com/th?id=OVFT.3Sbgp42lgLNRXa1KPht4aS,Panamá,panamaamerica.com.pa
BHN recaudó más de $9 millones en pago de hipotecas en 2020,https://www.laestrella.com.pa/economia/210108/bhn-recaudo-9-millones-pago-hipotecas-2020,"Durante el 2020, el Banco Hipotecario Nacional (BHN) recaudó un total de $9,027,759 en concepto de pago de hipotecas en el territorio nacional, informó la entidad este viernes mediante un comunicado d",08-01-2021 17:50,https://www.bing.com/th?id=OVFT.LXzONj-1MLrZYYKDsXyR7y,Panamá,laestrella.com.pa
OMS insta a los países a cesar los 'acuerdos bilaterales' con laboratorios para vacuna contra COVID-19,https://www.tvn-2.com/mundo/OMS-acuerdos-bilaterales-laboratorios-COVID-19_0_5757924210.html,"La Organización Mundial de la Salud (OMS) reclamó este viernes más solidaridad en la lucha contra el covid-19 y pidió a los países ricos que dejen de cerrar ""acuerdos bilaterales"" con los laboratorios",08-01-2021 17:53,https://www.bing.com/th?id=OVFT.KQpB82rWpD0aTGaKzzsKmC,Panamá,TVN
Panamá ha realizado pagos a tres proveedores de vacunas contra el Covid-19,https://www.metrolibre.com/nacionales/191013-panam%C3%A1-ha-realizado-pagos-tres-proveedores-de-vacunas-contra-el-covid-19.html,"“Ya tanto a Pfizer como a AstraZeneca y a Covax ya se le han hecho pagos, o sea, que ya se han firmado los pagos”, informó este viernes, 8 de enero, el ministro de Salud Luis Francisco Sucre. Con resp",08-01-2021 18:22,https://www.bing.com/th?id=OVFT.VZjxZtdzhRnBs0ZioJxsYC,Panamá,Metro Libre
Gorgas actualizó la lista de laboratorios para pruebas del Covid-19,https://ensegundos.com.pa/2021/01/08/gorgas-actualizo-la-lista-de-laboratorios-para-pruebas-del-covid-19/,"De los laboratorios actualizados, 20 están ubicados en la provincia de Panamá; tres en Colón; cuatro en Chiriquí y uno en las provincias de Panamá Oeste, Veraguas, Coclé, Herrera, Darién y Los Santos.",08-01-2021 18:39,https://www.bing.com/th?id=OVFT.8duowiZg1hy04_hj19LoUy,Panamá,En Segundos
Biden denuncia como una ‘farsa’ distribución de vacunas de la Covid-19 en Estados Unidos,https://www.prensa.com/mundo/biden-denuncia-como-una-farsa-distribucion-de-vacunas-de-la-covid-19-en-estados-unidos/,"El presidente electo de Estados Unidos, Joe Biden, criticó este viernes la distribución de las vacunas contra la Covid-19 por parte del gobierno de Donald Trump, asegurando que ha sido una",08-01-2021 19:19,https://www.bing.com/th?id=OVFT.FVUlyjjew9VDSP_Qi4yQYS,Panamá,prensa.com
"Hospitales campañas se preparan para la atención de pacientes, en Panamá",https://sertv.gob.pa/nacionalfm/hospitales-campanas-se-preparan-para-la-atencion-de-pacientes-en-panama/,"El sistema sanitario en Panamá, cuenta actualmente, con siete hospitales campañas en apoyo a las instalaciones existentes, este paliativo reconocido a nivel mundial por la Organización Mundial de la S",08-01-2021 19:42,https://www.bing.com/th?id=OVFT.enHy1XFSeL1uE5NDPo20RS,Panamá,SERTV
"Biden denuncia como una ""farsa"" distribución de vacunas de covid-19 en EE.UU.",https://ensegundos.com.pa/2021/01/08/biden-denuncia-como-una-farsa-distribucion-de-vacunas-de-covid-19-en-ee-uu/,"La distribución de las vacunas será ""el mayor reto operacional que enfrentaremos jamás como una nación"", aseguró el presidente electo que será investido en 12 días. El presidente electo de Estados Uni",08-01-2021 20:11,https://www.bing.com/th?id=OVFT.9dWBlFzto_nEqzRlYtZSJi,Panamá,En Segundos
"Panamá supera los 5,100 nuevos casos de Covid-19 en un día y se reportan 45 defunciones",https://noticias24pty.com/panama-supera-los-5100-nuevos-casos-de-covid-19-en-un-dia-y-se-reportan-45-defunciones/,"El Ministerio de Salud (Minsa) informó este miércoles, 6 de enero, que se reportan 5,186 nuevos casos en las últimas 24 horas, tras la aplicación de 19,830 pruebas (26% de positividad). El total",08-01-2021 20:40,https://www.bing.com/th?id=OVFT.LJWILgccf-8S43BqOL5SHC,Panamá,Noticias 24 PTY
Evalúan adecuar sala de hemodiálisis para pacientes COVID-19 en el ITSE,https://www.diaadia.com.pa/el-pais/evaluan-adecuar-sala-de-hemodialisis-para-pacientes-covid-19-en-el-itse-374258,"La mañana de este viernes el Ministro de Salud Luis Francisco Sucre, anunció que se evalúa la posibilidad de adecuar una sala para pacientes COVID-19 que necesiten hemodiálisis en el Institu",08-01-2021 20:48,https://www.bing.com/th?id=OVFT.nI02khmNo1CpbU8XfAuQyC,Panamá,Día a Día
Municipios del Oeste piden subsidio,https://www.critica.com.pa/sucesos/municipios-del-oeste-piden-subsidio-595834,"Rolly Rodríguez, alcalde del distrito de Arraiján, confirmó que el déficit presupuestario en el año 2020 alcanzó los 4 millones de dólares.",08-01-2021 21:30,https://www.bing.com/th?id=OVFT.amlgOKqkNSHgoVqp8SiNKS,Panamá,Critica
"ANEP lamenta el deceso de una de sus agremiadas, ya suman 8 las enfermeras fallecidas por Covid-19",https://www.tvn-2.com/nacionales/Anep-agremiadas-enfermeras-fallecidas-Covid_0_5757924242.html,"Este viernes 8 de enero, la Asociación de Enfermeras de Panamá (ANEP), dio a conocer el deceso de una de sus colegas, la licenciada Graciela Sanjur, quien laboraba en el Hospital Santo Tomás.",08-01-2021 22:06,https://www.bing.com/th?id=OVFT.Fs5ay2rX_Sp89_ZtWced2C,Panamá,TVN
