name,url,description,datePublished,imagen,pais,Fuente
La CCIAP manifiesta su preocupación ante posible rebrote de COVID-19 en Panamá,https://www.telemetro.com/nacionales/2020/11/03/la-cciap-manifiesta-su-preocupacion-ante-posible-rebrote-de-covid-19-en-panama/3416655.html,"Noviembre y diciembre son tiempos desafiantes para el Ministerio de Salud, pues se indica que podríamos pasar Navidad y Año Nuevo en confinamiento por rebrotes de coronavirus, este escenario y su efec",03-11-2020 01:11,https://www.bing.com/th?id=OVFT.pku6mTDuhYdlHfZhS4xeqi,Panamá,Telemetro
AstraZeneca estima distribuir la vacuna de la COVID-19 a finales de marzo,https://lagacetadepanama.com/astrazeneca-estima-distribuir-la-vacuna-de-la-covid-19-a-finales-de-marzo/,"La distribución de la vacuna de la COVID-19 podría estar «en fase avanzada» a finales de marzo de 2021, según estimaciones de la empresa farmacéutica AstraZeneca, encargada de proveer a la Unión Europ",03-11-2020 01:20,https://www.bing.com/th?id=OVFT.8ilhI7jBfdy9HJpuf-5PGy,Panamá,La Gaceta de Panama
"Presidente Cortizo entra en aislamiento, luego que un colaborador cercano dio positivo por COVID-19",https://lagacetadepanama.com/presidente-cortizo-entra-en-aislamiento-luego-que-un-colaborador-cercano-dio-positivo-por-covid-19/,"La Presidencia de la República anunció la noche de este lunes (02.11.2020), que el mandatario Laurentino Cortizo no participará de los actos del 3 y 4 de noviembre, luego que un colaborador cercano fu",03-11-2020 01:41,https://www.bing.com/th?id=OVFT.SyQvvxj7vFI81sVnMvLidC,Panamá,La Gaceta de Panama
Ministro Sucre insiste en que las pruebas de la Covid-19 se pueden realizar de forma obligatoria,https://www.prensa.com/sociedad/ministro-sucre-insiste-que-las-pruebas-de-la-covid-19-se-pueden-realizar-de-forma-obligatoria/,"El ministro de Salud, Luis Francisco Sucre, declaró la noche de este lunes 2 de noviembre que las pruebas para detectar la Covid-19 se pueden realizar de “manera obligatoria” porque en el país se vive",03-11-2020 01:56,https://www.bing.com/th?id=OVFT.LU4e9Pcm0UgoLXBkrF7PlC,Panamá,prensa.com
Así evoluciona el COVID-19 en Panamá,https://www.telemetro.com/nacionales/2020/11/03/asi-evoluciona-el-covid-19-en-panama/3416728.html,"Panamá alcanzó para este lunes 2 de noviembre la cifra acumulada de 134,915 casos de coronavirus, luego de registrar un total de 579 nuevos contagios en las últimas 24 horas. Este lunes el país contab",03-11-2020 01:59,https://www.bing.com/th?id=OVFT.8nA2ONvgWbKojkrYzcfCNC,Panamá,Telemetro
Covid-19 en Panamá: 579 casos nuevos y 14 defunciones,https://www.laestrella.com.pa/nacional/201102/covid-19-panama-579-casos-nuevos-14-defunciones,"Panamá reportó 579 casos nuevos de la covid-19, para un total acumulado de 134,915. A la fecha se aplicaron 4,613 pruebas, para un porcentaje de positividad de 12.6% y se han registrado 14 nuevas defu",03-11-2020 02:12,https://www.bing.com/th?id=OVFT.IDi-F5LKaMBxwbALz9w2qS,Panamá,laestrella.com.pa
"Presidente de Panamá en aislamiento, colaborador cercano dio positivo por covid-19",https://www.laestrella.com.pa/nacional/201102/presidente-panama-cuarentena-colaborador-cercano-dio-positivo-covid-19,"Cortizo estuvo ausente en la eucaristía de este 2 de noviembre, en conmemoración del Día de los Difuntos, en la Catedral Santa María La Antigua",03-11-2020 04:04,https://www.bing.com/th?id=OVFT.FiRhGtsQG1trliCVbv3eVi,Panamá,laestrella.com.pa
Día 239: 579 nuevos casos de covid-19 y 14 muertes,https://www.midiario.com/nacionales/dia-239-579-nuevos-casos-de-covid-19-y-14-muertes/,El Ministerio de Salud informó que se detectaron 579 nuevos casos de coronavirus en Panamá y la muerte de 14 personas por la,03-11-2020 04:27,https://www.bing.com/th?id=OVFT.WZh8C3t5vSCG4A11a0tTwi,Panamá,Mi Diario
Panamá está en una meseta de alta transmisión del nuevo coronavirus,https://www.prensa.com/impresa/panorama/panama-esta-en-una-meseta-de-alta-transmision-del-nuevo-coronavirus/,"Los datos epidemiológicos del Ministerio de Salud (Minsa) muestran que Panamá tiene poco avance en las últimas semanas en el descenso diario del número de casos de la enfermedad Covid-19, pues la sema",03-11-2020 05:00,https://www.bing.com/th?id=OVFT.yg7wMhEHo3uLx1rvcTNtni,Panamá,prensa.com
Panamá podría enfrentar rebrote de covid-19 a partir del 15 de noviembre,http://elsiglo.com.pa/panama/panama-podria-enfrentar-rebrote-covid-19-partir-15-noviembre/24167200,"Lo importante será que las medidas básicas de prevención de la enfermedad, como uso de mascarillas Un repunte de los casos por la covid-19 se podría registrar en los próximos días, advirtió este lunes",03-11-2020 05:05,https://www.bing.com/th?id=OVFT.cE3v4r4WKKDWcKDt6W06ii,Panamá,El Siglo
Marathón y Antigua por el pase a la siguiente ronda de la Liga Concacaf,https://www.cableondasports.com/futbol/internacional/marathon-y-antigua-por-el-pase-a-la-siguiente-ronda-de-la-liga-concacaf_0_399419/,"Tegucigalpa, 2 nov (EFE).- El Marathón, de Honduras, y el Antigua, de Guatemala, se enfrentarán este martes en un único partido de octavos de final",03-11-2020 07:54,https://www.bing.com/th?id=OVFT.DHdPra1hvYVbCL76kbVXKC,Panamá,Cable Onda Sports
Chiriquí y Bocas del Toro reanudan la serie final del campeonato mayor,https://www.diaadia.com.pa/deportes/chiriqui-y-bocas-del-toro-reanudan-la-serie-final-del-campeonato-mayor-372047,"Después de que la lluvia no dejara desarrollar las acciones del segundo partido más allá de la tercera entrada de la serie final entre Bocas del Toro y Chiriquí, la Federación Panameña de Béisbo",03-11-2020 08:02,https://www.bing.com/th?id=OVFT.jZR8fOtMc8mYQn1bYCfDVC,Panamá,Día a Día
Belarmino Campos está orgulloso de ser el Jugador Más Valioso,https://www.diaadia.com.pa/deportes/belarmino-campos-esta-orgulloso-de-ser-el-jugador-mas-valioso-372046,"Aunque sabía que estaba en la jugada, el pelotero santeño Belarmino Campos confesó que no dejó de sorprenderle haber ganado el premio al Jugador Más Valioso del Campeonato Nacional de Béisbol 20",03-11-2020 08:23,https://www.bing.com/th?id=OVFT.sML2_i5yIDBke6CjrgVnSC,Panamá,Día a Día
EDITORIAL: Para prevenir un rebrote,https://www.metrolibre.com/editorial/185929-editorial-para-prevenir-un-rebrote.html,"Frente a lo que está ocurriendo en Europa, Panamá tiene que estar preparada para enfrentar una segunda ola del virus de coronavirus. La apertura económica trae consigo el riesgo a contagios si los ciu",03-11-2020 10:20,https://www.bing.com/th?id=OVFT.D2Vx4EdlHNFW-Z8G4sMlKy,Panamá,Metro Libre
Reportan 738 nuevos casos de COVID-19; fallecieron 6 en las últimas horas,https://www.tvn-2.com/nacionales/Casos-COVID-19-Panama-alcanzan-fallecieron_0_5706929312.html,"Este domingo 1 de noviembre se confirmaron 6 decesos y 738 casos nuevos de la COVID-19. Del 9 de marzo a la fecha, el Sistema de Vigilancia Epidemiológica cuantifica 134,336 contagiados, de los cuales",03-11-2020 10:40,https://www.bing.com/th?id=OVFT.wjUhq820J1JCUA6UjrDJmS,Panamá,TVN
Bocas del Toro y Chiriquí continúan la lucha por el título en Las Tablas,https://www.tvmax-9.com/beisbolnacional/Bocas-Toro-Chiriqui-continuan-Tablas_0_5707679271.html,"Bocas del Toro y Chiriquí reanudan hostilidades este martes para el segundo partido de la Serie Final del 77 Campeonato Nacional de Béisbol Mayor, el que pospuesto por lluvia el domingo pasado. La pos",03-11-2020 13:03,https://www.bing.com/th?id=OVFT.DK43Zn4I5cqxfdeED7kCzC,Panamá,TVMAX
Realizan actos protocolares del 3 de noviembre,http://elsiglo.com.pa/panama/realizan-actos-protocolares-3-noviembre/24167224,"Este martes 3 de noviembre, como cada año, se realizaron los actos conmemorativos de la separación Panamá de Colombia. En esta oportunidad se llevaron a cabo con pocas personas de público y con estric",03-11-2020 13:16,https://www.bing.com/th?id=OVFT.lkvbbui5OBvpp9v1-vouaC,Panamá,El Siglo
"Lourdes Moreno: 'Demostrémosle a Panamá que la amamos, sigamos las medidas de bioseguridad'",https://www.tvn-2.com/nacionales/Lourdes-Moreno-Demostremosle-Panama-bioseguridad-normas-fiestas-patrias-COVID-19_0_5708429109.html,"Una de las figuras que sin duda se ganó el cariño y respeto de los panameños en medio de la pandemia fue la doctora Lourdes Moreno, jefa de Epidemiología del Ministerio de Salud (Minsa), quien se hizo",03-11-2020 13:19,https://www.bing.com/th?id=OVFT.jKxAtl9SdgcNH35_SzeOky,Panamá,TVN
Argentina comprará 25 millones de dosis de vacuna rusa contra covid-19,https://ensegundos.com.pa/2020/11/03/argentina-comprara-25-millones-de-dosis-de-vacuna-rusa-contra-covid-19/,El presidente Alberto Fernández informó que Argentina comprará entre diciembre y enero 25 millones de dosis de la vacuna Sputnik V contra el coronavirus desarrollada por el Instituto Gamaleya de Rusia,03-11-2020 13:38,https://www.bing.com/th?id=OVFT.4r2YgPYwMhgOMH6SUrocIS,Panamá,En Segundos
Reconfinamiento en Atenas y en regiones griegas más afectadas por el coronavirus,https://ensegundos.com.pa/2020/11/03/reconfinamiento-en-atenas-y-en-regiones-griegas-mas-afectadas-por-el-coronavirus/,"La pandemia del coronavirus Covid-19 no da tregua y obliga a países a confinarse. Atenas y las regiones griegas con más casos de coronavirus retoman progresivamente el confinamiento este martes, con c",03-11-2020 13:41,https://www.bing.com/th?id=OVFT.gJSkaWevR0apefzIumVQPC,Panamá,En Segundos
Conmemoran separación de Colombia sin Cortizo,https://radioreformaseoye.com/nacionales/conmemoran-separacion-de-colombia-sin-cortizo/,"Los actos protocolares con motivo a los 117 años desde la separación de Panamá de Colombia fueron desarrollados sin la presencia del presidente Laurentino Cortizo, quien se encuentra en una cuarentena",03-11-2020 14:28,https://www.bing.com/th?id=OVFT.rfxKQFfU8T0cO2l9bDNgXy,Panamá,Radio Reforma se Oye
Advierten rebrote y alta meseta de transmisión en Panamá,https://radioreformaseoye.com/nacionales/advierten-rebrote-y-alta-meseta-de-transmision-en-panama/,"Por su parte, Jean Paul Carrera, epidemiólogo del Instituto Conmemorativo Gorgas de Estudios de Salud, explicó al diario La Prensa, que Panamá nunca suprimió la circulación del virus, y que está en un",03-11-2020 14:40,https://www.bing.com/th?id=OVFT.34gcqB3Ef6nTqQHzJ4qcKi,Panamá,Radio Reforma se Oye
Panamá conmemora 117 años de vida republicana en medio de la pandemia,https://www.metrolibre.com/nacionales/185943-panam%C3%A1-conmemora-117-a%C3%B1os-de-vida-republicana-en-medio-de-la-pandemia.html,"Este año, los actos del 3 de noviembre para celebrar la Separación de Panamá de Colombia estuvieron marcados por las medidas de bioseguridad a causa de la pandemia, sin embargo, esto no impidió que se",03-11-2020 14:42,https://www.bing.com/th?id=OVFT.mGwBo4TGdY2kDMpkPD9W9y,Panamá,Metro Libre
Donald Trump busca su reelección en medio de la pandemia de la COVID-19,https://www.panamaamerica.com.pa/mundo/donald-trump-busca-su-reeleccion-en-medio-pandemia-covid-19-1175270,"En las últimas cuatro décadas, solamente dos mandatarios estadounidenses han perdido sus campañas de reelección. Desde que George Washington asumió como el primer presidente de Estados Unidos, la hist",03-11-2020 15:05,https://www.bing.com/th?id=OVFT.hJVxMHtECsCRfhbQE4YMTi,Panamá,panamaamerica.com.pa
Un grupo de colonenses desafía a la COVID-19 con desfile clandestino,https://www.panamaamerica.com.pa/provincias/un-grupo-colonenses-desafia-covid-19-con-desfile-clandestino-1175272,"A pesar de las restricciones y el toque de queda establecido, un grupo de personas salió a las calles en el sector de Sabanitas, en la provincia de Colón, para llevar a cabo un desfile clandestino, en",03-11-2020 15:09,https://www.bing.com/th?id=OVFT.TnUzq8itrHW1Z5y3bT021C,Panamá,panamaamerica.com.pa
"Izada de bandera de Panamá sin ""Nito"" Cortizo",https://www.critica.com.pa/nacional/izada-de-bandera-de-panama-sin-nito-cortizo-591524,"A diferencia de años anteriores, la ceremonia fue rápida y guardando las medidas de bioseguridad adoptadas por el Ministerio de Salud para evitar el contagio del COVID-19.",03-11-2020 15:21,https://www.bing.com/th?id=OVFT.AP9waYnWByCsJk3IDP979C,Panamá,Critica
Izada de bandera de Panamá sin el presidente Cortizo,https://www.critica.com.pa/nacional/izada-de-bandera-de-panama-sin-el-presidente-cortizo-591524,"A diferencia de años anteriores, la ceremonia fue rápida y guardando las medidas de bioseguridad adoptadas por el Ministerio de Salud para evitar el contagio del COVID-19.",03-11-2020 15:22,https://www.bing.com/th?id=OVFT.udhoo3EwRNVI6dp-mdihUS,Panamá,Critica
