name,url,description,datePublished,imagen,pais,Fuente
Retoman tareas de hisopado en Arraiján,https://noticias24pty.com/retoman-tareas-de-hisopado-en-arraijan/,"Los equipos de respuesta rápida de la Caja de Seguro Social (CSS), retomaron las tarea de hisopado nasal en cuatro comunidades del distrito de Arraiján, provincia de Panamá Oeste, a la búsqueda de casos aislados de covid-19. El barrido epidemiológico ...",26-03-2021 22:14,https://www.bing.com/th?id=OVFT.OJLVZv1CkFaLrgSjNOWtRC,Panamá,Noticias 24 PTY
Se reportan 438 nuevos casos de COVID-19 y 12 fallecimientos en Panamá,https://www.tvn-2.com/nacionales/reportan-nuevos-casos-COVID-19-fallecimientos_0_5815668456.html,"El Ministerio de Salud (Minsa) reportó en el informe epidemiológico de este viernes 26 de marzo, un total de 438 casos positivos nuevos, para un total acumulado de 353,017.",26-03-2021 22:59,https://www.bing.com/th?id=OVFT.5q3dl7O9iXsAcjZhgHW7HS,Panamá,TVN
"Panamá reporta 438 nuevos contagios de COVID-19 y 5,030 casos activos",https://www.telemetro.com/nacionales/2021/03/26/panama-casos-covid-19/3886257.html,"Panamá reportó este viernes 26 de marzo unos 438 nuevos casos de COVID-19, haciendo que los contagios acumulados en el país se elevaran a 353,017.",26-03-2021 23:05,https://www.bing.com/th?id=OVFT.UaWnTIyU-Hp1RCZVIGX4Fy,Panamá,Telemetro
"Panamá aplica 9,140 pruebas de Covid-19 y se detectan 438 nuevos casos",https://www.metrolibre.com/nacionales/197543-panam%C3%A1-aplica-9140-pruebas-de-covid-19-y-se-detectan-438-nuevos-casos.html,"El informe epidemiológico para este viernes, 26 de marzo, revela que en las últimas 24 horas se detectaron 438 nuevos casos positivos de coronavirus, para un total acumulado de 353,017. A la fecha se",26-03-2021 23:08,https://www.bing.com/th?id=OVFT.Y9vwlRh5CthtvSBORjD_4y,Panamá,Metro Libre
"Panavac aprueba incluir a 25,000 personas con enfermedades crónicas en etapa que inicia el 5 de abril",https://elcapitalfinanciero.com/panavac-aprueba-incluir-a-25000-personas-con-enfermedades-cronicas-en-etapa-que-inicia-el-5-de-abril/,"El Plan Nacional de Vacunación (Panavac) aprobó por unanimidad este jueves, incluir a 25 mil pacientes con enfermedades crónicas en etapa 2 A del Plan Continuo de Vacunación Panavac-19 que arranca el",26-03-2021 23:15,https://www.bing.com/th?id=OVFT.xU8QXia8eCdksf9ypEEPJi,Panamá,El Capital Financiero
Panamá registra 12 fallecimientos por covid-19 y 438 nuevos contagios,https://www.laestrella.com.pa/nacional/210326/panama-registra-12-fallecimientos-covid-19-438-nuevos-contagios,"Panamá registró 12 fallecimientos por covid-19 este viernes 26 de marzo y 438 casos positivos nuevos, según el más reciente informe epidemiológico emitido por el Ministerio de Salud (Minsa). Además se",27-03-2021 00:00,https://www.bing.com/th?id=OVFT.eEhfILWhWKLFBgC49lvaTi,Panamá,laestrella.com.pa
Gobierno vacunará contra la covid-19 a 25 mil pacientes con enfermedades crónicas a partir del 5 de abril,https://www.laestrella.com.pa/nacional/210326/plan-vacunacion-aprueba-incluir-25-mil-pacientes-enfermedades-cronicas-etapa-2a,"La vacunación de estos pacientes, que serán del circuito 8-6 en San Miguelito, iniciará el lunes 5 de abril El Plan Nacional de Vacunación (Panavac) aprobó por unanimidad incluir a 25 mil pacientes co",27-03-2021 00:23,https://www.bing.com/th?id=OVFT.kGKplqAHGQ4Yho2ryDX1KC,Panamá,laestrella.com.pa
"En 65 días: aplicadas 342,716 dosis de vacuna contra la covid-19",https://ensegundos.com.pa/2021/03/26/en-65-dias-aplicadas-342716-dosis-de-vacuna-contra-la-covid-19/,"Las defunciones aumentaron en las últimas 24 horas, (ayer fueron 8).  Hoy se reportaron 12 nuevas, además se actualizaron 2 de fechas anteriores que totalizan 6,087 acumuladas, para una letalidad del",27-03-2021 00:40,https://www.bing.com/th?id=OVFT.9Kw3F7JvWNoi055GInlE6i,Panamá,En Segundos
Panamá reporta 438 casos positivos nuevos y 12 defunciones por coronavirus,https://www.midiario.com/nacionales/panama-reporta-438-casos-positivos-nuevos-y-12-defunciones-por-coronavirus/,"342,716 dosis de la vacuna contra la covid-19 En su informe el PAI también reporta que en el auto rápido denominado VACUNATON, ubicado en los estacionamientos de la Ciudad Deportiva Irving Saladino, se han aplicado hasta este viernes, 2,513 dosis y en el ...",27-03-2021 01:06,https://www.bing.com/th?id=OVFT.ccGc9N8lcuQMMQTnaEe7oC,Panamá,Mi Diario
La pandemia de la Covid-19 está lejos de terminar: OMS,https://www.prensa.com/impresa/panorama/la-pandemia-de-la-covid-19-esta-lejos-de-terminar-oms/,"No obstante, el limitado número de dosis no permite avanz La pandemia de la Covid-19 se encuentra en un escenario complejo: por un lado, entraron en escena varias vacunas, pero en cantidades limitadas, y por el otro, hay variantes del virus que lo hacen ...",27-03-2021 04:08,https://www.bing.com/th?id=OVFT.pUyqV_1YzBSjlq6jzqPoDy,Panamá,prensa.com
Un Domingo de Ramos en la burbuja familiar,https://www.midiario.com/nacionales/un-domingo-de-ramos-en-la-burbuja-familiar/,"Este año 2021, la pandemia de la covid-19 hará vivir la Semana Santa con ciertas restricciones, lo que significa participar de diversos modos según la situación en que se encuentre cada comunidad para el cuidado de todos. Desde la Comisión de Liturgia ...",27-03-2021 12:38,https://www.bing.com/th?id=OVFT.4dohJUr80XiBZFd1TkrzUy,Panamá,Mi Diario
Al menos 16 mil pacientes con Covid-19 han sido atendidos en hoteles hospitales desde el inicio de la pandemia,https://www.prensa.com/sociedad/al-menos-16-mil-pacientes-con-covid-19-han-sido-atendidos-en-hoteles-hospitales-desde-el-inicio-de-la-pandemia/,El Ministerio de Salud (Minsa) informó que al menos 16 mil pacientes han recibido atención en los hoteles hospitales durante la pandemia a de la Covid-19 que llegó al país en marzo de,27-03-2021 13:03,https://www.bing.com/th?id=OVFT.Xu1urdEAC3_5kBX_2MAAoC,Panamá,prensa.com
Minsa ha atendido a 16 mil pacientes con COVID-19 en hoteles y albergues,https://www.telemetro.com/nacionales/2021/03/27/minsa-atendido-16-mil-pacientes/3887474.html,"El Ministerio de Salud de Panamá (Minsa) informó que un total de 16 mil pacientes han recibido atención en los hoteles hospitales desde marzo del 2020, inicio de la pandemia de COVID-19, hasta la fech",27-03-2021 13:46,https://www.bing.com/th?id=OVFT.06_L7Bj28sLabemagk4UJS,Panamá,Telemetro
"12 meses de crisis mundial, lo inédito y lo complejo",https://bayanodigital.com/12-meses-de-crisis-mundial-lo-inedito-y-lo-complejo/,"Benjamín Colamarco Patiño* Especial para Bayano digital Lo inédito y lo complejo de estos tiempos, que nos han sorprendido a todos En medio de esta pa",27-03-2021 14:36,https://www.bing.com/th?id=OVFT.P6tGtbNKDSifh_AoYA22xy,Panamá,Bayano Digital
Presidente Cortizo Cohen sancionará ley que elimina Aupsa,https://elcapitalfinanciero.com/presidente-cortizo-cohen-sancionara-ley-que-elimina-aupsa/,"El presidente de la República, Laurentino Cortizo Cohen,   anunció durante una gira por la provincia de Chiriquí, que el próximo martes 30 de marzo, sancionará en el distrito de Tierras Altas, la Ley",27-03-2021 15:15,https://www.bing.com/th?id=OVFT.kqbrqvqQe04NLcqns_Xu2y,Panamá,El Capital Financiero
Artistas y músicos en protesta con murga para que “los dejen trabajar”,https://www.metrolibre.com/nacionales/197573-artistas-y-m%C3%BAsicos-en-protesta-con-murga-para-que-%E2%80%9Clos-dejen-trabajar%E2%80%9D.html,"Al son de los tambores, murgas, marcha y hasta fuegos artificiales al final, el grupo de músicos pidió que ‘los dejen trabajar’, tras más de un año de inactividad tras la llegada del Covid-19. Los man",27-03-2021 15:36,https://www.bing.com/th?id=OVFT.vqw5pzoPUOHgf__kq4a3Gi,Panamá,Metro Libre
Esquema de vacunación en la población infantil sufrió un descenso en 2020,https://www.radiopanama.com.pa/noticias/actualidad/esquema-de-vacunacion-en-la-poblacion-infantil-sufrio-un-descenso-en-2020/20210327/nota/4121051.aspx,"En el mundo, existen 19,7 millones de niños vulnerables a enfermedades prevenibles por vacunación.En los últimos 10 años han sido vacunados más de 1,000 millones de niños",27-03-2021 17:02,https://www.bing.com/th?id=OVFT.U5aKDYpkHePXVNpXvKWW7y,Panamá,Radio Panamá
Un total de 16 mil pacientes con covid-19 han recibido atención en los hoteles hospitales,https://www.panamaamerica.com.pa/sociedad/un-total-16-mil-pacientes-con-covid-19-han-recibido-atencion-en-hoteles-hospitales-1184098,"Un total de 16 mil pacientes han recibido atención en los hoteles hospitales desde marzo del 2020 hasta la fecha, informó Oliver Paredes, coordinador nacional de instalaciones COVID-19 del Ministerio",27-03-2021 17:50,https://www.bing.com/th?id=OVFT.EPcBP6PO8T-Dhg1rCZwK2C,Panamá,panamaamerica.com.pa
Brasil se acerca a 4.000 muertes diarias de COVID-19,http://www.nexpanama.com/brasil-se-acerca-a-4-000-muertes-diarias-de-covid-19/,"Brasil representa actualmente la cuarta parte de las muertes de COVID-19 de todo el mundo, mucho más que cualquier otro país, y los expertos en salud advierten que el país está en el borde de una cala",27-03-2021 17:54,https://www.bing.com/th?id=OVFT.PLeA9_iekg7kazEMg1Owfy,Panamá,NEX TV
Estados Unidos se alza con la corona del Miss Grand International,https://www.diaadia.com.pa/fama/estados-unidos-se-alza-con-la-corona-del-miss-grand-international-376905,"De los 63 participantes, Miss Grand Nigeria Chikaodili Nna-Udosen y Miss Grand Kenya Irene Ng-endo dieron positivo para COVID- 19 a la llegada. Ambos pasaron por cuarentena hospitalaria mientras que todas las demás estaban en cuarentena hotelera.",27-03-2021 18:54,https://www.bing.com/th?id=OVFT.SKuh548VmBRzqsjNph5-Bi,Panamá,Día a Día
MINSA señala que alrededor de 16 mil pacientes han recibido atención en los hoteles hospitales,https://www.radiopanama.com.pa/noticias/actualidad/minsa-senala-que-alrededor-de-16-mil-pacientes-han-recibido-atencion-en-los-hoteles-hospitales/20210327/nota/4121071.aspx,"Entre los insumos utilizados para mayor calidad en la atención están los oxímetros que mide saturación de oxígeno, doppler para escuchar latidos de las embarazadas, monitor de signos vitales, desfibri",27-03-2021 19:17,https://www.bing.com/th?id=OVFT.U5aKDYpkHePXVNpXvKWW7y,Panamá,Radio Panamá
Ya se habilitó la celebración de reuniones y conferencias,https://ensegundos.com.pa/2021/03/27/ya-se-habilito-la-celebracion-de-reuniones-y-conferencias/,"El anuncio se dio luego de la publicación, en Gaceta Oficial, de la Resolución 405 de 11 de mayo de 2020 “que adopta los lineamientos para el retorno a la normalidad de las empresas post Covid-19 en Panamá”. Los protocolos de Bioseguridad y ...",27-03-2021 19:18,https://www.bing.com/th?id=OVFT.uPqzeWn4jaahxt3GzHyLni,Panamá,En Segundos
Reunión entre asociación de música y Minsa esta semana,https://www.critica.com.pa/nacional/reunion-entre-asociacion-de-musica-y-minsa-esta-semana-601027,"La junta Directiva Nacional del Sindicato de Trabajadores de la Música, Artistas y Similares de Panamá, informó que la próxima semana mantendrán reuniones con el Ministro de Salud, Luis Francisco Sucr",27-03-2021 19:52,https://www.bing.com/th?id=OVFT.F66aGHXVGz9Faqh7NY9p8y,Panamá,Critica
Asociación de artistas piden evitar aglomeraciones; anuncia reunión con el Minsa,https://www.critica.com.pa/nacional/asociacion-de-artistas-piden-evitar-aglomeraciones-anuncia-reunion-con-el-minsa-601027,"El viernes, los músicos realizaron una protesta en el parque Porras, de la ciudad de Las Tablas para reclamar que se reabran las actividades.",27-03-2021 19:55,https://www.bing.com/th?id=OVFT.F66aGHXVGz9Faqh7NY9p8y,Panamá,Critica
OMS alerta a países de la circulación de una vacuna contra la Covid-19 falsificada,https://noticias24pty.com/oms-alerta-a-paises-de-la-circulacion-de-una-vacuna-contra-la-covid-19-falsificada/,La Organización Mundial de la Salud (OMS) alertó a los países de la región sobre la circulación de una vacuna contra la Covid-19 falsificada que fue detectada hace un mes en México y que pudieran,27-03-2021 20:02,https://www.bing.com/th?id=OVFT.Cxw8rxT4aZxUwWe9OwXG4y,Panamá,Noticias 24 PTY
