name,url,description,datePublished,imagen,pais,Fuente
"Se suspende la temporada de Pobeis, pero Panamá sí estará en la Serie del Caribe de Mazatlán",https://www.midiario.com/deportivas/se-suspende-la-temporada-de-pobeis-pero-panama-si-estara-en-la-serie-del-caribe-de-mazatlan/,"La pandemia por el coronavirus sigue golpeando al deporte panameño. En esta ocasión, La Liga Profesional de Béisbol de Panamá, Probeis, anunció la posposición de su temporada 2020-2021 anunciada para",03-01-2021 19:31,https://www.bing.com/th?id=OVFT.PHGANBvE8iJBVJJuYKAGKS,Panamá,Mi Diario
"Ministro de Salud de Panamá, Luis Francisco Sucre, reitera seguir medidas de autocuidado para evitar sanciones",https://sertv.gob.pa/nacionalfm/ministro-de-salud-de-panama-luis-francisco-sucre-reitera-seguir-medidas-de-autocuidado-para-evitar-sanciones/,"El Ministro de Salud, Luis Francisco Sucre, recordó a toda la población seguir las medidas de autocuidado para prevenir el contagio por COVID-19 y además evitar sanciones, ya que Panamá, enfrenta una",04-01-2021 17:37,https://www.bing.com/th?id=OVFT.9mCiiRjO5ICrLO6QwKbL-S,Panamá,SERTV
Covid positivity rate at 28.18%,https://www.newsroompanama.com/health/covid-positivity-rate-at-2818-1,The percentage of positivity in diagnostic tests for Covid-19 is almost six times higher in Panama than that recommended by the World Health Organization. In,04-01-2021 17:38,https://www.bing.com/th?id=OVFT.WCJgcdvKxi4vMycpu-QeCC,Panamá,Newsroom Panama
Municipio de Panamá suspende temporalmente la atención al público,https://elcapitalfinanciero.com/municipio-de-panama-suspende-temporalmente-la-atencion-al-publico/,"De acuerdo al Decreto Alcaldicio No. 033-2020 de 29 de diciembre de 2020, el alcalde del Distrito de Panamá, José Luis Fábrega, cumpliendo con las disposiciones descritas en el Decreto Ejecutivo No. 1",04-01-2021 18:19,https://www.bing.com/th?id=OVFT.eYzatvisQAoXFBtMItpWwy,Panamá,El Capital Financiero
Ciudad de Panamá semiparalizada por nueva cuarentena ante covid desenfrenado,https://noticias24pty.com/ciudad-de-panama-semiparalizada-por-nueva-cuarentena-ante-covid-desenfrenado/,"“La venta está regular. La gente está desabastecida tras días de encierro y sale a comprar, pero hay que ver cómo estará el movimiento en la semana”, comentó a Efe Lester Herrera, un",04-01-2021 19:33,https://www.bing.com/th?id=OVFT.bUtdAtIPZFBMvbTft2tqSi,Panamá,Noticias 24 PTY
"En Panamá, capacitan a enfermeras para el manejo de equipos y pacientes COVID-19",https://sertv.gob.pa/nacionalfm/en-panama-capacitan-a-enfermeras-para-el-manejo-de-equipos-y-pacientes-covid-19/,"Enfermeras panameñas que se capacitaron en la utilización de equipo de última generación para la atención de pacientes COVID-19, se han incorporado esta semana para dar el apoyo en las unidades de cui",04-01-2021 19:55,https://www.bing.com/th?id=OVFT.YvpK_2tVAM4cmgHcPsjGZC,Panamá,SERTV
Pfizer capacita a personal panameño para la llegada de su vacuna contra el covid-19,https://www.metrolibre.com/nacionales/190643-pfizer-capacita-personal-paname%C3%B1o-para-la-llegada-de-su-vacuna-contra-el-covid-19.html,"Funcionarios de salud, de la cadena de frío y de la Autoridad de Innovación Gubernamental (AIG) recibieron una inducción sobre el proceso de embalaje y desembalaje del primer lote de vacuna que arriba",04-01-2021 20:28,https://www.bing.com/th?id=OVFT.38WI3_3nQ3KEkDYMCx7mri,Panamá,Metro Libre
"Wall Street termina en baja, temerosa de la Covid-19 y las elecciones en Georgia",https://www.prensa.com/economia/wall-street-termina-en-baja-temerosa-de-la-covid-19-y-las-elecciones-en-georgia/,"La Bolsa de Nueva York cerró en baja este lunes 4 de enero en su primera sesión del año, con inquietudes por la aceleración de la pandemia de Covid-19 y expectante sobre los resultados de la elección",04-01-2021 20:57,https://www.bing.com/th?id=OVFT.q0808B9WfMsdhF_zbpMPjC,Panamá,prensa.com
Arzobispo de Panamá exige Salud Pública igual para todos,https://bayanodigital.com/arzobispo-de-panama-exige-salud-publica-igual-para-todos/,"(Redacción de Bayano digital) El arzobispo de Panamá, José Domingo Ulloa, manifestó en su primera homilía dominical del 2021 que Panamá demanda un sistema de Salud Pública eficiente e igualitario, que",04-01-2021 20:57,https://www.bing.com/th?id=OVFT.deAngDqmnQIbISaeajBRci,Panamá,Bayano Digital
Estos son los horarios de MiBus y Metro de Panamá durante la cuarentena,http://elsiglo.com.pa/panama/estos-horarios-mibus-metro-panama-durante-cuarentena/24170519,Modificaron los horarios de circulación mientras dure la cuarentena total impuesta para mitigar los contagios de covid-19 en el país,04-01-2021 21:45,https://www.bing.com/th?id=OVFT.bc619qBZEentTSPDCvoWZS,Panamá,El Siglo
Denuncian falta de pruebas Covid-19 en el aeropuerto de Tocumen,https://ensegundos.com.pa/2021/01/04/denuncian-falta-de-pruebas-covid-19-en-el-aeropuerto-de-tocumen/,"Esta situación provocó aglomeración y largas filas en la terminal aérea panameña. La mañana de este lunes 4 de enero de 2021, viajeros que retornan al país, denunciaron la falta de test para la realiz",04-01-2021 22:17,https://www.bing.com/th?id=OVFT.Gp9JXviUw8Bmvj9LF1-fMi,Panamá,En Segundos
"Panamá registra en las últimas horas 57 defunciones por la Covid-19; hay 48,345 casos activos",https://www.prensa.com/sociedad/panama-registra-en-las-ultimas-horas-57-defunciones-por-la-covid-19-hay-48345-casos-activos/,"En las últimas horas en Panamá se registraron 57 nuevas defunciones debido a la enfermedad de la Covid-19, destacó el informe epidemiológico del Ministerio de Salud (Minsa). En el país se contabilizan 203,688 pacientes recuperados. Mientras los casos ...",04-01-2021 22:26,https://www.bing.com/th?id=OVFT.GvBcK-Icbep4kMZ9nqK2aS,Panamá,prensa.com
Canciller Mouynes: Panamá recibirá el primer lote de vacunas contra el COVID-19 entre el 18 y 25 de enero,https://www.tvn-2.com/nacionales/Canciller-Mouynes-Panama-vacuna-recibira-COVID-19-enero_0_5754924535.html,"El primer lote de 40 mil vacunas contra el COVID-19 llegará a Panamá entre el 18 y 25 de enero, así lo confirmó la canciller de la República, Erika Mouynes en conferencia de prensa, la tarde de este l",04-01-2021 23:42,https://www.bing.com/th?id=OVFT.X7UOQaO-IfR33N0_p_ye2C,Panamá,TVN
"Panamá registra 57 nuevas muertes por covid-19, la cifra más alta registrada en un día",https://www.laestrella.com.pa/nacional/210104/panama-registra-57-nuevas-muertes-covid-19-alta-registrada-dia,"Panamá registró este lunes 4 de enero, 57 nuevas muertes por covid-19, la cifra más alta registrada en un día, desde que empezó la pandemia. Según el informe epidemiológico del Ministerio de Salud (Mi",04-01-2021 23:44,https://www.bing.com/th?id=OVFT.gc1gm_xHthfRLv0m3xZXQi,Panamá,laestrella.com.pa
Panamá recibirá el primer embarque de la vacuna Pfizer entre el 18 y 25 de enero,https://www.midiario.com/ciencia-y-tecnologia/panama-recibira-el-primer-embarque-de-la-vacuna-pfizer-entre-el-18-y-25-de-enero/,"Panamá recibirá el primer lote de vacunas contra la covid-19 entre el 18 y 25 de enero de este 2021, según anunció la canciller Erika Mouynes la tarde de este lunes, 4 de",05-01-2021 00:21,https://www.bing.com/th?id=OVFT.ggnJjpwxSs1Jxk74To6WHy,Panamá,Mi Diario
40 mil dosis de vacuna de Pfizer llegarán a Panamá entre el 18 y 25 de enero,https://www.critica.com.pa/nacional/40-mil-dosis-de-vacuna-de-pfizer-llegaran-panama-entre-el-18-y-25-de-enero-595568,"Cuarenta mil dosis de la vacuna de Pfizer/BioNTech contra la COVID-19 estarán llegando a Panamá en la semana del 18 al 25 de enero, según explicó la ministra de Relaciones Exteriores, Erika Mouynes.La",05-01-2021 00:27,https://www.bing.com/th?id=OVFT.9nw4c6SWUCvFAe015erK0C,Panamá,Critica
"Panamá recibirá las primeras 40,000 dosis de vacuna Pfizer entre el 18 y el 25 de enero",https://elcapitalfinanciero.com/panama-recibira-las-primeras-40000-dosis-de-vacuna-pfizer-entre-el-18-y-el-25-de-enero/,"Entre el 18 y el 25 de enero la empresa farmacéutica Pfizer confirmó al Gobierno de Panamá, que procederá a entregar las primeras 40,000 dosis de la vacuna .",05-01-2021 00:37,https://www.bing.com/th?id=OVFT.JWrWqahYn2Nbw8oyVjLCui,Panamá,El Capital Financiero
Primeras 40 mil dosis de la vacuna llegarán a Panamá a finales de enero,https://noticias24pty.com/primeras-40-mil-dosis-de-la-vacuna-llegaran-a-panama-a-finales-de-enero/,"Ahora resulta que Panamá cambió la estrategia de vacunación y según informó la canciller, Erika Mouynes las primeras 40 mil dosis de la vacuna contra el COVID-19 llegarán a suelo panameño del 18",05-01-2021 00:39,https://www.bing.com/th?id=OVFT.9jTce-L7WCcn3sGs8nM8ei,Panamá,Noticias 24 PTY
Panamá registra récord de 57 defunciones por coronavirus en un día,https://www.metrolibre.com/nacionales/190663-panam%C3%A1-registra-r%C3%A9cord-de-57-defunciones-por-coronavirus-en-un-d%C3%ADa.html,"El Ministerio de Salud de Panamá (Minsa) informó que hoy, lunes 4 de enero de 2021 se registraron 57 nuevas muertes a causa del covid-19, lo que eleva el acumulado de fallecimientos a 4,197, lo que re",05-01-2021 00:39,https://www.bing.com/th?id=OVFT.ddy8T7t4BQpU-uoPUFMoSi,Panamá,Metro Libre
Panamá[EN VIVO] Revelan detalles de la adquisición de las vacunas contra la covid-19,https://www.panamaamerica.com.pa/sociedad/en-vivo-revelan-detalles-adquisicion-vacunas-contra-covid-19-1178963,Utilizamos cookies propias y de terceros para mejorar nuestros servicios y mostrarle publicidad relacionada con sus preferencias mediante el análisis de sus hábitos de navegacin,05-01-2021 00:45,https://www.bing.com/th?id=OVFT.pHRfXHGR7HS-8TIaSOOi7S,Panamá,panamaamerica.com.pa
ICG investiga si en Panamá hay variantes del COVID-19,https://www.telemetro.com/nacionales/2021/01/05/icg-investiga-si-en-panama-hay-variantes-del-covid-19/3609620.html,El Instituto Conmemorativo Gorgas desarrolla una investigación para determinar la existencia de posibles variantes del nuevo coronavirus en Panamá.,05-01-2021 00:49,https://www.bing.com/th?id=OVFT.YKkocvQq1sV-x5xNrFe6LS,Panamá,Telemetro
Primeras 40 mil dosis de vacuna Pfizer llegarán a Panamá entre el 18 y 25 de enero,https://www.laestrella.com.pa/nacional/210104/primeras-40-mil-dosis-vacuna-pfizer-llegaran-panama-18-25-enero,"La Canciller de Panamá, Erika Mouynes anunció este lune que la farmacéutica Pfizer confirmó que entre el 18 al 25 de enero próximo, el país recibirá las primeras 40 mil dosis de la vacuna contra la co",05-01-2021 00:51,https://www.bing.com/th?id=OVFT.pawS6G-9E39BqPBt2iRZFy,Panamá,laestrella.com.pa
Covid-19 marca nuevo récord en Panamá: 57 muertes en 24 horas,https://www.panamaamerica.com.pa/sociedad/covid-19-marca-nuevo-record-en-panama-57-muertes-en-24-horas-1178966,"Panamá registró este lunes un nuevo máximo de muertes por coronavirus, a pesar de las duras restricciones impuestas por las autoridades de salud para frenar los contagios: 57 víctimas mortales por cov",05-01-2021 00:51,https://www.bing.com/th?id=OVFT.MrSv6d8yWR7mrxKKazDlsS,Panamá,panamaamerica.com.pa
Panamá investiga cepas más contagiosas de coronavirus,https://www.tvn-2.com/nacionales/Panama-investiga-cepas-contagiosas-coronavirus_0_5754924526.html,Científicos en todo el mundo investigan cepas más contagiosas que las primeras encontradas al inicio de la pandemia de covid-19. En Panamá también se realizan estos estudios.,05-01-2021 01:04,https://www.bing.com/th?id=OVFT.bH_U6RtoZtBd7GxMFTxEiy,Panamá,TVN
La evolución de COVID-19 en Panamá,https://www.telemetro.com/nacionales/2021/01/05/la-evolucion-de-covid-19-en-panama/3609629.html,"Panamá alcanzó los 256,230 contagios de coronavirus acumulados, luego de contabilizar 2,494 nuevos casos para este lunes 4 de enero.",05-01-2021 01:08,https://www.bing.com/th?id=OVFT.287tpyNbSGP3sych4ElOsi,Panamá,Telemetro
"Informe-Covid: 57 muertos y 2,494 casos positivos nuevos",https://www.critica.com.pa/nacional/informe-covid-57-muertos-y-2494-casos-positivos-nuevos-595569,"Panamá sumó en las últimas horas, 57 nuevos fallecimientos por COVID-19, la cifra más alta registrada en un día desde marzo del 2020, con un acumlado de 4,197 personas.El número de casos positivos par",05-01-2021 01:10,https://www.bing.com/th?id=OVFT.XqIrSz47On-ERqfdrqghvy,Panamá,Critica
"Panamá recibirá primeros envíos de la vacuna contra la Covid-19, entre el 18 y 25 de enero",https://www.radiopanama.com.pa/noticias/actualidad/panama-recibira-primeros-envios-de-la-vacuna-contra-la-covid19-entre-el-18-y-25-de-enero/20210104/nota/4099292.aspx,"La canciller Erika Mouynes, confirmó que Panamátiene un cronograma estructurado que permite progresivamente recibir las vacunas de distintos fabricantes con que hemos negociado",05-01-2021 01:24,https://www.bing.com/th?id=OVFT.U5aKDYpkHePXVNpXvKWW7y,Panamá,Radio Panamá
México aprueba vacuna de AstraZeneca/Oxford contra covid-19,https://ensegundos.com.pa/2021/01/04/mexico-aprueba-vacuna-de-astrazeneca-oxford-contra-covid-19/,Una caja de viales de vacuna AstraZeneca / Oxford Covid-19 se muestra en la práctica médica de Pontcae en Merthyr Tydfil en el sur de Gales el 4 de enero de 2021. Foto: AFP,05-01-2021 01:29,https://www.bing.com/th?id=OVFT.61XEdWRX2dQQiGEEx6vZri,Panamá,En Segundos
"Panamá reporta 2,494 casos positivos por Covid-19 y 57 nuevas defunciones",https://www.radiopanama.com.pa/noticias/actualidad/panama-reporta-2494-casos-positivos-por-covid19-y-57-nuevas-defunciones/20210104/nota/4099307.aspx,"Las autoridades invitan a la población a no bajar la guardia, mantener las medidas de autocuidado y cooperar con los esfuerzos para cortar la cadena de contagio de este mortal virus que está cobrando",05-01-2021 01:32,https://www.bing.com/th?id=OVFT.U5aKDYpkHePXVNpXvKWW7y,Panamá,Radio Panamá
