name,url,description,datePublished,imagen,pais,Fuente
Quedan pocas camas en la Unidad de Cuidados Intensivos de la CSS,https://www.diaadia.com.pa/el-pais/quedan-pocas-camas-en-la-unidad-de-cuidados-intensivos-de-la-css-367052,"La Caja de Seguro Social (CSS) cuenta con un moderno equipo denominado “Cobas 6,800”, como respuesta a la población por la situación de salud por el COVID-19. Con este equipo se podrá realizar de mane",07-06-2020 21:46,https://www.bing.com/th?id=ON.68524A62364C88C860A9D2B56370AC85,Panamá,Día a Día
Cuba declara la pandemia bajo control,https://www.radiopanama.com.pa/noticias/internacional/cuba-declara-la-pandemia-bajo-control/20200607/nota/4044961.aspx,"El presidente de Cuba, Miguel Díaz-Canel, declaró la covid-19 “bajo control” e indicó que podría anunciar una estrategia de desconfinamiento gradual la próxima semana, después de que el país cumpliera",07-06-2020 22:53,https://www.bing.com/th?id=ON.7D78B3FEAE78D8AC05601605E2D2BC64,Panamá,Radio Panamá
Panamá gestiona préstamos por $20 millones con el Banco Mundial para hacer frente al COVID-19,https://www.panamaamerica.com.pa/sociedad/panama-gestiona-prestamos-por-20-millones-con-el-banco-mundial-para-hacer-frente-al-covid,El Gobierno panameño gestiona un préstamo por $20 millones de dólares con el Banco Mundial para la adquisición de medicamentos e insumos que le permitirá hacer frente a la pandemia del COVID-19 en los,08-06-2020 00:23,https://www.bing.com/th?id=ON.DB98C7444A3B663EB5DB00D25315053F,Panamá,panamaamerica.com.pa
Panamá acumula 393 muertes y 16.425 casos de COVID-19 en 3 meses de pandemia,https://www.diaadia.com.pa/el-pais/panama-acumula-393-muertes-y-16425-casos-de-covid-19-en-3-meses-de-pandemia-367063,"Las autoridades de Panamá reportaron este domingo otras 7 muertes y 421 casos de COVID-19, lo que elevó a 393 las defunciones y a 16.425 los contagios confirmados de la enfermedad en 90 días de pandem",08-06-2020 01:04,https://www.bing.com/th?id=ON.F69095E777A587944FA567BEE82F50D7,Panamá,Día a Día
Método de trazabilidad en Panamá no es confiable,https://www.panamaamerica.com.pa/sociedad/metodo-de-trazabilidad-en-panama-no-es-confiable-1165171,"Panamá no cuenta con un sistema formal de trazabilidad de los casos del COVID-19, lo que podría complicar el combate efectivo de este mortal virus y empujaría a las autoridades a tomar decisiones equi",08-06-2020 01:18,https://www.bing.com/th?id=ON.32A342F14D1DD69B445E2A69085A089E,Panamá,panamaamerica.com.pa
"Panamá registra 16,425 casos de Covid-19",http://elsiglo.com.pa/panama/panama-registra-16425-casos-covid-19/24157930,"Este domingo nuestro país registró 421 nuevos casos de Covid-19 , que se suman un  total de 16,425 casos positivos acumulados.  ""El 93% de los últimos casos de Covid-19 están en aislamiento hospitalar",08-06-2020 02:07,https://www.bing.com/th?id=ON.859061E573D57F8FBA55A0BEEDD74BC5,Panamá,El Siglo
Camacho pide la renuncia de la Ministra de Salud,https://lagacetadepanama.com/camacho-pide-la-renuncia-de-la-ministra-de-salud/,"El Secretario General Provisional del Movimiento Realizando Metas (RM), Luis Eduardo Camacho, pidió la renuncia de la Ministra de Salud Rosario Turner, argumentando que las medidas adoptadas para enfr",08-06-2020 02:30,https://www.bing.com/th?id=ON.43D70FC9EF92B4E135C6EFF339BD6280,Panamá,La Gaceta de Panama
"Las cifras no disminuyen, ayer hubo 421 casos nuevos de coronavirus",http://elsiglo.com.pa/panama/cifras-disminuyen-ayer-hubo-421-casos-nuevos-coronavirus/24157940,"Pandemia. El último informe epidemiológico, divulgado ayer por el Ministerio de Salud (Minsa), anunció 421 casos nuevos de coronavirus Covid-19 pa... Pandemia. El último informe epidemiológico, divulg",08-06-2020 05:21,https://www.bing.com/th?id=ON.9EF7138737DA1B349EC0017248E184B8,Panamá,El Siglo
Sistema Penitenciario anuncia nuevas medidas para familiares de reos y abogados,https://www.critica.com.pa/sucesos/sistema-penitenciario-anuncia-nuevas-medidas-para-familiares-de-reos-y-abogados-580794,El Sistema Penitenciario -luego de que el Ministerio de Salud anunciara una vuelta a las medidas de cuarentena por Covid-19 en Panamá y Panamá Oeste- anunció la reprogramación del horario de recepción,08-06-2020 05:36,https://www.bing.com/th?id=ON.AE116C5EAE80BC2ABBCC51488CFEED67,Panamá,Critica
"Panamá está peor que Costa Rica, a pesar de una cuarentena más estricta",https://www.critica.com.pa/nacional/panama-esta-peor-que-costa-rica-pesar-de-una-cuarentena-mas-estricta-580785,Los contrastes que existen entre Panamá y su vecino Costa Rica en el manejo de la crisis del Covid-19 no pueden ser más dramáticos. Mientras Panamá tiene la lamentable distinción de ser el país centro,08-06-2020 06:27,https://www.bing.com/th?id=ON.60DA730684B3A81B5CC9A41200F5B1BF,Panamá,Critica
"Panamá aumenta a 393 muertos, 16,425 contagiados y 421 nuevos casos por COVID-19",https://www.tvn-2.com/nacionales/Panama-aumenta-muertos-contagiados-COVID-19_0_5596690345.html,"En este día 90 de confirmado el primer caso por COVID-19 en Panamá, el Sistema de Vigilancia Epidemiológica del país reportó 421 nuevos casos del virus a nivel nacional, para un total de 16,424 infect",08-06-2020 12:08,https://www.bing.com/th?id=ON.EE7D23ED1A95D863E31D00ABC1ABF2BE,Panamá,TVN
Covid-19: Panamá suma siete nuevas defunciones y 421 casos nuevos,https://ensegundos.com.pa/2020/06/07/covid-19-panama-suma-siete-nuevas-defunciones-y-421-casos-nuevos/,"Se registran 393 defunciones. Un total de 667 personas están en hoteles hospitales. El Departamento de epidemiología del Ministerio de Salud, informó que al día de hoy se contabilizan 16,425 casos de",08-06-2020 12:38,https://www.bing.com/th?id=ON.AFBBF6D06865CF39A55D71A5E42686BE,Panamá,En Segundos
"Panamá y Panamá Oeste inician la semana con movilidad por cédula y sexo, lunes de mujeres",https://www.telemetro.com/nacionales/2020/06/08/panama-panama-oeste-inician-semana/2933171.html,"Tras la determinación del Ministerio de Salud (Minsa) de retornar a la movilidad por género y cédula/pasaporte desde este 8 de junio, para reducir el aumento de los casos de COVID-19 entre los residen",08-06-2020 12:55,https://www.bing.com/th?id=ON.2119ADD0E523E1B8D44A55BACD4202DF,Panamá,Telemetro
Planificación intefral en tiempo de pandemia,https://elcapitalfinanciero.com/planificacion-intefral-en-tiempo-de-pandemia/,"Desde hace semanas hemos planteado que la pandemia de COVID-19 es un tema complejo, multidimensional, con afectaciones visibles y a la vez impredecibles. Inicialmente, hubo implicaciones de salud prop",08-06-2020 13:12,https://www.bing.com/th?id=ON.C29ADC49EB423BDD99FFA5F8C2A2914C,Panamá,El Capital Financiero
Panamá gestiona préstamos por $20 millones con el Banco Mundial,http://www.nexpanama.com/panama-gestiona-prestamos-por-20-millones-con-el-banco-mundial/,El Gobierno panameño gestiona un préstamo por $20 millones de dólares con el Banco Mundialpara la adquisición de medicamentos e insumos que le permitirá hacer frente a la pandemia del COVID-19 en los,08-06-2020 14:07,https://www.bing.com/th?id=ON.C6D4A1DC98107404C1DECD23B1F67056,Panamá,NEX TV
Ministra Turner espera que la cuarentena sea corta,https://ensegundos.com.pa/2020/06/07/ministra-turner-espera-que-la-cuarentena-sea-corta/,"Hizo un llamado a los ciudadanos a que tomen conciencia sobre la importancia de protegerse. La ministra de Salud, Rosario Turner quién encabeza la lucha contra el Covid-19 en el país, espera que la cu",08-06-2020 14:51,https://www.bing.com/th?id=ON.127C7B6C3EBB78EC6C05BDBC290FFDFF,Panamá,En Segundos
Fundaciones y oenegés podrán seguir realizando actividades benéficas cumpliendo medidas sanitarias,https://www.tvn-2.com/nacionales/Coronavirus-en-Panama-Fundaciones-realizando-actividades-cumpliendo-sanitarias_0_5597440221.html,"Las fundaciones, organizaciones no gubernamentales y organizaciones sin fines de lucro, debidamente inscritas en la República de Panamá podrán seguir realizando sus actividades benéficas, siguiendo la",08-06-2020 14:51,https://www.bing.com/th?id=ON.5CD0582606C416CBA3795A1CF031D06B,Panamá,TVN
Sáez-Llorens: El reciente aumento de los casos no tiene relación con la flexibilización del 1 de junio,https://www.telemetro.com/nacionales/2020/06/08/saez-llorens-aumento-casos-recientemente/2933458.html,"El pediatra infectólogo y miembro del Comité asesor del COVID-19 en Panamá, Xavier Sáez-Llorens adelantó a ECOTV que el aumento de los casos de coronavirus que recientemente se han dado en el país no tiene relación con la flexibilización del 1 de junio que permitieron las autoridades. ""Hay un poco de confusión con el tema de los 14 o ...",08-06-2020 14:53,https://www.bing.com/th?id=ON.25B511F9EBDB266F9A036D2A8DED6B8D,Panamá,Telemetro
Panamá vuelve a la cuarentena por género tras explosión de casos por covid-19,https://www.metrolibre.com/nacionales/173298-panam%C3%A1-vuelve-la-cuarentena-por-g%C3%A9nero-tras-explosi%C3%B3n-de-casos-por-covid-19.html,"El gobierno de Panamá decretó el regreso a la cuarentena por género en la capital y en una provincia contigua tras dispararse los contagios por la covid-19, solo una semana después de reabrir nuevos s",08-06-2020 15:06,https://www.bing.com/th?id=ON.971EA100E85020D2B920CCCB7B722E69,Panamá,Metro Libre
Mides habilita portal sobre donaciones recibidas y entregadas,https://elcapitalfinanciero.com/mides-habilita-portal-sobre-donaciones-recibidas-y-entregadas/,"El Ministerio de Desarrollo Social (Mides), ha habilitado un portal donde la ciudadanía podrá conocer los resultados de las alianzas público-privadas y las donaciones recibidas y entregadas para el be",08-06-2020 15:08,https://www.bing.com/th?id=ON.A0B155C39797B74DAA5E7E66EF1228DF,Panamá,El Capital Financiero
China dice estar trabajando contrarreloj para desarrollar vacunas contra la COVID-19,https://lagacetadepanama.com/china-dice-estar-trabajando-contrarreloj-para-desarrollar-vacunas-contra-la-covid-19/,"China está trabajando a contrarreloj para investigar y desarrollar vacunas contra la enfermedad del nuevo coronavirus (COVID-19) y es necesaria la cooperación internacional durante este proceso, indic",08-06-2020 15:38,https://www.bing.com/th?id=ON.598E32A8330F564860D705B3C8BFBD7F,Panamá,La Gaceta de Panama
Panamá y Oeste con restricciones desde hoy,https://www.metrolibre.com/nacionales/173347-panam%C3%A1-y-oeste-con-restricciones-desde-hoy.html,"Tras  una semana de reabrir algunas actividades económicas y flexibilizar la cuarentena, los casos por Covid-19 siguen en aumento, por lo que el gobierno decidió retornar desde hoy  las restricciones",08-06-2020 15:39,https://www.bing.com/th?id=ON.869E6D5A36EDCFBBBB67FC25F769E47E,Panamá,Metro Libre
BDA respalda a productores y préstamos en tiempos de COVID19,https://www.radiopanama.com.pa/noticias/actualidad/bda-respalda-a-productores-y-prestamos-en-tiempos-de-covid19/20200608/nota/4045089.aspx,"El Gerente General del Banco De Desarrollo Agropeciario, BDA; Cecilio Ricord, señaló en Radio Panamá, que la institución mantiene el respaldo al sector agropecuario con el pago de los préstamos. Ricor",08-06-2020 16:51,https://www.bing.com/th?id=ON.7D78B3FEAE78D8AC05601605E2D2BC64,Panamá,Radio Panamá
