name,url,description,datePublished,imagen,pais,Fuente
"Pandemia está en su fase más avanzada en Panamá y el pronóstico es comprometedor, plantea Consejo Consultivo de Salud",https://www.prensa.com/sociedad/pandemia-esta-en-su-fase-mas-avanzada-en-panama-y-el-pronostico-es-comprometedor-plantea-consejo-consultivo-de-salud/,"El Consejo Consultivo de Salud, creado para asesorar al presidente Laurentino Cortizo en las estrategias para enfrentar la pandemia de la Covid-19, elaboró una serie de puntos sobre el avance del viru",04-07-2020 17:35,https://www.bing.com/th?id=ON.3C7CD2F402D9A4660E4729EAFAFC4F05,Panamá,prensa.com
Panamá: Cifra récord de 31 muertes en 24 horas por Covid-19,https://www.metrolibre.com/nacionales/175731-panam%C3%A1-cifra-r%C3%A9cord-de-31-muertes-en-24-horas-por-covid-19.html,"El Ministerio de Salud de Panamá (Minsa) informó que para este viernes, 3 de julio, se registran 758 nuevos contagios de coronavirus, elevando el número total de casos en el país 35,995. Asimismo para",04-07-2020 17:38,https://www.bing.com/th?id=ON.5128019E4FAAA3AE3651D789999DF836,Panamá,Metro Libre
Panamá participa en el Ccva para elaborar Plan de Recuperación post COVID-19,https://elcapitalfinanciero.com/panama-participa-en-el-ccva-para-elaborar-plan-de-recuperacion-post-covid-19/,"Durante la reunión ordinaria número 41 del Consejo Centroamericano de Vivienda y Asentamientos Humanos (Ccva), se elaboró el Plan de Recuperación Social y Resiliencia del Sistema de Integración Centro",04-07-2020 19:18,https://www.bing.com/th?id=ON.BBB6B3C2CD0C5A4AB25A1B915E0107F5,Panamá,El Capital Financiero
Encierro por COVID-19 y su efecto en los niños,https://ensegundos.com.pa/2020/07/04/encierro-por-covid-19-y-su-efecto-en-los-ninos/,"Los padres que tienen teletrabajo deben establecer un horario de trabajo para que el menor no mal interprete la calidad de tiempo. Con la situación de la pandemia, a la cual Panamá no escapa, son much",04-07-2020 19:28,https://www.bing.com/th?id=ON.34C986D2823024959386D18B897268BA,Panamá,En Segundos
Sale de Panamá primer grupo de nicaragüenses tras autorización de Managua,https://www.telemetro.com/nacionales/2020/07/04/sale-de-panama-primer-grupo-de-nicaragueenses-tras-autorizacion-de-managua/3013163.html,Un total de 1.180 nicaragüenses que se quedaron sin medios de vida en Panamá por la crisis provocada por la COVID-19 llegaron el miércoles a la principal estación de autobuses de la capital para regre,04-07-2020 19:28,https://www.bing.com/th?id=ON.2BF9116530339013F5F3301F202864B5,Panamá,Telemetro
La covid-19 está cerca de sobrepasar al gran complejo hospitalario de Houston,https://ensegundos.com.pa/2020/07/04/la-covid-19-esta-cerca-de-sobrepasar-al-gran-complejo-hospitalario-de-houston/,Los hospitales empezaron el miércoles a transformar algunas camas convencionales en unidades de cuidado intensivo luego de que las camas de cuidados intensivos excedieron resultaron insuficientes. Pes,04-07-2020 19:35,https://www.bing.com/th?id=ON.BF497B349E1CBC12E9D011FC02E2EE00,Panamá,En Segundos
Comunidades de la Región de Salud en Panamá Este mantienen más de 200 casos activos de COVID-19,https://www.radiopanama.com.pa/noticias/actualidad/comunidades-de-la-region-de-salud-en-panama-este-mantienen-mas-de-200-casos-activos-de-covid19/20200704/nota/4052109.aspx,Las autoridades de salud en Panamá Este mantienen un patrullaje mixto con funcionarios de diversas instituciones para ubicar la mayor cantidad posible de casos de COVID-19 y brindarles la asistencia n,04-07-2020 21:01,https://www.bing.com/th?id=ON.7D78B3FEAE78D8AC05601605E2D2BC64,Panamá,Radio Panamá
"Al cierre de abril, el Imae de Panamá registró una caída interanual de 34.7%",https://elcapitalfinanciero.com/al-cierre-de-abril-el-imae-de-panama-registro-una-caida-interanual-de-34-7/,"Con base en la información preliminar, el Índice Mensual de Actividad Económica (Imae) de abril de 2020 cayó 34.7%, en comparación con igual mes del año anterior. No obstante, el acumulado del período",04-07-2020 22:06,https://www.bing.com/th?id=ON.738FBF4B9C7D7A8D97C278BF5FA3B28C,Panamá,El Capital Financiero
"Panamá, en lista de países de alto riesgo de infección por COVID-19",https://www.critica.com.pa/nacional/panama-en-lista-de-paises-de-alto-riesgo-de-infeccion-por-covid-19-582688,"Suiza emitió un listado de 29 países que presentan un alto riesgo de infección por coronavirus, por lo que a partir de este lunes, 6 de julio, los viajeros que ingresen desde esos países deben pasar p",04-07-2020 23:09,https://www.bing.com/th?id=ON.8CEA8D6F45837E67ABD44234A37CDF84,Panamá,Critica
Instalan centro de trazabilidad contra Covid-19 en Colón,https://www.prensa.com/provincias/instalan-centro-de-trazabilidad-contra-covid-19-en-colon/,"Un centro de operación para el control y trazabilidad comunitaria para enfrentar la Covid-19 en la provincia de Colón, fue inaugurado por la Gobernación este sábado 4 de julio. Con este centro se busc",04-07-2020 23:13,https://www.bing.com/th?id=ON.4B58C946EC5641C9AC6A28BF1E040A7C,Panamá,prensa.com
La SENACYT apoya a proyectos que ayuden en la lucha contra el Covid-19,https://www.metrolibre.com/nacionales/175771-la-senacyt-apoya-proyectos-que-ayuden-en-la-lucha-contra-el-covid-19.html,"La Secretaría Nacional de Ciencia, Tecnología e Innovación (SENACYT) informó que, durante su primer año de gestión, ha apoyado a 32 investigadores destacados del SNI a la respuesta ante el COVID-19. T",04-07-2020 23:17,https://www.bing.com/th?id=ON.F5EBA299D6A6F9F7D3A9966046485E8D,Panamá,Metro Libre
"Panamá alcanza las 720 defunciones por COVID-19 y acumula 36,983 casos en total",https://www.telemetro.com/nacionales/2020/07/04/panama-defunciones-covid-contabiliza/3015733.html,"El Ministerio de Salud (Minsa) informa que para este sábado 4 de julio la cifra de casos de COVID-19 en Panamá se elevó a 36,983, con un total de 988 nuevos contagios. Además el número de muertes a ca",04-07-2020 23:21,https://www.bing.com/th?id=ON.066D0C63F72A259D210017A07EB17CAE,Panamá,Telemetro
Minsa confirma 988 casos nuevos de covid-19 en Panamá,http://elsiglo.com.pa/panama/minsa-confirma-988-casos-nuevos-covid-19-panama/24159789,"Para este sábado 4 de julio se registraron, en Panamá, 988 casos positivos nuevos de covid-19, para un total de 36,983 contagiados. Además el Ministerio de Salud (Minsa) confirmó 22 nuevas defunciones",04-07-2020 23:35,https://www.bing.com/th?id=ON.07D8D3CA3E3F57D4FC991A76F7867A48,Panamá,El Siglo
Agarraron a cinco libando licor en un bar en Torrijos Cárter,http://elsiglo.com.pa/panama/agarraron-cinco-libando-licor-torrijos-carter/24159788,"La Policía Nacional (PN) detuvo, la tarde de este sábado, a cinco ciudadanos que se encontraban libando licor en un bar en Torrijos Cárter violando las normas sanitarias establecidas por las autoridad",04-07-2020 23:50,https://www.bing.com/th?id=ON.E89CE211D50E34504922CF4BE5A1C440,Panamá,El Siglo
Consejo Consultivo advierte de aumento de la mortalidad por COVID-19 y riesgo de descontrol social,https://www.tvn-2.com/nacionales/Coronavirus-en-Panama-Consejo-Consultivo-mortalidad-COVID-19-descontrol-pandemia_0_5616938270.html,"Destacaron que la pandemia en Panamá está en la fase 4, que es la más avanzada, según la Organización Mundial de la Salud (OMS), y dentro de lo que se contempla, la transmisión comunitaria a un alto n",04-07-2020 23:52,https://www.bing.com/th?id=ON.F30AAABD27794ED6948C42DED35192CA,Panamá,TVN
Autoridades apuntan a la trazabilidad para combatir el COVID-19,https://www.radiopanama.com.pa/noticias/actualidad/autoridades-apuntan-a-la-trazabilidad-para-combatir-el-covid19/20200704/nota/4052161.aspx,"El Ministerio de Salud informó este sábado que se trabaja en la instalación de centros de trazabilidad en el país, para combatir los contagios del COVID-19. Ya son siete los centros de operaciones par",04-07-2020 23:57,https://www.bing.com/th?id=ON.7D78B3FEAE78D8AC05601605E2D2BC64,Panamá,Radio Panamá
"Raúl Vega, Melquiades Vásquez y José Iván Ramos fuera Telemetro Reporta",https://www.diaadia.com.pa/fama/raul-vega-melquiades-vasquez-y-jose-ivan-ramos-fuera-telemetro-reporta-368014,El COVID-19 sigue haciendo estrago en el mundo y Panamá no escapa de la situación. La salud y la economía son las áreas más afectadas. El desempleo aumenta y lastimosamente no se ve una mejoría a la s,05-07-2020 00:02,https://www.bing.com/th?id=ON.2BDDD0CC939129E0F5DB9F243C2E69AF,Panamá,Día a Día
"Muertes a causa de COVID-19 suman 720 en Panamá, en los últimos tres días se registraron 75 defunciones",https://www.panamaamerica.com.pa/sociedad/muertes-causa-de-covid-19-suman-720-en-panama-en-los-ultimos-tres-dias-se-registraron-75,"La cifra de personas muertas a causa de COVID-19 sigue en incremento, a tal nivel que en los últimos tres días se registraron 75; y hasta este sábado 4 de julio van un total de 720 pacientes fallecido",05-07-2020 00:12,https://www.bing.com/th?id=ON.2C1C45E40C79AE422705DFC54F154343,Panamá,panamaamerica.com.pa
Pandemia de COVID-19 en Panamá está en fase crítica; y especialistas pronostican que situación empeorará,https://www.panamaamerica.com.pa/sociedad/pandemia-de-covid-19-en-panama-esta-en-fase-critica-y-especialistas-pronostican-que,"El Consejo Consultivo Presidencial de Salud mediante un comunicado a la nación dejó claro que la situación de la COVID-19 en este país centroamericano está en la fase 4, que es la más avanzada de la p",05-07-2020 00:12,https://www.bing.com/th?id=ON.BE901D7D1E7B588AC7F9123734441891,Panamá,panamaamerica.com.pa
"COVID-19 sigue llenando de luto a Panamá, 22 defunciones en las últimas horas",https://noticias24pty.com/covid-19-sigue-llenando-de-luto-a-panama-22-defunciones-en-las-ultimas-horas/,"COVID-19 deja  más dolor en el mundo. Hoy, sábado 4 de julio en Panamá se contabilizan 17,761 pacientes recuperados, 988 casos positivos nuevos, para un total de acumulado de 36,983. El Ministerio de",05-07-2020 00:16,https://www.bing.com/th?id=ON.944825B55A7B7352594563144CD21923,Panamá,Noticias 24 PTY
"Dr. Lau Cortés se reúne con directores médicos de Panamá Metro, Este y Oeste",https://www.diaadia.com.pa/el-pais/dr-lau-cortes-se-reune-con-directores-medicos-de-panama-metro-este-y-oeste-368021,"Hoy 4 de julio, el director general de la Caja de Seguro Social (CSS), Dr. Enrique Lau Cortés, tuvo un encuentro con directores médicos, nacionales y jefes de servicio de Panamá Este, Oeste y Metro, c",05-07-2020 00:55,https://www.bing.com/th?id=ON.80071B71B78DE0BC19A14F159D4E90BF,Panamá,Día a Día
Panameño Christian Bethancourt dio positivo por coronavirus,https://www.critica.com.pa/deportes/panameno-christian-bethancourt-dio-positivo-por-coronavirus-582697,Medios de comunicación estadounidenses reportaron hoy sábado que el receptor panameño Christian Bethancourt es uno de los peloteros de los Filis de Filadelfia que dieron positivo por coronavirus. Matt,05-07-2020 00:56,https://www.bing.com/th?id=ON.71F814EF94AAD04EF2072759A26226E8,Panamá,Critica
"Entregan préstamos, un millón de dólares para productores de Coclé y Los Santos",https://noticias24pty.com/entregan-prestamos-un-millon-de-dolares-para-productores-de-cocle-y-los-santos/,Por un monto de un millón de dólares el Ministerio de Desarrollo Agropecuario (MIDA) y el Banco de Desarrollo Agropecuario (BDA) entregó préstamos a productores de Coclé y Los Santos del Plan Panamá A,05-07-2020 01:17,https://www.bing.com/th?id=ON.B3FE30582C108E665645DD746D746F06,Panamá,Noticias 24 PTY
