name,url,description,datePublished,imagen,pais,Fuente
El innovador estudio sobre genética y COVID-19 que se está realizando en Panamá,https://www.tvn-2.com/contenido_exclusivo/innovador-estudio-genetica-COVID-19-realizando-Panama_0_5703929551.html,"Un grupo de científicos panameños liderados por el Oficial Ejecutivo en Jefe (CEO, por sus siglas en inglés) del Instituto de Ciencias Médicas, el pediatra e investigador genetista Iván Landires, perf",28-10-2020 11:04,https://www.bing.com/th?id=OVFT.Fv2EMdfjEI4AhiA2l9OEey,Panamá,TVN
Detectan 43 casos positivos de covid-19 en el aeropuerto y 39 en Guna Yala. Reportan 12 nuevas defunciones,https://www.midiario.com/salud/detectan-43-casos-positivos-de-covid-19-en-el-aeropuerto-y-39-en-guna-yala-reportan-12-nuevas-defunciones/,"El Ministro de Salud Luis Sucre reveló que tras la reapertura de los vuelos internacionales en el Aeropuerto de Tocumen se han detectado ya 43 casos positivos del nuevo coronavirus, luego de aplicar l",28-10-2020 11:09,https://www.bing.com/th?id=OVFT.MbGBdSMeEbCTV_pkImP_Ri,Panamá,Mi Diario
"Si parrandea en fiestas Patria, puede llorar en Navidad",https://www.critica.com.pa/nacional/si-parrandea-en-fiestas-patria-puede-llorar-en-navidad-591073,"El índice de contagio del Covid-19 en Panamá o Rt bajó a .92, uno de los niveles más bajos durante la pandemia, pero el director del Seguro Social, Enrique Lau advirtió que si se decide parrandear desenfrenadamente en fiestas patrias, luego podemos ...",28-10-2020 12:00,https://www.bing.com/th?id=OVFT.uVcsOY-2mANYh7BzGP7Ouy,Panamá,Critica
Alemania y Francia preparan nuevos confinamientos,http://www.nexpanama.com/alemania-y-francia-preparan-nuevos-confinamientos/,"Alemania y Francia se preparaban para anunciar el miércoles restricciones que se acercan al nivel de los confinamientos de la pasada primavera boreal, ya que las muertes por COVID-19 subieron casi un",28-10-2020 12:04,https://www.bing.com/th?id=OVFT.xMtwzwNjc98tJOnqmiEmDC,Panamá,NEX TV
Museos de MiCultura inician reapertura escalonada,https://prnoticiaspanama.com/museos-de-micultura-inician-reapertura-escalonada/,El Ministerio de Cultura inicia la reapertura escalonada de 14 museos que estuvieron cerrados temporalmente por la pandemia de la Covid-19. El Museo de Arte Religioso Colonial es el primero en reabrir,28-10-2020 12:18,https://www.bing.com/th?id=OVFT.f1RMXZ2yKpgsoGSdRe2M_y,Panamá,PR Noticias Panama
Presidente de la ABP explica a clientes cómo extender alivio financiero,https://www.telemetro.com/entrevistas/2020/10/28/presidente-de-la-abp-explica-a-clientes-como-extender-alivio-financiero/3395911.html,"Carlos Berguido, presidente de la Asociación Bancaria de Panamá (ABP) dijo que los clientes, afectados económicamente por la pandemia del covid-19, que quieran extender el alivio financiero deberán co",28-10-2020 12:47,https://www.bing.com/th?id=OVFT.yAZvE4FpJr9hR56wyEL8ki,Panamá,Telemetro
"A los 12 años, ella es portadora prolongada de COVID-19",https://ensegundos.com.pa/2020/10/28/a-los-12-anos-ella-es-portadora-prolongada-de-covid-19/,"A principios de marzo, cuando las pruebas de coronavirus aún eran escasas, Maggie Flannery, alumna de sexto grado en Manhattan, y sus dos padres presentaron síntomas de COVID-19. Al cabo de tres seman",28-10-2020 13:00,https://www.bing.com/th?id=OVFT.aVTX_cGviBD54uydVhvVFy,Panamá,En Segundos
MiCultura: Ingreso a museos será con reserva previa,https://www.telemetro.com/entrevistas/2020/10/28/micultura-ingreso-a-museos-sera-con-reserva-previa/3396063.html,"El Ministerio de Cultura (MiCultura) anunció la reapertura escalonada de 14 museos a nivel nacional, bajo estrictas medidas de bioseguridad por la pandemia del covid-19. Anayansi Chichaco, coordinadora Nacional de Musesos, dijo que el ingreso será con ...",28-10-2020 13:56,https://www.bing.com/th?id=OVFT.Mi2PCepUpp86UW0UL6B17S,Panamá,Telemetro
"Sube el precio del bloque de arcilla, arena y piedra hasta septiembre",https://www.laestrella.com.pa/economia/201028/precio-bloque-arena-piedra-registra-incremento-septiembre,"El índice de precio del ciento del bloque de arcilla N°4 subió 1.7% y el de la yarda de arena y de piedra N°4, ambos aumentaron 1.6%, según cifras de INEC",28-10-2020 14:23,https://www.bing.com/th?id=OVFT.Xv7aoqys82UeLW8FwCNIdC,Panamá,laestrella.com.pa
Médicos a favor del tratamiento temprano de Covid-19 piden usar la hidroxicloroquina ante rebrotes,https://www.metrolibre.com/nacionales/185486-m%C3%A9dicos-favor-del-tratamiento-temprano-de-covid-19-piden-usar-la-hidroxicloroquina-ante-rebrotes.html,El grupo médico por el tratamiento temprano y profilaxis del Covid-19 emitió un comunicado en el que solicita a sus colegas recomendar y prescribir la hidroxicloroquina (HCQ) en los primeros cinco día,28-10-2020 14:29,https://www.bing.com/th?id=OVFT.qq6Q5UCW1KC4dyzUXmKcTi,Panamá,Metro Libre
Cristiano Ronaldo no entra en convocatoria de la Juve contra el Barcelona,https://ensegundos.com.pa/2020/10/28/cristiano-ronaldo-no-entra-en-convocatoria-de-la-juve-contra-el-barcelona/,"El exjugador del Real Madrid y su club esperaron en vano un test negativo que no llegó. El astro portugués de la Juventus Cristiano Ronaldo, en cuarentena desde hace dos semanas después de varios test",28-10-2020 15:04,https://www.bing.com/th?id=OVFT.KTZ_bVuWX_1ACP85USkdEC,Panamá,En Segundos
En medio de cuestionamientos avanza aprobación de presupuesto y modificación de ley de responsabilidad fiscal,https://anpanama.com/10511-En-medio-de-cuestionamientos-avanza-aprobacion-de-presupuesto-y-modificacion-de-ley-de-responsabilidad-fiscal.note.aspx,(Ciudad de Panamá-ANPanamá) En medio de críticas el Gobierno aprieta el acelarador para lograr que se aprueben en la Asamblea Nacional el presupuesto y la modificación de la ley de responsabilidad fis,28-10-2020 15:13,https://www.bing.com/th?id=OVFT.kQmjppu-gjGNZ9mqRO6v8S,Panamá,AN Panama
Rubén Blades participará como jurado del Festival Hayah 2020,https://www.critica.com.pa/show/ruben-blades-participara-como-jurado-del-festival-hayah-2020-591092,"Por la pandemia que afecta a Panamá en estos momentos, todo lo relacionado a este evento se desarrollará de manera virtual.",28-10-2020 15:13,https://www.bing.com/th?id=OVFT.vZLD6W0VLvycTUCQuG9Rbi,Panamá,Critica
Empresa introduce al mercado purificador de aire que elimina COVID-19,https://anpanama.com/10509-Empresa-introduce-al-mercado-purificador-de-aire-que-elimina-COVID-19.note.aspx,"(Ciudad de Panamá-ANPanamá) La empresa panameña Puristmo introdujo al mercado purificadores de ambientes, con tecnología ActivePure, que elimina el coronavirus, Covid-19 en el aire y en superficies, s",28-10-2020 15:13,https://www.bing.com/th?id=OVFT.emr5YV2nPkc0qWNzxvSCci,Panamá,AN Panama
El auge del comercio electrónico en tiempos de Covid-19,https://www.prensa.com/economia/el-auge-del-comercio-electronico-en-tiempos-de-covid-19/,"“Lo que hizo la Covid-19 fue catapultar el e-commerce”. Así lo expresó Mary Quintero, directora ejecutiva de Undercover Boots, durante la edición de este miércoles 28 de octubre del Café con La Prensa",28-10-2020 15:35,https://www.bing.com/th?id=OVFT.0FHFW7OfrUMZoVdp2miLnC,Panamá,prensa.com
Afrodisíaco y Los Rabanes ofrecerán un vistazo a la cultura musical panameña en el concierto de la ONU,https://www.laestrella.com.pa/cafe-estrella/cultura/201028/afrodisiaco-rabanes-ofreceran-vistazo-cultura-musical-panamena-concierto-onu,El encuentro musical Voces Unidas celebra el 75 aniversario de las Naciones Unidas. Participarán más de 40 artistas de 17 países y se transmitirá por Youtube el 30 de octubre 2020 a las 7:00 p.m.,28-10-2020 16:47,https://www.bing.com/th?id=OVFT.DpnqECmenVoviJ0_3Zabiy,Panamá,laestrella.com.pa
Minsa: reaperturas de diversas actividades en Panamá no han afectado negativamente índices relacionados a la COVID-19,https://www.panamaamerica.com.pa/sociedad/minsa-reaperturas-diversas-actividades-en-panama-no-han-afectado-negativamente-indices,"A pesar de las reaperturas de diferentes actividades, todos los índices relacionados a la COVID-19 se encuentran en un nivel aceptable, así lo dio a conocer el Ministerio de Salud (Minsa).",28-10-2020 16:56,https://www.bing.com/th?id=OVFT.38u4NPv-8X3NjdaiGIz7XS,Panamá,panamaamerica.com.pa
Recomiendan a las personas no permanecer más de 30 minutos en los cementerios por la covid-19 en Panamá,https://www.midiario.com/nacionales/recomiendan-a-las-personas-no-permanecer-mas-de-30-minutos-en-los-cementerios-por-la-covid-19-en-panama/,El Ministerio de Salud (MINSA) informó a la población que este año tendrá que cumplir con las medidas de bioseguridad y evitar aglomeraciones a la hora de visitar los cementerios y las criptas por la covid-19. Las autoridades de salud indicaron que al ...,28-10-2020 17:00,https://www.bing.com/th?id=OVFT.Oa83GUjrwO2zXv6XfCFBsS,Panamá,Mi Diario
Junta Directiva de la Cciap 2020-2021 rinde informe de gestión,https://elcapitalfinanciero.com/junta-directiva-de-la-cciap-2020-2021-rinde-informe-de-gestion/,el cuerpo diplomático y representantes de las empresas miembros del gremio empresarial siguieron la transmisión en línea por primera vez en la historia de este gremio empresarial por la crisis sanitaria del Covid-19. Informe de gestión En su informe de ...,28-10-2020 17:23,https://www.bing.com/th?id=OVFT.pzJGYp-00jpcuqm8L5UU9y,Panamá,El Capital Financiero
Ejecutivo concede rebaja de penas a extranjeros detenidos en Panamá por delitos comunes,https://www.radiopanama.com.pa/noticias/actualidad/ejecutivo-concede-rebaja-de-penas-a-extranjeros-detenidos-en-panama-por-delitos-comunes/20201028/nota/4081545.aspx,"Este martes quedó publicado en la Gaceta Oficial el Decreto Ejecutivo N° 415 del 27 de octubre de 2020, con el cual 114 detenidos que habían sido condenados por delitos comunes quedan en libertad tras",28-10-2020 17:28,https://www.bing.com/th?id=OVFT.U5aKDYpkHePXVNpXvKWW7y,Panamá,Radio Panamá
Analizan los avances del empoderamiento de la mujer en tiempo de COVID-19,http://elsiglo.com.pa/panama/analizan-avances-empoderamiento-mujer-tiempo-covid-19/24166878,Durante la reunión se realizó un repaso de las últimas labores acometidas por la Iniciativa de Paridad de Género (IPC),28-10-2020 17:39,https://www.bing.com/th?id=OVFT.dqGmfDyVj6pWadIzPKSBIS,Panamá,El Siglo
Aplicarán pruebas COVID-19 durante operativo en playas y días feriados en Veraguas,https://www.tvn-2.com/nacionales/provincias/Aplicaran-Covid-19-operativo-enVeraguasy-feriados_0_5703929595.html,Más de 2 mil pruebas de inmunofluorescencia llegaron a la provincia de Veraguas para detectar casos de la COVID-19.,28-10-2020 17:47,https://www.bing.com/th?id=OVFT.fLaAShdyr0MJynk6exG-uS,Panamá,TVN
Autoridades harán obligatorio pruebas de la COVID-19 en playas y centros comerciales,https://www.panamaamerica.com.pa/sociedad/autoridades-haran-obligatorio-pruebas-covid-19-en-playas-centros-comerciales-1174906,"Las autoridades de Salud harán obligatorio las pruebas de la COVID-19 en playas, centros comerciales y puntos de control, para detectar los casos positivos. Versión impresa Sin embargo, esta medida es cuestionada por algunas personas, quienes consideran ...",28-10-2020 18:31,https://www.bing.com/th?id=OVFT.AhdTiay6FdAFLx3cfRL-Ui,Panamá,panamaamerica.com.pa
La Alcaldía de Panamá coloca contenedor especial para almacenar mascarillas usadas,http://elsiglo.com.pa/panama/alcaldia-panama-coloca-contenedor-especial-para-almacenar-mascarillas-usadas/24166883,"Con la instalación, en los predios del Parque Francisco Arias Paredes, de un contenedor especial para almacenar mascarillas usadas, la Alcaldía de Panamá inició el Plan piloto denominado “No la tires,",28-10-2020 19:13,https://www.bing.com/th?id=OVFT.IWQoL8Y4x9Bv45DKrmlOJS,Panamá,El Siglo
Funcionario del Minsa justifica aplicación de pruebas aleatorias para Covid-19,https://www.radiopanama.com.pa/noticias/actualidad/funcionario-del-minsa-justifica-aplicacion-de-pruebas-aleatorias-para-covid19/20201028/nota/4081604.aspx,"Ante los cuestionamientos y posibles acciones legales anunciadas contra la obligatoriedad de la aplicación de pruebas para Covid-19 informada por autoridades del Minsa, el doctor Israel Cedeño indicó que la disposición forma parte de las medidas para ...",28-10-2020 19:48,https://www.bing.com/th?id=OVFT.U5aKDYpkHePXVNpXvKWW7y,Panamá,Radio Panamá
Francia decreta nuevo confinamiento a partir del viernes para frenar la Covid-19,https://www.prensa.com/mundo/francia-decreta-nuevo-confinamiento-a-partir-del-viernes-para-frenar-la-covid-19/,"El presidente de Francia, Emmanuel Macron, anunció este miércoles un nuevo confinamiento nacional para frenar el aumento de casos de la Covid-19 a partir del viernes y hasta al menos el 1 de diciembre",28-10-2020 20:00,https://www.bing.com/th?id=OVFT.9jot2W2IEM-kMm2DGAdfvy,Panamá,prensa.com
Acto de doblez de bandera marca el inicio oficial de las festividades patrias,https://www.metrolibre.com/nacionales/185517-acto-de-doblez-de-bandera-marca-el-inicio-oficial-de-las-festividades-patrias.html,"cumpliendo los protocolos establecidos por el Ministerio de Salud ante el Covid-19. El equipo del Servicio de Protección Institucional (SPI) se encargó de doblar la bandera que mide 15x28 metros y pesa 44 kilos, con este acto se inicia la conmemoración ...",28-10-2020 20:03,https://www.bing.com/th?id=OVFT.r_nJCIQGE5v6xTDdvpL7hi,Panamá,Metro Libre
Tocumen passengers warned to arrive 3-hours ahead for 41% travel surge,https://www.newsroompanama.com/news/tocumen-passengers-warned-to-arrive-3-hours-ahead-for-41-travel-surge,"Tocumen International Airport anticipates some 30,6 91 passengers during the upcoming national holidays week, a 41% increase compared to the regular average sin",28-10-2020 20:16,https://www.bing.com/th?id=OVFT.0P1tvhQ0bCY5CYTURqxyyC,Panamá,Newsroom Panama
Macron ordena un nuevo confinamiento en Francia a nivel nacional,https://www.nexpanama.com/macron-ordena-un-nuevo-confinamiento-en-francia-a-nivel-nacional/,"Francia volverá a un confinamiento nacional a partir de esta semana para tratar de contener la epidemia de COVID-19 que nuevamente amenaza con salirse de control, dijo el miércoles el presidente Emman",28-10-2020 20:18,https://www.bing.com/th?id=OVFT.ic72CpPZbDEONRPC27AHmi,Panamá,NEX TV
Thomas Christiansen habló de la convocatoria y de su paso por Europa,https://www.tvmax-9.com/somoslasele/Thomas-Christiansen-hablo-convocatoria-Europa_0_5703929614.html,El plan para aprovechar la fecha FIFA de noviembre en Europa está en marcha para la Selección de Fútbol de Panamá.,28-10-2020 20:23,https://www.bing.com/th?id=OVFT.puypduSZeS_4bTxBXXlX4i,Panamá,TVMAX
