name,url,description,datePublished,imagen,pais,Fuente
"Siguen disparadas las defunciones por covid-19. Ya suman 4,738. Este sábado reportan 2,677 nuevos contagios",https://www.midiario.com/salud/siguen-disparadas-las-defunciones-por-covid-19-ya-suman-4738-este-sabado-reportan-2677-nuevos-contagios/,"De acuerdo al informe epidemiológico del Ministerio de Salud, en Panamá, en las últimas 24 horas se han registrado 45 nuevas defunciones, y además se actualizan 4 defunciones más no contabilizadas en",17-01-2021 00:44,https://www.bing.com/th?id=OVFT.9gW5W6_CCavOCvyGCBHxiy,Panamá,Mi Diario
Manifestantes se oponen a la vacuna contra el Covid-19 en Panamá,https://www.metrolibre.com/nacionales/191697-manifestantes-se-oponen-la-vacuna-contra-el-covid-19-en-panam%C3%A1.html,"Un grupo de personas que se opone a la aplicación de la vacuna contra el Covid-19 realizó una marcha ayer en la Avenida Balboa. Con pancartas que decían ""No a la vacuna experimental, No a la vacuna ob",17-01-2021 01:22,https://www.bing.com/th?id=OVFT.j7iAv0ASfs01Z9YRmNDUiS,Panamá,Metro Libre
Aseguran que médico cubano dio positivo en COVID en Panamá,https://noticias24pty.com/aseguran-que-medico-cubano-dio-positivo-en-covid-en-panama/,"Una fuente  de salud confirmó  que uno de los 23 médicos cubanos que prestan servicios en las torres de COVID del hospital Rafael Hernández dio positivo a la prueba, procediendo a  tomarse más",17-01-2021 02:02,https://www.bing.com/th?id=OVFT.uucKKIZqtLNoZlM9WR-W7y,Panamá,Noticias 24 PTY
"Panamá entre los países que más pruebas diagnósticas aplica a su población, según la OPS",https://www.tvn-2.com/nacionales/Panama-pruebas-diagnosticas-poblacion-OPS_0_5763923606.html,"Panamá es de los países de la región que más pruebas diagnósticas aplica a su población (335.319 pruebas por millón de habitantes), según un informe de la Organización Panamericana de la Salud (OPS).",17-01-2021 02:03,https://www.bing.com/th?id=OVFT.qpBF46bunVOkAEa3xSPWuS,Panamá,TVN
Suspendidos amistosos de la selección panameña ante Martinica y Guadalupe,https://www.tvmax-9.com/somoslasele/Suspendidos-amistosos-seleccion-Martinica-Guadalupe_0_5763923626.html,"Debido a la ampliación de restricciones de entrada a Francia y sus territorios de ultramar, por parte del gobierno del país europeo, a partir del lunes 18 de enero, los partidos amistosos que sostendr",17-01-2021 02:20,https://www.bing.com/th?id=OVFT.-Y6oL_n35ROR5JwMzRS8ES,Panamá,TVMAX
"Mantener el tejido empresarial será fundamental para la recuperación a largo plazo del mercado laboral, advierte el CNC",https://elcapitalfinanciero.com/mantener-el-tejido-empresarial-sera-fundamental-para-la-recuperacion-a-largo-plazo-del-mercado-laboral-advierte-el-cnc/,"El Centro Nacional de Competitividad (CNC) advirtió que la reducción de la PEA de 66,5% a 63% y el incremento de la tasa de desempleo de 7.1% a 18.5%, como consecuencia de la pandemia de coronavirus (",17-01-2021 02:32,https://www.bing.com/th?id=OVFT.J4lOH2pqrjGrnCjhg24cqC,Panamá,El Capital Financiero
Panamá registró récord de femicidios en el 2020,https://www.laestrella.com.pa/nacional/210117/ano-pandemia-registraron-31-femicidios,"El reporte más alto que se tiene por parte del Ministerio Público es el de 2015, en el que se reportaron 29 muertes de mujeres y que se clasificaron como feminicidios, según establece la Ley 82",17-01-2021 05:04,https://www.bing.com/th?id=OVFT.hA0Msg2pQuzGGvCJZpWGIi,Panamá,laestrella.com.pa
Entran en vigencia las nuevas medidas de movilidad en Panamá,https://www.portobelostereo.net/fm/index.php/noticias/nacionales/56-entran-en-vigencia-las-nuevas-medidas-de-movilidad-en-panama,"A partir de este jueves 14 de enero, entraron en vigencia en Panamá las nuevas medidas de movilidad de los ciudadanos establecidas por las autoridades del Ministerio de Salud (Minsa), las cuales inclu",17-01-2021 05:33,https://www.bing.com/th?id=OVFT.PWK_J6aDuIRFkQ49TxauIC,Panamá,Portobelo
Simulacro de vacunas,https://www.critica.com.pa/nacional/simulacro-de-vacunas-596371,Las autoridades de Salud de Panamá desarrollaron ayer un simulacro de llegada y aplicación de la vacuna contra el Covid-19 en diferentes instituciones médicas. En la,17-01-2021 05:37,https://www.bing.com/th?id=OVFT.YgjXq25ybtp41aoop8_iOS,Panamá,Critica
Síndrome que se puede producir en los pequeños luego de la covid-19,https://www.panamaamerica.com.pa/variedades/sindrome-que-se-puede-producir-en-pequenos-luego-covid-19-1179648,"Los síntomas de la covid-19 no son tan severos en los niños como ha demostrado ser con los adultos e incluso su letalidad es baja, pero, no se debe bajar la guardia y seguir con las medidas sanitarias",17-01-2021 07:19,https://www.bing.com/th?id=OVFT.LqiMAX6i6rfZQZSS-gyTgi,Panamá,panamaamerica.com.pa
Voluntarios de la Cruz Roja Panameña han dicho presente durante pandemia de la Covid-19,https://ensegundos.com.pa/2021/01/17/voluntarios-de-la-cruz-roja-panamena-han-dicho-presente-durante-pandemia-de-la-covid-19/,"La Cruz Roja Panameña ha sido incluida, junto a los grupos que están en primera línea de batalla contra Covid-19 y están en espera que el MINSA les indique cómo será el proceso de vacunación. El presidente nacional de la Cruz Roja Panameña (CRP ...",17-01-2021 10:33,https://www.bing.com/th?id=OVFT.TroEMrADL_ETU5Y6QNAYLC,Panamá,En Segundos
Beach closing boondogle,https://www.newsroompanama.com/news/beach-closing-boondogle-3,"For Panama and West Panama it will be until March 15, and in Herrera, until February 1, according to a statement from (Sinaproc) that indicates that the measure is adopted to mitigate the Covid-19 pandemic. On January 13, the Ministry of Health (Minsa ...",17-01-2021 11:06,https://www.bing.com/th?id=OVFT.HgsVRA8Irh-GSPe0KU6MfC,Panamá,Newsroom Panama
El Milan anuncia positivos al covid-19 de Theo Hernández y Calhanoglu,https://www.prensa.com/deportes/el-milan-anuncia-positivos-al-covid-19-de-theo-hernandez-y-calhanoglu/,"El AC Milan, líder de la Serie A, sumó a su lista de bajas las del lateral francés Theo Hernández y del mediocamista turco Hakan Calhanoglu, que dieron positivo al Covid-19 y no podrán jugar el lunes",17-01-2021 11:15,https://www.bing.com/th?id=OVFT.9UZzznxn5zyPpeTVycV1NC,Panamá,prensa.com
"El Minsa reporta 2,677 casos covid-19 y 49 muertes para este sábado",https://www.panamaamerica.com.pa/sociedad/minsa-reporta-2677-casos-covid-19-49-muertes-este-sabado-1179647,"A nivel mundial se registran 51,808,931 personas recuperadas, mientras que se suman un total de 94,078,427 casos positivos por covid-19 acumulados y 2,012,048 defunciones para un porcentaje de letalidad de 2.14%. Agrega que el equipo de la coordinación de ...",17-01-2021 12:29,https://www.bing.com/th?id=OVFT.A9_00jwVaHtwzFXAsp2lxi,Panamá,panamaamerica.com.pa
CAIPIS en Panamá prestarán servicios durante todo el año bajo las medidas de bioseguridad,https://www.radiopanama.com.pa/noticias/actualidad/caipis-en-panama-prestaran-servicios-durante-todo-el-ano-bajo-las-medidas-de-bioseguridad/20210115/nota/4102015.aspx,"Vuelvas añadió que por esta razón los colaboradores de los CAIPI fueron incluidos en la fase 2, etapa 2B de vacunación determinada por el MINSA contra la COVID-19. El pasado 29 de diciembre, la ministra María Inés Castillo de Sanmartín, emitió un ...",17-01-2021 12:38,https://www.bing.com/th?id=OVFT.U5aKDYpkHePXVNpXvKWW7y,Panamá,Radio Panamá
Gobierno presenta plan de vacunación a empresarios,https://www.critica.com.pa/nacional/gobierno-presenta-plan-de-vacunacion-empresarios-596370,"El mandatario Laurentino Cortizo lideró una reunión con representantes de gremios empresariales de Panamá, a quienes les presentaron el Plan Nacional de Vacunación contra el",17-01-2021 12:42,https://www.bing.com/th?id=OVFT.mMhcR8u6rXaK5IE_Mci1cy,Panamá,Critica
Amistosos contra Martinica y Guadalupe ya no van,https://www.midiario.com/deportivas/amistosos-contra-martinica-y-guadalupe-ya-no-van/,"Pocas horas después de haber revelado la lista con la que enfrentarían esos compromisos, la Federación Panameña de Fútbol (Fepafut) anunció que los amistosos de nuestro país contra Martinica y Guadalu",17-01-2021 13:24,https://www.bing.com/th?id=OVFT.bKOSj9wjzPyqj-xynck3OC,Panamá,Mi Diario
"Crece la cifra de hospitalizados en Panamá, que lucha contra el COVID-19",https://www.telemetro.com/nacionales/2021/01/17/crece-la-cifra-de-hospitalizados-en-panama-que-lucha-contra-el-covid-19/3646746.html,"Panamá acumula ya 296.269 casos de COVID-19 y 4.738 muertes tras más de 10 meses de pandemia, en medio de un repunte del virus que se está enfrentado con restricciones a la movilidad y ha elevado a má",17-01-2021 13:57,https://www.bing.com/th?id=OVFT.badlKhaUavWj5nFMA1t2ii,Panamá,Telemetro
"“El terreno que se prende todos los años, es totalmente improductivo”, Helbecia Bonilla",https://ensegundos.com.pa/2021/01/17/el-terreno-que-se-prende-todos-los-anos-es-totalmente-improductivo-helbecia-bonilla/,"Las quemas de masa vegetal, cada año, conllevan inconvenientes para la tierra y la salud.  Regiones con mayor ocurrencia y recurrencia de quemas en el país: Los Santos, Coclé, Panamá (área metropolita",17-01-2021 14:00,https://www.bing.com/th?id=OVFT.CQ59yz887WZEemsX9oHplC,Panamá,En Segundos
"Pacientes con Covid-19 podrían experimentar una “tormenta inflamatoria”, según la CSS",https://www.metrolibre.com/nacionales/191720-pacientes-con-covid-19-podr%C3%ADan-experimentar-una-%E2%80%9Ctormenta-inflamatoria%E2%80%9D-seg%C3%BAn-la-css.html,De acuerdo con una nota de la Caja de Seguro Social (CSS) el exceso de protección inmunológica también mata. Explican que algunos pacientes con Covid-19 experimentan una reacción denominada “tormenta,17-01-2021 14:29,https://www.bing.com/th?id=OVFT.zgUrnPIbBK9t90CRdIwZVy,Panamá,Metro Libre
OMT: La covid-19 llevó al turismo a un punto muerto casi de la noche a la mañana,https://noticias24pty.com/omt-la-covid-19-llevo-al-turismo-a-un-punto-muerto-casi-de-la-noche-a-la-manana/,"“Antes de la crisis, como sector, estábamos haciendo un excelente progreso hacia la inclusividad y la sostenibilidad que ahora tenemos la oportunidad de profundizar y ampliar”. “Mi visión para reinventar el turismo se basa en mantener una ...",17-01-2021 15:07,https://www.bing.com/th?id=OVFT.2oWCOzrqK1p90R7H9ymFOC,Panamá,Noticias 24 PTY
"2% de fallecidos por COVID-19 mueren en sus casas, dice director metropolitano de Salud",https://www.radiopanama.com.pa/noticias/actualidad/2-de-fallecidos-por-covid19-mueren-en-sus-casas-dice-director-metropolitano-de-salud/20210117/nota/4102396.aspx,El Ministerio de Salud trata establecer una entre los casos de fallecimientos que se originan en las últimas 24 horas y aquellas muertes por COVID-19 que se confirman días después.,17-01-2021 15:23,https://www.bing.com/th?id=OVFT.U5aKDYpkHePXVNpXvKWW7y,Panamá,Radio Panamá
Análisis de la situación de salud vs. economía en Panamá,https://www.telemetro.com/debate-abierto-dominical/2021/01/17/debate-abierto-dominical-17-ene/3645200.html,"La situación de la salud vs. la economía en Panamá y la llegada de la vacunas para mitigar los casos del COVID-19, fueron parte de los temas analizados en Debate Abierto por autoridades y expertos com",17-01-2021 16:14,https://www.bing.com/th?id=OVFT.bP5pU-Ywofk1Ad9c66fjWy,Panamá,Telemetro
Suspendidos los amistosos de Panamá frente a Martinica y Guadalupe,https://www.cableondasports.com/futbol/internacional/suspendidos-los-amistosos-de-panama-frente-a-martinica-y-guadalupe_0_416423/,"Panamá, 17 ene (EFE).- Los partidos amistosos de Panamá ante Martinica y Guadalupe previstos la próxima semana han sido suspendidos y el país",17-01-2021 16:25,https://www.bing.com/th?id=OVFT.jgVQBJ_A5Mjgm2YuQf0kDy,Panamá,Cable Onda Sports
Panamá a la espera del arribo del primer cargamento de vacunas COVID-19,https://www.tvn-2.com/nacionales/Panama-espera-cargamento-vacunas-COVID-19_0_5764673491.html,"La viceministra de Salud, Ivette Berrios, manifestó que están a la espera de la llamada para que les den una fecha exacta del arribo del primer cargamento de vacunas contra la COVID-19 a Panamá",17-01-2021 17:18,https://www.bing.com/th?id=OVFT.7nGLO4SwzI2zM1Ye31qz_y,Panamá,TVN
