name,url,description,datePublished,imagen,pais,Fuente
Personas con VIH y enfermedades crónicas en Panamá piden que se les vacune,https://www.midiario.com/nacionales/personas-con-vih-y-enfermedades-cronicas-en-panama-piden-que-se-les-vacune/,"Desde el día uno, los pacientes con VIH en Panamá le han solicitado al Ministerio de Salud (Minsa) que los incluya en las primeras etapas de vacunación contra la covid-19, pero no han sido escuchados. LEA TAMBIÉN: Aeropuerto de Tocumen convoca por ...",07-04-2021 20:03,https://www.bing.com/th?id=OVFT.aNhBkcb3cOlpwHqJ-i62Vi,Panamá,Mi Diario
Presentan estudio sobre la alimentación y la conducta durante la pandemia en Panamá,https://www.metrolibre.com/nacionales/198503-presentan-estudio-sobre-la-alimentaci%C3%B3n-y-la-conducta-durante-la-pandemia-en-panam%C3%A1.html,"Su objetivo fue “evaluar las conductas de salud y alimentación durante el confinamiento por la pandemia de COVID-19 durante la primera ola el año pasado”, dijo Maritza Ríos, nutricionista dietista, investigadora adjunta del Centro de Investigaciones ...",07-04-2021 20:40,https://www.bing.com/th?id=OVFT.2__62SCZZ__oW8OT3TBeHi,Panamá,Metro Libre
Minsa reporta 2 defunciones por Covid-19 en las últimas horas y porcentaje de positividad es de 3.6%,https://www.prensa.com/sociedad/minsa-reporta-2-defunciones-por-covid-19-en-las-ultimas-horas-y-porcentaje-de-positividad-es-de-36/,"El Ministerio de Salud (Minsa) informó este miércoles, 7 de abril, que en las últimas 24 horas se reportan dos defunciones por la",07-04-2021 21:53,https://www.bing.com/th?id=OVFT.T12_af7yYtHUAps5II2uwi,Panamá,prensa.com
"En Panamá se han aplicado 440,787 dosis de la vacuna contra la Covid-19",https://www.prensa.com/sociedad/en-panama-se-han-aplicado-440787-dosis-de-la-vacuna-contra-la-covid-19/,"Hasta este miércoles 7 de abril en el país se han colocado 440,787 dosis de la vacuna contra la Covid-19, informó el Programa Ampliado de Inmunización del Ministerio de Salud",07-04-2021 22:26,https://www.bing.com/th?id=OVFT.KYTHA47Tc_N2vy8LO0OIGS,Panamá,prensa.com
"Desempleados y con menos de $1,000 en ingresos desmejoraron su alimentación",https://elcapitalfinanciero.com/desempleados-y-con-menos-de-1000-en-ingresos-desmejoraron-su-alimentacion/?doing_wp_cron=1617834790.9051229953765869140625,"No contar con empleo, ni estudios universitarios, además de ganar menos de $1,000, son tres condiciones que han afectado la alimentación de la población en pandemia en Panamá.Las personas desempleadas",07-04-2021 22:30,https://www.bing.com/th?id=OVFT.7DDO6OXhu0Lnjx7SRmzF9i,Panamá,El Capital Financiero
Se inicia segunda fase de vacunación contra la covid-19 en Arraiján,https://noticias24pty.com/se-inicia-segunda-fase-de-vacunacion-contra-la-covid-19-en-arraijan/,"El Ministerio de Salud (Minsa) inició este miércoles la Fase 2 de vacunación contra la covid-19 en el distrito de Arraiján, en la provincia de Panamá Oeste, donde se proyecta inocular, en un plazo de cuatro días, a 36,344 personas entre docentes ...",07-04-2021 23:13,https://www.bing.com/th?id=OVFT.Nb-Guh5yLvD0i_45IdgIJC,Panamá,Noticias 24 PTY
Panamá con 2 nuevas muertes por covid-19; autoridades analizan pedir a Covax reemplazar vacuna de AstraZeneca,https://www.laestrella.com.pa/nacional/210407/panama-registra-2-nuevas-defunciones-covid-19-autoridades-analizan-pedir-covax-reemplazar-vacuna-astrazeneca,"Para hoy se contabilizan 346,611 pacientes recuperados, 364 casos positivos nuevos, para un total acumulado de 357,277.",07-04-2021 23:13,https://www.bing.com/th?id=OVFT.0C4LAk3RB127XWWcQkNLQC,Panamá,laestrella.com.pa
Letalidad del COVID-19 se mantiene en 1.7%; hoy solo se reportan 2 muertes,https://www.critica.com.pa/nacional/letalidad-del-covid-19-se-mantiene-en-17-hoy-solo-se-reportan-2-muertes-601705,"Según destaca el informe epidemiológico del Ministerio de Salud (Minsa), en esta última jornada se aplicaron 9,981 pruebas, de las cuales 364 casos dieron positivo, con lo cual se mantiene el índice d",07-04-2021 23:44,https://www.bing.com/th?id=OVFT.svkBi28Q60mhNlYwwMV-4i,Panamá,Critica
Panamá suma 364 casos nuevos y 2 defunciones por la COVID-19 en las últimas 24 horas,https://www.tvn-2.com/nacionales/Panama-nuevos-defunciones-COVID-19-ultimas_0_5824667578.html,"Al cierre de este miércoles 7 de abril, el Sistema de Vigilancia Epidemiológica de Panamá confirmó el deceso de 2 personas y el contagio de otras 364 por la COVID-19.",08-04-2021 00:33,https://www.bing.com/th?id=OVFT.AOAmpVunruWcbH8j7KT9Qy,Panamá,TVN
Panamá reporta 364 casos positivos y 2 nuevas defunciones por Covid-19,https://www.radiopanama.com.pa/noticias/actualidad/panama-reporta-364-casos-positivos-y-2-nuevas-defunciones-por-covid19/20210407/nota/4123972.aspx,"Sobre las restricciones de los viajeros de Suramérica el ministro de salud recalcó que las medidas adoptadas por Panamá solo buscan mantener los números como se encuentran en el país actualmente, porq",08-04-2021 00:51,https://www.bing.com/th?id=OVFT.U5aKDYpkHePXVNpXvKWW7y,Panamá,Radio Panamá
"Pandemia: 484 personas hospitalizadas, 69 en UCI, hoy 364 nuevos casos",https://ensegundos.com.pa/2021/04/07/pandemia-484-personas-hospitalizadas-69-en-uci-hoy-364-nuevos-casos/,"La tasa de letalidad de la Covid-19 es de 1.7, según el informe epidemiológico del MINSA. Aunque en los últimos meses los niveles de contagios por la Covid-19 han bajado en Panamá, a la fecha unas 484",08-04-2021 01:13,https://www.bing.com/th?id=OVFT.H_swcHCOndadtRJP2ZDAaC,Panamá,En Segundos
"África que tiene unos 1 300 millones de habitantes, sólo ha administrado 11 millones de vacunas/ OMS",https://www.radiopanama.com.pa/noticias/internacional/africa-que-tiene-unos-1-300-millones-de-habitantes-solo-ha-administrado-11-millones-de-vacunas-oms/20210407/nota/4123988.aspx,"La Organización Mundial de la Salud, hace referencia en torno a las desigualdades que existen con relación al acceso a la vacuna contra el Covid-19. El argumento surge a raíz de conocer que África, que tiene unos 1 300 millones de habitantes ...",08-04-2021 01:39,https://www.bing.com/th?id=OVFT.U5aKDYpkHePXVNpXvKWW7y,Panamá,Radio Panamá
OPS: Panamá en el umbral de controlar la pandemia,https://www.critica.com.pa/nacional/ops-panama-en-el-umbral-de-controlar-la-pandemia-601722,"Panamá estaría en el umbral establecido por la Organización Mundial de la Salud (OMS) para considerar que la pandemia del Covid-19 está controlada, destaca el",08-04-2021 02:35,https://www.bing.com/th?id=OVFT.vNmHpOCq2Wrjz0KEfDa82S,Panamá,Critica
"Control de Covid-19 impulsará la economía, dicen empresarios",https://www.metrolibre.com/econom%C3%ADa/198534-control-de-covid-19-impulsar%C3%A1-la-econom%C3%ADa-dicen-empresarios.html,"Sin embargo, se mantienen optimistas en que la economía pueda recuperarse con el avance que tenga el programa de vacunación y su eficacia contra el Covid-19. La Cámara de Comercio, Industrias y Agricu",08-04-2021 10:00,https://www.bing.com/th?id=OVFT.1wqCy4KBp5SRCw-Zug4CCi,Panamá,Metro Libre
"Panamá, entre primeros países de América con mayor vacunados",https://www.telemetro.com/nacionales/panama-primeros-paises-america-mayor-vacunados-n5000759,"Panamá, que acumula 357,277 casos de COVID-19 y 6,148 muertes por la enfermedad, es el tercer país de América con mayor proporción de personas vacunadas, OPS.",08-04-2021 13:05,https://www.bing.com/th?id=OVFT.SCX_0usivMx1TJsqgemlPC,Panamá,Telemetro
"Panamá, entre los primeros países de América con mayor proporción de vacunados",https://www.laestrella.com.pa/nacional/210408/panama-primeros-paises-america-mayor-proporcion-vacunados,Las autoridades sanitarias reiteraron que trabajan para lograr más vacunas tras aprobarse el uso de la Sputnik V de Rusia,08-04-2021 13:23,https://www.bing.com/th?id=OVFT.SmLaWYJEsbwZwTONP3UFxC,Panamá,laestrella.com.pa
Extienden subsidio de la tarifa eléctrica hasta el 30 de junio de 2021,http://elsiglo.com.pa/panama/extiendensubsidio-tarifa-electrica-hasta-30-junio-2021/24175865,"El administrador de la Autoridad Nacional de los Servicios Públicos (Asep), Armando Fuentes Rodríguez, anunció la extensión",08-04-2021 13:37,https://www.bing.com/th?id=OVFT.x-Isn2SbMM4dygKi7jCG3i,Panamá,El Siglo
"Regreso a clases será en zonas de baja incidencia de casos COVID-19, ministro Sucre",https://elcapitalfinanciero.com/regreso-a-clases-sera-en-zonas-de-baja-incidencia-de-casos-covid-19-ministro-sucre/,"El ministro de salud, Luis Francisco Sucre, manifestó que el regreso a clases de forma semipresencial será un proceso que se hará en las zonas con baja incidencia de casos y las escuelas tienen que cu",08-04-2021 14:00,https://www.bing.com/th?id=OVFT.XlluqZIlTbq_egmkG4j6sy,Panamá,El Capital Financiero
"Vacunación contra la Covid-19 proyecta cubrir a 122,416 personas hasta el día sábado",https://ensegundos.com.pa/2021/04/08/vacunacion-contra-la-covid-19-proyecta-cubrir-a-122416-personas-hasta-el-dia-sabado/,"En los circuitos 8-6, 8-10 y 8-1, se pretende alcanzar, desde el lunes 5 hasta el sábado 10 abril, a 122,416 personas, incluidas adultos mayores de 60 años, educadores que laboran en los citados circu",08-04-2021 14:06,https://www.bing.com/th?id=OVFT.TNRAVBqxGGT4Rj3OkM4qTC,Panamá,En Segundos
"Covid-19: Alemania registra 20,407 nuevos contagios y 306 muertes en un día",https://www.panamaamerica.com.pa/mundo/covid-19-alemania-registra-20407-nuevos-contagios-306-muertes-en-un-dia-1184816,"El número de positivos desde el inicio de la pandemia suma 2,930,852-de los cuales unos 2,631,400 constan como pacientes recuperados- y el de víctimas mortales con o por covid-19 asciende a 77,707. VEA TAMBIÉN: Costa Rica ha vacunado al 10% de su ...",08-04-2021 14:15,https://www.bing.com/th?id=OVFT.nqzZJZF3IILWs_mcBQ_5RC,Panamá,panamaamerica.com.pa
"BCBRP inicia programa piloto de salud mental, dirigido a su personal",https://sertv.gob.pa/nacionalfm/bcbrp-inicia-programa-piloto-de-salud-mental-dirigido-a-su-personal/,"El Benemérito Cuerpo de Bomberos de la República de Panamá (BCBRP), puso en marcha, un plan piloto denominado “Salud Mental en tiempos del COVID-19”, que tiene como objetivo atender la salud mental de",08-04-2021 15:27,https://www.bing.com/th?id=OVFT.HJEMxtEMJsaz8wErStdzgy,Panamá,SERTV
"Pacientes crónicos, en lista de evaluación para recibir vacuna anticovid",https://www.tvn-2.com/nacionales/Pacientes-cronicos-evaluacion-colocacion-consejera-Salud-COVID-19-vacuna_0_5825417434.html,"La ministra consejera para Asuntos de la Salud, Eyra Ruiz, indicó que se encuentran evaluando a los pacientes crónicos para la vacunación contra la COVID-19, ya que existen diferentes tipos personas con este padecimiento. Ruiz agregó que existen ...",08-04-2021 15:39,https://www.bing.com/th?id=OVFT.8LWoZp1dOTRUWA40OtV2hC,Panamá,TVN
"Rebajas de pena y repatriaciones, medidas adoptadas en pandemia para salvaguardar la vida de reos",https://www.panamaamerica.com.pa/judicial/rebajas-pena-repatriaciones-medidas-adoptadas-en-pandemia-salvaguardar-vida-reos-1184829,Redacción / [email protected] / @panamaamerica - Actualizado: 08/4/2021 - 02:44 pm Más de 3 mil personas privadas de libertad se han recuperado de la covid-19 en Panamá. Foto: Cortesía Sistema Penitenciario Coronavirus /COVID-19 /Ministerio de ...,08-04-2021 19:43,https://www.bing.com/th?id=OVFT.zEYf89sMb3JTc0Z6wn1nqC,Panamá,panamaamerica.com.pa
Los Santos. Reportan primer caso de hantavirus,https://www.midiario.com/salud/los-santos-reportan-primer-caso-de-hantavirus/,"En los primeros cinco meses del 2020 en Panamá se reportaron siete casos de hantavirus, entre ellos una señora con covid-19, que por fortuna pudo sobrevivir. Según Salud, no se han descuidado con las otras patologías sanitarias y por ello se mantienen ...",08-04-2021 19:48,https://www.bing.com/th?id=OVFT.UMh_4nmfMvgm1RtI_uBlMy,Panamá,Mi Diario
