name,url,description,datePublished,imagen,pais,Fuente
Ya están en Panamá las vacunas para ensayo clínico contra la Covid-19,https://www.tvn-2.com/especiales/covid-19/Llegan-Panama-vacunas-ensayo-clinico-contra-Covid-19_0_5670932933.html,Ya llegaron las vacunas para el estudio clínico contra la Covid-19 a Panamá. En tanto se continua con el proceso para identificar a los voluntarios que deben cumplir ciertos requisitos y comprometerse,15-09-2020 00:39,https://www.bing.com/th?id=OVFT.o1CjtsTfLFSEwOKxBjCtTS,Panamá,TVN
El mundo bate un récord y registra casi 2 millones de casos de coronavirus en una semana,https://www.prensa.com/mundo/el-mundo-bate-un-record-y-registra-casi-2-millones-de-casos-de-coronavirus-en-una-semana/,"El mundo registró cerca de 2 millones de casos de la Covid-19 la semana pasada, una cifra récord, mientras que el número de decesos disminuyó con respecto a la semana precedente, según los datos divulgados este martes por la Organización Mundial de ...",22-09-2020 12:13,https://www.bing.com/th?id=OVFT.HMvT8aXcDRYU_BlQXGtGLi,Panamá,prensa.com
"Mediante Factoring, Caja de Ahorros financia transacciones comerciales",https://noticias24pty.com/mediante-factoring-caja-de-ahorros-financia-transacciones-comerciales/,"La situación económica para los empresarios en Panamá no está nada bien, debido a que por varios meses no pudieron operar de manera regular por motivo de la pandemia por COVID-19, sin embargo, como pa",22-09-2020 12:19,https://www.bing.com/th?id=OVFT.vyp7GjdPo0aqIkAt7IpPRC,Panamá,Noticias 24 PTY
Italia aprueba reducir su parlamento en medio de la pandemia,https://www.radiopanama.com.pa/noticias/internacional/italia-aprueba-reducir-su-parlamento-en-medio-de-la-pandemia/20200922/nota/4071992.aspx,"Italia ha registrado 5 mil nuevos casos positivos de COVID-19 en los últimos 3 días, y permanece como el país con menor número de contagios de la región. Aunque si se mira la cantidad de fallecidos, aparece en el primer lugar desde el inicio de la ...",22-09-2020 12:38,https://www.bing.com/th?id=OVFT.U5aKDYpkHePXVNpXvKWW7y,Panamá,Radio Panamá
El Reino Unido vuelve a imponer toque de queda para combatir el COVID.19,https://www.radiopanama.com.pa/noticias/internacional/el-reino-unido-vuelve-a-imponer-toque-de-queda-para-combatir-el-covid19/20200922/nota/4071998.aspx,"En medio de la pandemia del COVID-19, el gobierno del Reino Unido vuelve a imponer medidas de restricción, para combatir los contagios. El toque de queda desde las 10 de la noche para bares y restaura",22-09-2020 12:49,https://www.bing.com/th?id=OVFT.U5aKDYpkHePXVNpXvKWW7y,Panamá,Radio Panamá
"Proyecto de reserva hídrica, principal objetivo del Canal de Panamá en su presupuesto 2021",https://anpanama.com/10398-Proyecto-de-reserva-hidrica-principal-objetivo-del-Canal-de-Panama-en-su-presupuesto-2021.note.aspx,"(Ciudad de Panamá-ANPanamá) Con el proyecto de proveer recursos hídricos para los ciudadanos y la operación del Canal de Panamá, la administración de la vía presentó su presupuesto a la Asamblea Nacio",22-09-2020 13:54,https://www.bing.com/th?id=OVFT.u3Q-XUgUW9TTY7v3c4i4fy,Panamá,AN Panama
Pompeo elogia a Cortizo en Twitter,https://radioreformaseoye.com/internacionales/pompeo-elogia-a-cortizo-en-twitter/,"Según la vocera Ortagus, Estados Unidos ha proporcionado más de 4 millones para enfrentar la pandemia ocasionada por la Covid-19. El secretario de Estado ... NitoCortizo today about our strong U.S.-Panama partnership. Panama remains a key regional ...",22-09-2020 14:16,https://www.bing.com/th?id=OVFT.Wkx4XbOGa9YbjQX_sa-wCC,Panamá,Radio Reforma se Oye
"Canal de Panamá sustenta presupuesto 2021 por $3,308.9 millones",https://www.laestrella.com.pa/economia/200922/canal-panama-sustenta-presupuesto-2021-base-ingresos-3-308-9-millones,"Pese a que la pandemia de la covid-19 aún sigue impactando las economías del mundo, el administrador del Canal de Panamá, Ricaurte Vásquez Morales, estimó para la vigencia fiscal 2021 ingresos por $3,308.9 millones y aportes al Tesoro Nacional por $ ...",22-09-2020 14:22,https://www.bing.com/th?id=OVFT.C35K3ZaZ9t5AARwbXby21y,Panamá,laestrella.com.pa
Reino Unido impone restricciones de seis meses para frenar nueva ola de COVID-19,http://www.nexpanama.com/reino-unido-impone-restricciones-de-seis-meses-para-frenar-nueva-ola-de-covid-19/,"El primer ministro Boris Johnson pidió el martes a los británicos que trabajen desde casa siempre que sea posible y ordenó el cierre más temprano de restaurantes y bares para frenar la rápida propagación de una segunda ola de coronavirus, con ...",22-09-2020 14:48,https://www.bing.com/th?id=OVFT.dC1KwEAGWa1RjKYP4AykES,Panamá,NEX TV
Universidad de Panamá presenta propuesta para la reactivación económica del país,https://ensegundos.com.pa/2020/09/22/universidad-de-panama-presenta-propuesta-para-la-reactivacion-economica-del-pais/,"La Universidad de Panamá presentó un plan para la reactivación económica del país, en medio de la pandemia por el Covid-19, que ha mantenido al Estado con severas medidas sanitarias y económicas por al menos seis meses. En el documento, que contempla ...",22-09-2020 15:55,https://www.bing.com/th?id=OVFT.JWJTDEEtQPeTNRXadpJsoC,Panamá,En Segundos
Canal de Panamá sustenta presupuesto del AF 2021 en la Asamblea Nacional,https://www.panamaamerica.com.pa/economia/canal-de-panama-sustenta-presupuesto-del-af-2021-en-la-asamblea-nacional-1172584,"por la vía interoceánica transitarán 429.2 millones de toneladas CP/SUAB (Sistema Universal de Arqueo de Buques del Canal de Panamá), con base en el comportamiento de la economía mundial tras el impacto de la pandemia de Covid-19. Para la vigencia ...",22-09-2020 16:05,https://www.bing.com/th?id=OVFT.UKJ5zD3m3J40BXB1Fu5yoy,Panamá,panamaamerica.com.pa
Fue citado el propietario del local donde se grabó el video,https://tucomunidad.com.pa/2020/09/fue-citado-el-propietario-del-local-donde-se-grabo-el-video/,"solicitaran el permiso respectivo ante el Ministerio de Salud (Minsa), en medio de las medidas sanitarias impuestas para evitar la propagación de la Covid-19″, indicó el médico Cedeño, quien aseguró que el dueño del local fue citado para este martes.",22-09-2020 16:07,https://www.bing.com/th?id=OVFT.m-v49DsbMBgp0CuOi7sNQi,Panamá,Tu Comunidad
Mercados higiénicos y en estricto cumplimiento de normas de bioseguridad,https://www.critica.com.pa/nacional/mercados-higienicos-y-en-estricto-cumplimiento-de-normas-de-bioseguridad-588441,"Además de la higiene y cadena de frío para los productos del mar. Todos estos protocolos se accionan para evitar el contagio de Covid-19. En tanto, en Merca Panamá dos veces a la semana se desarrollan jornada de limpieza en la parte exterior por la ...",22-09-2020 16:09,https://www.bing.com/th?id=OVFT.wFblBz7hXXXS7X9DJDBUKy,Panamá,Critica
Political “hoax” anti masker killed by Covid-19,https://www.newsroompanama.com/news/political-hoax-anti-masker-killed-by-covid-19,A former Republican councilman who opposed mask-wearing and spread conspiracy theories about COVID-19 on social media has died from the disease one of many deni,22-09-2020 18:15,https://www.bing.com/th?id=OVFT.Nfo5GtzPA5Myua15dbrtYy,Panamá,Newsroom Panama
Más de 700 nicaragüenses salieron de Panamá durante septiembre,https://ensegundos.com.pa/2020/09/22/mas-de-700-nicaraguenses-salieron-de-panama-durante-septiembre/,"Las fronteras continúan cerradas como medida de bio-seguridad para prevenir contagios por COVID-19. Cualquier solicitud de salida humanitaria, se debe canalizar por medio de las vías diplomáticas del país de origen. Inspectores migratorios del Puesto ...",22-09-2020 18:38,https://www.bing.com/th?id=OVFT.3OfavWQA3rfztQzoIKeKqC,Panamá,En Segundos
Inician convocatorias en Panamá para Online Cup Centroamérica de Tiro con Arco,https://www.tvmax-9.com/mas_deportes/Inician-Panama-Online-Centroamerica-Tiro_0_5676932307.html,"La Asociación Nacional de Tiro con Arco de Panamá (ANTAP) tiene el placer de convocar al Online Cup Centroamérica, evento que será respaldado por World Archery Americas y que contará con la participac",22-09-2020 18:54,https://www.bing.com/th?id=OVFT.W4fN2Y8W4y397RpHI96VBi,Panamá,TVMAX
Consumidores desconfían de una mejora económica pese a reapertura en Panamá,https://www.diaadia.com.pa/el-pais/consumidores-desconfian-de-una-mejora-economica-pese-reapertura-en-panama-370627,"El consumidor panameño no confía en que haya una mejora de la economía a pesar de la reapertura de las actividades productivas en el marco de la pandemia del COVID-19, que obligó a semiparalizar al pa",22-09-2020 20:21,https://www.bing.com/th?id=OVFT.fslkjsDkRdmi7BMGsgsWzy,Panamá,Día a Día
Congelan programa de Meduca,https://www.critica.com.pa/nacional/congelan-programa-de-meduca-588454,"Tras cerca de ocho meses, de permanecer cerradas a causa de la pandemia de la COVID-19, el deterior de las escuelas de la provincia de Panamá Oeste a consecuencia de la falta de mantenimiento es evide",22-09-2020 20:39,https://www.bing.com/th?id=OVFT.J3_pF8Up2UfH5kkyy06wUS,Panamá,Critica
Nicaragua espera a 312 nacionales que estaban varados en Panamá por pandemia,https://www.midiario.com/mundo/nicaragua-espera-a-312-nacionales-que-estaban-varados-en-panama-por-pandemia/,"La vicepresidenta nicaragüense, Rosario Murillo, dijo que “hoy regresan 312 hermanos y hermanas que llegan desde Panamá con sus pruebas para la covid-19 negativas”. Con el arribo de dicho grupo el número de nicaragüenses que ha regresado de Panamá ...",22-09-2020 20:41,https://www.bing.com/th?id=OVFT.jmMXSs82SCWn6K78TY9Sey,Panamá,Mi Diario
Un panameño domina las olas de Hawaii,http://www.rpctv.com/deportes/otros_deportes/panameno-domina-olas-Hawaii_0_1394260566.html,"El hijo de Santa Catalina, Isauro Elizondo, se encuentra actualmente en Hawaii, la meca del surf a nivel mundial, con la intención de mejorar su técnica y prepararse para futuras competencias, entre e",22-09-2020 20:48,https://www.bing.com/th?id=OVFT.qemW98fz0kXO3-z3tP4zqC,Panamá,RPCTV
Continúa entrega de bonos solidarios a futbolistas y entrenadores en Panamá,https://www.tvmax-9.com/futbol_nacional/Continua-solidarios-futbolistas-entrenadores-Panama_0_5676932319.html,"con el fin de apoyar a los deportistas en medio de la pandemia del COVID-19. Los jugadores beneficiados en el plan social forman parte de la Asociación de Futbolistas Panameños, al igual que los miembros de la Asociación Profesional de Entrenadores y ...",22-09-2020 20:57,https://www.bing.com/th?id=OVFT.dkuu5sIkHc7xxnIQjENTQi,Panamá,TVMAX
170 litros de aceite usado ha recolectado el Programa Saneamiento de Panamá,http://elsiglo.com.pa/panama/170-litros-aceite-usado-recolectadoel-programa-saneamiento-panama/24164618,"Durante los meses que ha durado la Pandemia de la covid 19, el Programa Saneamiento de Panamá ha recolectado un total de 170 litros de aceite vegetal usado, que representa 45 galones. Este programa, busca reducir las incidencias de grasa en el ...",22-09-2020 21:16,https://www.bing.com/th?id=OVFT.tFM1ONHMcL2-BDEGWFuIEi,Panamá,El Siglo
Panamá pone fin a extensiones de acuerdo de empleo para gente de mar,https://anpanama.com/10400-Panama-pone-fin-a-extensiones-de-acuerdo-de-empleo-para-gente-de-mar.note.aspx,"para efectuar los cambios de tripulación generados por la pandemia del coronavirus (COVID-19) y en pro de la gente de mar. En un principio, la tripulación no podía desembarcar por las restricciones existentes en los puertos, aeropuertos y distintos ...",22-09-2020 21:16,https://www.bing.com/th?id=OVFT.NjVL8mTqvBJQ-QujpF2a3y,Panamá,AN Panama
Panamá reserva $20 millones para la adquisición de una vacuna contra la covid-19,https://www.laestrella.com.pa/nacional/200922/panama-reserva-20-millones-adquisicion-vacuna-covid-19,para la adquisición de la vacuna más segura y eficaz que finalmente se produzca para controlar de manera permanente el virus la covid-19. “Esta suma permite al Gobierno Nacional acceder a una cartera de vacunas a través del mecanismo multinacional Cov ...,22-09-2020 21:53,https://www.bing.com/th?id=OVFT.Br9SKYGE9yf9l1aNImEUhS,Panamá,laestrella.com.pa
Panamá reservará B/.20 millones del Fondo de Ahorro para la compra de vacuna contra el COVID-19,https://www.telemetro.com/nacionales/2020/09/22/panama-reservara-millones-vacuna-covid-19/3263268.html,"En la sesión de este martes 22 de septiembre en el Consejo de Gabinete se aprobó la reserva de 20 millones de balboa, provenientes del Fondo de Ahorro de Panamá, para la adquisición de la vacuna más s",22-09-2020 21:56,https://www.bing.com/th?id=OVFT.A-Dfwd_lvFtihT9Cjn2kJi,Panamá,Telemetro
Gabinete aprueba reserva de $20 millones para adquisición de vacuna contra la COVID-19,https://www.tvn-2.com/nacionales/Gabinete-aprueba-millones-adquisicion-vacuna-COVID-19_0_5676932327.html,"La reservación de $20 millones provenientes del Fondo de Ahorro de Panamá, para la adquisición de la vacuna más segura y eficaz que finalmente se produzca para controlar de manera permanente el virus de la COVID-19, fue aprobada este martes ...",22-09-2020 22:06,https://www.bing.com/th?id=OVFT.WkX5TLQ3vyB4WhQB3V6a4y,Panamá,TVN
"Panamá reserva fondos para la vacuna más segura y eficaz, afirma el Gabinete",https://www.metrolibre.com/nacionales/182580-panam%C3%A1-reserva-fondos-para-la-vacuna-m%C3%A1s-segura-y-eficaz-afirma-el-gabinete.html,"El Consejo de Gabinete aprobó en su sesión de este martes, 20 de septiembre, reservar “20 millones de balboas provenientes del Fondo de Ahorro de Panamá, para la adquisición de la vacuna más segura y",22-09-2020 22:26,https://www.bing.com/th?id=OVFT.znqTUA2caE3fCeI9QNZ3KC,Panamá,Metro Libre
Gobierno reserva 20 millones del Fondo de Ahorro de Panamá para la vacuna contra Covid-19,http://elsiglo.com.pa/panama/gobierno-reserva-20-millones-fondo-ahorro-panama-para-vacuna-contra-covid-19/24164620,"El Gobierno toma esta decisión en la lucha contra la pandemia, aunada a otras medidas que buscan mitigar las secuelas del impacto de salud La reserva de 20 millones de balboas, del Fondo de Ahorro de",22-09-2020 23:35,https://www.bing.com/th?id=OVFT.3dPKG6rOaHXabhhYLQYxGS,Panamá,El Siglo
Se registran 474 nuevos casos de Covid-19; Rt se mantiene por debajo de 1,https://www.prensa.com/sociedad/se-registran-474-nuevos-casos-de-covid-19-rt-se-mantiene-por-debajo-de-1/,"Israel Cedeño, director de la Región Metropolitana de Salud brinda informe de Covid-19. El reporte epidemiológico del Ministerio de Salud (Minsa) de este martes 22 de septiembre registra 474 nuevos casos de la Covid-19 y 13 decesos en las 24 últimas horas.",22-09-2020 23:43,https://www.bing.com/th?id=OVFT.2XV-V6m8GpdvrAQfvKy_ey,Panamá,prensa.com
Panamá reporta 474 nuevos casos de Covid-19,https://www.metrolibre.com/nacionales/182589-panam%C3%A1-reporta-474-nuevos-casos-de-covid-19.html,"El Ministerio de Salud de Panamá (Minsa) informó sobre la detección de 474 nuevos casos de coronavirus para hoy, martes 22 de septiembre de 2020. Mientras que, se contabilizaron 13 defunciones en las últimas 24 horas. Con los nuevos datos brindados en ...",22-09-2020 23:52,https://www.bing.com/th?id=OVFT.Mc5XOz1t8Xv7-T60k9x0mi,Panamá,Metro Libre
Martinelli and ex-boxer in virus-flouting video,https://www.newsroompanama.com/news/martinelli-and-ex-boxer-in-virus-flouting-video,"Durán already had coronavirus and his $30,000 treatment was assumed by the Presidency. ""The owner of the premises is being summoned and we will also summon the producer and see where the non-compliance and the pertinent sanctions fit,” Cedeño said in ...",23-09-2020 00:04,https://www.bing.com/th?id=OVFT.m-v49DsbMBgp0CuOi7sNQi,Panamá,Newsroom Panama
Gobierno separa 20 millones de dólares del Fondo de Ahorro de Panamá para la compra de la vacuna contra la COVID-19,https://www.panamaamerica.com.pa/sociedad/gobierno-separa-20-millones-de-dolares-del-fondo-de-ahorro-de-panama-para-la-compra-de-la,para la adquisición de la vacuna más segura y eficaz que finalmente se produzca para controlar de manera permanente la COVID-19. Versión impresa Se informó que con esta suma permite al Gobierno Nacional acceder a una cartera de vacunas a través del ...,23-09-2020 00:13,https://www.bing.com/th?id=OVFT.ed9XqRabH4Ui0PW9mgtKQC,Panamá,panamaamerica.com.pa
Rt del COVID-19 en Panamá sube a 0.96,https://www.telemetro.com/nacionales/2020/09/23/rt-covid-19-panama-sube/3263530.html,"Las defunciones marcaron una caída hasta la semana del 14 de septiembre, luego un ligero ascenso, sin embargo sigue a la baja, explicó Cedeño. Panamá y Darién son las provincias más afectadas por la pandemia con más de 3 mil casos. En la región ...",23-09-2020 00:20,https://www.bing.com/th?id=OVFT.0mapYzPqk6rsg5P1CCnfwi,Panamá,Telemetro
