name,url,description,datePublished,imagen,pais,Fuente
"Repitamos ‘burbuja familiar’. Minsa reporta 1,344 casos nuevo por la covid-19 en Panamá",https://www.midiario.com/salud/repitamos-burbuja-familiar-minsa-reporta-1344-casos-nuevo-por-la-covid-19-en-panama/,"Este domingo 15 de noviembre se reportaron 6 nuevos decesos y 1,344 casos positivos de la COVID-19 en Panamá. Hasta el momento van acumulados 146,653 casos. de los cuales 125,370 se han recuperado y 2",16-11-2020 08:18,https://www.bing.com/th?id=OVFT.V3Xift_rpDxs9HYOo6TgHy,Panamá,Mi Diario
"Repunte de casos, las personas han bajado la guardia ante el COVID-19",https://www.tvn-2.com/nacionales/Repunte-casos-personas-bajado-guardia-COVID-19_0_5718178133.html,"Las últimas semanas epidemiológicas se ha experimentado un repunte en los casos de la COVID-19, lo que ha encendido las alarmas en el Ministerio de Salud, que ya toma medidas en algunos sectores y no",16-11-2020 12:30,https://www.bing.com/th?id=OVFT.zu5agc9aEfluMemKaGN6Ti,Panamá,TVN
"Exalcaldes, pastores y policías le quitan la buhonería a familias humildes de Penonomé",http://elsiglo.com.pa/panama/exalcaldes-pastores-policias-quitan-buhoneria-familias-humildes-penonome/24167900,"El desalojo e investigación de cada uno de los propietarios de los kioscos o puestos de buhonería ubicados en las aceras de la vía principal en Penonomé, trajo consigo una sorpresa, al descubrirse que",16-11-2020 15:19,https://www.bing.com/th?id=OVFT.4RR7qF20UWtAD3pDJT8lUC,Panamá,El Siglo
Copa Airlines retomará vuelos comerciales regulares a Venezuela,https://elcapitalfinanciero.com/copa-airlines-retomara-vuelos-comerciales-regulares-a-venezuela/,"La aerolínea panameña Copa Airlines informó que recibió la autorización para restablecer sus vuelos regulares a Venezuela, a partir del 24 de noviembre.",16-11-2020 17:00,https://www.bing.com/th?id=OVFT.y0F0bEn-Sl37_kgYnIMUGy,Panamá,El Capital Financiero
"Panamá acumula 147,667 casos positivos de Covid-19",https://ensegundos.com.pa/2020/11/16/panama-acumula-147667-casos-positivos-de-covid-19/,"Los hospitalizados suman 871 y de ellos 710 se encuentran en sala y 161 en UCI. El Ministerio de Salud (Minsa), informó este lunes 16 de noviembre, que,  en Panamá se contabilizan 1,014 casos positivo",16-11-2020 23:00,https://www.bing.com/th?id=OVFT.PNNL6DzGkbYoX9kE1om13S,Panamá,En Segundos
"Aumentan a 147,667 los casos de COVID-19 en Panamá tras registrar 1,014 nuevos contagios",https://www.telemetro.com/nacionales/2020/11/16/aumentan-casos-covid-19-panama/3463919.html,"Panamá registró un total de 1,014 nuevos contagios de coronavirus en las últimas 24 horas, con lo cual la cifra acumulada de casos se eleva a 147,667 para este lunes 16 de noviembre.",16-11-2020 23:00,https://www.bing.com/th?id=OVFT.FAadyx7G7P-KF-pQ4RrP_C,Panamá,Telemetro
Panamá reporta por sexto día consecutivo más de mil pacientes recuperados de la COVID-19,https://noticias24pty.com/panama-reporta-por-sexto-dia-consecutivo-mas-de-mil-pacientes-recuperados-de-la-covid-19/,"La cifra de mil pacientes recuperados de la COVID-19 en Panamá se volvió a repetir este lunes por sexto día consecutivo, según el reporte epidemiológico del Ministerio de Salud (Minsa).Versión",17-11-2020 00:28,https://www.bing.com/th?id=OVFT.ncxZSZBna8Ef-XUxy1nJ_i,Panamá,Noticias 24 PTY
Panamá explica cómo se prepara para obtener la vacuna contra el COVID-19 tras informe de la compañía Moderna,https://www.telemetro.com/nacionales/2020/11/17/panama-explica-como-se-prepara-para-obtener-la-vacuna-contra-el-covid-19-tras-informe-de-la-compania-moderna/3464315.html,"El mundo amanece hoy con importantes avances sobre la efectividad de una de las vacunas contra la COVID-19, Moderna, un proyecto fabricado por expertos norteamericanos que asegura tener un 94.5 % de e",17-11-2020 00:44,https://www.bing.com/th?id=OVFT.1cElTGlguKQyUdWgcA7r1C,Panamá,Telemetro
Panamá alcanza los 147 mil 667 casos de la covid-19,https://www.midiario.com/nacionales/panama-alcanza-los-147-mil-667-casos-de-la-covid-19/,"El Ministerio de Salud (Minsa) informó que para este lunes 16 de noviembre, Panamá alcanzó los 147 mil 667 casos acumulados de coronavirus, tras registrar un total de mil 14 nuevos",17-11-2020 01:19,https://www.bing.com/th?id=OVFT.5B4rGvlWrv6ujM6p6Oebti,Panamá,Mi Diario
"Resultados de la vacuna de Moderna son ‘increíblemente impresionantes’, dice Anthony Fauci",https://www.prensa.com/salud-ciencia/resultados-de-la-vacuna-de-moderna-son-increiblemente-impresionantes-dice-anthony-fauci/,"El inmunólogo Anthony Fauci, asesor de la Casa Blanca durante la pandemia de Covid-19, calificó este lunes de “increíblemente impresionantes” los primeros resultados de la vacuna del laboratorio estad",17-11-2020 04:29,https://www.bing.com/th?id=OVFT.ZPIlrSclQ1cYRitQmVWyuS,Panamá,prensa.com
Rumbo a 150 mil contagiados de Coronavirus en Panamá,https://www.critica.com.pa/nacional/rumbo-150-mil-contagiados-de-coronavirus-en-panama-592437,"La semana 47 del Covid-19 en Panamá arrancó con 1,014 nuevos contagios con una tasa de positividad del 14% y la proyección de alcanzar antes",17-11-2020 05:06,https://www.bing.com/th?id=OVFT.X9rWwDJRl8eGbd6IxTdkeC,Panamá,Critica
Christian Bethancourt peleó cara a cara contra el COVID-19,https://www.diaadia.com.pa/deportes/christian-bethancourt-peleo-cara-cara-contra-el-covid-19-372500,"El receptor panameño Christian Bethancourt está listo para jugar con las Estrellas Orientales en la temporada 2020-2021 de la Liga de Béisbol Profesional de República Dominicana (Lidom), pe",17-11-2020 05:20,https://www.bing.com/th?id=OVFT.toOPnUsaQ3O1XFg7qOnh6y,Panamá,Día a Día
Hubo más de mil casos nuevos ayer,https://www.panamaamerica.com.pa/nacion/hubo-mas-mil-casos-nuevos-ayer-1176120,"Panamá volvió a registrar ayer más de mil contagios del virus que causa la COVID-19, con lo que la alerta de los organismos de salud se mantiene activa. En total, fueron 1,014 casos positivos nuevos y",17-11-2020 06:00,https://www.bing.com/th?id=OVFT.Rg0TjEuq30ziq_kR2V4URy,Panamá,panamaamerica.com.pa
Suárez marginado de la selección de Uruguay por dar positivo de COVID-19,http://www.nexpanama.com/suarez-marginado-de-la-seleccion-de-uruguay-por-dar-positivo-de-covid-19/,"Con la baja del goleador Luis Suárez contagiado de COVID-19, Uruguay recibirá el martes a la selección de Brasil, líder de las eliminatorias sudamericanas para el Mundial de Qatar 2022, en busca de ma",17-11-2020 14:30,https://www.bing.com/th?id=OVFT.RrNY573-2tmhgHFd-TSU5i,Panamá,NEX TV
"Boris Johnson da negativo por COVID-19, pero sigue autoaislado",https://www.nexpanama.com/boris-johnson-da-negativo-por-covid-19-pero-sigue-autoaislado/,"El primer ministro de Reino Unido, Boris Johnson, dio negativo por COVID-19, dijo su portavoz el martes, pero seguirá en régimen de autoaislamiento, de acuerdo a las normas del gobierno. “Se hizo el t",17-11-2020 14:54,https://www.bing.com/th?id=OVFT.ZX5bsokKbx5GXRL5ez3zGS,Panamá,NEX TV
Putin insta a BRICS a producir masivamente vacunas rusas contra covid-19,https://ensegundos.com.pa/2020/11/17/putin-insta-a-brics-a-producir-masivamente-vacunas-rusas-contra-covid-19/,"El presidente ruso, Vladimir Putin, instó este martes a los países integrantes del grupo BRICS a que produzcan las vacunas de diseño ruso contra covid-19. Sin embargo, no ofreció detalles específicos",17-11-2020 15:49,https://www.bing.com/th?id=OVFT.29rQHpl6pz-lWfRfUzlqES,Panamá,En Segundos
Moderna dice que demora en firma del contrato de vacunas con Europa retrasará la entrega,https://www.prensa.com/mundo/moderna-dice-que-demora-en-firma-del-contrato-de-vacunas-con-europa-retrasara-la-entrega/,El director general de la biotecnológica estadounidense Moderna dijo este martes a los europeos que la prolongación de las negociaciones para la compra de su vacuna contra la Covid-19 puede retrasar l,17-11-2020 16:01,https://www.bing.com/th?id=OVFT.FXOpkDhd-xcEsFKkoclIgi,Panamá,prensa.com
"Covid-19 Panamá: casos, 147,667; fallecidos, 2,881; recuperados, 126,746; pruebas realizadas, 772,702",https://noticias24pty.com/covid-19-panama-casos-147667-fallecidos-2881-recuperados-126746-pruebas-realizadas-772702/,El 9 de marzo el Ministerio de Salud reportó el primer caso confirmado de coronavirus Covid-19 en Panamá. A partir de la fecha el ministerio ha reportado diariamente a través de conferencias de,17-11-2020 16:34,https://www.bing.com/th?id=OVFT.0Ac1hvVP1ncWkRhNJP-8XS,Panamá,Noticias 24 PTY
Después de ocho meses ya puede ir al gimnasio,http://elsiglo.com.pa/panama/despues-ocho-meses-puede-gimnasio/24167961,"Panamá, que acumula 147.667 casos de la covid-19 y 2.881 defunciones, reabrió este lunes los gimnasios en todo el país bajo protocolos de bioseguridad, tras permanecer cerrados por más de ocho meses p",17-11-2020 16:41,https://www.bing.com/th?id=OVFT.L1pETpZ8IKAm7Z1k1uJSjC,Panamá,El Siglo
20 casos de Covid-19 en Pedasí asociados a un culto,https://www.critica.com.pa/provincias/20-casos-de-covid-19-en-pedasi-asociados-un-culto-592471,"Hernández dijo que de acuerdo con la investigación, estas personas no estaban cumpliendo con las medidas de bioseguridad duante el desarrollo de la actividad religiosa.",17-11-2020 17:25,https://www.bing.com/th?id=OVFT.AKRaS4nGfwrna0OT90vmqi,Panamá,Critica
