name,url,description,datePublished,imagen,pais,Fuente
"Panamá registra una ""dramática"" disminución de muertes por la covid-19",https://www.msn.com/es-us/noticias/mundo/panam%C3%A1-registra-una-dram%C3%A1tica-disminuci%C3%B3n-de-muertes-por-la-covid-19/ar-AAL9Y2P,"Panamá ha registrado en los últimos meses una disminución ""dramática"" de las muertes por la covid-19, especialmente entre las personas de entre 60 y 80 años, un comportamiento atribuido a la vacunació",17-06-2021 18:57,https://www.bing.com/th?id=OVFT.jIcFvtj4xYKz0enPbZtxGi,Panamá,MSN
Panamá expone sus ventajas como Hub de Manufactura y Logística,https://elcapitalfinanciero.com/panama-expone-sus-ventajas-como-hub-de-manufactura-y-logistica/,"La logística de clase mundial panameña, las zonas económicas especiales y el nuevo marco legal enfocado en la manufactura y sus servicios relacionados, brindan una gran oportunidad para que las empres",17-06-2021 21:45,https://www.bing.com/th?id=OVFT.SCrJnOFXc_ArnJpcR2FgRy,Panamá,El Capital Financiero
Panamá llega a 391.190 casos de la covid-19 y 6.458 defunciones,https://www.msn.com/es-us/noticias/mundo/panam%C3%A1-llega-a-391190-casos-de-la-covid-19-y-6458-defunciones/ar-AAL9Y2P,"El Ministerio de Salud de Panamá (Minsa) informó este jueves de 969 nuevos casos de la covid-19 y un deceso por la enfermedad, que hacen un total de 391.190 contagios confirmados y 6.458 defunciones e",18-06-2021 01:30,https://www.bing.com/th?id=OVFT.jIcFvtj4xYKz0enPbZtxGi,Panamá,MSN
Gobierno pide sensatez a la población panameña ante la escalada de la covid-19,https://www.midiario.com/nacionales/gobierno-pide-sensatez-a-la-poblacion-panamena-ante-la-escalada-de-la-covid-19/,"El ministro de Salud, Luis Francisco Sucre, pidió el martes “sensatez” a la población en medio de una escalada de la covid-19, que está enviando al hospital a personas de los segmentos jóvenes de la p",23-06-2021 11:47,https://www.bing.com/th?id=OVFT.fYnqbdMD066Gv8jxEW4k1C,Panamá,Mi Diario
Vigésimo lote de vacunas Pfizer arribó a Panamá,https://sertv.gob.pa/nacionalfm/vigesimo-lote-de-vacunas-pfizer-arribo-a-panama/,"El martes, 22 de junio, Panamá, recibió 43,290 nuevas dosis de la vacuna contra la COVID-19, de la casa farmacéutica Pfizer, las cuales seguirán reforzando la estrategia continua de vacunación que lle",23-06-2021 13:29,https://www.bing.com/th?id=OVFT.FxeBYAMsfb3edwMU4TXYVy,Panamá,SERTV
Ministro Sucre pide “sensatez” a la población,https://nexpanama.com/ministro-sucre-pide-sensatez-a-la-poblacion/,"El ministro de Salud de Panamá, Luis Francisco Sucre, pidió tener “sensatez” a la población en medio de una escalada de la covid-19, que está enviando al hospital a personas de los segmentos jóvenes d",23-06-2021 13:47,https://www.bing.com/th?id=OVFT.SrBhPZ8IfpZo3rL2g0tpWy,Panamá,NEX TV
El Gobierno de Panamá pide sensatez a la población ante la escalada pandémica,https://www.laestrella.com.pa/nacional/210623/gobierno-panama-pide-sensatez-poblacion-escalada-pandemica,"Una veintena de personas fueron detenidas por participar en ""parking"", como se le conoce en Panamá las celebraciones callejeras",23-06-2021 13:47,https://www.bing.com/th?id=OVFT.PUweKTgwVdhKtZAXICgk8y,Panamá,laestrella.com.pa
Desde enero no se reportaba una cifra tan elevada de casos de covid-19 en Panamá,https://www.panamaamerica.com.pa/sociedad/desde-enero-no-se-reportaba-una-cifra-tan-elevada-de-casos-de-covid-19-en-panama-1189536,"Desde enero de 2021 no se presentaba en Panamá una cifra tan elevada de casos de covid-19, como se reportó este martes 22 de junio.Para este martes el Ministerio de Salud (Minsa) reportó 1,208 casos d",23-06-2021 13:57,https://www.bing.com/th?id=OVFT.oSrkeomVr3XDVq51f4SF_S,Panamá,panamaamerica.com.pa
Omar Ahumada tilda de Ninis a beneficiarios de Panamá Solidario,http://elsiglo.com.pa/panama/omar-ahumada-tilda-ninis-beneficiarios-panama-solidario/24180319,"A los ciudadanos no les agradó y descargaron su furia . Luego que surgieran críticas por las nuevas condiciones para recibir el bono del Plan Panamá Solidario, el coordinador d",23-06-2021 17:20,https://www.bing.com/th?id=OVFT.sXbU2d2Fs3ovIBw5Io5PiS,Panamá,El Siglo
Comunicado visitas DGSP,https://sertv.gob.pa/crisolfm/comunicado-visitas-dgsp/,"A través de comunicado, las autoridades del Ministerio de Gobierno de la República de Panamá, notifican lo siguiente: La Dirección General del Sistema Penitenciario, dependencia del Ministerio de Gobi",23-06-2021 19:31,https://www.bing.com/th?id=OVFT.2rhXWZ0E61tTToqPhcoZny,Panamá,SERTV
"Diputado Sucre, hermano de ministro del Minsa, hace política con la vacunación",http://elsiglo.com.pa/panama/diputado-sucre-hermano-ministro-minsa-hace-politica-vacunacion/24180327,El diputado oficialista ha colgado videos promoviendo las jornadas de vacunación con logo de la Asamblea y junto a su equipo de trabajo,23-06-2021 21:01,https://www.bing.com/th?id=OVFT.qipYJk-YKqZw6DSEJ3HXmi,Panamá,El Siglo
"A 440 días desde el primer caso detectado de coronavirus, el Minsa pide no bajar la guardia",https://www.metrolibre.com/nacionales/205656-440-d%C3%ADas-desde-el-primer-caso-detectado-de-coronavirus-el-minsa-pide-no-bajar-la-guardia%C2%A0.html,"Lourdes Moreno, epidemióloga y asesora del despacho superior del Ministerio de Salud (Minsa), dijo que hoy, 23 de junio de 2021, se cumplen 440 días desde el primer caso de Covid-19 detectado en el Pa",23-06-2021 22:12,https://www.bing.com/th?id=OVFT.tXMCi9xBHwVwpdP0dQfLoC,Panamá,Metro Libre
Las salas Covid-19 se quedan sin camas en hospital chitreano,https://www.prensa.com/sociedad/las-salas-covid-19-se-quedan-sin-camas-en-hospital-chitreano/,"Con la ocupación de la cama número 43 este miércoles 23 de junio se copó la capacidad hospitalaria del hospital Gustavo Nelson Collado, de Chitré, para atender a los pacientes positivos de la Covid-19",23-06-2021 22:31,https://www.bing.com/th?id=OVFT.avUtcjPjkBrpVeBel080xC,Panamá,prensa.com
"Panamá reporta 1,077 casos positivos, 7 nuevas defunciones y 63 pacientes en UCI",https://www.radiopanama.com.pa/noticias/actualidad/panama-reporta-1077-casos-positivos-7-nuevas-defunciones-y-63-pacientes-en-uci/20210623/nota/4145829.aspx,"Las autoridades le recuerdan a la población que, aunque el proceso de vacunación avance según lo programado, es importante no bajar la guardia ya que no se le ha ganado la batalla al COVID-19",23-06-2021 23:27,https://www.bing.com/th?id=OVFT.U5aKDYpkHePXVNpXvKWW7y,Panamá,Radio Panamá
"Panamá reporta 1,077 casos nuevos de coronavirus y 7 defunciones",https://www.metrolibre.com/nacionales/205666-panam%C3%A1-reporta-1077-casos-nuevos-de-coronavirus-y-7-defunciones.html,"El Ministerio de Salud (Minsa) reveló que para el día de hoy en Panamá se contabilizan 378,954 pacientes recuperados, 1,077 casos positivos nuevos, para un total acumulado de 396,526. De acuerdo al úl",23-06-2021 23:26,https://www.bing.com/th?id=OVFT.OwEhEF7kKSMSUjTdrRyO5y,Panamá,Metro Libre
"Panamá reporta 1,077 nuevos casos de covid-19 y 7 decesos en las últimas horas",https://www.telemetro.com/nacionales/panama-reporta-1077-nuevos-casos-covid-19-y-7-decesos-las-ultimas-horas-n5249144,"En total Panamá acumula 396,526 casos de covid-19 y 6,491 decesos a causa de esta enfermedad, de acuerdo con el reporte epidemiológico del Minsa.",23-06-2021 23:32,https://www.bing.com/th?id=OVFT.mCCeZVVeAs6XWdaSAmONHy,Panamá,Telemetro
"Minsa reporta 7 muertos y 1,077 casos nuevos de la COVID-19 en Panamá",https://www.tvn-2.com/nacionales/Minsa-reporta-muertos-COVID-19-Panama_0_5882411781.html,"Un total de 1,077 casos positivos nuevos y 7 decesos por la COVID-19 fueron confirmados en las últimas 24 horas en Panamá.",23-06-2021 23:34,https://www.bing.com/th?id=OVFT.1L126Fu-xmbIxNAOCtWQIi,Panamá,TVN
"Panamá registra 1,077 casos positivos nuevos de COVID-19",https://www.diaadia.com.pa/panama-registra-1077-casos-positivos-nuevos-de-covid-19-735490,"El Ministerio de Salud (Minsa), solicitó a la población acudir a una instalación médica si presenta síntomas de resfriado y realizarse una prueba de hisopado para descartar el contagio por COVID-19. C",23-06-2021 23:35,https://www.bing.com/th?id=OVFT.mCOToWkmoOOaDHMQdQHrRC,Panamá,Día a Día
Panamá supera los mil nuevos contagios de covid-19 por segundo día consecutivo; se registran 7 nuevos decesos,https://www.laestrella.com.pa/nacional/210623/panama-supera-mil-nuevos-contagios-covid-19-segundo-dia-consecutivo-registran-7-nuevos-decesos,"Para este miércoles en Panamá se contabilizan 378,954 pacientes recuperados, 1,077 casos positivos nuevos, para un total acumulado de 396,526",23-06-2021 23:41,https://www.bing.com/th?id=OVFT.7eCFGayog9d4cvji7MtPAi,Panamá,laestrella.com.pa
"Latinoamérica puede evitar otra ""década perdida"", asegura el presidente del Banco Mundial",https://ensegundos.com.pa/2021/06/23/latinoamerica-puede-evitar-otra-decada-perdida-asegura-el-presidente-del-banco-mundial/,"La región de Latinoamérica y el Caribe puede evitar otra ""década perdida"" como la de los años 1980 a pesar del fuerte impacto del covid-19, aseguró el miércoles el presidente del Banco Mundial, David",24-06-2021 00:03,https://www.bing.com/th?id=OVFT.YCBT8d7XAIwRWIbfHVlrEy,Panamá,En Segundos
Reportan mil 77 casos nuevos de covid-19 en Panamá y 7 muertos más en las últimas 24 horas,https://www.midiario.com/salud/reportan-mil-77-casos-nuevos-de-covid-19-en-panama-y-7-muertos-mas-en-las-ultimas-24-horas/,"Para este miércoles, 23 de junio, en Panamá el Ministerio de Salud reporta mil 77 casos positivos nuevos, para un total acumulado de 396 mil 526 contagios en lo que va de la",24-06-2021 00:07,https://www.bing.com/th?id=OVFT.MBoE5GzobkAHp2B704UKDi,Panamá,Mi Diario
Pandemia: Panamá vuelve a superar los mil casos nuevos por Covid-19,https://ensegundos.com.pa/2021/06/23/pandemia-panama-vuelve-a-superar-los-mil-casos-nuevos-por-covid-19/,"Para el día de hoy en Panamá se reportan 1,077 casos positivos nuevos, para un total acumulado de 396,526. A la fecha se aplicaron 14,117 pruebas, y se mantiene un porcentaje de positividad de 7.6%. E",24-06-2021 00:18,https://www.bing.com/th?id=OVFT.sP1KkKJ_ng4M7xK5tUpsNi,Panamá,En Segundos
"Reportan 1,077 casos positivos nuevos por Covid-19 y el 48% de camas disponibles",https://www.critica.com.pa/nacional/reportan-1077-casos-positivos-nuevos-por-covid-19-y-el-48-de-camas-disponibles-606579,"Con estas nuevas cifras, la cantidad de muertes totalizan 6,492 acumuladas, desde que inició la pandemia en el país por el SARS-CoV-2, ubicándose la letalidad en el 1.6 %.",24-06-2021 00:20,https://www.bing.com/th?id=OVFT.z-Dem2efWMh3ocDwxr49Yy,Panamá,Critica
Varela: ‘No hay un día que Panamá no me decepcioné’,https://www.critica.com.pa/show/varela-no-hay-un-dia-que-panama-no-me-decepcione-606581,La expresentadora de televisión Estefani Varela explotó y dijo que está cansada y decepcionada del sistema de salud de Panamá. Las declaraciones de la famosa se,24-06-2021 00:35,https://www.bing.com/th?id=OVFT.QIN04a92S3nojhkq6iAZJC,Panamá,Critica
"Colombia contabiliza 29,995 casos positivos y 645 defunciones por coronavirus",https://www.radiopanama.com.pa/noticias/internacional/colombia-contabiliza-29995-casos-positivos-y-645-defunciones-por-coronavirus/20210623/nota/4145858.aspx,"El ministro de salud Fernando Ruíz confirmó la llegada del primer lote de 480, 000 dosis de la vacuna de Janssen, empresa de la farmacéutica Johnson & Johnson",24-06-2021 00:51,https://www.bing.com/th?id=OVFT.U5aKDYpkHePXVNpXvKWW7y,Panamá,Radio Panamá
Aumento de casos de covid-19 pone en aprietos la atención hospitalaria,https://www.tvn-2.com/nacionales/Aumento-covid-19-aprietos-atencion-hospitalaria_0_5882411768.html,Los indicadores epidemiológicos de covid-19 en tres provincias del país mantiene en alerta a las autoridades.  Siguen aumentando los casos y se compromete la capacidad hospitalaria.,24-06-2021 01:29,https://www.bing.com/th?id=OVFT.DdvcUaEYZ-GAElm8_EY7wC,Panamá,TVN
Jóvenes protestan contra cambios en ayuda estatal y la corrupción en Panamá,https://www.telemetro.com/nacionales/jovenes-protestan-contra-cambios-ayuda-estatal-y-la-corrupcion-panama-n5249268,"Al menos un centenar de jóvenes se manifestaron en los predios de la Asamblea Nacional con cánticos, banderas de sus organizaciones y pancartas.",24-06-2021 02:25,https://www.bing.com/th?id=OVFT.0JZC2sLkrc3yTyXZO0b8rC,Panamá,Telemetro
Princesa de Asturias premia a los artífices de vacunas anticovid,https://www.prensa.com/impresa/panorama/princesa-de-asturias-premia-a-los-artifices-de-vacunas-anticovid/,Siete científicos de diversos países cuyos aportes permitieron desarrollar con rapidez varias vacunas contra el Covid-19 fueron galardonados ayer en España con el Premio Princesa de Asturias de Invest,24-06-2021 03:21,https://www.bing.com/th?id=OVFT.X5xdPGSJdDCzoptqrclFRy,Panamá,prensa.com
