name,url,description,datePublished,imagen,pais,Fuente
Las selecciones de Guatemala y Honduras buscan su primera victoria del año,https://www.cableondasports.com/futbol/internacional/las-selecciones-de-guatemala-y-honduras-buscan-su-primera-victoria-del-ano_0_401826/,"Guatemala, 14 nov (EFE).- Las selecciones de Guatemala y Honduras buscarán su primera victoria del atípico año futbolístico en el partido amistoso",15-11-2020 14:35,https://www.bing.com/th?id=OVFT.Y3XypZWHsQqQYk9I0wHk7S,Panamá,Cable Onda Sports
Idaan anuncia plan de emergencia para mejorar el suministro de agua en Arraiján,https://www.diaadia.com.pa/el-pais/idaan-anuncia-plan-de-emergencia-para-mejorar-el-suministro-de-agua-en-arraijan-372442,"Los reclamos y cierres de vías por la falta de agua en el distrito de Arraiján crecen, aún cuando esta región de la provincia de Panamá Oeste, recibe la provisión de cuatro potabilizadoras.&nbsp",15-11-2020 19:00,https://www.bing.com/th?id=OVFT.AHLJk4JQJ-5FF8Df4VlHbS,Panamá,Día a Día
"Un total de diez jugadores panameños, repiten para enfrentar a Japón",https://www.tvmax-9.com/somoslasele/jugadores-panamenos-volveran-enfrentar-Japon_0_5715178555.html,"Japón será el cuarto rival de la selección nacional de Panamá en lo que va del 2020, un año atípico en el mundo del fútbol debido a la pandemia de COVID-19 que azota a la humanidad.",15-11-2020 21:37,https://www.bing.com/th?id=OVFT.qn_iVcSGC4iSeVsW5hSxqS,Panamá,TVMAX
Gabinete declara Estado de Emergencia Ambiental en el territorio nacional,https://www.diaadia.com.pa/el-pais/gabinete-declara-estado-de-emergencia-ambiental-en-el-territorio-nacional-372464,"El Consejo de Gabinete, en sesión extraordinaria, celebrada este domingo, extendió la declaración del estado de Emergencia Ambiental para las provincias de Colón, Darién, Los Santos, y las comar",16-11-2020 00:27,https://www.bing.com/th?id=OVFT.7LON1xNpBKAZUwjK6cJAZC,Panamá,Día a Día
Olvídese de los ‘parking’… los contagios de COVID-19 siguen aumentando,https://noticias24pty.com/olvidese-de-los-parking-los-contagios-de-covid-19-siguen-aumentando/,Autoridades de Salud siguen preocupadas por la cantidad de personas que son asintomáticas y que deambulan por las calles sin ningún tipo de protección.  Estas personas corresponden al 30% y se,16-11-2020 03:43,https://www.bing.com/th?id=OVFT.IIHCGsG9JG54rUCOfklwvi,Panamá,Noticias 24 PTY
90% de los pacientes con Covid-19 llega tarde a las salas de urgencias,https://www.prensa.com/impresa/panorama/90-de-los-pacientes-con-covid-19-llega-tarde-a-las-salas-de-urgencias/,Los datos de las dos últimas semanas epidemiológicas muestran un aumento en las defunciones provocadas por la Covid-,16-11-2020 05:00,https://www.bing.com/th?id=OVFT.dkEX80kHf4d_cW16CwX1mi,Panamá,prensa.com
Vacunas contra la Covid-19 exigen una compleja logística,https://www.prensa.com/impresa/panorama/vacunas-contra-la-covid-19-exigen-una-compleja-logistica/,"La vacunación contra la enfermedad Covid-19 exige una logística diferente al resto de las inmunizaciones, así como adecuaciones a la cadena de",16-11-2020 05:00,https://www.bing.com/th?id=OVFT.8NKBLSgsRom0FQ-W0gbQSy,Panamá,prensa.com
Analizarán situación de la música y la cultura en Panamá en la era Post Covid,https://www.critica.com.pa/nacional/analizaran-situacion-de-la-musica-y-la-cultura-en-panama-en-la-era-post-covid-592381,"El Sindicato de la Música, Artistas y Similares de Panamá (Sitmas), en colaboración con la Federación Internacional de Músicos analizarán la situación de los profesionales",16-11-2020 05:05,https://www.bing.com/th?id=OVFT.zEkytk-T23f9swoa9VeqqC,Panamá,Critica
Bellezas que engalanan el Mes de la Patria,http://elsiglo.com.pa/espectaculos/bellezas-engalanan-patria/24167885,"Orgullosas por ser panameñas. Los 365 días del año los panameños se sienten orgullosos de su tierra, pero noviembre es aún más especial para celebrar por todos esos aconteci",16-11-2020 05:06,https://www.bing.com/th?id=OVFT.jMJjnDl2RKu6gtuc9bGdVC,Panamá,El Siglo
Inspeccionan normas de un casino contra la COVID-19,https://www.critica.com.pa/nacional/inspeccionan-normas-de-un-casino-contra-la-covid-19-592380,"Este juego de azar es una actividad individual. Bajo esa premisa, casinos de todo el país abrieron sus puertas al público, cuando se oficializó su",16-11-2020 05:06,https://www.bing.com/th?id=OVFT.wrbgkkKStR_SJZSKnDeu5i,Panamá,Critica
Panamá se afina para Estados Unidos a la espera de los resultados de las pruebas de la covid-19,https://www.midiario.com/deportivas/panama-se-afina-para-estados-unidos-a-la-espera-de-los-resultados-de-las-pruebas-de-la-covid-19/,Panamá entrenó este domingo en el SC Wiener Nestadt con miras al segundo partido que disputará este lunes ante los Estados Unidos para cerrar su gira europea de dos,16-11-2020 08:17,https://www.bing.com/th?id=OVFT.6Aj3nBtCXJtDEe8c29tqqS,Panamá,Mi Diario
"Repitamos ‘burbuja familiar’. Minsa reporta 1,344 casos nuevo por la covid-19 en Panamá",https://www.midiario.com/salud/repitamos-burbuja-familiar-minsa-reporta-1344-casos-nuevo-por-la-covid-19-en-panama/,"Este domingo 15 de noviembre se reportaron 6 nuevos decesos y 1,344 casos positivos de la COVID-19 en Panamá. Hasta el momento van acumulados 146,653 casos. de los cuales 125,370 se han recuperado y 2",16-11-2020 08:18,https://www.bing.com/th?id=OVFT.V3Xift_rpDxs9HYOo6TgHy,Panamá,Mi Diario
"Repunte de casos, las personas han bajado la guardia ante el COVID-19",https://www.tvn-2.com/nacionales/Repunte-casos-personas-bajado-guardia-COVID-19_0_5718178133.html,"Las últimas semanas epidemiológicas se ha experimentado un repunte en los casos de la COVID-19, lo que ha encendido las alarmas en el Ministerio de Salud, que ya toma medidas en algunos sectores y no",16-11-2020 12:30,https://www.bing.com/th?id=OVFT.zu5agc9aEfluMemKaGN6Ti,Panamá,TVN
"Moderna afirma que su vacuna tiene 94,5% de efectividad para prevenir COVID-19",http://www.nexpanama.com/moderna-afirma-que-su-vacuna-tiene-945-de-efectividad-para-prevenir-covid-19/,"Moderna Inc dijo este lunes que su vacuna experimental tuvo una efectividad de 94,5% para prevenir el COVID-19, según datos provisionales de un ensayo clínico en etapa avanzada, convirtiéndose en la s",16-11-2020 12:30,https://www.bing.com/th?id=OVFT.4rhSXY3dMgIWNSIikiw6bi,Panamá,NEX TV
"Moderna anuncia que su vacuna contra el covid-19 tiene una eficacia de 94,5%",https://ensegundos.com.pa/2020/11/16/moderna-anuncia-que-su-vacuna-contra-el-covid-19-tiene-una-eficacia-de-945/,El mundo está a la espera de una vacuna contra el coronavirus Covid-19. La empresa de biotecnología estadounidense Moderna anunció el lunes en un comunicado que su vacuna contra el covid-19 tiene una,16-11-2020 13:08,https://www.bing.com/th?id=OVFT.LSqMU2wF4iIaaag1J-VUVy,Panamá,En Segundos
El Covid-19 recorta el comercio marítimo y transforma la industria,https://ensegundos.com.pa/2020/11/16/el-covid-19-recorta-el-comercio-maritimo-y-transforma-la-industria/,La pandemia ha provocado ondas de choque en el transporte marítimo mundial y ha sentado las bases para una industria transformada y las cadenas de suministro asociadas. El comercio marítimo mundial se,16-11-2020 14:03,https://www.bing.com/th?id=OVFT.Hx31RfpFnq73DCUZO0OwOC,Panamá,En Segundos
"A partir del 2021 suspensiones de contratos serán regidas por el Código de Trabajo, Mitradel",https://www.telemetro.com/nacionales/2020/11/16/a-partir-del-2021-suspensiones-de-contratos-seran-regidas-por-el-codigo-de-trabajo-mitradel/3462881.html,"Dado que la vigencia de la Ley 157 de 3 de agosto de 2020 que establece medidas temporales de protección de empleo en las empresas afectadas por el COVID-19, vence el 31 de diciembre de 2020, el Minis",16-11-2020 14:18,https://www.bing.com/th?id=OVFT.vvqhb0gETBWp_uzl84YWuC,Panamá,Telemetro
Alemania considera medidas más duras antes de Navidad para frenar la pandemia,http://www.nexpanama.com/alemania-considera-medidas-mas-duras-antes-de-navidad-para-frenar-la-pandemia/,"La canciller alemana Angela Merkel y los líderes de los distintos estados federales impondrían el lunes nuevas medidas, incluyendo el uso obligatorio de mascarilla en las escuelas y acciones más drást",16-11-2020 14:49,https://www.bing.com/th?id=OVFT.0CcepybDSaMi20SpHg8UQS,Panamá,NEX TV
UNCTAD destaca capacidad del Canal de Panamá de adaptarse a la pandemia,https://www.telemetro.com/nacionales/2020/11/16/unctad-destaca-capacidad-canal-panama/3462968.html,"La Conferencia de las Naciones Unidas sobre Comercio y Desarrollo (UNCTAD, por su siglas en inglés) destacó la resiliencia y capacidad del Canal de Panamá de adaptarse a la realidad que impuso la pand",16-11-2020 15:02,https://www.bing.com/th?id=OVFT.2uYn8zATKSRbpwcvtnyqRS,Panamá,Telemetro
"Exalcaldes, pastores y policías le quitan la buhonería a familias humildes de Penonomé",http://elsiglo.com.pa/panama/exalcaldes-pastores-policias-quitan-buhoneria-familias-humildes-penonome/24167900,"El desalojo e investigación de cada uno de los propietarios de los kioscos o puestos de buhonería ubicados en las aceras de la vía principal en Penonomé, trajo consigo una sorpresa, al descubrirse que",16-11-2020 15:19,https://www.bing.com/th?id=OVFT.4RR7qF20UWtAD3pDJT8lUC,Panamá,El Siglo
