name,url,description,datePublished,imagen,pais,Fuente
Unión Europea critica “apresurada” aprobación británica de la vacuna,http://www.nexpanama.com/union-europea-critica-apresurada-aprobacion-britanica-de-la-vacuna/,"La Unión Europea criticó el miércoles la rápida aprobación británica de la vacuna contra el COVID-19 de Pfizer y BioNTech, diciendo que su propio procedimiento es más exhaustivo, después de que Reino",02-12-2020 17:57,https://www.bing.com/th?id=OVFT._thLjUmy1UWDWwzzW2Cm6C,Panamá,NEX TV
Alcaldes de Panamá Oeste consideran acertado el endurecimiento de medidas contra la COVID-19,https://noticias24pty.com/alcaldes-de-panama-oeste-consideran-acertado-el-endurecimiento-de-medidas-contra-la-covid-19/,Los alcaldes de la provincia de Panamá Oeste calificaron de acertada la medida adoptada por el Ministerio de Salud (Minsa) de establecer un toque de queda entre 9:00 p.m. y 5:00 a.m.  a partir de,02-12-2020 18:31,https://www.bing.com/th?id=OVFT.V9D1hMbk3DcIK-YL5UAIAi,Panamá,Noticias 24 PTY
"Dr. Lau Cortés: CSS aumenta capacidad de respuesta en la lucha contra la COVID-19, en Panamá",https://sertv.gob.pa/nacionalfm/dr-lau-cortes-css-aumenta-capacidad-de-respuesta-en-la-lucha-contra-la-covid-19-en-panama/,"En el reporte sanitario y epidemiológico emitido este martes, 1 de diciembre, el director general de la Caja de Seguro Social (CSS), Dr. Enrique Lau Cortés se refirió a diversos temas que lleva adelan",02-12-2020 21:15,https://www.bing.com/th?id=OVFT.WjX7HNZXu1QBx0uDorW9xS,Panamá,SERTV
Decreto sobre el año escolar 2021 ya está en despacho de la ministra de Eduación Maruja Gorday de Villalobos,https://www.panamaamerica.com.pa/sociedad/decreto-ano-escolar-2021-ya-esta-en-despacho-ministra-eduacion-maruja-gorday-villalobos,"Tras las consultas que se realizaron con gremios magisteriales, el Decreto Ejecutivo para el periodo escolar 2021 ya fue remitido al despacho de la ministra de Educación, Maruja Gorday de Villalobos,",02-12-2020 21:26,https://www.bing.com/th?id=OVFT.Jp5UTaEEGv0ewBgmoNUhCC,Panamá,panamaamerica.com.pa
"Panamá registra 2,028 casos de COVID-19 en las últimas 24 horas",https://www.telemetro.com/nacionales/2020/12/02/panama-acumula-registrarse-covid-19/3515819.html,"El informe epidemiológico revela que para este miércoles 2 de diciembre se han detectado 2,028 nuevos contagios en Panamá, elevando la cantidad de casos por COVID-19 a 169,339.",02-12-2020 23:30,https://www.bing.com/th?id=OVFT.wtCmNd2wRvTKiopQliQJCi,Panamá,Telemetro
"Sube a 2,028 los nuevos casos positivos de Covid-19 y 16 fallecidos",https://www.critica.com.pa/nacional/sube-2028-los-nuevos-casos-positivos-de-covid-19-y-16-fallecidos-593576,"Panamá reporta hoy, 2,028 casos positivos nuevos, para un total acumulado de 169,339 y se han registrado 16 nuevas defunciones, que totalizan 3,114 acumuladas y una letalidad del 1.8 %. A la fecha se",02-12-2020 23:48,https://www.bing.com/th?id=OVFT.5VJYdnatt8uEqOUIKOAxui,Panamá,Critica
"Panamá supera los dos mil casos nuevos de COVID-19 en un solo día, lo cual es una cifra récord",https://noticias24pty.com/panama-supera-los-dos-mil-casos-nuevos-de-covid-19-en-un-solo-dia-lo-cual-es-una-cifra-record/,"Panamá rompe récord en la cifra de casos nuevos de COVID-19 al registrarse este miércoles 2,028 pacientes positivos, lo que aumenta el total acumulado a 169,339. Versión impresa A la fecha se",03-12-2020 00:31,https://www.bing.com/th?id=OVFT.V9D1hMbk3DcIK-YL5UAIAi,Panamá,Noticias 24 PTY
OPS alerta sobre alza de 30% de casos de COVID-19 en un mes en las Américas,https://www.tvn-2.com/mundo/OPS-alerta-casos-COVID-19-Americas_0_5730177031.html,"La Organización Panamericana de la Salud (OPS) reportó el miércoles un aumento de un 30% de casos de covid-19 en el continente americano en un mes, y llamó a mejorar la atención de los afrodescendient",03-12-2020 01:26,https://www.bing.com/th?id=OVFT.GgW_RLozJkIciQQGVs17ui,Panamá,TVN
OPS: inminente riesgo de rebrote de Covid-19 en Panamá,https://www.critica.com.pa/nacional/ops-inminente-riesgo-de-rebrote-de-covid-19-en-panama-593584,"La Organización Panamericana de la Salud (OPS) advirtió que es ""inminente el riesgo de un rebrote"" del Covid-19 a lo largo del territorio nacional de",03-12-2020 02:40,https://www.bing.com/th?id=OVFT.DrhF5jOUm8uhpm9wXyY6Zi,Panamá,Critica
Personal de salud del país está agotado; faltan camas en Panamá Oeste,https://www.prensa.com/impresa/panorama/personal-de-salud-del-pais-esta-agotado-faltan-camas-en-panama-oeste/,El incremento de casos de la Covid-19 está poniendo a prueba el sistema de salud del país. Médicos y enfermeras comienzan a mostrar signos de cansancio tras casi nueve meses de pandemia y varios hospi,03-12-2020 05:31,https://www.bing.com/th?id=OVFT.2n-L8Ytbq3bUP65JQAI1PC,Panamá,prensa.com
Italia restringe movilidad por el covid-19 para fiestas de fin de año,https://www.prensa.com/mundo/italia-restringe-movilidad-por-el-covid-19-para-fiestas-de-fin-de-ano/,El gobierno italiano adoptó la madrugada del jueves un decreto-ley que restringe la movilidad dentro del país durante las fiestas de Navidad y Año Nuevo como parte de las medidas para combatir la prop,03-12-2020 10:20,https://www.bing.com/th?id=OVFT.f7-0uc4UDhza8UdAknBKlC,Panamá,prensa.com
Indicadores de la COVID-19 en Panamá denotan que el confinamiento es una opción real,https://www.tvn-2.com/contenido_exclusivo/Indicadores-COVID-19-Panama-denotan-confinamiento_0_5730177036.html,"Con el referente de un índice Reproductivo Efectivo (Rt) de 1.24%, los indicadores de la semana epidemiológica 48 en el país marcados con un aumento acelerado de casos y hospitalizados, denota que un",03-12-2020 11:23,https://www.bing.com/th?id=OVFT.JHK6oNLVnWdy22pYUDTiVy,Panamá,TVN
Suspenden ceremonias de graduación en escuelas públicas y privadas por repunte de COVID-19,https://www.telemetro.com/nacionales/2020/12/03/suspenden-ceremonias-de-graduacion-en-escuelas-publicas-y-privadas-por-repunte-de-covid-19/3517305.html,El Ministerio de Educación en conjunto con el Ministerio de Salud suspendieron las ceremonias de graduaciones en centros educativos públicos y privados ante el repunte significativo de casos de COVID-,03-12-2020 11:50,https://www.bing.com/th?id=OVFT.bWREczdCJ1bc48L4AooXpC,Panamá,Telemetro
"La pandemia de covid-19 agravó el hambre en el mundo, según la FAO",https://ensegundos.com.pa/2020/12/03/la-pandemia-de-covid-19-agravo-el-hambre-en-el-mundo-segun-la-fao/,"El hambre en el mundo se ha agravado debido a las repercusiones de la pandemia de coronavirus, advirtió este jueves la Organización de Naciones Unidas para la Agricultura y la Alimentación (FAO). La a",03-12-2020 12:23,https://www.bing.com/th?id=OVFT.vpy5R9ppl6uQwaBET5T7jC,Panamá,En Segundos
La pandemia frena graduaciones en Panamá,http://elsiglo.com.pa/panama/pandemia-frena-graduaciones-panama/24168842,"Los alumnos recibirán su diploma por ventanilla. Ante el repunte de casos del covid-19, el Ministerio de Educación (MEDUCA) optó por suspender los actos de graduación 2020. Vi",03-12-2020 12:38,https://www.bing.com/th?id=OVFT.p5kMyAQ9VGHmvU21SeYKiy,Panamá,El Siglo
SNM completa las citas del mes de diciembre para recepción de documentos en el proceso de regularización,https://sertv.gob.pa/nacionalfm/snm-completa-las-citas-del-mes-de-diciembre-para-recepcion-de-documentos-en-el-proceso-de-regularizacion/,"El Servicio Nacional de Migración (SNM), informa a los usuarios, que las citas para la recepción de documentos, como parte del proceso de renovación de regularización migratoria, emitidas a través de",03-12-2020 13:44,https://www.bing.com/th?id=OVFT.mQ_paEcBZ_FIYM7uAqEgiS,Panamá,SERTV
Panamá y el mundo frente a la COVID-19,https://www.laestrella.com.pa/opinion/columnistas/201203/panama-mundo-frente-covid-19,"""Es hora de que todos, sin intereses mezquinos, apoyemos el Pacto Nacional “Cerrando Brechas”, para transformar nuestra cruda realidad y poder brindarles a las próximas generaciones mejores caminos de",03-12-2020 13:57,https://www.bing.com/th?id=OVFT.df3Hbt7wA5GR76g61G9QWi,Panamá,laestrella.com.pa
En Penonomé se realizaron la exequias de su primer obispo.,http://elsiglo.com.pa/panama/penonome-realizaron-exequias-primer-obispo/24168846,"En la Catedral San Juan Bautista de Penonomé, se realizaron las exequias de cenizas de Monseñor Uriah Ashley, primer Obispo de la Diócesis de Penonomé. La ceremonia efectuada dentro de los parámetros",03-12-2020 14:18,https://www.bing.com/th?id=OVFT.ceI0asS9k91Sgazd9ocXUC,Panamá,El Siglo
Suspenden ceremonias de graduación en escuelas públicas y privadas por repunte de la covid-19 en Panamá,https://www.midiario.com/nacionales/suspenden-ceremonias-de-graduacion-en-escuelas-publicas-y-privadas-por-repunte-de-la-covid-19-en-panama/,"Virgilio Sousa, director de Asesoría Legal del Ministerio de Educación confirmó la noticia de que los actos de graduación de este año escolar 2020 fueron canceladas debido al rebrote de casos de la co",03-12-2020 14:20,https://www.bing.com/th?id=OVFT.JEgsJ1iA7K-pFIHa4aYpuC,Panamá,Mi Diario
Meduca cancela actos de graduación en el país,https://ensegundos.com.pa/2020/12/03/meduca-cancela-actos-de-graduacion-en-el-pais/,"El Ministerio de Salud (Meduca), emitió la circular GDE-124-0360 del 2 de diciembre de 2020, mediante la cual anuncia la suspensión de actos de graduación escolar y cualquier otro que conlleven aglome",03-12-2020 14:42,https://www.bing.com/th?id=OVFT.-w16vglEJN82WGTR3raGNy,Panamá,En Segundos
El primer país del mundo en vacunarse contra la Covid-19,https://radioreformaseoye.com/internacionales/el-primer-pais-del-mundo-en-vacunarse-contra-la-covid-19/,El Gobierno británico anunció que iniciará su proceso de vacunación contra la Covid-19 con la administración al personal de salud y adultos mayores en asilos. La agencia reguladora de Medicamentos y P,03-12-2020 15:12,https://www.bing.com/th?id=OVFT.52lfYlEEoiJfLzWohTqIBS,Panamá,Radio Reforma se Oye
López Obrador espera distribución en México de la vacuna de Pfizer este mes,https://www.nexpanama.com/lopez-obrador-espera-distribucion-en-mexico-de-la-vacuna-de-pfizer-este-mes/,"El presidente de México, Andrés Manuel López Obrador, dijo el jueves que espera que la vacuna contra el COVID-19 de Pfizer comience a ser distribuida en el país en diciembre, un día después de que el",03-12-2020 15:24,https://www.bing.com/th?id=OVFT.DaJtvO96_x2nWyqOsDbiXC,Panamá,NEX TV
