name,url,description,datePublished,imagen,pais,Fuente
"Presidente de Panamá en aislamiento, colaborador cercano dio positivo por covid-19",https://www.laestrella.com.pa/nacional/201102/presidente-panama-cuarentena-colaborador-cercano-dio-positivo-covid-19,"Cortizo estuvo ausente en la eucaristía de este 2 de noviembre, en conmemoración del Día de los Difuntos, en la Catedral Santa María La Antigua",03-11-2020 04:04,https://www.bing.com/th?id=OVFT.FiRhGtsQG1trliCVbv3eVi,Panamá,laestrella.com.pa
Día 239: 579 nuevos casos de covid-19 y 14 muertes,https://www.midiario.com/nacionales/dia-239-579-nuevos-casos-de-covid-19-y-14-muertes/,El Ministerio de Salud informó que se detectaron 579 nuevos casos de coronavirus en Panamá y la muerte de 14 personas por la,03-11-2020 04:27,https://www.bing.com/th?id=OVFT.WZh8C3t5vSCG4A11a0tTwi,Panamá,Mi Diario
De vuelta a los museos,https://www.prensa.com/impresa/vivir/de-vuelta-a-los-museos/,"El Ministerio de Cultura (MiCultura) comenzó la reapertura escalonada de los 14 museos que se encuentran bajo su paraguas, tras el cierre al público por la pandemia de la",03-11-2020 05:00,https://www.bing.com/th?id=OVFT.TQBGSkWm2HitqQSZWCcr0S,Panamá,prensa.com
Panamá está en una meseta de alta transmisión del nuevo coronavirus,https://www.prensa.com/impresa/panorama/panama-esta-en-una-meseta-de-alta-transmision-del-nuevo-coronavirus/,"Los datos epidemiológicos del Ministerio de Salud (Minsa) muestran que Panamá tiene poco avance en las últimas semanas en el descenso diario del número de casos de la enfermedad Covid-19, pues la sema",03-11-2020 05:00,https://www.bing.com/th?id=OVFT.yg7wMhEHo3uLx1rvcTNtni,Panamá,prensa.com
Panamá podría enfrentar rebrote de covid-19 a partir del 15 de noviembre,http://elsiglo.com.pa/panama/panama-podria-enfrentar-rebrote-covid-19-partir-15-noviembre/24167200,"Lo importante será que las medidas básicas de prevención de la enfermedad, como uso de mascarillas Un repunte de los casos por la covid-19 se podría registrar en los próximos días, advirtió este lunes",03-11-2020 05:05,https://www.bing.com/th?id=OVFT.cE3v4r4WKKDWcKDt6W06ii,Panamá,El Siglo
"COVID-19 compromete migración por el Darién, mientras el Senafront controla su flujo y los protege de los peligros que enfrentan",https://www.panamaamerica.com.pa/sociedad/covid-19-compromete-migracion-por-darien-1175260,"La pandemia del coronavirus pone retos más difíciles a los migrantes que intentan cruzar la peligrosa selva del Darién, mientras que el Servicio Nacional de Fronteras (Senafront) controla su flujo y e",03-11-2020 07:21,https://www.bing.com/th?id=OVFT.qRvSYkaR41JhMebh_uVDAS,Panamá,panamaamerica.com.pa
Marathón y Antigua por el pase a la siguiente ronda de la Liga Concacaf,https://www.cableondasports.com/futbol/internacional/marathon-y-antigua-por-el-pase-a-la-siguiente-ronda-de-la-liga-concacaf_0_399419/,"Tegucigalpa, 2 nov (EFE).- El Marathón, de Honduras, y el Antigua, de Guatemala, se enfrentarán este martes en un único partido de octavos de final",03-11-2020 07:54,https://www.bing.com/th?id=OVFT.DHdPra1hvYVbCL76kbVXKC,Panamá,Cable Onda Sports
Chiriquí y Bocas del Toro reanudan la serie final del campeonato mayor,https://www.diaadia.com.pa/deportes/chiriqui-y-bocas-del-toro-reanudan-la-serie-final-del-campeonato-mayor-372047,"Después de que la lluvia no dejara desarrollar las acciones del segundo partido más allá de la tercera entrada de la serie final entre Bocas del Toro y Chiriquí, la Federación Panameña de Béisbo",03-11-2020 08:02,https://www.bing.com/th?id=OVFT.jZR8fOtMc8mYQn1bYCfDVC,Panamá,Día a Día
Belarmino Campos está orgulloso de ser el Jugador Más Valioso,https://www.diaadia.com.pa/deportes/belarmino-campos-esta-orgulloso-de-ser-el-jugador-mas-valioso-372046,"Aunque sabía que estaba en la jugada, el pelotero santeño Belarmino Campos confesó que no dejó de sorprenderle haber ganado el premio al Jugador Más Valioso del Campeonato Nacional de Béisbol 20",03-11-2020 08:23,https://www.bing.com/th?id=OVFT.sML2_i5yIDBke6CjrgVnSC,Panamá,Día a Día
Reportan 738 nuevos casos de COVID-19; fallecieron 6 en las últimas horas,https://www.tvn-2.com/nacionales/Casos-COVID-19-Panama-alcanzan-fallecieron_0_5706929312.html,"Este domingo 1 de noviembre se confirmaron 6 decesos y 738 casos nuevos de la COVID-19. Del 9 de marzo a la fecha, el Sistema de Vigilancia Epidemiológica cuantifica 134,336 contagiados, de los cuales",03-11-2020 10:40,https://www.bing.com/th?id=OVFT.wjUhq820J1JCUA6UjrDJmS,Panamá,TVN
Bocas del Toro y Chiriquí continúan la lucha por el título en Las Tablas,https://www.tvmax-9.com/beisbolnacional/Bocas-Toro-Chiriqui-continuan-Tablas_0_5707679271.html,"Bocas del Toro y Chiriquí reanudan hostilidades este martes para el segundo partido de la Serie Final del 77 Campeonato Nacional de Béisbol Mayor, el que pospuesto por lluvia el domingo pasado. La pos",03-11-2020 13:03,https://www.bing.com/th?id=OVFT.DK43Zn4I5cqxfdeED7kCzC,Panamá,TVMAX
"Lourdes Moreno: 'Demostrémosle a Panamá que la amamos, sigamos las medidas de bioseguridad'",https://www.tvn-2.com/nacionales/Lourdes-Moreno-Demostremosle-Panama-bioseguridad-normas-fiestas-patrias-COVID-19_0_5708429109.html,"Una de las figuras que sin duda se ganó el cariño y respeto de los panameños en medio de la pandemia fue la doctora Lourdes Moreno, jefa de Epidemiología del Ministerio de Salud (Minsa), quien se hizo",03-11-2020 13:19,https://www.bing.com/th?id=OVFT.jKxAtl9SdgcNH35_SzeOky,Panamá,TVN
Reconfinamiento en Atenas y en regiones griegas más afectadas por el coronavirus,https://ensegundos.com.pa/2020/11/03/reconfinamiento-en-atenas-y-en-regiones-griegas-mas-afectadas-por-el-coronavirus/,"La pandemia del coronavirus Covid-19 no da tregua y obliga a países a confinarse. Atenas y las regiones griegas con más casos de coronavirus retoman progresivamente el confinamiento este martes, con c",03-11-2020 13:41,https://www.bing.com/th?id=OVFT.gJSkaWevR0apefzIumVQPC,Panamá,En Segundos
Biomuseo reabrirá sus puertas el 7 de noviembre,https://www.telemetro.com/las-buenas-noticias/2020/11/03/biomuseo-reabrira-sus-puertas-el-7-de-noviembre/3417798.html,"Luego de varios meses de cierre debido a la pandemia del covid-19, el Biomuseo de Panamá reabrirá sus puertas a partir del próximo 7 de noviembre, bajo medidoas de bioseguridad.",03-11-2020 13:42,https://www.bing.com/th?id=OVFT.gALID75PwPAv3SgV8j_RVy,Panamá,Telemetro
Mairim Solís: 'Las paredes del Gorgas albergan a genios en toda su potencia',https://www.laestrella.com.pa/cafe-estrella/miavocesactivas/201103/mairim-solis-paredes-gorgas-albergan,La joven doctora panameña obtuvo este año dos reconocimientos por su valioso aporte en la medicina e investigación de células madre para combatir la covid-19. Hoy nos platica desde su rol de madre y e,03-11-2020 14:12,https://www.bing.com/th?id=OVFT.olpP0-x8w8nJxfRm8QNMnC,Panamá,laestrella.com.pa
Conmemoran separación de Colombia sin Cortizo,https://radioreformaseoye.com/nacionales/conmemoran-separacion-de-colombia-sin-cortizo/,"Los actos protocolares con motivo a los 117 años desde la separación de Panamá de Colombia fueron desarrollados sin la presencia del presidente Laurentino Cortizo, quien se encuentra en una cuarentena",03-11-2020 14:28,https://www.bing.com/th?id=OVFT.rfxKQFfU8T0cO2l9bDNgXy,Panamá,Radio Reforma se Oye
Advierten rebrote y alta meseta de transmisión en Panamá,https://radioreformaseoye.com/nacionales/advierten-rebrote-y-alta-meseta-de-transmision-en-panama/,"Por su parte, Jean Paul Carrera, epidemiólogo del Instituto Conmemorativo Gorgas de Estudios de Salud, explicó al diario La Prensa, que Panamá nunca suprimió la circulación del virus, y que está en un",03-11-2020 14:40,https://www.bing.com/th?id=OVFT.34gcqB3Ef6nTqQHzJ4qcKi,Panamá,Radio Reforma se Oye
Panamá conmemora 117 años de vida republicana en medio de la pandemia,https://www.metrolibre.com/nacionales/185943-panam%C3%A1-conmemora-117-a%C3%B1os-de-vida-republicana-en-medio-de-la-pandemia.html,"Este año, los actos del 3 de noviembre para celebrar la Separación de Panamá de Colombia estuvieron marcados por las medidas de bioseguridad a causa de la pandemia, sin embargo, esto no impidió que se",03-11-2020 14:42,https://www.bing.com/th?id=OVFT.mGwBo4TGdY2kDMpkPD9W9y,Panamá,Metro Libre
Un grupo de colonenses desafía a la COVID-19 con desfile clandestino,https://www.panamaamerica.com.pa/provincias/un-grupo-colonenses-desafia-covid-19-con-desfile-clandestino-1175272,"A pesar de las restricciones y el toque de queda establecido, un grupo de personas salió a las calles en el sector de Sabanitas, en la provincia de Colón, para llevar a cabo un desfile clandestino, en",03-11-2020 15:09,https://www.bing.com/th?id=OVFT.TnUzq8itrHW1Z5y3bT021C,Panamá,panamaamerica.com.pa
"Izada de bandera de Panamá sin ""Nito"" Cortizo",https://www.critica.com.pa/nacional/izada-de-bandera-de-panama-sin-nito-cortizo-591524,"A diferencia de años anteriores, la ceremonia fue rápida y guardando las medidas de bioseguridad adoptadas por el Ministerio de Salud para evitar el contagio del COVID-19.",03-11-2020 15:21,https://www.bing.com/th?id=OVFT.AP9waYnWByCsJk3IDP979C,Panamá,Critica
Izada de bandera de Panamá sin el presidente Cortizo,https://www.critica.com.pa/nacional/izada-de-bandera-de-panama-sin-el-presidente-cortizo-591524,"A diferencia de años anteriores, la ceremonia fue rápida y guardando las medidas de bioseguridad adoptadas por el Ministerio de Salud para evitar el contagio del COVID-19.",03-11-2020 15:22,https://www.bing.com/th?id=OVFT.udhoo3EwRNVI6dp-mdihUS,Panamá,Critica
Presidente pide a la población disciplina para salir de la pandemia,https://www.metrolibre.com/nacionales/185947-presidente-pide-la-poblaci%C3%B3n-disciplina-para-salir-de-la-pandemia.html,"""La Patria necesita, una vez más, de la unidad de todos los panameños, para que de manera organizada y disciplinada podamos superar esta situación que nos ataca y sacude al mundo entero"", expresó Cort",03-11-2020 15:34,https://www.bing.com/th?id=OVFT.90exjhrwBBz2stgMAAYveS,Panamá,Metro Libre
Sanción de Ley de Cultura y presentación del logo del Bicentenario de la Independencia de Panamá,https://www.telemetro.com/nacionales/2020/11/03/sancion-de-ley-de-cultura-y-presentacion-del-logo-del-bicentenario-de-la-independencia-de-panama/3418366.html,"El presidente Laurentino Cortizo sancionó la Ley General de Cultura, participando en el acto de forma virtual, toda vez que decidió acogerse a aislamiento preventivo luego de que un colaborador cercan",03-11-2020 15:36,https://www.bing.com/th?id=OVFT.UfxnBATA1r6L0JaKwVgq2i,Panamá,Telemetro
Presidente Cortizo participó en la lectura virtual del Acta de Independencia,http://elsiglo.com.pa/panama/presidente-cortizoparticipo-lectura-virtual-acta-independencia/24167229,"En la sesión, Cortizo dijo que la pandemia por covid-19 es uno de los retos más grandes de la vida republicana",03-11-2020 15:50,https://www.bing.com/th?id=OVFT.IFngL9_pfO6i1clr1Hqxii,Panamá,El Siglo
Humbled Boris Johnson follows Europe with UK lockdown,https://www.newsroompanama.com/business/humbled-boris-johnson-follows-europe-with-uk-lockdown,"AFP. London British Prime Minister Boris Johnson ended up changing his approach and, given the evidence that the coronavirus is out of control, announced a seco",03-11-2020 15:57,https://www.bing.com/th?id=OVFT.yo8ETFVKVCqF5FJE-3kjaS,Panamá,Newsroom Panama
San Miguelito celebra los 117 años de la separación de Colombia,https://www.midiario.com/nacionales/san-miguelito-celebra-los-117-anos-de-la-separacion-de-colombia/,"Yaritzel Ríos, director regional de salud de San Miguelito fue la abanderada en los actos protocolares que realizó el Consejo Municipal, este 3 de noviembre al celebrarse los 117 años de la separación",03-11-2020 16:07,https://www.bing.com/th?id=OVFT.BH0kRxbZHmiEoqvxmjwonC,Panamá,Mi Diario
México se suma a ensayos de fase tres de la vacuna contra covid-19 del chino CanSinoBio,https://ensegundos.com.pa/2020/11/03/mexico-se-suma-a-ensayos-de-fase-tres-de-la-vacuna-contra-covid-19-del-chino-cansinobio/,"México se sumará esta semana a los ensayos clínicos de la fase tres de la vacuna contra el coronavirus del laboratorio chino CanSinoBio, informó el martes el presidente Andrés Manuel López Obrador. ""E",03-11-2020 16:20,https://www.bing.com/th?id=OVFT.bdhqq4MqBX54j1ZqX57lXC,Panamá,En Segundos
"Fidel Escobar, el único jugador de campo sin minutos en el Alcorcón",https://www.tvmax-9.com/somoslasele/Fidel-Escobar-jugador-minutos-Alcorcon_0_5708429127.html,"No está siendo precisamente un inicio de Liga soñado para la Agrupación Deportiva Alcorcón. A pesar de que no empezaron mal, el conjunto que dirige Mere Hermoso suma seis derrotas consecutivas, la últ",03-11-2020 16:49,https://www.bing.com/th?id=OVFT.2Sw3p6-iAkluRa3dKVjSvy,Panamá,TVMAX
