name,url,description,datePublished,imagen,pais,Fuente
"""Nito"": el virus no perdona ni a Presidentes",https://www.critica.com.pa/nacional/nito-el-virus-no-perdona-ni-presidentes-589272,"El mandatario de Panamá, Laurentino Cortizo hizo una referencia indirecta al gobernante de EEUU, Donald Trump y el peligro del coronavirus, alegando que ""usted puede",04-10-2020 05:08,https://www.bing.com/th?id=OVFT.a5MREucvygGmN8sUZ2tiFC,Panamá,Critica
"""El Docente como Gerente de Instrucción""",https://www.panamaamerica.com.pa/opinion/docente-como-gerente-instruccion-1173257,"El contexto actual de la COVID-19 y los retos emergentes para seguir cumpliendo con los compromisos sociales, han hecho que la educación nuevamente sea un tema principal de discusión a nivel global.Un",04-10-2020 05:12,https://www.bing.com/th?id=OVFT.3MNDNBqrbCnxxFIfuSWHai,Panamá,panamaamerica.com.pa
"Apuran los últimos días para registrar 150,000 votantes latinos en Arizona",https://lagacetadepanama.com/apuran-los-ultimos-dias-para-registrar-150000-votantes-latinos-en-arizona/,Grupos que promueven el voto latino en Arizona redoblan sus esfuerzos para tratar de registrar el mayor número de votantes antes que se cumpla este lunes la fecha límite para anotarse para poder ejerc,04-10-2020 07:14,https://www.bing.com/th?id=OVFT.ROfxuO_1Fr6sDKobFBMUqS,Panamá,La Gaceta de Panama
Van 74 muertos esta semana,https://www.critica.com.pa/nacional/van-74-muertos-esta-semana-589270,"Unos 74 panameños han muerto en lo que esta semana por coronavirus y 4,098 se han contagiado. El Ministerio de Salud (Minsa) reportó ayer 8",04-10-2020 12:00,https://www.bing.com/th?id=OVFT.GRqnXaO914YzHLQyVFmFXC,Panamá,Critica
Inauguran la segunda clínica Post-covid en Panamá Oeste,https://www.midiario.com/nacionales/inauguran-la-segunda-clinica-post-covid-en-panama-oeste/,"La segunda clínica de Post-covid fue inaugurada en la Policlínica Dr. Santiago Barraza, en La Chorrera, Panamá",04-10-2020 12:52,https://www.bing.com/th?id=OVFT.-24rAkXWGV5EcX5ry2v1iy,Panamá,Mi Diario
Persisten protestas en Costa Rica contra eventual acuerdo con el FMI,http://elsiglo.com.pa/internacional/persisten-protestas-costa-rica-contra-eventual-acuerdo/24165316,"Las protestas son organizadas por un grupo denominado ""Movimiento Rescate Nacional"", encabezado por personajes políticos",04-10-2020 13:55,https://www.bing.com/th?id=OVFT.m4oURA4yiqo5X_jxI_eU6C,Panamá,El Siglo
Fallece privado de libertad que se había recuperado de la covid-19 en Panamá,https://www.midiario.com/policiales/fallece-privado-de-libertad-que-se-habia-recuperado-de-la-covid-19-en-panama/,"La Dirección General del Sistema Penitenciario (DGSP), dependencia del Ministerio de Gobierno (Mingob), informó este domingo sobre la muerte de un privado de libertad de 46 años de edad, quien estaba",04-10-2020 15:00,https://www.bing.com/th?id=OVFT.YPuoEeHIOMgpGPbfnNFU4C,Panamá,Mi Diario
SBP define las reglas temporales para el tratamiento y constitución de provisiones para créditos que se han acogido a la Ley de Moratoria,https://elcapitalfinanciero.com/sbp-define-las-reglas-temporales-para-el-tratamiento-y-constitucion-de-provisiones-para-creditos-que-se-han-acogido-a-la-ley-de-moratoria/,"La Junta Directiva de la Superintendencia de Bancos de Panamá (SBP), recientemente aprobó el Acuerdo No. 9-2020, a través del cual se modifica el Acuerdo No. 2-2020 “Que establece medidas adicionales,",04-10-2020 15:01,https://www.bing.com/th?id=OVFT.4OXnmDcU_MdZZwVRej062S,Panamá,El Capital Financiero
Santiago y Soná podría volver a la cuarentena los fines de semana,http://www.nexpanama.com/santiago-y-sona-podria-volver-a-la-cuarentena-los-fines-de-semana/,"Si no mejora el comportamiento sanitario en relación a la propagación del coronavirus en la provincia de Veraguas, para los próximos días en los distritos de Santiago cabecera y Soná, podría darse la",04-10-2020 15:23,https://www.bing.com/th?id=OVFT.IDartYqvLE5FD7hg3l3WYy,Panamá,NEX TV
Especialistas analizan la situación económica de Panamá en medio de la pandemia,https://www.telemetro.com/debate-abierto-dominical/2020/10/04/especialistas-analizan-la-situacion-economica-de-panama-en-medio-de-la-pandemia/3303628.html,"Expertos en el tema económico, artístico, salud y laboral como Ana Patiño, economista; Aimeé T. Sentmat, presidenta de la Asociación Bancaria de Panamá; Carlos Ayala, asesor del Ministerio de Trabajo",04-10-2020 16:33,https://www.bing.com/th?id=OVFT.K3BLgDB5IibJqBnwtIG4_S,Panamá,Telemetro
"Radar: Reactivación económica, Donald Trump y la neutralidad de Panamá",https://www.tvn-2.com/radar/Radar-Reactivacion-Donald-Trump-Panama_0_5685931364.html,"Los panameños han vuelto a las calles, pero es seguro decir que la normalidad aún es un concepto lejano. Esta semana en Radar, un panel de expertos discutió las principales tendencias que se han visto",04-10-2020 16:34,https://www.bing.com/th?id=OVFT.KOHIEcIBghBXjB8uLGT--S,Panamá,TVN
Santiago y Soná podrían regresar a la cuarentena los fines de semana,https://www.nexpanama.com/santiago-y-sona-podria-volver-a-la-cuarentena-los-fines-de-semana/,"Si no mejora el comportamiento sanitario en relación a la propagación del coronavirus en la provincia de Veraguas, para los próximos días en los distritos de Santiago cabecera y Soná, podría darse la",04-10-2020 16:58,https://www.bing.com/th?id=OVFT.IDartYqvLE5FD7hg3l3WYy,Panamá,NEX TV
"Muere privado de libertad de El Renacer, se había recuperado de la COVID-19",https://www.panamaamerica.com.pa/judicial/muere-privado-libertad-renacer-se-habia-recuperado-covid-19-1173369,"Un privado de libertad recluido en el centro penitenciario El Renacer, falleció en horas de la tarde de ayer sábado 3 de octubre, informó la Dirección General del Sistema Penitenciario.Según la entida",04-10-2020 17:27,https://www.bing.com/th?id=OVFT.lD-mq9e4TXQRv54P06Tt_y,Panamá,panamaamerica.com.pa
Paraguay alivia cuarentena y restricciones contra covid-19,https://ensegundos.com.pa/2020/10/04/paraguay-alivia-cuarentena-y-restricciones-contra-covid-19/,El gobierno del presidente Mario Abdo Benítez anunció este fin de semana el fin de la cuarentena sanitaria formal en Paraguay y un alivio de las restricciones que buscaban prevenir la expansión del co,04-10-2020 18:54,https://www.bing.com/th?id=OVFT.NrTEmhxkjBaLz3QiJT43tC,Panamá,En Segundos
Meduca autoriza la inscripción virtual de estudiantes para el año lectivo 2021,https://www.laestrella.com.pa/nacional/201004/meduca-autoriza-inscripcion-virtual-estudiantes-ano-lectivo-2021,"Las inscripciones para prekínder y kínder inician en la semana de vacaciones, para retornar las clases a distancias desde el próximo 12 de octubre",04-10-2020 19:13,https://www.bing.com/th?id=OVFT.pEfoU38phEaninGXLTTa-i,Panamá,laestrella.com.pa
Gobierno de EE.UU. descarta transferencia de poder por convalecencia de Trump,https://lagacetadepanama.com/gobierno-de-ee-uu-descarta-transferencia-de-poder-por-convalecencia-de-trump/,"La transferencia de poder al vicepresidente estadounidense, Mike Pence, por la convalecencia por COVID-19 del mandatario Donald Trump «no está sobre la mesa», aseguró este domingo a CBS News el asesor",04-10-2020 19:20,https://www.bing.com/th?id=OVFT.fjZZXDItoeeXxUdtNnFeDS,Panamá,La Gaceta de Panama
Cámara de Comercio resalta la importancia de la Responsabilidad Social Empresarial,https://www.metrolibre.com/econom%C3%ADa/183544-c%C3%A1mara-de-comercio-resalta-la-importancia-de-la-responsabilidad-social-empresarial.html,La donación de alimentos y la logística de hacerlos llegar a centros de acopio son algunas de las acciones que destacó la Cámara de Comercio e Industrias y Agricultura de Panamá (CCIAP) como parte de,04-10-2020 19:39,https://www.bing.com/th?id=OVFT.WsK3X_abw72KKcRSbHMAHS,Panamá,Metro Libre
Cerca de 500 mil estudiantes en clases a distancia inician vacaciones este lunes,https://www.metrolibre.com/nacionales/183547-cerca-de-500-mil-estudiantes-en-clases-distancia-inician-vacaciones-este-lunes.html,"Más de medio millón de estudiantes se aprestan a tomar una semana de vacaciones a partir de este lunes, 5 de octubre, tras completar, el pasado 2 de octubre, el primer trimestre de clases de este año",04-10-2020 19:46,https://www.bing.com/th?id=OVFT.tZGFtE2bzTTGf4jKgebMtC,Panamá,Metro Libre
Ciudad de Nueva York busca reconfinar nueve barrios por Covid-19,https://www.prensa.com/mundo/ciudad-de-nueva-york-busca-reconfinar-nueve-barrios-por-covid-19/,"La ciudad de Nueva York planea volver a cerrar escuelas, restaurantes y comercios no esenciales en nueve barrios de Brooklyn y Queens, donde los casos de coronavirus se han multiplicado en las últimas",04-10-2020 22:03,https://www.bing.com/th?id=OVFT.Xr9ewqXVTuHBF-DLqGpCPi,Panamá,prensa.com
Cámara de Comercio reflexiona sobre la RSE y el valor compartido en medio de covid-19,https://www.laestrella.com.pa/nacional/201004/camara-comercio-reflexiona-rse-compartido-medio-covid-19,La organización enumera algunas de las acciones que la empresa privada ha desarrollado en medio de covid-19 en Panamá,04-10-2020 22:05,https://www.bing.com/th?id=OVFT.r_yZnR00tbGqrRiblf0-Ey,Panamá,laestrella.com.pa
Autoridades mantienen preocupación ante casos que demuestran “desobediencia ciudadana”,https://www.radiopanama.com.pa/noticias/actualidad/autoridades-mantienen-preocupacion-ante-casos-que-demuestran-desobediencia-ciudadana/20201004/nota/4075098.aspx,"En Panamá Oeste, segunda provincia con más contagios por COVID-19, se empiezan a reportar un repunte de casos en comunidades apartadas que antes no lo tenían",04-10-2020 22:19,https://www.bing.com/th?id=OVFT.U5aKDYpkHePXVNpXvKWW7y,Panamá,Radio Panamá
Desobediencia ciudadana,https://www.radiopanama.com.pa/temas/desobediencia-ciudadana/temas/21712.aspx,"Autoridades mantienen preocupación ante casos que demuestran “desobediencia ciudadana” En Panamá Oeste, segunda provincia con más contagios por COVID-19, se empiezan a repo",04-10-2020 22:35,https://www.bing.com/th?id=OVFT.U5aKDYpkHePXVNpXvKWW7y,Panamá,Radio Panamá
Vigilancia Epidemiológica de Panamá confirma 633 casos nuevos y 9 muertos por COVID-19,https://www.tvn-2.com/nacionales/Vigilancia-Epidemiologica-Panama-confirma-COVID-19_0_5685931408.html,En las últimas 24 horas el Sistema de Vigilancia Epidemiológica de Panamá confirmó 9 defunciones y  633 casos nuevos por la COVID-19.,04-10-2020 23:02,https://www.bing.com/th?id=OVFT.cpAGZ0a3sC9qZCM87a4MOi,Panamá,TVN
Panamá registra en las últimas horas 9 defunciones por la Covid-19; detectan 633 nuevos casos de infectados,https://www.prensa.com/sociedad/panama-registra-en-las-ultimas-horas-9-defunciones-por-la-covid-19-detectan-633-nuevos-casos-de-infectados/,El informe epidemiológico del Ministerio de Salud (Minsa) de este domingo 4 de octubre reporta que en las últimas horas se registraron nueve defunciones debido a la enfermedad de,04-10-2020 23:03,https://www.bing.com/th?id=OVFT.NRhT7VWFlrsaQyxVerk77C,Panamá,prensa.com
"Panama eleva las muertes por COVID-19 a 2,423 y los contagios a 115,286",https://www.telemetro.com/nacionales/2020/10/04/panama-eleva-muertes-covid/3309683.html,"El informe epidemiológico del Ministerio de Salud de Panamá reportó que para este domingo unas 9 nuevas muertes se suscitaron a consecuencia del COVID-19 lo que eleva a 2,423 los decesos en el país po",04-10-2020 23:11,https://www.bing.com/th?id=OVFT.wWxzZdV366huB9AOiw1qti,Panamá,Telemetro
Los decesos por covid-19 se han elevado a 2 mil 423 en nuestro país,http://elsiglo.com.pa/panama/decesos-covid-19-elevado-423-nuestro-pais/24165334,"Las autoridades de Salud señalaron que para este domingo se registran unas 9 nuevas muertes por covid-19 las que la elevan a 2, 423. En tanto hay 633 nuevos casos para un total de 115,286 contagios ac",04-10-2020 23:20,https://www.bing.com/th?id=OVFT.1pP3AocxOsKlOxKma5XABy,Panamá,El Siglo
"Panamá acumula 115,286 casos positivos de Covid-19",https://ensegundos.com.pa/2020/10/04/panama-acumula-115286-casos-positivos-de-covid-19/,"Los hospitalizados suman 843 y de ellos 733 se encuentran en sala y 110 en UCI. El Ministerio de Salud (Minsa), informó que, para este domingo 4 de octubre en Panamá, se contabilizan 91,809 pacientes",04-10-2020 23:23,https://www.bing.com/th?id=OVFT.y9WMfCkn6DB8ltnVlTtaXS,Panamá,En Segundos
Panamá acumula 115.286 casos confirmados y 2.423 muertes por la COVID-19,https://www.diaadia.com.pa/el-pais/panama-acumula-115286-casos-confirmados-y-2423-muertes-por-la-covid-19-371031,"Panamá sumó este domingo 633 nuevos casos del coronavirus SARS-CoV-2 y 9 defunciones por la COVID-19, que elevaron hasta 115.286 los contagios confirmados y 2.423 las muertes por la enfermedad en 211 días de pandemia. En su informe diario, el Ministerio ...",05-10-2020 00:09,https://www.bing.com/th?id=OVFT.G4MUsfSM1K5IzH_KD_8fBy,Panamá,Día a Día
