name,url,description,datePublished,imagen,pais,Fuente
"""Panamá está sufriendo"", atestigua un adulto mayor que superó la COVID-19",https://www.critica.com.pa/nacional/panama-esta-sufriendo-atestigua-un-adulto-mayor-que-supero-la-covid-19-584903,"Guillermo Antonio Espino es un panameño de 74 años que superó la COVID-19 y que le pide ""a Dios que quite esta pandemia"", que ha contagiado a 69.424 personas y matado a otras 1.522 en Panamá, un país",05-08-2020 17:39,https://www.bing.com/th?id=ON.4738E2F2DA2EFDF438ABFF7042EDB582,Panamá,Critica
Kendal Royo pierde la batalla contra la COVID-19,http://www.nexpanama.com/kendal-royo-pierde-la-batalla-contra-la-covid-19/,"El folklorista y presentador del programa “De aquí pa’ lla”, Kendall Royo perdió la batalla contra la COVID-19. Familiares de Royo confirmaron la triste noticia a través de las redes sociales. Kendal",05-08-2020 18:07,https://www.bing.com/th?id=ON.5A28D51174BA9C7F73D1950FDBAA5CE1,Panamá,NEX TV
Científicos panameños ayudan a crear suplemento alimenticio para fortalecer el sistema inmune,http://www.nexpanama.com/cientificos-panamenos-ayudan-a-crear-suplemento-alimenticio-para-fortalecer-el-sistema-inmune/,"Científicos de Panamá, Japón e India estudian los bondades de un suplemento alimenticio derivado de un hongo japonés para fortalecer el sistema inmune de los pacientes de la COVID-19 con comorbilidade",05-08-2020 18:24,https://www.bing.com/th?id=ON.C16252FED1DA526BC54F879B47A99CED,Panamá,NEX TV
"Panamá es un destino turístico seguro, según estudio de percepción del destino",https://www.panamaamerica.com.pa/economia/panama-es-un-destino-turistico-seguro-segun-estudio-de-percepcion-del-destino-1169299,"Como un destino seguro fue calificado Panamá, de acuerdo con el estudio: “Percepción de Panamá y Salud de la Marca”, realizado en Estados Unidos, Colombia, Brasil, Costa Rica, Argentina, Canadá, Españ",05-08-2020 19:18,https://www.bing.com/th?id=ON.0EF864E15299ED821D68C90C93A286BB,Panamá,panamaamerica.com.pa
Número reproductivo efectivo del COVID-19 en Panamá desciende a 1.13,https://elcapitalfinanciero.com/numero-reproductivo-efectivo-del-covid-19-en-panama-desciende-a-1-13/,"El índice reproductivo efectivo del coronavirus (COVID-19), o Rt, en Panamá descendió de 1.16 a 1.13, informó el doctor Israel Cedeño, director de la Región Metropolitana de Salud. Cedeño explicó que",05-08-2020 19:45,https://www.bing.com/th?id=ON.F24485F302DF17B4354F4BEC8BF52885,Panamá,El Capital Financiero
Entregan mascarillas y gel alcoholado en Instituto de Salud Mental,http://elsiglo.com.pa/panama/entreganmascarillas-ygel-alcoholado-eninstituto-salud-mental/24161789,"Unas 400 mascarillas así como 300 gel alcoholado, 12 docenas de batas descechables y 10 oxímetros recibió el Instituto de Salud Mental (INSAM) por la junta comunal de San Francisco. para la prevención",05-08-2020 20:27,https://www.bing.com/th?id=ON.152918567F2E837E9C77319DC516D99E,Panamá,El Siglo
"Atrapan a 'Monstruo', implicado en el caso de los jóvenes asesinados en Colón",https://www.diaadia.com.pa/el-pais/atrapan-monstruo-implicado-en-el-caso-de-los-jovenes-asesinados-en-colon-369014,"En la comunidad de Puerto Escondido fue encontrado la mañana de este miércoles, el tercer implicado en la masacre de los siete jóvenes en el búnker de Espinar. Tras una serie de allanamientos en las c",05-08-2020 21:22,https://www.bing.com/th?id=ON.18F86308AF0A8E0287C53895E83D6D37,Panamá,Día a Día
Se agudiza conflicto entre Panamá y Costa Rica,https://www.prensa.com/impresa/economia/se-agudiza-conflicto-entre-panama-y-costa-rica/,"Más del 40% de las importaciones de productos lácteos que entran a Panamá proviene de Costa Rica, en su mayoría leche fluida, evaporada y deslactosada. Archivo En momentos en que el mundo enfrenta una",05-08-2020 21:36,https://www.bing.com/th?id=ON.5DD8D09CA72998D9DC3AAA46E5104CA6,Panamá,prensa.com
Siete semanas sucesivas con alta tasa de positividad,https://www.prensa.com/impresa/panorama/la-tasa-de-positividad-una-cifra-dificil-de-bajar/,La pasada semana epidemiológica (26 de julio al 1 de agosto) se realizaron 22 mil 996 pruebas diagnósticas de la enfermedad Covid-19 en todo el país. Gabriel Rodríguez Lograr una tasa de positividad q,05-08-2020 21:36,https://www.bing.com/th?id=ON.6248B0760E75D65442D640168DD3102B,Panamá,prensa.com
Empresarios se unen a los equipos de trazabilidad,https://www.critica.com.pa/nacional/empresarios-se-unen-los-equipos-de-trazabilidad-584927,Dirigentes de dos de los principales gremios empresariales del país manifestaron que se suman al trabajo coordinado y unificado que realiza el Gobierno Nacional para reducir el número de casos positiv,05-08-2020 21:46,https://www.bing.com/th?id=ON.E521D1A63C6DBF4319151314B7703656,Panamá,Critica
Arrested former Colombian president tests positive,https://www.newsroompanama.com/news/arrested-former-colombian-president-tests-positive,Former Colombian President Álvaro Uribe tested positive for COVID-19 just 19 hoursafter the Supreme Court ordered his house arrest for alleged procedur,05-08-2020 21:55,https://www.bing.com/th?id=ON.19DFE6F9AE437A6A3DD467B5EFC7D4D7,Panamá,Newsroom Panama
"Migración de estudiantes del sector particular al público, genera preocupación en gremios magisteriales",https://www.radiopanama.com.pa/noticias/actualidad/migracion-de-estudiantes-del-sector-particular-al-publico-genera-preocupacion-en-gremios-magisteriales/20200805/nota/4060587.aspx,"Unos 2,210 estudiantes han migrado del sector particular al público como consecuencia de los efectos en la economía a raíz de la pandemia del COVID-19. Anaika De la Espada, subdirectora general admini",05-08-2020 22:15,https://www.bing.com/th?id=ON.7D78B3FEAE78D8AC05601605E2D2BC64,Panamá,Radio Panamá
El premundial de futsal de Concacaf se jugará en el mes de mayo del 2021,https://www.tvmax-9.com/somoslasele/premundial-futsal-Concacaf-jugara-mayo_0_5640935937.html,"Concacaf ratificó a Guatemala como sede del Campeonato de Futsal de la Confederación, este evento clasificará a cuatro selecciones para el Mundial de Futsal que se disputará en Lituania en el 2021. Or",05-08-2020 22:33,https://www.bing.com/th?id=ON.38BD5C7B4E1279E388D03465A641B225,Panamá,TVMAX
Se confirma la muerte del folklorista y médico Kendall Royo por la covid-19,https://www.latinol.com/vidasocial/se-confirma-la-muerte-del-folklorista-y-medico-kendall-royo-por-la-covid-19/91053.html,"Esto sin duda nos rompe el alma y menos tratándose de alguien tan querido como el folklorista Kendall Royo, quien ha sido víctima del Covid-19, Royo se encontraba hospitalizado en cuidados intensivos",05-08-2020 23:08,https://www.bing.com/th?id=ON.526E3A017830AABBC7FC007A1AC5E5A4,Panamá,Latin OL
"Panamá mantiene comunicación directa con fábricas de vacunas contra el COVID-19, dice Cortizo",https://www.telemetro.com/nacionales/2020/08/05/panama-mantiene-comunicacion-directa-con-fabricas-de-vacunas-contra-el-covid-19-dice-cortizo/3107311.html,"Reconozco el esfuerzo que el Comité de Vacuna ha realizado para organizar la estrategia que nos permita obtener, a través de las fábricas de vacunas contra #COVID19 de todo el mundo y con las Organiza",05-08-2020 23:11,https://www.bing.com/th?id=ON.5A05B43A4D190DDB99321A8D6001EF94,Panamá,Telemetro
"COVID-19 en Panamá: 31 defunciones, 807 casos nuevos y 23,886 activos",https://www.tvn-2.com/nacionales/COVID-19-Panama-defunciones-nuevos-activos_0_5640935944.html,"Para hoy miércoles 5 de agosto en Panamá se contabilizan 44,792 pacientes recuperados, 807 casos positivos nuevos, para un total acumulado de 70,231. A la fecha se aplicaron 2,535 pruebas, para un por",05-08-2020 23:13,https://www.bing.com/th?id=ON.77268DE4785CB0A1832721FB21B4CE5F,Panamá,TVN
Panama virus positivity rate over 30% for seven weeks,https://www.newsroompanama.com/health/panama-virus-positivity-rate-over-30-for-seven-weeks-1,"The positivity rate in the diagnostic tests of Covid-19 has not dropped below 30% in the last seven weeks and the 4000, daily tests announced by President Corti",05-08-2020 23:16,https://www.bing.com/th?id=ON.6886D177FC1265B92DB6B379E634B68F,Panamá,Newsroom Panama
"Con 807 nuevos contagios de COVID-19, Panamá supera los 70,000 casos acumulados",https://www.telemetro.com/nacionales/2020/08/05/nuevos-contagios-covid-panama/3106902.html,"Agregó que unas 44,792 personas se han recuperado y se registran 23,886 casos activos, 21,784 permanecen en aislamiento domiciliario y 598 se encuentran en hoteles hospitales. Por otro lado, 1,340 per",05-08-2020 23:32,https://www.bing.com/th?id=ON.54EE4052B7145515FF687B8C5009B9E9,Panamá,Telemetro
"Panamá supera los 70 mil casos de Covid-19 y registra 1,533 muertes",https://ensegundos.com.pa/2020/08/05/panama-supera-los-70-mil-casos-de-covid-19-y-registra-1533-muertes/,"En suelo patrio la pandemia no da tregua. En las últimas 24 horas ha arrebatado la vida de 31 personas. Para hoy miércoles 5 de agosto en Panamá se contabilizan 44,792 pacientes recuperados, 807 casos",05-08-2020 23:38,https://www.bing.com/th?id=ON.93EB37405281C380B500F320F7A612F2,Panamá,En Segundos
Minsa: 807 casos positivos nuevos 31 nuevas defunciones por covid-19,http://elsiglo.com.pa/panama/minsa807casos-positivos-nuevos31-nuevas-defunciones-covid-19/24161804,"Este miércoles 5 de agosto el Ministerio de Salud (Minsa) informó que en Panamá se contabilizan 44,792 pacientes recuperados, 807 casos positivos nuevos, para un total acumulado de 70,231. En cuanto a",05-08-2020 23:38,https://www.bing.com/th?id=ON.13AE292F20674C47BE597FB25AF72CAB,Panamá,El Siglo
"Panamá alcanza las 1,553 muertes por Covid-19",https://www.metrolibre.com/nacionales/178500-panam%C3%A1-alcanza-las-1553-muertes-por-covid-19.html,"Para este miércoles, 5 de agosto, el Ministerio de Salud contabilizó 807 nuevos casos positivos de Covid-19, para un total acumulado de 70,231.  A la fecha se aplicaron 2,535 pruebas, para un porcenta",05-08-2020 23:40,https://www.bing.com/th?id=ON.C16DEA376240B22C7FE6D132F1FA3E70,Panamá,Metro Libre
Comité de vacuna de la COVID-19 hace los enlaces para que Panamá obtenga las dosis requeridas,https://www.panamaamerica.com.pa/sociedad/comite-de-vacuna-de-la-covid-19-hace-los-enlaces-para-que-panama-obtenga-las-dosis,"El presidente de la República, Laurentino Cortizo, sostuvo este miércoles una reunión con el comité de vacuna de la COVID-19, el cual le da seguimiento al trabajo que desarrollan las casas comerciales",05-08-2020 23:49,https://www.bing.com/th?id=ON.B2ADEAD0E95F8A309E5DCF67B941D658,Panamá,panamaamerica.com.pa
"Las defunciones por COVID-19 siguen en aumento, 31 en las últimas horas",https://www.diaadia.com.pa/el-pais/las-defunciones-por-covid-19-siguen-en-aumento-31-en-las-ultimas-horas-369036,"Hoy miércoles 5 de agosto en Panamá el Ministerio de Salud contabilizan 44,792 pacientes recuperados de COVID-19, mientras que 807 casos positivos nuevos, para un total acumulado de 70,231. A la fecha",05-08-2020 23:54,https://www.bing.com/th?id=ON.2854D667BC7B540B3A0CF28B7CD0ADD7,Panamá,Día a Día
"Presidente Cortizo, adelantó que a partir de la próxima semana culmina vuelos humanitarios para ciudadanos panameños",https://www.radiopanama.com.pa/noticias/actualidad/presidente-cortizo-adelanto-que-a-partir-de-la-proxima-semana-culmina-vuelos-humanitarios-para-ciudadanos-panamenos/20200805/nota/4060625.aspx,"El presidente de la República, Laurentino Cortizo, adelantó que a partir de la próxima semana se estaría culminando con los vuelos humanitarios para los ciudadanos panameños. El mandatario informó que",05-08-2020 23:56,https://www.bing.com/th?id=ON.7D78B3FEAE78D8AC05601605E2D2BC64,Panamá,Radio Panamá
Panamá anuncia eliminación de vuelos humanitarios para retorno de panameños,https://www.tvn-2.com/nacionales/Panama-anuncia-eliminacion-humanitarios-panamenos_0_5640935936.html,"El presidente de Panamá, Laurentino Cortizo, anunció este miércoles que se ""eliminarán"" los vuelos humanitarios para nacionales a partir de la próxima semana y que sólo se les exigirá una prueba de CO",06-08-2020 00:25,https://www.bing.com/th?id=ON.F28B40248CFF391AA6265D4AC7FC7813,Panamá,TVN
Emiten recomendaciones a embarazadas con Covid-19 para concluir su periodo de gestación,https://ensegundos.com.pa/2020/08/05/emiten-recomendaciones-a-embarazadas-con-covid-19-para-concluir-su-periodo-de-gestacion/,Si la embarazada se siente deprimida debe expresar sus temores y buscar ayuda psicológica. Las embarazadas que resultan positivas a la prueba covid -19 no deben alarmarse y sentir temor durante los nu,06-08-2020 00:28,https://www.bing.com/th?id=ON.B2304540A8DE17CFEC1F7A8B427FEC56,Panamá,En Segundos
Cortizo: Panamá mantiene comunicación directa con fábricas de vacunas contra el Covid-19,https://www.metrolibre.com/internacionales/178503-cortizo-panam%C3%A1-mantiene-comunicaci%C3%B3n-directa-con-f%C3%A1bricas-de-vacunas-contra-el-covid-19.html,"El presidente de la República, Laurentino Cortizo, informó que se reunió con el Comité de Vacuna, que mantiene comunicación directa con las casas comerciales que están produciendo las vacunas contra e",06-08-2020 00:53,https://www.bing.com/th?id=ON.6C379CF52A14482757330E62BCFA3950,Panamá,Metro Libre
