name,url,description,datePublished,imagen,pais,Fuente
Se dictan nuevas disposiciones laborales debido a cierres por cuarentena total,https://sertv.gob.pa/nacionalfm/se-dictan-nuevas-disposiciones-laborales-debido-a-cierres-por-cuarentena-total/,"A través de nota, las autoridades del Ministerio de Desarrollo Laboral de la República de Panamá, han dado a conocer lo siguiente: Ante las medidas preventivas para la mitigación del contagio del COVI",30-12-2020 20:21,https://www.bing.com/th?id=OVFT.Ew-YYi0cpJJs0lVs9EL5ry,Panamá,SERTV
"Panamá tiene 44,582 casos activos de COVID-19, y los últimos seis días se han registrado 269 muertes",https://www.panamaamerica.com.pa/sociedad/panama-tiene-44582-casos-activos-covid-19-ultimos-seis-dias-se-han-registrado-269-muertes,"En los últimos seis días, en Panamá se han registrado 269 muertes por COVID-19, mientras que hay 44,582 casos activos.Y es que el 24 de diciembre se contabilizaron 51 fallecimientos, el 25  fueron 41",30-12-2020 22:31,https://www.bing.com/th?id=OVFT.z67Z6d42YKqVopO001eRGi,Panamá,panamaamerica.com.pa
Arquidiócesis suspende misas presenciales,http://elsiglo.com.pa/panama/arquidiocesis-suspende-misas-presenciales/24170290,"La Arquidiócesis de Panamá  informó a la población que por quince días se mantendrán suspendidas las eucarístías de manera presencial.  Esto debido al aumento de casos de covid-19 en el país. "" A part",30-12-2020 22:52,https://www.bing.com/th?id=OVFT.s37UFUfMJN37edcmd--ryi,Panamá,El Siglo
Durante la crisis sanitaria por la Covid-19 Estados Unidos donó a Panamá $7.8 millones,https://noticias24pty.com/durante-la-crisis-sanitaria-por-la-covid-19-estados-unidos-dono-a-panama-7-8-millones/,"Debido a la crisis sanitaria surgida por la Covid-19 Estados Unidos le ha donado a la República de Panamá un total de $7.8 millones, en los que se incluyen ventiladores y kits para realizar",30-12-2020 23:17,https://www.bing.com/th?id=OVFT.j69asF7UC34_5DyDj5zauC,Panamá,Noticias 24 PTY
Gobierno cancela deuda a médicos y técnicos de la Salud,http://elsiglo.com.pa/panama/gobierno-cancela-deuda-medicos-tecnicos-salud/24170291,"Este miércoles 30 de diciembre el Gobierno Nacional ha dado a conocer que se ha cancelado las deudas a médicos y técnicos del sector salud, en 10 meses de este año, que habían sido dejadas de pagar a",30-12-2020 23:18,https://www.bing.com/th?id=OVFT.LVHmf12TsKUHGGGyL8NxQC,Panamá,El Siglo
"4,465 casos nuevos de COVID en Panamá y 42 defunciones en las últimas horas",https://www.diaadia.com.pa/el-pais/4465-casos-nuevos-de-covid-en-panama-y-42-defunciones-en-las-ultimas-horas-373988,"Este miércoles el ministro de Salud, Luis Francisco Sucre se reunió con los magistrados de la Corte Suprema de Justicia, a quienes les explicó las estrategias implementadas hasta el momento en P",31-12-2020 00:09,https://www.bing.com/th?id=OVFT.M8QmPQzcYSmXpXjKMzthQi,Panamá,Día a Día
Defunciones no bajan de 40 por día. La covid-19 está golpeando duro al pueblo panameño,https://www.midiario.com/nacionales/defunciones-no-bajan-de-40-por-dia-la-covid-19-esta-golpeando-duro-al-pueblo-panameno/,"El Ministerio de Salud (Minsa), informó que Panamá eleva a 242,744 su cifra de contagios por la covid-19, tras registrarse 4,465 nuevos casos del virus a nivel",31-12-2020 00:37,https://www.bing.com/th?id=OVFT.WCM8ASluYKn9dCn7-6Jf2y,Panamá,Mi Diario
EEUU ha aportado a Panamá $7.8 millones en asistencia para el manejo de la pandemia,https://www.tvn-2.com/nacionales/EEUU-aportado-Panama-millones-asistencia_0_5751174917.html,"Un total de $7.8 millones en asistencia humanitaria, han sido otorgados por Estados Unidos para el manejo de la pandemia en Panamá y para fortalecer el sistema de salud.",31-12-2020 01:11,https://www.bing.com/th?id=OVFT.-7v_NqHYRPqb8Ak-ADfnni,Panamá,TVN
Sitracog pide reactivación del Comité de Salud e Higiene COVID-19 en la Contraloría,https://www.telemetro.com/nacionales/2020/12/31/sitracog-pide-reactivacion-comite-higiene/3598691.html,"El Sindicato de Trabajadores de la Contraloría General (Sitracog) de la República de Panamá se pronunció este miércoles, ante los últimos hechos suscitados en la sede de dicha institución con respecto",31-12-2020 01:48,https://www.bing.com/th?id=OVFT.KvM0q-5VOLhIj_Sr01DISS,Panamá,Telemetro
"Panamá terminará el año 2020 con 4,000 muertes por Covid-19",https://www.critica.com.pa/nacional/panama-terminara-el-ano-2020-con-4000-muertes-por-covid-19-595302,"Panamá debe cerrar hoy el año con 4,000 muertes por Covid-19. Hasta ayer los decesos acumulados ascendían a 3,975, luego de registrarse el miércoles 42",31-12-2020 02:40,https://www.bing.com/th?id=OVFT.kmO6UN66orvt_N8D7ZwB6y,Panamá,Critica
2 mil 694 compras para la pandemia por $698 millones,https://www.prensa.com/impresa/panorama/2-mil-694-compras-para-la-pandemia-por-698-millones/,"En Panamá Compra constan contrataciones por parte de entidades del Estado para enfrentar la pandemia por Covid-19 por un total de $698 millones. En total, son 2 mil 694 compras que se han subido al po",31-12-2020 04:02,https://www.bing.com/th?id=OVFT.2NaiAWnxevaqEC_e3s7CsC,Panamá,prensa.com
Para Gwendolyn la vacuna contra el COVID-19 no es la solución,https://www.diaadia.com.pa/fama/para-gwendolyn-la-vacuna-contra-el-covid-19-no-es-la-solucion-373993,"Oye, Gwendolyn Stephenson está imparable con su segmento de preguntas y respuestas todos losmartes y cada semana se pone mejor.Sí, la panameña que está en Panamá disfrutando de las festividades de fin",31-12-2020 05:37,https://www.bing.com/th?id=OVFT.8ZTg55U-zSj9QlTg72rfLy,Panamá,Día a Día
Descubren en China la variante inglesa del covid-19,https://ensegundos.com.pa/2020/12/31/descubren-en-china-la-variante-inglesa-del-covid-19/,El Centro de Control y Prevención de Enfermedades (CDC) indicó que la nueva cepa fue aislada en una mujer de 23 años llegada a Shanghái el 14 de diciembre procedente del Reino Unido. La nueva variante,31-12-2020 11:07,https://www.bing.com/th?id=OVFT.oir3f_mjStNfDocWwznO-i,Panamá,En Segundos
Hombres madrugan para adquirir productos en el Mercado de Mariscos,https://www.tvn-2.com/nacionales/Hombres-madrugan-productos-Mercado-Mariscos_0_5751924760.html,"Este jueves, día de compras para hombres, muchos han madrugado para acudir al Mercado de Mariscos, en ciudad de Panamá.",31-12-2020 11:31,https://www.bing.com/th?id=OVFT.0Qx6AMce-6h-qAIbuVyr_C,Panamá,TVN
El coronavirus deja al mundo sin celebraciones de Año Nuevo,https://www.prensa.com/mundo/el-coronavirus-deja-al-mundo-sin-celebraciones-de-ano-nuevo/,"El planeta se prepara este jueves para dejar atrás el año 2020, marcado principalmente por la pandemia del coronavirus y que obliga a miles de millones de personas a celebrar el paso al Año Nuevo en l",31-12-2020 11:35,https://www.bing.com/th?id=OVFT.NJOSd_PYmQwrf6kNwjAveS,Panamá,prensa.com
"Tras un desgarrador 2020, Asia entra de puntillas en el Año Nuevo",https://www.nexpanama.com/tras-un-desgarrador-2020-asia-entra-de-puntillas-en-el-ano-nuevo/,"Asia se está despidiendo del 2020, que será recordado como el año en que una pandemia letal asoló el mundo, con celebraciones más pequeñas, cortas y apagadas por el temor a los rebrotes del coronaviru",31-12-2020 13:17,https://www.bing.com/th?id=OVFT.lAR8mGoul6DvYOfGNy-v9C,Panamá,NEX TV
Costa Rica recibe segundo envío de más de 11 mil vacunas de Pfizer contra la COVID-19,https://www.panamaamerica.com.pa/mundo/costa-rica-recibe-segundo-envio-mas-11-mil-vacunas-pfizer-contra-covid-19-1178745,"El presidente de Costa Rica, Carlos Alvarado Quesada, informó que 11.700 vacunas más para combatir la COVID-19 ya llegaron a su país.El segundo lote de las vacunas de la compañía Pfizer/BioNTech llegó",31-12-2020 13:37,https://www.bing.com/th?id=OVFT.Eo4qQjnDY9IA42MASVgo4S,Panamá,panamaamerica.com.pa
"2020 termina al fin, pero el coronavirus altera su despedida",http://www.nexpanama.com/2020-termina-al-fin-pero-el-coronavirus-altera-su-despedida/,"Esta víspera de Año Nuevo se está celebrando como ninguna otra, con las restricciones por la pandemia del coronavirus limitando las reuniones multitudinarias y muchos despidiendo un año que preferiría",31-12-2020 13:55,https://www.bing.com/th?id=OVFT.oqETvkM6yzOrmKaVY4eqvy,Panamá,NEX TV
Hechos 2020: Panamá despide un año marcado por la pandemia del COVID-19,https://www.telemetro.com/nacionales/2020/12/31/hechos-2020-panama-despide-un-ano-marcado-por-la-pandemia-del-covid-19/3595295.html,"Una crisis sanitaria causada por la pandemia del COVID-19, hizo que el Gobierno de Panamá implementara medidas de restricción para mitigar contagios, en medio de una educación a distancia, el sistema",31-12-2020 14:05,https://www.bing.com/th?id=OVFT.jSIbyZzlc3lPpdg4wHEFwi,Panamá,Telemetro
Casa del arrocero en Chiriquí se convertirá en albergue para pacientes con COVID-19,https://noticias24pty.com/casa-del-arrocero-en-chiriqui-se-convertira-en-albergue-para-pacientes-con-covid-19/,"La casa del arrocero en Chiriquí (Apach) se convertirá en un albergue para pacientes con COVID-19, confirmó  la directora del Ministerio de Salud en esa provincia, Gladys Novoa.Versión impresaLa",31-12-2020 14:41,https://www.bing.com/th?id=OVFT.u01KOVEtnE0Il7qiWphGnC,Panamá,Noticias 24 PTY
Club Activo 20-30 Panamá dona equipos de bioseguridad al Hospital Santo Tomás,https://ensegundos.com.pa/2020/12/31/club-activo-20-30-panama-dona-equipos-de-bioseguridad-al-hospital-santo-tomas/,"El equipo donado tiene un valor de unos 5 mil dólares. Para dar apoyo al personal médico panameño que, son la primera línea de batalla contra el COVID-19, el Club Activo 20-30 Panamá realizó la donaci",31-12-2020 15:11,https://www.bing.com/th?id=OVFT.2WK0FfHN-yse9RlZI3Ue9S,Panamá,En Segundos
El Canal cumple 21 años en manos panameñas,https://www.critica.com.pa/nacional/el-canal-cumple-21-anos-en-manos-panamenas-595329,"Estados Unidos traspasó el Canal a Panamá el 31 de diciembre de 1999, luego de 85 años de administración estadounidense.",31-12-2020 15:17,https://www.bing.com/th?id=OVFT.F5GDIqWKSXnhhqshAia5yS,Panamá,Critica
