name,url,description,datePublished,imagen,pais,Fuente
Pandemia deja a la Amazonia más frágil que nunca,https://www.prensa.com/impresa/vivir/pandemia-deja-a-la-amazonia-mas-fragil-que-nunca/,"Incendios, agricultura intensiva, extracción minera y petrolera, ocupaciones ilegales de tierras: la pandemia de Covid-19 ha agravado todos los males de la Amazonia y está causando estragos entre sus",08-08-2020 21:46,https://www.bing.com/th?id=ON.35E1CAEE52D3A51CDA1CD3751342EB38,Panamá,prensa.com
"Autoridades de salud, en alerta por los casos activos de la Covid-19 en Aguadulce",https://www.prensa.com/provincias/salud-en-alerta-por-los-casos-activos-de-la-covid-19-en-aguadulce/,"El incremento de casos de la Covid-19 detectados en el distrito de Aguadulce, provincia de Coclé, mantiene en alerta a las autoridades de la región, quienes no descartan aplicar medidas aún más enérgi",08-08-2020 21:46,https://www.bing.com/th?id=ON.0CA47A369FE5FCB704E6E33E16E86C89,Panamá,prensa.com
Recuperadas de Covid-19 cuentan su historia y cómo fue su paso por un hotel hospital,https://www.metrolibre.com/nacionales/178702-recuperadas-de-covid-19-cuentan-su-historia-y-c%C3%B3mo-fue-su-paso-por-un-hotel-hospital.html,"Johanna y Verónica lo han conseguido. Son dos de los 46675 panameños que han logrado superar el coronavirus, una cantidad que, aunque todavía es muy inferior al número de infectados (72,560), más que",08-08-2020 22:46,https://www.bing.com/th?id=ON.EB7E38D34C9B22D68ED0063299C085FB,Panamá,Metro Libre
Amupa pide que tema de vertederos se discutido por Ejecutivo,https://www.critica.com.pa/nacional/amupa-pide-que-tema-de-vertederos-se-discutido-por-ejecutivo-585174,"En medio de la pandemia de la Covid-19, los municipios del país se han quedado sin los recursos financieros necesarios para el mantenimiento y control de los vertederos a cielo, por lo cual la situaci",08-08-2020 23:38,https://www.bing.com/th?id=ON.5E44325433B86C290010AFFB79584583,Panamá,Critica
"Reportan 1,091 casos nuevos de covid-19 y 18 defunciones",http://elsiglo.com.pa/panama/reportan-1091-casos-nuevos-covid-19-18-defunciones/24161999,"El Ministerio de Salud (Minsa) reporta 1,091 nuevos casos de covid-19 con 18 nuevas defunciones. La cifra total de afectados se eleva a 73 mil 561 y los fallecidos son 1,609. Actualmente hay  en aisla",08-08-2020 23:51,https://www.bing.com/th?id=ON.4B675F46F3A74BD77DD5B357BFFBF121,Panamá,El Siglo
"Panamá y Panamá Oeste, con más casos de Covid-19 y más violaciones al toque de queda",https://ensegundos.com.pa/2020/08/08/panama-y-panama-oeste-con-mas-casos-de-covid-19-y-mas-violaciones-al-toque-de-queda/,"Son las provincias con más casos acumulados de Covid- 19. Este 8 de agosto, el Gobierno Nacional, las autoridades de Salud y el Ministerio de Seguridad reiteran el llamado a la población a respetar la",09-08-2020 01:00,https://www.bing.com/th?id=ON.D85FECE107C21395147F634677903E65,Panamá,En Segundos
"Frescos y campantes, así estaban 44 covid-19 en las calles",http://elsiglo.com.pa/panama/frescos-campantes-estaban-44-covid-19-calles/24162005,"Luego de que fueran diagnosticados con el coronavirus (covid-19), andaban por las calles del país como si nada les hubiera pasado. Esto se ve reflejado en las estadísticas del Ministerio Público (MP),",09-08-2020 05:13,https://www.bing.com/th?id=ON.19A6ED895BF7BD36B770E5EBFC52620B,Panamá,El Siglo
Entregas de Panamá Solidario totalizan más de 6 millones de operaciones,https://lagacetadepanama.com/entregas-de-panama-solidario-totalizan-mas-de-6-millones-de-operaciones/,"El Gobierno Nacional informó que hasta el pasado 2 de agosto de 2020, el Plan Panamá Solidario había entregado un total de 2 millones 479 mil 208 bolsas de comida, además de 1 millón 510 mil 696 bonos",09-08-2020 05:44,https://www.bing.com/th?id=ON.47029937D48EE5783B89A51F0D3FE271,Panamá,La Gaceta de Panama
Casos de coronavirus en EEUU superan marca de 5 millones,http://www.nexpanama.com/casos-de-coronavirus-en-eeuu-superan-marca-de-5-millones/,"(Reuters) – Estados Unidos marcó un récord de casos de coronavirus el sábado, con más de 5 millones de personas infectadas, de acuerdo a un recuento de Reuters. Esta semana, el principal responsable d",09-08-2020 15:26,https://www.bing.com/th?id=ON.3E3EDC5685DB8ACF1291B7F901A4F952,Panamá,NEX TV
Analizan estrategias para enfrentar el COVID-19 en Panamá y otros países,https://www.telemetro.com/debate-abierto-dominical/2020/08/09/analizan-estrategias-para-enfrentar-el-covid-19-en-panama-y-otros-paises/3115568.html,En el programa Debate Abierto Dominical se analizó los efectos psicológicos de la pandemia del COVID-19 y lo que están haciendo otros países para enfrentar la enfermedad.,09-08-2020 16:18,https://www.bing.com/th?id=ON.D358DC917460E18D68EDBF04AA74F510,Panamá,Telemetro
"Piden donar plasma convaleciente en Panamá, que acopia 73.561 casos de COVID",https://www.diaadia.com.pa/el-pais/piden-donar-plasma-convaleciente-en-panama-que-acopia-73561-casos-de-covid-369139,"Las autoridades sanitarias pidieron este sábado a los recuperados de COVID-19 que donen plasma convaleciente para ayudar a ""salvar vidas"" en Panamá, que acumula 73.561 casos confirmados y 1.609 muerte",09-08-2020 16:40,https://www.bing.com/th?id=ON.6700DBEDF32D66A0AAA5BBC73D4C94F0,Panamá,Día a Día
"Selectividad en tiempos 'apocalípticos', ¿cómo enfrentar la crisis económica, social y judicial?",https://www.tvn-2.com/radar/Selectividad-apocalipticos-enfrentar-economica-judicial_0_5643935562.html,"Quedarse en casa y morir de hambre, o salir y morir de COVID-19. Esa es la disyuntiva que enfrentan cada día millones de panameños. Se les pide que confíen en las autoridades, pero falta transparencia",09-08-2020 16:41,https://www.bing.com/th?id=ON.FF3A9AD68ACA8133354029EAD38F0A82,Panamá,TVN
Minsa reiteró el llamado a donar plasma convaleciente,http://www.nexpanama.com/minsa-reitero-el-llamado-a-donar-plasma-convaleciente/,"Las autoridades de Salud pidieron a los recuperados de COVID-19 que donen plasma convaleciente para ayudar a “salvar vidas” en Panamá, tras acumular 73.561 casos confirmados y 1.609 muertes por la enf",09-08-2020 16:55,https://www.bing.com/th?id=ON.D3B45FE299CA1749BEBC7C56018D39C7,Panamá,NEX TV
Panamá Solidario ha beneficiado a más de 240 mil residentes de Arraiján,https://www.telemetro.com/nacionales/2020/08/09/panama-solidario-beneficiado-240-mil/3118417.html,"El Plan Panamá Solidario para afectados por la pandemia del COVID-19 ha benefiado en 5 meses a más de 240 mil residentes en ocho corregimientos del distrito de Arraiján, informó el Gobierno Nacional.",09-08-2020 17:33,https://www.bing.com/th?id=ON.8D8F875C4BF94AFEA4F7806F42972BBB,Panamá,Telemetro
Empresarios perciben 'falta de urgencia' para atender reactivación de Panamá,https://www.diaadia.com.pa/el-pais/empresarios-perciben-falta-de-urgencia-para-atender-reactivacion-de-panama-369141,"Empresarios dijeron este domingo que ""la falta de urgencia"" para levantar ""gradualmente las restricciones"" a las actividades productivas hunde cada día más la economía de Panamá, semiparalizada desde",09-08-2020 17:41,https://www.bing.com/th?id=ON.FDA863453895A683CB42ACEB4620AFF5,Panamá,Día a Día
"Sólo el 25% de las Mipymes piensa permanecer activas una vez se reinicie la actividad económica, advierte el CNC",https://elcapitalfinanciero.com/solo-el-25-de-las-mipymes-piensa-permanecer-activas-una-vez-se-reinicie-la-actividad-economica-advierte-el-cnc/,"La pandemia del coronavirus (COVID-19) llegó para estremecer las economías y a la sociedad, generando impactos importantes a nivel mundial y Panamá no escapa a esta realidad. Sin embargo, el impacto m",09-08-2020 17:46,https://www.bing.com/th?id=ON.473098E4CFE0A093F693081F876C2625,Panamá,El Capital Financiero
"Día Internacional de los Pueblos Indígenas: Pobreza, desempleo y la amenaza del COVID-19",https://www.tvn-2.com/nacionales/Dia-Internacional-Pueblos-Indigenas-Pobreza-COVID-19-ONU-FAO-Panama_0_5643185699.html,"Este domingo 9 de agosto se conmemora el Día Internacional de los Pueblos Indígenas. De acuerdo con la Organización de las Naciones Unidas para la Alimentación y la Infancia (FAO), existen cerca de 37",09-08-2020 17:46,https://www.bing.com/th?id=ON.3CB92C5F5D3A897A5ECA1377FDAAB7F2,Panamá,TVN
"Covid-19 en Panamá: 1,091 nuevos casos y 18 defunciones",https://www.metrolibre.com/nacionales/178757-covid-19-en-panam%C3%A1-1091-nuevos-casos-y-18-defunciones.html,"Las defunciones a causa del nuevo coronavirus en Panamá aumentaron a 1,609, mientras que el número de casos positivos confirmados se elevó a 73,561, informó el Ministerio de Salud (Minsa). El doctor I",09-08-2020 18:04,https://www.bing.com/th?id=ON.1229862807C37CCA65C9A33FB0BEF8A7,Panamá,Metro Libre
"Minsa: 1,091 nuevos casos de Covid-19 y un total de 1,609 defunciones",https://ensegundos.com.pa/2020/08/08/minsa-1091-nuevos-casos-de-covid-19-y-un-total-de-1609-defunciones/,"Este 8 de agosto el Ministerio de Salud informó que se registran  1,091 nuevos para un acumulado de 73,561  casos de Covid-19. Se reportan 18 nuevas defunciones, elevando la cifra a 1,609. Se mantiene",09-08-2020 18:08,https://www.bing.com/th?id=ON.C3827007D42EB44B4B9FD4C2E7253C80,Panamá,En Segundos
"Más del 50% de los panameños con contratos suspendidos podrían perder sus empleos, dice Rene Quevedo",https://elcapitalfinanciero.com/mas-del-50-de-los-panamenos-con-contratos-suspendidos-podrian-perder-sus-empleos-dice-rene-quevedo/,"El Gobierno Nacional debe admitir que la Cuarentena Total que actualmente se aplica en las provincias de Panamá, Panamá Oeste, Colón, Bocas del Toro y Chiriquí no ha sido efectiva para contener los co",09-08-2020 18:41,https://www.bing.com/th?id=ON.98DE80C5E0CEB8E2EC2E13A7D2BC2751,Panamá,El Capital Financiero
Cardiólogos dan créditos a la hidroxicloroquina en la lucha contra la COVID-19 y reviven debate sobre su uso en Panamá,https://www.panamaamerica.com.pa/sociedad/cardiologos-dan-creditos-la-hidroxicloroquina-en-la-lucha-contra-la-covid-19-y-reviven,La Sociedad panameña de cardiología y la sociedad panameña de reumatología se encuentran muy preocupados por la confusión que se ha generado en redes sociales y medios de comunicación sobre el supuest,09-08-2020 18:57,https://www.bing.com/th?id=ON.B8C3AA886AC9A57684F7AD92ADA3C59A,Panamá,panamaamerica.com.pa
Cámara de Comercio expresa preocupación por el Presupuesto 2021 y pide que se atienda la crisis económica,https://www.radiopanama.com.pa/noticias/actualidad/camara-de-comercio-expresa-preocupacion-por-el-presupuesto-2021-y-pide-que-se-atienda-la-crisis-economica/20200809/nota/4061274.aspx,"La Cámara de Comercio, Industria y Agricultura de Panamá (CCIAP), ha solicitado al Gobierno Nacional, atender la crisis económica generada por la pandemia del COVID-19, y establecer acciones que contr",09-08-2020 19:09,https://www.bing.com/th?id=ON.7D78B3FEAE78D8AC05601605E2D2BC64,Panamá,Radio Panamá
Estados Unidos supera los 5 millones de casos de COVID-19,https://www.radiopanama.com.pa/noticias/internacional/estados-unidos-supera-los-5-millones-de-casos-de-covid19/20200809/nota/4061300.aspx,"Estados Unidos, el país más afectado por la pandemia de coronavirus, superó este domingo los 5 millones de casos confirmados de COVID-19, con 162.441 fallecidos, según el recuento independiente de la",09-08-2020 19:47,https://www.bing.com/th?id=ON.7D78B3FEAE78D8AC05601605E2D2BC64,Panamá,Radio Panamá
"CCIAP percibe ""falta de urgencia"" para atender reactivación de Panamá",https://www.critica.com.pa/nacional/cciap-percibe-falta-de-urgencia-para-atender-reactivacion-de-panama-585220,"Empresarios dijeron este domingo que ""la falta de urgencia"" para levantar ""gradualmente las restricciones"" a las actividades productivas hunde cada día más la economía de Panamá, semiparalizada desde",09-08-2020 20:23,https://www.bing.com/th?id=ON.CC369BCB8889FD78D25375D2FC82F0C7,Panamá,Critica
Camarógrafo Armando Contreras pierde la batalla contra la COVID-19,https://www.panamaamerica.com.pa/sociedad/camarografo-armando-contreras-pierde-la-batalla-contra-la-covid-19-1169599,"El camarógrafo Armando Contreras falleció este domingo a consecuencia de un infarto, en medio de la lucha que libraba contra el mortal virus caudante de la COVID-19. La noticia conmocionó a sus colega",09-08-2020 20:32,https://www.bing.com/th?id=ON.0C2A876AF08E8A9D15ABB29CCA9106EB,Panamá,panamaamerica.com.pa
