name,url,description,datePublished,imagen,pais,Fuente
Bajan los casos de COVID en Nueva Delhi y Mumbai,http://www.nexpanama.com/bajan-los-casos-de-covid-en-nueva-delhi-y-mumbai/,"Los contagios de coronavirus bajaron en las dos ciudades más grandes de India, pero el gobierno advirtió que el devastador brote que asola el país se esta extendiendo a las zonas rurales donde viven c",15-05-2021 14:47,https://www.bing.com/th?id=OVFT.nwJYOtlhBCIlPgrDBbgk9y,Panamá,NEX TV
Rubén Blades recibe la vacuna del COVID-19 e insta a todos aplicársela,https://www.telemetro.com/famosos/entretenimiento/ruben-blades-recibe-la-vacuna-del-covid-19-e-insta-todos-aplicarsela-n5017773,"El reconocido cantautor panameño, Rubén Blades, mostró a sus seguidores el momento preciso en el que recibió la vacuna contra el COVID-19 e instó a todas las personas a aplicársela.",15-05-2021 18:03,https://www.bing.com/th?id=OVFT.ZZ6UGuON6sXotWKrFdn36y,Panamá,Telemetro
Rubén Blades recibe la vacuna del COVID-19,https://www.metrolibre.com/cultura/201935-rub%C3%A9n-blades-recibe-la-vacuna-del-covid-19.html,"El cantante y compositor panameño, Rubén Blades, publicó en sus redes sociales una fotografía del momento  en el que recibía la vacuna en contra del COVID-19 y aprovechó la oportunidad para enviar un",15-05-2021 21:54,https://www.bing.com/th?id=OVFT.7dRGi0nahWnebDM-hTupsC,Panamá,Metro Libre
Argentina supera los 70.000 muertos por covid-19,https://ensegundos.com.pa/2021/05/15/argentina-supera-los-70-000-muertos-por-covid-19/,"Argentina superó este sábado los 70.000 muertos por covid-19 desde que se inició la pandemia mientras el promedio diario de nuevos casos no cede y se ubica por encima de 20.000, informaron las autorid",15-05-2021 22:24,https://www.bing.com/th?id=OVFT.-LEgRR-Imxuaw5-caksEUi,Panamá,En Segundos
Panamá reporta 490 casos positivos nuevos y cuatro defunciones por COVID-19,https://www.tvn-2.com/nacionales/Panama-reporta-positivos-defunciones-COVID-19_0_5853164662.html,"El Ministerio de Salud (Minsa), reportó en su informe de este sábado 15 de mayo, 490 casos positivos nuevos y 4 fallecidos por COVID-19.",15-05-2021 23:01,https://www.bing.com/th?id=OVFT.B5RFl0H-DzQ2XioCrRF3Zy,Panamá,TVN
Panamá acumula 370.533 casos por Covid-19,https://www.metrolibre.com/nacionales/201939-panam%C3%A1-acumula-370533-casos-por-covid-19.html,"El Ministerio de Salud (MINSA), informó este sábado 15 de mayo, que en las últimas 24 horas se registraron 490 nuevos contagios por el nuevo coronavirus, elevando la cifra a 370.533. A la fecha se apl",15-05-2021 23:24,https://www.bing.com/th?id=OVFT.rtmVzDJkjxy8zEBItJMJHC,Panamá,Metro Libre
Continúa vacunación contra COVID-19 a docentes de la UP,https://www.telemetro.com/nacionales/continua-vacunacion-contra-covid-19-docentes-la-up-n5017863,"Más de 2,500 docentes y administrativos de la Universidad de Panamá están vacunados contra COVID-19.",15-05-2021 23:45,https://www.bing.com/th?id=OVFT.9dgxmya2MXPgITtTUekU_S,Panamá,Telemetro
"Este sábado, casi 500 casos de Covid-19 y el fallecimiento de 4 connacionales",https://ensegundos.com.pa/2021/05/15/este-sabado-casi-500-casos-de-covid-19-y-el-fallecimiento-de-4-connacionales/,"La curva de contagios en el país sigue en aumento. Autoridades piden a la población no bajar la guardia. Para el día de hoy en Panamá se contabilizan 490 casos positivos nuevos, para un total acumulad",15-05-2021 23:57,https://www.bing.com/th?id=OVFT.mPXewsFBLqeuBYj_wsWziy,Panamá,En Segundos
Panamá reporta 490 casos positivos y 4 nuevas defunciones por Covid-19,https://www.radiopanama.com.pa/noticias/actualidad/panama-reporta-490-casos-positivos-y-4-nuevas-defunciones-por-covid19/20210515/nota/4135199.aspx,"La cifra de contagios por Covid-19 para este sábado 15 de mayo del 2021, contabiliza 490 casos positivos nuevos, para un total acumulado de 370,533. Los casos activos al día de hoy suman 5,299, en tan",16-05-2021 00:17,https://www.bing.com/th?id=OVFT.U5aKDYpkHePXVNpXvKWW7y,Panamá,Radio Panamá
Panamá registra 490 casos y 4 muertes por covid-19 en las últimas 24 horas,https://noticias24pty.com/panama-registra-490-casos-y-4-muertes-por-covid-19-en-las-ultimas-24-horas/,"De acuerdo con cifras de las autoridades de salud para hoy sábado 15 de mayo se contabilizan 358,938 pacientes recuperados. Panamá registró una positividad de casos covid-19 de 7.7%, uno de los",16-05-2021 03:39,https://www.bing.com/th?id=OVFT.dFUlBjbSU2qumyvNYrhgCS,Panamá,Noticias 24 PTY
La Covid-19 en la niñez: sorpresiva y traicionera,https://www.prensa.com/impresa/opinion/la-covid-19-en-la-ninez-sorpresiva-y-traicionera/,"Aunque todavía no ganamos la batalla contra la Covid-19, ya podemos estar mas tranquilos y mejor preparados para contener la posibilidad de futuras olas de la enfermedad. El nuevo golpe contra este mo",16-05-2021 04:00,https://www.bing.com/th?id=OVFT.7FmiQ9QBYApyAm0T64Sdli,Panamá,prensa.com
Los tropiezos de la vacunación contra la Covid-19,https://www.prensa.com/impresa/panorama/los-tropiezos-de-la-vacunacion-contra-la-covid-19/,"La vacunación contra la Covid-19 en Panamá afronta, al menos, dos dificultades básicas: una limitada cantidad de dosis disponibles y la carencia de un sistema único de expediente clínico electrónico,",16-05-2021 04:11,https://www.bing.com/th?id=OVFT.ymATxc4HmshL-eUXmdeoyS,Panamá,prensa.com
Desconfianza y falta de acceso a internet ralentizan la vacunación en Guatemala,https://www.laestrella.com.pa/internacional/america/210515/desconfianza-falta-acceso-internet-ralentizan-vacunacion-guatemala,La mayoría de las personas que ya fueron vacunadas al menos una ocasión pertenecen a la primera línea de atención de la enfermedad,16-05-2021 05:00,https://www.bing.com/th?id=OVFT.ibXms7BHwfRYeFBo5CYsGy,Panamá,laestrella.com.pa
El costo promedio de la canasta básica de alimentos en abril se fijó en $264,https://www.laestrella.com.pa/nacional/210516/costo-promedio-canasta-basica-alimentos,"Los productos que más aumentaron en supermercados en el mes de abril, en comparación con el mes de marzo pasado, son la manzana roja mediana por unidad, la leche en polvo entera instantánea, la mortad",16-05-2021 05:21,https://www.bing.com/th?id=OVFT.CMyTue-wZOaq6iNN2W2BcC,Panamá,laestrella.com.pa
Lamentable. Cuatro personas más pierden la vida por covid-19 en Panamá. Chequee cuál es el grupo de edad que más está muriendo,https://www.midiario.com/salud/lamentable-cuatro-personas-mas-pierden-la-vida-por-covid-19-en-panama-chequee-cual-es-el-grupo-de-edad-que-mas-esta-muriendo/,"Cuatro personas más perdieron la vida por covid-19 en las últimas 24 horas en Panamá, con lo que totalizan 6 mil 296 las muertes acumuladas, para una letalidad del 1.7",16-05-2021 05:40,https://www.bing.com/th?id=OVFT.3T6PTi_EyvbshsYGuq-3AS,Panamá,Mi Diario
Aumentan los casos de covid-19 en La Chorrera por el relajamiento en las medidas de bioseguridad,https://noticias24pty.com/aumentan-los-casos-de-covid-19-en-la-chorrera-por-el-relajamiento-en-las-medidas-de-bioseguridad/,"Aun cuando el número de reproducción efectiva (Rt) de la covid-19 en Panamá Oeste se mantiene en 1.0 las autoridades sanitarias en esta provincia advirtieron del riesgo del aumento de casos,",16-05-2021 10:58,https://www.bing.com/th?id=OVFT.UbRafbynwhEde-AfqYC0zC,Panamá,Noticias 24 PTY
Empresarios afirman que medidas de confinamiento en Veraguas y Chiriquí genera desconfianza,https://www.midiario.com/nacionales/empresarios-afirman-que-medidas-de-confinamiento-en-veraguas-y-chiriqui-genera-desconfianza/,"José Ramón Icaza, presidente de la Cámara de Comercio e Industria de Panamá expresó por medio de un comunicado que uno de los obstáculos más importantes para la recuperación económica y del empleo es",16-05-2021 14:19,https://www.bing.com/th?id=OVFT.NI2NLG6qnznJf0OC8NPBvS,Panamá,Mi Diario
Invertir en telecomunicaciones es una alternativa ante la crisis generada por la pandemia,https://www.radiopanama.com.pa/noticias/actualidad/invertir-en-telecomunicaciones-es-una-alternativa-ante-la-crisis-generada-por-la-pandemia/20210516/nota/4135247.aspx,"La información surgió del foro internacional: ¿Por qué invertir en telecomunicaciones?, un espacio virtual donde se expusieron temas que benefician directamente a emprendedores e inversionistas",16-05-2021 15:34,https://www.bing.com/th?id=OVFT.U5aKDYpkHePXVNpXvKWW7y,Panamá,Radio Panamá
"Variantes del COVID-19, rol de las enfermeras, salud mental y futuro de la CSS en el radar",https://www.tvn-2.com/radar/Variantes-Covid-mental-futuro-CSS_0_5853914567.html,"Este domingo en Radar, un panel de expertos exploró el futuro de la CSS, el rol de las enfermeras en la lucha contra la pandemia, si las variantes representan un peligro para la inmunidad de rebaño y",16-05-2021 15:44,https://www.bing.com/th?id=OVFT.wztyuD-D8U5W6w_9f0CVDi,Panamá,TVN
Blades ya se vacunó contra el COVID-19 e insta a todos hacerlo,https://www.critica.com.pa/show/blades-ya-se-vacuno-contra-el-covid-19-e-insta-todos-hacerlo-604222,"El cantautor panameño Rubén Blades ya se puso su vacuna contra el COVID-19, y señaló que tuvo un poco de malestar y cansancio, pero nada",16-05-2021 16:10,https://www.bing.com/th?id=OVFT.bnf4klSuHVfd8WvYmdwDPC,Panamá,Critica
Blades se vacunó contra el COVID-19 e insta a todos hacerlo,https://www.critica.com.pa/show/blades-se-vacuno-contra-el-covid-19-e-insta-todos-hacerlo-604222,"El cantautor panameño Rubén Blades ya se puso su vacuna contra el COVID-19, y señaló que tuvo un poco de malestar y cansancio, pero nada",16-05-2021 16:19,https://www.bing.com/th?id=OVFT.bnf4klSuHVfd8WvYmdwDPC,Panamá,Critica
"Cifra de muertes por covid-19 bajan en mayo, a pesar de incremento de casos",https://www.panamaamerica.com.pa/sociedad/cifra-de-muertes-por-covid-19-bajan-en-mayo-pesar-de-incremento-de-casos-1187193,"A pesar de que se ha registrado un incremento de casos de covid-19 en este mes de mayo, la cifra de muertes ha bajado en comparación al mes anterior.Y es que en lo que va de mayo se han presentadi 59",16-05-2021 16:47,https://www.bing.com/th?id=OVFT.zGSqcFLbsZH50kM3uzqfjS,Panamá,panamaamerica.com.pa
Vuelven a sacar brillo al Nido de Águilas,https://bayanodigital.com/vuelven-a-sacar-brillo-al-nido-de-aguilas/,Por David Carrasco Director de Bayano digital Grupos de voluntarios y voluntarias de varias generaciones institutoras acudieron al llamado de la Fundación Pro,16-05-2021 17:19,https://www.bing.com/th?id=OVFT.Q8WtuLJ2vgeV09Yp_p-VzS,Panamá,Bayano Digital
