name,url,description,datePublished,imagen,pais,Fuente
Moody’s ajusta a la baja sus proyecciones de crecimiento para Panamá y advierte sobre su posible debilitamiento fiscal,https://elcapitalfinanciero.com/moodys-ajusta-a-la-baja-sus-proyecciones-de-crecimiento-para-panama-y-advierte-sobre-su-posible-debilitamiento-fiscal/,"La economía de Panamá se contraerá al menos un 4% este 2020 a causa de la crisis del coronavirus (COVID-19), que llegó cuando el país enfrentaba ya una desaceleración en su crecimiento y una erosión d",09-07-2020 20:59,https://www.bing.com/th?id=ON.D87B06B476AC427E2D9966E4CCC2688B,Panamá,El Capital Financiero
ANTAI pide garantizar derechos fundamentales a los pacientes con Covid-19,https://ensegundos.com.pa/2020/07/09/antai-pide-garantizar-derechos-fundamentales-a-los-pacientes-con-covid-19/,“Conocemos de protocolos exitosos en países como México y España donde se ha aplicado un procedimiento efectivo para dar información a familiares de pacientes”. El Derecho de Petición y el Acceso a la,09-07-2020 23:35,https://www.bing.com/th?id=ON.E6AC66A085F3AEE08DC0A7241558986D,Panamá,En Segundos
El COVID-19 cambia la feria del libro de Panamá en una fiesta virtual de las letras,https://www.panamaamerica.com.pa/variedades/el-covid-19-cambia-la-feria-del-libro-de-panama-en-una-fiesta-virtual-de-las-letras,"La Feria Internacional del Libro (FIL) de Panamá se celebrará del 13 al 16 de agosto próximo por primera vez de forma virtual y gratuita por la COVID-19, que golpea con severidad al país centroamerica",09-07-2020 23:37,https://www.bing.com/th?id=ON.5A138EE6C66F1D68F34EC86AE8248A89,Panamá,panamaamerica.com.pa
Países podrían mandar selecciones a Serie del Caribe en caso de cancelar ligas,https://www.tvmax-9.com/beisbol/Paises-selecciones-Serie-Caribe-cancelar_0_5620687970.html,"El comisionado de la Confederación de Béisbol Profesional del Caribe (CBPC), el dominicano Juan Francisco Puello Herrera, comentó este jueves que en caso de que un país cancele su Liga, podría mandar",09-07-2020 23:41,https://www.bing.com/th?id=ON.1B5596F59023A9A5B44F54879127CA36,Panamá,TVMAX
CAF y la AIG realizan conversatorio Resiliencia Digital en Tiempos de Covid-19,https://www.radiopanama.com.pa/noticias/actualidad/caf-y-la-aig-realizan-conversatorio--resiliencia-digital-en-tiempos-de-covid19/20200709/nota/4053739.aspx,"El Banco de Desarrollo de América Latina (CAF), en conjunto con la Autoridad de Innovación Gubernamental de Panamá (AIG), realizaron el conversatorio virtual ""Resiliencia Digital en Tiempos de Covid-1",09-07-2020 23:48,https://www.bing.com/th?id=ON.7D78B3FEAE78D8AC05601605E2D2BC64,Panamá,Radio Panamá
Panamá suma 965 casos de covid-19 y 20 nuevas defunciones,http://elsiglo.com.pa/panama/panama-suma-965-casos-covid-19-20-nuevas-defunciones/24160170,"Para este jueves 9 de julio en Panamá se reportan 20,437 pacientes recuperados, 965 casos positivos nuevos, para un total acumulado de 42,216. Se aplicaron 2,457 pruebas, para un porcentaje de positiv",10-07-2020 00:06,https://www.bing.com/th?id=ON.1B2B8E7289160B0EDFA6325B4A245033,Panamá,El Siglo
"965 casos nuevos por COVID-19 en las últimas horas; van 839 muertos y 42,216 contagiados",https://www.tvn-2.com/nacionales/Suben-COVID-19-ultimas-muertos-contagiados_0_5620687972.html,"Un total de 965 casos positivos nuevos fueron confirmados en las últimas 24 horas por el Sistema de Vigilancia Epidemiológica del país. La cifra de nuevos casos positivos aumenta a 42,216 los contagia",10-07-2020 00:32,https://www.bing.com/th?id=ON.3DD7B7E26288D0A9691F517F64DE5B24,Panamá,TVN
"Hospitales en Panamá, al borde del colapso por explosivo incremento de COVID-19",https://www.telemetro.com/nacionales/2020/07/09/hospitales-en-panama-al-borde-del-colapso-por-explosivo-incremento-de-covid-19/3029174.html,"Los hospitales de Panamá están bajo amenaza de colapso por el explosivo crecimiento de casos de COVID-19, con médicos agotados por extenuantes horarios, en el país de Centroamérica con más contagios p",10-07-2020 00:53,https://www.bing.com/th?id=ON.9EE971B88D609A7786AA15C74AF529E5,Panamá,Telemetro
"Laurentino Cortizo: en la lucha contra la COVID-19, Panamá tiene que estar hasta tres pasos adelante para salvar vidas",https://www.panamaamerica.com.pa/sociedad/laurentino-cortizo-en-la-lucha-contra-la-covid-19-panama-tiene-que-estar-hasta-tres-pasos,"El presidente de la República, Laurentino Cortizo, exhortó este jueves a los miembros de la mesa interinstitucional de compras COVID-19 a ""hacer su trabajo"" de forma responsable, porque en la lucha co",10-07-2020 01:22,https://www.bing.com/th?id=ON.A955B9E7C918C64423D40A61C70C6593,Panamá,panamaamerica.com.pa
Panamá registra 839 fallecidos por COVID-19 al cumplir cuatro meses en crisis sanitaria,https://ensegundos.com.pa/2020/07/09/panama-registra-839-fallecidos-por-covid-19-al-cumplir-cuatro-meses-en-crisis-sanitaria/,"Un promedio de una persona por hora muere en Panamá por consecuencia de la enfermedad viral COVID-19, según los datos oficiales entregados por el Ministerio de Salud. En las últimas 24 horas se regist",10-07-2020 02:31,https://www.bing.com/th?id=ON.72824BB9E64E44F7DD8B394A7015A9EE,Panamá,En Segundos
Autoridades municipales buscan estrategias financieras para enfrentar pandemia de la COVID-19,https://www.tvn-2.com/nacionales/Autoridades-municipales-estrategias-financieras-COVID-19_0_5620687882.html,"Los efectos de la pandemia siguen afectando la recaudación de los municipios y según el alcalde de la ciudad de Panamá, José Luis Fábrega, antes de la pandemia de la COVID-19 se recaudaban diariamente",10-07-2020 03:27,https://www.bing.com/th?id=ON.394A0C86C3F90A2FC17B70C3D5EE8A69,Panamá,TVN
Renuncia director regional de salud de Panamá Oeste,https://noticias24pty.com/renuncia-director-regional-de-salud-de-panama-oeste/,"En medio de un incremento de los casos de COVID-19, en la provincia de Panamá Oeste y la consecuente saturación de la UCI de hospital Nicolás A. Solano, el director regional de Salud, Ismael Vergara,",10-07-2020 03:30,https://www.bing.com/th?id=ON.AAFE01B73EA383BF83B14ED3D8661589,Panamá,Noticias 24 PTY
Covid-19 arrastra la recaudación de impuestos,https://www.prensa.com/impresa/economia/covid-19-arrastra-la-recaudacion-de-impuestos/,"La inactividad de la mayor parte de la economía durante el último trimestre dejó sentir su furia en junio, mes en el que el Ministerio de Economía y Finanzas (MEF) reportó una caída de 63.9% en la rec",10-07-2020 03:47,https://www.bing.com/th?id=ON.CC23D74C812A2F2E14D59BC1AC23FBB6,Panamá,prensa.com
Mujer podría ser multada con $50 mil por salir de casa cuando esperaba resultado de prueba de Covid-19,https://www.metrolibre.com/provincias/176215-multan-una-mujer-con-50-mil-por-salir-de-casa-cuando-esperaba-el-resultado-de-la-prueba-de-covid-19.html,"Una mujer podría ser multada con 50 mil dólares por incumplir con la cuarentena cuando estaba en espera de resultados de la prueba de Covid-19, informó el director encargado de la dirección provincial",10-07-2020 04:03,https://www.bing.com/th?id=ON.5793847469FECD14A88AAE5C1BB16216,Panamá,Metro Libre
"Casos de Covid-19 en Panamá se incrementan a 42,216",https://www.metrolibre.com/nacionales/176214-casos-de-covid-19-en-panam%C3%A1-se-incrementan-42216.html,"Para este jueves, 9 de julio, en Panamá se registraron 20 nuevas defunciones, que totalizan 839 acumuladas y una letalidad del 1.98%, según el reporte epidemiológico del Ministerio de Salud (Minsa).",10-07-2020 04:03,https://www.bing.com/th?id=ON.5FF4114998C1CB72403FDC3058DC5213,Panamá,Metro Libre
Salud sexual y reproductiva en estos tiempos,https://www.prensa.com/impresa/opinion/salud-sexual-y-reproductiva-en-estos-tiempos/,"La pandemia de Covid-19 ha exacerbado algunos problemas de salud pública previamente existentes. Si bien la pandemia ha afectado más a los hombres a nivel médico, las mujeres han sido más afectadas a",10-07-2020 04:21,https://www.bing.com/th?id=ON.9BC26FC26E442192D7684576EACF6388,Panamá,prensa.com
Ministra de Educación participa en webinar con más de 500 educadores,http://prnoticiaspanama.com/ministra-de-educacion-participa-en-webinar-con-mas-de-500-educadores/,"‘Compromisos y estrategias del Meduca para enfrentar el Covid-19’ es el título del webinar en el que disertó la ministra de Educación, Maruja Gorday de Villalobos, donde respondió las interrogantes de",10-07-2020 04:31,https://www.bing.com/th?id=ON.6B0310C0E37C47851C378F4350C7221E,Panamá,PR Noticias Panama
No abrirán el Bloque 3,https://www.critica.com.pa/nacional/no-abriran-el-bloque-3-583089,"Tras 839 muertes acumuladas por coronavirus -20 de un día a otro- y una tasa diaria de contagio del 39.2%, el ministro de Salud, Luis Francisco Sucre descartó reabrir el Bloque 3 de actividades comerc",10-07-2020 05:06,https://www.bing.com/th?id=ON.29F83D856B60805412C067EAF4922E51,Panamá,Critica
"Suman 839 fallecidos por COVID-19; hay 42,216 contagios confirmados",https://www.critica.com.pa/nacional/suman-839-fallecidos-por-covid-19-hay-42216-contagios-confirmados-583072,El Sistema Epidemiológico del Ministerio de Salud reportó hoy 20 nuevas defunciones que elevan la cifra a 839 de fallecidos por COVID-19 . El informe detalla que se han reportado 965 nuevos casos posi,10-07-2020 05:06,https://www.bing.com/th?id=ON.1CBCEC6320D0CA7836F9CEA8C43EE61B,Panamá,Critica
La CorteIDH verifica las medidas de protección a migrantes en Panamá,http://elsiglo.com.pa/panama/corteidh-verifica-medidas-proteccion-migrantes-panama/24160167,"El Estado de Panamá por su parte, subrayó la importancia de las recomendaciones y medidas solicitadas por la Corte  La Corte Interamericana de Derechos Humanos (CorteIDH) realizó este jueves una audie",10-07-2020 05:10,https://www.bing.com/th?id=ON.6AE25A1E37E643B09E1156D65C0556AF,Panamá,El Siglo
Revelan casos positivos de COVID-19 en Municipio de La Chorrera,https://noticias24pty.com/revelan-casos-positivos-de-covid-19-en-municipio-de-la-chorrera/,"El Municipio de La Chorrera suspendió  temporalmente sus operaciones, para realizar trabajos de higienizado en todas las oficinas del palacio municipal Luis Emilio Veces, luego de que se confirmara el",10-07-2020 05:39,https://www.bing.com/th?id=ON.4D33B7DBEDC1C628189307DEEFAEE73B,Panamá,Noticias 24 PTY
