name,url,description,datePublished,imagen,pais,Fuente
Agregarán nuevas camas para pacientes COVID-19 en La Chorrera,https://www.radiopanama.com.pa/noticias/actualidad/agregaran-nuevas-camas-para-pacientes-covid19-en-la-chorrera/20210111/nota/4100862.aspx,"El número de nuevos casos sigue en aumento y el espacio para quienes mueren a causa de la enfermedad es mínimo, indican las autoridades",12-01-2021 00:32,https://www.bing.com/th?id=OVFT.U5aKDYpkHePXVNpXvKWW7y,Panamá,Radio Panamá
Honduras espera en febrero primeras vacunas de Pfizer contra el covid,https://ensegundos.com.pa/2021/01/11/honduras-espera-en-febrero-primeras-vacunas-de-pfizer-contra-el-covid/,La vacuna de Pfizer requiere una infraestructura compleja con temperaturas muy bajas la Universidad Nacion por lo que la Autónoma de Honduras puso a disposicióno sus laboratorios. Honduras se prepara,12-01-2021 01:00,https://www.bing.com/th?id=OVFT.uMKmFQqh3rzNKCSf3i_tPS,Panamá,En Segundos
"Guatemala, el primer país de Centroamérica en llegar a 5.000 muertes por COVID",https://www.diaadia.com.pa/mundo/guatemala-el-primer-pais-de-centroamerica-en-llegar-5000-muertes-por-covid-374358,"Guatemala se convirtió este domingo en el primer país de Centroamérica en llegar a los 5.000 fallecidos por eel covid-19, aunque según expertos la cifra es mucho mayor debido al subregistro de d",12-01-2021 01:12,https://www.bing.com/th?id=OVFT.ETPKGqt6H3XEo4yg4qOAhS,Panamá,Día a Día
"2,157 casos positivos nuevos de COVID-19 en las últimas horas en Panamá",https://noticias24pty.com/2157-casos-positivos-nuevos-de-covid-19-en-las-ultimas-horas-en-panama/,El Ministerio de Salud  informa que el presupuesto para el pago de los hoteles hospitales que se encuentran en el fondo de Reserva COVID-19 está a la espera de la aprobación por parte del,12-01-2021 01:42,https://www.bing.com/th?id=OVFT.JLM80mHfg2uaQy3Iv5e5Fy,Panamá,Noticias 24 PTY
"""Estamos contentos con los que tenemos aquí"", Thomas Christiansen",https://www.tvmax-9.com/somoslasele/contentos-Thomas-Christiansen_0_5760174035.html,La Selección de Fútbol de Panamá inició su preparación previa a los partidos amistosos del 19 y 22 de enero ante Martinica y Guadalupe. Un momento muy esperado por el técnico Thomas Christiansen,12-01-2021 02:16,https://www.bing.com/th?id=OVFT.Thc76DKu8yp-iwTMQQzm0C,Panamá,TVMAX
Coordinan llegada de la vacuna de Pfizer a Panamá,https://www.critica.com.pa/nacional/coordinan-llegada-de-la-vacuna-de-pfizer-panama-596027,"El equipo Panamá Vacunas se reunió ayer en el Centro de Operaciones Nacionales (CON) de Salud, a fin de dar seguimiento al proceso de coordinación",12-01-2021 05:16,https://www.bing.com/th?id=OVFT.u5xAq30PdVABjDXVZ343KC,Panamá,Critica
Un merengue de Rabanes pa' 'La vacuna',https://www.diaadia.com.pa/fama/un-merengue-de-rabanes-pa-la-vacuna-374365,"La agrupación panameña de rock, Rabanes, no andan jugando en la música. Les comento que están por lanzar el video de un tema titulado 'La vacuna', que habla de esa protección contra el temido COVID-19",12-01-2021 06:11,https://www.bing.com/th?id=OVFT.wzTytbfDHRHS93COYUfsBS,Panamá,Día a Día
Béisbol criollo en vilo,https://www.metrolibre.com/deportes/191258-b%C3%A9isbol-criollo-en-vilo.html,"Los campeonatos de béisbol en Panamá (en todas sus categorías) e inclusive la participación del equipo nacional para el Mundial sub-15 [del 13 al 22 de marzo próximo, en Tijuana, México] están en peli",12-01-2021 09:32,https://www.bing.com/th?id=OVFT.ikBVoHjNesKBtRm5yoDGey,Panamá,Metro Libre
Opinión: Por qué tu dieta de Año Nuevo está condenada al fracaso,https://ensegundos.com.pa/2021/01/12/opinion-por-que-tu-dieta-de-ano-nuevo-esta-condenada-al-fracaso/,Esta es una lucha que libras contra los grandes fabricantes de alimentos que te venden chatarra. Y llevas las de perder. Casi ninguno de nosotros logra cumplir los propósitos de Año Nuevo que formulam,12-01-2021 10:10,https://www.bing.com/th?id=OVFT.YLt0VH8TR-j9U4cpWvsCMS,Panamá,En Segundos
Inversión China en Panamá “es una amenaza extraordinaria para la seguridad nacional de los EE UU”,https://bayanodigital.com/inversion-china-en-panama-es-una-amenaza-extraordinaria-para-la-seguridad-nacional-de-los-ee-uu/,"Redacción de Bayano digital En una reciente publicación, en el diario “TheHill”, Daniel F. Runde experto en Análisis Global en el Centro de Estudios Estratégicos e Internacionales. revela que fuentes",12-01-2021 12:33,https://www.bing.com/th?id=OVFT.n6t0Jyxww-HKJ0UmP-qrLC,Panamá,Bayano Digital
"Funerarias de Panamá Oeste al límite, la crisis económica impide que las personas retiren los cuerpos",https://www.tvn-2.com/nacionales/Funerarias-Panama-Oeste-economica-morgues_0_5760923867.html,"Tras diez meses de pandemia las morgues en la provincia de Panamá Oeste, sobre todo en La Chorrera y Arraiján están al límite. Las familias no tienen los recursos económicos para realizar las honras f",12-01-2021 12:49,https://www.bing.com/th?id=OVFT.N3lcT-wZpTFpOQ6H7LQbDS,Panamá,TVN
Gorgas detecta mutación del COVID-19 altamente contagiosa en Panamá,https://noticias24pty.com/gorgas-detecta-mutacion-del-covid-19-altamente-contagiosa-en-panama/,"El Instituto Conmemorativo Gorgas anunció esta mañana que detectó una mutación del COVID-19 altamente contagiosa en Panamá. La mutación D614G fue detectado en un 70% de casos, detalló el",12-01-2021 13:17,https://www.bing.com/th?id=OVFT.KfZ23BJRDaDsjVpPhC8krS,Panamá,Noticias 24 PTY
Dirigente magisterial enfatiza que se debe mantener el año escolar 2021 a distancia,https://www.telemetro.com/entrevistas/2021/01/12/dirigente-magisterial-enfatiza-que-se-debe-mantener-el-ano-escolar-2021-a-distancia/3630725.html,"El dirigente magisterial, Ángel Mitre, enfatizó este martes que el Ministerio de Educación (Meduca) debería mantener la modalidad de clases a distancia, mientras que las condiciones sanitarias así lo",12-01-2021 13:57,https://www.bing.com/th?id=OVFT.6zeG75Qy2lGJjrnTj0iOXi,Panamá,Telemetro
El Minsa apela a la sensatez de la población para ganar lucha contra pandemia,https://www.midiario.com/nacionales/el-minsa-apela-a-la-sensatez-de-la-poblacion-para-ganar-lucha-contra-pandemia/,"Panamá, que acumula a la fecha 4 mil 500 muertes por la covid-19 y 281 mil 353 casos positivos, apela a la “conciencia ciudadana” para ganar la batalla al “mortal virus” y frenar los contagios, que ha",12-01-2021 13:57,https://www.bing.com/th?id=OVFT.UqL5xcUvc4HnzGwEYPeXsC,Panamá,Mi Diario
Siguen aumentando los problemas de salud mental,https://tucomunidad.com.pa/2021/01/tan-letal-como-el-nuevo-coronavirus-son-las-afectaciones-a-la-salud-mental-que-esta-provocando-la-pandemia/,"La ansiedad, la angustia, el temor, el desgaste emocional, las tristezas, los familiares que se pierden o se enferman de manera grave, así como las graves fallas en el manejo del gobierno y la corrupc",12-01-2021 14:07,https://www.bing.com/th?id=OVFT.L_9LKMtlM7ShGytjeeUf8i,Panamá,Tu Comunidad
"Panamá, con 4.500 muertes por covid-19, evalúa usar un gran coliseo como hospital",https://www.laestrella.com.pa/nacional/210112/panama-4-500-muertes-covid-19-evalua-gran-coliseo-hospital,El Minsa planea adecuar el coliseo que lleva el nombre del ex campeón mundial de boxeo Roberto Durán para reforzar la capacidad hospitalaria,12-01-2021 14:34,https://www.bing.com/th?id=OVFT.CiOZ_ZUo-YL6uFLh8yG5Qi,Panamá,laestrella.com.pa
La OMS descarta inmunidad colectiva al Covid-19 en 2021,https://www.prensa.com/mundo/la-oms-descarta-inmunidad-colectiva-al-covid-19-en-2021/,"Las campañas masivas de vacunación, que hacen frente a un galopante avance de la Covid-19, no serán suficientes para garantizar la inmunidad colectiva o de rebaño en 2021, advirtió el lunes la Organiz",12-01-2021 14:40,https://www.bing.com/th?id=OVFT.JH_2PNosiR03Jj8ZN3l_DC,Panamá,prensa.com
Recomendaciones para conductores de transporte selectivo para evitar covid-19,https://www.metrolibre.com/nacionales/191298-recomendaciones-para-conductores-de-transporte-selectivo-para-evitar-covid-19.html,"Los conductores de transporte selectivo o taxis debido a su oficio deben trasladar pasajeros y manipular dinero, por lo que pudieran ser objeto de contagio de esta enfermedad, si no toman las debidas",12-01-2021 14:54,https://www.bing.com/th?id=OVFT.2pFNmdIDhHCnUQOwXEIXbC,Panamá,Metro Libre
Comienza instalación de bases para hospital campaña en policlínica de Santiago de Veraguas,https://www.tvn-2.com/nacionales/Instalaran-hospital-policlinica-Santiago-Veraguas_0_5760923883.html,"La Caja de Seguro Social (CSS) inició la instalación de las bases para un hospital campaña en las inmediaciones de la Policlínica Dr. Horacio Díaz Gómez, en la ciudad de Santiago de Veraguas.",12-01-2021 14:56,https://www.bing.com/th?id=OVFT.s7Fexxb2uce5sV_tc8e0hy,Panamá,TVN
Evalúan posibilidad de alquilar contenedores para apoyar a las morgues de los hospitales,https://www.telemetro.com/nacionales/2021/01/12/evaluan-posibilidad-alquilar-contenedores-apoyar/3631164.html,"La directora nacional de Provisión del Ministerio de Salud (Minsa), Yelkis Gill Mojica, dio a conocer este martes que frente al incremento en la cantidad de cadáveres en las morgues de algunos hospita",12-01-2021 15:07,https://www.bing.com/th?id=OVFT.qzWY7RxgCaSKDcKYq3T0Fi,Panamá,Telemetro
Más de un centenar de pacientes con insuficiencia renal han muerto a causa del COVID-19,https://www.radiopanama.com.pa/noticias/actualidad/mas-de-un-centenar-de-pacientes-con-insuficiencia-renal-han-muerto-a-causa-del-covid19/20210112/nota/4100963.aspx,"De acuerdo a datos que maneja la Asociación Nacional de Pacientes con Insuficiencia Renal Crónica, 150 personas con la enfermedad han perdido la vida como consecuencia del COVID-19. Hasta el momento,",12-01-2021 15:12,https://www.bing.com/th?id=OVFT.U5aKDYpkHePXVNpXvKWW7y,Panamá,Radio Panamá
"Casi 91 millones infectados de coronavirus en el mundo, según Universidad Hopkins",https://www.panamaamerica.com.pa/mundo/casi-91-millones-infectados-coronavirus-en-mundo-segun-universidad-hopkins-1179398,"El número de casos de covid-19 en el mundo se aproxima a los 91 millones, mientras que el de fallecidos se acerca a los 2 millones, según el recuento de la Universidad John Hopkins.En el cómputo que a",12-01-2021 15:19,https://www.bing.com/th?id=OVFT.1TudeLbOzDNHabPjlQKQeC,Panamá,panamaamerica.com.pa
Movimiento #TodoPanamá lanza nuevo asistente virtual para consultas sobre Covid-19,https://www.prensa.com/sociedad/movimiento-todopanama-lanza-nuevo-asistente-virtual-para-consultas-sobre-covid-19/,"El movimiento #TodoPanamá lanzó un nuevo asistente virtual en sus plataformas de comunicación, con el fin de brindarle a la población información accesible y oportuna sobre las medidas de prevención y",12-01-2021 15:30,https://www.bing.com/th?id=OVFT.SjdiTSntUPw2XCwpw5nZfy,Panamá,prensa.com
Intensifican acciones para contener el virus en Arraiján,https://www.critica.com.pa/nacional/intensifican-acciones-para-contener-el-virus-en-arraijan-596057,"Roniel Rodríguez, alcalde de Arraiján, dijo que hoy, martes, instalan un centro de hisopado exprés, ubicado en Tower Center, a fin de detectar casos positivos, contactos y prestar el servicio de ayuda",12-01-2021 15:59,https://www.bing.com/th?id=OVFT.VQ9ZqPkFiChKl6LYMbwpTi,Panamá,Critica
Reapertura económica se anunciará este martes: Mici,https://www.laestrella.com.pa/nacional/210112/reapertura-economica-anunciara-martes-mici,"El ministro de Comercio e Industrias de Panamá, Ramón Martínez, dijo que “hemos visto una mejoría al haber hecho esta pausa""",12-01-2021 16:11,https://www.bing.com/th?id=OVFT.Z4XrjayRTZqHL9KHFfsqUi,Panamá,laestrella.com.pa
Panamá con más de 200 pacientes en UCI por la covid-19 desde el 31 de diciembre,https://www.panamaamerica.com.pa/sociedad/panama-con-mas-200-pacientes-en-uci-por-covid-19-desde-31-diciembre-1179402,"El explosivo repunte de casos de covid-19 en Panamá ha quedado reflejado no solo en el número de contagios diarios, sino en la cantidad de pacientes que han necesitado hospitalización, especialmente e",12-01-2021 16:13,https://www.bing.com/th?id=OVFT.-I3guT7looZw2ZnYKKa61S,Panamá,panamaamerica.com.pa
China confina a 22 millones de personas en la provincia de Hebei,https://www.nexpanama.com/china-confina-a-22-millones-de-personas-en-la-provincia-de-hebei/,"La ciudad china de Langfang entró en cuarentena, y se convierte en la tercera bloqueada por el foco de Covid-19 en la provincia de Hebei, tras la capital, Shijiazhuang, y Xingtai. Quedan bloqueados as",12-01-2021 16:38,https://www.bing.com/th?id=OVFT.RQYPOQC8JJnBMq-UfQoOWC,Panamá,NEX TV
Atentos. Este martes el Gobierno dará a conocer cómo será la reapertura económica gradual en Panamá,https://www.midiario.com/nacionales/atentos-este-martes-el-gobierno-dara-a-conocer-como-sera-la-reapertura-economica-gradual-en-panama/,"Las cifras de coronavirus en todo el mundo siguen en aumento y esta vez con una nueva cepa que, según los expertos es más",12-01-2021 16:37,https://www.bing.com/th?id=OVFT.Sqmd3kXGXcrTNOhU__3D-C,Panamá,Mi Diario
Gobierno hará importantes anuncios sobre la pandemia de COVID-19 en Panamá,https://elcapitalfinanciero.com/gobierno-hara-importantes-anuncios-sobre-la-pandemia-de-covid-19-en-panama/,La Presidencia de la República dio a conocer que las autoridades del Gobierno Nacional realizarán este martes dos importantes anuncios relacionados con la situación de la pandemia de coronavirus (COVI,12-01-2021 16:55,https://www.bing.com/th?id=OVFT.ubag48jiq6k1MFpYyT0OeS,Panamá,El Capital Financiero
"Reducción de la velocidad de contagio de COVID-19 permitiría una apertura gradual, asegura ministro Martínez",https://elcapitalfinanciero.com/reduccion-de-la-velocidad-de-contagio-de-covid-19-permitiria-una-apertura-gradual-asegura-ministro-martinez/,"Con la cuarentena total establecida hasta el 14 de enero en las regiones de Panamá y Panamá Oeste, se ha logrado observar una disminución en cuanto a la propagación de los casos de coronavirus (COVID.",12-01-2021 17:01,https://www.bing.com/th?id=OVFT.LascIqy7Xi9qsZEzxLqbNS,Panamá,El Capital Financiero
