name,url,description,datePublished,imagen,pais,Fuente
Universitarios se unen a los afectados por la pandemia,https://www.prensa.com/impresa/economia/universitarios-se-unen-a-los-afectados-por-la-pandemia/,"Los universitarios también experimentan las debilidades de una educación a distancia, impuesta por el coronavirus (Covid-19) de un día para otro. Estudiantes de cuatro universidades particulares del p",19-06-2020 07:12,https://www.bing.com/th?id=ON.B58E1F0A14E83F0420B38E07F4CBE59F,Panamá,prensa.com
Asociación de Restaurantes pide cumplimiento de disposiciones legales por COVID-19,https://www.telemetro.com/nacionales/2020/06/19/asociacion-de-restaurantes-pide-cumplimiento-de-disposiciones-legales-por-covid-19/2968673.html,La Asociación de Restaurantes y Afines de Panamá exigió igualdad de condiciones en el cumplimiento de regulaciones o disposiciones legales establecidas por el Ministerio de Salud durante la pandemia d,19-06-2020 19:16,https://www.bing.com/th?id=ON.6C6434F13EC5E4414D347DDA5C091D68,Panamá,Telemetro
Instituto Gorgas adquiere pruebas rápidas de detección del COVID-19,https://elcapitalfinanciero.com/instituto-gorgas-adquiere-pruebas-rapidas-de-deteccion-del-covid-19/,"El Instituto Conmemorativo Gorgas de Estudios de la Salud (Icges) adquirió recientemente 15 mil pruebas rápidas para la detección de proteínas del COVID-19, pruebas que son practicadas por un hisopado",19-06-2020 19:42,https://www.bing.com/th?id=ON.EB43C64B9C19D7A551FF3F29F69506DA,Panamá,El Capital Financiero
Contracción del comercio y recesión mundial impactan a Canal de Panamá,https://bayanodigital.com/contraccion-del-comercio-y-recesion-mundial-impactan-a-canal-de-panama/,"Un buque transita de un océano a otro a través del tercer juego de esclusas del Canal de Panamá. (Foto: Osvaldo Rodríguez/PL).. Por Osvaldo Rodríguez Panamá, jun (Prensa Latina) – El Canal de Panamá e",19-06-2020 19:50,https://www.bing.com/th?id=ON.AB870A3A0D6919104E583C9BBA48BAA1,Panamá,Bayano Digital
Panamá Este en busca de casos activos de Covid-19,https://ensegundos.com.pa/2020/06/19/panama-este-en-busca-de-casos-activos-de-covid-19/,"Se han visitado las comunidades del corregimiento de Tortí, desde La Ocho, Cañazas, Igarwuala, Palmas Bellas, Además Wuagandi- Quebrada Cali, Comarca Madugandi. La región de Salud de Panamá Este, en c",19-06-2020 20:03,https://www.bing.com/th?id=ON.01AD67B50D096C9CCDA1DE38E51B7F36,Panamá,En Segundos
Hoteles Decameron presenta su plan integral de bioseguridad,https://www.radiopanama.com.pa/noticias/espectaculos/hoteles-decameron-presenta-su-plan-integral-de-bioseguridad/20200619/nota/4048252.aspx,"Para Hoteles Decameron siempre ha sido prioridad proteger la salud, la seguridad y el bienestar de todos sus huéspedes, afiliados y equipos de trabajo. Ante las actuales circunstancias, la compañía ha",19-06-2020 20:16,https://www.bing.com/th?id=ON.7D78B3FEAE78D8AC05601605E2D2BC64,Panamá,Radio Panamá
Saturadas las salas de hospitalización para COVID-19 en el Hospital Nicolás A. Solano,https://www.panamaamerica.com.pa/provincias/saturadas-las-salas-de-hospitalizacion-para-covid-19-en-el-hospital-nicolas-solano,"Las cuatro salas de hospitalización para pacientes positivos de coronavirus en el hospital regional Nicolás Alejo Solano en la provincia de Panamá Oeste, con capacidad para 64 personas, se encuentran",19-06-2020 20:18,https://www.bing.com/th?id=ON.6359397D27163A072ADCA8B00B321782,Panamá,panamaamerica.com.pa
Covid-19: 'Son tiempos de sonreír con los ojos',http://elsiglo.com.pa/panama/covid-19-tiempos-sonreir-ojos/24158739,"La aparición del COVID-19, en el mundo, sin duda cambió las etiquetas y costumbres sociales. Saludo de manos, besos y acompañado de una sonrisa, son cosa del pasado. Ahora, las demostraciones de afect",19-06-2020 20:39,https://www.bing.com/th?id=ON.8702E9F24BEEEEF744E5BFF846222C22,Panamá,El Siglo
Atlético Chiriquí señala sus razones detrás de la crisis que vive el club,https://www.tvmax-9.com/somoslasele/Atletico-Chirqui-senala-razones-detras_0_5605689449.html,"La junta directiva del Atlético Chiriquí, con motivo del aniversario 18 de club, rompió el silenció y habló sobre la crisis institucional que viven por el Covid-19, y que los ha llevado a no cumplir c",19-06-2020 21:29,https://www.bing.com/th?id=ON.031326EE889E6D141FC69F1A67E4704B,Panamá,TVMAX
Salas con pacientes con COVID-19 están llenas en el hospital Nicolás Solano,https://noticias24pty.com/salas-con-pacientes-con-covid-19-estan-llenas-en-el-hospital-nicolas-solano/,"Las cuatro salas de hospitalización para pacientes positivos de coronavirus, en el hospital regional Nicolás Alejo Solano en la provincia de Panamá Oeste, con capacidad para 64 personas, se encuentran",19-06-2020 22:35,https://www.bing.com/th?id=ON.2CC6409C2F6427054277C37ED0B57200,Panamá,Noticias 24 PTY
Productores panameños reciben $500 mil en préstamos,https://elcapitalfinanciero.com/productores-panamenos-reciben-500-mil-en-prestamos/,"$500,000 en concepto de préstamos a 0% de interés recibieron el miércoles, 17 de junio, 30 productores de Penonomé, Coclé, para que fortalezcan la siembra de arroz ante la emergencia sanitaria ocasion",19-06-2020 22:41,https://www.bing.com/th?id=ON.E86B0BC994F5A6CB65A6E3CC9195B6AA,Panamá,El Capital Financiero
Protesta en Panamá por reunión de diputados oficialistas pese a cuarentena,https://www.metrolibre.com/nacionales/174426-protesta-en-panam%C3%A1-por-reuni%C3%B3n-de-diputados-oficialistas-pese-cuarentena.html,"Unas 200 personas protestaron este jueves en Panamá frente a un restaurante donde se reunieron diputados oficialistas, pese a las medidas de cuarentena que rigen en el país con más muertos y contagios",19-06-2020 22:59,https://www.bing.com/th?id=ON.0DAA176E08B5684CC99DF2B9E4969ABD,Panamá,Metro Libre
Distribuyen carne de cerdo a familias en Bocas del Toro,https://www.metrolibre.com/provincias/174442-distribuyen-carne-de-cerdo-familias-en-bocas-del-toro.html,"Alrededor de 810 cajas de carne de cerdo del Plan Panamá Solidario fueron distribuidas entre las familias más vulnerables de la provincia de Bocas del Toro afectadas por la pandemia del Covid-19, info",19-06-2020 23:22,https://www.bing.com/th?id=ON.77E853F47AD2309D7F635E5C85C61582,Panamá,Metro Libre
923 casos,https://www.critica.com.pa/nacional/923-casos-581648,"En las últimas 24 horas se detectaron en Panamá, 923 nuevos casos de la COVID-19, que elevaron hasta 24.270 los contagios confirmados en 103 días de pandemia, y se registraron 10 fallecimientos, para",19-06-2020 23:30,https://www.bing.com/th?id=ON.370046A7599B4F9EA6BC3AE851E247EE,Panamá,Critica
"Salas de UCI de Panamá entran en fase crítica; pandemia por COVID-19 suma 485 muertos y 24,274 contagiados",https://www.tvn-2.com/nacionales/Salas-UCI-Panama-COVID-19-contagiados_0_5605689471.html,"El Sistema de Vigilancia Epidemiológica de Panamá registró 923 casos nuevos casos de COVID-19 detectados en las últimas 24 horas, para un total de 24,274. Hasta este viernes, 19 de junio, se corrobora",19-06-2020 23:32,https://www.bing.com/th?id=ON.545F05516FEA69554274F302C81ED61A,Panamá,TVN
COVID: 923 casos nuevos y 485 fallecidos,https://www.critica.com.pa/nacional/covid-923-casos-nuevos-y-485-fallecidos-581648,"En las últimas 24 horas se detectaron en Panamá, 923 nuevos casos de la COVID-19, que elevaron hasta 24.270 los contagios confirmados en 103 días de pandemia, y se registraron 10 fallecimientos, para",19-06-2020 23:48,https://www.bing.com/th?id=ON.370046A7599B4F9EA6BC3AE851E247EE,Panamá,Critica
Panamá alcanza nuevo récord de contagiados con 923,http://www.nexpanama.com/panama-alcanza-nuevo-record-de-contagiados-con-923/,"Panamá rebasó este viernes los 24.000 casos de la COVID-19 y llegó a 485 muertos por la enfermedad, según datos reportados por el Ministerio de Salud de las últimas 24 horas. Se detectaron 923 nuevos",19-06-2020 23:51,https://www.bing.com/th?id=ON.8E0AC80C9BF8E4F40A59217055A899BF,Panamá,NEX TV
Reunión entre diputados oficialistas dentro de restaurante en medio de restricciones es duramente cuestionada,https://www.radiopanama.com.pa/noticias/actualidad/reunion-entre-diputados-oficialistas-dentro-de-restaurante-en-medio-de-restricciones-es-duramente-cuestionada/20200619/nota/4048316.aspx,"y también fue duramente cuestionado por integrantes del Comité Asesor del Minsa, para la lucha contra el COVID-19.",19-06-2020 23:57,https://www.bing.com/th?id=ON.7D78B3FEAE78D8AC05601605E2D2BC64,Panamá,Radio Panamá
Panamá registra 923 de contagios en las últimas 24 horas,http://elsiglo.com.pa/panama/panama-registra-923-contagios-enlas-ultimas-24-horas/24158766,"Panamá sumó 923 casos de covid-19 en las últimas 24 horas, para un total de 24,274. El Ministerio de Salud detalló que 9,430 son casos activos y se registran 10 nuevas defunciones, que ascienden a 485",20-06-2020 00:03,https://www.bing.com/th?id=ON.6E00BAFCBB0AF61C13ED42C47E0A06FE,Panamá,El Siglo
Minsa reporta casi mil nuevos casos y asegura que hay pocas camas en UCI,https://www.diaadia.com.pa/el-pais/minsa-reporta-casi-mil-nuevos-casos-y-asegura-que-hay-pocas-camas-en-uci-367498,"La ministra de Salud Rosario Turner señaló que ""el deber de la entidad lo están reafirmando velando por la Salud del país"". ""Ayer instruí a Israel Cedeño, jefe de la Región Metropolitana para iniciar",20-06-2020 00:14,https://www.bing.com/th?id=ON.DD5576CBE5EB203E326B132C5A5DC85A,Panamá,Día a Día
Investigan causas de muerte de hombre en la terminal de David,http://www.nexpanama.com/investigan-causas-de-muerte-de-hombre-en-la-terminal-de-david/,"Un hombre cayó muerto al frente de la terminal de transporte de David, en Chiriquí, lo que ha generado temor por sospechar que pudiera ser un contagiado de COVID-19.",20-06-2020 00:14,https://www.bing.com/th?id=ON.385B9C61E9B8CC53951807648B3D2F52,Panamá,NEX TV
Panamá supera por primera vez los 900 casos nuevos de COVID-19 en un día,https://www.panamaamerica.com.pa/sociedad/panama-supera-por-primera-vez-los-900-casos-nuevos-de-covid-19-en-un-dia-1166049,"El Ministerio de Salud anunció esta tarde que 923 nuevas personas se han contagiado de COVID-19 en Panamá, lo que representa una cifra récord para una jornada. Versión impresa Los 923 casos nuevos de",20-06-2020 00:37,https://www.bing.com/th?id=ON.32314E6D0026A310AEBDF3DD349FB095,Panamá,panamaamerica.com.pa
Colombia sobrepasa los 2 mil muertos por Covid-19,https://www.prensa.com/mundo/colombia-sobrepasa-los-2-mil-muertos-por-covid-19/,"Colombia sobrepasó este viernes 19 de junio los 2 mil muertos por el nuevo coronavirus, con un récord de casi 100 decesos en las últimas 24 horas, en medio de las cada vez más relajadas medidas de con",20-06-2020 01:29,https://www.bing.com/th?id=ON.043BC7B58903FE73B3D67CF170814043,Panamá,prensa.com
"Indigentes contagiados con COVID-19, una cifra que desconocen las autoridades",https://www.tvn-2.com/nacionales/Indigentes-contagiados-COVID-19-la-sombra-autoridades-panamenas_0_5605689474.html,"Los indigentes, se han convertido en un desafío para las autoridades en medio de la pandemia que se vive en el país. Intentamos conocer con el Ministerio de Salud y la Alcaldía de Panamá las estadísti",20-06-2020 01:31,https://www.bing.com/th?id=ON.8F6FB4EFCE168191F9F4665E354E0405,Panamá,TVN
Costa Rica rolls back reopening moves,https://www.newsroompanama.com/news/costa-rica-rolls-back-reopening-moves,The Government of Costa Rica has suspended phase 3 of its reopening plan scheduled to start on Saturday and has tightened restrictions on the movement of vehicl,20-06-2020 01:41,https://www.bing.com/th?id=ON.8D89E54AD001C956D02578F464ED5470,Panamá,Newsroom Panama
Uproar as lawmakers flout rules and dine in restaurant,https://www.newsroompanama.com/news/uproar-as-lawmakers-flout-rules-and-dine-in-restaurant-1,"The Ministry of Health has opened an investigation following the outrage expressed by Panama’s hard-hit Restaurant, Bar and Club Owners Association afte",20-06-2020 01:41,https://www.bing.com/th?id=ON.2E45FC87E9EAAC27FBC56EDBBC5B5563,Panamá,Newsroom Panama
En Los Santos pronto podrían ser habilitadas actividades del Bloque 3,https://ensegundos.com.pa/2020/06/19/en-los-santos-pronto-podrian-ser-habilitadas-actividades-del-bloque-3/,"Actualmente, esta provincia esta libre de Covid-19. Las personas contagiadas ya se han recuperado. La ministra de Salud, Rosario Turner se refirió a la flexibilización en un futuro de algunas activida",20-06-2020 01:59,https://www.bing.com/th?id=ON.29D488DA86EE2642364D43648A678DD3,Panamá,En Segundos
