name,url,description,datePublished,imagen,pais,Fuente
"Covid-19 Panamá: casos, 351,213; fallecidos, 6,052; recuperados, 339,961; pruebas realizadas, 2,076,630",https://noticias24pty.com/covid-19-panama-casos-351213-fallecidos-6052-recuperados-339961-pruebas-realizadas-2076630/,El 9 de marzo el Ministerio de Salud reportó el primer caso confirmado de coronavirus Covid-19 en Panamá. A partir de la fecha el ministerio ha reportado diariamente a través de conferencias de,24-03-2021 01:37,https://www.bing.com/th?id=OVFT.gqtqX4yF7F1b9Gsn_5LNZy,Panamá,Noticias 24 PTY
"Panamá es el segundo país del mundo con mejor porcentaje de recuperados de covid-19, según el Minsa",https://www.panamaamerica.com.pa/sociedad/panama-es-segundo-pais-del-mundo-con-mejor-porcentaje-recuperados-covid-19-segun-minsa,"Adultos mayores /COVID-19 /Panamá /Pandemia /Vacunas ""Somos el segundo país del mundo con el mejor porcentaje de recuperados, ya se ha vuelto común observar las imágenes de cientos de adultos mayores de 60 años regocijados y llenos de esperanza de ser ...",24-03-2021 04:09,https://www.bing.com/th?id=OVFT.PsQGX2DSWhynht_Gc4KywS,Panamá,panamaamerica.com.pa
Llega a Panamá el séptimo lote de vacunas Pifzer contra el COVID-19,https://www.tvn-2.com/nacionales/Llega-Panama-septimo-Pifzer-COVID-19_0_5813418708.html,"Continuando con la programación semanal, este miércoles 23 de marzo llegaron a Panamá las 70,200 dosis de vacunas contra la COVID-19, correspondientes al séptimo lote que entrega la casa farmacéutica",24-03-2021 04:38,https://www.bing.com/th?id=OVFT.qghvPNv_QXcUSBz8hw_CZS,Panamá,TVN
"Llegan 70,200 dosis de vacuna de Pfizer, el séptimo lote (Video)",https://www.critica.com.pa/nacional/llegan-70200-dosis-de-vacuna-de-pfizer-el-septimo-lote-video-600830,"E séptimo embarque con 70.200 vacunas contra la covid-19 de la farmacéutica Pfizer llegó a las 11:25 de la noche a Panamá, en un vuelo del DHL y procedente de Miami.Con esta nueva remesa Panamá habrá",24-03-2021 06:02,https://www.bing.com/th?id=OVFT.4arPXA7i0oKIevjra-W0Gy,Panamá,Critica
Autoridades reciben el séptimo lote de vacunas Pfizer para la Covid-19,https://www.radiopanama.com.pa/noticias/actualidad/autoridades-reciben-el-septimo-lote-de-vacunas-pfizer-para-la-covid19/20210324/nota/4119898.aspx,"Hasta la fecha, Panamá ha recibido 421 mil 60 dosis de la vacuna. Cerca del 75% ya han sido aplicadas a los grupos prioritarios.",24-03-2021 09:15,https://www.bing.com/th?id=OVFT.U5aKDYpkHePXVNpXvKWW7y,Panamá,Radio Panamá
Llegan a Panamá 70 mil 200 nuevas vacunas contra Coivd-19,https://ensegundos.com.pa/2021/03/24/llegan-a-panama-70-mil-200-nuevas-vacunas-contra-coivd-19/,"Según cifra del Programa Ampliado de Inmunización, a fecha se han aplicado 312,761 vacunas en todo el país. Llegaron a Panamá 70,200 dosis de la vacuna contra el Covid-19. Se trata del séptimo lote de",24-03-2021 11:22,https://www.bing.com/th?id=OVFT.M50bdR39_bBBHBpgHoxvoi,Panamá,En Segundos
Panamá recibió el séptimo lote de vacunas de Pfizer contra el Covid-19,https://www.metrolibre.com/nacionales/197297-panam%C3%A1-recibi%C3%B3-el-s%C3%A9ptimo-lote-de-vacunas-de-pfizer-contra-el-covid-19.html,"El séptimo lote de vacunas de Pfizer contra el Covid-19, con 70,200 dosis, llegó a Panamá para continuar con la estrategia de vacunación. Hasta la fecha se han aplicado 312,761 vacunas en todo el país",24-03-2021 11:48,https://www.bing.com/th?id=OVFT.4V1sxcUSc8u3eP9fwseKpS,Panamá,Metro Libre
Llega a Panamá séptimo lote de la vacuna de Pfizer contra covid-19,https://www.telemetro.com/nacionales/2021/03/24/llega-a-panama-septimo-lote-de-la-vacuna-de-pfizer-contra-covid-19/3875613.html,"El séptimo lote de 70,200 dosis de la vacuna contra covid-19 de Pfizer y BioNTech, llegó a Panamá este martes.",24-03-2021 12:48,https://www.bing.com/th?id=OVFT.lTM8obqA5OVn5sewjA5j9C,Panamá,Telemetro
Panamá sin actividades masivas en Semana Santa para prevenir más contagios,https://www.laestrella.com.pa/nacional/210324/panama-actividades-masivas-semana-santa-prevenir-contagios,"El ministro de Salud, Luis Francisco Sucre, dijo que se reunió con líderes religiosos para acordar no celebrar actividades que pueden generar aglomeraciones",24-03-2021 13:16,https://www.bing.com/th?id=OVFT._7YjUuEGZZNVtJuuZhrwwy,Panamá,laestrella.com.pa
Padres piden un retorno 'voluntario y gradual' a las escuelas en Panamá,https://www.laestrella.com.pa/nacional/210324/padres-piden-retorno-voluntario-gradual-escuelas-panama,"Los manifestantes expresaron que muchos estudiantes están en situaciones precarias en sus residencias, sin internet y sin las condiciones necesarias para estudiar",24-03-2021 13:30,https://www.bing.com/th?id=OVFT.RCikMRTVoXj-Y8d1TvvR9C,Panamá,laestrella.com.pa
"Séptimo lote de vacunas con 70,200 dosis llega a Panamá",https://sertv.gob.pa/nacionalfm/septimo-lote-de-vacunas-con-70200-dosis-llega-a-panama/,"A la fecha la farmacéutica Pfizer ha entregado al país un total de 421,060 dosis de vacunas. El séptimo lote de vacunas de la farmacéutica Pfizer con un total de 70,200 dosis para combatir el COVID-19",24-03-2021 14:14,https://www.bing.com/th?id=OVFT.dXzgI0gMDc9c8UgjJUNGXi,Panamá,SERTV
Panamá completa recepción de 421 mil dosis de vacuna de Pfizer,https://anpanama.com/10872-Panama-completa-recepcion-de-421-mil-dosis-de-vacuna-de-Pfizer.note.aspx,"(Ciudad de Panamá-ANPanamá) Un total de 421,060 dosis de la vacuna de Pfzer contra el COVID-19 han llegado a Panamá, tras la última entrega hecha de 70,200 dosis, mientras continúan mejorando los indi",24-03-2021 14:17,https://www.bing.com/th?id=OVFT.RsMLIQ3jOJ0jg68VRPGJoy,Panamá,AN Panama
Panamá extiende régimen arancelario a productos de higiene y protección personal,https://anpanama.com/10873-Panama-extiende-regimen-arancelario-a-productos-de-higiene-y-proteccion-personal-.note.aspx,"La medida, que representa un sacrificio fiscal de 12 millones de dólares, busca mantener asegurado para la población nacional el acceso a productos de higiene y protección personal a precios competiti",24-03-2021 14:21,https://www.bing.com/th?id=OVFT.jlIjubC3YWQEdgRMp5rLTy,Panamá,AN Panama
OPS advierte que el virus está aumentando peligrosamente en la región,https://www.prensa.com/sociedad/ops-advierte-que-el-virus-esta-aumentando-peligrosamente-en-la-region/,"Los nuevos rebrotes de casos de la Covid-19 que se registran en varios países del continente americano, reflejan un aumento peligroso del virus advirtió la Organización Panamericana de la Salud (OPS).",24-03-2021 14:30,https://www.bing.com/th?id=OVFT.hl9k7UE6XwPVXpZ9XK2hfy,Panamá,prensa.com
Las Políticas Públicas del Gobierno claves para la disciplina fiscal,https://sertv.gob.pa/nacionalfm/las-politicas-publicas-del-gobierno-claves-para-la-disciplina-fiscal/,"Destacó, que es fundamental encaminar al país en la senda de la disciplina fiscal, pese a un financiamiento cuestionado, que solo buscó sostener la economía y evitar una pérdida de la capacidad produc",24-03-2021 15:08,https://www.bing.com/th?id=OVFT.VgnmtXN2_YgySRIpZrb2NS,Panamá,SERTV
Recomiendan ampliar el portafolio de vacunas contra la COVID-19 para acelerar el proceso de inmunización,https://www.tvn-2.com/nacionales/Recomiendan-portafolio-COVID-19-acelerar-vacunacion_0_5814168552.html,"Los últimos datos epidemiológicos, pese a que se han mantenido durante varias semanas, empiezan a tener un leve ascenso lo que enciende las alarmas entre los expertos de una posible tercera ola de con",24-03-2021 15:20,https://www.bing.com/th?id=OVFT.rNE3VwpMRKIh75vblmwM_C,Panamá,TVN
Continúan labores de adecuaciones en escuelas para proceso de vacunación,https://www.radiopanama.com.pa/noticias/actualidad/continuan-labores-de-adecuaciones-en-escuelas-para-proceso-de-vacunacion/20210324/nota/4120012.aspx,"De acuerdo a un informe emitido por la Dirección, son 67 planteles escolares que se mejoran para las fases de vacunación, 40 han sido terminadas, cinco se encuentran en construcción y en 22 iniciarán",24-03-2021 15:42,https://www.bing.com/th?id=OVFT.U5aKDYpkHePXVNpXvKWW7y,Panamá,Radio Panamá
Dos jugadores dan positivo por Covid-19 en la concentración panameña,https://www.tvmax-9.com/somoslasele/Seleccion-Nacional-primer-positivos-Covid-19_0_5814168547.html,La Selección Nacional de Panamá sufrió su primer revés en la eliminatoria de CONCACAF camino a Catar 2022 al darse a conocer dos positivos por Covid-19 en la concentración que se lleva a cabo en Repúb,24-03-2021 15:43,https://www.bing.com/th?id=OVFT.t19So5c8aiX9uuFSp01HQC,Panamá,TVMAX
‘Manotas’ y ‘Negrito’ arrojan positivo en covid-19 en la concentración de la Roja en República Dominicana,https://www.midiario.com/deportivas/manotas-y-negrito-arrojan-positivo-en-covid-19-en-la-concentracion-de-la-roja-en-republica-dominicana/,Malas noticias para la delegación panameña que se encuentra en República Dominicana para los dos primeros partidos de la Eliminatoria rumbo al Mundial de Catar,24-03-2021 15:52,https://www.bing.com/th?id=OVFT.d4ADxJK-Ww-rjOMbuP7ZEi,Panamá,Mi Diario
Distribuyen en Azuero 2 mil 808 dosis contra la Covid-19,https://www.prensa.com/provincias/distribuyen-en-azuero-2-mil-808-dosis-contra-la-covid-19/,"GUARARÉ, Los Santos. Un total de 2 mil 808 dosis de la vacuna contra la Covid-19 llegaron este miércoles por la mañana, vía aérea a la región de Azuero, tras el arribo al país de un nuevo",24-03-2021 16:06,https://www.bing.com/th?id=OVFT.gyjHGl45G02Qjignr-Aq9y,Panamá,prensa.com
Develan monumento en honor a profesionales de la salud fallecidos en la lucha contra la COVID-19,https://www.telemetro.com/nacionales/2021/03/24/develan-monumento-honor-heroes-sistema/3876570.html,"El miércoles 24 de marzo, se develó un monumento en honor de los héroes del sistema de salud fallecidos en la lucha contra la COVID-19 en Panamá.",24-03-2021 16:13,https://www.bing.com/th?id=OVFT.9Mfu24P2_kjZR-Ikk9i0nC,Panamá,Telemetro
Luis Mejía y Alberto Quintero dan positivo previo a las Eliminatorias,http://www.nexpanama.com/luis-mejia-y-alberto-quintero-dan-positivo-previo-a-las-eliminatorias/,"La Federación Panameña de Fútbol informó que luego de las pruebas de COVID-19 que toda la delegación de #PanamáMayor se realizó este martes como parte del protocolo de bioseguridad previo a cada partido de eliminatorias de Concacaf, se encontraron ...",24-03-2021 16:27,https://www.bing.com/th?id=OVFT.S1_0Dxg_Q7lG2MuNhQn8XS,Panamá,NEX TV
Mejía y Quintero asintomáticos positivos por Covid-19 en la convocatoria de Panamá,https://www.metrolibre.com/deportes/197324-mej%C3%ADa-y-quintero-asintom%C3%A1ticos-positivos-por-covid-19-en-la-convocatoria-de-panam%C3%A1.html,"La Federación Panameña de Fútbol informó que luego de las pruebas de COVID-19, como parte del protocolo de bioseguridad previo a cada partido de eliminatorias de Concacaf, se encontraron dos casos que",24-03-2021 16:30,https://www.bing.com/th?id=OVFT.mZazeH7AwTneomyoC9vLfC,Panamá,Metro Libre
"OPS alerta sobre ""terrible"" alza de covid-19 en Brasil e impacto en sus vecinos",https://ensegundos.com.pa/2021/03/24/ops-alerta-sobre-terrible-alza-de-covid-19-en-brasil-e-impacto-en-sus-vecinos/,"La Organización Panamericana de la Salud (OPS) alertó el martes sobre el “terrible” aumento de casos de covid-19 en Brasil, que también golpea a sus vecinos Venezuela, Bolivia y Perú, y destacó el alza de los contagios en Chile, Paraguay y Uruguay.",24-03-2021 16:38,https://www.bing.com/th?id=OVFT.AAH-F3CDdEWyzj5WkcTYTS,Panamá,En Segundos
Europa estudia controles más estrictos de exportación de vacunas,http://www.nexpanama.com/europa-estudia-controles-mas-estrictos-de-exportacion-de-vacunas/,La Unión Europea está ajustando los controles sobre la exportación para garantizar que el bloque cuente con mayor cantidad de vacunas contra el COVID-19 y así impulsar la campaña de inmunización cuand,24-03-2021 16:39,https://www.bing.com/th?id=OVFT.QAwJofGCi1_4V5ye1kiDRC,Panamá,NEX TV
Luis 'Manota' Mejía y Alberto 'Negrito' Quintero dieron positivo al coronavirus,https://www.panamaamerica.com.pa/deportes/luis-manota-mejia-alberto-negrito-quintero-dieron-positivo-al-coronavirus-1183911,"Los jugadores de la selección panameña Luis ""Manota"" Mejía y Alberto ""Negrito"" Quintero dieron positivo a la Covid-19, según reveló la Federación Panameña de Fútbol (Fepafut) en un comunicado.Panamá s",24-03-2021 16:53,https://www.bing.com/th?id=OVFT.zhL7YdEwGAw3BLzJAN2tPC,Panamá,panamaamerica.com.pa
