name,url,description,datePublished,imagen,pais,Fuente
"Panamá establece cuarentena para Navidad y Año Nuevo, amplían horario de toque de queda y ley seca",https://www.tvn-2.com/nacionales/cuarentena-COVID-19-Navidad-Ano-Nuevo-Panama-pantalla-facial-buses-toque-queda_0_5739926039.html,El Ministerio de Salud (Minsa) anunció este martes en conferencia de prensa cuarentena total para Navidad y Año Nuevo en Panamá con el objetivo de detener el incremento de casos por COVID-19.,15-12-2020 23:54,https://www.bing.com/th?id=OVFT.f06miJ-UKcDEmSAgd1Sjsy,Panamá,TVN
"Informe del Minsa revela que Panamá presenta 2,368 nuevos casos de COVID-19",https://www.telemetro.com/nacionales/2020/12/16/informe-del-minsa-revela-que-panama-presenta-2-368-nuevos-casos-de-covid-19/3559194.html,"En las últimas 24 horas, Panamá registró un total de 2,368 nuevos casos de COVID-19, elevando la cifra de contagios a 196,987, así lo informó el Ministerio de Salud (Minsa). También se reportó 29 nuevas defunciones, lo que eleva los fallecimientos a ...",16-12-2020 00:46,https://www.bing.com/th?id=OVFT.kddxSJu-TkvHeVbFLMWGYS,Panamá,Telemetro
Gobierno anuncia nuevo toque de queda y llegada de médicos extranjeros,https://elcapitalfinanciero.com/gobierno-anuncia-nuevo-toque-de-queda-y-llegada-de-medicos-extranjeros/,"A partir del 18 de diciembre y hasta el 4 de enero regirá toque de queda desde las 7:00 p.m. y hasta las 5:00 a.m y toque de queda total en el periodo de las fiesta de Navidad y 31 de diciembre, anunc",16-12-2020 01:00,https://www.bing.com/th?id=OVFT.l678cYfgEbphCAXljUqgKy,Panamá,El Capital Financiero
Corte suspende términos en tres juzgados por Covid-19,https://www.prensa.com/impresa/panorama/corte-suspende-terminos-en-tres-juzgados-por-covid-19/,"La Corte Suprema de Justicia suspendió los términos judiciales en tres juzgados al menos por un día, luego de que varios funcionarios resultaron contagiados con la",16-12-2020 04:00,https://www.bing.com/th?id=OVFT.yi_OmftKajc_5PquY3kMSi,Panamá,prensa.com
Licitación de cadena de frío de vacunas para la Covid-19 será este viernes,https://www.panamaamerica.com.pa/sociedad/licitacion-cadena-frio-vacunas-covid-19-sera-este-viernes-1177914,"Este viernes deben conocerse las propuestas para el proyecto de equipamiento de la cadena de frío para las vacunas contra la COVID-19. En la reunión informativa, celebrada el lunes, participaron seis empresas, que solicitaron que el tiempo de entrega de ...",16-12-2020 04:07,https://www.bing.com/th?id=OVFT.n4pJLeeQkyagA80kuvA_ni,Panamá,panamaamerica.com.pa
"COVID 19, transitismo e inestabilidad estructural",https://www.panamaamerica.com.pa/opinion/covid-19-transitismo-e-inestabilidad-estructural-1177910,"Cambio de modelo COVID 19, transitismo e inestabilidad estructural... la pandemia no solo generó, sino que también profundizó una tendencia hacia al dislocamiento de las cadenas internacionales de abastecimiento, lo cual puede efectivamente afectar la ...",16-12-2020 04:07,https://www.bing.com/th?id=OVFT.NuM9ajheah5xH3XCLHS_cS,Panamá,panamaamerica.com.pa
La OMS ha pedido a China y Rusia que le sometan los datos de sus vacunas,https://lagacetadepanama.com/la-oms-ha-pedido-a-china-y-rusia-que-le-sometan-los-datos-de-sus-vacunas/,"La Organización Mundial de la Salud (OMS) ha pedido a todas las compañías que están desarrollando vacunas y otros productos contra la COVID-19, incluidas Rusia y China, que le sometan sus datos científicos para evaluarlos y dar el visto bueno para su ...",16-12-2020 04:53,https://www.bing.com/th?id=OVFT.bCgol0SGkaiPOPeXe64K5y,Panamá,La Gaceta de Panama
Navidad en el encierro,https://www.critica.com.pa/nacional/navidad-en-el-encierro-594409,"Sin tener una ""bala de plata"" para matar al Covid-19, el gobierno de Panamá agobiado por el incremento del contagio, endureció el toque de queda",16-12-2020 05:05,https://www.bing.com/th?id=OVFT.QUnU1Rxguud9dkKiLyGFmi,Panamá,Critica
"Vacunas contra la covid-19, mitos y panorama sobre la efectividad",https://www.laestrella.com.pa/cafe-estrella/cultura/201216/vacunas-covid-19-mitos-panorama,"También se dio a conocer que médicos del Reino Unido con antecedentes de alergias severas, presentaron contratiempos en los ensayos clínicos, pero ¿realmente estos efectos están ligados a la vacuna contra la covid-19? La Administración de ...",16-12-2020 05:41,https://www.bing.com/th?id=OVFT.L3Ywnco-MA8V6etFC_p9zy,Panamá,laestrella.com.pa
Uso de la mascarilla y careta facial en el transporte público reduce el contagio,https://noticias24pty.com/uso-de-la-mascarilla-y-careta-facial-en-el-transporte-publico-reduce-el-contagio/,"La mascarilla y la careta son clave al momento de utilizar el transporte público, ya que utilizadas de forma conjunta estas herramientas son un escudo para evitar el contagio de la enfermedad",16-12-2020 09:28,https://www.bing.com/th?id=OVFT.UFcs-drsuCYJkoEeiPHNYy,Panamá,Noticias 24 PTY
"En Panamá, ministra de Gobierno, afirma trabajar para un futuro mejor y más justo para los pueblos indígenas",https://sertv.gob.pa/nacionalfm/en-panama-ministra-de-gobierno-afirma-trabajar-para-un-futuro-mejor-y-mas-justo-para-los-pueblos-indigenas/,"Proyecto de Inclusión Financiera y Empresariado Indígenas del Banco Interamericano de Desarrollo (BID), y el avance del Plan de Acción para controlar la enfermedad del COVID-19 en los territorios indígenas. Del mismo modo, se aprobaron varias ...",16-12-2020 10:55,https://www.bing.com/th?id=OVFT.ojyfZXrDQs3XI7fz1Wt9Wi,Panamá,SERTV
"Derechos y libertades, víctimas del Covid-19",https://ensegundos.com.pa/2020/12/16/derechos-y-libertades-victimas-del-covid-19/,El impacto en las libertades no se limita a los regímenes totalitarios o antiliberales. También se siente en las democracias liberales. La lucha mundial contra la pandemia en 2020 ha restringido las l,16-12-2020 10:57,https://www.bing.com/th?id=OVFT.PplXf1fBXbYrU1nGiDXvDy,Panamá,En Segundos
"Muere otra unidad policial, 30 han caído por covid-19",http://elsiglo.com.pa/panama/muere-otra-unidad-policial-30-caido-covid-19/24169558,"Deceso. El cabo segundo de la Policía Nacional, Luis Gómez, de 30 años , falleció a últimas horas de la tarde de este lunes 14 de diciembre presuntamente por covid-19, de acuerdo con un informe policial. El documento señala que a las 5:00 de la tarde ...",16-12-2020 12:00,https://www.bing.com/th?id=OVFT.W5V3PWsngQg6TurPNKuOwi,Panamá,El Siglo
Misión internacional que investigará el origen de la Covid-19 viajará a China en enero próximo,https://www.prensa.com/mundo/mision-internacional-que-investigara-el-origen-de-la-covid-19-viajara-a-china-en-enero-proximo/,"El equipo científico internacional creado por la Organización Mundial de la Salud (OMS) para determinar el origen del virus que causó la pandemia de la Covid-19 viajará a China en enero, indicó la org",16-12-2020 12:10,https://www.bing.com/th?id=OVFT.15kn4kxoPQiEeGbPhYAU4i,Panamá,prensa.com
Berrío: ‘Panamá aprobó el uso por emergencia de la vacuna Pfizer’,https://www.midiario.com/nacionales/berrio-panama-aprobo-el-uso-por-emergencia-de-la-vacuna-pfizer/,"La viceministra de Salud, Ivette Berrío, informó que se aprobó el uso por emergencia de la vacuna Pfizer-BioNTech contra la covid-19 y que el país está preparado para recibirla y administrar la inmuni",16-12-2020 12:48,https://www.bing.com/th?id=OVFT.p_SXdCxXQID0q6ucarNwVy,Panamá,Mi Diario
Se agotan las camas para pacientes de Covid-19,https://radioreformaseoye.com/nacionales/se-agotan-las-camas-para-pacientes-de-covid-19/,"Menos del 20% de la capacidad de camas en hospitales y en la unidad de cuidados intensivos, tiene el sistema de salud panameño disponible para la atención de pacientes positivos por la Covid-19. Esta urgencia sucede cuando el indicador de velocidad de tr ...",16-12-2020 13:38,https://www.bing.com/th?id=OVFT.no4JmFbX6XTpWeGH9bJely,Panamá,Radio Reforma se Oye
Reino Unido ya ha vacunado a 140.000 personas,http://www.nexpanama.com/reino-unido-ya-ha-vacunado-a-140-000-personas/,"Cerca de 140.000 personas en el Reino Unido han recibido sus primeras inyecciones de COVID-19 en la primera semana de lanzamiento de la vacuna desarrollada por Pfizer y BioNTech, según dijo el miércol",16-12-2020 14:04,https://www.bing.com/th?id=OVFT.OxnIfj2eYjKxON1uHwMJLC,Panamá,NEX TV
Panamá decreta cuarentena para fin de año,https://radioreformaseoye.com/nacionales/panama-decreta-cuarentena-para-fin-de-ano/,"El Gobierno de Panamá decretó una cuarentena total durante las fiestas de Navidad y Año Nuevo, para enfrentar el aumento de contagios positivos por la Covid-19. Además aumentará las horas del toque de queda, establecerá nuevos cercos sanitarios y ...",16-12-2020 14:28,https://www.bing.com/th?id=OVFT.bsUDnGL2B-45AxbZdtgaui,Panamá,Radio Reforma se Oye
"Gorgas recibe donación de 8,500 pruebas serológicas",https://elcapitalfinanciero.com/gorgas-recibe-donacion-de-8500-pruebas-serologicas/,"causante de la enfermedad COVID-19 y, al respecto, Cobre Panamá realizó una donación de 8,500 pruebas serológicas para ampliar el estudio. En este sentido, Manuel Aizpurúa, vocero de Cobre Panamá indicó que “Cobre Panamá apoya al país y a las ...",16-12-2020 15:01,https://www.bing.com/th?id=OVFT.9Mv6FfzYzTnmLZ0lZiALhy,Panamá,El Capital Financiero
Hospital Santo Tomás suspende temporalmente atención médica de la consulta externa especializada,https://www.laestrella.com.pa/nacional/201216/hospital-santo-tomas-suspende-temporalmente-atencion-medica-consulta-externa-especializada,"La dirección médica del Hospital Santo Tomás, debido al aumento de los casos de covid-19, suspendió temporalmente la atención médica de la consulta externa especializada. Elías García Mayorca, quien es el director Médico del Hospital, informó que ...",16-12-2020 16:02,https://www.bing.com/th?id=OVFT.Bop-NYVOVfFlsEfb1nKWzC,Panamá,laestrella.com.pa
"Durán, Christiansen y Mariano se roban los reflectores en 2020",http://elsiglo.com.pa/deportes/duran-christiansen-mariano-roban-reflectores-2020/24169567,"La pandemia del coronavirus paralizó al deporte en el mundo durante varios meses pero en Panamá momentos negativos y positivos contribuyeron a dar visibilidad al boxeo, el fútbol, el béisbol y el atle",16-12-2020 16:47,https://www.bing.com/th?id=OVFT.M-bzYwYA8Nlb7c4JvHT4ii,Panamá,El Siglo
Panamá entre los países que aseguraron a tiempo dosis de vacunas contra COVID-19 para toda su población,https://lagacetadepanama.com/panama-entre-los-paises-que-aseguraron-a-tiempo-dosis-de-vacunas-contra-covid-19-para-toda-su-poblacion/,"Reino Unido y la Unión Europea, en el grupo de naciones que hicieron pedidos anticipados asegurando la compra de vacunas debidamente autorizadas contra el coronavirus de acuerdo ... de la vacuna para combatir el COVID-19. El artículo del periódico ...",16-12-2020 16:49,https://www.bing.com/th?id=OVFT.HZTwfmNHVKrJQRy0LiTonS,Panamá,La Gaceta de Panama
Londres vuelve a cerrar y Johnson llama a festejar la Navidad con prudencia,https://ensegundos.com.pa/2020/12/16/londres-vuelve-a-cerrar-y-johnson-llama-a-festejar-la-navidad-con-prudencia/,"Locales de restauración y ocio volvieron a cerrar el miércoles en Londres, solo dos semanas después de que Inglaterra saliese de su segundo confinamiento, ante una disparada en los contagios de covid-",16-12-2020 17:17,https://www.bing.com/th?id=OVFT.z2kU-RbV1FFQRluh3mmPCS,Panamá,En Segundos
