name,url,description,datePublished,imagen,pais,Fuente
Canciller Erika Mouynes asiste a toma de posesión del presidente electo de Ecuador Guillermo Lasso,https://www.radiopanama.com.pa/noticias/internacional/canciller-erika-mouynes-asiste-a-toma-de-posesion-del-presidente-electo-de-ecuador-guillermo-lasso/20210524/nota/4137466.aspx,"Panamá y Costa Rica comparten una frontera que sufre los embates de oleada de miles de migrantes que la cruzan en camino a Norteamericano, y también otros derivados de la pandemia de la covid-19, que ha obligado a reforzar los controles migratorios y la ...",24-05-2021 23:47,https://www.bing.com/th?id=OVFT.U5aKDYpkHePXVNpXvKWW7y,Panamá,Radio Panamá
COVID-19 mató a 14 personas en las últimas 24 horas; positividad en el 4.8.%,https://www.critica.com.pa/nacional/covid-19-mato-14-personas-en-las-ultimas-24-horas-positividad-en-el-48-604725,"Un total de 14 nuevas defunciones a causa del COVID-19, reporta este lunes el Ministerio de Salud (Minsa) en Panamá durante las últimas 24 horas y actualizan 1 de fechas anteriores.Con estos nuevos de",25-05-2021 00:04,https://www.bing.com/th?id=OVFT.nqE2pJHGKn_oHQZtwtRDhi,Panamá,Critica
Panamá acuerda otros 150 millones de dólares con el BID para MIPYMES,https://lagacetadepanama.com/panama-acuerda-otros-150-millones-de-dolares-con-el-bid-para-mipymes/,El Ministerio de Economía y Finanzas de Panamá (MEF) suscribió este lunes (24.05.2021) un préstamo con el Banco Interamericano de Desarrollo (BID) de 150 millones de dólares para reactivar a las micro,25-05-2021 00:33,https://www.bing.com/th?id=OVFT.DPlLFUZNSGTZHdUdwyoJwi,Panamá,La Gaceta de Panama
"Le disparan con ‘taser’ a usuario del Metro, pantalla facial trajo el altercado",http://elsiglo.com.pa/panama/disparan-taser-usuario-metro-pantalla-facial-trajo-altercado/24178557,El Metro de Panamá recuerda  que no usar mascarilla ni pantalla facial es una falta que se sanciona con una multa de hasta 150 dólares.,25-05-2021 00:44,https://www.bing.com/th?id=OVFT.bWlfQplw4nGVZZlyN6mPUy,Panamá,El Siglo
Minsa: En Panamá se han aplicado 953 mil 508 vacunas contra la covid-19,https://www.midiario.com/salud/minsa-en-panama-se-han-aplicado-953-mil-508-vacunas-contra-la-covid-19/,"A través de un comunicado el Ministerio de Salud (Minsa) informó este lunes que desde la llegada del primer lote a Panamá, el pasado 20 de enero a la fecha, se han aplicado 953 mil 508 dosis en todo e",25-05-2021 01:02,https://www.bing.com/th?id=OVFT.XI8uazygQ0YL8SVqzR5BTy,Panamá,Mi Diario
15 altos cargos han salido del gobierno,https://www.critica.com.pa/nacional/15-altos-cargos-han-salido-del-gobierno-604736,"Durante el gobierno del mandatario de Panamá, Laurentino Cortizo se han dado al menos 15 remociones y renuncias entre ministros y directores de instituciones. Estas bajas",25-05-2021 02:08,https://www.bing.com/th?id=OVFT.Kjz3G_t6um_oWmEt-YbJhy,Panamá,Critica
Los viajes aéreos están regresando,https://www.prensa.com/impresa/martes-financiero/los-viajes-aereos-estan-regresando/,"Cuando estalló la Covid-19, la demanda de viajes aéreos se deplomó, en todas partes y al mismo tiempo. La recuperación será diferente: algunas regiones y segmentos volverán antes que otros. ¿Qué signi",25-05-2021 04:00,https://www.bing.com/th?id=OVFT.7FmiQ9QBYApyAm0T64Sdli,Panamá,prensa.com
14 muertes por Covid-19; vacunación avanza en medio de polémica,https://noticias24pty.com/14-muertes-por-covid-19-vacunacion-avanza-en-medio-de-polemica/,"El informe epidemiológico del Ministerio de Salud (Minsa) reportó ayer el fallecimiento de 14 personas por la enfermedad Covid-19. La mayoría de los decesos se dio en la provincia de Chiriquí,",25-05-2021 07:44,https://www.bing.com/th?id=OVFT.d_Q63g9N9c9ODQsdTTIuUi,Panamá,Noticias 24 PTY
"COVID-19: Panamá sigue en la meseta con igual cantidad de casos, muertes y personas en UCI",https://www.tvn-2.com/contenido_exclusivo/Panama-cantidad-muertes-personas-UCI_0_5859914036.html,"Coclé y Panamá están por debajo de la medida de 100 casos por 100 mil, métrica clave para mantener aperturas de escuelas, acotó el experto.",25-05-2021 11:00,https://www.bing.com/th?id=OVFT.nrLE3Bx6uSoEpRGd12LhPi,Panamá,TVN
Alumnos de Nueva York regresarán a las escuelas en otoño,http://www.nexpanama.com/alumnos-de-nueva-york-regresaran-a-las-escuelas-en-otono/,"Los alumnos de la ciudad de Nueva York podrán regresar a clases en persona en el otoño sin necesidad de tomar lecciones a distancia, anunció el lunes el alcalde Bill de Blasio. “No tendremos una plena",25-05-2021 12:46,https://www.bing.com/th?id=OVFT.k5MA6nKl4TLqE6aFTIX3rC,Panamá,NEX TV
Advierten del peligro de no cumplir con las medidas de bioseguridad,https://www.tvn-2.com/nacionales/Advierten-peligro-cumplir-medidas-bioseguridad_0_5860663887.html,"A pesar de que se avanza con el proceso de vacunación, la jefa de la Unidad de Inteligencia Sanitaria de la Caja del Seguro Social (CSS), Gladys Guerrero, advierte que el porcentaje en la actualidad s",25-05-2021 12:47,https://www.bing.com/th?id=OVFT.zVSTvSXW7jWhiZ-BtnMiry,Panamá,TVN
COMUNICADO # 454,https://sertv.gob.pa/crisolfm/comunicado-454/,"En su reporte emitido esta tarde, el Programa Ampliado de Inmunización del Ministerio de Salud (MINSA), señala que, desde la llegada del primer lote a Panamá, se han aplicado 953,508 dosis en todo el",25-05-2021 13:33,https://www.bing.com/th?id=OVFT.TExIUMQKiIGJqTtEn3bRry,Panamá,SERTV
Panamá tiene una política racional para hacerle frente a los retos de la pandemia,https://sertv.gob.pa/nacionalfm/panama-tiene-una-politica-racional-para-hacerle-frente-a-los-retos-de-la-pandemia/,"La comunidad internacional está reconociendo la estrategia que Panamá ejecuta para superar la crisis sanitaria y económica generada por la pandemia por el COVID-19 y saldrá fortalecida de la misma, ex",25-05-2021 14:05,https://www.bing.com/th?id=OVFT.AfjKzeCV4xIVXYliZ4sMIy,Panamá,SERTV
"Panamá recibe nuevo lote de vacuna de Pfizer con 109,980 dosis, la mayor cantidad con esta farmacéutica",https://www.prensa.com/sociedad/panama-recibe-nuevo-lote-de-vacuna-de-pfizer-con-109980-dosis/,"Panamá recibió este martes, 18 de mayo, un nuevo lote de vacunas contra la Covid-19 del laboratorio Pfizer con un total de 109,980 dosis, confirmó el Ministerio de Salud",25-05-2021 15:47,https://www.bing.com/th?id=OVFT.v_qCQahTrkKRBzNaoyyeay,Panamá,prensa.com
"Llega a Panamá el decimosexto lote de vacunas de Pfizer con 109,980 dosis",https://www.telemetro.com/nacionales/llega-panama-el-decimosexto-lote-vacunas-pfizer-109980-dosis-n5022468,"Con este nuevo lote de dosis de Pfizer, Panamá recibiría su segundo embarque más grande de vacunas contra el COVID-19.",25-05-2021 16:38,https://www.bing.com/th?id=OVFT.Y94IVh90cJcX0_gfTgBlXC,Panamá,Telemetro
"Panamá recibe el lote #16 de vacunas contra el Covid-19 de Pfizer/BioNtech con 109,980 dosis",https://www.metrolibre.com/nacionales/202857-panam%C3%A1-recibe-el-lote-16-de-vacunas-contra-el-covid-19-de-pfizerbiontech-con-109980-dosis.html,"Este martes, 25 de mayo, arribó al Aeropuerto Internacional de Tocumen de Panamá, el decimosexto lote de vacunas contra el Covid-19 de la farmacéutica Pfizer/BioNtech. Son 109,980 dosis que se incluir",25-05-2021 17:03,https://www.bing.com/th?id=OVFT.766-hAolfEEitYtpKwtc9S,Panamá,Metro Libre
Panamá recibe el décimo sexto lote de vacunas contra la covid-19 de la farmacéutica Pfizer,https://www.panamaamerica.com.pa/sociedad/panama-recibe-el-decimo-sexto-lote-de-vacunas-contra-la-covid-19-de-la-farmaceutica-pfizer,"El décimo sexto lote de vacunas contra la covid-19 de la farmacéutica Pfizer llegó esta mañana al Aeropuerto Internacional de Tocumen.En total, son 109,980 nuevas dosis con la cual se espera continuar",25-05-2021 18:04,https://www.bing.com/th?id=OVFT.Ub0i9orBjYGdFib641zqYS,Panamá,panamaamerica.com.pa
Llega a Panamá nuevo lote de vacunas de Pfizer con 109 mil 980 dosis,https://www.midiario.com/nacionales/llega-a-panama-nuevo-lote-de-vacunas-de-pfizer-con-109-mil-980-dosis/,"Este martes, 18 de mayo, el país recibió un nuevo lote de vacunas contra la covid-19 del laboratorio Pfizer con un total de 109 mil 980 dosis, así lo confirmó el Ministerio de Salud",25-05-2021 18:24,https://www.bing.com/th?id=OVFT.Wo_VTySsC-HA5DKRGOeYWS,Panamá,Mi Diario
Panamá rinde informe ante la Asamblea Mundial de la Salud,https://www.metrolibre.com/nacionales/202863-panam%C3%A1-rinde-informe-ante-la-asamblea-mundial-de-la-salud.html,"Como parte de la septuagésima cuarta reunión de la Asamblea Mundial de la Salud (OMS), el ministro Luis Francisco Sucre presentó el informe país sobre el manejo de la pandemia y destacó las medidas im",25-05-2021 18:26,https://www.bing.com/th?id=OVFT.01vUW_pUbsy6uCGoHRIOti,Panamá,Metro Libre
Autorrápido de vacunas en Azuero inicia operaciones,https://www.telemetro.com/nacionales/autorrapido-vacunas-azuero-inicia-operaciones-n5022553,En los autorrápidos solo se inoculará con dosis de vacunas de AstraZeneca a aquellos que llenaron el formulario de registro para la aplicación voluntaria.,25-05-2021 18:58,https://www.bing.com/th?id=OVFT.cVYqhTKhJE6PNJDPSMEFaC,Panamá,Telemetro
"Llegan 109,980 dosis de vacunas contra el COVID-19 a Panamá",https://www.diaadia.com.pa/el-pais/llegan-109980-dosis-de-vacunas-contra-el-covid-19-panama-734398,"Panamá cuenta con 109,980 dosis de las vacunas de la farmacéutica Pfizer, luego de que hoy martes 25 de mayo, arribara el décimo sexto a la Terminal de Carga del Aeropuerto Internacional de Tocumen. “",25-05-2021 19:46,https://www.bing.com/th?id=OVFT.CyRVI9bdDkzW4wwONNwHdC,Panamá,Día a Día
Estados Unidos tiene ya al 50% de su población adulta vacunada contra la covid-19,https://www.panamaamerica.com.pa/mundo/estados-unidos-tiene-ya-al-50-de-su-poblacion-adulta-vacunada-contra-la-covid-19-1187748,"Estados Unidos alcanzó este martes la vacunación completa del 50% de su población adulta, a la vez que continúa el descenso en el número de contagios y muertes diarias por la covid-19 en la batalla co",25-05-2021 20:08,https://www.bing.com/th?id=OVFT.ZEotNG0wJuGgGgdLHp470i,Panamá,panamaamerica.com.pa
"Más barriadas para Panamá Este y Oeste, más de 15 anteproyectos se tramitaron en el Miviot",https://www.diaadia.com.pa/el-pais/mas-barriadas-para-panama-este-y-oeste-mas-de-15-anteproyectos-se-tramitaron-en-el-miviot,"De acuerdo con un informe, de la semana del 17 al 21 de mayo se tramitaron 15 anteproyectos, la mayoría para Panamá Oeste y Panamá Este. Adicional, se registraron ocho proyectos del programa Fondo Sol",25-05-2021 21:09,https://www.bing.com/th?id=OVFT.EVo8iaAXLcb1lt6RVTzEti,Panamá,Día a Día
"Panamá recibe 109,980 nuevas dosis de la Farmacéutica Pfizer",https://ensegundos.com.pa/2021/05/25/panama-recibe-109980-nuevas-dosis-de-la-farmaceutica-pfizer/,El Ministerio de Salud le pide una vez más a la población que a pesar de haber recibido la vacuna contra la COVID-19 es importante no bajar la guardia y mantener las medidas El decimosexto lote de vac,25-05-2021 21:44,https://www.bing.com/th?id=OVFT._wxCj8OK0ba_75h0vNUC1C,Panamá,En Segundos
Recobra fuerza en EE.UU la idea de que el covid-19 surgió en un laboratorio chino,https://ensegundos.com.pa/2021/05/25/recobra-fuerza-en-ee-uu-la-idea-de-que-el-covid-19-surgio-en-un-laboratorio-chino/,"Desestimada durante mucho tiempo por la mayoría de los expertos, considerada altamente improbable sino descabellada, la idea de que la pandemia de covid-19 se originó en un accidente de laboratorio ch",25-05-2021 22:00,https://www.bing.com/th?id=OVFT.fdxWN0G16ZNP6ZAL-WPR7S,Panamá,En Segundos
