name,url,description,datePublished,imagen,pais,Fuente
Panamá cumple con plazos para el intercambio automático de información,https://elcapitalfinanciero.com/panama-cumple-con-plazos-para-el-intercambio-automatico-de-informacion/,"La Dirección General de Ingresos (DGI) del Ministerio de Economía y Finanzas informó que ha cumplido con el plazo establecido para los intercambios automáticos de información que, por motivo de la pan",25-02-2021 18:31,https://www.bing.com/th?id=OVFT.HAu1ud0Eisa-sJKAa-zlmi,Panamá,El Capital Financiero
"Más de 2,5 millones de muertes en el mundo por covid-19",https://ensegundos.com.pa/2021/02/25/mas-de-25-millones-de-muertes-en-el-mundo-por-covid-19/,"Las cifras se basan en los reportes comunicados diariamente por las autoridades sanitarias de cada país. Más de 2,5 millones de muertes de covid-19 se han registrado en todo el mundo desde el inicio d",25-02-2021 20:08,https://www.bing.com/th?id=OVFT.FCoZbW9Z3Ru4j-j9s1CAzC,Panamá,En Segundos
Autoridades realizan adecuaciones a colegios para programa de vacunación contra la Covid-19,https://elcapitalfinanciero.com/autoridades-realizan-adecuaciones-a-colegios-para-programa-de-vacunacion-contra-la-covid-19/?doing_wp_cron=1614284215.4887659549713134765625,Cuadrillas del Ministerio de Vivienda y Ordenamiento Territorial (Miviot) de Panamá Oeste realizan adecuaciones a las escuelas que fueron inspeccionadas y seleccionadas por una comisión interinstituci,25-02-2021 20:43,https://www.bing.com/th?id=OVFT.JWDsEeCg4q96q9vlzECvPC,Panamá,El Capital Financiero
En Panamá Oeste continúa el proceso de vacunación a personal de la FTC,https://www.radiopanama.com.pa/noticias/actualidad/en-panama-oeste-continua-el-proceso-de-vacunacion-a-personal-de-la-ftc/20210225/nota/4112622.aspx,"En esta vacunación están siendo incluidos miembros de la Fuerza Tarea en Conjunto (FTC), así como personal que lleva a cabo las jornadas de trazabilidad",25-02-2021 21:14,https://www.bing.com/th?id=OVFT.U5aKDYpkHePXVNpXvKWW7y,Panamá,Radio Panamá
"En Panamá se han aplicado 89,419 vacunas contra la Covid-19, según el Minsa",https://www.prensa.com/sociedad/en-panama-se-han-aplicado-89419-vacunas-contra-la-covid-19-segun-el-minsa/,"Un total de 89,419 vacunas contra la Covid-19 se han aplicado en todo el país, de acuerdo con un informe del Programa Ampliado de Inmunización (PAI) del Ministerio de Salud",25-02-2021 22:34,https://www.bing.com/th?id=OVFT.IW5QB7LNSDymQzv-P5IvPi,Panamá,prensa.com
Contagios bajan pero muertes no. Panamá sigue perdiendo personas por la covid-19,https://www.midiario.com/nacionales/contagios-bajan-pero-muertes-no-panama-sigue-perdiendo-personas-por-la-covid-19/,"El Ministerio de Salud (Minsa) ha reportado la muerte de 21 personas por la covid-19, para un total de 5 mil 810 en más de 11 meses de",25-02-2021 23:21,https://www.bing.com/th?id=OVFT.5BgX6epO6WjkHEdKfnh1Ei,Panamá,Mi Diario
Se contabilizan 20 muertos y 682 nuevos contagiados por la COVID-19 en Panamá,https://www.tvn-2.com/nacionales/contabilizan-muertos-contagiados-COVID-19-Panama_0_5793920644.html,"Al cierre de este jueves 25 de febrero se contabilizaron 20 decesos (más una defunción de días anteriores) y 682 casos nuevos de la COVID-19 en Panamá. Del 9 de marzo de 2020 hasta hoy se han contagiado 339,383 ciudadanos en el territorio nacional ...",25-02-2021 23:21,https://www.bing.com/th?id=OVFT.FlfPcHvsdPiTAKGZq6sKWy,Panamá,TVN
Panamá registra 682 nuevos casos y 20 defunciones por coronavirus,https://www.metrolibre.com/nacionales/195096-panam%C3%A1-registra-682-nuevos-casos-y-20-defunciones-por-coronavirus.html,"De acuerdo al informe epidemiológico oficial, se reportaron 20 nuevos fallecimientos, no obstante, se actualizó una muerte detectada en fechas anteriores, totalizando 5,810 los decesos. Para Panamá la",25-02-2021 23:49,https://www.bing.com/th?id=OVFT.UT64rKBlEV2ejR0Jfo7g8i,Panamá,Metro Libre
Primera dama se vacuna contra el covid-19,https://www.metrolibre.com/nacionales/195097-primera-dama-se-vacuna-contra-el-covid-19.html,"El despacho de la primera dama informó que Yazmín Colón de Cortizo, esposa del presidente, recibió la primera dosis de la vacuna para combatir el cornavirus de la empresa Pfizer. Colón de Cortizo reci",25-02-2021 23:50,https://www.bing.com/th?id=OVFT.-xHIvP5424NSadZNDQ4F-S,Panamá,Metro Libre
"Panamá registra unas 5,810 muertes en total a causa del COVID-19",https://www.telemetro.com/nacionales/2021/02/26/panama-registra-unas-5-810-muertes-en-total-a-causa-del-covid-19/3787465.html,"Con un total de 682 nuevos casos de COVID-19, Panamá elevó su cifra de contagios a 339,383, según el informe epidemiológico del Ministerio de Salud. Además, se reportaron 20 nuevos fallecimientos, y s",26-02-2021 00:27,https://www.bing.com/th?id=OVFT.S4nkUNL3rkhzDs1GFvCymi,Panamá,Telemetro
Azmahar Ariano piensa en grande con el Alianza Atlético Suyana de Perú,https://www.tvmax-9.com/somoslasele/Azmahar-Ariano-Alianza-Atletico-Suyana_0_5793920651.html,"Con mucho entusiasmo y deseos de triunfar, así se encuentra Azmahar Ariano quien espera el inicio de la nueva temporada en la primera división del fútbol de Perú para jugar por el recién ascendido Ali",26-02-2021 00:56,https://www.bing.com/th?id=OVFT.ZoRjtbLASXd06IK-k_BC3C,Panamá,TVMAX
Azmahar Ariano piensa en grande con el Alianza Atlético Sullana de Perú,https://www.tvmax-9.com/somoslasele/Azmahar-Ariano-Alianza-Atletico-Sullana_0_5793920651.html,"Con mucho entusiasmo y deseos de triunfar, así se encuentra Azmahar Ariano quien espera el inicio de la nueva temporada en la primera división del fútbol de Perú para jugar por el recién ascendido Ali",26-02-2021 01:12,https://www.bing.com/th?id=OVFT.ZoRjtbLASXd06IK-k_BC3C,Panamá,TVMAX
Pfizer alista una tercera dosis contra la Covid-19,https://www.prensa.com/impresa/panorama/pfizer-alista-una-tercera-dosis-contra-la-covid-19/,"El dúo estadounidense-alemán Pfizer/BioNTech informó ayer que estudia añadir una tercera dosis a su régimen de vacunas contra la Covid-19, así como probar una nueva versión dirigida a la variante suda",26-02-2021 04:00,https://www.bing.com/th?id=OVFT.F94KgN4fMWHqKSkgzVAnJC,Panamá,prensa.com
Casinos le apuestan a sus medidas contra la COVID-19 para funcionar,https://www.critica.com.pa/nacional/casinos-le-apuestan-sus-medidas-contra-la-covid-19-para-funcionar-599094,"La industria del entretenimiento y juegos de azar en Panamá se está preparando para su reapertura el próximo 6 de marzo, pero antes de la",26-02-2021 05:32,https://www.bing.com/th?id=OVFT.L3JTmSsm7coRlcqP1dR0Yi,Panamá,Critica
"Panamá recibe tercer lote de vacuna Pfizer contra COVID-19 con 77,220 dosis",https://noticias24pty.com/panama-recibe-tercer-lote-de-vacuna-pfizer-contra-covid-19-con-77220-dosis/,"Linda Batista • 24 Feb 2021 – 01:44 AM El tercer lote de 77,220 dosis de la vacuna contra COVID-19 de Pfizer y BioNTech, llegó a Panamá la madrugada de este miércoles. Tras arribar al",26-02-2021 05:39,https://www.bing.com/th?id=OVFT.n6ZnbOTWIXc_EASZCpKNfi,Panamá,Noticias 24 PTY
Desde hoy inicia vacunación para personas con discapacidad,https://www.critica.com.pa/nacional/desde-hoy-inicia-vacunacion-para-personas-con-discapacidad-599093,"Unos 682 nuevos casos con una positividad del 6. 8% en la aplicación de 9,909 pruebas, registró ayer el Covid-19 en Panamá. Se reportaron 21 defunciones que",26-02-2021 05:57,https://www.bing.com/th?id=OVFT.iW9z6V81y2HJ0SAH-t_3sC,Panamá,Critica
"Bomberos de la provincia de Coclé, reciben primeras dosis de vacuna",https://sertv.gob.pa/nacionalfm/bomberos-de-la-provincia-de-cocle-reciben-primeras-dosis-de-vacuna/,"Los equipos de enfermería del MINSA Y CSS de Coclé, al corte de hoy, han aplicado la primera dosis de la vacuna de la farmacéutica Pfizer contra la COVID-19, a 182 colaboradores del Benemérito Cuerpo",26-02-2021 08:50,https://www.bing.com/th?id=OVFT.5dC4S5kQTBaIxji3lG4AQy,Panamá,SERTV
"'El negocio está quebrado', advierten transportistas de Panamá Oeste",https://www.diaadia.com.pa/el-pais/el-negocio-esta-quebrado-advierten-transportistas-de-panama-oeste-375884,"Luego de un año de afrontar restricciones debido a la pandemia del covid-19, la dirigencia del transporte de rutas internas en La Chorrera, provincia de Panamá Oeste, asegura que el “negocio est",26-02-2021 11:27,https://www.bing.com/th?id=OVFT.2iekHV9V8rpTJHtPhK_2ni,Panamá,Día a Día
Un 66% de los panameños está de acuerdo con vacunarse contra covid-19,https://www.telemetro.com/nacionales/2021/02/26/66-panamenos-acuerdo-vacunarse-covid/3789149.html,La tendencia en la intención de los panameños de vacunarse contra covid-19 se mantiene. Un 66% de la ciudadanía está de acuerdo con ser inmunizado.,26-02-2021 15:02,https://www.bing.com/th?id=OVFT.6SpelW4wGqv0teNLRzbgqS,Panamá,Telemetro
Artistas panameños y chinos destacan valor de unidad para enfrentar la pandemia,https://www.laestrella.com.pa/cafe-estrella/cultura/210226/artistas-panamenos-chinos-destacan-unidad-enfrentar-pandemia,"La exposición virtual incluye 72 pinturas al óleo, acuarelas, pinturas chinas y pinturas de composición mixta, fruto del trabajo de 32 artistas chinos y de 40 artistas panameños",26-02-2021 15:19,https://www.bing.com/th?id=OVFT.OMgpserVhhTA-kuhBq-Gci,Panamá,laestrella.com.pa
Panamá ya aplicó unas 89 mil dosis de la vacuna contra el COVID-19,https://anpanama.com/10806-Panama-ya-aplico-unas-89-mil-dosis-de-la-vacuna-contra-el-COVID-19.note.aspx,"(Ciudad de Panamá-ANPanamá) Un total de 89,419 dosis de vacunas contra el COVID-19 se han aplicado en todo el país, mientras continúa en descenso las cifras de contagios, aumentan los recuperados y di",26-02-2021 16:52,https://www.bing.com/th?id=OVFT.eDHlfPavxmBV26bBYhqVQy,Panamá,AN Panama
FAO y China apuestan a la digitalización en la agricultura para recuperar los sistemas en la era post-covid-19,https://www.laestrella.com.pa/economia/210226/fao-china-apuestan-digitalizacion-agricultura-recuperar-sistemas-post-covid-19,"Planean desarrollar un proyecto con enfoque de digitalización, financiado con el Fondo FAO-China de Cooperación Sur-Su para apoyar la recuperación de los sistemas agroalimentarios",26-02-2021 17:18,https://www.bing.com/th?id=OVFT.xuZaDmRBY8aoW8mAA5abUS,Panamá,laestrella.com.pa
