name,url,description,datePublished,imagen,pais,Fuente
Ministerio de Salud convoca a directores de los hospitales,https://www.prensa.com/impresa/panorama/ministerio-de-salud-convoca-a-directores-de-los-hospitales/,"Directores de hospitales públicos se reunieron ayer con el secretario general del Ministerio de Salud (Minsa), José Baruco, para “coordinar intervenciones” frente a un posible rebrote de la Covid-19 e",16-10-2020 05:00,https://www.bing.com/th?id=OVFT.qOCD9e2SInpK5KmVR4vlyy,Panamá,prensa.com
20 médicos han perdido la vida ante la covid-19,http://elsiglo.com.pa/panama/20-medicos-perdido-vida-ante-covid-19/24166037,"Despidieron ayer al doctor Cabrera. El personal de Salud ha sido golpeado por las garras de la coronavirus, pues en medio de la pandemia unos 20 galenos han fallecido, según datos del Ministerio de Sa",16-10-2020 05:17,https://www.bing.com/th?id=OVFT.zc0ZwZNoVQTnMjMLUmeQqy,Panamá,El Siglo
"Letalidad de COVID-19 en Panamá sube a 2.06%, se registran 8 muertes y 832 nuevos contagios",https://www.tvn-2.com/nacionales/Letalidad-COVID-19-Panama-registran-contagios_0_5693430682.html,"Este miércoles 14 de octubre, fueron contabilizados 8 decesos y 832 casos nuevos por la COVID-19 en Panamá. Hasta el momento van acumulados 122,128 infectados por el virus, de los cuales, 97,919 se ha",16-10-2020 06:15,https://www.bing.com/th?id=OVFT.pnJ1WUmisPCqob3Mb8HebC,Panamá,TVN
Uniendo fuerzas contra el cáncer,https://www.metrolibre.com/opini%C3%B3n/184519-uniendo-fuerzas-contra-el-c%C3%A1ncer.html,"Hay grandes expectativas en torno a la Campaña Rosada 2020 con el lema, “UNIENDO FUERZAS CONTRA EL CANCER”, promovida por el Despacho de la Primera Dama de la República de Panamá, Señora Yazmín Colón",16-10-2020 09:42,https://www.bing.com/th?id=OVFT.Ox1Oo21VA0ZJGi7fY3Agoy,Panamá,Metro Libre
Asamblea: 47 leyes han superado el tercer debate desde julio,https://www.metrolibre.com/nacionales/184524-asamblea-47-leyes-han-superado-el-tercer-debate-desde-julio.html,"Un total de 306 iniciativas y proyectos de ley se han presentado en la Asamblea Nacional en medio de la pandemia del Covid-19, bajo las cuales los diputados han tenido que implementar sesiones virtual",16-10-2020 09:50,https://www.bing.com/th?id=OVFT.3ji8IPDqtNzkazaSrx2d0C,Panamá,Metro Libre
Puerto Caimito lidera corregimientos con más casos. Reportan 755 nuevos contagios en el país por covid-19,https://www.midiario.com/salud/puerto-caimito-lidera-corregimientos-con-mas-casos-reportan-755-nuevos-contagios-en-el-pais-por-covid-19/,"Las autoridades reportaron este jueves, 15 de octubre, 755 casos positivos nuevos, para un total acumulado de 122 mil 883, mientras que diez personas más perdieron la vida en las últimas horas víctima",16-10-2020 11:51,https://www.bing.com/th?id=OVFT.Ut6ooy4VlkFfg9osp5MkWS,Panamá,Mi Diario
Mueren dos migrantes en la provincia de Darién,https://www.nexpanama.com/mueren-dos-migrantes-en-la-provincia-de-darien/,"Luego de contraer el COVID-19, dos migrantes que ingresaron a Panamá desde Colombia fallecieron recientemente. El director del Servicio Nacional de Fronteras, Oriel Ortega, detalló el jueves que los e",16-10-2020 12:14,https://www.bing.com/th?id=OVFT.jGMZL3T9Wyi6srpEUndegS,Panamá,NEX TV
Canal de Panamá anticipa caída del 10% en los tránsitos para 2021,https://ensegundos.com.pa/2020/10/16/canal-de-panama-anticipa-caida-del-10-en-los-transitos-para-2021/,"La pandemia de la covid-19 reconfiguró el comercio y los viajes a nivel mundial. La Organización Mundial del Comercio (OMC), prevé que el comercio mundial caerá un 9.2% en 2020, con un 7.2% de recuper",16-10-2020 14:57,https://www.bing.com/th?id=OVFT.Xh_0NDZkQTOZ0k7753Zy5i,Panamá,En Segundos
Proyecto de ampliación del puente de Las Américas- Arraiján tiene un 38% de avance,https://noticias24pty.com/proyecto-de-ampliacion-del-puente-de-las-americas-arraijan-tiene-un-38-de-avance/,"El Ministerio de Obras Públicas (MOP) informó que el proyecto para el estudio, diseño, construcción y mantenimiento de obras para la ampliación y rehabilitación de la carretera Panamericana, tramo",16-10-2020 15:58,https://www.bing.com/th?id=OVFT.61JDq3WCPZt1OK_KKxjGyi,Panamá,Noticias 24 PTY
Vietnam cancela GP de F1 por pandemia de COVID-19,https://www.nexpanama.com/vietnam-cancela-gp-de-f1-por-pandemia-de-covid-19/,"El primer Gran Premio de Vietnam de la Fórmula Uno ha sido oficialmente cancelado debido a la pandemia de COVID-19, dijeron el viernes los organizadores. La carrera estaba programada originalmente par",16-10-2020 16:20,https://www.bing.com/th?id=OVFT.o22bMa-IZbWUE16E0mo8-i,Panamá,NEX TV
HEALTH: Herd immuniry a mirage,https://www.newsroompanama.com/health/health-herd-immuniry-a-mirage,"The idea of ​​letting the Covid-19 virus circulate freely to achieve herd immunity, postulated at the beginning of the pandemic, is increasingly emerging",16-10-2020 16:51,https://www.bing.com/th?id=OVFT.6gqU2g7vphQPXWsrSnkKpi,Panamá,Newsroom Panama
Remdesivir fails to cut covid deaths,https://www.newsroompanama.com/health/remdesivir-fails-to-cut-covid-deaths,"The antiviral drug Remdesivir, considered one of the most promising treatments againstCovid-19, turns out to be ineffective in preventing death from this di",16-10-2020 17:43,https://www.bing.com/th?id=OVFT.lyK1z9UFkv0_e6XREGhXOS,Panamá,Newsroom Panama
CSS y Minsa en Panamá Oeste desarrollan plan de educación comunitaria,https://www.diaadia.com.pa/el-pais/css-y-minsa-en-panama-oeste-desarrollan-plan-de-educacion-comunitaria-371423,"Un agresivo plan de promoción y prevención para evitar un incremento de casos COVID-19 inició la coordinación provincial de la Caja de Seguro Social (CSS), en sitios extramuros, junto a personal de sa",16-10-2020 18:38,https://www.bing.com/th?id=OVFT.6nDCsWO9qRAJIvTM75wqoS,Panamá,Día a Día
Minsa sanciona a dueños de dos locales por corridas de toro en Veraguas,https://www.telemetro.com/nacionales/2020/10/16/minsa-notifica-sancion-establecimientos-corridas-de-toro/3353924.html,"El Ministerio de Salud en la provincia de Veraguas, sancionó a los dueños de dos establecimientos por la realización de corridas de toro, celebradas en días pasados en abierta violación a restriccione",16-10-2020 19:20,https://www.bing.com/th?id=OVFT.Fy1Kc3aEM5wvCGel7Kchpy,Panamá,Telemetro
Barrido epidemiológico por nuevos casos de Covid-19 en Panamá Oeste,https://www.critica.com.pa/sucesos/barrido-epidemiologico-por-nuevos-casos-de-covid-19-en-panama-oeste-590199,"La jornada inició en centro comercial del corregimiento de Vista Alegre, donde el personal sanitario ofreció kits informativos, aplicación de vacunas e hisopados a aquellos que deseaban descartar la e",16-10-2020 19:22,https://www.bing.com/th?id=OVFT.2SPBrXfldjd_1GQdx9JiTy,Panamá,Critica
Minsa inspecciona protocolos de prevención en casas de citas y determina fallos,http://elsiglo.com.pa/panama/minsa-inspecciona-protocolos-prevencion-casas-citas-determina-fallos/24166075,"Hay relajamientos en las medidas preventivas. Con la reapertura de actividades económicas en el país, Funcionarios de la Región Metropolitana de Salud inspeccionó las casas de",16-10-2020 20:29,https://www.bing.com/th?id=OVFT.KU1kOo5DWqdIXRlHNke6sy,Panamá,El Siglo
Casas de citas no cumplen a cabalidad lineamientos de seguridad contra la COVID-19,https://www.panamaamerica.com.pa/sociedad/casas-citas-no-cumplen-cabalidad-lineamientos-seguridad-contra-covid-19-1174151,"En una inspección realizada en las casas de citas, la Región Metropolitana de Salud constató que no todo los establecimientos están cumpliendo con el protocolo de bioseguridad para evitar el contagio",16-10-2020 21:17,https://www.bing.com/th?id=OVFT.Ei3tYo_jLD-Knn81Sbqwdy,Panamá,panamaamerica.com.pa
"Lanzan el taller de periodismo ""Pensar el Futuro Contar Panamá""",https://www.laestrella.com.pa/nacional/201016/lanzan-taller-periodismo-pensar-futuro-contar-panama,"El colectivo periodístico independiente de Panamá, Concolón cerrará este lunes, 19 de octubre, la convocatoria de formación teórico-práctica virtual denominada Pensar el futuro/Contar Panamá, para avi",16-10-2020 21:46,https://www.bing.com/th?id=OVFT.r1twTPBefVdVeZrr9oQsfi,Panamá,laestrella.com.pa
Panamá crea programa de residencia permanente para atraer inversión foránea,https://lagacetadepanama.com/panama-crea-programa-de-residencia-permanente-para-atraer-inversion-foranea/,"Panamá creó el llamado «programa de residencia permanente por razones económicas para inversionistas calificados» para atraer inversión extranjera e incentivar economía, que este año se derrumbará al",16-10-2020 21:57,https://www.bing.com/th?id=OVFT.NN8TdktoV-vdXLRX6fPeby,Panamá,La Gaceta de Panama
Panamá registra 17 nuevas muertes a causa de la COVID-19 y 615 nuevos contagios,https://www.telemetro.com/nacionales/2020/10/16/panama-registra-17-nuevas-muertes-a-causa-de-la-covid-19-y-615-nuevos-contagios/3354319.html,"El Ministerio de Salud (Minsa) informó que para este viernes 16 de octubre en Panamá se contabilizan 17 nuevas defunciones a causa de la COVID-19, elevando a 2,546 la cifra total de fallecimientos, co",16-10-2020 22:48,https://www.bing.com/th?id=OVFT.mkGktu6rfV7kUGOUw814Dy,Panamá,Telemetro
"Panamá mantiene 21,666 casos activos de Covid-19",https://ensegundos.com.pa/2020/10/16/panama-mantiene-21666-casos-activos-de-covid-19/,"Los hospitalizados suman 778 y de ellos 662 se encuentran en sala y 116 en UCI. Elo Ministerio de Salud (Minsa), informó que este viernes 16 de octubre, en Panamá, se contabilizan 99,286 pacientes rec",16-10-2020 22:58,https://www.bing.com/th?id=OVFT.0JRG72d69F3CNrT2sgKwCi,Panamá,En Segundos
Panamá reporta 17 defunciones y 615 casos positivos de COVID-19,https://www.critica.com.pa/nacional/panama-reporta-17-defunciones-y-615-casos-positivos-de-covid-19-590213,"El Ministerio de Salud reporta hoy, 17 nuevas defunciones, que totalizan 2,546 acumuladas mientras que el número de casos positivos nuevos de COVID-19 alcanzan los 17,  para un total acumulado de 123,",16-10-2020 23:11,https://www.bing.com/th?id=OVFT.DE0KV5Ekf3pVOGZ4bbKeii,Panamá,Critica
Se registran 17 nuevas defunciones a causa de la Covid-19 y 615 casos nuevos,https://www.prensa.com/sociedad/se-registran-17-nuevas-defunciones-a-causa-de-la-covid-19-y-615-casos-nuevos/,"El Ministerio de Salud (Minsa) informó este viernes, 16 de octubre, que en las últimas horas se han registrado 17 nuevas defunciones a causa de la Covid-19 y 615 casos confirmados para la",16-10-2020 23:14,https://www.bing.com/th?id=OVFT.WZh8C3t5vSCG4A11a0tTwi,Panamá,prensa.com
Covid-19 en Panamá registra 17 defunciones en las últimas 24 horas,https://www.laestrella.com.pa/nacional/201016/covid-19-panama-registra-17-defunciones-ultimas-24-horas,"Las autoridades de salud han reportado 2,546 fallecidos por el virus y 123,498 casos acumulados. Hasta este miércoles se aplicaron 6,472 pruebas, para un porcentaje de positividad de 9.5%",16-10-2020 23:18,https://www.bing.com/th?id=OVFT.wAHkgN9ZERzSVZU05lEjKi,Panamá,laestrella.com.pa
Panamá detecta 615 casos nuevos y 17 decesos por la COVID-19 en las últimas 24 horas,https://www.tvn-2.com/nacionales/Panama-detecta-decesos-COVID-19-ultimas_0_5694930531.html,El Sistema de Vigilancia Epidemiológica de Panamá contabilizó 17 defunciones y 615 nuevos contagios por la COVID-19.,16-10-2020 23:30,https://www.bing.com/th?id=OVFT.JKlbnFmcBpYR_XPyrqz_tS,Panamá,TVN
Patricia Navidad asegura que la vacuna de la COVID-19 tiene nanotecnología para controlar a los seres humanos,https://www.panamaamerica.com.pa/variedades/patricia-navidad-asegura-que-vacuna-covid-19-tiene-nanotecnologia-controlar-seres-humanos,¡Ay madre! Nuevamente la actriz Patricia Navidad hace de la suyas en las redes sociales e insiste en difundir sus teorías conspirativas que supuestamente ponen en riesgo la supervivencia de la humanid,17-10-2020 00:19,https://www.bing.com/th?id=OVFT.M9YgV1grQ7TBdLIFZNYIVS,Panamá,panamaamerica.com.pa
