name,url,description,datePublished,imagen,pais,Fuente
"CSS registra aumento gradual de casos Covid-19, mantienen capacidad hospitalaria",https://www.radiopanama.com.pa/noticias/actualidad/css-registra-aumento-gradual-de-casos-covid19-mantienen-capacidad-hospitalaria/20210610/nota/4142171.aspx,"Las autoridades de salud hacen un llamado a no bajar la guardia y mantener todas las medidas de bioseguridad recomendadas por las entidades de salud, ya que el Covid-19 no se ha ido",10-06-2021 20:47,https://www.bing.com/th?id=OVFT.U5aKDYpkHePXVNpXvKWW7y,Panamá,Radio Panamá
Panamá expone sus ventajas como Hub de Manufactura y Logística,https://elcapitalfinanciero.com/panama-expone-sus-ventajas-como-hub-de-manufactura-y-logistica/,"La logística de clase mundial panameña, las zonas económicas especiales y el nuevo marco legal enfocado en la manufactura y sus servicios relacionados, brindan una gran oportunidad para que las empres",17-06-2021 21:45,https://www.bing.com/th?id=OVFT.SCrJnOFXc_ArnJpcR2FgRy,Panamá,El Capital Financiero
Panamá llega a 391.190 casos de la covid-19 y 6.458 defunciones,https://www.msn.com/es-us/noticias/mundo/panam%C3%A1-llega-a-391190-casos-de-la-covid-19-y-6458-defunciones/ar-AAL9Y2P,"El Ministerio de Salud de Panamá (Minsa) informó este jueves de 969 nuevos casos de la covid-19 y un deceso por la enfermedad, que hacen un total de 391.190 contagios confirmados y 6.458 defunciones e",18-06-2021 01:30,https://www.bing.com/th?id=OVFT.jIcFvtj4xYKz0enPbZtxGi,Panamá,MSN
Panamá acumula 393.144 casos de la covid y 6.468 casos de la enfermedad,https://www.msn.com/es-us/noticias/mundo/panam%C3%A1-acumula-393144-casos-de-la-covid-y-6468-casos-de-la-enfermedad/ar-AALe6Fq,"Las autoridades sanitarias de Panamá reportaron este sábado 978 nuevos casos y 3 muertes por la covid-19, que elevaron a 393.144 los contagios confirmados y a 6.468 las defunciones en más de 15 meses",20-06-2021 00:02,https://www.bing.com/th?id=OVFT.1PfIFSWG1GWJsQsuGhoYly,Panamá,MSN
Panamá registra 978 casos nuevos de covid-19 y dos defunciones,http://elsiglo.com.pa/panama/panama-registra-978-casos-nuevos-covid-19-defunciones/24180115,"Hoy se contabilizaron 376,215 pacientes recuperados y 978 casos positivos nuevos, para un total acumulado de 393,144",20-06-2021 00:54,https://www.bing.com/th?id=OVFT.dL-YFIFVfvly73xc-rMy-S,Panamá,El Siglo
"Magnetismo, la nueva mentira sobre las vacunas de Covid-19",https://www.prensa.com/impresa/panorama/magnetismo-la-nueva-mentira-sobre-las-vacunas-de-covid-19/,"Desde que se desarrollaron las primeras vacunas contra la enfermedad Covid-19 y empezó la campaña de vacunación en Panamá y varios países del mundo, las historias y mentiras que han surgido alrededor",20-06-2021 02:08,https://www.bing.com/th?id=OVFT.SWyp8ZPvbXJhmtWTXjNPTC,Panamá,prensa.com
Alcalde de Aguadulce es trasladado a Panamá tras contraer Covid-19,https://nexpanama.com/alcalde-de-aguadulce-es-trasladado-a-la-ciudad-de-panama-tras-contraer-covid-19/,"El alcalde de Aguadulce, Jorge Herrera fue trasladado la tarde de este viernes del Hospital Rafael Estévez a la ciudad capital, tras padecer de covid-19 En su cuenta de Facebook, ya la máxima autorida",20-06-2021 02:10,https://www.bing.com/th?id=OVFT.UPLPkGPfGmPHD_av1BKTby,Panamá,NEX TV
Aumentan hospitalizados en salas y UCI por Covid,https://www.critica.com.pa/nacional/aumentan-hospitalizados-en-salas-y-uci-por-covid-606342,Panamá registró ayer 978 nuevos casos de Covid-19 y refleja un incremento paulatino de pacientes hospitalizados en salas (489) y en las unidades de cuidados,20-06-2021 03:20,https://www.bing.com/th?id=OVFT.xzm4ACpL5MZtviDTP3JF2y,Panamá,Critica
"Argentina afirma que tiene un plan económico, pero a Washington no le conviene",https://noticias24pty.com/argentina-afirma-que-tiene-un-plan-economico-pero-a-washington-no-le-conviene/,"19 junio, 2021 admin Comentarios desactivados en Panamá registra dos nuevas defunciones por covid-19 y 978 nuevos contagios",20-06-2021 04:42,https://www.bing.com/th?id=OVFT.jLkLVia8dHw2Xeh1IXNGki,Panamá,Noticias 24 PTY
Centro de vacunación en Westland Mall seguirá operando,https://www.metrolibre.com/nacionales/205291-centro-de-vacunaci%C3%B3n-en-westland-mall-seguir%C3%A1-operando.html,"La Caja de Seguro Social (CSS) informó que mantendrá abierto al público el centro de vacunación ubicado en Westland Mall, en horario de 7:00 a.m. a 1:00 p.m., de lunes a viernes. Detallan que “aquella",20-06-2021 11:05,https://www.bing.com/th?id=OVFT.pfLW0xGVJpRMHGu3pEMjrS,Panamá,Metro Libre
"Nuestra Natación, (FPN). Ausente en el 32°, (CCCAN), Puerto Rico, 2021",https://www.laestrella.com.pa/deportes/cocteldeportivo/210620/x-x-x-nuestra-natacion-fpn-ausente-32-cccan-puerto-rico-2021,"para preparar atletas, e ir a los 32° ‘JO’. SUMARIO: El ‘Cacique’ H. Brands lo negó, pero lo aprobó al Mitómano C. Amado Varela. En el contenido di a conocer todos los detalles. Dando un mirada a las",20-06-2021 13:49,https://www.bing.com/th?id=OVFT.df3Hbt7wA5GR76g61G9QWi,Panamá,laestrella.com.pa
Entérese en qué lugares se ampliará el toque de queda a partir de mañana,https://www.tvn-2.com/nacionales/Enterese-lugares-ampliara-partir-manana_0_5880161932.html,"Este lunes 21 junio se amplía el toque de queda en varios corregimientos y distritos de Panamá, Panamá Oeste, Herrera, Los Santos y Colón desde las 10:00 pm hasta las 4:00 am como parte de las medidas",20-06-2021 14:33,https://www.bing.com/th?id=OVFT.C0jvKvCfSMB9mCAgyvZqQS,Panamá,TVN
Autoridades en Herrera afinan estrategias ante aumento de contagios de covid-19,https://noticias24pty.com/autoridades-en-herrera-afinan-estrategias-ante-aumento-de-contagios-de-covid-19/,"En medio de un aumento de casos en la región de Azuero, las autoridades de la provincia de Herrera buscan alternativas para frenar la ola de casos que tiene la provincia, que a la fecha alcanzan",20-06-2021 14:35,https://www.bing.com/th?id=OVFT.oQAnaheDskoZhoNuUikPES,Panamá,Noticias 24 PTY
"India baja de 60,000 contagios diarios por covid-19 por primera vez en tres meses",https://www.panamaamerica.com.pa/mundo/india-baja-de-60000-contagios-diarios-por-covid-19-por-primera-vez-en-tres-meses-1189351,"La India registró este domingo algo menos de 60,000 infecciones por coronavirus por primera vez en tres meses, tras sufrir una virulenta segunda ola que colapsó el sector sanitario y causó falta de ca",20-06-2021 14:44,https://www.bing.com/th?id=OVFT.CEEJPhUa46ZfqWcqiwKEoS,Panamá,panamaamerica.com.pa
"Tercera ola de contagios, constituyente y corrupción: este es el relato de la última semana en Panamá",https://www.tvn-2.com/radar/Tercera-contagios-constituyente-corrupcion-Panama_0_5879412042.html,"Con varios días rondando o superando los mil casos diarios, para el infectólogo Xavier Sáez Llorens es un hecho que el país está ya en la tercera ola de covid-19. La pregunta clave es: ¿será la cuaren",20-06-2021 15:56,https://www.bing.com/th?id=OVFT.4l6gJCaSc76a-V6xj3-AAy,Panamá,TVN
Epidemiólogo señala estrategias que podrían incentivar la vacunación contra COVID-19,https://www.telemetro.com/nacionales/epidemiologo-senala-estrategias-que-podrian-incentivar-la-vacunacion-contra-covid-19-n5245564,"""Si tu traes la tarjeta de vacunación te regalan una cerveza de tipo artesanal en el Casco Viejo y en otros restaurantes"", señaló el epidemiólogo Rebollón.",20-06-2021 16:31,https://www.bing.com/th?id=OVFT.UouHKpI_IXDE6HnLr-6pgy,Panamá,Telemetro
Nuevos puestos de vacunación AstraZeneca en Chiriquí,https://ensegundos.com.pa/2021/06/20/nuevos-puestos-de-vacunacion-astrazeneca-en-chiriqui/,"Equipo Panavac-19 busca mitigar la pandemia del coronavirus Covid-19. El Ministerio de Salud (MINSA) a través de la regional de Chiriquí, anunció a la ciudadanía la ubicación de nuevos puestos de vacu",20-06-2021 17:57,https://www.bing.com/th?id=OVFT.KruSbSuCwYNB56btvAjKSy,Panamá,En Segundos
Panamá registra 583 casos nuevos de coronavirus,https://www.metrolibre.com/nacionales/205346-panam%C3%A1-registra-583-casos-nuevos-de-coronavirus-%C2%A0.html,"El Ministerio de Salud (Minsa) informó que para de hoy en Panamá se contabilizan 583 casos positivos nuevos, para un total acumulado de 393,727. De acuerdo al informe oficial, a la fecha se aplicaron",20-06-2021 18:10,https://www.bing.com/th?id=OVFT.gWsP780cZENVPbWs0zogNy,Panamá,Metro Libre
Implementan estrategias para ampliar capacidad hospitalaria en Herrera por Covid,https://www.critica.com.pa/nacional/implementan-estrategias-para-ampliar-capacidad-hospitalaria-en-herrera-por-covid-606366,"El principal centro de atención para las personas contagiadas es el hospital Gustavo Nelson Collado, ubicado en Chitré, el cual cuenta con la Unidad de Cuidados Intensivos, así como la de Cuidados Res",20-06-2021 18:45,https://www.bing.com/th?id=OVFT.-QryE-oaNhEbvPUsGirUGi,Panamá,Critica
Ojo. Desde este domingo y lunes comienzan a regir nuevos toques de queda en varias regiones del país,https://www.midiario.com/salud/ojo-desde-este-domingo-y-lunes-comienzan-a-regir-nuevos-toques-de-queda-en-varias-regiones-del-pais/,"El ministro de Salud, Luis Francisco Sucre, ha alertado de que el 90 % de los nuevos casos de la covid-19 en Panamá se dan en reuniones familiares y de amigos, por lo que pidió a la población actuar d",20-06-2021 20:20,https://www.bing.com/th?id=OVFT.wdYE9EcK7V4XC3zjIJwSgC,Panamá,Mi Diario
Panamá entre los países latinos con parte de sus escuelas abiertas; Meduca,https://elcapitalfinanciero.com/panama-entre-los-paises-latinos-con-parte-de-sus-escuelas-abiertas-meduca/,"Un informe preparado por el Fondo de las Naciones Unidas para la Infancia (Unicef), elaborado con base en  información estadística recibida por las oficinas de cada nación de América Latina, señala qu",20-06-2021 20:32,https://www.bing.com/th?id=OVFT.EAmbvjKpWjutvCZ66x4NHS,Panamá,El Capital Financiero
"Covid-19 deja seis nuevas defunciones en el país; los casos activos totalizan 10,491",https://www.prensa.com/sociedad/covid-19-deja-seis-nuevas-defunciones-en-el-pais-los-casos-activos-totalizan-10491/,El informe epidemiológico del Ministerio de Salud (Minsa) destacó este domingo 20 de junio que en las últimas 24 horas se han registrado 6 nuevas defunciones debido a la,20-06-2021 22:07,https://www.bing.com/th?id=OVFT.LMdd7LMbTie12QFIcrxGiC,Panamá,prensa.com
"Panamá acumula 393,727 contagios por COVID-19, hay 10,491 casos activos",https://www.telemetro.com/nacionales/panama-acumula-393727-contagios-covid-19-hay-10491-casos-activos-n5245825,"De acuerdo con el informe epidemiológico del Minsa, a la fecha se aplicaron 7,997 pruebas, para un porcentaje de positividad de 7.3%.",20-06-2021 22:33,https://www.bing.com/th?id=OVFT.ELZDsV2Ji_hHnqSAtqOCPy,Panamá,Telemetro
Panamá reporta 583 casos positivos y 6 nuevas defunciones por Covid-19,https://www.radiopanama.com.pa/noticias/actualidad/panama-reporta-583-casos-positivos-y-6-nuevas-defunciones-por-covid19/20210620/nota/4144792.aspx,"La cifra de contagios en Panamá registra para este domingo 20 de junio, 583 casos positivos nuevos, para un total acumulado de 393,727. Para la fecha se contabilizan 376,761 pacientes recuperados, se",20-06-2021 23:20,https://www.bing.com/th?id=OVFT.U5aKDYpkHePXVNpXvKWW7y,Panamá,Radio Panamá
Covid-19 en Panamá: 583 casos positivos nuevos y seis nuevas defunciones en las últimas 24 horas,https://www.midiario.com/salud/covid-19-en-panama-583-casos-positivos-nuevos-y-seis-nuevas-defunciones-en-las-ultimas-24-horas/,"El Ministerio de Salud (Minsa) informó que para este domingo, 20 de junio, Panamá alcanzó los 393 mil 727 casos acumulados de coronavirus, tras registrar un total de 583 nuevos",20-06-2021 23:29,https://www.bing.com/th?id=OVFT.AooaD_-ZbgHftXxCICS6Iy,Panamá,Mi Diario
"Casos activos de covid-19 se incrementan a 10,491 en Panamá; el país registra 6 nuevos fallecimientos",https://www.laestrella.com.pa/nacional/210620/casos-activos-covid-19-incrementan-10-491-panama-pais-registra-6-nuevos-fallecimientos,"Para este domingo en Panamá se contabilizan 376,761 pacientes recuperados, 583 casos positivos nuevos, para un total acumulado de 393,727",20-06-2021 23:44,https://www.bing.com/th?id=OVFT.tG38LbpBvsK64mo9d00pLy,Panamá,laestrella.com.pa
"El COVID-19 no da tregua, seis defunciones en las últimas 24 horas",https://www.diaadia.com.pa/el-pais/el-covid-19-no-da-tregua-seis-defunciones-en-las-ultimas-24-horas-735348,"El Departamento de Epidemiología del Ministerio de Salud (Minsa) informa, que se han detectado 1,565 pasajeros positivos con COVID-19 en el Aeropuerto Internacional de Tocumen. Según el reporte, desde",20-06-2021 23:51,https://www.bing.com/th?id=OVFT.mqJfawnYdDZs-_8799p_Ny,Panamá,Día a Día
Panamá registra 583 casos nuevos de covid-19 y 6 defunciones,http://elsiglo.com.pa/panama/panama-registra-583-casos-nuevos-covid-19-6-defunciones/24180164,"Panamá registró, en las últimas 24 horas, 6 nuevas defunciones y 1 de días anteriores por la covid-19, con lo que totalizan 6,475 muertes acumuladas desde el inicio de la pandemia.",20-06-2021 23:53,https://www.bing.com/th?id=OVFT.NULXht4mzrcbHOSS2iW_ty,Panamá,El Siglo
"Panamá alcanza los 10,491 casos activos de coronavirus",https://www.panamaamerica.com.pa/sociedad/panama-alcanza-los-10491-casos-activos-de-coronavirus-1189371,"El Ministerio de Salud (Minsa) informó este domingo de 10,491 casos activos de coronavirus en Panamá.La estadística revela un aumento respecto a los casos activos anunciados ayer, sábado, cuando se no",20-06-2021 23:58,https://www.bing.com/th?id=OVFT.vRM_CxGC0ipx2rqEZDl_EC,Panamá,panamaamerica.com.pa
Fallecen dos privados de libertad en el Hospital Santo Tomás,https://ensegundos.com.pa/2021/06/20/fallecen-dos-privados-de-libertad-en-el-hospital-santo-tomas/,"Ambos cumplían condena por el delito contra la seguridad colectiva. La Dirección General del Sistema Penitenciario (DGSP), informó esta tarde el fallecimiento de dos privados de libertad del centro pe",21-06-2021 01:10,https://www.bing.com/th?id=OVFT.x_EtV3N-sfiuH8yyKqQC0i,Panamá,En Segundos
