name,url,description,datePublished,imagen,pais,Fuente
Botadera en Medcom y en TVN Media tras la crisis por COVID-19,https://noticias24pty.com/botadera-en-medcom-y-en-tvn-media-tras-la-crisis-por-covid-19/,"Uno de los primeros en pronunciarse y pedir explicación fue el Colegio Nacional de Periodistas (Conape), que en su cuenta de Twitter solicitó información.  Según TVN Media, “la reestructuración y cons",04-07-2020 05:46,https://www.bing.com/th?id=ON.52D4BCB9695242D64A4CF54BBD5C1578,Panamá,Noticias 24 PTY
Nuevo récord: 31 muertos,https://www.critica.com.pa/nacional/nuevo-record-31-muertos-582644,"Además para controlar que estos pacientes no incumplan con su cuarentena, se ha ingresado al sistema Paco, manejado por la Policía Nacional, las cédulas de cada uno de los ciudadanos que se mantienen activos con COVID-19. Los contactos como los ...",04-07-2020 11:15,https://www.bing.com/th?id=ON.1B7671DDCF68C9A608D25AF01265B191,Panamá,Critica
"Actinio, la sala virtual que busca generar nuevas experiencias en el teatro",https://www.telemetro.com/cultura/2020/07/04/actinio-la-sala-virtual-que-busca-generar-nuevas-experiencias-en-la-sala-de-tu-casa/3011457.html,"El sector cultural continúa reinventándose ante la crisis mundial causada por el COVID 19, y Panamá no es la excepción. La compañía de teatro panameña PROYECTO ACTINIO, creada en el 2015, presenta una",04-07-2020 13:17,https://www.bing.com/th?id=ON.74D81222EE95C426C639D68D83609735,Panamá,Telemetro
Panamá Este activa Centro de Operaciones para Trazabilidad Comunitaria COVID-19,https://ensegundos.com.pa/2020/07/04/panama-este-activa-centro-de-operaciones-para-trazabilidad-comunitaria-covid-19/,"Esta estrategia busca detectar, encontrar, aislar, y dar seguimiento a los casos detectados por COVID-19 y todos sus contactos. Se fortalecen las estrategias interinstitucionales ante el COVID-19 en P",04-07-2020 14:34,https://www.bing.com/th?id=ON.7274BAA2549352424F71C9FE9E8CDF14,Panamá,En Segundos
Autoridades analizarán la reapertura de restaurantes y proyectos de construcción en Los Santos,https://www.tvn-2.com/nacionales/Autoridades-analizaran-restaurantes-construccion-Santos_0_5616188421.html,"El ministro de Salud, Luis Francisco Sucre señaló este viernes 3 de julio en medio de la conferencia sobre la situación del COVID-19 en Panamá, que una comisión estará viajando a la provincia de Los S",04-07-2020 14:37,https://www.bing.com/th?id=ON.4C9902BCC236F6B4F7A4A211AFCF3F9C,Panamá,TVN
"Siete estados de EEUU registran récords de casos de COVID, Miami ordena el toque de queda",http://www.nexpanama.com/siete-estados-de-eeuu-registran-records-de-casos-de-covid-miami-ordena-el-toque-de-queda/,"Alabama y otros seis estados de EEUU registraron un aumento récord de casos de coronavirus el viernes, cuando el condado más poblado de Florida impuso un toque de queda antes del fin de semana del Día",04-07-2020 15:17,https://www.bing.com/th?id=ON.B23904C4856B9232996BB8F4CB24AB01,Panamá,NEX TV
Pandemia de COVID-19 en Panamá está en fase crítica; y epecialistas pronostican que situación empeorará,https://www.panamaamerica.com.pa/sociedad/pandemia-de-covid-19-en-panama-esta-en-fase-critica-y-epecialistas-pronostican-que,"El Consejo Consultivo Presidencial de Salud mediante un comunicado a la nación dejó claro que la situación de la COVID-19 en este país centroamericano está en la fase 4, que es la más avanzada de la p",04-07-2020 15:32,https://www.bing.com/th?id=ON.BE901D7D1E7B588AC7F9123734441891,Panamá,panamaamerica.com.pa
La Covid-19 está cerca de sobrepasar al gran complejo hospitalario de Houston,https://www.prensa.com/mundo/la-covid-19-esta-cerca-de-sobrepasar-al-gran-complejo-hospitalario-de-houston/,"Pese a ufanarse por concentrar la mayor cantidad de hospitales y centros de investigación del mundo, Houston está peligrosamente cerca de quedar desbordada por la el avance del coronavirus en Texas. D",04-07-2020 16:31,https://www.bing.com/th?id=ON.8554AD570D19B1F448BDE5A899BDD01C,Panamá,prensa.com
El Covid-19 arrebata la vida de 31 panameños en las últimas horas,https://ensegundos.com.pa/2020/07/03/el-covid-19-le-arrebata-la-vida-a-otros-31-panamenos-la-cifra-mas-alta-en-un-dia/,"El mortal virus ha acabado en Panamá con la vida de 698 connacionales. Se contabilizan 35,995 contagios. Para hoy jueves 2 de julio de 2020, el Ministerio de Salud informó se contabilizan 16,945 pacie",04-07-2020 17:19,https://www.bing.com/th?id=ON.0E77A23A8D663FF2172033F5989D76AE,Panamá,En Segundos
La SENACYT apoya a proyectos que ayuden en la lucha contra el Covid-19,https://www.metrolibre.com/nacionales/175771-la-senacyt-apoya-proyectos-que-ayuden-en-la-lucha-contra-el-covid-19.html,"La Secretaría Nacional de Ciencia, Tecnología e Innovación (SENACYT) informó que, durante su primer año de gestión, ha apoyado a 32 investigadores destacados del SNI a la respuesta ante el COVID-19. T",04-07-2020 17:21,https://www.bing.com/th?id=ON.F5EBA299D6A6F9F7D3A9966046485E8D,Panamá,Metro Libre
Consejo Consultivo advierte de aumento de la mortalidad por COVID-19 y riesgo de descontrol social,https://www.tvn-2.com/nacionales/Coronavirus-en-Panama-Consejo-Consultivo-mortalidad-COVID-19-descontrol-pandemia_0_5616938270.html,"Destacaron que la pandemia en Panamá está en la fase 4, que es la más avanzada, según la Organización Mundial de la Salud (OMS), y dentro de lo que se contempla, la transmisión comunitaria a un alto n",04-07-2020 17:30,https://www.bing.com/th?id=ON.F30AAABD27794ED6948C42DED35192CA,Panamá,TVN
Panamá: Cifra récord de 31 muertes en 24 horas por Covid-19,https://www.metrolibre.com/nacionales/175731-panam%C3%A1-cifra-r%C3%A9cord-de-31-muertes-en-24-horas-por-covid-19.html,"El Ministerio de Salud de Panamá (Minsa) informó que para este viernes, 3 de julio, se registran 758 nuevos contagios de coronavirus, elevando el número total de casos en el país 35,995. Asimismo para",04-07-2020 17:38,https://www.bing.com/th?id=ON.5128019E4FAAA3AE3651D789999DF836,Panamá,Metro Libre
Primer grupo de nicaragüenses viajan con rumbo a su país,https://www.critica.com.pa/provincias/primer-grupo-de-nicaraguenses-viajan-con-rumbo-su-pais-582668,"El primer grupo de nicaragüenses que estaban varados en Panamá, salieron hoy, sábado, de Paso Canoas, provincia de Chiriquí, con destino hacia su país. ""Queremos agradecer a las autoridades panameñas",04-07-2020 17:47,https://www.bing.com/th?id=ON.9BA73D125F256146BA9F6C417B767C7F,Panamá,Critica
Panamá participa en el Ccva para elaborar Plan de Recuperación post COVID-19,https://elcapitalfinanciero.com/panama-participa-en-el-ccva-para-elaborar-plan-de-recuperacion-post-covid-19/,"Durante la reunión ordinaria número 41 del Consejo Centroamericano de Vivienda y Asentamientos Humanos (Ccva), se elaboró el Plan de Recuperación Social y Resiliencia del Sistema de Integración Centro",04-07-2020 19:18,https://www.bing.com/th?id=ON.BBB6B3C2CD0C5A4AB25A1B915E0107F5,Panamá,El Capital Financiero
Sale de Panamá primer grupo de nicaragüenses tras autorización de Managua,https://www.telemetro.com/nacionales/2020/07/04/sale-de-panama-primer-grupo-de-nicaragueenses-tras-autorizacion-de-managua/3013163.html,Un total de 1.180 nicaragüenses que se quedaron sin medios de vida en Panamá por la crisis provocada por la COVID-19 llegaron el miércoles a la principal estación de autobuses de la capital para regre,04-07-2020 19:28,https://www.bing.com/th?id=ON.2BF9116530339013F5F3301F202864B5,Panamá,Telemetro
Pandemia de COVID-19 en Panamá está en fase crítica; y especialistas pronostican que situación empeorará,https://www.panamaamerica.com.pa/sociedad/pandemia-de-covid-19-en-panama-esta-en-fase-critica-y-especialistas-pronostican-que,"El Consejo Consultivo Presidencial de Salud mediante un comunicado a la nación dejó claro que la situación de la COVID-19 en este país centroamericano está en la fase 4, que es la más avanzada de la p",04-07-2020 19:31,https://www.bing.com/th?id=ON.BE901D7D1E7B588AC7F9123734441891,Panamá,panamaamerica.com.pa
"Entregan préstamos, un millón de dólares para productores de Coclé y Los Santos",https://www.diaadia.com.pa/el-pais/entregan-prestamos-un-millon-de-dolares-para-productores-de-cocle-y-los-santos-368011,Por un monto de un millón de dólares el Ministerio de Desarrollo Agropecuario (MIDA) y el Banco de Desarrollo Agropecuario (BDA) entregó préstamos a productores de Coclé y Los Santos del Plan Panamá A,04-07-2020 19:33,https://www.bing.com/th?id=ON.51CF8B2936A225666D5E6DD61644E8A5,Panamá,Día a Día
"Mitradel: ""Más de 800 trabajadores están capacitados para enfrentar el covid-19""",http://elsiglo.com.pa/panama/mitradel-800-trabajadores-estan-capacitados-para-enfrentar-covid-19/24159781,"Del 15 de junio al 2 de julio fueron capacitados 820 personas de los cuales el 96%, son trabajadores y administradores de empresas privadas  El director del Instituto Panameño de Estudios Laborales (I",04-07-2020 19:51,https://www.bing.com/th?id=ON.B1E37BBF22181BC779592358CD3BA850,Panamá,El Siglo
Porcinocultores reciben 600 mil dólares por venta de cerdos,https://noticias24pty.com/porcinocultores-reciben-600-mil-dolares-por-venta-de-cerdos/,"Porcinocultores de las provincias de Los Santos, Colón, Panamá y Panamá Oeste recibieron el primer pago en concepto de la venta de 2,232 cerdos para el Plan Panamá Solidario, así lo informó el ministr",04-07-2020 20:07,https://www.bing.com/th?id=ON.6D97335AE65476D357BF423CCFCB1F0C,Panamá,Noticias 24 PTY
Estrategia de salud apunta a instalar camas en Centros de Convenciones,https://www.radiopanama.com.pa/noticias/actualidad/estrategia-de-salud-apunta-a-instalar-camas-en-centros-de-convenciones/20200704/nota/4052112.aspx,El Ministerio de Salud aplicará multas y suspenderá vale digital a personas con COVID-19 positivo. Las autoridades anunciaron también que habilitarán camas fuera de los hospitales. Laritza De León con,04-07-2020 21:01,https://www.bing.com/th?id=ON.7D78B3FEAE78D8AC05601605E2D2BC64,Panamá,Radio Panamá
Comunidades de la Región de Salud en Panamá Este mantienen más de 200 casos activos de COVID-19,https://www.radiopanama.com.pa/noticias/actualidad/comunidades-de-la-region-de-salud-en-panama-este-mantienen-mas-de-200-casos-activos-de-covid19/20200704/nota/4052109.aspx,Las autoridades de salud en Panamá Este mantienen un patrullaje mixto con funcionarios de diversas instituciones para ubicar la mayor cantidad posible de casos de COVID-19 y brindarles la asistencia n,04-07-2020 21:01,https://www.bing.com/th?id=ON.7D78B3FEAE78D8AC05601605E2D2BC64,Panamá,Radio Panamá
El IPHE elaboró cuadernillos con orientación para los padres,http://elsiglo.com.pa/panama/prueba/24159776,"Ante la situación mundial de la pandemia debido a la propagación del virus covid-19, el Instituto Panameño de Habilitación Especial (IPHE), informó que ha garantizado el funcionamiento institucional,",04-07-2020 21:11,https://www.bing.com/th?id=ON.A06D9510A62F6FE020B55329AC30F6D8,Panamá,El Siglo
"Raúl Vega, Melquiades Vásquez y José Iván Ramos fuera Telemetro Reporta",https://www.diaadia.com.pa/fama/raul-vega-melquiades-vasquez-y-jose-ivan-ramos-fuera-telemetro-reporta-368014,El COVID-19 sigue haciendo estrago en el mundo y Panamá no escapa de la situación. La salud y la economía son las áreas más afectadas. El desempleo aumenta y lastimosamente no se ve una mejoría a la s,04-07-2020 21:21,https://www.bing.com/th?id=ON.2BDDD0CC939129E0F5DB9F243C2E69AF,Panamá,Día a Día
