name,url,description,datePublished,imagen,pais,Fuente
Rodrigo Vigil tendrá una Serie del Caribe muy especial,https://www.diaadia.com.pa/deportes/rodrigo-vigil-tendra-una-serie-del-caribe-muy-especial-374882,"El receptor panameño, Rodrigo Vigil vivirá momentos especiales cuando inicie la Serie del Caribe, ya que tendrá que enfrentar a las Águilas Cibaeñas, equipo que representará a República Dominica",27-01-2021 16:43,https://www.bing.com/th?id=OVFT.1EWVvTB-Z3sO2chEecfYki,Panamá,Día a Día
Panamá recibirá segundo lote de vacunas a partir del 15 de febrero,http://elsiglo.com.pa/panama/panama-recibira-segundo-lote-vacunas-partir-15-febrero/24171967,"Panamá recibió un primer lote con 12,840 dosis de la vacuna de Pfizer el pasado 20 de enero Este viernes la ministra de Relaciones Exteriores de Panamá, Erika Mouynes anunció que nuestro país recibirá",29-01-2021 22:38,https://www.bing.com/th?id=OVFT.TFU_3iFAfYeLgnkto4KNLS,Panamá,El Siglo
"En diciembre, el índice de precios de consumo Covid-19 reflejó leve descenso",https://www.laestrella.com.pa/nacional/210129/diciembre-indice-precios-consumo-covid-19-reflejo-leve-descenso,"El grupo de medicamentos creció en 2.8, principalmente por el incremento en 3.0% de los medicamentos para la fiebre en niños",29-01-2021 22:45,https://www.bing.com/th?id=OVFT.yQis04VvLnYXu7Ve4uTjhi,Panamá,laestrella.com.pa
"Panamá registra 1,445 nuevos casos de COVID-19 y los contagios acumulados ascienden a 318,253",https://www.telemetro.com/nacionales/2021/01/29/panama-registra-nuevos-casos-covid/3693106.html,"El informe epidemiológico del Ministerio de Salud de Panamá (Minsa) destacó este viernes 29 de enero que se registraron 1,445 nuevos casos de coronavirus, lo que hizo elevar a 318,253 los contagios ac",29-01-2021 23:19,https://www.bing.com/th?id=OVFT.fZStrj77KyWgln04R6nPJy,Panamá,Telemetro
"Canó, Guzmán y Martínez lideran equipo dominicano que va a Serie del Caribe",https://www.tvmax-9.com/beisbol/Cano-Guzman-Martinez-Serie-Caribe_0_5773672657.html,"El segunda base Robinson Canó, el inicialista Ronald Guzmán y el lanzador Carlos 'Tsunami' Martínez, jugadores de Grandes Ligas, encabezan el equipo de las Águilas Cibaeñas que defenderá los colores d",29-01-2021 23:21,https://www.bing.com/th?id=OVFT.MsyGJ9bP4WrPntE5N8gt_y,Panamá,TVMAX
"Panamá contabiliza 24 defunciones y 1,445 casos positivos nuevos por la COVID-19",https://www.tvn-2.com/nacionales/Panama-contabiliza-defunciones-positivos-COVID-19_0_5773672604.html,"Un total de 24 defunciones y 1,445 casos positivos nuevos por la COVID-19 fueron confirmados este viernes 29 de enero en Panamá.",29-01-2021 23:33,https://www.bing.com/th?id=OVFT.L6xb-eBdJgeMgTZkmI3XBS,Panamá,TVN
Three restaurants fined for flouting decree,https://www.newsroompanama.com/news/three-restaurants-fined-for-flouting-decree-1,"Three restaurants including repeat offender La Fragata, have been sanctioned for failing to comply with the restrictions to prevent the spread of Covid-19. Met",29-01-2021 23:37,https://www.bing.com/th?id=OVFT.IvOpVXHBV1VHW2JTHZqcDC,Panamá,Newsroom Panama
Mejora. Siguen decreciendo los casos activos de covid-19 en Panamá,https://www.midiario.com/nacionales/mejora-siguen-decreciendo-los-casos-activos-de-covid-19-en-panama/,"El Ministerio de Salud (Minsa) reportó 40 mil 852 casos activos de covid-19, la cifra más baja desde el 24 de diciembre del año pasado, cuando se reportó 39 mil 914 casos en el país. Esto significa qu",29-01-2021 23:43,https://www.bing.com/th?id=OVFT.rU48xS3TPZv2KcItX0dI0S,Panamá,Mi Diario
"Panamá suma 1,445 casos de Covid-19 y 25 fallecidos",https://www.metrolibre.com/nacionales/192870-panam%C3%A1-suma-1445-casos-de-covid-19-y-25-fallecidos.html,"El Ministerio de Salud (MINSA) informó que para hoy, viernes 29 de enero 2021, en Panamá se contabilizan 1,445 casos positivos nuevos de COVID-19, para un total acumulado de 318,253. A la fecha se apl",29-01-2021 23:58,https://www.bing.com/th?id=OVFT.zgUrnPIbBK9t90CRdIwZVy,Panamá,Metro Libre
"Panamá reporta 1,445 casos positivos nuevos y 25 fallecidos por COVID-19",https://www.critica.com.pa/nacional/panama-reporta-1445-casos-positivos-nuevos-y-25-fallecidos-por-covid-19-597265,"Un total de 1,445 casos positivos nuevos de COVID-19 destacan hoy, en el informe epidemiológico del Ministerio de Salud , en el que se detalle que a la fecha el total acumulado se eleva  318,253.El nú",30-01-2021 00:06,https://www.bing.com/th?id=OVFT.uyMrJ5vuC2cnzyo38fBFQy,Panamá,Critica
"MINSA de Panamá, insta a la población, aplicarse vacunas de otras enfermedades",https://sertv.gob.pa/nacionalfm/minsa-de-panama-insta-a-la-poblacion-aplicarse-vacunas-de-otras-enfermedades/,"La coordinadora regional del Programa Ampliado de Inmunizaciones (PAI), en la provincia de Chiriquí, Lcda. Marisela Arjona, recomendó a los padres, acudir con sus hijos a sus respectivos Centros de Sa",30-01-2021 00:21,https://www.bing.com/th?id=OVFT.CmbyzaLxQHlWUgKjpr9yIy,Panamá,SERTV
Brasil registra más de mil muertes por la covid-19 por cuarto día consecutivo,https://www.panamaamerica.com.pa/mundo/brasil-registra-mas-mil-muertes-por-covid-19-por-cuarto-dia-consecutivo-1180507,"Brasil, uno de los epicentros mundiales de la pandemia, registró más de mil muertes por la covid-19 en las últimas 24 horas por cuarto día consecutivo y el total de fallecimientos sobrepasó los 222.00",30-01-2021 00:43,https://www.bing.com/th?id=OVFT.r78v-IRiBPyqezBeqAbLHS,Panamá,panamaamerica.com.pa
"Panamá registra 1,445 nuevos casos de covid-19 y 25 muertes este viernes 29 de enero",https://www.panamaamerica.com.pa/sociedad/panama-registra-1445-nuevos-casos-covid-19-25-muertes-este-viernes-29-enero-1180512,"Este viernes 29 de enero de 2021 se registran 1,445 nuevos casos de covid-19 y 25 muertes.El informe del Ministerio de Salud (Minsa) destaca que para este viernes se contabilizan 272,180 pacientes rec",30-01-2021 00:52,https://www.bing.com/th?id=OVFT.eNTqSStfTx9fTPorh-lpFi,Panamá,panamaamerica.com.pa
"Cortizo destaca combate de la pandemia y pide denunciar, con pruebas, actos de corrupción",https://www.laestrella.com.pa/nacional/210129/cortizo-destaca-combate-pandemia-pide-denunciar-pruebas-actos-corrupcion,"El presidente enfatizó que en su administración no acepta a ningún funcionario corrupto, y solicitó que quien tenga información de actos de corrupción, los denuncie con pruebas",30-01-2021 01:09,https://www.bing.com/th?id=OVFT.LYex5DkKtWrRkMHrgg55ji,Panamá,laestrella.com.pa
Segundo lote de vacunas Pfizer estará llegando a Panamá en Febrero,https://noticias24pty.com/segundo-lote-de-vacunas-pfizer-estara-llegando-a-panama-en-febrero/,El Ministerio de Salud (Minsa) confirma al país que el segundo lote de vacunas COVID-19 de la farmacéutica Pfizer estará arribando a Panamá en la semana del 15 de febrero próximo.De manera,30-01-2021 01:28,https://www.bing.com/th?id=OVFT.CrpuMEhirnGHtjb4Cz8-my,Panamá,Noticias 24 PTY
Culmina proceso de entrega de dosis contra el Covid-19 en hospitales privados,https://www.metrolibre.com/nacionales/192879-culmina-proceso-de-entrega-de-dosis-contra-el-covid-19-en-hospitales-privados.html,"La entrega de 399 dosis de vacunas para personal que trabaja en la primera línea de atención a pacientes con Covid-19 en los hospitales privados culminó esta semana, informó el Ministerio de Salud. La",30-01-2021 02:30,https://www.bing.com/th?id=OVFT.eE3drBZmUcxi2GRZ1AkvLS,Panamá,Metro Libre
Los grandes ligas Ramírez y Herrera encabezan a los Caimanes para la Serie del Caribe,https://www.tvmax-9.com/beisbol/Ramirez-Herrera-Caimanes-Serie-Caribe_0_5773672670.html,"El cartagenero Harold Ramírez, quien desde el 2019 hace parte del primer equipo de los Marlins de Florida, lleva dos años vistiendo la camiseta de los Caimanes durante la tempor",30-01-2021 02:45,https://www.bing.com/th?id=OVFT.x7d7T5s5Mm8BRcOgCrVZfC,Panamá,TVMAX
Opinión: Mujeres: Las vacunas contra la Covid-19 no causan infertilidad,https://ensegundos.com.pa/2021/01/30/opinion-mujeres-las-vacunas-contra-la-covid-19-no-causan-infertilidad/,"No sabemos todo sobre la covid-19, pero inmunizarse sigue siendo la mejor manera de proteger la salud. La pandemia de COVID-19 ha cobrado una factura muy desproporcionada en las carreras, las finanzas",30-01-2021 10:28,https://www.bing.com/th?id=OVFT.10aaomqp9Gel8WWPPxIdvy,Panamá,En Segundos
"Presidente Cortizo pide denunciar, con pruebas, actos de corrupción",https://www.midiario.com/nacionales/presidente-cortizo-pide-denunciar-con-pruebas-actos-de-corrupcion/,"Ante estudios de organizaciones internacionales sobre la transparencia y el manejo de la pandemia de la covid-19, el presidente de la República, Laurentino Cortizo Cohen, resaltó que Panamá es uno de",30-01-2021 11:38,https://www.bing.com/th?id=OVFT.lx0naK_A8hkN7_aBUSmTPy,Panamá,Mi Diario
Francia usa perros para detectar la Covid-19 a través de la transpiración humana,https://www.prensa.com/mundo/francia-usa-perros-para-detectar-la-covid-19-a-traves-de-la-transpiracion-humana/,"Eliot está entrenado para encontrar el rastro de criminales y de personas desaparecidas, pero desde hace un mes, este pastor belga malinois es entrenado para detectar el coronavirus a través del sudor",30-01-2021 13:34,https://www.bing.com/th?id=OVFT.d0mBrUw1gYMr6beIGUpQ0C,Panamá,prensa.com
Colombia detecta primer caso de la variante brasileña del coronavirus,https://www.prensa.com/mundo/colombia-detecta-primer-caso-de-la-variante-brasilena-del-coronavirus/,"Colombia detectó en el departamento del Amazonas, fronterizo con Brasil, el primer caso de una variante del coronavirus que surgió recientemente en ese país vecino, informó este sábado el Ministerio d",30-01-2021 16:07,https://www.bing.com/th?id=OVFT.PmhWtl3-76ofc8mZiow6Jy,Panamá,prensa.com
Presidente destaca avance de conectividad en medio de la pandemia,https://elcapitalfinanciero.com/presidente-destaca-avance-de-conectividad-en-medio-de-la-pandemia/,"Durante una gira por la comarca Ngäbe Buglé, el presidente de la República, Laurentino Cortizo Cohen, afirmó que, a pesar de la pandemia que ha afectado al país por más de diez meses, el Gobierno Naci",30-01-2021 16:39,https://www.bing.com/th?id=OVFT.WxZ7jvpxF8qN_QEcgmqocC,Panamá,El Capital Financiero
"101 heatlcare workers dead from covid, 9.810 infected",https://newsroompanama.com/health/101-heatlcare-workers-dead-from-covid-9810-infected,"Nearly 10,000 Panama healthcare workers have contracted covid-19 the since the start of the pandemic and 101 have died says the Jan 27 situation report of the",30-01-2021 17:02,https://www.bing.com/th?id=OVFT.vVRFzOAXlWbsLSmai25cdC,Panamá,Newsroom Panama
Festejo en honor a Don Bosco iniciará con el canto de las mañanitas,https://www.critica.com.pa/nacional/festejo-en-honor-don-bosco-iniciara-con-el-canto-de-las-mananitas-597326,"Don Bosco, fundador de los salesianos. Juan Bosco, llamado en italiano Giovanni Melchiorre Bosco y más conocido como Don Bosco fue un sacerdote, educador y escritor italiano del siglo XIX.",30-01-2021 17:35,https://www.bing.com/th?id=OVFT.PguY0Dj1AAweH4W9sd15DS,Panamá,Critica
Piden a las personas hacerse pruebas para detectar COVID-19 a tiempo y no en el último momento,https://www.tvn-2.com/nacionales/Piden-personas-hacerse-detectar-COVID-19_0_5774422536.html,"Fiebre, malestar general, dolor de cabeza, tos, perdida de olfato, perdida de gusto, síntomas de resfriado, debilidad, algunos más graves como dificultad respiratoria, son parte de los síntomas por lo",30-01-2021 18:20,https://www.bing.com/th?id=OVFT.Clz2Gwaxp-LwcR0f3MPOmy,Panamá,TVN
Colombia detecta primer caso de variante brasileña de covid-19,https://ensegundos.com.pa/2021/01/30/colombia-detecta-primer-caso-de-variante-brasilena-de-covid-19/,"Para evitar la propagación de esta nueva cepa, probablemente más contagiosa, Colombia siguió los pasos de Portugal, Turquía, Marruecos, Perú, Alemania y Francia en las restricciones de viajes con Bras",30-01-2021 18:24,https://www.bing.com/th?id=OVFT.3eReSRk56Wv7U8_eylJsxy,Panamá,En Segundos
Minsa reitera que las fiestas del Carnaval quedan suspendidas por la pandemia del COVID-19,https://www.telemetro.com/nacionales/2021/01/30/minsa-reitera-fiestas-carnaval-quedan/3695545.html,"El Ministerio de Salud de Panamá (Minsa) reiteró a través de un comunicado que para este 2021 las tradicionales fiestas del carnaval quedarán suspendidas en todo el país, como parte de las medidas par",30-01-2021 18:50,https://www.bing.com/th?id=OVFT.i3LrWIkzZnruJGQM536wLS,Panamá,Telemetro
Colombia comenzará a vacunar masivamente contra la covid-19 el 20 de febrero,http://elsiglo.com.pa/internacional/colombia-comenzara-vacunar-masivamente-contra-covid-19-20-febrero/24172011,"El mandatario justificó el retraso en la llegada de vacunas, prevista en un principio para la primera semana de febrero",30-01-2021 19:38,https://www.bing.com/th?id=OVFT.UhA4DCrYSCadYQpmjd2wgi,Panamá,El Siglo
Minsa recalca que no hay Carnaval 2021… el lunes 15 de febrero se trabaja,https://noticias24pty.com/minsa-recalca-que-no-hay-carnaval-2021-el-lunes-15-de-febrero-se-trabaja/,"¡Ya saben! No hagan planes para los días en que se debió celebrar el Carnaval 2021. El Ministerio de Salud (INSA) informa que este año el Carnaval quedará suspendido  en todo el país, como parte",30-01-2021 19:51,https://www.bing.com/th?id=OVFT.0eWZfDiqCbpnbLgkhElF_y,Panamá,Noticias 24 PTY
