name,url,description,datePublished,imagen,pais,Fuente
Instalan Centro de Operaciones de Emergencia en Panamá Oeste,https://www.critica.com.pa/nacional/instalan-centro-de-operaciones-de-emergencia-en-panama-oeste-582349,"Las autoridades provinciales de Panamá Oeste, optaron por activar el Centro de Operaciones de Emergencia (COE), cuya principal tarea será la trazabilidad de los casos de Coronavirus. La Dra. Herminia",30-06-2020 23:32,https://www.bing.com/th?id=ON.3CD6DB11D6A7C8796D5DB2B6141ACC05,Panamá,Critica
"Covid-19: Panamá suma 631 fallecimientos y 33,550 contagios",https://ensegundos.com.pa/2020/06/30/covid-19-panama-suma-631-fallecimientos-y-33550-contagios/,"Un total de 11 personas perdieron la vida en las últimas horas. Los hospitales están a su máxima capacidad. Para hoy martes 30 de junio en Panamá se contabilizan 15,745 pacientes recuperados, 765 caso",30-06-2020 23:35,https://www.bing.com/th?id=ON.F870F1D74666D06356E3B0CA431EA715,Panamá,En Segundos
MITRADEL recibe informe oficial con los 23 acuerdos logrados en la mesa tripartita,https://www.radiopanama.com.pa/noticias/actualidad/mitradel-recibe-informe-oficial-con-los-23-acuerdos-logrados-en-la-mesa-tripartita/20200630/nota/4051010.aspx,"El Ministerio de Trabajo y Desarrollo Laboral recibió del sector trabajador y empleador el documento que contiene los 23 acuerdos alcanzados en la mesa de Diálogo Tripartita por la economía, luego de",30-06-2020 23:42,https://www.bing.com/th?id=ON.7D78B3FEAE78D8AC05601605E2D2BC64,Panamá,Radio Panamá
Panamá contabiliza 765 casos positivos nuevos y 631 defunciones por Covid-19,https://www.critica.com.pa/nacional/panama-contabiliza-765-casos-positivos-nuevos-y-631-defunciones-por-covid-19-582373,"Panamá se contabiliza 11 nuevas defunciones y 765 casos positivos nuevos para un total de acumulado de 631 muertes y 33,550 contagios para hoy, día 114 desde que inició la pandemia por Covid-19 en nue",30-06-2020 23:48,https://www.bing.com/th?id=ON.64FD5F3B18C82095531A345A2FB0B92D,Panamá,Critica
MEF asegura que saneó las finanzas de Panamá en su primer año de gestión gubernamental,https://www.telemetro.com/nacionales/2020/06/30/mef-asegura-saneo-finanzas-panama/3002317.html,"Al cumplirse un año de gestión gubernamental el Ministerio de Economía y Finanzas de Panamá (MEF) reseña las acciones que efectuaron entre las que destaca que se sanearon las finanzas públicas, se pus",01-07-2020 00:26,https://www.bing.com/th?id=ON.9CAC7B7E15943C3A8F245CEC49E4CB55,Panamá,Telemetro
"Siguen aumentando las defunciones por COVID-19, 11 en las últimas horas",https://www.diaadia.com.pa/el-pais/siguen-aumentando-las-defunciones-por-covid-19-11-en-las-ultimas-horas-367889,"Martes 30 de junio en Panamá se contabilizó 15,745 pacientes recuperados de COVID-19, 765 casos nuevos, para un total de acumulado de 33,550. Se registró 11 nuevas defunciones, que totalizan 631 acumu",01-07-2020 00:30,https://www.bing.com/th?id=ON.7C19B4AF53339F4A04709A1359C2790F,Panamá,Día a Día
Reportan primer caso de Covid-19 en policlínica de Chitré,https://www.prensa.com/provincias/reportan-primer-caso-de-covid-19-en-policlinica-de-chitre/,En la provincia de Herrera hay 62 casos acumulados. Vielka Corro. El primer caso positivo de la Covid-19 en la Policlínica Roberto Ramírez De Diego fue confirmado esta tarde por las autoridades de la,01-07-2020 00:45,https://www.bing.com/th?id=ON.5904DCBF250C1CB97D73924775EE6B8C,Panamá,prensa.com
OPS está preocupada por aumento de muertes por COVID-19 en Panamá,https://www.tvn-2.com/nacionales/salud/OPS-preocupada-aumento-muertes-Covid-19-Panama_0_5613938631.html,Han pasado más de seis meses desde los primeros casos oficiales de coronavirus en China. Ahora los contagiados se cuentan por millones. La Organización Panamericana de la Salud (OPS) está preocupada p,01-07-2020 00:58,https://www.bing.com/th?id=ON.ABDE014941FED7229390E767E09FCABC,Panamá,TVN
"Toque de queda, en Panamá y Panamá Oeste, se mantendrá durante el mes de julio",https://www.panamaamerica.com.pa/sociedad/toque-de-queda-en-panama-y-panama-oeste-se-mantendra-durante-el-mes-de-julio-1166781,"Las autoridades de salud evalúan la capacidad instalada en los hospitales públicos, por medio del Centro de Control Interhospitalario que desde esta semana busca el mejor rendimiento para establecer e",01-07-2020 01:09,https://www.bing.com/th?id=ON.9F92821EF2D9E013980901A8DE96FFE5,Panamá,panamaamerica.com.pa
"Cortizo, un año al frente de Panamá golpeado por la pandemia y escándalos",https://ensegundos.com.pa/2020/06/30/cortizo-cumple-un-ano-al-frente-de-panama-golpeado-por-la-pandemia-y-escandalos/,"“Han sido y son tiempos difíciles”, reconoció Cortizo la semana pasada tras destituir a tres ministros, incluida Rosario Turner, de la cartera de Salud, en plena explosión de la pandemia. El president",01-07-2020 01:19,https://www.bing.com/th?id=ON.DD1825D708C835FDB00785624CBF931B,Panamá,En Segundos
"Panamá alcanza los 33,550 casos de COVID-19 con 765 nuevos contagios",https://www.telemetro.com/nacionales/2020/06/30/panama-alcanza-casos-covid-19/3002332.html,"Asimismo para hoy se registran un total de 11 muertes a causa del coronavirus, con 631 nuevas defunciones. Esto representa una tasa de letalidad del 1.88%. A la fecha se reportan unas 15,745 personas",01-07-2020 01:34,https://www.bing.com/th?id=ON.964845C8DF6659F6223A1EB9335C6614,Panamá,Telemetro
Activan Centro de Operación de Emergencias por COVID-19 en Panamá Oeste,https://noticias24pty.com/activan-centro-de-operacion-de-emergencias-por-covid-19-en-panama-oeste/,"Las autoridades provinciales de Panamá Oeste, optaron por activar el Centro de Operaciones de Emergencia (COE), cuya principal tarea será la trazabilidad de los casos de coronavirus.  La Dra. Herminia",01-07-2020 02:21,https://www.bing.com/th?id=ON.97A642364A82B8A165FBA6A54CA86CA8,Panamá,Noticias 24 PTY
"Panamá registra un total 33,550 casos de COVID-19 y 631 personas fallecidas a causa de este virus",https://www.panamaamerica.com.pa/sociedad/panama-registra-un-total-33550-casos-de-covid-19-y-631-personas-fallecidas-causa-de-este,"Al día 114 de iniciada la pandemia en nuestro país, se registran 33,550 casos acumulados mientras que se cuentan con 765 nuevos casos y 11 nuevas defunciones lo que deja un total de 631 fallecidos a c",01-07-2020 02:50,https://www.bing.com/th?id=ON.8A27438A7D0E0043A8DB0E0E38B5C7E2,Panamá,panamaamerica.com.pa
Rápida escalada de la transmisión del virus en el país,https://www.prensa.com/impresa/panorama/rapida-escalada-de-la-transmision-del-virus-en-el-pais/,"El personal sanitario está visitando los corregimientos de Panamá y Panamá Oeste, que reportan más de 10 casos diarios de Covid-19, para realizar pruebas de diagnóstico. Elysée Fernández Un escenario",01-07-2020 02:56,https://www.bing.com/th?id=ON.76EC358397850A9540747068C46426C2,Panamá,prensa.com
"Pobreza y desigualdad, la COVID-19 deja en evidencia la 'brecha' que hay en Panamá",https://www.tvn-2.com/nacionales/Pobreza-desigualdad-COVID-19-evidencia-Panama_0_5613938570.html,"Panamá al igual que muchos países habían realizado esfuerzos para luchar contra la pobreza, sin embargo, la pandemia llegó para condenar a varios sectores y sumar a otros tantos a este problema. La ex",01-07-2020 03:15,https://www.bing.com/th?id=ON.02C107015E4E20165A75AFBE5640ECC6,Panamá,TVN
La vacuna inactivada contra el COVID-19 de China inició los ensayos clínicos de fase 3 a nivel internacional,https://lagacetadepanama.com/la-vacuna-inactivada-contra-el-covid-19-de-china-inicio-los-ensayos-clinicos-de-fase-3-a-nivel-internacional/,"La vacuna inactivada candidata contra la enfermedad del nuevo coronavirus (COVID-19) de China ha iniciado la tercera fase de ensayos clínicos a nivel mundial en Emiratos Árabes Unidos (EAU), según el",01-07-2020 03:41,https://www.bing.com/th?id=ON.1D97134BA54B9A8834101F94DA04C1C7,Panamá,La Gaceta de Panama
OMS planea entregar 2 mil millones de vacunas contra la COVID-19 para finales de 2021,https://lagacetadepanama.com/oms-planea-entregar-2-mil-millones-de-vacunas-contra-la-covid-19-para-finales-de-2021/,La Organización Mundial de la Salud (OMS) anunció el pasado viernes su plan de entregar 2 mil millones de dosis de vacunas contra la COVID-19 al mundo para finales de 2021. Este plan es una parte del,01-07-2020 03:57,https://www.bing.com/th?id=ON.65EB0902ADDA1ADD2E00A6A4880BADEE,Panamá,La Gaceta de Panama
"FIFA mantiene sede y fechas de Mundial Femenino Sub-20 Costa Rica-Panamá, afirma federación tica",https://www.tvmax-9.com/somoslasele/FIFA-Mundial-Femenino-Sub-20-Rica-Panama_0_5613938635.html,"""El Consejo de la FIFA decidió y estableció las fechas de la Copa Mundial Femenina Sub-20, del 20 de enero al 6 de febrero del 2021, y no entra actualmente en los planes de la FIFA mover la competenci",01-07-2020 04:05,https://www.bing.com/th?id=ON.E079E281F07FFDF74B5FFD7BCDE12582,Panamá,TVMAX
Panamá suma 765 nuevos contagios de Covid-19 y 11 fallecimientos,https://www.metrolibre.com/nacionales/175434-panam%C3%A1-suma-765-nuevos-contagios-de-covid-19-y-11-fallecimientos.html,"El Ministerio de Salud reportó para este martes, 30 de junio, 15,745 pacientes recuperados, 765 casos positivos nuevos, para un total de acumulado de 33,550. Se han registrado 11 nuevas defunciones, q",01-07-2020 04:06,https://www.bing.com/th?id=ON.CAE7ECF5156E21528E74FDA7F3BC5CDA,Panamá,Metro Libre
FIFA mantiene sede y fechas de Mundial conjunto entre Costa Rica y Panamá,https://www.diaadia.com.pa/deportes/fifa-mantiene-sede-y-fechas-de-mundial-conjunto-entre-costa-rica-y-panama-367881,"Costa Rica informó este martes que la FIFA ha ratificado al país y a Panamá como sedes del Mundial Sub'20 femenino, así como las nuevas fechas, del 20 de enero al 6 de febrero de 2021. ""El Consejo de",01-07-2020 04:15,https://www.bing.com/th?id=ON.64B9742C84234946C4D1E2DC4A5073D5,Panamá,Día a Día
La FIFA mantiene la sede y las fechas del Mundial conjunto entre Costa Rica y Panamá,https://www.cableondasports.com/futbol/internacional/la-fifa-mantiene-la-sede-y-las-fechas-del-mundial-conjunto-entre-costa-rica-y-panama_0_375346/,"San José, 30 jun. (EFE).- Costa Rica informó este martes que la FIFA ha ratificado al país y a Panamá como sedes del Mundial Sub'20 femenino, así como las nuevas fechas, del 20 de enero al 6 de febrer",01-07-2020 05:00,https://www.bing.com/th?id=ON.20C94452533C49172713F70A8BC10E00,Panamá,Cable Onda Sports
Psiquiatra da recomendaciones en tiempos de covid-19,http://elsiglo.com.pa/panama/psiquiatra-recomendaciones-tiempos-covid-19/24159536,"En ""Cuarenteneando"" también nos dijo que al vivir este tiempo de crisis sanitaria sí te sientes solo o estás triste, debes hablar con alguien ¿No sabes qué hacer si un familiar fallece en tiempos de c",01-07-2020 05:05,https://www.bing.com/th?id=ON.5894214C70E406DA76BB75750752ACCA,Panamá,El Siglo
Cierran juzgado de la niñez por covid-19,http://elsiglo.com.pa/panama/cierran-juzgado-ninez-covid-19/24159540,"La suspensión de términos y labores en el Tribunal Superior de la Niñez y Adolescencia de Panamá, fue lo que decreto ayer el pleno de la... Decisión. La suspensión de términos y labores en el Tribunal",01-07-2020 05:05,https://www.bing.com/th?id=ON.EC20733A4AB3AF56A194656C0F411A01,Panamá,El Siglo
"FIFA descarta mover sede del Mundial Femenino Sub-20, según COL de Costa Rica",http://www.rpctv.com/deportes/futbol/FIFA-Mundial-Femenino-Sub-20-COL_0_1369063098.html,"El Comité Organizador Local de Costa Rica para el Mundial Femenino Sub-20 comunicó a través de la página oficial de la Federación Costarricense de Fútbol, que la FIFA descartó mover la sede del evento",01-07-2020 05:14,https://www.bing.com/th?id=ON.A04E535B2167EBE5FD0196DB7535284F,Panamá,RPCTV
Once defunciones por COVID-19 en las últimas horas… 765 casos nuevos,https://noticias24pty.com/once-defunciones-por-covid-19-en-las-ultimas-horas-765-casos-nuevos/,"Martes 30 de junio en Panamá se contabilizó 15,745 pacientes recuperados de COVID-19, 765 casos nuevos, para un total de acumulado de 33,550. Se registró 11 nuevas defunciones, que totalizan 631 acumu",01-07-2020 08:28,https://www.bing.com/th?id=ON.7563911665C095EA29E0C3B10EE2308F,Panamá,Noticias 24 PTY
Lo más googleado en la cuarentena,https://www.metrolibre.com/tecnolog%C3%ADa/175435-lo-m%C3%A1s-googleado-en-la-cuarentena.html,"En medio de la pandemia por el Covid-19, los intereses  de los panameños en el internet han variado. Así lo confirmó Luisa Vásquez, del grupo de soporte para Google en Centroamérica y Panamá.  De acue",01-07-2020 10:26,https://www.bing.com/th?id=ON.E5E416B4A71D82BE67C31E602CB9831F,Panamá,Metro Libre
"El Pride Panamá logró llegar a + de 500,000 personas",http://prnoticiaspanama.com/el-pride-panama-logro-llegar-a-de-500000-personas/,"El World Pride Panamá, este año se realizó de manera virtual por el Covid-19, marcando varios hitos en la Historia de la comunidad LGBTIQ+ en Panamá, con la transmisión en streaming, redes sociales, r",01-07-2020 10:52,https://www.bing.com/th?id=ON.96DA880D239AE4BC8C8CB4563B6C1BB5,Panamá,PR Noticias Panama
Investigación de Mastercard muestra un aumento en los pagos digitales a medida que el comercio electrónico alcanza niveles sin precedentes,http://prnoticiaspanama.com/investigacion-de-mastercard-muestra-un-aumento-en-los-pagos-digitales-a-medida-que-el-comercio-electronico-alcanza-niveles-sin-precedentes/,"La manera en que compramos está cambiando. A medida que se imponen restricciones en nuestra vida diaria debido al COVID-19, los consumidores están adoptando nuevos hábitos de pago a un ritmo acelerado",01-07-2020 11:08,https://www.bing.com/th?id=ON.731325F4F6061F67E2BE82A3DCFA6ABF,Panamá,PR Noticias Panama
