name,url,description,datePublished,imagen,pais,Fuente
Panamá llega a 383.733 casos de la covid-19 y 6.408 defunciones,https://es-us.noticias.yahoo.com/panam%C3%A1-llega-383-733-casos-012902773.html,"Ciudad de Panamá, 8 jun (EFE).- Panamá reportó este martes 882 nuevos casos de la covid-19 y 4 muertes por la enfermedad, que hacen un total de 383.733 contagios confirmados y 6.408 fallecimientos en",09-06-2021 01:29,https://www.bing.com/th?id=OVFT.XIcZaDZD7zTD1awjAiG3fy,Panamá,Yahoo Noticias en Español
La vacuna anticovid de CureVac registra una eficacia de 47%,https://noticias24pty.com/la-vacuna-anticovid-de-curevac-registra-una-eficacia-de-47-2/,"La empresa alemana CureVac entregó los resultados preliminares de un ensayo clínico de su vacuna contra la Covid-19, arrojando sólo un 47% de eficacia.El ensayo incluyó a 40 mil voluntarios en",17-06-2021 01:27,https://www.bing.com/th?id=OVFT.b0nsPw2fSEItOTemqoEthS,Panamá,Noticias 24 PTY
"Panamá registra 1,048 casos positivos nuevos de covid-19 en las últimas 24 horas",https://www.laestrella.com.pa/nacional/210616/panama-registra-1-048-casos-positivos-nuevos-covid-19-ultimas-24-horas,"Para este miércoles se contabilizan 373,896 pacientes recuperados, se registran 1,048 casos positivos nuevos, para un total acumulado de 390,221",17-06-2021 01:35,https://www.bing.com/th?id=OVFT.sJf5bT3nHdVpRGvQ8hiywC,Panamá,laestrella.com.pa
Un 47% de eficacia registra vacuna anticovid de CureVac,https://www.prensa.com/impresa/panorama/un-47-de-eficacia-registra-vacuna-anticovid-de-curevac/,"La empresa alemana CureVac entregó los resultados preliminares de un ensayo clínico de su vacuna contra la Covid-19, arrojando solo un 47% de",17-06-2021 04:00,https://www.bing.com/th?id=OVFT.GeMJPLn5rnOEtjUz49fVsi,Panamá,prensa.com
Sigue la tendencia al alza de los casos nuevos de la covid en Panamá,https://www.msn.com/es-us/noticias/mundo/sigue-la-tendencia-al-alza-de-los-casos-nuevos-de-la-covid-en-panam%C3%A1/ar-AAL82I2,"Panamá registró este miércoles más de mil nuevos casos de la covid-19, una cifra que no se daba hacía meses, en medio de las alertas sobre la llegada de una tercera ola pandémica que las autoridades i",17-06-2021 04:17,https://www.bing.com/th?id=OVFT.vteLCbzOdjssH4IQiFJWLC,Panamá,MSN
Ver imagen más grande,https://sertv.gob.pa/nacionalfm/comunicado-477/,"En su informe emitido esta tarde, el Programa Ampliado de Inmunización del Ministerio de Salud (MINSA), detalla que, en Panamá, se han aplicado hasta el corte de hoy 1,343,784 dosis de la vacuna contr",17-06-2021 13:00,https://www.bing.com/th?id=OVFT.hLsJxXIA9-TrLEXzsvIe8y,Panamá,SERTV
DATA COVID: Se registra crecimiento de 1.4% en los contagios,https://www.radiopanama.com.pa/noticias/actualidad/data-covid-se-registra-crecimiento-de-14-en-los-contagios/20210617/nota/4143904.aspx,Se mantiene una tendencia semanal al aumento que se reitera en las mismas zonas donde desde hace varias semanas se reporta un número considerable de nuevos contagios.,17-06-2021 13:38,https://www.bing.com/th?id=OVFT.U5aKDYpkHePXVNpXvKWW7y,Panamá,Radio Panamá
Panamá expone ventajas competitivas como hub de manufactura y logística,https://ensegundos.com.pa/2021/06/17/panama-expone-ventajas-competitivas-como-hub-de-manufactura-y-logistica/,"El país apuesta a la atracción de empresas de los Estados Unidos como puente comercial y sitio ideal para las inversiones. La Cámara Americana de Comercio (AmCham), la embajada de Panamá en Washington",17-06-2021 15:23,https://www.bing.com/th?id=OVFT.62cl4OSP6sDIHcb0ZVw5xy,Panamá,En Segundos
"Reino Unido supera 10,000 contagios de Covid-19 por primera vez desde febrero",https://www.prensa.com/sociedad/reino-unido-supera-10000-contagios-de-covid-19-por-primera-vez-desde-febrero/,"El Reino Unido superó el jueves los 10,000 nuevos contagios registrados diariamente por la Covid-19 (11,007) por primera vez desde febrero, ante el auge de la variante Delta del",17-06-2021 15:43,https://www.bing.com/th?id=OVFT.2U9oz5yvIDM0nFOPml4SyC,Panamá,prensa.com
Nadja Porcell: No se reportan muertes relacionadas a vacunas contra la covid-19,http://elsiglo.com.pa/panama/nadja-porcell-reportan-muertes-relacionadas-vacunas-contra-covid-19/24179992,"Precisó que Panamá, en la evolución de la pandemia ha disminuido el porcentaje de la letalidad hasta por debajo de 2.0%",17-06-2021 16:10,https://www.bing.com/th?id=OVFT.5SoEmS-P5l6ktcPpFqBdbi,Panamá,El Siglo
"Panamá no reporta muertes de personas por vacunas contra la COVID-19, según el Minsa",https://www.tvn-2.com/nacionales/Panama-personas-Vacunas-COVID-19-Minsa_0_5877912186.html,"El Ministerio de Salud (Minsa) informó este jueves 17 de junio, que la mortalidad a causa de la COVID-19 ha presentado un descenso considerable en los últimos meses e incluso se han reportado días sin",17-06-2021 16:11,https://www.bing.com/th?id=OVFT.Vv5wqV9kHa5j54pZd9T-Ly,Panamá,TVN
No se reportan defunciones relacionadas a vacunas contra la covid-19,https://www.midiario.com/nacionales/no-se-reportan-defunciones-relacionadas-a-vacunas-contra-la-covid-19/,"La mortalidad a causa de la COVID-19 ha presentado en los últimos meses un descenso considerable e incluso se han reportado días sin presentar defunciones en el país, así lo sostuvo la dra. Nadja Porc",17-06-2021 16:40,https://www.bing.com/th?id=OVFT.F-nv_x2tWWt2jWlqcGGqli,Panamá,Mi Diario
Minsa aclara que no se reportan defunciones relacionadas a las vacunas contra el COVID-19,https://www.diaadia.com.pa/el-pais/minsa-aclara-que-no-se-reportan-defunciones-relacionadas-las-vacunas-contra-el-covid-19,La doctora Nadja Porcell explicó que con la llegada de las vacunas se ha experimentado un descenso significativo en la mortalidad de los adultos mayores en el país específicamente entre las edades de,17-06-2021 16:52,https://www.bing.com/th?id=OVFT.rERqgxttO735xsRuFZwYTy,Panamá,Día a Día
Minsa: No se reportan muertes relacionadas a vacunas contra covid-19,https://www.telemetro.com/nacionales/minsa-no-se-reportan-muertes-relacionadas-vacunas-contra-covid-19-n5242961,El Minsa aseguró que la mortalidad a causa de covid-19 en Panamá ha presentado un descenso considerable y la letalidad ha disminuido hasta por debajo de 2.0%.,17-06-2021 16:53,https://www.bing.com/th?id=OVFT.OU8sAjhV4jduwX1kDzvILi,Panamá,Telemetro
Acciones que no se detienen en la región Metropolitana de Salud,https://sertv.gob.pa/nacionalfm/acciones-que-no-se-detienen-en-la-region-metropolitana-de-salud/,"En la región Metropolitana de Salud, se mantienen las acciones enfocadas por la COVID-19 y otras enfermedades propias de la temporada lluviosa en Panamá. Ante las inundaciones ocasionadas por las fuer",17-06-2021 16:58,https://www.bing.com/th?id=OVFT.T7lhtSc9Rxidp-7eB-Xy_i,Panamá,SERTV
MINSA: No se reportan defunciones relacionadas a vacunas contra la COVID-19,https://ensegundos.com.pa/2021/06/17/minsa-no-se-reportan-defunciones-relacionadas-a-vacunas-contra-la-covid-19/,"La doctora Porcell reiteró a la población que al estar vacunado tiene la posibilidad de tener una evolución positiva y desarrollar formas más leves de la enfermedad. La dra. Nadja Porcell, directora g",17-06-2021 17:23,https://www.bing.com/th?id=OVFT.EFsR17H6tEICqLVE8jLNbi,Panamá,En Segundos
Más de mil personas por día se vacunan contra el covid-19 en Westland Mall,http://elsiglo.com.pa/panama/personas-vacunan-contra-covid-19-westland-mall/24179995,"Hasta el miércoles 16 de junio iban contabilizados 3,326 voluntarios vacunados contra el covid-19 en este centro comercial de Panamá Oeste",17-06-2021 17:42,https://www.bing.com/th?id=OVFT.BbpBml_sLbVCMCEfZgOgwi,Panamá,El Siglo
"Quejas de pacientes crónicos, mujeres embarazadas y en lactancia por extensas filas para vacunación",https://www.tvn-2.com/nacionales/Quejas-pacientes-embarazadas-lactancia-vacunacion_0_5877912206.html,"Pacientes crónicos, mujeres en estado de gestación y de lactancia, se quejaron de la desorganización  la extensa fila que debieron realizar para colocarse la vacuna contra la COVID-19, en el centro de",17-06-2021 18:42,https://www.bing.com/th?id=OVFT.7RDVFC0Ootq11I94CtF4oy,Panamá,TVN
Minsa: No se reportan defunciones relacionadas a vacunas contra COVID-19,https://www.critica.com.pa/nacional/minsa-no-se-reportan-defunciones-relacionadas-vacunas-contra-covid-19-606173,"Panamá en la evolución de la pandemia ha disminuido el porcentaje de la letalidad hasta por debajo de 2.0%, ubicándolo entre los países de la región con las cifras más bajas.",17-06-2021 18:44,https://www.bing.com/th?id=OVFT.qqDP6Dj_8OdXToj0P06bMS,Panamá,Critica
"Panamá registra ""dramática"" disminución de muertes por la covid-19",https://www.laestrella.com.pa/nacional/210617/panama-registra-dramatica-disminucion-muertes-covid-19,"Panamá ha registrado en los últimos meses una disminución ""dramática"" de las muertes por la covid-19, especialmente entre las personas de entre 60 y 80 años, un comportamiento atribuido a la vacunació",17-06-2021 19:46,https://www.bing.com/th?id=OVFT.VrFD9B_3hfAZ1oI3fVerqi,Panamá,laestrella.com.pa
Revés para la vacuna CureVac en la que participaron unos 300 panameños. Dr. Sáez Llorens reacciona,https://www.midiario.com/salud/reves-para-la-vacuna-curevac-en-la-que-participaron-unos-300-panamenos-dr-saez-llorens-reacciona/,"Los resultados preliminares de un ensayo clínico de la vacuna CureVac contra la covid-19, en los que participaron unos 300 panameños, han arrojado sólo un 47% de eficacia, lo que no es suficiente aún",17-06-2021 19:57,https://www.bing.com/th?id=OVFT.HdvEVCn53GiOJuI0t-PnHy,Panamá,Mi Diario
Centro de vacunación del Rommel Fernández estará cerrado este domingo,https://www.telemetro.com/nacionales/centro-vacunacion-del-rommel-fernandez-estara-cerrado-este-domingo-n5243186,"Las personas con cita de vacunación programada para este día en el Estadio Rommel Fernández podrán vacunarse el sábado 19 o lunes 21, informó el Minsa.",17-06-2021 19:56,https://www.bing.com/th?id=OVFT.heyfJbdvdFB9imlBJNu6MC,Panamá,Telemetro
Porcell: No se reportan defunciones relacionadas a vacunas contra el Covid-19,https://www.metrolibre.com/nacionales/205059-porcell-no-se-reportan-defunciones-relacionadas-vacunas-contra-el-covid-19.html,"Porcell dejó claro que no se ha reportado ninguna muerte a causa de las vacunas, “las defunciones que se han registrados han sido pacientes que han fallecido por el Covid-19 pero que no se adjudica a",17-06-2021 20:03,https://www.bing.com/th?id=OVFT.IHW47KsqdqzvB1QjZrKeuC,Panamá,Metro Libre
Panamá registra 'dramática' disminución de muertes por el covid-19,https://www.diaadia.com.pa/el-pais/panama-registra-dramatica-disminucion-de-muertes-por-el-covid-19-735236,"Panamá ha registrado en los últimos meses una disminución ""dramática"" de las muertes por el covid-19, especialmente entre las personas de entre 60 y 80 años, un comportamiento atribuido a la vacunació",17-06-2021 20:13,https://www.bing.com/th?id=OVFT.ZIICacaupyxwZ3-HUIDcdS,Panamá,Día a Día
Minsa alega tener hojas ruta para hospital,https://www.critica.com.pa/provincias/minsa-alega-tener-hojas-ruta-para-hospital-606183,"Panamá. Aunque sin referirse al urgente reemplazo de los equipos de climatización del hospital Nicolás A. Solano en la provincia de Panamá Oeste, el Ministerio de Salud (Minsa), indicó a través de un",17-06-2021 20:17,https://www.bing.com/th?id=OVFT.4cMJB6Ia31Ghje1XGAM7Li,Panamá,Critica
