name,url,description,datePublished,imagen,pais,Fuente
"Primeras vacunaciones contra covid-19 en la UE, factibles en ""primer trimestre de 2021""",https://ensegundos.com.pa/2020/11/11/primeras-vacunaciones-contra-covid-19-en-la-ue-factibles-en-primer-trimestre-de-2021/,"La situación ante la pandemia en el Viejo Continente es ""muy, muy preocupante"" y ""todos nuestros indicadores van en la mala dirección"". Las primeras vacunaciones contra el covid-19 en la Unión Europea",11-11-2020 13:19,https://www.bing.com/th?id=OVFT.VzC4c4rNCYyxhnbuKHNoxS,Panamá,En Segundos
Estudios experimentales de la vacuna contra la COVID-19 en Panamá avanzan 'adecuadamente',https://www.tvn-2.com/nacionales/progreso-estudios-experimentales-COVID-19-Panama-vacuna_0_5714428516.html,"El doctor Eduardo Ortega, miembro del Consorcio de Investigación de Vacunas COVID-19, detalló que las pruebas científicas que se aplican de las vacunas en desarrollo en Panamá, progresan adecuadamente",11-11-2020 14:02,https://www.bing.com/th?id=OVFT.74LWSZpndraLDsNSUxlh1C,Panamá,TVN
Anuncian inscripciones para capacitación sobre Certificaciones de Origen en línea,https://elcapitalfinanciero.com/anuncian-inscripciones-para-capacitacion-sobre-certificaciones-de-origen-en-linea/,"A partir de este miércoles 11 de noviembre, las empresas exportadoras que requieran capacitarse sobre el uso de la Certificación de Origen en la plataforma en línea del Sistema de Gestión Aduanera (SI",11-11-2020 14:05,https://www.bing.com/th?id=OVFT.s6a3qBvH8EsYyHZzvzBIxC,Panamá,El Capital Financiero
"Panameño Betesh, piso fuerte en el GT Challenge de las Américas Panameño Betesh, piso fuerte en el GT Challenge de las Américas",https://www.cableondasports.com/mas-deportes/panameno-betesh-piso-fuerte-en-el-gt-challenge-de-las-americas_0_401196/,"El piloto panameño Solly Betesh al mando del auto Audi R 8 LMS, impuso autoridad en el autódromo Pedro Cofiño en la segunda fecha del GT Challenge de las Américas celebrado en Guatemala, con acreditar",11-11-2020 14:19,https://www.bing.com/th?id=OVFT.btadX3f3uhpNXUG7iICrFS,Panamá,Cable Onda Sports
"Teletrabajo, ¿el futuro laboral de Panamá?",https://noticias24pty.com/teletrabajo-el-futuro-laboral-de-panama/,"Debido a la pandemia por la COVID-19, que obligó al mundo entero a refugiarse en sus casas para evitar contagios, Panamá tuvo que agilizar una tarea pendiente: el teletrabajo, y por ello, en",11-11-2020 14:46,https://www.bing.com/th?id=OVFT.WVC-8D9RoCxs6YS0E46ksi,Panamá,Noticias 24 PTY
Panamá anunció lista jugadores para el FIBA AmeriCup 2022,http://www.nexpanama.com/panama-anuncio-lista-jugadores-para-el-fiba-americup-2022/,"entarán a Panamá en la segunda ventana de los Clasificatorios FIBA AmeriCup 2022, se jugarán del 27 al 30 de noviembre en Buenos Aires, Argentina. A continuación el listado de la Selección Nacional de",11-11-2020 15:00,https://www.bing.com/th?id=OVFT.D_bUbaidxzH0Eo_Adi4Eci,Panamá,NEX TV
Gobierno restringirá el turismo en Guna Yala si continúa repunte de covid-19 en la zona,https://www.laestrella.com.pa/nacional/201111/gobierno-restringira-turismo-guna-yala-continua-repunte-covid-19-zona,"El titular de la cartera de salud, Luis Francisco Sucre, señaló que si la cifra de casos positivos por covid-19 continúa aumentado puede afectar al resto del país",11-11-2020 16:09,https://www.bing.com/th?id=OVFT.xP3xGJglk9dnZ8SnWR66Li,Panamá,laestrella.com.pa
Minsa anunció Plan de Contingencia aplicado a provincias centrales,https://elcapitalfinanciero.com/minsa-anuncio-plan-de-contingencia-aplicado-a-provincias-centrales/,"Nadja Porcell, directora General del Ministerio de Salud (Minsa), anunció este martes, 10 de noviembre, un nuevo Plan de Contingencia que se pondrá en marca para mantener la tendencia al alza de los c",11-11-2020 16:42,https://www.bing.com/th?id=OVFT.Pgr3YvPnW90fyVcEaj3XAS,Panamá,El Capital Financiero
Continúan las medidas contra el coronavirus en Panamá,https://www.radiopanama.com.pa/noticias/actualidad/continuan-las-medidas-contra-el-coronavirus-en-panama/20201111/nota/4084870.aspx,"Se ha evaluado, junto al ministro Luis Sucre, los criterios que han servido para hacer los cierres y aperturas de comercios.",11-11-2020 17:19,https://www.bing.com/th?id=OVFT.U5aKDYpkHePXVNpXvKWW7y,Panamá,Radio Panamá
NBA recortará la temporada para permitir a jugadores participar en Juegos de Tokio,http://www.nexpanama.com/nba-recortara-la-temporada-para-permitir-a-jugadores-participar-en-juegos-de-tokio/,Los dueños de los equipos y la asociación de jugadores de la NBA acordaron una temporada más corta para permitir que los jugadores de la mejor liga del mundo compitan en los Juegos Olímpicos de Tokio,11-11-2020 17:57,https://www.bing.com/th?id=OVFT.BYpPv8JhEGQ67Fpwvezz1C,Panamá,NEX TV
"Panamá registra 1,163 casos nuevos de coronavirus",https://www.metrolibre.com/nacionales/186605-panam%C3%A1-registra-1163-casos-nuevos-de-coronavirus.html,"Para hoy miércoles 11 de noviembre en Panamá se contabilizan 1,163 casos positivos nuevos, para un total acumulado de 142,465. Mientras que se totalizan 120,823 pacientes recuperados. De acuerdo al úl",11-11-2020 18:26,https://www.bing.com/th?id=OVFT.ddy8T7t4BQpU-uoPUFMoSi,Panamá,Metro Libre
Solo el 38% de contratos suspendidos se reactivaron; menos de lo estimado por Mitradel,https://www.laestrella.com.pa/economia/201111/38-contratos-suspendidos-reactivaron-estimado-mitradel,"Hasta la fecha se han reactivado 88,464 contratos, contrario a los 180 mil que se esperaban tener tras la reactivación económica. Hay empresas que no reportan la reactivación y están contratando por s",11-11-2020 18:43,https://www.bing.com/th?id=OVFT.7wiMlSe94cflG-iOgoPb9y,Panamá,laestrella.com.pa
Venezuela autoriza vuelos comerciales desde y hacia Panamá,https://www.metrolibre.com/nacionales/186621-venezuela-autoriza-vuelos-comerciales-desde-y-hacia-panam%C3%A1.html,"Venezuela autorizó vuelos comerciales desde y hacia Panamá, aunque extendió hasta febrero de 2021 la prohibición de operaciones aéreas vigente desde marzo por la pandemia de covid-19, anunció este mié",11-11-2020 19:59,https://www.bing.com/th?id=OVFT.KrpV5gPFY0kK9pwSgUnkwS,Panamá,Metro Libre
Venezuela reactiva vuelos hacia Panamá,https://www.critica.com.pa/mundo/venezuela-reactiva-vuelos-hacia-panama-592061,"En un comunicado, el Instituto Nacional de Aeronáutica Civil (INAC) informó que continúa el cierre de los aeropuertos ""para los vuelos internacionales que ingresan por prevención del covid-19, a parti",11-11-2020 22:39,https://www.bing.com/th?id=OVFT.36053bwBovDxYM92iWDUUi,Panamá,Critica
Autoridades del MINSA hacen nueva advertencia ante el incremento de casos por COVID-19,https://www.radiopanama.com.pa/noticias/actualidad/autoridades-del-minsa-hacen-nueva-advertencia-ante-el-incremento-de-casos-por-covid19/20201111/nota/4085002.aspx,La Dra. Lourdes Moreno resaltó que el uso de la mascarilla y el constante lavado de manos debe continuar al igual que el resto de las medidas de protección para mitigar los contagios,11-11-2020 22:57,https://www.bing.com/th?id=OVFT.U5aKDYpkHePXVNpXvKWW7y,Panamá,Radio Panamá
"Se reportan 1,163 nuevos casos de Covid-19 en Panamá y 6 defunciones",https://www.prensa.com/sociedad/se-reportan-1163-nuevos-casos-de-covid-19-en-panama-y-6-defunciones/,"En las últimas 24 horas se han registrado 1,163 nuevos de coronavirus y seis nuevas defunciones, informó este miércoles 11 de noviembre el Ministerio de Salud",11-11-2020 23:16,https://www.bing.com/th?id=OVFT.ffbGCff1PanWFeIA3-3_DS,Panamá,prensa.com
Suben los casos de covid-19 en Panamá,http://elsiglo.com.pa/panama/suben-casos-covid-19-panama/24167655,Hasta ahora solamente se ha aplicado restricción de movilidad en Soná y San Francisco de la provincia de Veraguas,11-11-2020 23:20,https://www.bing.com/th?id=OVFT._-tkdC7cJgOiwQsMo8X9xS,Panamá,El Siglo
Baja la cifra de muertos pero suben los contagios por COVID-19,https://www.critica.com.pa/nacional/baja-la-cifra-de-muertos-pero-suben-los-contagios-por-covid-19-592067,"Según el informe epidemiológico, divulgado por el Ministerio de Salud (Minsa), en las últimas 24 horas se aplicaron 6,288 nuevas pruebas, de las cuales 1,163 dieron positivo.",11-11-2020 23:48,https://www.bing.com/th?id=OVFT.vFndNqNVnad0WsGvAcuyti,Panamá,Critica
Piden aplicar nuevas medidas ante avance de la COVID-19,https://noticias24pty.com/piden-aplicar-nuevas-medidas-ante-avance-de-la-covid-19/,"Ante la advertencia del Ministerio de Salud (Minsa) de un repunte en los casos de coronavirus, los ediles de La Chorrera, en la provincia de Panamá Oeste, abogaron por la aplicación de un nuevo",11-11-2020 23:57,https://www.bing.com/th?id=OVFT.1-0aMsFpXqAW_eeLQ5zgcC,Panamá,Noticias 24 PTY
Pandemia: Panamá vuelve a superar los mil casos nuevos en 24 horas,https://ensegundos.com.pa/2020/11/11/pandemia-panama-vuelve-a-superar-los-mil-casos-nuevos-en-24-horas/,"En medio de advertencia de restricciones por las autoridades, los casos nuevos de coronavirus van en repunte. El país enfrenta nuevamente una encrucijada. La pandemia del coronavirus Covid-19 vuelve a",12-11-2020 00:02,https://www.bing.com/th?id=OVFT.9hclGo2jtvafbRilV-S5by,Panamá,En Segundos
Venezuela reapertura sus vuelos a Panamá,http://elsiglo.com.pa/internacional/venezuela-reapertura-vuelos-panama/24167654,"Venezuela extendió este miércoles hasta el 11 de febrero de 2021 el cierre de sus aeropuertos internacionales para vuelos comerciales, que comenzó en marzo debido a la pandemia por la covid-19, con la",12-11-2020 00:19,https://www.bing.com/th?id=OVFT.1FO_mPLRfrSUwmm_pRu_9S,Panamá,El Siglo
La Ciudad de Panamá está cerca de pasar al nivel amarillo en el semáforo del repunte de la COVID-19,https://www.panamaamerica.com.pa/sociedad/ciudad-panama-esta-cerca-pasar-al-nivel-amarillo-en-semaforo-del-repunte-covid-19-1175820,El plan de contingencia presentado esta semana por el Ministerio de Salud (Minsa) pretende que la población esté en sintonía con la realidad de la COVID-19 y sepa de antemano los pasos a seguir.En el,12-11-2020 00:40,https://www.bing.com/th?id=OVFT.tMY7nN2z0gWd5Lq4vU-jQi,Panamá,panamaamerica.com.pa
Panamá vuelve a superar los mil casos nuevos de COVID-19,https://www.panamaamerica.com.pa/sociedad/panama-vuelve-superar-mil-casos-nuevos-covid-19-1175816,"El Ministerio de Salud (Minsa) reportó la tarde de este miércoles 1.163 casos nuevos de COVID-19, en las últimas 24 horas en Panamá.A la fecha se aplicaron 6.288 pruebas nuevas de contagio, para un po",12-11-2020 00:50,https://www.bing.com/th?id=OVFT.wck9YoptPWMCOfaUYzqCbS,Panamá,panamaamerica.com.pa
Minsa reafirma nuevas medidas tras aumento de casos de COVID-19,https://www.diaadia.com.pa/el-pais/minsa-reafirma-nuevas-medidas-tras-aumento-de-casos-de-covid-19-372340,"El ministro de Salud, Luis Francisco Sucre, recomienda a la población extremar medidas de bioseguridad y cumplir con los protocolos de salud para evitar el contagio de la COVID-19.En estos momentos en",12-11-2020 01:09,https://www.bing.com/th?id=OVFT.UArX-ReX_aXhWzguBRhycC,Panamá,Día a Día
Roban ‘laptop’ a científico del Gorgas con información valiosa sobre el nuevo coronavirus,https://www.prensa.com/sociedad/roban-laptop-a-cientifico-del-gorgas-con-informacion-valiosa-sobre-el-nuevo-coronavirus/,"Lo que parecía un robo más en la ciudad de Panamá, en uno de los estacionamientos de una plaza comercial en el corregimiento de San Francisco, es en realidad la perdida de valiosa información científi",12-11-2020 01:12,https://www.bing.com/th?id=OVFT.8gr13hIbIP835CDqmXb9GS,Panamá,prensa.com
CCIAP pide ser incluido en elaboración de nuevas acciones para enfrentar el covid-19,https://www.telemetro.com/nacionales/2020/11/12/cciap-pide-ser-incluido-en-elaboracion-de-nuevas-acciones-para-enfrentar-el-covid-19/3448919.html,"La Cámara de Comercio, Industrias y Agricultura de Panamá (CCIAP) pidió a las autoridades ser incluidos en la toma de nuevas decisiones, ante el aumento de casos de covid-19 en el país, esto después d",12-11-2020 01:23,https://www.bing.com/th?id=OVFT.oyWR3d5u8gjvq9CwPHIkdC,Panamá,Telemetro
Es oficial. Cierran temporalmente el parque nacional de Coiba y la hermosa Reserva La Yeguada por casos de la covid-19,https://www.midiario.com/nacionales/es-oficial-cierran-temporalmente-el-parque-nacional-de-coiba-y-la-hermosa-reserva-la-yeguada-por-casos-de-la-covid-19/,"El Ministerio de Ambiente anunció a través de su cuenta de Twitter que se procede al cierre temporal de la Reserva Forestal La Yeguada y el Parque Nacional Coiba, en la provincia de Veraguas, a partir",12-11-2020 01:37,https://www.bing.com/th?id=OVFT.-xxUbZqYmyMdHDydiILRvS,Panamá,Mi Diario
