name,url,description,datePublished,imagen,pais,Fuente
Médicos cubanos son asignados a la Torre COVID-19 del hospital Rafael Hernández en Chiriquí,https://noticias24pty.com/medicos-cubanos-son-asignados-a-la-torre-covid-19-del-hospital-rafael-hernandez-en-chiriqui/,"Los 23 médicos cubanos asignados al Hospital Rafael Hernández ubicado en la ciudad de David, provincia de Chiriquí, reforzarán la atención en la Torre COVID-19, así lo informó el director médico Rolando Caballero. Versión impresa Destacó que los ...",27-12-2020 21:33,https://www.bing.com/th?id=OVFT.AGZipAVxqWf7wIYoUpamfS,Panamá,Noticias 24 PTY
"OMS eleva a 79,2 millones los casos y a 1,75 millones los muertos por covid",https://www.diaadia.com.pa/mundo/oms-eleva-792-millones-los-casos-y-175-millones-los-muertos-por-covid-373871,"Los casos globales de covid-19 notificados oficialmente a la Organización Mundial de la Salud (OMS) han llegado a los 79,2 millones, con 435.000 nuevos contagios correspondientes a la última jornada. Los decesos acumulados debido a esa enfermedad se ...",27-12-2020 22:37,https://www.bing.com/th?id=OVFT.CvyChdzA14h2pnSN93Vd7i,Panamá,Día a Día
Minsa ampliará el confinamiento desde el 4 de enero para frenar avance de la covid-19,https://www.laestrella.com.pa/nacional/201227/minsa-ampliara-confinamiento-4-enero-frenar-avance-covid-19,"como medida para frenar el acelerado incremento en el número de contagios y muertes registrados este mes de diciembre a causa de la covid-19. El ministro de Salud, Luis Francisco Sucre anunció que del 4 de enero al 14 de enero habrá cuarentena total y ...",27-12-2020 23:26,https://www.bing.com/th?id=OVFT.qei_Y6v54i34z3SH6wHDfC,Panamá,laestrella.com.pa
"Panamá reporta 2,633 nuevos casos de la covid-19 y 41 nuevas defunciones",https://www.laestrella.com.pa/nacional/201227/panama-reporta-2-633-nuevos-casos-covid-19-41-nuevas-defunciones,"Panamá reportó 2,633 nuevos casos de la covid-19, para un total acumulado de 231,357. A la fecha se aplicaron 9,831 pruebas, para un porcentaje de positividad de 26.7% y se han registrado 41 nuevas defunciones, que totalizan 3,840 acumuladas y una ...",27-12-2020 23:34,https://www.bing.com/th?id=OVFT.RsKhdWOTiGO0MEHZnkmLwC,Panamá,laestrella.com.pa
Instituto de Medicina Legal y Ciencias Forenses realiza entierro de unos 46 cadáveres no reclamados,https://www.panamaamerica.com.pa/judicial/instituto-medicina-legal-ciencias-forenses-realiza-entierro-unos-46-cadaveres-no-reclamados,"Eran casos forenses, no de COVID-19, de los últimos 5 meses. En total eran 46 los cadáveres, entre ellos adultos, fetos y restos óseos. “De esta forma se cumplió con un procedimiento legalmente establecido y se aumentó la capacidad de depósito de ...",27-12-2020 23:49,https://www.bing.com/th?id=OVFT.QVX5-WJkvGfwF9W4PPmx2y,Panamá,panamaamerica.com.pa
"Panamá contabiliza 231,357 casos de COVID-19 y 3,840 defunciones",https://www.telemetro.com/nacionales/2020/12/28/panama-contabiliza-231-357-casos-de-covid-19-y-3-840-defunciones/3590660.html,"El Ministerio de Salud informó que para este domingo en Panamá se contabilizan 231,357 contagios de coronavirus y 3,840 decesos a causa de este virus.",28-12-2020 00:18,https://www.bing.com/th?id=OVFT.3Wm3Vus9DW2GOd15zDkf_S,Panamá,Telemetro
Seguimos aumentando en los decesos de la covid-19 en Panamá. Los casos no paran,https://www.midiario.com/nacionales/seguimos-aumentando-en-los-decesos-de-la-covid-19-en-panama-los-casos-no-paran/,"En las últimas horas se aplicaron 9,831 pruebas para detectar coronavirus, para una positividad de 26.7%. De acuerdo con el informe epidemiológico del Minsa, hay 41,551 casos activos y 185,966 pacientes recuperados. Se mantienen en aislamiento 39,520 ...",28-12-2020 00:27,https://www.bing.com/th?id=OVFT.hBCMQ9wm9F0Fm5OI4rNbCC,Panamá,Mi Diario
Caldo Deportivo del 28 de diciembre de 2020,https://www.metrolibre.com/caldo-deportivo/190034-caldo-deportivo-del-28-de-diciembre-de-2020.html,Un mensaje que varias gimnastas compartieron y desearon en estos momentos difíciles por el covid-19. Club incluiría Parkour en clases “Agradecido con la Unión Panamericana de Gimnasia por realizar este curso de iniciación del Parkour con ...,28-12-2020 00:43,https://www.bing.com/th?id=OVFT.RZ94v7t3-HbPX3ZxTTZVFC,Panamá,Metro Libre
"Se registran 2,633 nuevos casos de COVID y 41 defunciones en las últimas horas",https://www.diaadia.com.pa/el-pais/se-registran-2633-nuevos-casos-de-covid-y-41-defunciones-en-las-ultimas-horas-373881,Estas pruebas son realizadas a pasajeros que ingresan al país sin el resultado negativo por COVID-19 exigido por la República de Panamá. Leer también: Niño de nueve años se ahoga en piscina de plástico en Arraiján Informe epidemiológico Para hoy ...,28-12-2020 02:04,https://www.bing.com/th?id=OVFT.F7Nselb9sGDoIFsGzv4m-S,Panamá,Día a Día
Fármacos para Covid-19 sin robusta evidencia científica calan en Panamá,https://www.prensa.com/impresa/panorama/farmacos-para-covid-19-sin-robusta-evidencia-cientifica-calan-en-panama/,"Pese a que no existe un respaldo científico robusto que garantice su eficacia contra la enfermedad Covid-19, en Panamá persiste el debate sobre el uso o no de medicamentos como la ivermectina, la hidr",28-12-2020 04:01,https://www.bing.com/th?id=OVFT._gNSaNTo5LAWnIc6pvQKYi,Panamá,prensa.com
El coronavirus muestra su crudeza a Panamá,https://www.prensa.com/impresa/panorama/el-coronavirus-muestra-su-crudeza-a-panama/,"La última semana epidemiológica, del 20 al 26 de diciembre, fue la peor de toda la pandemia de Covid-19 en el país, debido al aumento en el número de nuevos contagios, hospitalizados y muertes. El número total de casos fue de 19 mil 140, lo que ...",28-12-2020 04:49,https://www.bing.com/th?id=OVFT.kNVrAIYT95P9NaoEwEKVUi,Panamá,prensa.com
Gobierno recurre al encierro para contener el Covid-19,https://www.critica.com.pa/nacional/gobierno-recurre-al-encierro-para-contener-el-covid-19-595109,El gobierno retrocedió nueve meses atrás y aplicará la misma receta fallida para contener el Covid-19: el encierro de la población en las provincias de,28-12-2020 05:14,https://www.bing.com/th?id=OVFT.whkKSy61HZiwIRVKADit2y,Panamá,Critica
Gremio médico se opone a la contratación de cardiólogos extranjeros,http://elsiglo.com.pa/panama/gremio-medico-opone-contratacion-cardiologos-extranjeros/24170173,"Describen que ""en ningún momento los servicios de Cardiología de los principales Hospitales del sector público, ni la Sociedad Panameña de Cardiología, hemos solicitado la contratación""",28-12-2020 12:13,https://www.bing.com/th?id=OVFT.wl-7g8Q0eYTEY4wW_lys6i,Panamá,El Siglo
"En un nuevo intento por frenar los casos de Covid19, regresan las restricciones de movilidad",https://tucomunidad.com.pa/2020/12/en-un-nuevo-intento-por-frenar-los-casos-de-covid19-regresan-las-restricciones-de-movilidad/,"La nuevas medidas anunciadas por el Ministerio de Salud (Minsa) establecen nuevamente (del 4 al 14 de enero de 2021) restricciones de movilidad por género y cédula, además de toque de queda de 8:00 p.",28-12-2020 13:09,https://www.bing.com/th?id=OVFT.zgmikqJVf3VWqJ85l7grNC,Panamá,Tu Comunidad
"En Panamá, realizan capacitación de personal de salud, para reforzar atención de UCI en el IMFRE",https://sertv.gob.pa/nacionalfm/en-panama-realizan-capacitacion-de-personal-de-salud-para-reforzar-atencion-de-uci-en-el-imfre/,"Personal de salud, el cual formará parte de la sala habilitada como Unidad de Cuidados Intensivos (UCI) en el Instituto de Medicina Física y Rehabilitación (INMFRE), se está capacitando y preparando c",28-12-2020 13:15,https://www.bing.com/th?id=OVFT.rxD4g5ea68foFUNDRo07sS,Panamá,SERTV
Extranjeros piden ser incluidos en bonos solidarios,http://elsiglo.com.pa/panama/extranjeros-piden-incluidos-bonos-solidarios/24170176,"Ante la crisis que vive el país, producto de la pandemia del Covid-19, un grupo de migrantes, extranjeros y refugiados realizaron una petición ante la Defensoría del Pueblo, para ser incluidos en la e",28-12-2020 14:17,https://www.bing.com/th?id=OVFT.CA8jyxbYU0L1KqLA0brOQi,Panamá,El Siglo
Nueva cuarentena podría causar desenfreno en las compras de supermercado. Administrador de Acodeco pide cordura,https://www.midiario.com/nacionales/nueva-cuarentena-podria-causar-desenfreno-en-las-compras-de-supermercado-administrador-de-acodeco-pide-cordura/,"Jorge Quintero, administrador de Acodeco aconsejó a la población no salir a comprar montones de comida por la cuarentena total, sino más bien llevar su lista de compras y llevar lo necesario y así evi",28-12-2020 14:51,https://www.bing.com/th?id=OVFT.N1sVy6RJv_jvO4HKLyWhbS,Panamá,Mi Diario
"CNTP AL DIA, panel sobre la Brigada Henrry Reeve en Panamá (Videos)",https://bayanodigital.com/cntp-al-dia-panel-sobre-la-brigada-henrry-reeve-en-panama-videos/,"Redacción de Bayano digital Por una cortesía del medio alternativo hermano CNTP AL DIA, Bayano digital pone a disposición de audiencia los videos editados del programa sobre el arribo a Panamá de la B",28-12-2020 15:13,https://www.bing.com/th?id=OVFT.i5REldmcEdgVYdVPydPlUS,Panamá,Bayano Digital
Taxis circularán según los últimos dígitos de la placa,https://ensegundos.com.pa/2020/12/28/taxis-circularan-segun-los-ultimos-digitos-de-la-placa/,"Del 4 al 14 de enero el transporte selectivo (Taxis), regirá el último número de placa, por pares y nones. El Ministerio de Salud anunció un nuevo confinamiento y medidas restricción de movilidad para",28-12-2020 15:23,https://www.bing.com/th?id=OVFT.M86iw02S4peJy9O5WdACbC,Panamá,En Segundos
Seguridad jurídica y mano de obra calificada entre los retos que tiene Panamá,https://noticias24pty.com/seguridad-juridica-y-mano-de-obra-calificada-entre-los-retos-que-tiene-panama/,"Adoptar más tecnología, brindar mayor seguridad jurídica a las empresas extranjeras y una mano de obra calificada figuran como los retos que tiene Panamá para convertirse en un hub de",28-12-2020 16:24,https://www.bing.com/th?id=OVFT.c6iBVCVxjJlOWsLOIj7wHS,Panamá,Noticias 24 PTY
Administrador de ACP resalta acciones implementadas en pandemia logrando mantener las operaciones de tránsito,https://www.telemetro.com/nacionales/2020/12/28/administrador-acp-resalta-acciones-implementadas/3592279.html,"El administrador del Canal de Panamá, Ricaurte Vásquez, emitió este lunes un comunicado de fin de año, en el que destaca las acciones implementadas durante el 2020 en medio de la pandemia de la COVID-",28-12-2020 16:58,https://www.bing.com/th?id=OVFT.hVb3sR75g9bruaLBl3J0Ty,Panamá,Telemetro
Gobierno anuncia nuevas medidas para reducir cadena de contagio y letalidad en el país,https://sertv.gob.pa/nacionalfm/gobierno-anuncia-nuevas-medidas-para-reducir-cadena-de-contagio-y-letalidad-en-el-pais/,"Debido a la evolución que registra la pandemia COVID-19 en Panamá, dado que los índices de contagio y de su consecuente letalidad están vinculados directamente con el comportamiento social, el Ministr",28-12-2020 17:01,https://www.bing.com/th?id=OVFT.H9UEfrfJQsvMX3ckl5lgqi,Panamá,SERTV
Cámara Marítima rechaza medida de cuarentena total del 4 al 14 de enero de 2021,https://ensegundos.com.pa/2020/12/28/camara-maritima-rechaza-medida-de-cuarentena-total-del-4-al-14-de-enero-de-2021/,"Subrayan que los proveedores de sus empresas son comerciantes privados panameños cuyas operaciones se verán suspendidas, afectando directamente al sector logístico. Mediante comunicado, la Cámara Marí",28-12-2020 17:19,https://www.bing.com/th?id=OVFT.l-ZSY1_4XOuhHhcWrL2AsS,Panamá,En Segundos
Denuncian retraso en la atención y aglomeración de personas en centro de salud,https://www.critica.com.pa/whatsappcri/denuncian-retraso-en-la-atencion-y-aglomeracion-de-personas-en-centro-de-salud-595136,"A través de un video que fue divulgado a través de redes sociales, los afectados reportan el retraso en la atención y la aglomeración de personas que llegaron desde temprano en busca de atención médic",28-12-2020 17:22,https://www.bing.com/th?id=OVFT.fgA_fBrYaF3KNrAZzm88yS,Panamá,Critica
