name,url,description,datePublished,imagen,pais,Fuente
Al menos 12 casos positivos de la Covid-19 han sido detectados en albergues,https://www.prensa.com/sociedad/al-menos-12-casos-positivos-de-la-covid-19-han-sido-detectados-en-albergues/,"El Ministerio de Salud (Minsa) ha girado instrucciones para que en Chiriquí, Bocas del Toro y la comarca Ngäbe-Buglé −algunas de las regiones del país afectadas por el coletazo del huracán Eta− se hag",10-11-2020 19:20,https://www.bing.com/th?id=OVFT.blN1xLMXGl6VChKJyD9mXS,Panamá,prensa.com
Encuentran casos positivos de coronavirus en albergues del distrito de Barú,https://www.midiario.com/nacionales/encuentran-casos-positivos-de-coronavirus-en-albergues-del-distrito-de-baru/,El informe de la Operación Patria de este martes 10 de noviembre indica que el Servicio Nacional de Fronteras (Senafront) realizó un total de 341 pruebas de hisopados para detectar la covid-19 en dife,10-11-2020 20:58,https://www.bing.com/th?id=OVFT.aX2FqFk5HRvnMuATYWsW-C,Panamá,Mi Diario
Reportan 971 casos positivos y 9 defunciones por covid-19,https://www.critica.com.pa/nacional/reportan-971-casos-positivos-y-9-defunciones-por-covid-19-591992,"Panamá reportó este martes 971 nuevos casos positivos de covid-19 y 9 defunciones, según el informe epidemiológico del Ministerio de Salud .",10-11-2020 23:25,https://www.bing.com/th?id=OVFT.jJapPuMdByCfY4ofk5qLoy,Panamá,Critica
Reportan nueve defunciones y 971 casos nuevos de COVID-19 en las últimas 24 horas en Panamá,https://noticias24pty.com/reportan-nueve-defunciones-y-971-casos-nuevos-de-covid-19-en-las-ultimas-24-horas-en-panama/,"El Ministerio de Salud (Minsa) reportó esta tarde nueve defunciones y 971 casos nuevos de COVID-19 en las últimas 24 horas en Panamá.Versión impresaCon estas nuevas cifras, los decesos por el",11-11-2020 02:12,https://www.bing.com/th?id=OVFT.Ml6TDrk8t_7O6CU-94Q1ZC,Panamá,Noticias 24 PTY
"No se puede bajar la guardia, la batalla contra la COVID-19 no acaba",https://www.diaadia.com.pa/el-pais/no-se-puede-bajar-la-guardia-la-batalla-contra-la-covid-19-no-acaba-372310,"Desde el inicio de la pandemia nos hemos mantenido como país, en pie de lucha. En todos los lugares del mundo, cuando se levantaron las medidas de restricción se presentaron, en mayor o menor medida,",11-11-2020 02:45,https://www.bing.com/th?id=OVFT.EMqaHoJYznViM2UQ7rbMwC,Panamá,Día a Día
Expertos: La mascarilla debe acompañarnos en reuniones,https://www.metrolibre.com/nacionales/186501-expertos-la-mascarilla-debe-acompa%C3%B1arnos-en-reuniones.html,"Gabriela de Salazar, del departamento de Promoción de Salud del Minsa, explica que la mascarilla es una barrera de protección que debe usarse todos los días siempre que salga de casa, ya que minimiza",11-11-2020 04:10,https://www.bing.com/th?id=OVFT.dL8yINfVCnPw5ocm2IUKdy,Panamá,Metro Libre
Alarma: el ‘bicho' sigue cogiendo fuerza,http://elsiglo.com.pa/panama/alarma-bicho-sigue-cogiendo-fuerza/24167620,"Virólogos: la ciudadanía se está confiando con el uso de mascarillas y distanciamiento. El aumento de los casos por el covid-19 es evidente y aunque todavía no hay un rebrote,",11-11-2020 05:05,https://www.bing.com/th?id=OVFT.pauPjaEzHxf4VtC9BgOxGC,Panamá,El Siglo
Tejemeneje del 11 de noviembre de 2020,https://www.metrolibre.com/tejemeneje/186525-tejemeneje-del-11-de-noviembre-de-2020.html,"La reflexión de Sánchez Cárdenas. El exministro y exdirector de la CSS, Francisco Sánchez Cárdenas, dijo en tuiter que si practicamos sencillas medidas de seguridad, entre el",11-11-2020 05:20,https://www.bing.com/th?id=OVFT.lpDsuHCeBDXw24R9ysLR1C,Panamá,Metro Libre
Panamá no debe renegar su vocación minera,https://www.laestrella.com.pa/nacional/201111/panama-debe-renegar-vocacion-minera,Continuar renegando la vocación minera que el istmo panameño tiene por naturaleza geológica e histórica es impedirle al país y a sus ciudadanos aprovechar de forma sostenible valiosos recursos que son,11-11-2020 10:06,https://www.bing.com/th?id=OVFT.ZMDxtTpoVpiwQoxEtbbD2y,Panamá,laestrella.com.pa
Autoridades de Panamá advierten con retomar restricciones contra la pandemia,http://elsiglo.com.pa/panama/autoridades-panama-advierten-retomar-restricciones-contra-pandemia/24167632,"El plan, diseñado por el Ministerio de Salud, se basa en cinco ""niveles de alerta"" según el aumento de cuatro indicadores pandémicos",11-11-2020 12:23,https://www.bing.com/th?id=OVFT.rNKI6JEdquKwTgtiNRF7Ni,Panamá,El Siglo
Panamá cuenta con sus 12 jugadores para clasificatorios al FIBA AmeriCup 2022,https://www.tvmax-9.com/baloncesto/Panama-jugadores-clasificatorios-FIBA-AmeriCup_0_5714428512.html,"Panamá se medirá a Brasil en choque de invictos el viernes 27 de noviembre y al día siguiente lo hará ante Uruguay, por el Grupo B de los Clasificatorios FIBA AmeriCup 2022, donde también está Paragua",11-11-2020 13:09,https://www.bing.com/th?id=OVFT.9M5Mckv0dPGBXhMIgXM3kS,Panamá,TVMAX
"Primeras vacunaciones contra covid-19 en la UE, factibles en ""primer trimestre de 2021""",https://ensegundos.com.pa/2020/11/11/primeras-vacunaciones-contra-covid-19-en-la-ue-factibles-en-primer-trimestre-de-2021/,"La situación ante la pandemia en el Viejo Continente es ""muy, muy preocupante"" y ""todos nuestros indicadores van en la mala dirección"". Las primeras vacunaciones contra el covid-19 en la Unión Europea",11-11-2020 13:19,https://www.bing.com/th?id=OVFT.VzC4c4rNCYyxhnbuKHNoxS,Panamá,En Segundos
Estudios experimentales de la vacuna contra la COVID-19 en Panamá avanzan 'adecuadamente',https://www.tvn-2.com/nacionales/progreso-estudios-experimentales-COVID-19-Panama-vacuna_0_5714428516.html,"El doctor Eduardo Ortega, miembro del Consorcio de Investigación de Vacunas COVID-19, detalló que las pruebas científicas que se aplican de las vacunas en desarrollo en Panamá, progresan adecuadamente",11-11-2020 14:02,https://www.bing.com/th?id=OVFT.74LWSZpndraLDsNSUxlh1C,Panamá,TVN
Anuncian inscripciones para capacitación sobre Certificaciones de Origen en línea,https://elcapitalfinanciero.com/anuncian-inscripciones-para-capacitacion-sobre-certificaciones-de-origen-en-linea/,"A partir de este miércoles 11 de noviembre, las empresas exportadoras que requieran capacitarse sobre el uso de la Certificación de Origen en la plataforma en línea del Sistema de Gestión Aduanera (SI",11-11-2020 14:05,https://www.bing.com/th?id=OVFT.s6a3qBvH8EsYyHZzvzBIxC,Panamá,El Capital Financiero
"Panameño Betesh, piso fuerte en el GT Challenge de las Américas Panameño Betesh, piso fuerte en el GT Challenge de las Américas",https://www.cableondasports.com/mas-deportes/panameno-betesh-piso-fuerte-en-el-gt-challenge-de-las-americas_0_401196/,"El piloto panameño Solly Betesh al mando del auto Audi R 8 LMS, impuso autoridad en el autódromo Pedro Cofiño en la segunda fecha del GT Challenge de las Américas celebrado en Guatemala, con acreditar",11-11-2020 14:19,https://www.bing.com/th?id=OVFT.btadX3f3uhpNXUG7iICrFS,Panamá,Cable Onda Sports
"Teletrabajo, ¿el futuro laboral de Panamá?",https://noticias24pty.com/teletrabajo-el-futuro-laboral-de-panama/,"Debido a la pandemia por la COVID-19, que obligó al mundo entero a refugiarse en sus casas para evitar contagios, Panamá tuvo que agilizar una tarea pendiente: el teletrabajo, y por ello, en",11-11-2020 14:46,https://www.bing.com/th?id=OVFT.WVC-8D9RoCxs6YS0E46ksi,Panamá,Noticias 24 PTY
Panamá anunció lista jugadores para el FIBA AmeriCup 2022,http://www.nexpanama.com/panama-anuncio-lista-jugadores-para-el-fiba-americup-2022/,"entarán a Panamá en la segunda ventana de los Clasificatorios FIBA AmeriCup 2022, se jugarán del 27 al 30 de noviembre en Buenos Aires, Argentina. A continuación el listado de la Selección Nacional de",11-11-2020 15:00,https://www.bing.com/th?id=OVFT.D_bUbaidxzH0Eo_Adi4Eci,Panamá,NEX TV
"Según Rusia, pruebas muestran que eficacia de su vacuna supera el 90%",https://www.prensa.com/mundo/segun-rusia-pruebas-muestran-que-eficacia-de-su-vacuna-supera-el-90/,"El desarrollador de la vacuna insignia rusa contra la Covid-19 anunció que su tratamiento muestra una tasa de eficacia de 92% en la prevención de los contagios, mientras el país busca ocupar uno de lo",11-11-2020 15:01,https://www.bing.com/th?id=OVFT.rb9wUU8ENBVh-e7XqmxUgi,Panamá,prensa.com
Taxistas trancan el país. Exigen retorno del sistema de pares y nones [Videos],https://www.critica.com.pa/nacional/taxistas-trancan-el-pais-exigen-retorno-del-sistema-de-pares-y-nones-videos-592031,"""Somos más 30 mil unidades de taxis, no hay dinero y esto provocará que la cuenta diaria sea casi nada"", expresó.",11-11-2020 16:04,https://www.bing.com/th?id=OVFT.PYhShRZ8VkvTeXjJ3LJpei,Panamá,Critica
Gobierno restringirá el turismo en Guna Yala si continúa repunte de covid-19 en la zona,https://www.laestrella.com.pa/nacional/201111/gobierno-restringira-turismo-guna-yala-continua-repunte-covid-19-zona,"El titular de la cartera de salud, Luis Francisco Sucre, señaló que si la cifra de casos positivos por covid-19 continúa aumentado puede afectar al resto del país",11-11-2020 16:09,https://www.bing.com/th?id=OVFT.xP3xGJglk9dnZ8SnWR66Li,Panamá,laestrella.com.pa
Minsa exhorta a las empresas a utilizar el teletrabajo como una alternativa para los grupos vulnerables a la COVID-19,https://www.panamaamerica.com.pa/sociedad/minsa-exhorta-empresas-utilizar-teletrabajo-como-una-alternativa-grupos-vulnerables-covid,"El Ministerio de Salud (Minsa) exhorta a las empresas a utilizar el teletrabajo como una herramienta productiva para los grupos vulnerables dentro del ambiente laboral. De acuerdo con la entidad, el c",11-11-2020 16:09,https://www.bing.com/th?id=OVFT.EszG7UE6ukDw6QFM8mVfJC,Panamá,panamaamerica.com.pa
Optimismo en la Organización Mundial de la Salud ante los primeros grandes avances en la vacuna anticovid,https://www.panamaamerica.com.pa/mundo/optimismo-en-organizacion-mundial-salud-ante-primeros-grandes-avances-en-vacuna-anticovid,"La Organización Mundial de la Salud (OMS) sigue con optimismo los avances de las diferentes compañías farmacéuticas para lograr una vacuna contra la covid-19, después de que Pfizer y BioNTech anunciar",11-11-2020 16:13,https://www.bing.com/th?id=OVFT.DgaHzyrcsupTFgPGyXhXMy,Panamá,panamaamerica.com.pa
Minsa anunció Plan de Contingencia aplicado a provincias centrales,https://elcapitalfinanciero.com/minsa-anuncio-plan-de-contingencia-aplicado-a-provincias-centrales/,"Nadja Porcell, directora General del Ministerio de Salud (Minsa), anunció este martes, 10 de noviembre, un nuevo Plan de Contingencia que se pondrá en marca para mantener la tendencia al alza de los c",11-11-2020 16:42,https://www.bing.com/th?id=OVFT.Pgr3YvPnW90fyVcEaj3XAS,Panamá,El Capital Financiero
Autoridades de Panamá y España se reúnen para establecen acuerdos e iniciativas para el Bicentenario,https://www.telemetro.com/nacionales/2020/11/11/autoridades-panama-espana-acuerdos/3447161.html,Autoridades de Panamá y España sostuvieron una reunión con el objetivo de establecer una serie de acuerdos e iniciativas para la celebración del Bicentenario de la Independencia de Panamá en noviembre,11-11-2020 16:56,https://www.bing.com/th?id=OVFT.wJcVZKTALqXb479BnHAMvy,Panamá,Telemetro
Minsa recomienda continuar con el teletrabajo para grupos vulnerables,https://ensegundos.com.pa/2020/11/11/minsa-recomienda-continuar-con-el-teletrabajo-para-grupos-vulnerables/,"El comité Covid-19 de las empresas deben hacer una evaluación del recurso humano, que incluya adultos mayores de 60 años, trabajadores con comorbilidades, mujeres embarazadas, entre otros. En el camin",11-11-2020 17:02,https://www.bing.com/th?id=OVFT.7g_n_2KxYCjTkz0AE5qRVi,Panamá,En Segundos
Continúan las medidas contra el coronavirus en Panamá,https://www.radiopanama.com.pa/noticias/actualidad/continuan-las-medidas-contra-el-coronavirus-en-panama/20201111/nota/4084870.aspx,"Se ha evaluado, junto al ministro Luis Sucre, los criterios que han servido para hacer los cierres y aperturas de comercios.",11-11-2020 17:19,https://www.bing.com/th?id=OVFT.U5aKDYpkHePXVNpXvKWW7y,Panamá,Radio Panamá
