name,url,description,datePublished,imagen,pais,Fuente
La resistencia a los antibióticos ha incrementado en este 2020,http://elsiglo.com.pa/panama/resistencia-antibioticos-incrementado-este-2020/24168774,La Organización Mundial de la Salud desaconseja su uso para casos leves de COVID-19 y sí los recomienda en casos graves,02-12-2020 13:29,https://www.bing.com/th?id=OVFT.xbY72GkF8cv8xscS8IWB7C,Panamá,El Siglo
Japón permitirá llegada masiva de extranjeros para los Juegos Olímpicos,http://www.nexpanama.com/japon-permitira-llegada-masiva-de-extranjeros-para-los-juegos-olimpicos/,"Japón planea permitir que un gran número de extranjeros asista a los Juegos Olímpicos de Tokio del próximo año sin vacunas obligatorias o cuarentena, siempre que presenten resultados negativos de la p",02-12-2020 13:50,https://www.bing.com/th?id=OVFT.FPqQdHeu9Q8cRd8QyJ2m-y,Panamá,NEX TV
Covid-19 hace caer los salarios en todo el mundo,https://ensegundos.com.pa/2020/12/02/covid-19-hace-caer-los-salarios-en-todo-el-mundo/,"La pandemia de covid-19 hizo caer los salarios en todo el mundo durante el primer semestre de 2020 y se espera que “una muy fuerte presión a la baja” adicional en un futuro cercano, aseguró este miérc",02-12-2020 14:22,https://www.bing.com/th?id=OVFT.Rxw3YIzmhkVNCoyVSaHucy,Panamá,En Segundos
Kevin Hilton trabaja para alcanzar sus sueños y apuesta fuerte por la internacionalización,https://www.midiario.com/farandula/kevin-hilton-trabaja-para-alcanzar-sus-suenos-y-apuesta-fuerte-por-la-internacionalizacion/,"Tal vez usted lo recuerde de su participación cuando era más pequeño en el reality “Oye mi canto”, un programa que resaltaba esa mancuerna de los padres contribuyendo con sus hijos a alcanzar esa meta",02-12-2020 15:41,https://www.bing.com/th?id=OVFT.AeDoNtI3x41wnQz18-dgCy,Panamá,Mi Diario
El Panamá Jazz Festival va de forma virtual. Dos grandes cantautores nacionales dirán presentes en el evento,https://www.midiario.com/farandula/el-panama-jazz-festival-va-de-forma-virtual-dos-grandes-cantautores-nacionales-diran-presentes-en-el-evento/,"Uno de los eventos más esperados de inicio de año llega en el 2021 a su mayoría de edad y aunque con algunas innovaciones debido a la pandemia de covid-19, promete ser un espectáculo como siempre de n",02-12-2020 15:42,https://www.bing.com/th?id=OVFT.MMhRIGU6maKf892ZQAcuwi,Panamá,Mi Diario
Comunicado # 281,https://sertv.gob.pa/crisolfm/comunicado-281/,"El ministro de salud, Luis Francisco Sucre, informó que la actual administración del Ministerio de Salud, heredó deudas por B/.572.4 millones en diferentes rubros, entre ellos pagos a proveedores, cuo",02-12-2020 16:38,https://www.bing.com/th?id=OVFT.NgejyZ9m253gdLFc69rKty,Panamá,SERTV
Unión Europea critica “apresurada” aprobación británica de la vacuna,https://www.nexpanama.com/union-europea-critica-apresurada-aprobacion-britanica-de-la-vacuna/,"La Unión Europea criticó el miércoles la rápida aprobación británica de la vacuna contra el COVID-19 de Pfizer y BioNTech, diciendo que su propio procedimiento es más exhaustivo, después de que Reino",02-12-2020 17:57,https://www.bing.com/th?id=OVFT._thLjUmy1UWDWwzzW2Cm6C,Panamá,NEX TV
"Casos de la Covid-19 en América aumentaron casi 30% en noviembre, reporta la OPS",https://www.prensa.com/mundo/casos-de-la-covid-19-en-el-america-aumentaron-casi-30-en-noviembre-reporta-la-ops/,"Los casos de la Covid-19 en el continente americano aumentaron casi 30% en noviembre con respecto a octubre, informó este miércoles la directora de la Organización Panamericana de la Salud (OPS), Cari",02-12-2020 18:45,https://www.bing.com/th?id=OVFT.lTNs94TFeKdBMCDfP0H3sC,Panamá,prensa.com
Opiniones encontradas por toque de queda en Panamá Oeste,https://www.diaadia.com.pa/el-pais/opiniones-encontradas-por-toque-de-queda-en-panama-oeste-373039,"Los alcaldes de la provincia de Panamá Oeste, coincidieron en que el toque de queda y ley seca decretada por el Ministerio de Salud (Minsa) es una medida “que se veía venir” debido al repunte en los c",02-12-2020 19:52,https://www.bing.com/th?id=OVFT.fdBm0GSm2wwCa4a7ixv2Hi,Panamá,Día a Día
"Total de casos de covid-19 en las Américas sube un 30% en un mes, dice OPS",https://ensegundos.com.pa/2020/12/02/total-de-casos-de-covid-19-en-las-americas-sube-un-30-en-un-mes-dice-ops/,"El total acumulado de casos de covid-19 en el continente americano subió un 30% en un mes, dijo el miércoles la Organización Panamericana de la Salud (OPS). “Solo en el mes de noviembre tuvimos más de",02-12-2020 20:13,https://www.bing.com/th?id=OVFT.R03MRTTur4zzHBN6Q7qy1C,Panamá,En Segundos
"Dr. Lau Cortés: CSS aumenta capacidad de respuesta en la lucha contra la COVID-19, en Panamá",https://sertv.gob.pa/nacionalfm/dr-lau-cortes-css-aumenta-capacidad-de-respuesta-en-la-lucha-contra-la-covid-19-en-panama/,"En el reporte sanitario y epidemiológico emitido este martes, 1 de diciembre, el director general de la Caja de Seguro Social (CSS), Dr. Enrique Lau Cortés se refirió a diversos temas que lleva adelan",02-12-2020 21:15,https://www.bing.com/th?id=OVFT.WjX7HNZXu1QBx0uDorW9xS,Panamá,SERTV
Decreto sobre el año escolar 2021 ya está en despacho de la ministra de Eduación Maruja Gorday de Villalobos,https://www.panamaamerica.com.pa/sociedad/decreto-ano-escolar-2021-ya-esta-en-despacho-ministra-eduacion-maruja-gorday-villalobos,"Tras las consultas que se realizaron con gremios magisteriales, el Decreto Ejecutivo para el periodo escolar 2021 ya fue remitido al despacho de la ministra de Educación, Maruja Gorday de Villalobos,",02-12-2020 21:26,https://www.bing.com/th?id=OVFT.Jp5UTaEEGv0ewBgmoNUhCC,Panamá,panamaamerica.com.pa
"Panamá registra 2,028 casos de COVID-19 en las últimas 24 horas",https://www.telemetro.com/nacionales/2020/12/02/panama-acumula-registrarse-covid-19/3515819.html,"El informe epidemiológico revela que para este miércoles 2 de diciembre se han detectado 2,028 nuevos contagios en Panamá, elevando la cantidad de casos por COVID-19 a 169,339.",02-12-2020 23:30,https://www.bing.com/th?id=OVFT.wtCmNd2wRvTKiopQliQJCi,Panamá,Telemetro
"Sube a 2,028 los nuevos casos positivos de Covid-19 y 16 fallecidos",https://www.critica.com.pa/nacional/sube-2028-los-nuevos-casos-positivos-de-covid-19-y-16-fallecidos-593576,"Panamá reporta hoy, 2,028 casos positivos nuevos, para un total acumulado de 169,339 y se han registrado 16 nuevas defunciones, que totalizan 3,114 acumuladas y una letalidad del 1.8 %. A la fecha se",02-12-2020 23:48,https://www.bing.com/th?id=OVFT.5VJYdnatt8uEqOUIKOAxui,Panamá,Critica
Personal de AAUD denuncia falta de insumos para su protección contra el COVID-19,https://www.telemetro.com/nacionales/2020/12/03/personal-de-aaud-denuncia-falta-de-insumos-para-su-proteccion-contra-el-covid-19/3516268.html,Personal de la Autoridad de Aseo Urbano y Domiciliario de Panamá (AAUD) denuncia que le están entregando una mascarilla para laborar todo el día y la falta de insumos que en medio de su labor le prote,03-12-2020 00:08,https://www.bing.com/th?id=OVFT.S4q8LYBNmL12Tx41I7ev3C,Panamá,Telemetro
"Panamá supera los dos mil casos nuevos de COVID-19 en un solo día, lo cual es una cifra récord",https://noticias24pty.com/panama-supera-los-dos-mil-casos-nuevos-de-covid-19-en-un-solo-dia-lo-cual-es-una-cifra-record/,"Panamá rompe récord en la cifra de casos nuevos de COVID-19 al registrarse este miércoles 2,028 pacientes positivos, lo que aumenta el total acumulado a 169,339. Versión impresa A la fecha se",03-12-2020 00:31,https://www.bing.com/th?id=OVFT.V9D1hMbk3DcIK-YL5UAIAi,Panamá,Noticias 24 PTY
OPS alerta sobre alza de 30% de casos de COVID-19 en un mes en las Américas,https://www.tvn-2.com/mundo/OPS-alerta-casos-COVID-19-Americas_0_5730177031.html,"La Organización Panamericana de la Salud (OPS) reportó el miércoles un aumento de un 30% de casos de covid-19 en el continente americano en un mes, y llamó a mejorar la atención de los afrodescendient",03-12-2020 01:26,https://www.bing.com/th?id=OVFT.GgW_RLozJkIciQQGVs17ui,Panamá,TVN
OPS: inminente riesgo de rebrote de Covid-19 en Panamá,https://www.critica.com.pa/nacional/ops-inminente-riesgo-de-rebrote-de-covid-19-en-panama-593584,"La Organización Panamericana de la Salud (OPS) advirtió que es ""inminente el riesgo de un rebrote"" del Covid-19 a lo largo del territorio nacional de",03-12-2020 02:40,https://www.bing.com/th?id=OVFT.DrhF5jOUm8uhpm9wXyY6Zi,Panamá,Critica
Panamá alcanza récord de nuevos casos diarios de covid en medio de repunte,https://noticias24pty.com/panama-alcanza-record-de-nuevos-casos-diarios-de-covid-en-medio-de-repunte/,"Las autoridades de Panamá reportaron este miércoles 2.028 casos nuevos de covid-19, la cifra diaria más alta registrada en el país, que vive un repunte de la pandemia y acumula ya 169.339",03-12-2020 03:18,https://www.bing.com/th?id=OVFT.ob5Hw_PtYqR-HDOJsW4KMS,Panamá,Noticias 24 PTY
