name,url,description,datePublished,imagen,pais,Fuente
Costa Rica pide al FMI iniciar negociaciones para asistencia,https://www.prensa.com/impresa/economia/costa-rica-pide-al-fmi-iniciar-negociaciones-para-asistencia/,"Costa Rica pidió al Fondo Monetario Internacional (FMI) iniciar negociaciones para un acuerdo de asistencia por tres años, en que el gobierno se compromete a aplicar un ajuste fiscal, para hacer frent",31-08-2020 22:17,https://www.bing.com/th?id=ON.9BC26FC26E442192D7684576EACF6388,Panamá,prensa.com
En las últimas horas se registran 728 casos de Covid-19 y 12 fallecimientos,https://www.prensa.com/sociedad/en-las-ultimas-horas-se-registran-728-casos-de-covid-19-y-12-fallecimientos/,El reporte epidemiológico del Ministerio de Salud (Minsa) de este domingo 30 de agosto registra 728 nuevos casos del nuevo coronavirus y 12 decesos en las 24 últimas horas. Estas cifras aumentan los c,31-08-2020 22:17,https://www.bing.com/th?id=ON.AFB791CA12C019476B42C38F377F4862,Panamá,prensa.com
Barakaldo confirma el fichaje del 'plazino' Daniel Aparicio,https://www.tvmax-9.com/futbol_nacional/Barakaldo-confirma-fichaje-Daniel-Aparicio_0_5660433917.html,El Barakaldo CF desea comunicar el acuerdo alcanzado con el @cdplazaamador para la cesión de Daniel Aparicio. Dicha cesión incluye una opción de compra por parte del Barakaldo CF. Formado desde los 15,31-08-2020 23:47,https://www.bing.com/th?id=ON.D33B23EC0767F146E4E54D09E894CEF1,Panamá,TVMAX
"Cooperación, organización, velocidad, investigación y decisión",https://elcapitalfinanciero.com/cooperacion-organizacion-velocidad-investigacion-y-decision/,"Esta conversación es un llamado a adoptar una postura diferente ante nuestra realidad impuesta, por el coronavirus (COVID-19), y a empezar por quienes más requieren nuestra atención hoy. La reactivaci",01-09-2020 00:02,https://www.bing.com/th?id=ON.089267F34EC76F070539D50193CC0492,Panamá,El Capital Financiero
Panama pandemic deaths pass 2000 mark,https://www.newsroompanama.com/health/panama-pandemic-deaths-pass-2000-mark,"Panama exceeded 2000 deaths from COVID-19, on Monday, August 31 with the accumulated total of 2002 deaths so far in the pandemic. The fatality remains at 2.1%.",01-09-2020 00:39,https://www.bing.com/th?id=ON.5815D5938B62AE0C4A82FA24DB98A00B,Panamá,Newsroom Panama
Expertos canadienses prueban baya de açaí como tratamiento contra covid-19,https://ensegundos.com.pa/2020/08/31/expertos-canadienses-prueban-baya-de-acai-como-tratamiento-contra-covid-19/,Otros estudios han demostrado que los extractos de la baya de esta palma originaria de América Central y de América del Sur pueden reducir la inflamación. Investigadores canadienses están analizando u,01-09-2020 01:37,https://www.bing.com/th?id=ON.4B5DB5B7C06552DE18CA73F05BBC87C9,Panamá,En Segundos
"Más de 1,700 casos de COVID-19 se han reportado en las cárceles de Panamá, 197 siguen activos",https://www.panamaamerica.com.pa/sociedad/mas-de-1700-casos-de-covid-19-se-han-reportado-en-las-carceles-de-panama-197-siguen-activos,"Un total de 1,672 casos de la COVID-19 y unos 1,473 recuperados hay en los 15 centros penitenciarios a nivel nacional. La Nueva Joya es el Centro Penitenciario que más cantidad de casos positivos por",01-09-2020 01:47,https://www.bing.com/th?id=ON.D6BD32D756DD5FD8D7C048550D6CA33B,Panamá,panamaamerica.com.pa
Duatlón Solidario panameño completó su tercera serie,https://www.tvmax-9.com/mas_deportes/Duatlon-Solidario-panameno-completo-tercera_0_5660433973.html,"Anell Acosta (44 minutos y 52 segundos) y Ana Sofía Rodríguez (1 hora: 17 minutos y 23 segundos), registraron los mejores tiempos en el nivel Avanzado en las ramas masculina y femenina, respectivament",01-09-2020 02:08,https://www.bing.com/th?id=ON.C373F8E253206374099A6180BEDF4D28,Panamá,TVMAX
Panamá registra 917 casos nuevos de covid-19 y siete nuevas muertes,http://elsiglo.com.pa/panama/panama-registra917casosnuevos-covid-19-siete-nuevas-muertes/24163320,"Se han registraron 7 nuevas defunciones, que totalizan 2,002 acumuladas y una letalidad del 2.1 %.  En Panamá se contabilizan 66,173 pacientes recuperados, 917 casos positivos nuevos de covid-19, para",01-09-2020 02:30,https://www.bing.com/th?id=ON.4E17E631C55C58DCBEF7D75EAC1E0E7D,Panamá,El Siglo
"Equipo de trazabilidad sigue haciendo pruebas en la ciudad de Panamá, Panamá Oeste y Herrera",https://www.panamaamerica.com.pa/sociedad/equipo-de-trazabilidad-sigue-haciendo-pruebas-en-la-ciudad-de-panama-panama-oeste-y-herrera,La trazabilidad de los contactos y casos COVID-19 positivos ha sido una de las estrategias que ha generado una efectividad en la lucha contra la COVID-19. En las últimas semanas el Ministerio de Salud,01-09-2020 02:45,https://www.bing.com/th?id=ON.7CACCC29E9325D595524DC6E01DD71E4,Panamá,panamaamerica.com.pa
Los primeros Panamericanos Júnior se disputarán en septiembre de 2021 en Cali,https://www.laestrella.com.pa/deportes/mas-deportes/200831/primeros-panamericanos-junior-disputaran-septiembre-2021-cali,"El Gobierno colombiano y Panam Sports anunciaron este lunes que la primera edición de los Juegos Panamericanos Júnior se disputará en septiembre de 2021 en Cali, principal ciudad del suroeste del país",01-09-2020 05:20,https://www.bing.com/th?id=ON.397E3817C19CE7E6C140FE6E6900D086,Panamá,laestrella.com.pa
La importancia de la abogacía en medio de la Pandemia,http://elsiglo.com.pa/opinion/importancia-abogacia-medio-pandemia/24163344,"La crisis sanitaria provocada por el Covid 19, nos ha obligado a reinventarnos como sociedad. Para Walkiria Chandler D'Orcy, abogada, egresada de la Universidad de Panamá, los profesionales del derech",01-09-2020 05:34,https://www.bing.com/th?id=ON.77FF02ABD00E3C2E371F6F8F12047EB3,Panamá,El Siglo
Marketing Trends and Innovation Expo 2020,http://prnoticiaspanama.com/marketing-trends-and-innovation-expo-2020/,"En tiempos inciertos como los obligados a vivir por un acontecimiento mundial sin precedentes, la diferencia entre empresas que prefieren tomar la hoja de ruta tecnológica establecida y las que decide",01-09-2020 10:35,https://www.bing.com/th?id=ON.74CC98B518FB9CEE43C9C13E2D07227B,Panamá,PR Noticias Panama
"Panamá sobrepasa las 2 mil defunciones por COVID-19, acumula 92,982 casos",https://www.telemetro.com/nacionales/2020/08/31/panama-sobrepasa-las-2-mil-defunciones-por-covid-19-acumula-92-982-casos/3186267.html,"El Ministerio de Salud de Panamá (Minsa) reportó 917 nuevos casos de COVID-19 en las últimas 24 horas, elevando a 92,982 el total de contagios acumulados. En tanto, se registraron 7 nuevas defunciones",01-09-2020 12:22,https://www.bing.com/th?id=ON.25C275DF7941699A878010D27FFB8EA4,Panamá,Telemetro
"Vacuna de Covid-19 sería obligatoria en Panamá, según anteproyecto",https://www.metrolibre.com/nacionales/180705-vacuna-de-covid-19-ser%C3%ADa-obligatoria-seg%C3%BAn-anteproyecto.html,"Los diputados Tito Rodríguez, Ricardo Torres, Víctor Castillo y Miguel Fanovich presentaron ante la Comisión de Trabajo, Salud y Desarrollo un anteproyecto de ley que buscaría distribuir la vacuna con",01-09-2020 12:37,https://www.bing.com/th?id=ON.CA95154FC87D7B2319AC60D8066A5C6B,Panamá,Metro Libre
Grupo Empresarial Eleta apoya a pacientes COVID-19,http://prnoticiaspanama.com/grupo-empresarial-eleta-apoya-a-pacientes-covid-19/,"En un nuevo esfuerzo de la empresa privada por ayudar a los afectados por coronavirus, Guillermo de Saint Malo Eleta, CEO de Eleta, entregó 2,500 kits para uso de pacientes de COVID-19. La donación, v",01-09-2020 13:54,https://www.bing.com/th?id=ON.6932A2863E193E465AD16B3F01FDDF94,Panamá,PR Noticias Panama
"Hidroxicloroquina en tratamientos de COVID-19 podría tener 'efectos adversos' , según especialista",https://www.tvn-2.com/nacionales/Hidroxicloroquina-COVID-19-contraproducente-adversos-especialista_0_5661183846.html,"La evidencia que existe en estos momentos sobre el uso de medicamentos como la hidroxicloroquina, en el tratamiento contra la COVID-19, indica que no ha mostrado ser efectivo en la parte temprana, ni",01-09-2020 16:10,https://www.bing.com/th?id=ON.92AECC751C31D62C1EB9ED0281B93EBC,Panamá,TVN
“Do as I say not as I Do” -- Health Ministry Leader,https://www.newsroompanama.com/health/do-as-i-say-not-as-i-do-health-ministry-leader,"Minister of Health Counselor Eyra Ruiz, who has been declaiming that “no one is above the law” is the latest official of the current government to f",01-09-2020 17:24,https://www.bing.com/th?id=ON.8AA78838CAB4DE0CCD7138F38067649E,Panamá,Newsroom Panama
Tito Rodríguez: Vacuna de Covid-19 no sería obligatoria en Panamá,https://www.metrolibre.com/nacionales/180715-tito-rodr%C3%ADguez-vacuna-de-covid-19-no-ser%C3%ADa-obligatoria-en-panam%C3%A1.html,"Los proponentes del Anteproyecto de Ley No. 80 que busca que “la vacuna contra el Covid sea Universal, Pública y Gratuita para los Panameños”, aclaran que en ningún artículo de la propuesta se incluye",01-09-2020 17:44,https://www.bing.com/th?id=ON.60D48D53FAB25CFDA0ECE42774AA52E8,Panamá,Metro Libre
Venezolanos varados en Panamá piden apoyo para retornar a su país,https://www.tvn-2.com/nacionales/Venezolanos-varados-Panama-piden-retornar-covid-19-coronavirus_0_5661183874.html,"Una manifestación pacífica en las afueras de la Embajada de Venezuela en Panamá, realizó un grupo de ciudadanos de este país que han quedado varados en Panamá producto de la pandemia de la COVID-19. E",01-09-2020 18:07,https://www.bing.com/th?id=ON.720B62C4252F22A1CC35179C4B9749CE,Panamá,TVN
Realizan jornada de nebulización de taxis en Panamá Este,https://www.telemetro.com/nacionales/2020/09/01/realizan-jornada-de-nebulizacion-de-taxis-en-panama-este/3189060.html,"Una jornada de nebulización de taxis y otros vehículos de transporte público realizó la Junta Comunal del corregimiento de Tocumen, Panamá Este, con el fin de evitar contagios de COVID-19.",01-09-2020 19:38,https://www.bing.com/th?id=ON.251F88C617C126787EEBCB799CA861B9,Panamá,Telemetro
Reportan nuevos casos de COVID-19 en personal del hospital Nicolás Solano,https://www.diaadia.com.pa/el-pais/reportan-nuevos-casos-de-covid-19-en-personal-del-hospital-nicolas-solano-369902,Nuevos casos de coronavirus fueron confirmados entre el personal médico y administrativo que labora en el hospital regional Nicolás A. Solano en la provincia de Panamá Oeste. Una fuente hospitalaria i,01-09-2020 19:45,https://www.bing.com/th?id=ON.AFD68DB5AE645E14FD429221751192EA,Panamá,Día a Día
Panamá debate futura ley para vacuna contra la COVID-19 gratuita y universal,https://www.diaadia.com.pa/el-pais/panama-debate-futura-ley-para-vacuna-contra-la-covid-19-gratuita-y-universal-369904,"La Asamblea Nacional de Panamá comenzará a debatir un anteproyecto de ley que establece que la futura vacuna contra la COVID-19 sea aplicada de manera universal y gratuita a los panameños, dijo este m",01-09-2020 19:45,https://www.bing.com/th?id=ON.562C13ED514CFECB266D1C08B69649C3,Panamá,Día a Día
El coronavirus hunde la economía mundial en una recesión récord,https://ensegundos.com.pa/2020/09/01/el-coronavirus-hunde-la-economia-mundial-en-una-recesion-record-2/,"Brasil, primera economía de América Latina, registró una contracción récord de 9,7% en el segundo trimestre del año respecto al primeromía Luego de India el lunes, Brasil dio a conocer este martes una",01-09-2020 19:54,https://www.bing.com/th?id=ON.A1AB7E4CC9186711576CA4ED561566BE,Panamá,En Segundos
