name,url,description,datePublished,imagen,pais,Fuente
Cierran sede principal del Registro Civil y la Regional de Panamá Centro por casos de Covid-19,https://www.metrolibre.com/nacionales/189165-cierran-sede-principal-del-registro-civil-y-la-regional-de-panam%C3%A1-centro-por-casos-de-covid-19.html,"Debido a que se han registrado varios casos de Covid-19, el Pleno del Tribunal Electoral (TE) ordenó el cierre del Despacho principal de la Dirección Nacional de Registro Civil y de la Dirección Regional del Registro Civil de Panamá Centro, con el fin ...",15-12-2020 03:48,https://www.bing.com/th?id=OVFT.zjRvsJCTgGPle11AJmnuji,Panamá,Metro Libre
Vamos rumbo a 200 mil contagios de Covid-19 en Panamá,https://www.critica.com.pa/nacional/vamos-rumbo-200-mil-contagios-de-covid-19-en-panama-594332,"La semana 51 del Covid-19 en Panamá arrancó con 1,612 nuevos casos y 26 decesos, elevando a 194,619 los contagios acumulados y a 3,382 los",15-12-2020 05:20,https://www.bing.com/th?id=OVFT.8m0b4Zasq0V93k09yB6OFS,Panamá,Critica
Prestigioso científico panameño muere por Covid-19,https://www.critica.com.pa/nacional/prestigioso-cientifico-panameno-muere-por-covid-19-594336,"El doctor Mahabir Gupta, uno de los principales científicos de Panamá, falleció ayer. Fue admitido hace semanas por Covid-19 y murió de hipertensión pulmonar. El",15-12-2020 05:25,https://www.bing.com/th?id=OVFT.tz7MuAGmktvDbX8M3dg1JS,Panamá,Critica
La OPEP cuenta con Asia y vacunas para la recuperación del crudo,https://www.panamaamerica.com.pa/economia/opep-cuenta-con-asia-vacunas-recuperacion-del-crudo-1177835,"Los precios del petróleo avanzaron en noviembre hasta niveles que no se veían desde marzo, impulsados por las vacunas contra la COVID-19, pero están aún lejos de las cotas de antes de la pandemia.",15-12-2020 05:30,https://www.bing.com/th?id=OVFT.YD9croRQ4An-sOt5tVoN2i,Panamá,panamaamerica.com.pa
Obras de la línea 3 generarán cerca de 3 mil empleos,https://www.laestrella.com.pa/economia/201215/obras-linea-3-generaran-cerca,"En el primer semestre de 2020, la economía panameña cayó un 19% afectada por la cuarentena para reducir los contagios de la covid-19. El contrato de la obra espera la revisión de la Contraloría General de la República, para posteriormente entregar la ...",15-12-2020 06:07,https://www.bing.com/th?id=OVFT.mniQnh_tyWYOD0mCAG-bUi,Panamá,laestrella.com.pa
Asma y covid-19 una combinación perjudicial,https://www.laestrella.com.pa/cafe-estrella/salud/201215/asma-covid-19-combinacion-perjudicial,"En Panamá, aún no hay estadísticas oficiales que demuestren o relacionen las muertes por asma a causa de la covid-19, sin embargo, los médicos afirman que esta combinación es letal, si no se realizan los exámenes pertinentes a tiempo. Sin embargo ...",15-12-2020 06:07,https://www.bing.com/th?id=OVFT.1iUvfIJK7KOUPc6Gmei6Ei,Panamá,laestrella.com.pa
Gobierno de Venezuela cancela vuelos de Copa Airlines desde y hacia Caracas,https://elcapitalfinanciero.com/blog/,"Gobierno de Venezuela cancela vuelos de Copa Airlines desde y hacia Caracas. Actualidad, Top News; diciembre 12, 2020; Copa Airlines emitió un comunicado en el que informa la can",26-11-2020 00:18,https://www.bing.com/th?id=OVFT.2JKApGWJCAmcQIQ4oWY6fy,Panamá,El Capital Financiero
Panameño sustenta de forma ‘sobresaliente’ su tesis doctoral en España,http://elsiglo.com.pa/panama/panameno-sustenta-forma-sobresaliente-tesis-doctoral-espana/24169518,"Su trabajo doctoral contempló el análisis de infecciones de carácter comunitario. Fermín Acosta, oriundo de la comarca Ngäbe-Buglé, es un joven biotecnólogo que recientemen",15-12-2020 13:48,https://www.bing.com/th?id=OVFT.cvcyCNZW7j_Nmkev4XXqXi,Panamá,El Siglo
Consejo Académico de la UP analizará solicitud de la CSS de utilizar gimnasio para pacientes con la Covid-19,https://www.prensa.com/sociedad/consejo-academico-de-la-up-analizara-solicitud-de-la-css-de-utilizar-gimnasio-para-pacientes-con-la-covid-19/,El Consejo Académico de la Universidad de Panamá (UP) analizará este miércoles si cede las instalaciones del gimnasio universitario para recibir a pacientes con la,15-12-2020 14:17,https://www.bing.com/th?id=OVFT.DFnJ8_OzrxXHVtXL4woguS,Panamá,prensa.com
"Ministro Pino: ""Hemos perdido a 30 unidades por el Covid-19""",https://ensegundos.com.pa/2020/12/15/ministro-pino-hemos-perdido-a-30-unidades-por-el-covid-19/,"Del total de muertes en la FTC, 18 son de la Policía Nacional, uno del Senan, cinco del Senafront, cinco del Cuerpo de Bomberos de Panamá y uno del Sinaproc. El Ministro de Seguridad Pública (Minseg),",15-12-2020 15:57,https://www.bing.com/th?id=OVFT.QO04vpKvxn29-YqAKmqBrC,Panamá,En Segundos
"En Panamá, siguen realizando exportaciones de zapallo hacia EE.UU, Europa y el Caribe",https://sertv.gob.pa/nacionalfm/en-panama-siguen-realizando-exportaciones-de-zapallo-hacia-ee-uu-europa-y-el-caribe/,"Pese a la contracción de los principales mercados internacionales por la pandemia de COVID-19, Panamá, continúa con las exportaciones de diversos productos nacionales como es el zapallo y papaya, entre otros. Como manifiesta el director Nacional de ...",15-12-2020 16:05,https://www.bing.com/th?id=OVFT.GGsUXcN_mbkCaIZyz5xuVi,Panamá,SERTV
Instituto Gorgas ampliará el estudio de seroprevalencia,https://www.tvn-2.com/nacionales/Avanzan-seroprevalencia-exposicion-panamenos-Covid-Instituto-Gorgas_0_5739925997.html,"causante de la enfermedad COVID-19, llevan adelante Científicos del Instituto Conmemorativo Gorgas de Estudios de la Salud (ICGES), en conjunto con el Hospital Santo Tomás y el Instituto de Investigaciones Científicas y Servicios de Alta Tecnología de ...",15-12-2020 16:52,https://www.bing.com/th?id=OVFT.GWQ_78nC4bzgspxR2zpnjS,Panamá,TVN
La covid-19 ha cobrado la vida de 30 unidades de la Fuerza de Tarea Conjunta en Panamá,https://noticias24pty.com/la-covid-19-ha-cobrado-la-vida-de-30-unidades-de-la-fuerza-de-tarea-conjunta-en-panama/,La última víctima a causa del coronavirus se reportó la madrugada de este martes y era una unidad de la Policía Nacional Una unidad de la Policía Nacional de Panamá solicita documentación a un,15-12-2020 17:25,https://www.bing.com/th?id=OVFT.Fc3OnctBuyCNdLhf5I-NOi,Panamá,Noticias 24 PTY
Reforzarán la red primaria y hospitales ante repunte de la covid-19 en Panamá,https://www.midiario.com/nacionales/reforzaran-la-red-primaria-y-hospitales-ante-repunte-de-la-covid-19-en-panama/,"Panamá reportó 26 muertes por la covid-19 y mil 612 casos nuevos el lunes, con esta actualización el país acumula 3 mil 382 defunciones por el virus y 194 mil 619 casos en todo el territorio nacional.",15-12-2020 17:43,https://www.bing.com/th?id=OVFT.JvAjD1CB2IFue1iMadULNi,Panamá,Mi Diario
EEUU allana vía para aprobación vacuna de Moderna para el COVID-19,https://www.nexpanama.com/eeuu-allana-via-para-aprobacion-vacuna-de-moderna-para-el-covid-19/,El personal de la FDA dijo en documentos divulgados el martes que un régimen de dos dosis de la vacuna de Moderna era altamente efectivo en la prevención de casos confirmados de COVID-19. Los comentarios se hicieron en documentos preparados para la ...,15-12-2020 17:47,https://www.bing.com/th?id=OVFT.1qzhHHKU__yFVAytoqRGGy,Panamá,NEX TV
Autoridad de Pasaportes anuncia cierre de oficinas en Colón tras contagios de COVID-19,https://www.telemetro.com/nacionales/2020/12/15/autoridad-pasaportes-anuncia-cierre-oficinas/3557855.html,"La Autoridad de Pasaportes de Panamá (APAP) anunció que su sede de Colón suspendió temporalmente la atención al público desde este martes 15 de diciembre tras detectarse casos positivos de COVID-19 dentro de la institución. ""El cierre temporal es ...",15-12-2020 18:47,https://www.bing.com/th?id=OVFT.L3l42X10kz_ASqX5upgOrC,Panamá,Telemetro
PIB cae 23.6% en el tercer trimestre ante la crisis del coronavirus,https://noticias24pty.com/pib-cae-23-6-en-el-tercer-trimestre-ante-la-crisis-del-coronavirus/,"El Instituto Nacional de Estadísticas y Censo (Inec) informó que el Producto Interno Bruto (PIB), en el tercer trimestre, disminuyó 23.6%, aunque recuperó 15 puntos porcentuales con respecto al",15-12-2020 19:20,https://www.bing.com/th?id=OVFT.179DHQzK2V-1EERFTwV1ay,Panamá,Noticias 24 PTY
Consejo Académico de la UP analizará este miércoles solicitud de la CSS de utilizar gimnasio,https://www.telemetro.com/nacionales/2020/12/15/consejo-academico-up-analizara-miercoles/3558008.html,"El Consejo Académico de la Universidad de Panamá (UP) analizará este miércoles 16 de diciembre, la solicitud de la Caja de Seguro Social (CSS), de permitirle el uso del gimnasio, ubicado frente a las",15-12-2020 19:48,https://www.bing.com/th?id=OVFT.EQnA6Y0ueAFIa2hEgBGPoC,Panamá,Telemetro
PIB de Panamá con leve mejoría en tercer trimestre de 2020,https://ensegundos.com.pa/2020/12/15/pib-de-panama-se-contrae-23-6-en-tercer-trimestre-de-2020/,"Durante la presentación de la cifras, Moreno destacó el impacto que ha causado el covid-19 en América Latina y el Caribe, sin embargo, la región ya acumulaba casi siete años de bajo crecimiento con un promedio de 0.4% entre 2004 y 2019, según las ...",15-12-2020 20:38,https://www.bing.com/th?id=OVFT.90xbd2H5BpOOZxWCRVTzqC,Panamá,En Segundos
