name,url,description,datePublished,imagen,pais,Fuente
"Dr. Lau Cortés se reúne con directores médicos de Panamá Metro, Este y Oeste",https://noticias24pty.com/dr-lau-cortes-se-reune-con-directores-medicos-de-panama-metro-este-y-oeste/,"Hoy 4 de julio, el director general de la Caja de Seguro Social (CSS), Dr. Enrique Lau Cortés, tuvo un encuentro con directores médicos, nacionales y jefes de servicio de Panamá Este, Oeste y Metro, c",05-07-2020 07:18,https://www.bing.com/th?id=ON.CD66AD1D7F628C6F39F627F3B0C78C00,Panamá,Noticias 24 PTY
Consejo Consultivo recomienda nombrar personal para trazabilidad y atención de pacientes de Covid-19,https://www.metrolibre.com/nacionales/175998-consejo-consultivo-recomienda-nombrar-personal-para-trazabilidad-y-atenci%C3%B3n-de-pacientes-de-covid-19.html,"""Nombrar recurso humano para la atención de personas afectadas por Covid-19, además de un personal para realizar la trazabilidad de las cosas"", son algunas de las recomendaciones hechas por el Consejo",07-07-2020 22:35,https://www.bing.com/th?id=ON.1F64240566711D91F09E966678E3C365,Panamá,Metro Libre
Seleccionan 49 muestras de café de Panamá para cata internacional,https://www.prensa.com/provincias/seleccionan-49-muestras-de-cafe-de-panama-para-cata-internacional/,"Los jueces internacionales escogerán los mejores cafés de Panamá. Un total de 49 muestras del mejor café de Panamá participarán en la vigésima cuarta versión de The Best of Panamá, que se hará a travé",07-07-2020 23:22,https://www.bing.com/th?id=ON.49DA326DB39E16047D2DD283AD838821,Panamá,prensa.com
"COVID-19: Panamá suma 799 defunciones y 40,291 contagios",https://www.critica.com.pa/nacional/covid-19-panama-suma-799-defunciones-y-40291-contagios-582909,"Panamá registró este martes 957 casos y 29 nuevas muertes por COVID-19, que hacen un total de 40,291 contagios confirmados y de 799 defunciones en 121 días de pandemia en el país, para una tasa de let",08-07-2020 00:17,https://www.bing.com/th?id=ON.F5558E16062DB004691B0E63922FF84F,Panamá,Critica
Número reproductivo efectivo del COVID-19 en Panamá es de 1.35,https://www.telemetro.com/nacionales/2020/07/08/numero-reproductivo-efectivo-del-covid-19-en-panama-es-de-1-35/3024384.html,"El Rt o índice reproductivo efectivo del COVID-19 en Panamá, a la fecha, es de 1.35 según indicó el Ministerio de Salud (Minsa), este martes 7 de julio. Mientras que el porcentaje de letalidad del vir",08-07-2020 00:20,https://www.bing.com/th?id=ON.C10874AEE8158312F1468D9D31D48791,Panamá,Telemetro
Testimonios de pacientes panameños curados de COVID-19,http://www.nexpanama.com/testimonios-de-pacientes-panamenos-curados-de-covid-19/,"La Dra. Ajoortt Lezcano y la Dra. Marta Roa, comparten sus experiencias con pacientes contagiados con COVID-19.",08-07-2020 00:56,https://www.bing.com/th?id=ON.C6A846D46AC64BB98A3D55347979BF9C,Panamá,NEX TV
Préstamos por covid-19 en EEUU financian a multimillonarios como rapero Kanye West,https://ensegundos.com.pa/2020/07/07/prestamos-por-covid-19-en-eeuu-financian-a-multimillonarios-como-rapero-kanye-west/,"West, quien anunció su candidatura para las elecciones presidenciales de Estados Unidos en noviembre, se benefició de los fondos del Programa de Protección de Cheques. El empresario, cantante y produc",08-07-2020 01:18,https://www.bing.com/th?id=ON.352EAB8CD75E8E6C40234E968F2850FA,Panamá,En Segundos
OMS afirma que hay pruebas sobre posible transmisión aérea del COVID-19,https://www.radiopanama.com.pa/noticias/fecha/20200707.aspx,El Departamento de Justicia de EEUU publica el comunicado en donde agradece a Guatemala por la captura y da mayores detalles.,08-07-2020 01:29,https://www.bing.com/th?id=ON.7D78B3FEAE78D8AC05601605E2D2BC64,Panamá,Radio Panamá
Panamá supera los 40 mil casos de coronavirus,http://elsiglo.com.pa/panama/panama-supera-40-casos-coronavirus/24159982,"Este martes 7 de julio se reportaron 957 casos nuevos de covid-19 en Panamá alcanzando un total acumulado de 40,291 infectados con el virus, además de 799 fallecidos, de estos 29 murieron en las últim",08-07-2020 02:16,https://www.bing.com/th?id=ON.7210D59A3D6BF13EEA41E4B9846A02BD,Panamá,El Siglo
Panamá reporta 957 nuevos casos de COVID-19 y sobrepasa los 40 mil contagios,https://www.telemetro.com/nacionales/2020/07/07/panama-reporta-957-nuevos-casos-de-covid-19-y-sobrepasa-los-40-mil-contagios/3024051.html,"Se realizaron 2,427 nuevas pruebas para detectar COVID-19, para un total de 150,542 pruebas de las cuales 107,269 han resultado negativas. Hay 18,726 pacientes recuperados clínicamente y 20,766 casos",08-07-2020 03:35,https://www.bing.com/th?id=ON.E31C31D0446CBE18BFE7734BB032B610,Panamá,Telemetro
Colombia amplía un confinamiento cada vez más relajado,https://www.prensa.com/mundo/colombia-amplia-un-confinamiento-cada-vez-mas-relajado/,El país es sexto en América Latina en número de muertos por Covid-19 y el quinto en contagios. AFP/Archivo Colombia extenderá hasta el 1 de agosto las medidas de aislamiento cada vez más relajadas con,08-07-2020 03:56,https://www.bing.com/th?id=ON.430807729EABBE2B7F93BFCF9CAC8912,Panamá,prensa.com
Ajustan detalles para reapertura de Minera Panamá,http://elsiglo.com.pa/panama/ajustan-detalles-para-reapertura-minera-panama/24159999,"El Ministerio de Salud (Minsa) informó este martes que están ultimando los detalles para la reapertura de la empresa Minera Panamá, luego que esta cumpliera y adecuara las medidasestablecidas en los p",08-07-2020 05:10,https://www.bing.com/th?id=ON.CBDDFF95499BBD56B2DC892989700536,Panamá,El Siglo
Coronavirus no da tregua: Panamá reporta 29 nuevas muertes y un Rt de 1.35,https://www.panamaamerica.com.pa/sociedad/coronavirus-no-da-tregua-panama-reporta-29-nuevas-muertes-y-un-rt-de-135-1167275,"El coronavirus continúa sin dar tregua en Panamá. Para este martes el Ministerio de Salud (Minsa) reportó 957 casos positivos nuevos, 29 fallecimientos más y un número reproductivo efectivo de 1.35. V",08-07-2020 05:16,https://www.bing.com/th?id=ON.5A138EE6C66F1D68F34EC86AE8248A89,Panamá,panamaamerica.com.pa
Significativo aumento de pacientes en salas,https://www.panamaamerica.com.pa/sociedad/significativo-aumento-de-pacientes-en-salas-1167274,"En las salas de los hospitales se registra un importante aumento de pacientes con COVID-19, el cual coincide con un elevado índice reproductivo, según datos suministrados anoche por la doctora Rocío A",08-07-2020 05:16,https://www.bing.com/th?id=ON.EB76D4F2B20D9052EEE2D6271EE18FB1,Panamá,panamaamerica.com.pa
Infectólogos proponen retomar uso de hidroxicloroquina en Panamá,https://www.critica.com.pa/nacional/infectologos-proponen-retomar-uso-de-hidroxicloroquina-en-panama-582924,Un equipo de infectólogos panameños ha recomendado al Gobierno Nacional reanudar un tratamiento para pacientes de Covid-19 basado en una combinación del fármaco hidroxicloroquina (HCQ) con el antibiótico azitromicina (AZ). Los médicos se fundamentan ...,08-07-2020 05:18,https://www.bing.com/th?id=ON.7FFF40B3AD23A687C71A2A114CAF9AAA,Panamá,Critica
Panamá en la actualidad marítima. Parte 1,https://www.metrolibre.com/opini%C3%B3n/176041-panam%C3%A1-en-la-actualidad-mar%C3%ADtima-parte-1.html,"El escenario internacional en el que las economías de más de 180 naciones del mundo se han visto diezmada por el COVID-19, irá recuperándose. Pasada esta etapa, la economía mundial se reactivará incluyendo la actividad marítima. Panamá tiene que ...",08-07-2020 10:12,https://www.bing.com/th?id=ON.953431DDBAB664D598514F769A8C7E1A,Panamá,Metro Libre
Latinoamérica y el Caribe desplazan a EEUU como epicentro del coronavirus en América,http://www.nexpanama.com/latinoamerica-y-el-caribe-desplazan-a-eeuu-como-epicentro-del-coronavirus-en-america/,"América Latina y el Caribe desplazaron a Estados Unidos como el epicentro de la pandemia del coronavirus en América, al reportar más del 50% de los casos de COVID-19 en la región en la última semana,",08-07-2020 12:01,https://www.bing.com/th?id=ON.8EF4EE5932C474CCAF324F18601ABE26,Panamá,NEX TV
"Panamá Oeste, San Miguelito y Chiriquí principales áreas de contagio",https://ensegundos.com.pa/2020/07/07/panama-oeste-san-miguelito-y-chiriqui-principales-areas-de-contagio/,El covid-19 acabó con la vida de 29 panameños en las últimas 24 horas. Se informan 957 casos nuevos  que corresponde al 39% de las pruebas aplicadas. El contagio de covid-19 en el país incrementa su v,08-07-2020 12:20,https://www.bing.com/th?id=ON.1222303F061976F40C40E8750FA54F57,Panamá,En Segundos
Doctora Lourdes Moreno está en aislamiento tras realizarse prueba por COVID-19,https://www.tvn-2.com/nacionales/Doctora-Lourdes-Moreno-aislamiento-COVID-19_0_5619188106.html,"La tarde de este martes 7 de julio se conoció que la Jefa Nacional de Epidemiología del Ministerio de Salud, Lourdes Moreno se mantiene en aislamiento tras practicarse una primera prueba para detectar",08-07-2020 12:55,https://www.bing.com/th?id=ON.C26AEE02EAE395F0389DF3BCF4986B81,Panamá,TVN
